"location","source","target","id","fuzzy","context","translator_comments","developer_comments"
"Scripts/Content/Story/Dialoge/DIA_DMT_1200_Dementor.d:56","Wir wussten, dass du kommen wirst!","Wir wussten, dass du kommen wirst!","","","DIA_BridgeDementor_19_00","",""
"Scripts/Content/Story/Dialoge/DIA_DMT_1200_Dementor.d:57","Mein Meister wird triumphieren und die Herrschaft der Welt an sich reißen.","Mein Meister wird triumphieren und die Herrschaft der Welt an sich reißen.","","","DIA_BridgeDementor_19_01","",""
"Scripts/Content/Story/Dialoge/DIA_DMT_1200_Dementor.d:58","Du törichter Narr, du hast nicht gewusst, mit wem du dich anlegst, und dafür werde ich dich hier und jetzt bestrafen!","Du törichter Narr, du hast nicht gewusst, mit wem du dich anlegst, und dafür werde ich dich hier und jetzt bestrafen!","","","DIA_BridgeDementor_19_02","",""
"Scripts/Content/Story/Dialoge/DIA_DMT_1299_OberDementor_DI.d:21","Du schleimiger Wurm wagst es also tatsächlich, bis vor die Tore des Meisters zu treten.","Du schleimiger Wurm wagst es also tatsächlich, bis vor die Tore des Meisters zu treten.","","","DIA_Schwarzmagier_HELLO_09_00","",""
"Scripts/Content/Story/Dialoge/DIA_DMT_1299_OberDementor_DI.d:22","Bist du hier der Drahtzieher?","Bist du hier der Drahtzieher?","","","DIA_Schwarzmagier_HELLO_15_01","",""
"Scripts/Content/Story/Dialoge/DIA_DMT_1299_OberDementor_DI.d:23","Ich bin der Wächter der Hallen von Irdorath. Die mächtigste Quelle Beliars Macht auf Erden. Durch meine Hände fließt die göttliche Kraft des Meisters.","Ich bin der Wächter der Hallen von Irdorath. Die mächtigste Quelle Beliars Macht auf Erden. Durch meine Hände fließt die göttliche Kraft des Meisters.","","","DIA_Schwarzmagier_HELLO_09_02","",""
"Scripts/Content/Story/Dialoge/DIA_DMT_1299_OberDementor_DI.d:24","Nur ein Wort von mir und du wirst auf ewig dem Wahnsinn verfallen.","Nur ein Wort von mir und du wirst auf ewig dem Wahnsinn verfallen.","","","DIA_Schwarzmagier_HELLO_09_03","",""
"Scripts/Content/Story/Dialoge/DIA_DMT_1299_OberDementor_DI.d:25","Verstehe. Noch so ein Unterhändler, den ich aus dem Weg räumen muss.","Verstehe. Noch so ein Unterhändler, den ich aus dem Weg räumen muss.","","","DIA_Schwarzmagier_HELLO_15_04","",""
"Scripts/Content/Story/Dialoge/DIA_DMT_1299_OberDementor_DI.d:31","Bring mich zu deinem Meister.","Bring mich zu deinem Meister.","","","DIA_Schwarzmagier_HELLO.DIA_Schwarzmagier_HELLO_meister","Info_AddChoice",""
"Scripts/Content/Story/Dialoge/DIA_DMT_1299_OberDementor_DI.d:32","Wieviel von eurer Sorte muß ich denn noch töten?","Wieviel von eurer Sorte muß ich denn noch töten?","","","DIA_Schwarzmagier_HELLO.DIA_Schwarzmagier_HELLO_dmt","Info_AddChoice",""
"Scripts/Content/Story/Dialoge/DIA_DMT_1299_OberDementor_DI.d:33","Was verbirgt sich dort hinter dem großen Tor?","Was verbirgt sich dort hinter dem großen Tor?","","","DIA_Schwarzmagier_HELLO.DIA_Schwarzmagier_HELLO_hinterTor","Info_AddChoice",""
"Scripts/Content/Story/Dialoge/DIA_DMT_1299_OberDementor_DI.d:34","Wer ist dein Meister?","Wer ist dein Meister?","","","DIA_Schwarzmagier_HELLO.DIA_Schwarzmagier_HELLO_wer","Info_AddChoice",""
"Scripts/Content/Story/Dialoge/DIA_DMT_1299_OberDementor_DI.d:38","Du warst einmal ein Anhänger des Schläfers.","Du warst einmal ein Anhänger des Schläfers.","","","DIA_Schwarzmagier_HELLO.DIA_Schwarzmagier_HELLO_schlaefer","Info_AddChoice",""
"Scripts/Content/Story/Dialoge/DIA_DMT_1299_OberDementor_DI.d:44","Wer ist dein Meister?","Wer ist dein Meister?","","","DIA_Schwarzmagier_HELLO_wer_15_00","",""
"Scripts/Content/Story/Dialoge/DIA_DMT_1299_OberDementor_DI.d:45","Er ist ein Wanderer zwischen den Welten. Seine göttliche Weisheit erleuchtet uns.","Er ist ein Wanderer zwischen den Welten. Seine göttliche Weisheit erleuchtet uns.","","","DIA_Schwarzmagier_HELLO_wer_09_01","",""
"Scripts/Content/Story/Dialoge/DIA_DMT_1299_OberDementor_DI.d:46","Er ist der Erwählte Beliars, das Reich von den elenden Innos-Anhängern zu befreien.","Er ist der Erwählte Beliars, das Reich von den elenden Innos-Anhängern zu befreien.","","","DIA_Schwarzmagier_HELLO_wer_09_02","",""
"Scripts/Content/Story/Dialoge/DIA_DMT_1299_OberDementor_DI.d:47","Er bringt allen den Tod, die an seiner Herrlichkeit zweifeln.","Er bringt allen den Tod, die an seiner Herrlichkeit zweifeln.","","","DIA_Schwarzmagier_HELLO_wer_09_03","",""
"Scripts/Content/Story/Dialoge/DIA_DMT_1299_OberDementor_DI.d:48","Kommt mir bekannt vor.","Kommt mir bekannt vor.","","","DIA_Schwarzmagier_HELLO_wer_15_04","",""
"Scripts/Content/Story/Dialoge/DIA_DMT_1299_OberDementor_DI.d:53","Was verbirgt sich dort hinter dem großen Tor?","Was verbirgt sich dort hinter dem großen Tor?","","","DIA_Schwarzmagier_HELLO_hinterTor_15_00","",""
"Scripts/Content/Story/Dialoge/DIA_DMT_1299_OberDementor_DI.d:54","(lacht) Die Gemächer meines Herren bleiben unerreichbar für dich. Ich werde dir keine Gelegenheit geben, das Tor zu öffnen.","(lacht) Die Gemächer meines Herren bleiben unerreichbar für dich. Ich werde dir keine Gelegenheit geben, das Tor zu öffnen.","","","DIA_Schwarzmagier_HELLO_hinterTor_09_01","",""
"Scripts/Content/Story/Dialoge/DIA_DMT_1299_OberDementor_DI.d:59","Du warst einmal ein Anhänger des Schläfers.","Du warst einmal ein Anhänger des Schläfers.","","","DIA_Schwarzmagier_HELLO_schlaefer_15_00","",""
"Scripts/Content/Story/Dialoge/DIA_DMT_1299_OberDementor_DI.d:60","Das ist graue Vergangenheit. Der Meister hat uns die Augen geöffnet. Jetzt wird uns niemand mehr aufhalten.","Das ist graue Vergangenheit. Der Meister hat uns die Augen geöffnet. Jetzt wird uns niemand mehr aufhalten.","","","DIA_Schwarzmagier_HELLO_schlaefer_09_01","",""
"Scripts/Content/Story/Dialoge/DIA_DMT_1299_OberDementor_DI.d:61","Der Meister hat uns den einzig gangbaren Weg gezeigt, mit euch Ungläubigen fertig zu werden.","Der Meister hat uns den einzig gangbaren Weg gezeigt, mit euch Ungläubigen fertig zu werden.","","","DIA_Schwarzmagier_HELLO_schlaefer_09_02","",""
"Scripts/Content/Story/Dialoge/DIA_DMT_1299_OberDementor_DI.d:69","Wie viel von eurer Sorte muss ich denn noch töten?","Wie viel von eurer Sorte muss ich denn noch töten?","","","DIA_Schwarzmagier_HELLO_dmt_15_00","",""
"Scripts/Content/Story/Dialoge/DIA_DMT_1299_OberDementor_DI.d:70","Der unsrigen sind viele. Du hast ja keine Ahnung, wie zahlreich wir schon auf diese Zeit der Befreiung warten.","Der unsrigen sind viele. Du hast ja keine Ahnung, wie zahlreich wir schon auf diese Zeit der Befreiung warten.","","","DIA_Schwarzmagier_HELLO_dmt_09_01","",""
"Scripts/Content/Story/Dialoge/DIA_DMT_1299_OberDementor_DI.d:71","Ein Strom von Klageschreien wird sich über das Land ergießen, wenn wir in die Welt hinausziehen.","Ein Strom von Klageschreien wird sich über das Land ergießen, wenn wir in die Welt hinausziehen.","","","DIA_Schwarzmagier_HELLO_dmt_09_02","",""
"Scripts/Content/Story/Dialoge/DIA_DMT_1299_OberDementor_DI.d:72","Um die Welt von den Barbaren, die sich selbst die Hüter des Feuers nennen, zu befreien. Unsere Zusammenkunft hier im Tempel wird nicht von großer Dauer sein.","Um die Welt von den Barbaren, die sich selbst die Hüter des Feuers nennen, zu befreien. Unsere Zusammenkunft hier im Tempel wird nicht von großer Dauer sein.","","","DIA_Schwarzmagier_HELLO_dmt_09_03","",""
"Scripts/Content/Story/Dialoge/DIA_DMT_1299_OberDementor_DI.d:73","Ja.","Ja.","","","DIA_Schwarzmagier_HELLO_dmt_15_04","",""
"Scripts/Content/Story/Dialoge/DIA_DMT_1299_OberDementor_DI.d:83","(bedrohlich) Schluss mit dem Gefasel! Ich werde dich vernichten.","(bedrohlich) Schluss mit dem Gefasel! Ich werde dich vernichten.","","","DIA_Schwarzmagier_HELLO_meister_09_00","",""
"Scripts/Content/Story/Dialoge/DIA_DMT_1299_OberDementor_DI.d:84","Dein Augenlicht wird schwinden und dein Geist wird in der Dunkelheit vergehen.","Dein Augenlicht wird schwinden und dein Geist wird in der Dunkelheit vergehen.","","","DIA_Schwarzmagier_HELLO_meister_09_01","",""
"Scripts/Content/Story/Dialoge/DIA_DMT_1299_OberDementor_DI.d:88","(zu sich) Ohne das Seelenruf-Amulett hätte ich jetzt ein ernstes Problem.","(zu sich) Ohne das Seelenruf-Amulett hätte ich jetzt ein ernstes Problem.","","","DIA_Schwarzmagier_HELLO_meister_15_02","",""
