"location","source","target","id","fuzzy","context","translator_comments","developer_comments"
"Scripts/Content/Story/Dialoge/DIA_PC_Mage_DI.d:33","Wie in alten Zeiten.","Como en los viejos tiempos.","","","DIA_Milten_DI_Hello.description","",""
"Scripts/Content/Story/Dialoge/DIA_PC_Mage_DI.d:46","Wie in alten Zeiten.","Como en los viejos tiempos.","","","DIA_Milten_DI_Hello_15_00","",""
"Scripts/Content/Story/Dialoge/DIA_PC_Mage_DI.d:47","Du sagst es. Ich bin ja mal gespannt, ob es diesmal klappt.","Tú lo has dicho. Tengo curiosidad por ver si esta vez lo logras.","","","DIA_Milten_DI_Hello_03_01","",""
"Scripts/Content/Story/Dialoge/DIA_PC_Mage_DI.d:48","Was?","¿Qué?","","","DIA_Milten_DI_Hello_15_02","",""
"Scripts/Content/Story/Dialoge/DIA_PC_Mage_DI.d:49","Dass du deinen Hintern retten kannst, bevor wieder die ganze Höhle über dich hereinbricht!","Salvar el pellejo antes de que se vuelva a armar la gorda a tu alrededor.","","","DIA_Milten_DI_Hello_03_03","",""
"Scripts/Content/Story/Dialoge/DIA_PC_Mage_DI.d:63","Hast du ein paar Tränke übrig?","¿Puedes darme alguna poción?","","","DIA_Milten_DI_TRADE.description","",""
"Scripts/Content/Story/Dialoge/DIA_PC_Mage_DI.d:77","Hast du ein paar Tränke übrig?","¿Puedes darme alguna poción?","","","DIA_Milten_DI_TRADE_15_00","",""
"Scripts/Content/Story/Dialoge/DIA_PC_Mage_DI.d:88","Solange der Vorrat reicht.","Sí, mientras me queden existencias.","","","DIA_Milten_DI_TRADE_03_01","",""
"Scripts/Content/Story/Dialoge/DIA_PC_Mage_DI.d:100","Welchen Rat kannst du mir geben?","¿Qué consejo puedes darme?","","","DIA_Milten_DI_Rat.description","",""
"Scripts/Content/Story/Dialoge/DIA_PC_Mage_DI.d:114","Welchen Rat kannst du mir geben?","¿Qué consejo puedes darme?","","","DIA_Milten_DI_Rat_15_00","",""
"Scripts/Content/Story/Dialoge/DIA_PC_Mage_DI.d:115","Mmh. Es ehrt mich sehr, dass du gerade mich um Rat fragst. Mich beschäftigt schon die ganze Zeit nur eine Sache.","Um. Es un gran honor que de entre todos me hayas elegido a mí para que te aconseje. Hay una sola cosa que no se me ha quitado de la cabeza en todo momento.","","","DIA_Milten_DI_Rat_03_01","",""
"Scripts/Content/Story/Dialoge/DIA_PC_Mage_DI.d:116","Hast du das Auge Innos' mitgebacht?","¿Has traído el Ojo de Innos?","","","DIA_Milten_DI_Rat_03_02","",""
"Scripts/Content/Story/Dialoge/DIA_PC_Mage_DI.d:122","Nein.","No.","","","DIA_Milten_DI_Rat.DIA_Milten_DI_Rat_nein","Info_AddChoice",""
"Scripts/Content/Story/Dialoge/DIA_PC_Mage_DI.d:126","Natürlich.","Naturalmente.","","","DIA_Milten_DI_Rat.DIA_Milten_DI_Rat_ja","Info_AddChoice",""
"Scripts/Content/Story/Dialoge/DIA_PC_Mage_DI.d:132","Nein.","No.","","","DIA_Milten_DI_Rat_nein_15_00","",""
"Scripts/Content/Story/Dialoge/DIA_PC_Mage_DI.d:133","(entrüstet) Du bist doch ... Was wirst du denn tun, wenn dir hier auf der Insel Drachen begegnen?","(Indignado) Eres un... ¿Qué vas a hacer si te topas con dragones aquí, en la isla?","","","DIA_Milten_DI_Rat_nein_03_01","",""
"Scripts/Content/Story/Dialoge/DIA_PC_Mage_DI.d:134","Hast du denn gar nichts dazu gelernt? Sogar einen Alchemietisch haben wir hier, um das dämliche Ding wieder aufladen zu können.","¿Todavía no te enteras? Hasta tenemos una mesa de trabajo de alquimista para recargar ese cacharro estúpido.","","","DIA_Milten_DI_Rat_nein_03_02","",""
"Scripts/Content/Story/Dialoge/DIA_PC_Mage_DI.d:135","Und was machst du? Ich kann nur hoffen, dass uns deine Schlamperei nicht den Kopf kostet.","¿Y qué haces? Espero que tu dejadez no nos cueste la cabeza.","","","DIA_Milten_DI_Rat_nein_03_03","",""
"Scripts/Content/Story/Dialoge/DIA_PC_Mage_DI.d:141","Natürlich.","Naturalmente.","","","DIA_Milten_DI_Rat_ja_15_00","",""
"Scripts/Content/Story/Dialoge/DIA_PC_Mage_DI.d:142","Tut mir leid, dass ich so dumme Fragen stelle. Bin ein bisschen nervös?","Lo siento. Estoy haciendo preguntas estúpidas. Estoy algo nervioso.","","","DIA_Milten_DI_Rat_ja_03_01","",""
"Scripts/Content/Story/Dialoge/DIA_PC_Mage_DI.d:156","Ich habe Pedro gefunden.","He encontrado a Pedro.","","","DIA_Milten_DI_PEDROTOT.description","",""
"Scripts/Content/Story/Dialoge/DIA_PC_Mage_DI.d:169","Ich habe Pedro gefunden.","He encontrado a Pedro.","","","DIA_Milten_DI_PEDROTOT_15_00","",""
"Scripts/Content/Story/Dialoge/DIA_PC_Mage_DI.d:170","(überrascht) Was? Wo? Hier auf der Insel? Verdammt, er ist aber auch wirklich unglaublich.","(Sorprendido) ¿Qué? ¿Dónde? ¿Aquí en la isla? Maldita sea, es absolutamente increíble.","","","DIA_Milten_DI_PEDROTOT_03_01","",""
"Scripts/Content/Story/Dialoge/DIA_PC_Mage_DI.d:171","Für so einen abgebrühten Mistkerl hätte ich ihn nun wirklich nicht gehalten.","No tenía ni idea de que fuera tan duro.","","","DIA_Milten_DI_PEDROTOT_03_02","",""
"Scripts/Content/Story/Dialoge/DIA_PC_Mage_DI.d:176","Er ist tot.","Está muerto.","","","DIA_Milten_DI_PEDROTOT_15_03","",""
"Scripts/Content/Story/Dialoge/DIA_PC_Mage_DI.d:177","So? Nun ja. Friede seiner Seele. Obwohl ich nicht sagen kann, dass es mir sonderlich Leid tut, hätte ich ihn trotzdem gerne noch mal zur Rede gestellt.","¿Ah, sí? De acuerdo. Descanse en paz. Aunque no puedo decir que lo sienta demasiado, me habría gustado charlar con él.","","","DIA_Milten_DI_PEDROTOT_03_04","",""
"Scripts/Content/Story/Dialoge/DIA_PC_Mage_DI.d:181","Ich werde mit ihm bei Zeiten noch ein Hühnchen rupfen.","Dentro de poco tendré que ajustar cuentas con él.","","","DIA_Milten_DI_PEDROTOT_03_05","",""
"Scripts/Content/Story/Dialoge/DIA_PC_Mage_DI.d:195","Ich will meine magischen Fähigkeiten verbessern.","Quiero mejorar mis habilidades mágicas.","","","DIA_Milten_DI_TeachMagic.description","",""
"Scripts/Content/Story/Dialoge/DIA_PC_Mage_DI.d:210","Ich will meine magischen Fähigkeiten verbessern.","Quiero mejorar mis habilidades mágicas.","","","DIA_Milten_DI_TeachMagic_15_00","",""
"Scripts/Content/Story/Dialoge/DIA_PC_Mage_DI.d:214","Ich werde mein Bestes geben.","Haré todo lo posible.","","","DIA_Milten_DI_TeachMagic_03_01","",""
"Scripts/Content/Story/Dialoge/DIA_PC_Mage_DI.d:220","Ich helfe dir. Aber nur unter der Bedingung, dass du dafür sorgst, dass die Orks bleiben, wo sie sind.","Te ayudaré, pero con la condición de que te asegures de que los orcos se quedan donde están.","","","DIA_Milten_DI_TeachMagic_03_02","",""
"Scripts/Content/Story/Dialoge/DIA_PC_Mage_DI.d:225","Ok. Was brauchst du?","De acuerdo. ¿Qué es lo que necesitas?","","","DIA_Milten_DI_TeachMagic_03_03","",""
"Scripts/Content/Story/Dialoge/DIA_PC_Mage_DI.d:236","Runen herstellen","Crear runas","","","DIA_Milten_DI_TeachMagic.DIA_Milten_DI_TeachMagic_RUNES","Info_AddChoice",""
"Scripts/Content/Story/Dialoge/DIA_PC_Mage_DI.d:245","Möge Innos' Hand dich leiten.","Que la mano de Innos te guíe.","","","DIA_Milten_DI_TeachMagic_MANA_1_03_00","",""
"Scripts/Content/Story/Dialoge/DIA_PC_Mage_DI.d:264","Möge Innos' Licht dich erleuchten.","Que la luz de Innos te ilumine.","","","DIA_Milten_DI_TeachMagic_MANA_5_03_00","",""
"Scripts/Content/Story/Dialoge/DIA_PC_Mage_DI.d:283","Oh je! Das ist nun wirklich nicht mein Spezialgebiet, aber wir kriegen das schon hin.","¡Oh, no! No es mi especialidad, pero nos las apañaremos.","","","DIA_Milten_DI_TeachMagic_RUNES_03_00","",""
"Scripts/Content/Story/Dialoge/DIA_PC_Mage_DI.d:287","Paladin-Runen","Runas de paladín","","","DIA_Milten_DI_TeachMagic.DIA_Milten_DI_TeachMagic_Runen_Paladin","Info_AddChoice",""
"Scripts/Content/Story/Dialoge/DIA_PC_Mage_DI.d:291"," Vierter Kreis","Cuarto círculo","","","DIA_Milten_DI_TeachMagic.DIA_Milten_DI_TeachMagic_Runen_Circle_4","Info_AddChoice",""
"Scripts/Content/Story/Dialoge/DIA_PC_Mage_DI.d:295"," Fünfter Kreis","Quinto círculo","","","DIA_Milten_DI_TeachMagic.DIA_Milten_DI_TeachMagic_Runen_Circle_5","Info_AddChoice",""
"Scripts/Content/Story/Dialoge/DIA_PC_Mage_DI.d:299"," Sechster Kreis","Sexto círculo","","","DIA_Milten_DI_TeachMagic.DIA_Milten_DI_TeachMagic_Runen_Circle_6","Info_AddChoice",""
"Scripts/Content/Story/Dialoge/DIA_PC_Mage_DI.d:303","Oh. Du bist ja noch gar nicht bereit. Lerne erst die höheren Kreise, dann kann ich dir helfen.","Oh. Todavía no estás preparado. Aprende antes los círculos superiores, y luego te ayudaré.","","","DIA_Milten_DI_TeachMagic_RUNES_03_01","",""
"Scripts/Content/Story/Dialoge/DIA_PC_Mage_DI.d:564","Sagt dir dieses Buch, Almanach der Besessenen, irgendetwas?","¿Te dice algo este libro, el Almanáque de los poseídos?","","","DIA_Milten_DI_DementorObsessionBook.description","",""
"Scripts/Content/Story/Dialoge/DIA_PC_Mage_DI.d:577","Sagt dir dieses Buch, Almanach der Besessenen, irgendetwas?","¿Te dice algo este libro, el Almanaque de los Poseídos?","","","DIA_Milten_DI_DementorObsessionBook_15_00","",""
"Scripts/Content/Story/Dialoge/DIA_PC_Mage_DI.d:578","Pyrokar ist der Experte für diese Art von Büchern.","Pyrokar es el experto en este tipo de libros.","","","DIA_Milten_DI_DementorObsessionBook_03_01","",""
"Scripts/Content/Story/Dialoge/DIA_PC_Mage_DI.d:579","Tut mir Leid. Ich weiß zu wenig, um etwas Intelligentes darüber sagen zu können.","Lo siento. No sé lo bastante como para decir nada inteligente al respecto.","","","DIA_Milten_DI_DementorObsessionBook_03_02","",""
"Scripts/Content/Story/Dialoge/DIA_PC_Mage_DI.d:592","Hast du Erfahrung mit Dracheneiern?","¿Tienes experiencia con huevos de dragón?","","","DIA_Milten_DI_DragonEgg.description","",""
"Scripts/Content/Story/Dialoge/DIA_PC_Mage_DI.d:605","Hast du Erfahrung mit Dracheneiern?","¿Tienes experiencia con huevos de dragón?","","","DIA_Milten_DI_DragonEgg_15_00","",""
"Scripts/Content/Story/Dialoge/DIA_PC_Mage_DI.d:606","Nein, nicht wirklich. Ich habe davon gehört, dass einst ein cleverer Alchemist daraus einen mächtigen Trank brauen konnte.","No, la verdad es que no. He oído que un alquimista inteligente consiguió en cierta ocasión elaborar una poción potente con ellos.","","","DIA_Milten_DI_DragonEgg_03_01","",""
"Scripts/Content/Story/Dialoge/DIA_PC_Mage_DI.d:607","Aber jetzt frag mich jetzt bitte nicht nach dem Rezept. Ich habe keine Ahnung.","No me pidas la fórmula. No tengo ni idea.","","","DIA_Milten_DI_DragonEgg_03_02","",""
"Scripts/Content/Story/Dialoge/DIA_PC_Mage_DI.d:621","So. Jetzt ist Schluss!","Muy bien. ¡Se acabó!","","","DIA_Milten_DI_UndeadDragonDead.description","",""
"Scripts/Content/Story/Dialoge/DIA_PC_Mage_DI.d:635","So. Jetzt ist Schluss! Der Tempel ist entmachtet.","De acuerdo. ¡Se acabó! El templo se ha quedado sin su poder.","","","DIA_Milten_DI_UndeadDragonDead_15_00","",""
"Scripts/Content/Story/Dialoge/DIA_PC_Mage_DI.d:639","Wie schaffst du das eigentlich immer, hm?","¿Cómo es que siempre lo consigues, eh?","","","DIA_Milten_DI_UndeadDragonDead_03_01","",""
"Scripts/Content/Story/Dialoge/DIA_PC_Mage_DI.d:640","Das weiß ich auch nicht.","Que me aspen si lo sé.","","","DIA_Milten_DI_UndeadDragonDead_15_02","",""
"Scripts/Content/Story/Dialoge/DIA_PC_Mage_DI.d:641","(lacht) Werden jemals zur Ruhe kommen? Verdient hätten wir es jedenfalls.","(Se ríe) ¿Vamos a estar tranquilos en algún momento? Desde luego, nos lo hemos merecido.","","","DIA_Milten_DI_UndeadDragonDead_03_03","",""
"Scripts/Content/Story/Dialoge/DIA_PC_Mage_DI.d:645","Was wirst du nun tun?","¿Ahora qué vas a hacer?","","","DIA_Milten_DI_UndeadDragonDead_15_04","",""
"Scripts/Content/Story/Dialoge/DIA_PC_Mage_DI.d:646","Ich denke darüber nach, eine eigene Akademie zu gründen und unseren Glauben weiter zu verkünden. Aber es kann auch anders kommen.","Me estoy pensando fundar una academia y predicar nuestra fe. Pero podría hacer alguna otra cosa.","","","DIA_Milten_DI_UndeadDragonDead_03_05","",""
"Scripts/Content/Story/Dialoge/DIA_PC_Mage_DI.d:647","Ich habe es nie bereut, ein Magier des Feuers geworden zu sein. Wie siehst du das?","Nunca me he arrepentido de convertirme en mago de fuego. ¿Cómo te sientes?","","","DIA_Milten_DI_UndeadDragonDead_03_06","",""
"Scripts/Content/Story/Dialoge/DIA_PC_Mage_DI.d:648","Bin mir nicht sicher.","No estoy seguro.","","","DIA_Milten_DI_UndeadDragonDead_15_07","",""
"Scripts/Content/Story/Dialoge/DIA_PC_Mage_DI.d:649","(lacht) Trocken, wie immer. Hey, Mann. Du hast gerade die Welt gerettet. Ist das kein Grund, sich zu freuen?","(Se ríe) Seco, como siempre. Eh, tío. Acabas de salvar el mundo. ¿No es motivo para alegrarse?","","","DIA_Milten_DI_UndeadDragonDead_03_08","",""
"Scripts/Content/Story/Dialoge/DIA_PC_Mage_DI.d:650","Mmh.","Um. Tal vez.","","","DIA_Milten_DI_UndeadDragonDead_15_09","",""
"Scripts/Content/Story/Dialoge/DIA_PC_Mage_DI.d:653","Na komm, mein Freund, ich glaube, du brauchst jetzt erst einmal 'ne Mütze Schlaf.","Vamos, amigo mío, creo que necesitas echar una cabezadita.","","","DIA_Milten_DI_UndeadDragonDead_03_10","",""
"Scripts/Content/Story/Dialoge/DIA_PC_Mage_DI.d:657","Geh am besten gleich zum Kapitän und lass uns ablegen.","Deberías ir a ver al capitán y decirle que leve anclas.","","","DIA_Milten_DI_UndeadDragonDead_03_11","",""
"Scripts/Content/Story/Dialoge/DIA_PC_Mage_NW.d:86","(ungläubig) Ich kann das kaum glauben. Bist du jetzt wirklich ein Paladin?","(Incrédulo) No me lo puedo creer. ¿Ahora eres paladín?","","","DIA_MiltenNW_KAP3_Hello_03_00","",""
"Scripts/Content/Story/Dialoge/DIA_PC_Mage_NW.d:87","Offensichtlich.","Resulta evidente.","","","DIA_MiltenNW_KAP3_Hello_15_01","",""
"Scripts/Content/Story/Dialoge/DIA_PC_Mage_NW.d:88","(euphorisch) Wenn jemand wie du bei den Paladinen mitmacht, dann können sich die Schergen Beliars warm anziehen.","(Eufórico) Si alguien como tú está con los paladines, será mejor que los matones de Beliar se anden con ojo.","","","DIA_MiltenNW_KAP3_Hello_03_02","",""
"Scripts/Content/Story/Dialoge/DIA_PC_Mage_NW.d:89","Wenn du mit dem Schläfer fertig geworden bist, sind die paar Orks ja wohl kein Problem.","Si te cargaste al Durmiente, ese puñado de orcos no deberían suponer ningún problema.","","","DIA_MiltenNW_KAP3_Hello_03_03","",""
"Scripts/Content/Story/Dialoge/DIA_PC_Mage_NW.d:90","Es geht nicht nur um die Orks.","Esto no tiene que ver únicamente con los orcos.","","","DIA_MiltenNW_KAP3_Hello_15_04","",""
"Scripts/Content/Story/Dialoge/DIA_PC_Mage_NW.d:91","Ich weiß, aber es ist trotzdem gut, dass du auf unserer Seite stehst.","Ya lo sé, pero está muy bien tenerte en nuestro bando.","","","DIA_MiltenNW_KAP3_Hello_03_05","",""
"Scripts/Content/Story/Dialoge/DIA_PC_Mage_NW.d:92","Schon gut.","Bueno.","","","DIA_MiltenNW_KAP3_Hello_15_06","",""
"Scripts/Content/Story/Dialoge/DIA_PC_Mage_NW.d:93","Was machst du hier im Kloster? Lass mich raten. Du willst dich in der Kunst der Magie unterweisen lassen.","¿Qué haces en el monasterio? A ver si lo adivino. Quieres que te instruyan en las artes mágicas.","","","DIA_MiltenNW_KAP3_Hello_03_07","",""
"Scripts/Content/Story/Dialoge/DIA_PC_Mage_NW.d:94","Mal sehen.","Quizá.","","","DIA_MiltenNW_KAP3_Hello_15_08","",""
"Scripts/Content/Story/Dialoge/DIA_PC_Mage_NW.d:95","Wusste ich's doch, sprich am besten mit Marduk, er ist für euch Paladine zuständig. Du findest ihn vor der Kapelle.","Lo sabía. Será mejor que hables con Marduk, el que está al cargo de vosotros, los paladines. Lo encontrarás delante de la capilla.","","","DIA_MiltenNW_KAP3_Hello_03_09","",""
"Scripts/Content/Story/Dialoge/DIA_PC_Mage_NW.d:100","Wie ich sehe, sind die Gerüchte wahr.","Veo que los rumores son ciertos.","","","DIA_MiltenNW_KAP3_Hello_03_10","",""
"Scripts/Content/Story/Dialoge/DIA_PC_Mage_NW.d:101","Welche Gerüchte?","¿Qué rumores?","","","DIA_MiltenNW_KAP3_Hello_15_11","",""
"Scripts/Content/Story/Dialoge/DIA_PC_Mage_NW.d:102","Dass du bei diesen Drachenjägern mitmachst.","Que te has enrolado en los cazadores de dragones.","","","DIA_MiltenNW_KAP3_Hello_03_12","",""
"Scripts/Content/Story/Dialoge/DIA_PC_Mage_NW.d:103","Na ja, du warst ja noch nie ein Mann der Kirche. Dennoch kämpfst du für unsere Sache und das ist alles, was zählt.","Bueno, nunca fuiste un hombre de la iglesia. No obstante, defiendes nuestra causa y eso es lo que cuenta.","","","DIA_MiltenNW_KAP3_Hello_03_13","",""
"Scripts/Content/Story/Dialoge/DIA_PC_Mage_NW.d:104","Ist das alles?","¿Eso es todo?","","","DIA_MiltenNW_KAP3_Hello_15_14","",""
"Scripts/Content/Story/Dialoge/DIA_PC_Mage_NW.d:105","Ich freu mich natürlich, und so wie du rumläufst, hat bestimmt jeder Ork Angst vor dir.","Me alegro, por supuesto, y deduzco de tu aspecto que todos los orcos te van a tener miedo.","","","DIA_MiltenNW_KAP3_Hello_03_15","",""
"Scripts/Content/Story/Dialoge/DIA_PC_Mage_NW.d:106","Es geht nicht nur um die Orks.","Esto no tiene que ver únicamente con los orcos.","","","DIA_MiltenNW_KAP3_Hello_15_16","",""
"Scripts/Content/Story/Dialoge/DIA_PC_Mage_NW.d:107","Ich weiß, aber nichtsdestotrotz sind sie ein großes Problem. Du bist wichtig.","Ya, pero no dejan de ser un problema. Eres importante.","","","DIA_MiltenNW_KAP3_Hello_03_17","",""
"Scripts/Content/Story/Dialoge/DIA_PC_Mage_NW.d:108","Du hast den Schläfer besiegt. Wir alle werden deine Hilfe vielleicht noch einmal brauchen.","Derrotaste al Durmiente. Es posible que algún día necesitemos tu ayuda.","","","DIA_MiltenNW_KAP3_Hello_03_18","",""
"Scripts/Content/Story/Dialoge/DIA_PC_Mage_NW.d:109","Schon gut.","Bueno.","","","DIA_MiltenNW_KAP3_Hello_15_19","",""
"Scripts/Content/Story/Dialoge/DIA_PC_Mage_NW.d:122","Wie bist du so schnell zum Kloster gekommen?","¿Cómo llegaste tan rápido hasta el monasterio?","","","DIA_MiltenNW_Monastery.description","",""
"Scripts/Content/Story/Dialoge/DIA_PC_Mage_NW.d:135","Wie bist du so schnell zum Kloster gekommen?","¿Cómo llegaste tan rápido hasta el monasterio?","","","DIA_MiltenNW_Monastery_15_00","",""
"Scripts/Content/Story/Dialoge/DIA_PC_Mage_NW.d:136","Was soll die Frage? Ich habe mich durch den Pass geschlichen und dann auf direktem Wege zum Kloster begeben.","¿Qué clase de pregunta es ésa? Me escabullí a través del paso y fui directamente al monasterio.","","","DIA_MiltenNW_Monastery_03_01","",""
"Scripts/Content/Story/Dialoge/DIA_PC_Mage_NW.d:137","Zugegeben, es war nicht immer leicht, den ganzen Monstern auszuweichen, die sich diesseits des Tales breit gemacht haben, aber letztlich hatte ich weniger Probleme als erwartet.","Hay que reconocer que no me resultó fácil eludir a todos los monstruos que se han instalado en este lado del valle, pero al final me encontré con menos problemas de lo que me esperaba.","","","DIA_MiltenNW_Monastery_03_02","",""
"Scripts/Content/Story/Dialoge/DIA_PC_Mage_NW.d:149","Weißt du, wo die anderen sind?","¿No sabes dónde están los demás?","","","DIA_MiltenNW_FourFriends.description","",""
"Scripts/Content/Story/Dialoge/DIA_PC_Mage_NW.d:162","Weißt du, wo die anderen sind?","¿No sabes dónde están los demás?","","","DIA_MiltenNW_FourFriends_15_00","",""
"Scripts/Content/Story/Dialoge/DIA_PC_Mage_NW.d:165","Gorn hat seinen Kerkeraufenthalt bei Garond ganz gut verkraftet.","Parece que Gorn se ha tomado muy bien su estancia en la mazmorra de Garond.","","","DIA_MiltenNW_FourFriends_03_01","",""
"Scripts/Content/Story/Dialoge/DIA_PC_Mage_NW.d:169","Wie ist er rausgekommen?","¿Cómo salió?","","","DIA_MiltenNW_FourFriends_15_02","",""
"Scripts/Content/Story/Dialoge/DIA_PC_Mage_NW.d:170","Ich musste Garond anlügen, damit er alle Anklagen fallen lässt.","Tuve que mentirle a Garond para que retirara los cargos.","","","DIA_MiltenNW_FourFriends_03_03","",""
"Scripts/Content/Story/Dialoge/DIA_PC_Mage_NW.d:171","Aber das bleibt unter uns, verstanden?","Pero que se quede entre nosotros, ¿vale?","","","DIA_MiltenNW_FourFriends_03_04","",""
"Scripts/Content/Story/Dialoge/DIA_PC_Mage_NW.d:174","Jedenfalls wollte er zu Lee und gucken, was auf dem Hof so passiert.","En cualquier caso, quería ir a ver a Lee y comprobar lo que pasaba en la granja.","","","DIA_MiltenNW_FourFriends_03_05","",""
"Scripts/Content/Story/Dialoge/DIA_PC_Mage_NW.d:175","Nach dem Kerkeressen wird er sich wohl gerade den Wanst voll schlagen und die Vorräte der Söldner vor eine echte Bewährungsprobe stellen.","Con la bazofia que sirven en el calabozo, seguro que se está dando un atracón y poniendo a prueba las provisiones de los mercenarios.","","","DIA_MiltenNW_FourFriends_03_06","",""
"Scripts/Content/Story/Dialoge/DIA_PC_Mage_NW.d:179","Gorn hat's nicht geschafft.","Gorn no lo logró.","","","DIA_MiltenNW_FourFriends_03_07","",""
"Scripts/Content/Story/Dialoge/DIA_PC_Mage_NW.d:184","Diego hat was von einer Abrechnung gemurmelt. Keine Ahnung, was er damit meinte.","Diego murmuró no se qué de un ajuste de cuentas. No sé a qué se refería.","","","DIA_MiltenNW_FourFriends_03_08","",""
"Scripts/Content/Story/Dialoge/DIA_PC_Mage_NW.d:185","Ich vermute aber, dass er in der Stadt ist, du kennst ihn ja, immer da, wo was zu holen ist.","No obstante, sospecho que está en la ciudad. Ya lo conoces. Siempre anda por donde pueda haber algún botín.","","","DIA_MiltenNW_FourFriends_03_09","",""
"Scripts/Content/Story/Dialoge/DIA_PC_Mage_NW.d:189","Diego hat's erwischt, nun ist er doch noch in der Barriere geblieben.","Diego ha muerto. Parece que la barrera finalmente acabó con él.","","","DIA_MiltenNW_FourFriends_03_10","",""
"Scripts/Content/Story/Dialoge/DIA_PC_Mage_NW.d:203","Ich muss dringend ins Kloster!","Tengo que entrar en el monasterio, ¡es urgente!","","","DIA_MiltenNW_KAP3_Entry.description","",""
"Scripts/Content/Story/Dialoge/DIA_PC_Mage_NW.d:218","Ich muss dringend ins Kloster!","Tengo que entrar al monasterio. ¡Es urgente!","","","DIA_MiltenNW_KAP3_Entry_15_00","",""
"Scripts/Content/Story/Dialoge/DIA_PC_Mage_NW.d:221","Ja, klar. Hier ist der Schlüssel.","Sí, claro. Aquí tienes la llave.","","","DIA_MiltenNW_KAP3_Entry_03_01","",""
"Scripts/Content/Story/Dialoge/DIA_PC_Mage_NW.d:230","Ich kann dich nicht ins Kloster lassen. Ich bekomme Ärger mit dem hohen Rat.","No puedo dejar que entres al monasterio. Te meterás en un lío con el Concilio Supremo.","","","DIA_MiltenNW_KAP3_Entry_03_02","",""
"Scripts/Content/Story/Dialoge/DIA_PC_Mage_NW.d:231","Ohne Erlaubnis meiner Vorgesetzten darf ich niemanden ins Kloster lassen.","Sin permiso de mis superiores, no puedo dejar pasar a nadie al monasterio.","","","DIA_MiltenNW_KAP3_Entry_03_03","",""
"Scripts/Content/Story/Dialoge/DIA_PC_Mage_NW.d:235","Es ist wichtig!","Es importante.","","","DIA_MiltenNW_KAP3_Entry.DIA_MiltenNW_KAP3_Entry_Important","Info_AddChoice",""
"Scripts/Content/Story/Dialoge/DIA_PC_Mage_NW.d:239","Ich habe einen Brief von Lord Hagen.","Tengo una carta de lord Hagen.","","","DIA_MiltenNW_KAP3_Entry.DIA_MiltenNW_KAP3_Entry_Permit","Info_AddChoice",""
"Scripts/Content/Story/Dialoge/DIA_PC_Mage_NW.d:251","Es ist wichtig!","¡Es importante!","","","DIA_MiltenNW_KAP3_Entry_Important_15_00","",""
"Scripts/Content/Story/Dialoge/DIA_PC_Mage_NW.d:252","Es geht nicht. Pyrokar reißt mir den Kopf ab.","No es posible. Pyrokar me cortaría la cabeza.","","","DIA_MiltenNW_KAP3_Entry_Important_03_01","",""
"Scripts/Content/Story/Dialoge/DIA_PC_Mage_NW.d:259","Ich habe einen Brief von Lord Hagen.","Tengo una carta de lord Hagen.","","","DIA_MiltenNW_KAP3_Entry_Permit_15_00","",""
"Scripts/Content/Story/Dialoge/DIA_PC_Mage_NW.d:260","Zeig mal her.","Enséñamela.","","","DIA_MiltenNW_KAP3_Entry_Permit_03_01","",""
"Scripts/Content/Story/Dialoge/DIA_PC_Mage_NW.d:265","(zögerlich) In Ordnung. Hier hast du den Schlüssel vom Kloster. Pyrokar ist in der Kirche.","(Dubitativo) De acuerdo. Aquí tienes la llave del monasterio. Pyrokar está en la iglesia.","","","DIA_MiltenNW_KAP3_Entry_Permit_03_02","",""
"Scripts/Content/Story/Dialoge/DIA_PC_Mage_NW.d:285","Weißt du, wo Pedro ist?","¿Sabes dónde está Pedro?","","","DIA_MiltenNW_KAP3_NovizenChase.description","",""
"Scripts/Content/Story/Dialoge/DIA_PC_Mage_NW.d:300","Weißt du, wo Pedro ist?","¿Sabes dónde está Pedro?","","","DIA_MiltenNW_KAP3_NovizenChase_15_00","",""
"Scripts/Content/Story/Dialoge/DIA_PC_Mage_NW.d:301","Glaubst du, ich würde hier rumstehen, wenn ich wüsste, wo der Abtrünnige sich aufhält.","¿Crees que estaría aquí cruzado de brazos si supiera dónde se esconde el renegado?","","","DIA_MiltenNW_KAP3_NovizenChase_03_01","",""
"Scripts/Content/Story/Dialoge/DIA_PC_Mage_NW.d:302","Er muss für seine Taten bezahlen. Ich hoffe, es gelingt uns, das Auge zurück zu holen.","Tiene que pagar sus fechorías. Espero que consigamos recuperar el Ojo.","","","DIA_MiltenNW_KAP3_NovizenChase_03_02","",""
"Scripts/Content/Story/Dialoge/DIA_PC_Mage_NW.d:303","Du musst uns helfen. Finde ihn und bring uns das Auge Innos' zurück.","Tienes que ayudarnos. Encuéntralo y recupera el Ojo de Innos.","","","DIA_MiltenNW_KAP3_NovizenChase_03_03","",""
"Scripts/Content/Story/Dialoge/DIA_PC_Mage_NW.d:316","Weißt du etwas über die vermummten Gestalten?","¿Sabes algo de las figuras encapuchadas?","","","DIA_MiltenNW_KAP3_Perm.description","",""
"Scripts/Content/Story/Dialoge/DIA_PC_Mage_NW.d:329","Weißt du etwas über die vermummten Gestalten?","¿Sabes algo de las figuras encapuchadas?","","","DIA_MiltenNW_KAP3_Perm_15_00","",""
"Scripts/Content/Story/Dialoge/DIA_PC_Mage_NW.d:330","Nein, aber ich habe ein ungutes Gefühl bei diesen Typen.","No, pero esos tipos me dan mala espina.","","","DIA_MiltenNW_KAP3_Perm_03_01","",""
"Scripts/Content/Story/Dialoge/DIA_PC_Mage_NW.d:331","Sieh dich vor, wenn du ihnen begegnest.","Si te topas con ellos, ten cuidado.","","","DIA_MiltenNW_KAP3_Perm_03_02","",""
"Scripts/Content/Story/Dialoge/DIA_PC_Mage_NW.d:376","Gibt es Neuigkeiten?","¿Alguna novedad?","","","DIA_MiltenNW_KAP4_PERM.description","",""
"Scripts/Content/Story/Dialoge/DIA_PC_Mage_NW.d:389","Gibt es Neuigkeiten?","¿Alguna novedad?","","","DIA_MiltenNW_KAP4_PERM_15_00","",""
