"location","source","target","id","fuzzy","context","translator_comments","developer_comments"
"Scripts/Content/Story/B_AssignAmbientInfos/B_AssignAmbientInfos_VLK_16.d:46","Ich will Bürger dieser Stadt werden!","ˇQuiero convertirme en ciudadano!","","","DIA_VLK_16_JOIN_15_00","",""
"Scripts/Content/Story/B_AssignAmbientInfos/B_AssignAmbientInfos_VLK_16.d:47","Willst du uns helfen, die Stadt gegen die Orks zu verteidigen?","żNos vas a ayudar a defender la ciudad de los orcos?","","","DIA_VLK_16_JOIN_16_01","",""
"Scripts/Content/Story/B_AssignAmbientInfos/B_AssignAmbientInfos_VLK_16.d:48","Wenn du Bürger von Khorinis bist, kannst du der Miliz beitreten - du solltest mit einer der Stadtwachen reden.","Si eres ciudadano de Khorinis, puedes enrolarte en la milicia. Habla con uno de los guardias de la ciudad.","","","DIA_VLK_16_JOIN_16_02","",""
"Scripts/Content/Story/B_AssignAmbientInfos/B_AssignAmbientInfos_VLK_16.d:60","Wer sind die wichtigen Persönlichkeiten dieser Stadt?","żQuiénes son las personalidades de la ciudad?","","","DIA_VLK_16_PEOPLE.description","",""
"Scripts/Content/Story/B_AssignAmbientInfos/B_AssignAmbientInfos_VLK_16.d:70","Wer sind die wichtigen Persönlichkeiten dieser Stadt?","żQuiénes son las personalidades de la ciudad?","","","DIA_VLK_16_PEOPLE_15_00","",""
"Scripts/Content/Story/B_AssignAmbientInfos/B_AssignAmbientInfos_VLK_16.d:71","Die Paladine haben das obere Viertel besetzt.","Los paladines controlan el barrio alto.","","","DIA_VLK_16_PEOPLE_16_01","",""
"Scripts/Content/Story/B_AssignAmbientInfos/B_AssignAmbientInfos_VLK_16.d:83","Was gibt hier Interessantes zu sehen?","żQué cosas interesantes hay aquí para ver?","","","DIA_VLK_16_LOCATION.description","",""
"Scripts/Content/Story/B_AssignAmbientInfos/B_AssignAmbientInfos_VLK_16.d:93","Was gibt es hier Interessantes zu sehen?","żQué cosas interesantes hay aquí para ver?","","","DIA_VLK_16_LOCATION_15_00","",""
"Scripts/Content/Story/B_AssignAmbientInfos/B_AssignAmbientInfos_VLK_16.d:94","Auf dem Marktplatz kannst du alle möglichen Waren ansehen.","En el mercado hay todo tipo de mercancías.","","","DIA_VLK_16_LOCATION_16_01","",""
"Scripts/Content/Story/B_AssignAmbientInfos/B_AssignAmbientInfos_VLK_16.d:106","Was gibt's Neues?","żQué hay de nuevo?","","","DIA_VLK_16_STANDARD.description","",""
"Scripts/Content/Story/B_AssignAmbientInfos/B_AssignAmbientInfos_VLK_16.d:116","Was gibt's Neues?","żQué hay de nuevo?","","","DIA_VLK_16_STANDARD_15_00","",""
"Scripts/Content/Story/B_AssignAmbientInfos/B_AssignAmbientInfos_VLK_16.d:120","Ich hoffe, dass die Miliz endlich herausfindet, warum die Bevölkerung von Khorinis immer kleiner wird.","Espero que la milicia acabe averiguando por qué la población de Khorinis no hace más que descender.","","","DIA_Addon_VLK_16_STANDARD_16_00","",""
"Scripts/Content/Story/B_AssignAmbientInfos/B_AssignAmbientInfos_VLK_16.d:121","Man muss ja Angst um sein Leben haben, wenn man so hört, dass schon so viele vermisst werden.","Es normal temer por tu vida cuando desaparece tanta gente.","","","DIA_Addon_VLK_16_STANDARD_16_01","",""
"Scripts/Content/Story/B_AssignAmbientInfos/B_AssignAmbientInfos_VLK_16.d:134","Hast du es schon gehört? Die Orks sind vor der Stadt gesehen worden. Hoffentlich haben die Paladine genügend Leute.","żNo lo sabes? Se han visto orcos en las afueras de la ciudad. Esperemos que los paladines cuenten con suficientes efectivos.","","","DIA_VLK_16_STANDARD_16_01","",""
"Scripts/Content/Story/B_AssignAmbientInfos/B_AssignAmbientInfos_VLK_16.d:135","Ich frage mich, ob das der Grund ist, dass keine Bauern mehr zum Markt kommen.","Me pregunto a qué se debe que los granjeros ya no vengan al mercado.","","","DIA_VLK_16_STANDARD_16_02","",""
"Scripts/Content/Story/B_AssignAmbientInfos/B_AssignAmbientInfos_VLK_16.d:142","Der Söldner, der Lothar ermordet haben soll, ist unschuldig. Man hat Beweise gefunden, dass man ihm den Mord nur anhängen wollte. Ich hab's auf dem Markt gehört.","El mercenario acusado del asesinato de Lothar es inocente. Encontraron pruebas de que le tendieron una trampa. Me he enterado en el mercado.","","","DIA_VLK_16_STANDARD_16_03","",""
"Scripts/Content/Story/B_AssignAmbientInfos/B_AssignAmbientInfos_VLK_16.d:146","Es ist ungeheuerlich. Die Söldner des Großbauern haben den ehrenwerten Lothar auf offener Straße ermordet.","Es un escándalo. Los mercenarios del terrateniente han asesinado al honorable Lothar en plena calle.","","","DIA_VLK_16_STANDARD_16_04","",""
"Scripts/Content/Story/B_AssignAmbientInfos/B_AssignAmbientInfos_VLK_16.d:147","Aber Innos selbst wird sie für ihre Sünden bestrafen. Niemand darf Hand an einen Streiter unseres Herrn legen.","Pero Innos les castigará personalmente por sus pecados. Nadie puede alzar una mano contra un guerrero de nuestro Seńor.","","","DIA_VLK_16_STANDARD_16_05","",""
"Scripts/Content/Story/B_AssignAmbientInfos/B_AssignAmbientInfos_VLK_16.d:153","Ich habe gehört, die Verbrecher flüchten von Onars Hof. Aus Angst vor Lord Hagens Männern sollen sie wieder zurück ins Minental gegangen sein.","He oído que los criminales se han marchado de la granja de Onar. Dicen que han vuelto al Valle de las Minas por miedo a los hombres de lord Hagen.","","","DIA_VLK_16_STANDARD_16_06","",""
"Scripts/Content/Story/B_AssignAmbientInfos/B_AssignAmbientInfos_VLK_16.d:158","Ich habe gehört, einem Trupp der Paladine ist es gelungen, die fürchterlichen Drachen im Minental zu besiegen.","Me he enterado de que un pelotón de paladines ha conseguido derrotar a los monstruosos dragones en el Valle de las Minas.","","","DIA_VLK_16_STANDARD_16_07","",""
"Scripts/Content/Story/B_AssignAmbientInfos/B_AssignAmbientInfos_VLK_17.d:32","Was muss ich tun, um Bürger dieser Stadt zu werden?","żQué tengo que hacer para convertirme en ciudadano?","","","DIA_VLK_17_JOIN.description","",""
"Scripts/Content/Story/B_AssignAmbientInfos/B_AssignAmbientInfos_VLK_17.d:46","Was muss ich tun, um Bürger dieser Stadt zu werden?","żQué tengo que hacer para convertirme en ciudadano?","","","DIA_VLK_17_JOIN_15_00","",""
"Scripts/Content/Story/B_AssignAmbientInfos/B_AssignAmbientInfos_VLK_17.d:47","Die Handwerksmeister in der Unterstadt haben großen Einfluss hier in Khorinis. Du solltest mit einem von ihnen reden.","Los artesanos de la parte baja de la ciudad tienen mucha influencia en Khorinis. Habla con uno de ellos.","","","DIA_VLK_17_JOIN_17_01","",""
"Scripts/Content/Story/B_AssignAmbientInfos/B_AssignAmbientInfos_VLK_17.d:59","Wer sind die wichtigsten Persönlichkeiten dieser Stadt?","żQuiénes son las personalidades de la ciudad?","","","DIA_VLK_17_PEOPLE.description","",""
"Scripts/Content/Story/B_AssignAmbientInfos/B_AssignAmbientInfos_VLK_17.d:69","Wer sind die wichtigsten Persönlichkeiten dieser Stadt?","żQuiénes son las personalidades de la ciudad?","","","DIA_VLK_17_PEOPLE_15_00","",""
"Scripts/Content/Story/B_AssignAmbientInfos/B_AssignAmbientInfos_VLK_17.d:70","Seit die Paladine hier sind, haben sie die Kontrolle über die ganze Stadt übernommen.","Los paladines tomaron el control de toda la ciudad en cuanto llegaron.","","","DIA_VLK_17_PEOPLE_17_01","",""
"Scripts/Content/Story/B_AssignAmbientInfos/B_AssignAmbientInfos_VLK_17.d:71","Lord Andre vertritt das Gesetz. Du findest ihn in der Kaserne.","Lord Andre representa la ley. Lo encontrarás en el cuartel.","","","DIA_VLK_17_PEOPLE_17_02","",""
"Scripts/Content/Story/B_AssignAmbientInfos/B_AssignAmbientInfos_VLK_17.d:72","Aber solange du nicht gegen das Gesetz verstoßen hast, oder dich der Miliz anschließen willst, brauchst du nicht zu ihm zu gehen.","Pero solo tienes que presentarte ante él si has infringido la ley o si quieres enrolarte en la milicia.","","","DIA_VLK_17_PEOPLE_17_03","",""
"Scripts/Content/Story/B_AssignAmbientInfos/B_AssignAmbientInfos_VLK_17.d:84","Was sind die interessantesten Orte hier in Khorinis?","żQué lugares son los más interesantes en Khorinis?","","","DIA_VLK_17_LOCATION.description","",""
"Scripts/Content/Story/B_AssignAmbientInfos/B_AssignAmbientInfos_VLK_17.d:94","Was sind die interessantesten Orte hier in Khorinis?","żQué lugares son los más interesantes en Khorinis?","","","DIA_VLK_17_LOCATION_15_00","",""
"Scripts/Content/Story/B_AssignAmbientInfos/B_AssignAmbientInfos_VLK_17.d:95","(lacht) Vielleicht solltest du das besser einen Mann fragen. Wenn dir nach Unterhaltung ist, solltest du dich am Hafen umsehen.","(Se ríe) Sería mejor que se lo preguntases a un hombre. Si quieres diversión, prueba en el puerto.","","","DIA_VLK_17_LOCATION_17_01","",""
"Scripts/Content/Story/B_AssignAmbientInfos/B_AssignAmbientInfos_VLK_17.d:96","Aber wenn es dir darum geht, etwas zu kaufen, geh zum Marktplatz am Osttor oder in die Unterstadt.","Pero si quieres comprar algo, ve al mercado de la puerta este o a la parte baja de la ciudad.","","","DIA_VLK_17_LOCATION_17_02","",""
"Scripts/Content/Story/B_AssignAmbientInfos/B_AssignAmbientInfos_VLK_17.d:108","Was gibt's Neues?","żQué hay de nuevo?","","","DIA_VLK_17_STANDARD.description","",""
"Scripts/Content/Story/B_AssignAmbientInfos/B_AssignAmbientInfos_VLK_17.d:118","Was gibt's Neues?","żQué hay de nuevo?","","","DIA_VLK_17_STANDARD_15_00","",""
"Scripts/Content/Story/B_AssignAmbientInfos/B_AssignAmbientInfos_VLK_17.d:123","Ich frage mich, was die Paladine eigentlich hier wollen. Sie haben das Rathaus, die Kaserne und den Hafen besetzt, aber bis jetzt noch nichts unternommen.","Me pregunto qué hacen aquí los paladines. Controlan el ayuntamiento, el cuartel y el puerto, pero hasta el momento no han hecho nada.","","","DIA_VLK_17_STANDARD_17_01","",""
"Scripts/Content/Story/B_AssignAmbientInfos/B_AssignAmbientInfos_VLK_17.d:124","Wenn sie wegen der Orks oder der Banditen hier wären, hätten sie schon längst was unternommen. Es muss einen anderen Grund geben ...","Si hubieran venido por los orcos y los bandidos, habrían hecho algo hace siglos. Debe de haber otro motivo...","","","DIA_VLK_17_STANDARD_17_02","",""
"Scripts/Content/Story/B_AssignAmbientInfos/B_AssignAmbientInfos_VLK_17.d:129","Gerade ist mir klar geworden, warum die Paladine hier sind. Es geht ihnen nur ums Erz. Die Kerle sollten lieber unsere Stadt verteidigen.","Ya sé a qué han venido los paladines. Todo tiene que ver con el mineral. Sería mejor que se dedicaran a defender la ciudad.","","","DIA_VLK_17_STANDARD_17_03","",""
"Scripts/Content/Story/B_AssignAmbientInfos/B_AssignAmbientInfos_VLK_17.d:134","Ich hoffe, dass an den Geschichten über die Drachen etwas dran ist. Dann wird Lord Hagen gezwungen sein, etwas zu unternehmen. Er kann uns hier nicht einfach den Drachen ausliefern.","Espero que haya algo de cierto en esas historias de dragones. Lord Hagen se vería obligado a hacer algo. No nos puede entregar a los dragones.","","","DIA_VLK_17_STANDARD_17_04","",""
"Scripts/Content/Story/B_AssignAmbientInfos/B_AssignAmbientInfos_VLK_17.d:139","Jetzt, wo die Drachen tot sind, werden die Paladine mit dem restlichen Gesindel kurzen Prozess machen.","Ahora que los dragones han muerto, los paladines no tardarán en despachar al resto de la gentuza.","","","DIA_VLK_17_STANDARD_17_05","",""
"Scripts/Content/Story/B_AssignAmbientInfos/B_AssignAmbientInfos_VLK_6.d:32","Wie werde ich Bürger dieser Stadt?","żCómo me convierto en ciudadano?","","","DIA_VLK_6_JOIN.description","",""
"Scripts/Content/Story/B_AssignAmbientInfos/B_AssignAmbientInfos_VLK_6.d:46","Wie werde ich Bürger dieser Stadt?","żCómo me convierto en ciudadano?","","","DIA_VLK_6_JOIN_15_00","",""
"Scripts/Content/Story/B_AssignAmbientInfos/B_AssignAmbientInfos_VLK_6.d:47","Du willst dich hier niederlassen? Jetzt? Wo hier alle Anzeichen auf Weltuntergang stehen?","żQuieres instalarte aquí? żAhora? żCuando todo indica que el fin del mundo se aproxima?","","","DIA_VLK_6_JOIN_06_01","",""
"Scripts/Content/Story/B_AssignAmbientInfos/B_AssignAmbientInfos_VLK_6.d:48","Ich hatte nicht vor, ewig zu bleiben.","No tenía pensado quedarme para siempre.","","","DIA_VLK_6_JOIN_15_02","",""
"Scripts/Content/Story/B_AssignAmbientInfos/B_AssignAmbientInfos_VLK_6.d:49","Also, ich würde dir raten, dich hier zu verkrümeln, solange du noch kannst, aber wenn du's darauf anlegst, solltest du mit einem der einflussreichen Bürger hier reden.","Si aceptas mi consejo, deberías largarte a toda prisa mientras puedas. Pero si insistes, habla con uno de los ciudadanos influyentes.","","","DIA_VLK_6_JOIN_06_03","",""
"Scripts/Content/Story/B_AssignAmbientInfos/B_AssignAmbientInfos_VLK_6.d:61","Wer sind die einflussreichen Bürger von Khorinis?","żQuiénes son los ciudadanos influyentes de Khorinis?","","","DIA_VLK_6_PEOPLE.description","",""
"Scripts/Content/Story/B_AssignAmbientInfos/B_AssignAmbientInfos_VLK_6.d:71","Wer sind die einflussreichen Bürger von Khorinis?","żQuiénes son los ciudadanos influyentes de Khorinis?","","","DIA_VLK_6_PEOPLE_15_00","",""
"Scripts/Content/Story/B_AssignAmbientInfos/B_AssignAmbientInfos_VLK_6.d:72","Probier's mal beim Schmied oder beim Tischler in der Unterstadt. Es gibt dort auch noch ein paar andere angesehene Meister.","Prueba con el herrero o el carpintero de la parte baja de la ciudad. Allí también encontrarás a otros artesanos de renombre.","","","DIA_VLK_6_PEOPLE_06_01","",""
"Scripts/Content/Story/B_AssignAmbientInfos/B_AssignAmbientInfos_VLK_6.d:73","Wenn hier jemand abgesehen von der Stadtwache und den Paladinen was zu sagen hat, dann diese Männer.","Estos hombres son los pocos que tienen algo que decir en la ciudad, además de los guardias de la ciudad y los paladines.","","","DIA_VLK_6_PEOPLE_06_02","",""
"Scripts/Content/Story/B_AssignAmbientInfos/B_AssignAmbientInfos_VLK_6.d:85","Woran kann ich mich hier in der Stadt am besten orientieren?","żCómo puedo orientarme en la ciudad?","","","DIA_VLK_6_LOCATION.description","",""
"Scripts/Content/Story/B_AssignAmbientInfos/B_AssignAmbientInfos_VLK_6.d:95","Woran kann ich mich hier in der Stadt am besten orientieren?","żCómo puedo orientarme en la ciudad?","","","DIA_VLK_6_LOCATION_15_00","",""
"Scripts/Content/Story/B_AssignAmbientInfos/B_AssignAmbientInfos_VLK_6.d:96","Ist gar nicht so leicht, sich hier zurechtzufinden, was? Da helfen selbst die Wegweiser nicht immer.","La verdad es que no es fácil hacerlo. Ni siquiera los carteles ayudan.","","","DIA_VLK_6_LOCATION_06_01","",""
"Scripts/Content/Story/B_AssignAmbientInfos/B_AssignAmbientInfos_VLK_6.d:97","Wenn du einen schlechten Orientierungssinn hast, wird es das Beste sein, du gehst zum Hafen - den wirst du ja wohl noch finden - und suchst das Haus des Kartenzeichners.","Si no tienes mucho sentido de la orientación, será mejor que bajes al puerto (suponiendo que puedas encontrarlo) y busques la casa del cartógrafo.","","","DIA_VLK_6_LOCATION_06_02","",""
"Scripts/Content/Story/B_AssignAmbientInfos/B_AssignAmbientInfos_VLK_6.d:98","Es ist direkt neben der Kneipe, an der Hafenmauer. Brahim hat bestimmt einen Plan von der Stadt für dich.","Está al lado de la taberna, en el muelle. Seguro que Brahim puede proporcionarte un mapa de la ciudad.","","","DIA_VLK_6_LOCATION_06_03","",""
"Scripts/Content/Story/B_AssignAmbientInfos/B_AssignAmbientInfos_VLK_6.d:110","Was gibt's Neues?","żQué hay de nuevo?","","","DIA_VLK_6_STANDARD.description","",""
"Scripts/Content/Story/B_AssignAmbientInfos/B_AssignAmbientInfos_VLK_6.d:120","Was gibt's Neues?","żQué hay de nuevo?","","","DIA_VLK_6_STANDARD_15_00","",""
"Scripts/Content/Story/B_AssignAmbientInfos/B_AssignAmbientInfos_VLK_6.d:124","Seitdem die Barriere weg ist, wimmelt es in der Gegend um die Stadt nur so von Banditen. Aber die Paladine unternehmen nichts. Warum zum Teufel sind die Kerle dann hier?","Desde que cayó la barrera, la ciudad está infestada de bandidos, pero los paladines no hacen nada. żPara qué narices están aquí, si puede saberse?","","","DIA_VLK_6_STANDARD_06_01","",""
"Scripts/Content/Story/B_AssignAmbientInfos/B_AssignAmbientInfos_VLK_6.d:129","In letzter Zeit ist es schon besser geworden mit den Banditen. Es sieht so aus, als ob endlich mal jemand etwas unternehmen würde.","Últimamente el problema de los bandidos no es tan grave. Parece que alguien se ha estado ocupando del tema.","","","DIA_VLK_6_STANDARD_06_02","",""
"Scripts/Content/Story/B_AssignAmbientInfos/B_AssignAmbientInfos_VLK_6.d:136","Sie haben den dreckigen Söldner, der den Paladin ermordet hat, laufen lassen. Ihn zu hängen wäre sicherlich auch kein Fehler gewesen.","Han soltado al mercenario de mierda que asesinó al paladín. No habría sido mala idea ahorcarlo.","","","DIA_VLK_6_STANDARD_06_03","",""
"Scripts/Content/Story/B_AssignAmbientInfos/B_AssignAmbientInfos_VLK_6.d:140","Es heißt, einer von Onars Söldnern hat einen der Paladine umgebracht. Sie haben den Kerl geschnappt und eingelocht. Bald wird er hängen.","Se dice que uno de los mercenarios de Onar ha matado a un paladín. Lo han cogido y lo han metido en la cárcel. No van a tardar en ahorcarlo.","","","DIA_VLK_6_STANDARD_06_04","",""
"Scripts/Content/Story/B_AssignAmbientInfos/B_AssignAmbientInfos_VLK_6.d:146","Ich frage mich, on an den Geschichten über die Drachen was dran ist ...","Me pregunto si hay algo de cierto en los rumores de los dragones...","","","DIA_VLK_6_STANDARD_06_05","",""
"Scripts/Content/Story/B_AssignAmbientInfos/B_AssignAmbientInfos_VLK_6.d:151","Es heißt, Lord Hagen sammelt seine Männer, um das Minental befreien. Endlich geht es los!","Se dice que lord Hagen ha movilizado a sus hombres para liberar el Valle de las Minas. ˇPor fin hay algo de actividad!","","","DIA_VLK_6_STANDARD_06_06","",""
"Scripts/Content/Story/B_AssignAmbientInfos/B_AssignAmbientInfos_VLK_8.d:32","Ich will Bürger dieser Stadt werden!","ˇQuiero convertirme en ciudadano!","","","DIA_VLK_8_JOIN.description","",""
"Scripts/Content/Story/B_AssignAmbientInfos/B_AssignAmbientInfos_VLK_8.d:46","Ich will Bürger dieser Stadt werden!","ˇQuiero convertirme en ciudadano!","","","DIA_VLK_8_JOIN_15_00","",""
"Scripts/Content/Story/B_AssignAmbientInfos/B_AssignAmbientInfos_VLK_8.d:47","Und warum erzählst du mir das? Geh zu einem der Handwerksmeister in der Unterstadt. Vielleicht hast du Glück und sie suchen noch einen Lehrling.","żY a mí qué me cuentas? Ve a ver a uno de los maestros artesanos de la parte baja de la ciudad. Si tienes suerte, a lo mejor uno de ellos busca un aprendiz.","","","DIA_VLK_8_JOIN_08_01","",""
"Scripts/Content/Story/B_AssignAmbientInfos/B_AssignAmbientInfos_VLK_8.d:48","Ansonsten müsstest du zum Statthalter gehen und dich als Bürger eintragen lassen.","Si no, tendrás que ir a ver al gobernador e inscribirte como ciudadano.","","","DIA_VLK_8_JOIN_08_02","",""
"Scripts/Content/Story/B_AssignAmbientInfos/B_AssignAmbientInfos_VLK_8.d:49","Aber das kannst du zurzeit vergessen. Der Statthalter hat nichts mehr zu sagen, seit die Paladine da sind.","No obstante, olvídate del asunto. Desde la llegada de los paladines, el gobernador ha dejado de estar al cargo.","","","DIA_VLK_8_JOIN_08_03","",""
"Scripts/Content/Story/B_AssignAmbientInfos/B_AssignAmbientInfos_VLK_8.d:50","Und ihr Anführer, Lord Hagen, nimmt sich für solche Dinge garantiert keine Zeit.","Y seguro que su líder, lord Hagen, no tiene tiempo para cosas así.","","","DIA_VLK_8_JOIN_08_04","",""
"Scripts/Content/Story/B_AssignAmbientInfos/B_AssignAmbientInfos_VLK_8.d:62","Wer sind die wichtigsten Bürger dieser Stadt?","żQuiénes son los ciudadanos más importantes?","","","DIA_VLK_8_PEOPLE.description","",""
"Scripts/Content/Story/B_AssignAmbientInfos/B_AssignAmbientInfos_VLK_8.d:72","Wer sind die wichtigsten Bürger dieser Stadt?","żQuiénes son los ciudadanos más importantes?","","","DIA_VLK_8_PEOPLE_15_00","",""
"Scripts/Content/Story/B_AssignAmbientInfos/B_AssignAmbientInfos_VLK_8.d:73","Wenn man mal von den Paladinen absieht ... die Handwerksmeister aus der Unterstadt. Sie sind alle sehr hoch angesehen.","Además de los paladines... los maestros artesanos de la parte baja de la ciudad. Todos ellos son muy importantes.","","","DIA_VLK_8_PEOPLE_08_01","",""
"Scripts/Content/Story/B_AssignAmbientInfos/B_AssignAmbientInfos_VLK_8.d:85","Was gibt es hier interessantes zu sehen?","żQué cosas interesantes hay aquí para ver?","","","DIA_VLK_8_LOCATION.description","",""
"Scripts/Content/Story/B_AssignAmbientInfos/B_AssignAmbientInfos_VLK_8.d:95","Was gibt es hier Interessantes zu sehen?","żQué cosas interesantes hay aquí para ver?","","","DIA_VLK_8_LOCATION_15_00","",""
"Scripts/Content/Story/B_AssignAmbientInfos/B_AssignAmbientInfos_VLK_8.d:96","Das große Schiff, mit dem die Paladine gekommen sind, liegt am Hafen. Es ist ein Riesenkahn! Den musst du dir mal ansehen.","En el puerto está el gran barco en el que llegaron los paladines. ˇEs un navío enorme! Merece la pena echarle un vistazo.","","","DIA_VLK_8_LOCATION_08_01","",""
"Scripts/Content/Story/B_AssignAmbientInfos/B_AssignAmbientInfos_VLK_8.d:97","Allerdings kann ich mir nicht vorstellen, dass sie dich da drauf lassen. Die Paladine hüten das Schiff wie ihren Augapfel.","No obstante, no creo que te dejen subir a bordo. Los paladines vigilan el barco como si fuesen las joyas de la corona.","","","DIA_VLK_8_LOCATION_08_02","",""
"Scripts/Content/Story/B_AssignAmbientInfos/B_AssignAmbientInfos_VLK_8.d:98","Kein Wunder. Ist ja auch der einzige seetüchtige Kahn, der hier weit und breit vor Anker liegt.","No me extrańa. Es el único barco en condiciones de navegar en muchos kilómetros a la redonda.","","","DIA_VLK_8_LOCATION_08_03","",""
"Scripts/Content/Story/B_AssignAmbientInfos/B_AssignAmbientInfos_VLK_8.d:110","Was gibt's Neues?","żQué hay de nuevo?","","","DIA_VLK_8_STANDARD.description","",""
"Scripts/Content/Story/B_AssignAmbientInfos/B_AssignAmbientInfos_VLK_8.d:120","Was gibt's Neues?","żQué hay de nuevo?","","","DIA_VLK_8_STANDARD_15_00","",""
"Scripts/Content/Story/B_AssignAmbientInfos/B_AssignAmbientInfos_VLK_8.d:124","Alle sind in letzter Zeit sehr beunruhigt.","Todo el mundo anda preocupado últimamente.","","","DIA_Addon_VLK_8_STANDARD_08_00","",""
"Scripts/Content/Story/B_AssignAmbientInfos/B_AssignAmbientInfos_VLK_8.d:125","Nicht genug, dass die Paladine sich hier breit gemacht haben, jetzt verschwindet auch noch ständig irgendjemand auf merkwürdige Art und Weise.","Por si no bastara con que los paladines se hayan acomodado aquí, ahora empieza a desaparecer gente de la forma más extrańa.","","","DIA_Addon_VLK_8_STANDARD_08_01","",""
"Scripts/Content/Story/B_AssignAmbientInfos/B_AssignAmbientInfos_VLK_8.d:126","Es wird langsam Zeit, dass die Miliz endlich etwas dagegen unternimmt.","Ya es hora de que la milicia haga algo al respecto.","","","DIA_Addon_VLK_8_STANDARD_08_02","",""
"Scripts/Content/Story/B_AssignAmbientInfos/B_AssignAmbientInfos_VLK_8.d:139","Jeder wartet darauf, dass die Paladine verkünden, warum sie eigentlich hier sind. Ich vermute, es ist wegen der Orks. Sie greifen bestimmt bald an!","Todo el mundo espera a que los paladines anuncien a qué han venido. Sospecho que es por los orcos. ˇSeguro que atacan pronto!","","","DIA_VLK_8_STANDARD_08_01","",""
"Scripts/Content/Story/B_AssignAmbientInfos/B_AssignAmbientInfos_VLK_8.d:140","Die Paladine mögen zwar den Segen Innos' haben, aber wenn hier die Orkhorden auflaufen, sind wir geliefert.","Puede que los paladines cuenten con la bendición de Innos, pero cuando aparezcan las hordas orcas, llegará nuestro fin.","","","DIA_VLK_8_STANDARD_08_02","",""
"Scripts/Content/Story/B_AssignAmbientInfos/B_AssignAmbientInfos_VLK_8.d:145","Es heißt, die Paladine sind nur hier, um alles Erz von dieser Insel zu holen. Für den Krieg auf dem Festland, heißt es.","Se rumorea que los paladines solo han venido para llevarse todo el mineral de la isla. Se dice que es para la guerra en el continente.","","","DIA_VLK_8_STANDARD_08_03","",""
"Scripts/Content/Story/B_AssignAmbientInfos/B_AssignAmbientInfos_VLK_8.d:146","Weißt du, was das heißt? Es ist dem König egal, ob wir hier alle verrecken, wenn die Orks angreifen.","żSabes lo que significa eso? Al rey le importa un bledo que muramos miserablemente cuando ataquen los orcos.","","","DIA_VLK_8_STANDARD_08_04","",""
"Scripts/Content/Story/B_AssignAmbientInfos/B_AssignAmbientInfos_VLK_8.d:147","Ich werde zusehen, dass ich mit aufs Schiff komme, wenn die Paladine ablegen.","Cuando los paladines leven anclas, me aseguraré de estar a bordo del barco.","","","DIA_VLK_8_STANDARD_08_05","",""
"Scripts/Content/Story/B_AssignAmbientInfos/B_AssignAmbientInfos_VLK_8.d:152","Es heißt, die Orks reiten auf Drachen hierher, die so groß sind wie die halbe Stadt! Wir haben keine Chance!","ˇSe rumorea que los orcos vienen a lomos de dragones tan grandes como la mitad de la ciudad! ˇNo tenemos ninguna oportunidad!","","","DIA_VLK_8_STANDARD_08_06","",""
"Scripts/Content/Story/B_AssignAmbientInfos/B_AssignAmbientInfos_VLK_8.d:157","Die Leute erzählen sich, die Drachen wären besiegt worden. Ob das stimmt?","La gente dice que los dragones han sido vencidos. żSerá verdad?","","","DIA_VLK_8_STANDARD_08_07","",""
"Scripts/Content/Story/B_AssignAmbientInfos/B_AssignCityGuide.d:11","In die Unterstadt.","A la parte baja de la ciudad.","","","DIA_CITYGUIDE.DIA_CITYGUIDE_UNTERSTADT","Info_AddChoice",""
"Scripts/Content/Story/B_AssignAmbientInfos/B_AssignCityGuide.d:16","Ins obere Viertel.","Al barrio alto.","","","DIA_CITYGUIDE.DIA_CITYGUIDE_OBERSTADT","Info_AddChoice",""
"Scripts/Content/Story/B_AssignAmbientInfos/B_AssignCityGuide.d:21","Zum Adanos-Tempel","Al templo de Adanos.","","","DIA_CITYGUIDE.DIA_CITYGUIDE_TEMPEL","Info_AddChoice",""
"Scripts/Content/Story/B_AssignAmbientInfos/B_AssignCityGuide.d:26","Zum Marktplatz.","Al mercado.","","","DIA_CITYGUIDE.DIA_CITYGUIDE_MARKT","Info_AddChoice",""
