"location","source","target","id","fuzzy","context","translator_comments","developer_comments"
"Scripts/Content/Story/Dialoge/DIA_PAL_216_Cedric.d:72","Kannst du mich trainieren?","¿Puedes entrenarme?","","","DIA_Cedric_CanTeach_15_00","",""
"Scripts/Content/Story/Dialoge/DIA_PAL_216_Cedric.d:76","Ich kann dich im Kampf mit einhändigen Waffen trainieren.","Te puedo entrenar en el combate con armas a una mano,","","","DIA_Cedric_CanTeach_12_01","",""
"Scripts/Content/Story/Dialoge/DIA_PAL_216_Cedric.d:82","Ich trainiere nur Paladine.","Solo entreno a paladines.","","","DIA_Cedric_CanTeach_12_02","",""
"Scripts/Content/Story/Dialoge/DIA_PAL_216_Cedric.d:96","Ich will trainieren.","Quiero entrenar.","","","DIA_Cedric_Teach.description","",""
"Scripts/Content/Story/Dialoge/DIA_PAL_216_Cedric.d:113","Ich will trainieren.","Quiero entrenar.","","","DIA_Cedric_Teach_15_00","",""
"Scripts/Content/Story/Dialoge/DIA_PAL_216_Cedric.d:117","Du hast alles über den Schwertkampf gelernt. Mehr kann ich dir nicht zeigen.","Lo has aprendido todo acerca de la lucha a espada. No puedo enseñarte más.","","","DIA_DIA_Cedric_Teach_12_01","",""
"Scripts/Content/Story/Dialoge/DIA_PAL_217_Marcos.d:46","HALT - im Namen Innos'! Ich bin Marcos, Paladin des Königs. Sag, was du willst, und sprich wahr!","¡ALTO, en nombre de Innos! Soy Marcos, paladín del rey. ¡Dime qué es lo que quieres y no mientas!","","","DIA_Marcos_Hallo_04_00","",""
"Scripts/Content/Story/Dialoge/DIA_PAL_217_Marcos.d:50","Ein Erwählter Innos' spricht immer wahr.","Un elegido de Innos siempre dice la verdad.","","","DIA_Marcos_Hallo_15_01","",""
"Scripts/Content/Story/Dialoge/DIA_PAL_217_Marcos.d:51","Verzeih mir, ehrwürdiger Magier. Ich habe nicht erkannt, mit wem ich spreche.","Perdonadme, reverendo mago. No me había dado cuenta de con quién estaba hablando.","","","DIA_Marcos_Hallo_04_02","",""
"Scripts/Content/Story/Dialoge/DIA_PAL_217_Marcos.d:52","Ja ja, schon gut.","Sí, de acuerdo, no te preocupes.","","","DIA_Marcos_Hallo_15_03","",""
"Scripts/Content/Story/Dialoge/DIA_PAL_217_Marcos.d:53","Wenn mir die Frage gestattet ist - was verschlägt dich in diese Gegend?","Si se me permite la pregunta, ¿qué le trae por esta zona?","","","DIA_Marcos_Hallo_04_04","",""
"Scripts/Content/Story/Dialoge/DIA_PAL_217_Marcos.d:57","Bleib ruhig - ich stehe im Dienst von Lord Hagen.","Tranquilo, estoy al servicio de lord Hagen.","","","DIA_Marcos_Hallo_15_05","",""
"Scripts/Content/Story/Dialoge/DIA_PAL_217_Marcos.d:58","Du gehörst zur Truppe. Welcher Befehl verschlägt dich hier her?","Eres uno de sus soldados. ¿Qué órdenes has recibido?","","","DIA_Marcos_Hallo_04_06","",""
"Scripts/Content/Story/Dialoge/DIA_PAL_217_Marcos.d:62","Bleib ruhig, wir arbeiten für den gleichen Boss - Lord Hagen.","Tranquilo, trabajamos para el mismo, para lord Hagen.","","","DIA_Marcos_Hallo_15_07","",""
"Scripts/Content/Story/Dialoge/DIA_PAL_217_Marcos.d:63","Seit wann heuert Lord Hagen Söldner an? Sprich - was willst du hier?","¿Desde cuando contrata lord Hagen a mercenarios? Habla, ¿qué estás buscando aquí?","","","DIA_Marcos_Hallo_04_08","",""
"Scripts/Content/Story/Dialoge/DIA_PAL_217_Marcos.d:76","Ich muss Lord Hagen Beweise für die Existenz der Drachen bringen.","Debo llevarle pruebas a lord Hagen de la existencia de los dragones.","","","DIA_Marcos_Hagen.description","",""
"Scripts/Content/Story/Dialoge/DIA_PAL_217_Marcos.d:90","Ich muss Lord Hagen Beweise für die Existenz der Drachen bringen.","Debo llevarle pruebas a lord Hagen de la existencia de los dragones.","","","DIA_Marcos_Hagen_15_00","",""
"Scripts/Content/Story/Dialoge/DIA_PAL_217_Marcos.d:91","Dann solltest du keine Zeit verlieren und dein Leben nicht leichtfertig aufs Spiel setzen.","Entonces no deberías perder tiempo ni arriesgar la vida de manera innecesaria.","","","DIA_Marcos_Hagen_04_01","",""
"Scripts/Content/Story/Dialoge/DIA_PAL_217_Marcos.d:92","Glaubst du etwa, du findest hier eine Drachenschuppe, die du ihm bringen kannst?","¿Crees que vas a encontrar aquí una escama de dragón para poder llevársela?","","","DIA_Marcos_Hagen_04_02","",""
"Scripts/Content/Story/Dialoge/DIA_PAL_217_Marcos.d:93","Versuch, die Burg zu erreichen, und sprich mit Kommandant Garond.","Intenta llegar al castillo y habla con el comandante Garond.","","","DIA_Marcos_Hagen_04_03","",""
"Scripts/Content/Story/Dialoge/DIA_PAL_217_Marcos.d:94","Er muss erfahren, dass du im Auftrag von Lord Hagen kommst! Und er wird sich auch um deinen Auftrag kümmern.","¡Tiene que saber que estás en una misión por encargo de lord Hagen! Él se encargará de tu tarea.","","","DIA_Marcos_Hagen_04_04","",""
"Scripts/Content/Story/Dialoge/DIA_PAL_217_Marcos.d:106","Ich komme von Garond...","Vengo de parte de Garond...","","","DIA_Marcos_Garond.description","",""
"Scripts/Content/Story/Dialoge/DIA_PAL_217_Marcos.d:120","Ich komme von Garond - er muss wissen, wieviel Erz zum Transport bereit steht.","Vengo de parte de Garond. Necesita saber cuánto mineral está listo para el transporte.","","","DIA_Marcos_Garond_15_00","",""
"Scripts/Content/Story/Dialoge/DIA_PAL_217_Marcos.d:121","Sag Garond, dass ich die Schürfstelle verlassen musste, weil die Ork-Angriffe zu heftig wurden.","Dile a Garond que tuve que salir de la mina porque los ataques orcos se hicieron demasiado intensos.","","","DIA_Marcos_Garond_04_01","",""
"Scripts/Content/Story/Dialoge/DIA_PAL_217_Marcos.d:122","Ich habe versucht, mit ein paar Leuten die Burg zu erreichen, doch ich bin der einzige Überlebende.","Intenté, con otros pocos, llegar al castillo, pero soy el único superviviente.","","","DIA_Marcos_Garond_04_02","",""
"Scripts/Content/Story/Dialoge/DIA_PAL_217_Marcos.d:123","Das Erz habe ich sicher gestellt. Es sind VIER Kisten. Geh zu Garond und berichte ihm das.","He puesto a salvo el mineral. Hay CUATRO cofres. Ve a informar a Garond de ello.","","","DIA_Marcos_Garond_04_03","",""
"Scripts/Content/Story/Dialoge/DIA_PAL_217_Marcos.d:124","Sag ihm, dass ich das Erz mit meinen Leben schützen werde. Doch weiß ich nicht, wie lange es dauern wird, bis mich die Orks hier aufspüren.","Dile que protegeré el mineral con mi vida. Pero no sé cuánto van a tardar en encontrarme los orcos.","","","DIA_Marcos_Garond_04_04","",""
"Scripts/Content/Story/Dialoge/DIA_PAL_217_Marcos.d:125","Er soll mir Unterstützung schicken.","Dile que me envíe refuerzos.","","","DIA_Marcos_Garond_04_05","",""
"Scripts/Content/Story/Dialoge/DIA_PAL_217_Marcos.d:126","Ich werd's ihm ausrichten.","Se lo diré.","","","DIA_Marcos_Garond_15_06","",""
"Scripts/Content/Story/Dialoge/DIA_PAL_217_Marcos.d:149","Wie ist die Lage?","¿Cómo van las cosas?","","","DIA_Marcos_Perm.description","",""
"Scripts/Content/Story/Dialoge/DIA_PAL_217_Marcos.d:164","Wie ist die Lage?","¿Cuál es la situación?","","","DIA_Marcos_Perm_15_00","",""
"Scripts/Content/Story/Dialoge/DIA_PAL_217_Marcos.d:168","Ich brauche mal einen kräftigen Schluck Heiltrank!","¡Se me acaban las reservas de pociones de curación!","","","DIA_Marcos_Perm_04_01","",""
"Scripts/Content/Story/Dialoge/DIA_PAL_217_Marcos.d:173","Ich harre aus - und ich hoffe, Garond schickt mir bald die Unterstützung.","Aguantaré. Espero que Garond me envíe refuerzos deprisa.","","","DIA_Marcos_Perm_04_02","",""
"Scripts/Content/Story/Dialoge/DIA_PAL_217_Marcos.d:177","Ich danke dir für die Unterstützung. Innos wird uns die Kraft geben durchzuhalten.","Gracias por la ayuda. Innos me dará fuerza para aguantar.","","","DIA_Marcos_Perm_04_03","",""
"Scripts/Content/Story/Dialoge/DIA_PAL_217_Marcos.d:187","Ich werde hier durchhalten, denn Innos ist mit mir!","¡Resistiré porque Innos está conmigo!","","","DIA_Marcos_Perm_04_04","",""
"Scripts/Content/Story/Dialoge/DIA_PAL_250_Garond.d:57","Bevor wir irgendwas besprechen, zahlst du erstmal deine Strafe.","No vamos a discutir nada hasta que no pagues la multa.","","","DIA_Garond_PMSchulden_10_00","",""
"Scripts/Content/Story/Dialoge/DIA_PAL_250_Garond.d:61","Und die ist seit den letzten Anschuldigungen gestiegen.","Y ésta es superior, teniendo en cuenta las acusaciones más recientes.","","","DIA_Garond_PMSchulden_10_01","",""
"Scripts/Content/Story/Dialoge/DIA_PAL_250_Garond.d:62","Anscheinend hast du dir noch mehr Ärger aufgehalst.","Parece que te has metido en más problemas aún.","","","DIA_Garond_PMSchulden_10_02","",""
"Scripts/Content/Story/Dialoge/DIA_PAL_250_Garond.d:66","Aber ich hoffe, dass du jetzt für alles bezahlen wirst! Insgesamt sind das ...","¡No obstante, espero que ahora pagues todo! En total, la suma asciende a...","","","DIA_Garond_PMSchulden_10_03","",""
"Scripts/Content/Story/Dialoge/DIA_PAL_250_Garond.d:70","Ich bin schwer enttäuscht von dir. Deine Strafe beläuft sich auf ...","Me has decepcionado mucho. La suma de tus multas es...","","","DIA_Garond_PMSchulden_10_04","",""
"Scripts/Content/Story/Dialoge/DIA_PAL_250_Garond.d:85","Es haben sich ein paar neue Dinge ergeben.","Han surgido unas cuantas cosas más.","","","DIA_Garond_PMSchulden_10_05","",""
"Scripts/Content/Story/Dialoge/DIA_PAL_250_Garond.d:89","Plötzlich bezichtigt dich niemand mehr des Mordes.","Ha sido de repente, pero ya no estás acusado de asesinato.","","","DIA_Garond_PMSchulden_10_06","",""
"Scripts/Content/Story/Dialoge/DIA_PAL_250_Garond.d:95","Niemand erinnert sich dran, dich beim Diebstahl gesehen zu haben.","Nadie recuerda haberte visto cometer un robo.","","","DIA_Garond_PMSchulden_10_07","",""
"Scripts/Content/Story/Dialoge/DIA_PAL_250_Garond.d:101","Es gibt keine Zeugen mehr dafür, dass du jemals in eine Schlägerei verwickelt warst.","Ya no hay testigos que certifiquen que te has visto envuelto en peleas.","","","DIA_Garond_PMSchulden_10_08","",""
"Scripts/Content/Story/Dialoge/DIA_PAL_250_Garond.d:106","Anscheinend sind alle Anschuldigungen gegen dich fallen gelassen worden.","Parece que se han retirado los cargos contra ti.","","","DIA_Garond_PMSchulden_10_09","",""
"Scripts/Content/Story/Dialoge/DIA_PAL_250_Garond.d:109","Ich weiß nicht, was da gelaufen ist, aber ich warne dich: Treib es nicht zu weit!","No tengo ni idea de lo que pasó pero, te lo advierto: ¡no te pases!","","","DIA_Garond_PMSchulden_10_10","",""
"Scripts/Content/Story/Dialoge/DIA_PAL_250_Garond.d:114","Ich habe mich entschieden, dir deine Schulden zu erlassen.","He decidido condonar tus deudas.","","","DIA_Garond_PMSchulden_10_11","",""
"Scripts/Content/Story/Dialoge/DIA_PAL_250_Garond.d:115","Und mach bloß keinen Ärger mehr in der Burg!","¡Y no vuelvas a meterte en líos en el castillo!","","","DIA_Garond_PMSchulden_10_12","",""
"Scripts/Content/Story/Dialoge/DIA_PAL_250_Garond.d:123","Damit eines klar ist: Deine Strafe musst du trotzdem in voller Höhe zahlen.","Quiero que quede clara una cosa: de todas maneras vas a pagar todas las multas.","","","DIA_Garond_PMSchulden_10_13","",""
"Scripts/Content/Story/Dialoge/DIA_PAL_250_Garond.d:125","Also, was ist?","Bueno, ¿y qué pasa?","","","DIA_Garond_PMSchulden_10_14","",""
"Scripts/Content/Story/Dialoge/DIA_PAL_250_Garond.d:134","Ich habe nicht genug Gold!","¡No tengo bastante oro!","","","DIA_Garond_PMSchulden.DIA_Garond_PETZMASTER_PayLater","Info_AddChoice",""
"Scripts/Content/Story/Dialoge/DIA_PAL_250_Garond.d:135","Wieviel war es nochmal?","¿Dime otra vez cuánto era?","","","DIA_Garond_PMSchulden.DIA_Garond_PMSchulden_HowMuchAgain","Info_AddChoice",""
"Scripts/Content/Story/Dialoge/DIA_PAL_250_Garond.d:138","Ich will die Strafe zahlen.","¡Quiero pagar la multa!","","","DIA_Garond_PMSchulden.DIA_Garond_PETZMASTER_PayNow","Info_AddChoice",""
"Scripts/Content/Story/Dialoge/DIA_PAL_250_Garond.d:145","Wie viel war es noch mal?","¿Y cuánto era?","","","DIA_Garond_PMSchulden_HowMuchAgain_15_00","",""
"Scripts/Content/Story/Dialoge/DIA_PAL_250_Garond.d:188","Du bist also der Kerl, der hier in der Burg Ärger gemacht hat.","Así que tú eres el que ha causado problemas en el castillo.","","","DIA_Garond_PETZMASTER_10_00","",""
"Scripts/Content/Story/Dialoge/DIA_PAL_250_Garond.d:193","Ich habe mich schon gefragt, wie lange es dauert, bis du zu mir kommst.","He estado preguntándome cuánto tardarías en venir a verme.","","","DIA_Garond_PETZMASTER_10_01","",""
"Scripts/Content/Story/Dialoge/DIA_PAL_250_Garond.d:194","Mord ist so ziemlich das Letzte, das ich hier gebrauchen kann!","Lo último que necesito aquí es un asesino.","","","DIA_Garond_PETZMASTER_10_02","",""
"Scripts/Content/Story/Dialoge/DIA_PAL_250_Garond.d:195","Ich bin auf jeden meiner Leute angewiesen - und jetzt habe ich wieder einen weniger!","Necesito a cada uno de mis hombres, ¡y ahora me vuelve a faltar uno!","","","DIA_Garond_PETZMASTER_10_03","",""
"Scripts/Content/Story/Dialoge/DIA_PAL_250_Garond.d:200","Ganz zu schweigen von den anderen Sachen, die du angerichtet hast.","Por no hablar de los problemas en los que te metes.","","","DIA_Garond_PETZMASTER_10_04","",""
"Scripts/Content/Story/Dialoge/DIA_PAL_250_Garond.d:203","Ich erkläre dir jetzt mal was. Wir sitzen hier alle gemeinsam in der Falle.","Déjame que te explique algo. Aquí estamos todos atrapados.","","","DIA_Garond_PETZMASTER_10_05","",""
"Scripts/Content/Story/Dialoge/DIA_PAL_250_Garond.d:204","Und ich bin auf jeden einzelnen meiner Männer angewiesen. Auch auf dich.","Y necesito desesperadamente a cada uno de mis hombres. Incluyéndote a ti.","","","DIA_Garond_PETZMASTER_10_06","",""
"Scripts/Content/Story/Dialoge/DIA_PAL_250_Garond.d:205","Wenn du jemanden umbringen willst, dann brauchst du nur die Burg zu verlassen. Da gibt's genug Orks.","Si te apetece matar a alguien, no tienes más que salir del castillo. Ahí fuera hay orcos de sobra.","","","DIA_Garond_PETZMASTER_10_07","",""
"Scripts/Content/Story/Dialoge/DIA_PAL_250_Garond.d:206","Ich werde dir eine Strafe aufdrücken - obwohl ich mich eigentlich gar nicht mit so einer Scheiße beschäftigen will.","Te voy a imponer una multa, aunque siento tener que encargarme de estas estupideces.","","","DIA_Garond_PETZMASTER_10_08","",""
"Scripts/Content/Story/Dialoge/DIA_PAL_250_Garond.d:211","Ich hab gehört, das du hier Sachen mitgehen lässt.","Dicen que has estado robando.","","","DIA_Garond_PETZMASTER_10_09","",""
"Scripts/Content/Story/Dialoge/DIA_PAL_250_Garond.d:214","Ganz zu schweigen von den anderen Sachen, die mir berichtet wurden.","Por no hablar del resto de las cosas que me han dicho.","","","DIA_Garond_PETZMASTER_10_10","",""
"Scripts/Content/Story/Dialoge/DIA_PAL_250_Garond.d:217","Das werde ich dir nicht durchgehen lassen. Ich glaube du unterschätzt den Ernst der Lage.","No te vas a ir de rositas. Parece que no entiendes la gravedad de la situación.","","","DIA_Garond_PETZMASTER_10_11","",""
"Scripts/Content/Story/Dialoge/DIA_PAL_250_Garond.d:218","Du wirst eine Strafe zahlen, um dein Verbrechen wieder gut zu machen!","¡Se te hará pagar una multa que compense tus delitos!","","","DIA_Garond_PETZMASTER_10_12","",""
"Scripts/Content/Story/Dialoge/DIA_PAL_250_Garond.d:225","Ich sehe es nicht gerne, wenn es Schlägereien zwischen meinen Männern gibt.","No me gusta ver cómo se pelean mis hombres.","","","DIA_Garond_PETZMASTER_10_13","",""
"Scripts/Content/Story/Dialoge/DIA_PAL_250_Garond.d:229","Und die Sache mit den Schafen musste wohl auch nicht sein.","Y lo de la oveja tampoco era necesario.","","","DIA_Garond_PETZMASTER_10_14","",""
"Scripts/Content/Story/Dialoge/DIA_PAL_250_Garond.d:232","Also wirst du deine Strafe dafür zahlen!","¡Así que tendrás que pagar una multa por ello!","","","DIA_Garond_PETZMASTER_10_15","",""
"Scripts/Content/Story/Dialoge/DIA_PAL_250_Garond.d:240","Du gehst rum und tötest unsere Schafe? Die gehören uns allen.","¿Vas por ahí matando a nuestras ovejas? Son de todos.","","","DIA_Garond_PETZMASTER_10_16","",""
"Scripts/Content/Story/Dialoge/DIA_PAL_250_Garond.d:241","Du wirst mir das Fleisch bezahlen.","Me pagarás por la carne.","","","DIA_Garond_PETZMASTER_10_17","",""
"Scripts/Content/Story/Dialoge/DIA_PAL_250_Garond.d:246","Wie viel?","¿Cuánto?","","","DIA_Garond_PETZMASTER_15_18","",""
"Scripts/Content/Story/Dialoge/DIA_PAL_250_Garond.d:253","Ich habe nicht genug Gold!","¡No tengo bastante oro!","","","DIA_Garond_PETZMASTER.DIA_Garond_PETZMASTER_PayLater","Info_AddChoice",""
"Scripts/Content/Story/Dialoge/DIA_PAL_250_Garond.d:256","Ich will die Strafe zahlen.","¡Quiero pagar la multa!","","","DIA_Garond_PETZMASTER.DIA_Garond_PETZMASTER_PayNow","Info_AddChoice",""
"Scripts/Content/Story/Dialoge/DIA_PAL_250_Garond.d:262","Ich will die Strafe zahlen!","¡Quiero pagar la multa!","","","DIA_Garond_PETZMASTER_PayNow_15_00","",""
"Scripts/Content/Story/Dialoge/DIA_PAL_250_Garond.d:264","Gut, dann werde ich die Jungs wieder beruhigen. Aber mach so einen Scheiß nie wieder!","De acuerdo, entonces les diré a los chicos que se calmen. ¡Pero que no te vuelva a coger con algo así!","","","DIA_Garond_PETZMASTER_PayNow_10_01","",""
"Scripts/Content/Story/Dialoge/DIA_PAL_250_Garond.d:278","Ich habe nicht genug Gold!","¡No tengo oro suficiente!","","","DIA_Garond_PETZMASTER_PayLater_15_00","",""
"Scripts/Content/Story/Dialoge/DIA_PAL_250_Garond.d:279","Dann solltest du das Gold so schnell wie möglich beschaffen.","Entonces tendrás que conseguir el oro lo antes que puedas.","","","DIA_Garond_PETZMASTER_PayLater_10_01","",""
"Scripts/Content/Story/Dialoge/DIA_PAL_250_Garond.d:280","Und ich warne dich: Mach noch mehr Ärger und es wird teurer für dich!","Y, te lo advierto: si causas más problemas, ¡el precio subirá!","","","DIA_Garond_PETZMASTER_PayLater_10_02","",""
"Scripts/Content/Story/Dialoge/DIA_PAL_250_Garond.d:311","Woher kommst du? Du gehörst weder zu den Schürftruppen, noch zu meinen Leuten. Also?","¿De dónde vienes? No eres uno de los raspadores y no eres uno de los míos. ¿Y bien?","","","DIA_Garond_Hello_10_00","",""
"Scripts/Content/Story/Dialoge/DIA_PAL_250_Garond.d:312","Ich bin über den Pass gekommen.","Vengo del otro lado del paso.","","","DIA_Garond_Hello_15_01","",""
"Scripts/Content/Story/Dialoge/DIA_PAL_250_Garond.d:313","Über den Pass ...? Du hast es tatsächlich geschafft - bei Innos!","¿Por el paso...? Has cruzado, ¡por Innos!","","","DIA_Garond_Hello_10_02","",""
"Scripts/Content/Story/Dialoge/DIA_PAL_250_Garond.d:317","Warum hast du diesen Weg auf dich genommen, Magier?","¿Por qué has elegido este camino, mago?","","","DIA_Garond_Hello_10_03","",""
"Scripts/Content/Story/Dialoge/DIA_PAL_250_Garond.d:321","Wie lautet dein Befehl, Soldat?","Soldado, ¿cuáles son tus órdenes?","","","DIA_Garond_Hello_10_04","",""
"Scripts/Content/Story/Dialoge/DIA_PAL_250_Garond.d:325","Ich frage mich, warum ein Söldner das alles auf sich nimmt. Was willst du hier?","Me pregunto por qué un mercenario querría meterse en todo esto. ¿Qué haces aquí?","","","DIA_Garond_Hello_10_05","",""
"Scripts/Content/Story/Dialoge/DIA_PAL_250_Garond.d:338","Ich komme von Lord Hagen. ","Vengo de parte de lord Hagen.","","","DIA_Garond_NeedProof.description","",""
"Scripts/Content/Story/Dialoge/DIA_PAL_250_Garond.d:353","Ich komme von Lord Hagen. Er will, dass ich ihm einen Beweis für die Anwesenheit der Drachen bringe.","Vengo por encargo de lord Hagen. Quiere que le lleve pruebas de la presencia de dragones.","","","DIA_Garond_NeedProof_15_00","",""
"Scripts/Content/Story/Dialoge/DIA_PAL_250_Garond.d:354","Und du bist hergekommen, um ihn dir abzuholen und wieder zu verschwinden?","¿Y has venido para recogerlas y volver a desaparecer?","","","DIA_Garond_NeedProof_10_01","",""
"Scripts/Content/Story/Dialoge/DIA_PAL_250_Garond.d:355","So hatte ich mir das vorgestellt.","Ésa es mi intención.","","","DIA_Garond_NeedProof_15_02","",""
"Scripts/Content/Story/Dialoge/DIA_PAL_250_Garond.d:356","Er will also einen Beweis? Den kann er haben. Aber ich kann dich nicht zu Lord Hagen zurückschicken, ohne ihm Auskunft über das Erz zu erteilen.","¿Así que quiere pruebas? Las tendrá. Pero no te puedo enviar de vuelta con lord Hagen sin darle información acerca del mineral.","","","DIA_Garond_NeedProof_10_03","",""
"Scripts/Content/Story/Dialoge/DIA_PAL_250_Garond.d:357","Hör zu - Lord Hagen muss unbedingt erfahren, wie unsere Situation hier ist und wie viel Erz wir bisher gefördert haben.","Escucha, lord Hagen tiene que comprender, sin lugar a dudas, cuál es la situación aquí y cuánto mineral hemos conseguido hasta ahora.","","","DIA_Garond_NeedProof_10_04","",""
"Scripts/Content/Story/Dialoge/DIA_PAL_250_Garond.d:358","Okay, was soll ich für dich tun?","De acuerdo, ¿qué quieres que haga por ti?","","","DIA_Garond_NeedProof_15_05","",""
"Scripts/Content/Story/Dialoge/DIA_PAL_250_Garond.d:359","Ich habe drei Schürftrupps da draußen, aber die haben mir nicht einen Erzbrocken geschickt.","He enviado tres grupos de raspadores, pero no me han mandado ni una triste pepita.","","","DIA_Garond_NeedProof_10_06","",""
"Scripts/Content/Story/Dialoge/DIA_PAL_250_Garond.d:360","Such die Schürfstellen auf und berichte mir, wie viel Erz sie gelagert haben.","Visita las minas y dime cuánto mineral han extraído.","","","DIA_Garond_NeedProof_10_07","",""
"Scripts/Content/Story/Dialoge/DIA_PAL_250_Garond.d:361","Dann werde ich ein Schreiben für dich aufsetzen, mit dem du zu Lord Hagen zurückkehren wirst.","Luego te escribiré una carta que llevarás a lord Hagen.","","","DIA_Garond_NeedProof_10_08","",""
"Scripts/Content/Story/Dialoge/DIA_PAL_250_Garond.d:362","Na schön - schätze, mir bleibt keine Wahl.","Bueno, supongo que no tengo elección.","","","DIA_Garond_NeedProof_15_09","",""
"Scripts/Content/Story/Dialoge/DIA_PAL_250_Garond.d:385","Aber warum ausgerechnet ich? ","Pero, ¿por qué, de entre todos, yo?","","","DIA_Garond_Why.description","",""
"Scripts/Content/Story/Dialoge/DIA_PAL_250_Garond.d:399","Aber warum ausgerechnet ich?","Pero, ¿por qué me eliges a mí?","","","DIA_Garond_Why_15_00","",""
"Scripts/Content/Story/Dialoge/DIA_PAL_250_Garond.d:400","Weil du einen Weg durch die Orkreihen kennst. Meine Jungs wären da draußen hoffnungslos verloren.","Porque sabes atravesar las líneas orcas. Mis chicos no tendrían ninguna oportunidad.","","","DIA_Garond_Why_10_01","",""
"Scripts/Content/Story/Dialoge/DIA_PAL_250_Garond.d:401","Du hast es hingegen schon einmal geschafft durchzukommen - das macht dich zum besten Mann für diesen Job.","Por otra parte, te las has arreglado para pasar una vez, eso te hace el mejor para este trabajo.","","","DIA_Garond_Why_10_02","",""
"Scripts/Content/Story/Dialoge/DIA_PAL_250_Garond.d:413","Ich brauche Ausrüstung. ","Necesito equipo.","","","DIA_Garond_Equipment.description","",""
"Scripts/Content/Story/Dialoge/DIA_PAL_250_Garond.d:429","Ich brauche Ausrüstung.","Necesito equipo.","","","DIA_Garond_Equipment_15_00","",""
"Scripts/Content/Story/Dialoge/DIA_PAL_250_Garond.d:433","Sprich mit dem Magier Milten hier in der Burg. Er kennt sich mit den Sachen aus, die du benötigen wirst.","Habla con Milten, el mago, que está en el castillo. Podrá ayudarte con las cosas que necesitas.","","","DIA_Garond_Equipment_10_01","",""
"Scripts/Content/Story/Dialoge/DIA_PAL_250_Garond.d:438","Kläre das mit Tandor. Er wird dich mit allem versorgen, was du brauchst.","Habla de eso con Tandor. Él te conseguirá todo lo que necesites.","","","DIA_Garond_Equipment_10_02","",""
"Scripts/Content/Story/Dialoge/DIA_PAL_250_Garond.d:454","Wieviel zahlst du mir für den Job?","¿Cuánto me pagarás por este trabajo?","","","DIA_Garond_zahlen.description","",""
"Scripts/Content/Story/Dialoge/DIA_PAL_250_Garond.d:469","Wieviel zahlst du mir für den Job?","¿Cuánto me pagarás por este trabajo?","","","DIA_Garond_zahlen_15_00","",""
"Scripts/Content/Story/Dialoge/DIA_PAL_250_Garond.d:470","(verärgert) Ich bin es nicht gewohnt, mit Söldnern zu handeln.","(Irritado) No suelo regatear con mercenarios.","","","DIA_Garond_zahlen_10_01","",""
"Scripts/Content/Story/Dialoge/DIA_PAL_250_Garond.d:471","Aber gut, mir bleibt wohl nicht keine andere Wahl. Ich zahle dir 500 Goldstücke, wenn du die Mission für mich erledigst.","Bien, supongo que no tengo elección. Te pagaré 500 monedas de oro si te encargas de la misión.","","","DIA_Garond_zahlen_10_02","",""
"Scripts/Content/Story/Dialoge/DIA_PAL_250_Garond.d:483","Wo finde ich die Schürfstellen?","¿Dónde están las minas?","","","DIA_Garond_Wo.description","",""
"Scripts/Content/Story/Dialoge/DIA_PAL_250_Garond.d:497","Wo finde ich die Schürfstellen?","¿Dónde están las minas?","","","DIA_Garond_Wo_15_00","",""
"Scripts/Content/Story/Dialoge/DIA_PAL_250_Garond.d:498","Hier, nimm diese Karte. Dort sind die zwei Gebiete eingezeichnet, in denen sich die Schürfstellen befinden.","Toma este mapa. Muestra dos zonas en las que están las minas.","","","DIA_Garond_Wo_10_01","",""
"Scripts/Content/Story/Dialoge/DIA_PAL_250_Garond.d:503","Falls du noch weitere Fragen hast, wende dich an Parcival. Er wird dich mit allen Informationen über die Schürfer versorgen.","Si tienes más preguntas, pregunta a Parcival. Te podrá decir todo lo que necesites acerca de los raspadores.","","","DIA_Garond_Wo_10_02","",""
"Scripts/Content/Story/Dialoge/DIA_PAL_250_Garond.d:510","Verdammt! Was ist da draußen eigentlich los? Ist Beliar selbst gekommen, um uns zu vernichten?","¡Maldición! ¿Qué está pasando ahí fuera? ¿Es que ha venido el mismo Beliar a acabar con nosotros?","","","B_Garond_OreCounter3_10_00","",""
"Scripts/Content/Story/Dialoge/DIA_PAL_250_Garond.d:511","Meine Männer sind fast alle tot und mit dem bisschen Erz können wir NICHT MAL EINEN ORK AUFHALTEN - GESCHWEIGE DENN EINE ARMEE!","Mis hombres están casi todos muertos y con el poco mineral que tenemos, ¡NO PODEMOS PARAR A UN ORCO Y MUCHO MENOS A UN EJÉRCITO!","","","B_Garond_OreCounter3_10_01","",""
