"location","source","target","id","fuzzy","context","translator_comments","developer_comments"
"Scripts/Content/Story/B_AssignAmbientInfos/B_AssignDragonTalk_Main.d:130","Du brauchst eine Rune, die nur für dich angefertigt wurde.","Necesitas una runa creada para ti.","","","DIA_Dragons_Add_20_02","",""
"Scripts/Content/Story/B_AssignAmbientInfos/B_AssignDragonTalk_Main.d:134","Du brauchst eine Waffe, die nur für dich angefertigt wurde.","Necesitas un arma forjada para ti.","","","DIA_Dragons_Add_20_00","",""
"Scripts/Content/Story/B_AssignAmbientInfos/B_AssignDragonTalk_Main.d:137","Aber die wohl schwierigste aller Bedingungen ist, dass du fünf Gefährten für dich gewinnen musst, die dir in den Tod folgen würden.","Pero la condición más difícil es que debes conseguir cinco compańeros que te sigan hasta la muerte.","","","DIA_DragonTalk_Main_3_20_08","",""
"Scripts/Content/Story/B_AssignAmbientInfos/B_AssignDragonTalk_Main.d:138","Erst dann und nur dann kannst du es wagen, dem Meister zu begegnen.","Solo entonces podrás atreverte a enfrentarte al amo.","","","DIA_DragonTalk_Main_3_20_09","",""
"Scripts/Content/Story/B_AssignAmbientInfos/B_AssignDragonTalk_Main.d:151","Wie kann ich euren Meister finden?","żCómo puedo encontrar a tu amo?","","","DIA_DragonTalk_Main_4.description","",""
"Scripts/Content/Story/B_AssignAmbientInfos/B_AssignDragonTalk_Main.d:164","Wie kann ich euren Meister finden?","żCómo puedo encontrar a tu amo?","","","DIA_DragonTalk_Main_4_15_00","",""
"Scripts/Content/Story/B_AssignAmbientInfos/B_AssignDragonTalk_Main.d:165","Er hat seinen Hort im festem Fels der heiligen Hallen von Irdorath errichtet und wartet dort auf die Erfüllung seines Schicksals.","Tiene su cubil en la roca maciza de los salones de Irdorath y allí espera su destino.","","","DIA_DragonTalk_Main_4_20_01","",""
"Scripts/Content/Story/B_AssignAmbientInfos/B_AssignDragonTalk_Main.d:166","Auf dass er dieser Welt die Ordnung zurückgebe, die sie verdient, verweilt er dort in tiefer Meditation und ...","Hasta que pueda restaurar el orden que se merece este mundo, allí espera meditando y...","","","DIA_DragonTalk_Main_4_20_02","",""
"Scripts/Content/Story/B_AssignAmbientInfos/B_AssignDragonTalk_Main.d:167","Verschone mich mit den Einzelheiten. Sag mir lieber, wo ich diese heiligen Hallen von Irdorath finde.","Ahórrate los detalles. Dime dónde están los salones sagrados de Irdorath.","","","DIA_DragonTalk_Main_4_15_03","",""
"Scripts/Content/Story/B_AssignAmbientInfos/B_AssignDragonTalk_Main.d:168","Ha, ha, ha. Du enttäuschst mich, kleiner Mann. Hast du doch allen Gefahren getrotzt, fast alle von uns bezwungen und scheiterst nun an deinem Unvermögen, das obere Wissen anzuwenden.","Ja, ja, ja. Me decepcionas, hombrecillo. Has afrontado todos los peligros y casi nos vences a todos, pero no consigues aprovechar la información importante.","","","DIA_DragonTalk_Main_4_20_04","",""
"Scripts/Content/Story/B_AssignAmbientInfos/B_AssignDragonTalk_Main.d:169","Wenn dir Irdorath kein Begriff ist, dann solltest du besser zu deinen Magiern gehen und sie bitten, dich um ihre weltlichen Belange kümmern zu dürfen.","Si Irdorath no significa nada para ti, sería mejor que vayas a ver a los magos y les pidas que se ocupen ellos de sus asuntos mundanos.","","","DIA_DragonTalk_Main_4_20_05","",""
"Scripts/Content/Story/B_AssignAmbientInfos/B_AssignDragonTalk_Main.d:170","Denn ganz offensichtlich bist du noch nicht bereit für die hohe Bürde ihres oberen Wissens.","Resulta evidente que no estás preparado para soportar la pesada carga de su conocimiento superior.","","","DIA_DragonTalk_Main_4_20_06","",""
"Scripts/Content/Story/B_AssignAmbientInfos/B_AssignDragonTalk_Rock.d:26","Genug der Worte. Deine kurzweilige Macht ist dahin. Das Auge ist kraftlos. Jetzt wirst du sterben.","Basta de charla. Se ha agotado tu poder temporal. El Ojo ha perdido su fuerza. Prepárate para morir.","","","DIA_Dragon_Rock_Exit_20_00","",""
"Scripts/Content/Story/B_AssignAmbientInfos/B_AssignDragonTalk_Rock.d:54","Noch so ein vermessener Wicht, der sich auf meinen Felsen traut. Ihr kleinen Menschen. So mutig, doch so zerbrechlich.","Otro individuo presuntuoso que osa escalar mi roca. Los hombrecillos sois valientes, pero muy frágiles.","","","DIA_Dragon_Rock_Hello_20_00","",""
"Scripts/Content/Story/B_AssignAmbientInfos/B_AssignDragonTalk_Rock.d:57","Du kannst tatsächlich sprechen.","Anda, si sabes hablar.","","","DIA_Dragon_Rock_Hello_15_01","",""
"Scripts/Content/Story/B_AssignAmbientInfos/B_AssignDragonTalk_Rock.d:60","Ich werde dir die Eingeweide herausreißen und dich an die Ratten verfüttern.","Te arrancaré las entrańas y se las echaré a las ratas.","","","DIA_Dragon_Rock_Hello_20_02","",""
"Scripts/Content/Story/B_AssignAmbientInfos/B_AssignDragonTalk_Rock.d:61","Nicht so schnell. Ich trage das Auge Innos bei mir. Du wirst mir gehorchen und mir meine Fragen beantworten.","No tan deprisa. Llevo encima el Ojo de Innos. Vas a obedecerme y a responder mis preguntas.","","","DIA_Dragon_Rock_Add_15_00","",""
"Scripts/Content/Story/B_AssignAmbientInfos/B_AssignDragonTalk_Rock.d:62","(Brüllt) Arrh. Stell deine Fragen.","(Brama) Arrh. Pregunta.","","","DIA_Dragon_Rock_Hello_20_04","",""
"Scripts/Content/Story/B_AssignAmbientInfos/B_AssignDragonTalk_Rock.d:73","Wer bist du?","żQuién eres tú?","","","DIA_Dragon_Rock_WERBISTDU.description","",""
"Scripts/Content/Story/B_AssignAmbientInfos/B_AssignDragonTalk_Rock.d:86","Wer bist du?","żQuién eres tú?","","","DIA_Dragon_Rock_WERBISTDU_15_00","",""
"Scripts/Content/Story/B_AssignAmbientInfos/B_AssignDragonTalk_Rock.d:87","Ich heiße Pedrakhan und ich werde dir ganz langsam das Fell abziehen, wenn ich dich zu fassen kriege.","Me llaman Pedrakhan y cuando te coja voy a despellejarte muy despacio.","","","DIA_Dragon_Rock_WERBISTDU_20_01","",""
"Scripts/Content/Story/B_AssignAmbientInfos/B_AssignDragonTalk_Rock.d:98","Wer von euch Drachen ist der Stärkste?","żQuién es el dragón más fuerte?","","","DIA_Dragon_Rock_HIERARCHIE.description","",""
"Scripts/Content/Story/B_AssignAmbientInfos/B_AssignDragonTalk_Rock.d:111","Wer von euch Drachen ist der Stärkste?","żQuién es el dragón más fuerte?","","","DIA_Dragon_Rock_HIERARCHIE_15_00","",""
"Scripts/Content/Story/B_AssignAmbientInfos/B_AssignDragonTalk_Rock.d:112","Unsere Macht beziehen wir aus den Elementen dieser Welt. Ihre Hierarchie ist klar und einfach.","Nuestro poder procede de los elementos de este mundo. Su jerarquía es evidente.","","","DIA_Dragon_Rock_HIERARCHIE_20_01","",""
"Scripts/Content/Story/B_AssignAmbientInfos/B_AssignDragonTalk_Rock.d:113","Aus weicher Erde geformtes Land spendet Leben für alle Kreaturen unter der Sonne. Doch verschlingt es dich mit Haut und Haaren, wenn man ihm zu nahe kommt.","La tierra da la vida a todas las criaturas que ilumina el sol, pero se abrirá y te tragará si te acercas demasiado a ella.","","","DIA_Dragon_Rock_HIERARCHIE_20_02","",""
"Scripts/Content/Story/B_AssignAmbientInfos/B_AssignDragonTalk_Rock.d:114","Mit Stolz erhebt sich der Fels, der lieber bricht, als jemals nachzugeben, und begräbt so die Unachtsamen unter sich. Und doch bietet er den besten Schutz vor den Gezeiten.","La roca, que prefiere quebrarse a ceder, se eleva con orgullo y entierra bajo ella a los incautos. Aun así, es la mejor protección ante las mareas.","","","DIA_Dragon_Rock_HIERARCHIE_20_03","",""
"Scripts/Content/Story/B_AssignAmbientInfos/B_AssignDragonTalk_Rock.d:115","Der Funke des Lebens lebt in den tiefen Feuern dieser Erde. Und doch verbrennt das Feuer alles in einem Atemzug und hinterlässt nicht mehr als Asche.","Los fuegos de las entrańas del mundo albergan la chispa de la vida, aunque el fuego lo abrasa todo en un suspiro y no deja más que cenizas.","","","DIA_Dragon_Rock_HIERARCHIE_20_04","",""
"Scripts/Content/Story/B_AssignAmbientInfos/B_AssignDragonTalk_Rock.d:116","Alle unsere Elemente erhalten und zerstören. Nur im zu hartem Guss erstarrten Wasser wird alles zur ewig verweilenden Salzsäule, wo kaum Leben möglich ist.","Todos nuestros elementos preservan y destruyen. No obstante, solo en agua que se ha vuelto dura y maciza como una roca todo se transformará en un pilar eterno de sal donde la vida apenas podrá subsistir.","","","DIA_Dragon_Rock_HIERARCHIE_20_05","",""
"Scripts/Content/Story/B_AssignAmbientInfos/B_AssignDragonTalk_Swamp.d:26","Die Macht des Auges ist verbraucht. Dein Leben endet hier, Mensch.","El poder del Ojo se agota. Aquí acaba tu existencia, humano.","","","DIA_Dragon_Swamp_Exit_20_00","",""
"Scripts/Content/Story/B_AssignAmbientInfos/B_AssignDragonTalk_Swamp.d:74","Wehe dir, wenn du noch einen Schritt näher kommst!","ˇAy de ti si te acercas un paso más!","","","DIA_Dragon_Swamp_Hello_20_00","",""
"Scripts/Content/Story/B_AssignAmbientInfos/B_AssignDragonTalk_Swamp.d:78","Ah. Das Auge Innos' scheint zu funktionieren.","Ah. Parece que el Ojo de Innos funciona.","","","DIA_Dragon_Swamp_Hello_15_01","",""
"Scripts/Content/Story/B_AssignAmbientInfos/B_AssignDragonTalk_Swamp.d:81","Es kamen schon viele deiner Art. Ich habe sie alle hinweg gefegt.","Han venido muchos como tú, y acabé con todos.","","","DIA_Dragon_Swamp_Hello_20_02","",""
"Scripts/Content/Story/B_AssignAmbientInfos/B_AssignDragonTalk_Swamp.d:82","Spar dir die Mühe. Du machst mir keine Angst mit deinen Sprüchen, du stinkende Ausgeburt der Hölle.","No gastes saliva. Tu palabrería no me asusta, apestoso engendro infernal.","","","DIA_Dragon_Swamp_Hello_15_03","",""
"Scripts/Content/Story/B_AssignAmbientInfos/B_AssignDragonTalk_Swamp.d:83","Sag mir, was ich wissen will oder ich werde dich in deinem Blut ertrinken lassen.","Dime lo que quiero saber o haré que te ahogues en tu propia sangre.","","","DIA_Dragon_Swamp_Hello_15_04","",""
"Scripts/Content/Story/B_AssignAmbientInfos/B_AssignDragonTalk_Swamp.d:84","Ha, ha, ha. Du kleiner Wurm wagst es, mir zu drohen? Nenn mir nur einen Grund, warum ich dich nicht gleich in tausend Stücke zerfetze.","Ja, ja, ja. żOsas amenazarme, gusano? Dame una razón para que no te haga mil pedazos ahora mismo.","","","DIA_Dragon_Swamp_Hello_20_05","",""
"Scripts/Content/Story/B_AssignAmbientInfos/B_AssignDragonTalk_Swamp.d:85","Ich bin ein Gesandter Innos' und trage das geweihte Auge bei mir. Du hast keine Wahl. Du wirst dich meinem Willen beugen oder ich werde dich vernichten.","Soy un emisario de Innos y llevo encima el Ojo sagrado. No te queda más remedio. Debes someterte a mi voluntad si no quieres ser destruido.","","","DIA_Dragon_Swamp_Hello_15_06","",""
"Scripts/Content/Story/B_AssignAmbientInfos/B_AssignDragonTalk_Swamp.d:86","(Brüllt) Arrh. Sag, was du von mir willst.","(Brama) Arrh. Dime qué quieres de mí.","","","DIA_Dragon_Swamp_Hello_20_07","",""
"Scripts/Content/Story/B_AssignAmbientInfos/B_AssignDragonTalk_Swamp.d:97","Wer bist du?","żQuién eres tú?","","","DIA_Dragon_Swamp_WERBISTDU.description","",""
"Scripts/Content/Story/B_AssignAmbientInfos/B_AssignDragonTalk_Swamp.d:110","Wer bist du?","żQuién eres tú?","","","DIA_Dragon_Swamp_WERBISTDU_15_00","",""
"Scripts/Content/Story/B_AssignAmbientInfos/B_AssignDragonTalk_Swamp.d:111","Mein Name ist Pandrodor. Und du wärest gut beraten, wenn du wieder unter den Stein kriechst, unter dem du hervorgekrochen bist.","Me llamo Pandrodor. Harías bien en volver a escabullirte bajo la roca de la que has salido.","","","DIA_Dragon_Swamp_WERBISTDU_20_01","",""
"Scripts/Content/Story/B_AssignAmbientInfos/B_AssignDragonTalk_Swamp.d:122","Wo finde ich den Rest von euch widerlichen Kreaturen?","żDónde puedo encontrar a las demás criaturas repugnantes?","","","DIA_Dragon_Swamp_WOSINDDIEANDEREN.description","",""
"Scripts/Content/Story/B_AssignAmbientInfos/B_AssignDragonTalk_Swamp.d:135","Wo finde ich den Rest von euch widerlichen Kreaturen?","żDónde puedo encontrar a las demás criaturas repugnantes?","","","DIA_Dragon_Swamp_WOSINDDIEANDEREN_15_00","",""
"Scripts/Content/Story/B_AssignAmbientInfos/B_AssignDragonTalk_Swamp.d:136","Die Elemente, aus denen alles gemacht ist, halten diese Welt zusammen.","Los elementos son la materia prima de todo y mantienen unido el mundo.","","","DIA_Dragon_Swamp_WOSINDDIEANDEREN_20_01","",""
"Scripts/Content/Story/B_AssignAmbientInfos/B_AssignDragonTalk_Swamp.d:137","Jedes einzelne steht für die Fähigkeit, einen Teil der Welt zu kontrollieren.","Cada uno representa la capacidad de controlar una parte del mundo.","","","DIA_Dragon_Swamp_WOSINDDIEANDEREN_20_02","",""
"Scripts/Content/Story/B_AssignAmbientInfos/B_AssignDragonTalk_Swamp.d:138","Suche nach den Elementen und du wirst die anderen finden.","Busca los elementos y encontrarás a los demás.","","","DIA_Dragon_Swamp_WOSINDDIEANDEREN_20_03","",""
"Scripts/Content/Story/B_AssignAmbientInfos/B_AssignOrc_AntiPaladinTalk.d:10","KHROKGNAR! Meister sagen, du jetzt Paladin. Meister hatte Recht. Meister hatte immer Recht.","ˇKHROKGNAR! ˇAmo decir que tú ser paladín ahora! Amo tener razón. Amo siempre tener razón.","","","DIA_ORC_AntiPaladin_18_01","",""
"Scripts/Content/Story/B_AssignAmbientInfos/B_AssignOrc_AntiPaladinTalk.d:11","Wir Anführer der stolzen Orkarmee nun selbst kommen, um großen Paladin zu töten.","Nosotros, jefes de orgulloso ejército orco, venir a matar gran paladín.","","","DIA_ORC_AntiPaladin_18_02","",""
"Scripts/Content/Story/B_AssignAmbientInfos/B_AssignOrc_AntiPaladinTalk.d:12","Hagen werden untergehen mit seinen Mannen. Auch du nicht ihnen helfen können.","Hagen y sus hombres ir a ser aniquilados. Ni siquiera tú poder ayudarles.","","","DIA_ORC_AntiPaladin_18_03","",""
"Scripts/Content/Story/B_AssignAmbientInfos/B_AssignOrc_AntiPaladinTalk.d:17","Meister sagen Orkanführer, bringen Kopf von großen Paladin. Du jetzt sterben durch meine Hand. KHROKGNAR!","Amo decir que jefes orcos llevar cabeza de gran paladín. Tú morir a mis manos. ˇKHROKGNAR!","","","DIA_ORC_AntiPaladin_18_04","",""
"Scripts/Content/Story/B_AssignAmbientInfos/B_AssignOrc_AntiPaladinTalk.d:21","Wir Ork-Anführer jetzt selbst gekommen, dich zu töten, Paladin.","Nosotros, jefes orcos, venir a matarte, paladín.","","","DIA_ORC_AntiPaladin_18_05","",""
"Scripts/Content/Story/B_AssignAmbientInfos/B_AssignOrc_AntiPaladinTalk.d:25","KHROKGNAR! Wir dich töten, Paladin.","ˇKHROKGNAR! Nosotros matarte, paladín.","","","DIA_ORC_AntiPaladin_18_06","",""
"Scripts/Content/Story/B_AssignAmbientInfos/B_AssignSchiffswachenTalk.d:11","Wir beobachten dich. Denk daran.","Recuerda que estamos pendientes de ti.","","","DIA_Pal_Schiffswache_Ambient_04_00","",""
"Scripts/Content/Story/B_AssignAmbientInfos/B_AssignSchiffswachenTalk.d:16","Mach keinen Mist, solange du hier bist.","No te metas en líos mientras estés aquí.","","","DIA_Pal_Schiffswache_Ambient_09_01","",""
"Scripts/Content/Story/B_AssignAmbientInfos/B_AssignSchiffswachenTalk.d:21","Lass dir nicht einfallen, hier was zu klauen, klar?","Ni se te ocurra robar nada, żte enteras?","","","DIA_Pal_Schiffswache_Ambient_12_02","",""
"Scripts/Content/Story/B_AssignAmbientInfos/B_AssignSchiffswachenTalk.d:60","Die verdammten Orks haben Garonds Burg gestürmt. Wir müssen sofort handeln.","Los malditos orcos han atacado el castillo de Garond. Tenemos que actuar de inmediato.","","","DIA_Pal_Schiffswache_AmbientKap5_04_00","",""
"Scripts/Content/Story/B_AssignAmbientInfos/B_AssignSchiffswachenTalk.d:65","Wenn wir den Verräter zu fassen kriegen, der das Haupttor der Burg geöffnet hat, machen wir kurzen Prozess mit ihm.","Como cojamos al traidor que abrió la puerta principal del castillo, nos lo cargamos.","","","DIA_Pal_Schiffswache_AmbientKap5_09_01","",""
"Scripts/Content/Story/B_AssignAmbientInfos/B_AssignSchiffswachenTalk.d:70","Wir können nicht mehr lange warten. Unsere Jungs im Minental brauchen unsere Hilfe, bevor der nächste Orksturm kommt.","No podemos esperar mucho más. Los muchachos del Valle de las Minas necesitan nuestra ayuda antes de que ataque la siguiente oleada de orcos.","","","DIA_Pal_Schiffswache_AmbientKap5_12_02","",""
"Scripts/Content/Story/B_AssignAmbientInfos/B_AssignSchiffswachenTalk.d:77","Garond hat zur allgemeinen Mobilmachung aufgerufen. Bald brechen wir auf ins Minental.","Garond ha ordenado una movilización general. No tardaremos en ir al Valle de las Minas.","","","DIA_Pal_Schiffswache_AmbientKap5_04_03","",""
"Scripts/Content/Story/B_AssignAmbientInfos/B_AssignSchiffswachenTalk.d:82","Jetzt treten wir den Orks in den Arsch!","Los orcos por fin van a recibir su merecido.","","","DIA_Pal_Schiffswache_AmbientKap5_09_04","",""
"Scripts/Content/Story/B_AssignAmbientInfos/B_AssignSchiffswachenTalk.d:87","Ich kann's kaum erwarten, den Orks die Stirn zu bieten. Bald geht es los.","Tengo muchas ganas de dar un escarmiento a los orcos. Ya queda poco.","","","DIA_Pal_Schiffswache_AmbientKap5_12_05","",""
"Scripts/Content/Story/B_AssignAmbientInfos/B_AssignToughGuyNews.d:45","... ich will aber nicht mit dir reden ...","…pero no quiero hablar contigo","","","DIA_Addon_Skinner_ToughguyNews_08_00","",""
"Scripts/Content/Story/B_AssignAmbientInfos/B_BDT_10xx_Fluechtling.d:7","Vergiss es. Ich geh nicht mehr in den Knast.","Ni hablar. No voy a volver a la cárcel.","","","DIA_B_DIA_BDT_10XX_Fluechtling_07_00","",""
"Scripts/Content/Story/B_AssignAmbientInfos/B_BDT_10xx_Fluechtling.d:12","Du bist doch nicht etwa gekommen, um uns zurück ins Gefängnis zu bringen, oder?","No has venido a devolvernos a la cárcel, żverdad?","","","DIA_B_DIA_BDT_10XX_Fluechtling_06_00","",""
"Scripts/Content/Story/B_AssignAmbientInfos/B_BDT_10xx_Fluechtling.d:60","Wenn du nicht im Knast landen willst, solltest du dich besser von mir fern halten.","Será mejor que os alejéis de mí si no queréis acabar en la cárcel.","","","DIA_BDT_1031_Fluechtling_Tip1_07_00","",""
"Scripts/Content/Story/B_AssignAmbientInfos/B_BDT_10xx_Fluechtling.d:66","Ich habe nicht vor, dich zu verpfeifen.","No pienso chivarme.","","","DIA_BDT_1031_Fluechtling_Tip1.DIA_BDT_1031_Fluechtling_Tip1_frei","Info_AddChoice",""
"Scripts/Content/Story/B_AssignAmbientInfos/B_BDT_10xx_Fluechtling.d:67","Ich bin hier um dich zu verhaften.","He venido a arrestarte.","","","DIA_BDT_1031_Fluechtling_Tip1.DIA_BDT_1031_Fluechtling_Tip1_Knast","Info_AddChoice",""
"Scripts/Content/Story/B_AssignAmbientInfos/B_BDT_10xx_Fluechtling.d:68","Wo ist euer Anführer Morgahard?","żDonde está vuestro jefe Morgahard?","","","DIA_BDT_1031_Fluechtling_Tip1.DIA_BDT_1031_Fluechtling_Tip1_Morgahard","Info_AddChoice",""
"Scripts/Content/Story/B_AssignAmbientInfos/B_BDT_10xx_Fluechtling.d:74","Wo ist euer Anführer Morgahard?","żDonde está vuestro jefe Morgahard?","","","DIA_BDT_1031_Fluechtling_Tip1_Morgahard_15_00","",""
"Scripts/Content/Story/B_AssignAmbientInfos/B_BDT_10xx_Fluechtling.d:75","Wir haben uns getrennt, um nicht so schnell erwischt zu werden. Keine Ahnung, wo die anderen sind.","Nos separamos para que tardaran más en cogernos. No tengo ni idea de dónde están los demás.","","","DIA_BDT_1031_Fluechtling_Tip1_Morgahard_07_01","",""
"Scripts/Content/Story/B_AssignAmbientInfos/B_BDT_10xx_Fluechtling.d:77","Schade. Dann werde ich wohl den Richter holen müssen.","Es una pena. Supongo que tendré que traer al juez.","","","DIA_BDT_1031_Fluechtling_Tip1.DIA_BDT_1031_Fluechtling_Tip1_Morgahard_drohen","Info_AddChoice",""
"Scripts/Content/Story/B_AssignAmbientInfos/B_BDT_10xx_Fluechtling.d:82","Schade. Dann werde ich wohl den Richter holen müssen.","Es una pena. Supongo que tendré que traer al juez.","","","DIA_BDT_1031_Fluechtling_Tip1_Morgahard_drohen_15_00","",""
"Scripts/Content/Story/B_AssignAmbientInfos/B_BDT_10xx_Fluechtling.d:83","Ok, ok. Ich vermute, dass sich einige von uns in der Taverne abgesetzt haben. Aber das hast du nicht von mir gehört, ok?","Vale, vale. Supongo que algunos habrán llegado a la taberna. Pero yo no te he dicho nada, żde acuerdo?","","","DIA_BDT_1031_Fluechtling_Tip1_Morgahard_drohen_07_01","",""
"Scripts/Content/Story/B_AssignAmbientInfos/B_BDT_10xx_Fluechtling.d:89","Ich bin hier, um dich zu verhaften.","He venido a detenerte.","","","DIA_BDT_1031_Fluechtling_Tip1_Knast_15_00","",""
"Scripts/Content/Story/B_AssignAmbientInfos/B_BDT_10xx_Fluechtling.d:90","Nur über meine Leiche.","Por encima de mi cadáver.","","","DIA_BDT_1031_Fluechtling_Tip1_Knast_07_01","",""
"Scripts/Content/Story/B_AssignAmbientInfos/B_BDT_10xx_Fluechtling.d:97","Ich habe nicht vor, dich zu verpfeifen.","No pienso chivarme.","","","DIA_BDT_1031_Fluechtling_Tip1_frei_15_00","",""
"Scripts/Content/Story/B_AssignAmbientInfos/B_BDT_10xx_Fluechtling.d:98","Wenn dich der Richter geschickt hat, dann kannst du ihm von uns bestellen, dass er uns mal gerne haben kann.","Si te envía el juez, puedes decirle que se vaya a la mierda.","","","DIA_BDT_1031_Fluechtling_Tip1_frei_07_01","",""
"Scripts/Content/Story/B_AssignAmbientInfos/B_BDT_10xx_Fluechtling.d:100","Was habt ihr denn verbrochen?","żQué delito cometiste?","","","DIA_BDT_1031_Fluechtling_Tip1.DIA_BDT_1031_Fluechtling_Tip1_frei_verbrechen","Info_AddChoice",""
"Scripts/Content/Story/B_AssignAmbientInfos/B_BDT_10xx_Fluechtling.d:105","Was habt ihr denn verbrochen?","żQué delito cometiste?","","","DIA_BDT_1031_Fluechtling_Tip1_frei_verbrechen_15_00","",""
"Scripts/Content/Story/B_AssignAmbientInfos/B_BDT_10xx_Fluechtling.d:106","Das geht dich nichts an.","No es de tu incumbencia.","","","DIA_BDT_1031_Fluechtling_Tip1_frei_verbrechen_07_01","",""
"Scripts/Content/Story/B_AssignAmbientInfos/B_BDT_10xx_Fluechtling.d:231","(ängstlich) Was willst du von mir?","(Asustado) żQué quieres de mí?","","","DIA_BDT_1033_Fluechtling_Tip2_07_00","",""
"Scripts/Content/Story/B_AssignAmbientInfos/B_BDT_10xx_Fluechtling.d:237","Bleib locker. Ich will nur reden.","Tranquilo. Solo quiero hablar.","","","DIA_BDT_1033_Fluechtling_Tip2.DIA_BDT_1033_Fluechtling_Tip2_frei","Info_AddChoice",""
"Scripts/Content/Story/B_AssignAmbientInfos/B_BDT_10xx_Fluechtling.d:238","Der Richter hat mich geschickt um dich zurück zu bringen.","El juez me ha enviado para llevarte de vuelta.","","","DIA_BDT_1033_Fluechtling_Tip2.DIA_BDT_1033_Fluechtling_Tip2_Knast","Info_AddChoice",""
"Scripts/Content/Story/B_AssignAmbientInfos/B_BDT_10xx_Fluechtling.d:239","Wo ist euer Anführer Morgahard?","żDonde está vuestro jefe Morgahard?","","","DIA_BDT_1033_Fluechtling_Tip2.DIA_BDT_1033_Fluechtling_Tip2_Morgahard","Info_AddChoice",""
"Scripts/Content/Story/B_AssignAmbientInfos/B_BDT_10xx_Fluechtling.d:245","Wo ist euer Anführer Morgahard?","żDonde está vuestro jefe Morgahard?","","","DIA_BDT_1033_Fluechtling_Tip2_Morgahard_15_00","",""
"Scripts/Content/Story/B_AssignAmbientInfos/B_BDT_10xx_Fluechtling.d:246","(ängstlich) Ich will keinen Ärger. Geh zum Großbauern. Er wollte sich bei den Söldnern verstecken. Und jetzt lass mich in Ruhe.","(Asustado) No quiero líos. Ve a ver al terrateniente. Quería esconderse con los mercenarios. Y ahora, déjame en paz.","","","DIA_BDT_1033_Fluechtling_Tip2_Morgahard_07_01","",""
"Scripts/Content/Story/B_AssignAmbientInfos/B_BDT_10xx_Fluechtling.d:252","Der Richter hat mich geschickt, um dich zurück zu bringen.","El juez me ha enviado para llevarte de vuelta.","","","DIA_BDT_1033_Fluechtling_Tip2_Knast_15_00","",""
"Scripts/Content/Story/B_AssignAmbientInfos/B_BDT_10xx_Fluechtling.d:253","(schreit) NEIN.","(Chilla) NO.","","","DIA_BDT_1033_Fluechtling_Tip2_Knast_07_01","",""
"Scripts/Content/Story/B_AssignAmbientInfos/B_BDT_10xx_Fluechtling.d:260","Bleib locker. Ich will nur reden.","Tranquilo. Solo quiero hablar.","","","DIA_BDT_1033_Fluechtling_Tip2_frei_15_00","",""
"Scripts/Content/Story/B_AssignAmbientInfos/B_BDT_10xx_Fluechtling.d:261","Ich will aber nicht mir dir reden. Hau ab. Mann.","Pero yo no quiero hablar contigo. Lárgate, tío.","","","DIA_BDT_1033_Fluechtling_Tip2_frei_07_01","",""
"Scripts/Content/Story/B_AssignAmbientInfos/B_BDT_10xx_Fluechtling.d:263","Du hast du Hosen ganz schön voll, was?","Estás acojonado de verdad, żno?","","","DIA_BDT_1033_Fluechtling_Tip2.DIA_BDT_1033_Fluechtling_Tip2_frei_verbrechen","Info_AddChoice",""
"Scripts/Content/Story/B_AssignAmbientInfos/B_BDT_10xx_Fluechtling.d:268","Du hast die Hosen ganz schön voll, was?","Estás cagado de miedo, żno?","","","DIA_BDT_1033_Fluechtling_Tip2_frei_verbrechen_15_00","",""
"Scripts/Content/Story/B_AssignAmbientInfos/B_BDT_10xx_Fluechtling.d:269","Du hast gut reden. Auf dich wartet ja auch nicht der Galgen, wenn sie dich erwischen.","Habla. Si te cogen, la horca no te espera.","","","DIA_BDT_1033_Fluechtling_Tip2_frei_verbrechen_07_01","",""
"Scripts/Content/Story/B_AssignAmbientInfos/B_Bartok_ShitAnOrc.d:3","(zu sich) Ein Ork direkt vor der Stadt - verdammte Scheiße...","(Para sí) Un orco en las afueras de la ciudad. La leche...","","","DIA_Bartok_Angekommen_04_02","",""
"Scripts/Content/Story/B_AssignAmbientInfos/B_Dragon_Fire_Island.d:51","Bleib stehen, Mensch. Alle meine Sinne sagen mir, dass der Mörder meines eigenen Fleisch und Blutes vor mir steht.","Quieto, humano. Mis sentidos me dicen que tengo ante mí al asesino de los de mi propia carne y sangre.","","","DIA_Dragon_Fire_Island_Hello_20_00","",""
"Scripts/Content/Story/B_AssignAmbientInfos/B_Dragon_Fire_Island.d:52","So? Wen nennst du hier Mörder, du Ausgeburt der Hölle?","żDe verdad? żA quién llamas asesino, engendro infernal?","","","DIA_Dragon_Fire_Island_Hello_15_01","",""
"Scripts/Content/Story/B_AssignAmbientInfos/B_Dragon_Fire_Island.d:57","Dass du fast unsere gesamte Nachkommenschaft vernichtet hast, war dir wohl nicht genug.","żNo te bastó con matar a casi todos nuestros vástagos?","","","DIA_Dragon_Fire_Island_Hello_20_02","",""
"Scripts/Content/Story/B_AssignAmbientInfos/B_Dragon_Fire_Island.d:60","Du hast meinen Bruder Feomathar auf dem Gewissen und dafür wirst du bezahlen.","Mi hermano Feomathar pesa en tu conciencia y pagarás por ello.","","","DIA_Dragon_Fire_Island_Hello_20_03","",""
