"location","source","target","id","fuzzy","context","translator_comments","developer_comments"
"Scripts/Content/Story/B_AssignAmbientInfos/B_Addon_GivePotion.d:12","(Heiltrank geben)","(dar poción de curación)","","","DIA_Addon_GivePotion.description","",""
"Scripts/Content/Story/B_AssignAmbientInfos/B_Addon_GivePotion.d:35","(Elixier der Heilung geben)","(dar elixir de curación)","","","DIA_Addon_GivePotion.DIA_Addon_GivePotion_ItPo_Health_03","Info_AddChoice",""
"Scripts/Content/Story/B_AssignAmbientInfos/B_Addon_GivePotion.d:40","(Extrakt der Heilung geben)","(dar extracto de curación)","","","DIA_Addon_GivePotion.DIA_Addon_GivePotion_ItPo_Health_02","Info_AddChoice",""
"Scripts/Content/Story/B_AssignAmbientInfos/B_Addon_GivePotion.d:45","(Essenz der Heilung geben)","(dar esencia de curación)","","","DIA_Addon_GivePotion.DIA_Addon_GivePotion_ItPo_Health_01","Info_AddChoice",""
"Scripts/Content/Story/B_AssignAmbientInfos/B_Addon_GivePotion.d:52","Hier, nimm den Heiltrank.","Ten, tómate la poción de curación.","","","DIA_Addon_Brandon_GivePotion_15_00","",""
"Scripts/Content/Story/B_AssignAmbientInfos/B_Addon_Myxir_TeachRequest.d:6","Lehre mich die fremde Sprache.","Enséńame ese idioma.","","","DIA_Addon_Myxir_TeachRequest_15_00","",""
"Scripts/Content/Story/B_AssignAmbientInfos/B_Addon_Myxir_TeachRequest.d:11","Fangen wir erst einmal einfach an. Ich kann dich zu Anfang die Sprache der Bauern lehren.","Empezaremos con algo fácil. Para comenzar, te enseńaré el idioma de los campesinos.","","","DIA_Addon_Myxir_TeachL1_12_00","",""
"Scripts/Content/Story/B_AssignAmbientInfos/B_Addon_Myxir_TeachRequest.d:12","Texte, die in der Sprache der Bauern geschrieben sind, handeln in der Regel von weltlichen Belangen, wie Arbeit, Liebe oder die Beschaffung von Lebensmitteln.","Como norma general, los textos en idioma campesino tratan de asuntos como el trabajo, el amor o cómo conseguir comida.","","","DIA_Addon_Myxir_TeachL1_12_01","",""
"Scripts/Content/Story/B_AssignAmbientInfos/B_Addon_Myxir_TeachRequest.d:13","Es war die gemeine Sprache der Stadt. Die meisten Texte, die man hier findet, wirst du damit verstehen können.","Era el idioma común de la ciudad. Si lo conoces, podrás comprender casi todos los textos que encuentres aquí.","","","DIA_Addon_Myxir_TeachL1_12_02","",""
"Scripts/Content/Story/B_AssignAmbientInfos/B_Addon_Myxir_TeachRequest.d:18","Die Sprache der Bauern kennst du ja bereits. Die Sprache der Krieger ist schon etwas schwieriger.","Ya conoces el idioma de los campesinos. El de los guerreros es algo más difícil.","","","DIA_Addon_Myxir_TeachL2_12_00","",""
"Scripts/Content/Story/B_AssignAmbientInfos/B_Addon_Myxir_TeachRequest.d:19","Texte, die in der Sprache der Krieger geschrieben wurden, handeln meistens von Waffen und dem Krieg. Du wirst einige für dich nützliche Dinge dort erfahren.","Los textos en idioma guerrero tratan sobre todo de armas y guerra. Aprenderás muchas cosas útiles.","","","DIA_Addon_Myxir_TeachL2_12_01","",""
"Scripts/Content/Story/B_AssignAmbientInfos/B_Addon_Myxir_TeachRequest.d:24","Die hohe Sprache der Priester ist wahrhaftig sehr schwer zu verstehen. Aber ich kann sie dir gerne zeigen.","El lenguaje refinado de los sacerdotes es muy difícil de entender, pero te lo enseńaré.","","","DIA_Addon_Myxir_TeachL3_12_00","",""
"Scripts/Content/Story/B_AssignAmbientInfos/B_Addon_Myxir_TeachRequest.d:25","In der Sprache der Priester sind vor allem heilige Schriften verfasst, die die Geschichte und Magie der Erbauer erklären.","Sobre todo, las escrituras sagradas, que explican la historia y la magia de los creadores, están escritas en el idioma de los sacerdotes.","","","DIA_Addon_Myxir_TeachL3_12_01","",""
"Scripts/Content/Story/B_AssignAmbientInfos/B_Addon_Myxir_TeachRequest.d:26","Jeder dieser Texte ist eine wahre Kostbarkeit, wenn man ihren Sinn versteht.","Cada uno de estos textos es un auténtico tesoro, si uno sabe descifrarlos.","","","DIA_Addon_Myxir_TeachL3_12_02","",""
"Scripts/Content/Story/B_AssignAmbientInfos/B_Addon_Myxir_TeachRequest.d:31","Es gibt nichts mehr, was ich dir noch zeigen könnte. Du beherrschst jetzt die Sprache der Erbauer.","No te puedo enseńar nada más. Ya dominas el idioma de los constructores.","","","DIA_Addon_Myxir_TeachNoMore_12_00","",""
"Scripts/Content/Story/B_AssignAmbientInfos/B_Addon_Myxir_TeachRequest.d:36","Geh hin und erprobe dein neues Wissen. Du wirst sehen, dass die Schriften der Erbauer nicht länger ein unlösbares Rätsel für dich sind.","Ve a poner a prueba tus nuevos conocimientos. Verás que las escrituras de los constructores ya no son misterios indescifrables para ti.","","","DIA_Addon_Myxir_Teach_LANGUAGE_X_12_00","",""
"Scripts/Content/Story/B_AssignAmbientInfos/B_Addon_Riordian_TeachWisp.d:6","Zeig mir, wie ich mein Irrlicht unterrichte.","Enséńame a entrenar mi voluntad de la espiral.","","","DIA_Addon_Riordian_Teach_15_00","",""
"Scripts/Content/Story/B_AssignAmbientInfos/B_Addon_Riordian_TeachWisp.d:11","Nun kann dein Irrlicht schon einige Dinge mehr finden, die dir nützen.","Ahora tu voluntad de la espiral puede buscar más cosas que podrás usar.","","","DIA_Addon_Riordian_Teach_WISPSKILL_X_10_00","",""
"Scripts/Content/Story/B_AssignAmbientInfos/B_Addon_Riordian_TeachWisp.d:16","Dein Irrlicht sucht nun nach allen Gegenständen, die sich zu finden lohnen. Ich kann dir nichts mehr zeigen.","Tu voluntad de la espiral puede ahora buscar objetos que merecen la pena. Ya no puedo enseńarte más.","","","DIA_Addon_Riordian_Teach1_10_00","",""
"Scripts/Content/Story/B_AssignAmbientInfos/B_Addon_Riordian_TeachWisp.d:21","Wonach soll dein Irrlicht denn suchen?","żQué quieres que busque tu voluntad de la espiral?","","","DIA_Addon_Riordian_Teach2_10_00","",""
"Scripts/Content/Story/B_AssignAmbientInfos/B_AkilsSchaf_KommMit.d:10","Komm mit!","ˇVen conmigo!","","","DIA_AkilsSchaf_KommMit.description","",""
"Scripts/Content/Story/B_AssignAmbientInfos/B_Announce_Herold.d:20","Hört, ihr Bewohner von Khorinis! Auf ausdrückliche Anordnung des ehrenwerten Lord Hagens ergeht folgender Erlass.","ˇEscuchad, habitantes de Khorinis! Por orden explícita del honorable lord Hagen, se promulga el siguiente decreto.","","","DIA_Herold_Announce_04_00","",""
"Scripts/Content/Story/B_AssignAmbientInfos/B_Announce_Herold.d:27","Aufgrund der allgemeinen Lage zu eurem eigenen Schutz sind die Wälder und Wildnis in der Umgebung der Stadt zu meiden!","A causa de la situación general, y por vuestra propia protección, tenéis que evitar las zonas boscosas y agrestes que circundan la ciudad.","","","DIA_Herold_Announce_04_01","",""
"Scripts/Content/Story/B_AssignAmbientInfos/B_Announce_Herold.d:28","Des weiteren ist jeglicher Kontakt zu den aufständischen Bauernschaften in den umliegenden Gebieten strengstens untersagt.","Además, se prohíbe terminantemente el contacto con el campesinado rebelde de los alrededores.","","","DIA_Herold_Announce_04_02","",""
"Scripts/Content/Story/B_AssignAmbientInfos/B_Announce_Herold.d:32","Ab sofort wird Lord Andre den Oberbefehl für unsere Miliz übernehmen.","De ahora en adelante, lord Andre tomará el mando absoluto de la milicia.","","","DIA_Herold_Announce_04_03","",""
"Scripts/Content/Story/B_AssignAmbientInfos/B_Announce_Herold.d:33","Alle Bürger dieser Stadt, die über kämpferische Fähigkeiten verfügen, werden hiermit angehalten, der königlichen Miliz beizutreten.","Por la presente, se insta a todos los ciudadanos que cuenten con instrucción marcial a que se alisten en la milicia real.","","","DIA_Herold_Announce_04_04","",""
"Scripts/Content/Story/B_AssignAmbientInfos/B_Announce_Herold.d:37","Die Sicherheitsmaßnahmen zum Schutz des oberen Viertels werden noch weiter verstärkt.","Se reforzarán las medidas de seguridad destinadas a proteger el barrio alto.","","","DIA_Herold_Announce_04_05","",""
"Scripts/Content/Story/B_AssignAmbientInfos/B_Announce_Herold.d:38","Die Torwachen sind angewiesen, das Gesetz in aller Strenge auszulegen, um unerlaubtes Eindringen zu verhindern.","Los guardias de las puertas tienen orden de interpretar de manera estricta la ley para evitar cualquier entrada no autorizada.","","","DIA_Herold_Announce_04_06","",""
"Scripts/Content/Story/B_AssignAmbientInfos/B_Announce_Herold.d:42","In allen Städten und Landstrichen des Reiches ist ab sofort das Kriegsrecht ausgerufen.","Se impone con efecto inmediato la ley marcial en todas las ciudades y regiones del reino.","","","DIA_Herold_Announce_04_07","",""
"Scripts/Content/Story/B_AssignAmbientInfos/B_Announce_Herold.d:43","Alle bürgerlichen Richter haben mit sofortiger Wirkung ihre Aufgaben an die königlichen Paladine zu übertragen.","Todos los jueces civiles han de ceder sus atribuciones a los paladines reales, con efecto inmediato.","","","DIA_Herold_Announce_04_08","",""
"Scripts/Content/Story/B_AssignAmbientInfos/B_Announce_Herold.d:44","Der ehrenwerte Lord Andre ist angewiesen worden, jegliches Vergehen oder Widerstand gegen die Garde des Königs aufs Schwerste zu bestrafen.","El honorable lord Andre tiene orden de castigar con severidad todo delito o acto de resistencia contra la guardia del rey.","","","DIA_Herold_Announce_04_09","",""
"Scripts/Content/Story/B_AssignAmbientInfos/B_Announce_Herold.d:45","Jeder Bewohner von Khorinis, der sich eines Verbrechens schuldig macht, hat sich umgehend bei Lord Andre zu melden.","Todo habitante de Khorinis que sea culpable de un delito ha de presentarse de inmediato ante lord Andre.","","","DIA_Herold_Announce_04_10","",""
"Scripts/Content/Story/B_AssignAmbientInfos/B_Announce_Herold.d:49","Jeder Bewohner der Stadt hat sich auf Grund der drohenden Gefahr eines Orkangriffs entsprechend vorzubereiten.","A causa del peligro inminente de que se produzca un ataque orco, cada habitante de la ciudad ha de prepararse de manera adecuada.","","","DIA_Herold_Announce_04_11","",""
"Scripts/Content/Story/B_AssignAmbientInfos/B_Announce_Herold.d:50","Jeder hat sich ab sofort in den Fertigkeiten des Kampfes zu üben und sich angemessen zu bewaffnen.","Todo el mundo tiene que iniciar de inmediato su instrucción de combate, y ha de armarse adecuadamente.","","","DIA_Herold_Announce_04_12","",""
"Scripts/Content/Story/B_AssignAmbientInfos/B_Announce_Herold.d:57","Der Söldnerschmied Bennet, der den Paladin Lothar heimtückisch ermordet hat, ist im Namen Innos' verurteilt worden.","El herrero mercenario Bennet, que asesinó a traición al paladín Lothar, ha sido condenado en nombre de Innos.","","","DIA_Herold_Announce_04_13","",""
"Scripts/Content/Story/B_AssignAmbientInfos/B_Announce_Herold.d:58","Das Urteil lautet Tod durch den Strick. Die Vollstreckung erfolgt in wenigen Tagen.","Se le sentencia a morir en la horca. La ejecución tendrá lugar dentro de unos días.","","","DIA_Herold_Announce_04_14","",""
"Scripts/Content/Story/B_AssignAmbientInfos/B_Announce_Herold.d:62","Der Schmied Bennet wird freigesprochen, da seine Unschuld von einem klugen Berater Lord Hagens bewiesen wurde.","Se ha absuelto de toda culpa al herrero Bennet, porque un hábil consejero de lord Hagen demostró su inocencia.","","","DIA_Herold_Announce_04_15","",""
"Scripts/Content/Story/B_AssignAmbientInfos/B_Announce_Herold.d:67","Den aufkommenden Gerüchten über das Erscheinen von Drachen im Minental von Khorinis ist kein Glaube zu schenken.","Los rumores que han surgido acerca de la aparición de dragones en el Valle de las Minas de Khorinis no son dignos de crédito.","","","DIA_Herold_Announce_04_16","",""
"Scripts/Content/Story/B_AssignAmbientInfos/B_Announce_Herold.d:68","Die Gerüchte sind vom Feind gestreut worden, um das tapfere Volk von Myrtana in Angst und Schrecken zu versetzen.","El enemigo se dedica a propagar estos rumores para inspirar miedo y terror en el pueblo valiente de Myrtana.","","","DIA_Herold_Announce_04_17","",""
"Scripts/Content/Story/B_AssignAmbientInfos/B_Announce_Herold.d:69","Um die lächerlichen Behauptungen zu widerlegen, ist ein Trupp tapferer Paladine unter dem Befehl eines Ortskundigen ins Minental aufgebrochen.","Para refutar estas afirmaciones ridículas, ha partido hacia el Valle de las Minas una compańía de valientes paladines bajo las órdenes de alguien familiarizado con la región.","","","DIA_Herold_Announce_04_18","",""
"Scripts/Content/Story/B_AssignAmbientInfos/B_Announce_Herold.d:76","Die Drachen, die das Land bedrohten, wurden von tapferen Männern unter dem Befehl von Lord Hagen besiegt.","Los dragones que amenazaban el país han sido derrotados por hombres valientes bajo las órdenes de lord Hagen.","","","DIA_Herold_Announce_04_19","",""
"Scripts/Content/Story/B_AssignAmbientInfos/B_Announce_Herold.d:77","Bald wird auch König Rohbar das Land von den Orks befreit haben und das Königreich wird in neuem Glanz aufblühen!","Dentro de poco, el rey Rhobar habrá liberado el país de orcos y el reino florecerá con nuevo esplendor.","","","DIA_Herold_Announce_04_20","",""
"Scripts/Content/Story/B_AssignAmbientInfos/B_Announce_Herold.d:81","Lord Andre erhält mit sofortiger Wirkung den Oberbefehl über die Stadt Khorinis.","Lord Andre quedará al cargo de la ciudad de Khorinis, con efecto inmediato.","","","DIA_Herold_Announce_04_21","",""
"Scripts/Content/Story/B_AssignAmbientInfos/B_Announce_Herold.d:82","Lord Hagen hat verkündet, nun selbst ins Minental zu ziehen, um dafür zu sorgen, dass sein Schiff mit dem magischen Erz beladen werden kann.","Lord Hagen ha anunciado que irá en persona al Valle de las Minas para asegurarse que se cargue su nave de mineral mágico.","","","DIA_Herold_Announce_04_22","",""
"Scripts/Content/Story/B_AssignAmbientInfos/B_AssignAmbientInfos_Addon_BL_BDT_1.d:32","Wer hat hier das Sagen?","°Wer hat hier das Sagen?   °<<FTSTAMP005687017_CINFODESCRIPTION>>","","","DIA_Addon_BL_BDT_1_Chef.description","",""
"Scripts/Content/Story/B_AssignAmbientInfos/B_AssignAmbientInfos_Addon_BL_BDT_1.d:42","Wer hat hier das Sagen?","°Wer hat hier das Sagen?   °<<FTSTAMP005688061_AIOUTPUT>>","","","DIA_Addon_BL_BDT_1_Chef_15_00","",""
"Scripts/Content/Story/B_AssignAmbientInfos/B_AssignAmbientInfos_Addon_BL_BDT_1.d:48","Soviele Anführer kommen und gehen ... da verliert man schon mal den Überblick.","°Soviele Anführer kommen und gehen ... da verliert man schon mal den Überblick.   °<<FTSTAMP005689063_AIOUTPUT>>","","","DIA_Addon_BL_BDT_1_Chef_01_01","",""
"Scripts/Content/Story/B_AssignAmbientInfos/B_AssignAmbientInfos_Addon_BL_BDT_1.d:52","Ich glaube, Thorus ist jetzt unser Chef ...","°Ich glaube, Thorus ist jetzt unser Chef ...   °<<FTSTAMP005690063_AIOUTPUT>>","","","DIA_Addon_BL_BDT_1_Chef_01_02","",""
"Scripts/Content/Story/B_AssignAmbientInfos/B_AssignAmbientInfos_Addon_BL_BDT_1.d:57","Raven ist unser Anführer. Er hat uns hergeführt und das Lager aufgebaut.","°Raven ist unser Anführer. Er hat uns hergeführt und das Lager aufgebaut.   °<<FTSTAMP005691062_AIOUTPUT>>","","","DIA_Addon_BL_BDT_1_Chef_01_03","",""
"Scripts/Content/Story/B_AssignAmbientInfos/B_AssignAmbientInfos_Addon_BL_BDT_1.d:58","Er kontrolliert die Mine, denn sonst hätten sich die Hunde längst wegen dem Gold umgebracht.","°Er kontrolliert die Mine, denn sonst hätten sich die Hunde längst wegen dem Gold umgebracht.   °<<FTSTAMP005692062_AIOUTPUT>>","","","DIA_Addon_BL_BDT_1_Chef_01_04","",""
"Scripts/Content/Story/B_AssignAmbientInfos/B_AssignAmbientInfos_Addon_BL_BDT_1.d:70","Was weißt du über das Lager?","°Was weißt du über das Lager?   °<<FTSTAMP005693017_CINFODESCRIPTION>>","","","DIA_Addon_BL_BDT_1_Lager.description","",""
"Scripts/Content/Story/B_AssignAmbientInfos/B_AssignAmbientInfos_Addon_BL_BDT_1.d:84","Was weißt du über das Lager?","°Was weißt du über das Lager?   °<<FTSTAMP005694062_AIOUTPUT>>","","","DIA_Addon_BL_BDT_1_Lager_15_00","",""
"Scripts/Content/Story/B_AssignAmbientInfos/B_AssignAmbientInfos_Addon_BL_BDT_1.d:85","Nachdem klar war, dass es hier eine Goldmine gibt, haben sich die Penner wohl ganz schön auf's Maul gehauen.","°Nachdem klar war, dass es hier eine Goldmine gibt, haben sich die Penner wohl ganz schön auf's Maul gehauen.   °<<FTSTAMP005695062_AIOUTPUT>>","","","DIA_Addon_BL_BDT_1_Lager_01_01","",""
"Scripts/Content/Story/B_AssignAmbientInfos/B_AssignAmbientInfos_Addon_BL_BDT_1.d:86","Raven hat dann die Schlimmsten von ihnen umgebracht und den Rest aus der Mine geworfen.","°Raven hat dann die Schlimmsten von ihnen umgebracht und den Rest aus der Mine geworfen.   °<<FTSTAMP005696062_AIOUTPUT>>","","","DIA_Addon_BL_BDT_1_Lager_01_02","",""
"Scripts/Content/Story/B_AssignAmbientInfos/B_AssignAmbientInfos_Addon_BL_BDT_1.d:87","Seitdem darf niemand mehr in den oberen Bereich. Er hat sogar Gefangene anschleppen lassen, die in der Mine schürfen.","°Seitdem darf niemand mehr in den oberen Bereich. Er hat sogar Gefangene anschleppen lassen, die in der Mine schürfen.   °<<FTSTAMP005697062_AIOUTPUT>>","","","DIA_Addon_BL_BDT_1_Lager_01_03","",""
"Scripts/Content/Story/B_AssignAmbientInfos/B_AssignAmbientInfos_Addon_BL_BDT_1.d:107","Kannst du mir mehr über das Lager erzählen?","°Kannst du mir mehr über das Lager erzählen?   °<<FTSTAMP005698017_CINFODESCRIPTION>>","","","DIA_Addon_BL_BDT_1_Lager2.description","",""
"Scripts/Content/Story/B_AssignAmbientInfos/B_AssignAmbientInfos_Addon_BL_BDT_1.d:120","Was weißt du über das Lager?","°Was weißt du über das Lager?   °<<FTSTAMP005699063_AIOUTPUT>>","","","DIA_Addon_BL_BDT_1_Lager2_15_00","",""
"Scripts/Content/Story/B_AssignAmbientInfos/B_AssignAmbientInfos_Addon_BL_BDT_1.d:121","Wenn du jemanden angreifst, werden sich ALLE auf dich stürzen.","°Wenn du jemanden angreifst, werden sich ALLE auf dich stürzen.   °<<FTSTAMP005700063_AIOUTPUT>>","","","DIA_Addon_BL_BDT_1_Lager2_01_01","",""
"Scripts/Content/Story/B_AssignAmbientInfos/B_AssignAmbientInfos_Addon_BL_BDT_1.d:122","Es sei denn, du hast einen Grund, dich mit jemandem anzulegen. Dann wird sich keiner einmischen.","°Es sei denn, du hast einen Grund, dich mit jemandem anzulegen. Dann wird sich keiner einmischen.   °<<FTSTAMP005701063_AIOUTPUT>>","","","DIA_Addon_BL_BDT_1_Lager2_01_02","",""
"Scripts/Content/Story/B_AssignAmbientInfos/B_AssignAmbientInfos_Addon_BL_BDT_1.d:134","Gibt's was Neues? ","°Gibt's was Neues?    °<<FTSTAMP005702017_CINFODESCRIPTION>>","","","DIA_Addon_BL_BDT_1_News.description","",""
"Scripts/Content/Story/B_AssignAmbientInfos/B_AssignAmbientInfos_Addon_BL_BDT_1.d:144","Gibt's was Neues?","°Gibt's was Neues?   °<<FTSTAMP005703061_AIOUTPUT>>","","","DIA_Addon_BL_BDT_1_News_15_00","",""
"Scripts/Content/Story/B_AssignAmbientInfos/B_AssignAmbientInfos_Addon_BL_BDT_1.d:148","Raven ist tot. Was sollen wir denn jetzt machen?","°Raven ist tot. Was sollen wir denn jetzt machen?   °<<FTSTAMP005704062_AIOUTPUT>>","","","DIA_Addon_BL_BDT_1_News_01_01","",""
"Scripts/Content/Story/B_AssignAmbientInfos/B_AssignAmbientInfos_Addon_BL_BDT_1.d:151","Die Piraten wollen uns nicht mehr zum Festland bringen, weil sie für ihre letzten Transporte nicht bezahlt wurden.","°Die Piraten wollen uns nicht mehr zum Festland bringen, weil sie für ihre letzten Transporte nicht bezahlt wurden.   °<<FTSTAMP005705061_AIOUTPUT>>","","","DIA_Addon_BL_BDT_1_News_01_02","",""
"Scripts/Content/Story/B_AssignAmbientInfos/B_AssignAmbientInfos_Addon_BL_BDT_1.d:152","Wir sollten ein oder zwei von ihnen aufspießen, dann werden die anderen uns garantiert wieder übersetzen.","°Wir sollten ein oder zwei von ihnen aufspießen, dann werden die anderen uns garantiert wieder übersetzen.   °<<FTSTAMP005706061_AIOUTPUT>>","","","DIA_Addon_BL_BDT_1_News_01_03","",""
"Scripts/Content/Story/B_AssignAmbientInfos/B_AssignAmbientInfos_Addon_BL_BDT_1.d:164","Was weißt du über die Gefangenen?","°Was weißt du über die Gefangenen?   °<<FTSTAMP005707017_CINFODESCRIPTION>>","","","DIA_Addon_BL_BDT_1_Sklaven.description","",""
"Scripts/Content/Story/B_AssignAmbientInfos/B_AssignAmbientInfos_Addon_BL_BDT_1.d:179","Was weißt du über die Gefangenen?","°Was weißt du über die Gefangenen?   °<<FTSTAMP005708064_AIOUTPUT>>","","","DIA_Addon_BL_BDT_1_Sklaven_15_00","",""
"Scripts/Content/Story/B_AssignAmbientInfos/B_AssignAmbientInfos_Addon_BL_BDT_1.d:180","Raven will irgendwas ausgebuddeln. Erst hat er die Banditen das machen lassen, aber dabei sind zuviele draufgegangen.","°Raven will irgendwas ausgebuddeln. Erst hat er die Banditen das machen lassen, aber dabei sind zuviele draufgegangen.   °<<FTSTAMP005709064_AIOUTPUT>>","","","DIA_Addon_BL_BDT_1_Sklaven_01_01","",""
"Scripts/Content/Story/B_AssignAmbientInfos/B_AssignAmbientInfos_Addon_BL_BDT_1.d:181","Deshalb hat er die Gefangenen geholt - wenn die krepieren, spielt das keine Rolle.","°Deshalb hat er die Gefangenen geholt - wenn die krepieren, spielt das keine Rolle.   °<<FTSTAMP005710064_AIOUTPUT>>","","","DIA_Addon_BL_BDT_1_Sklaven_01_02","",""
"Scripts/Content/Story/B_AssignAmbientInfos/B_AssignAmbientInfos_Addon_BL_BDT_1.d:185","Was will Raven ausbuddeln?","°Was will Raven ausbuddeln?   °<<FTSTAMP005711065_AIOUTPUT>>","","","DIA_Addon_BL_BDT_1_Sklaven_15_03","",""
"Scripts/Content/Story/B_AssignAmbientInfos/B_AssignAmbientInfos_Addon_BL_BDT_1.d:186","Keine Ahnung, aber ihm geht's wohl um mehr als das Gold.","°Keine Ahnung, aber ihm geht's wohl um mehr als das Gold.   °<<FTSTAMP005712065_AIOUTPUT>>","","","DIA_Addon_BL_BDT_1_Sklaven_01_04","",""
"Scripts/Content/Story/B_AssignAmbientInfos/B_AssignAmbientInfos_Addon_BL_BDT_13.d:34","Wer hat hier das Sagen?","°Wer hat hier das Sagen?   °<<FTSTAMP005713017_CINFODESCRIPTION>>","","","DIA_Addon_BL_BDT_13_Chef.description","",""
"Scripts/Content/Story/B_AssignAmbientInfos/B_AssignAmbientInfos_Addon_BL_BDT_13.d:44","Wer hat hier das Sagen?","°Wer hat hier das Sagen?   °<<FTSTAMP005714062_AIOUTPUT>>","","","DIA_Addon_BL_BDT_13_Chef_15_00","",""
"Scripts/Content/Story/B_AssignAmbientInfos/B_AssignAmbientInfos_Addon_BL_BDT_13.d:50","(jubelt) Unser glorreicher Anführer Thorus. Er wird uns alle reich machen!","°(jubelt) Unser glorreicher Anführer Thorus. Er wird uns alle reich machen!   °<<FTSTAMP005715064_AIOUTPUT>>","","","DIA_Addon_BL_BDT_13_Chef_13_01","",""
"Scripts/Content/Story/B_AssignAmbientInfos/B_AssignAmbientInfos_Addon_BL_BDT_13.d:54","Unser glorreicher Anführer ... Äh ... keine Ahnung ...","°Unser glorreicher Anführer ... Äh ... keine Ahnung ...   °<<FTSTAMP005716064_AIOUTPUT>>","","","DIA_Addon_BL_BDT_13_Chef_13_02","",""
"Scripts/Content/Story/B_AssignAmbientInfos/B_AssignAmbientInfos_Addon_BL_BDT_13.d:59","(jubelt) Unser glorreicher Anführer Raven. Er wird uns alle reich machen!","°(jubelt) Unser glorreicher Anführer Raven. Er wird uns alle reich machen!   °<<FTSTAMP005717063_AIOUTPUT>>","","","DIA_Addon_BL_BDT_13_Chef_13_03","",""
"Scripts/Content/Story/B_AssignAmbientInfos/B_AssignAmbientInfos_Addon_BL_BDT_13.d:72","Was weißt du über das Lager?","°Was weißt du über das Lager?   °<<FTSTAMP005718017_CINFODESCRIPTION>>","","","DIA_Addon_BL_BDT_13_Lager.description","",""
"Scripts/Content/Story/B_AssignAmbientInfos/B_AssignAmbientInfos_Addon_BL_BDT_13.d:82","Was weißt du über das Lager?","°Was weißt du über das Lager?   °<<FTSTAMP005719063_AIOUTPUT>>","","","DIA_Addon_BL_BDT_13_Lager_15_00","",""
"Scripts/Content/Story/B_AssignAmbientInfos/B_AssignAmbientInfos_Addon_BL_BDT_13.d:83","Sprich mit Snaf, wenn du was wissen willst. Der dicke Koch weiß echt 'ne Menge.","°Sprich mit Snaf, wenn du was wissen willst. Der dicke Koch weiß echt 'ne Menge.   °<<FTSTAMP005720063_AIOUTPUT>>","","","DIA_Addon_BL_BDT_13_Lager_13_01","",""
"Scripts/Content/Story/B_AssignAmbientInfos/B_AssignAmbientInfos_Addon_BL_BDT_13.d:84","Wenn du was kaufen willst, geh zu Fisk. Er treibt alles Mögliche auf ...","°Wenn du was kaufen willst, geh zu Fisk. Er treibt alles Mögliche auf ...   °<<FTSTAMP005721063_AIOUTPUT>>","","","DIA_Addon_BL_BDT_13_Lager_13_02","",""
"Scripts/Content/Story/B_AssignAmbientInfos/B_AssignAmbientInfos_Addon_BL_BDT_13.d:96","Was gibt's Neues?","°Was gibt's Neues?   °<<FTSTAMP005722017_CINFODESCRIPTION>>","","","DIA_Addon_BL_BDT_13_News.description","",""
"Scripts/Content/Story/B_AssignAmbientInfos/B_AssignAmbientInfos_Addon_BL_BDT_13.d:106","Was gibt's Neues?","°Was gibt's Neues?   °<<FTSTAMP005723062_AIOUTPUT>>","","","DIA_Addon_BL_BDT_13_News_15_00","",""
"Scripts/Content/Story/B_AssignAmbientInfos/B_AssignAmbientInfos_Addon_BL_BDT_13.d:110","Raven ist tot. Jetzt werden wir NIEMALS von dieser Insel runterkommen.","°Raven ist tot. Jetzt werden wir NIEMALS von dieser Insel runterkommen.   °<<FTSTAMP005724063_AIOUTPUT>>","","","DIA_Addon_BL_BDT_13_News_13_01","",""
"Scripts/Content/Story/B_AssignAmbientInfos/B_AssignAmbientInfos_Addon_BL_BDT_13.d:114","Die Piraten haben Segel gesetzt und sind auf und davon.","°Die Piraten haben Segel gesetzt und sind auf und davon.   °<<FTSTAMP005725063_AIOUTPUT>>","","","DIA_Addon_BL_BDT_13_News_13_02","",""
"Scripts/Content/Story/B_AssignAmbientInfos/B_AssignAmbientInfos_Addon_BL_BDT_13.d:115","Jetzt hocken da nur noch ein paar Idioten am Strand und die haben kein anständiges Schiff.","°Jetzt hocken da nur noch ein paar Idioten am Strand und die haben kein anständiges Schiff.   °<<FTSTAMP005726063_AIOUTPUT>>","","","DIA_Addon_BL_BDT_13_News_13_03","",""
"Scripts/Content/Story/B_AssignAmbientInfos/B_AssignAmbientInfos_Addon_BL_BDT_13.d:116","Nicht mal Beliar weiß, wie wir von dieser Insel runterkommen sollen.","°Nicht mal Beliar weiß, wie wir von dieser Insel runterkommen sollen.   °<<FTSTAMP005727063_AIOUTPUT>>","","","DIA_Addon_BL_BDT_13_News_13_04","",""
"Scripts/Content/Story/B_AssignAmbientInfos/B_AssignAmbientInfos_Addon_BL_BDT_13.d:129","Wie komme ich schnell an viel Gold?","°Wie komme ich schnell an viel Gold?   °<<FTSTAMP005728017_CINFODESCRIPTION>>","","","DIA_Addon_BL_BDT_13_Gold.description","",""
