"location","source","target","id","fuzzy","context","translator_comments","developer_comments"
"Scripts/Content/Story/Dialoge/DIA_PC_Mage_OW.d:387","Ich habe Gorn befreit.","He liberado a Gorn.","","","DIA_MiltenOW_Frei_15_00","",""
"Scripts/Content/Story/Dialoge/DIA_PC_Mage_OW.d:388","Gut. Dann sollten wir überlegen, wie es weiter geht.","Estupendo. Entonces tendremos que pensar en lo que va a pasar a continuación.","","","DIA_MiltenOW_Frei_03_01","",""
"Scripts/Content/Story/Dialoge/DIA_PC_Mage_OW.d:400","Kannst du mir was beibringen?","¿Puedes enseñarme algo?","","","DIA_MiltenOW_Lehren.description","",""
"Scripts/Content/Story/Dialoge/DIA_PC_Mage_OW.d:414","Kannst du mir was beibringen?","¿Puedes enseñarme algo?","","","DIA_MiltenOW_Lehren_15_00","",""
"Scripts/Content/Story/Dialoge/DIA_PC_Mage_OW.d:415","Ich kann dich in einige Zauber aus dem zweiten Kreis der Magie einweihen oder ich kann dir helfen, deine magische Kraft zu steigern.","Te puedo enseñar algo de magia del segundo círculo de magia o, si no, puedo ayudarte a aumentar tu poder mágico.","","","DIA_MiltenOW_Lehren_03_01","",""
"Scripts/Content/Story/Dialoge/DIA_PC_Mage_OW.d:416","Wenn du die Bereitschaft verspürst, deine Macht zu mehren, dann werde ich dich unterweisen.","Si te sientes preparado para aumentar tu poder, te puedo entrenar.","","","DIA_MiltenOW_Lehren_03_02","",""
"Scripts/Content/Story/Dialoge/DIA_PC_Mage_OW.d:429","Lehre mich den zweiten Kreis der Magie!","¡Enséñame el segundo círculo de magia!","","","DIA_MiltenOW_TeachCircle2.description","",""
"Scripts/Content/Story/Dialoge/DIA_PC_Mage_OW.d:444","Lehre mich den zweiten Kreis der Magie!","¡Enséñame el segundo círculo de magia!","","","DIA_Milten_Add_15_00","",""
"Scripts/Content/Story/Dialoge/DIA_PC_Mage_OW.d:445","Normalerweise ist das den Lehrern unseres Ordens vorbehalten.","Ése suele ser un privilegio de los maestros de nuestra orden.","","","DIA_Milten_Add_03_01","",""
"Scripts/Content/Story/Dialoge/DIA_PC_Mage_OW.d:446","Aber ich denke, in diesem Fall können wir mal 'ne Ausnahme machen...","Pero creo que, en este caso, puedo hacer una excepción...","","","DIA_Milten_Add_03_02","",""
"Scripts/Content/Story/Dialoge/DIA_PC_Mage_OW.d:450","Ich weiß nicht, ob ich die offiziellen Worte noch weiß...","No sé si recuerdo las palabras protocolarias...","","","DIA_Milten_Add_03_03","",""
"Scripts/Content/Story/Dialoge/DIA_PC_Mage_OW.d:451","Tritt nun in den zweiten Kreis. Äh... Er zeigt dir die Richtung - doch deine Taten formen den Weg - oder so...","Entra ahora en el segundo círculo. Esto... te mostrará el camino, pero tus obras crean el camino, o algo por el estilo...","","","DIA_Milten_Add_03_04","",""
"Scripts/Content/Story/Dialoge/DIA_PC_Mage_OW.d:452","Ich denke, du hast verstanden, worum es geht...","Creo que entiendes de qué va...","","","DIA_Milten_Add_03_05","",""
"Scripts/Content/Story/Dialoge/DIA_PC_Mage_OW.d:466","Ich will neue Zauber lernen.","Quiero aprender más conjuros.","","","DIA_MiltenOW_Teach.description","",""
"Scripts/Content/Story/Dialoge/DIA_PC_Mage_OW.d:481","Ich will neue Zauber lernen.","Quiero aprender nuevos conjuros.","","","DIA_MiltenOW_Teach_15_00","",""
"Scripts/Content/Story/Dialoge/DIA_PC_Mage_OW.d:505","Du hast noch nicht den zweiten Kreis der Magie erreicht. Ich kann dir nichts beibringen.","Todavía no has llegado al segundo círculo de magia. No te puedo enseñar nada.","","","DIA_MiltenOW_Teach_03_01","",""
"Scripts/Content/Story/Dialoge/DIA_PC_Mage_OW.d:539","Ich will meine magischen Kräfte steigern.","Quiero aumentar mis poderes mágicos.","","","DIA_MiltenOW_Mana.description","",""
"Scripts/Content/Story/Dialoge/DIA_PC_Mage_OW.d:554","Ich will meine magischen Kräfte steigern.","Quiero aumentar mis poderes mágicos.","","","DIA_MiltenOW_Mana_15_00","",""
"Scripts/Content/Story/Dialoge/DIA_PC_Mage_OW.d:566","Deine magische Kraft ist groß. Zu groß, als dass ich dir jetzt noch helfen könnte, sie zu steigern.","Tu poder mágico es grande, demasiado como para que pueda ayudarte a aumentarlo.","","","DIA_MiltenOW_Mana_03_00","",""
"Scripts/Content/Story/Dialoge/DIA_PC_Mage_OW.d:604","Was ist deine Aufgabe hier?","¿A qué te dedicas?","","","DIA_MiltenOW_Perm.description","",""
"Scripts/Content/Story/Dialoge/DIA_PC_Mage_OW.d:618","Was ist deine Aufgabe hier?","¿Qué cometido tienes aquí?","","","DIA_MiltenOW_Perm_15_00","",""
"Scripts/Content/Story/Dialoge/DIA_PC_Mage_OW.d:619","Ursprünglich sollte ich das Erz untersuchen. Aber davon haben wir bisher nicht viel gesehen.","Al principio debía analizar el mineral mágico. Pero hasta ahora no hemos visto mucho.","","","DIA_MiltenOW_Perm_03_01","",""
"Scripts/Content/Story/Dialoge/DIA_PC_Mage_OW.d:620","Jetzt widme ich mich dem Studium der Alchemie.","Ahora me estoy concentrando en el estudio de la alquimia.","","","DIA_MiltenOW_Perm_03_02","",""
"Scripts/Content/Story/Dialoge/DIA_PC_Mage_OW.d:633","Was sind deine Pläne?","¿Cuáles son tus planes?","","","DIA_MiltenOW_Plan.description","",""
"Scripts/Content/Story/Dialoge/DIA_PC_Mage_OW.d:647","Was sind deine Pläne?","¿Cuáles son tus planes?","","","DIA_MiltenOW_Plan_15_00","",""
"Scripts/Content/Story/Dialoge/DIA_PC_Mage_OW.d:648","Ich werde wieder zurückkehren. Ich warte noch eine Weile ab, aber da Gorn nun frei ist, kann ich mich zusammen mit ihm absetzen.","Volveré. Esperaré durante un rato, pero ahora que Gorn está libre, puedo partir con él.","","","DIA_MiltenOW_Plan_03_01","",""
"Scripts/Content/Story/Dialoge/DIA_PC_Mage_OW.d:649","Es ist mehr als nötig, dass Pyrokar von der Situation hier erfährt.","Es imprescindible que Pyrokar conozca la situación que vivimos aquí.","","","DIA_MiltenOW_Plan_03_02","",""
"Scripts/Content/Story/Dialoge/DIA_PC_Mage_OW.d:650","Wie du meinst.","Si eso es lo que piensas.","","","DIA_MiltenOW_Plan_15_03","",""
"Scripts/Content/Story/Dialoge/DIA_PC_Mage_OW.d:651","Ich hoffe, dass Lord Hagen erkennen wird, welche Bedrohung von diesem Tal ausgeht. Nicht auszudenken, was passiert, wenn die Orks über den Pass kommen.","Espero que lord Hagen reconozca la amenaza que emana de este valle. Y eso sin pensar en lo que pasaría si los orcos cruzan el paso.","","","DIA_MiltenOW_Plan_03_04","",""
"Scripts/Content/Story/Dialoge/DIA_PC_Mage_OW.d:652","Na dann, gute Reise.","Bueno, que tengas un buen viaje.","","","DIA_MiltenOW_Plan_15_05","",""
"Scripts/Content/Story/Dialoge/DIA_PC_Mage_OW.d:665","(Es wäre schwierig seinen Trank zu stehlen)","(Sería difícil robar su poción)","","","DIA_MiltenOW_PICKPOCKET.description","",""
