"location","source","target","id","fuzzy","context","translator_comments","developer_comments"
"Scripts/Content/Story/B_AssignAmbientInfos/B_AssignAmbientInfos_NOV_3.d:203","Das wollen viele der Novizen. Aber nur den wenigsten ist es bestimmt, als Erwählte die Chance zu bekommen, in den Kreis des Feuers aufgenommen zu werden.","Eso es lo que quieren muchos de los novicios, pero solo poquísimos son ordenados como elegidos y tienen la oportunidad de ser aceptados en el Círculo de Fuego.","","","DIA_NOV_3_JOIN_03_01","",""
"Scripts/Content/Story/B_AssignAmbientInfos/B_AssignAmbientInfos_NOV_3.d:204","Ein Magier vom Kreis des Feuers zu sein, ist die höchste Ehre, die dir in unserem Orden zuteil werden kann.","Ser mago del Círculo del Fuego es el mayor honor al que puedes aspirar en nuestra orden.","","","DIA_NOV_3_JOIN_03_02","",""
"Scripts/Content/Story/B_AssignAmbientInfos/B_AssignAmbientInfos_NOV_3.d:205","Du wirst hart dafür arbeiten müssen, um deine Chance zu bekommen.","Si quieres optar a ello, tendrás que esforzarte.","","","DIA_NOV_3_JOIN_03_03","",""
"Scripts/Content/Story/B_AssignAmbientInfos/B_AssignAmbientInfos_NOV_3.d:217","Wer führt dieses Kloster?","żQuién es el líder de este monasterio?","","","DIA_NOV_3_PEOPLE.description","",""
"Scripts/Content/Story/B_AssignAmbientInfos/B_AssignAmbientInfos_NOV_3.d:227","Wer führt dieses Kloster?","żQuién es el líder de este monasterio?","","","DIA_NOV_3_PEOPLE_15_00","",""
"Scripts/Content/Story/B_AssignAmbientInfos/B_AssignAmbientInfos_NOV_3.d:228","Wir Novizen dienen den Magiern vom Kreis des Feuers. Diese wiederum werden angeführt vom hohen Rat, der aus den drei mächtigsten Magiern besteht.","Los novicios servimos a los magos del Círculo de Fuego, que a su vez están a las órdenes del Concilio Supremo, un consejo compuesto de los tres magos más poderosos.","","","DIA_NOV_3_PEOPLE_03_01","",""
"Scripts/Content/Story/B_AssignAmbientInfos/B_AssignAmbientInfos_NOV_3.d:229","Aber für alle Belange der Novizen ist Parlan zuständig. Er ist immer im Hof und überwacht die Arbeit der Novizen.","Pero Parlan es el responsable de todo lo relacionado con los novicios. Siempre está en el patio supervisando el trabajo de los novicios.","","","DIA_NOV_3_PEOPLE_03_02","",""
"Scripts/Content/Story/B_AssignAmbientInfos/B_AssignAmbientInfos_NOV_3.d:241","Was kannst du mir über dieses Kloster erzählen?","żQué puedes contarme de este monasterio?","","","DIA_NOV_3_LOCATION.description","",""
"Scripts/Content/Story/B_AssignAmbientInfos/B_AssignAmbientInfos_NOV_3.d:251","Was kannst du mir über dieses Kloster erzählen?","żQué puedes contarme de este monasterio?","","","DIA_NOV_3_LOCATION_15_00","",""
"Scripts/Content/Story/B_AssignAmbientInfos/B_AssignAmbientInfos_NOV_3.d:252","Wir bauen uns hier unsere bescheidene Verpflegung selbst an. Wir züchten Schafe und keltern Wein.","Nos dedicamos a producir nuestras modestas provisiones. Criamos ovejas y hacemos vino.","","","DIA_NOV_3_LOCATION_03_01","",""
"Scripts/Content/Story/B_AssignAmbientInfos/B_AssignAmbientInfos_NOV_3.d:253","Es gibt eine Bibliothek, aber deren Nutzung ist den Magiern und den ausgesuchten Novizen vorbehalten.","Hay una biblioteca, pero solo la pueden usar los magos y los novicios elegidos.","","","DIA_NOV_3_LOCATION_03_02","",""
"Scripts/Content/Story/B_AssignAmbientInfos/B_AssignAmbientInfos_NOV_3.d:254","Wir anderen Novizen kümmern uns in erster Linie darum, dass es den Magiern vom Kreis des Feuers an nichts fehlt.","Fundamentalmente, los demás novicios atendemos a los magos del Círculo de Fuego a cambio de nada.","","","DIA_NOV_3_LOCATION_03_03","",""
"Scripts/Content/Story/B_AssignAmbientInfos/B_AssignAmbientInfos_NOV_3.d:266","Was gibt's Neues?","żQué hay de nuevo?","","","DIA_NOV_3_STANDARD.description","",""
"Scripts/Content/Story/B_AssignAmbientInfos/B_AssignAmbientInfos_NOV_3.d:276","Was gibt's Neues?","żQué hay de nuevo?","","","DIA_NOV_3_STANDARD_15_00","",""
"Scripts/Content/Story/B_AssignAmbientInfos/B_AssignAmbientInfos_NOV_3.d:282","Das fragt der Richtige! Alle Gespräche unter den Novizen drehen sich nur um dich.","żY tú lo preguntas? Los novicios no hacen mas que hablar de ti.","","","DIA_NOV_3_STANDARD_03_01","",""
"Scripts/Content/Story/B_AssignAmbientInfos/B_AssignAmbientInfos_NOV_3.d:283","Es kommt nur sehr selten vor, dass ein Neuer wie du in den Kreis des Feuers erwählt wird.","Es bastante raro que un recién llegado como tú ingrese en el Círculo de Fuego.","","","DIA_NOV_3_STANDARD_03_02","",""
"Scripts/Content/Story/B_AssignAmbientInfos/B_AssignAmbientInfos_NOV_3.d:287","Es ist wieder soweit. Einer der Novizen wird bald in den Kreis des Feuers aufgenommen.","De nuevo ha llegado la hora. Dentro de poco, uno de los novicios ingresará en el Círculo de Fuego.","","","DIA_NOV_3_STANDARD_03_03","",""
"Scripts/Content/Story/B_AssignAmbientInfos/B_AssignAmbientInfos_NOV_3.d:288","Die Prüfungen werden bald beginnen.","Las pruebas comenzarán enseguida.","","","DIA_NOV_3_STANDARD_03_04","",""
"Scripts/Content/Story/B_AssignAmbientInfos/B_AssignAmbientInfos_NOV_3.d:298","Unser Orden wurde von Beliar berührt! Das Böse ist sehr stark, wenn es ihm gelingt, selbst hier Verbündete zu finden.","ˇBeliar ha corrompido nuestra orden! Para que el mal encuentre aliados aquí, tiene que ser muy poderoso.","","","DIA_NOV_3_STANDARD_03_05","",""
"Scripts/Content/Story/B_AssignAmbientInfos/B_AssignAmbientInfos_NOV_3.d:299","Pedro war schon seit Jahren hier im Kloster. Ich glaube, die viele Zeit außerhalb dieser Mauern hat seinen Glauben geschwächt und ihn so anfällig für die Verlockungen Beliars gemacht.","Pedro llevaba ańos en el monasterio. Creo que el tiempo que pasó fuera de estos muros hizo que su fe flaquease y le hizo vulnerable a las tentaciones de Beliar.","","","DIA_NOV_3_STANDARD_03_06","",""
"Scripts/Content/Story/B_AssignAmbientInfos/B_AssignAmbientInfos_NOV_3.d:303","Du bist zur rechten Zeit gekommen. Innos selbst hätte den Zeitpunkt deines Erscheinens nicht besser wählen können.","Eres muy oportuno. Ni siquiera Innos habría elegido un mejor momento para tu aparición.","","","DIA_NOV_3_STANDARD_03_07","",""
"Scripts/Content/Story/B_AssignAmbientInfos/B_AssignAmbientInfos_NOV_3.d:304","Du wirst als Retter des Auges in die Geschichte unseres Klosters eingehen.","Entrarás en los anales del monasterio como salvador del Ojo.","","","DIA_NOV_3_STANDARD_03_08","",""
"Scripts/Content/Story/B_AssignAmbientInfos/B_AssignAmbientInfos_NOV_3.d:310","Die Nachrichten aus dem Minental sind erschreckend. Ich glaube, dass Innos uns eine schwere Prüfung auferlegt hat.","Las noticias del Valle de las Minas son alarmantes. Creo que Innos nos está sometiendo a una dura prueba..","","","DIA_NOV_3_STANDARD_03_09","",""
"Scripts/Content/Story/B_AssignAmbientInfos/B_AssignAmbientInfos_NOV_3.d:314","Es heißt, es gibt keine Nachricht von den Paladinen, die ins Minental ausgezogen sind. Der Hohe Rat wird am Besten wissen, was zu tun ist.","Se dice que no se sabe nada de los paladines que fueron al Valle de las Minas. El Concilio Supremo sabrá lo que hay que hacer.","","","DIA_NOV_3_STANDARD_03_10","",""
"Scripts/Content/Story/B_AssignAmbientInfos/B_AssignAmbientInfos_NOV_3.d:321","Es heißt, wir werden mit der Hilfe unseres Herrn die Drachen vernichten. Der Zorn Innos' wird die Kreaturen Beliars treffen.","Dicen que destruiremos a los dragones con la ayuda de nuestro Seńor. La cólera de Innos golpeará a las criaturas de Beliar.","","","DIA_NOV_3_STANDARD_03_11","",""
"Scripts/Content/Story/B_AssignAmbientInfos/B_AssignAmbientInfos_NOV_3.d:326","Innos sei Dank, es gibt keine neue Krise. Wir müssen den Weg unseres Herrn weiter gehen, denn nur mit seiner Hilfe werden wir gegen das Böse bestehen können.","Gracias a Innos no hay nueva crisis. Debemos volver al sendero de nuestro Seńor, pues solo nos podemos enfrentar al mal con su ayuda.","","","DIA_NOV_3_STANDARD_03_12","",""
"Scripts/Content/Story/B_AssignAmbientInfos/B_AssignAmbientInfos_NOV_8.d:32","Ich brauche Hilfe beim Fegen der Novizenkammern.","Necesito ayuda para peinar las estancias de los novicios.","","","DIA_NOV_8_Fegen.description","",""
"Scripts/Content/Story/B_AssignAmbientInfos/B_AssignAmbientInfos_NOV_8.d:50","Ich brauche Hilfe beim Fegen der Novizenkammern.","Necesito ayuda para registrar las estancias de los novicios.","","","DIA_NOV_8_Fegen_15_00","",""
"Scripts/Content/Story/B_AssignAmbientInfos/B_AssignAmbientInfos_NOV_8.d:56","Oh Mann. Du bist gerade mal hier und lässt dir direkt die Fegerei aufs Auge drücken?","Vaya. żAcabas de llegar y ya te encargan esa labor?","","","DIA_NOV_8_Fegen_08_01","",""
"Scripts/Content/Story/B_AssignAmbientInfos/B_AssignAmbientInfos_NOV_8.d:57","Tröste dich, mir ist es genauso gegangen, als ich hier neu war. Und deswegen helfe ich dir. Wäre doch gelacht, wenn wir das nicht hinkriegen.","Consuélate. A mí me pasó lo mismo cuando llegué y por eso voy a ayudarte. Sería absurdo que no pudiéramos con ello.","","","DIA_NOV_8_Fegen_08_02","",""
"Scripts/Content/Story/B_AssignAmbientInfos/B_AssignAmbientInfos_NOV_8.d:69","Bruder, ich weiß, in welcher Situation du steckst. Und ich hab dir schon gesagt, dass ich dir helfe. Und das mach ich.","Hermano, sé por lo que estás pasando. Ya te dije que te ayudaré y eso es lo hago.","","","DIA_NOV_8_Fegen_08_03","",""
"Scripts/Content/Story/B_AssignAmbientInfos/B_AssignAmbientInfos_NOV_8.d:77","Hey, ich würd's ja tun, aber ich bin schwer beschäftigt.","Lo haría, pero estoy muy ocupado.","","","DIA_NOV_8_Fegen_08_04","",""
"Scripts/Content/Story/B_AssignAmbientInfos/B_AssignAmbientInfos_NOV_8.d:90","Wie wär's mit 'ner leckeren Schafswurst?","żTe apetece una deliciosa salchicha de cordero?","","","DIA_NOV_8_Wurst.description","",""
"Scripts/Content/Story/B_AssignAmbientInfos/B_AssignAmbientInfos_NOV_8.d:106","Wie wär's mit 'ner leckeren Schafswurst?","żTe apetece una deliciosa salchicha de cordero?","","","DIA_NOV_8_Wurst_15_00","",""
"Scripts/Content/Story/B_AssignAmbientInfos/B_AssignAmbientInfos_NOV_8.d:107","Da sage ich nicht nein. Danke Mann - das ist jetzt genau das Richtige.","No voy a decir que no. Gracias, tío. Me viene de miedo.","","","DIA_NOV_8_Wurst_08_01","",""
"Scripts/Content/Story/B_AssignAmbientInfos/B_AssignAmbientInfos_NOV_8.d:131","Was muß ich tun, um Magier zu werden?","żQué he de hacer para convertirme en mago?","","","DIA_NOV_8_JOIN.description","",""
"Scripts/Content/Story/B_AssignAmbientInfos/B_AssignAmbientInfos_NOV_8.d:144","Was muß ich tun, um Magier zu werden?","żQué he de hacer para convertirme en mago?","","","DIA_NOV_8_JOIN_15_00","",""
"Scripts/Content/Story/B_AssignAmbientInfos/B_AssignAmbientInfos_NOV_8.d:145","Ein Erwählter Innos' wirst du erst, wenn die Hohen Magier des Feuers es zulassen.","Solo te convertirás en un elegido de Innos cuando lo permitan los magos supremos de fuego.","","","DIA_NOV_8_JOIN_08_01","",""
"Scripts/Content/Story/B_AssignAmbientInfos/B_AssignAmbientInfos_NOV_8.d:146","Als Novizen ist es uns untersagt, uns mit der Runenmagie zu befassen - und nur mit der Erlaubnis der Magier dürfen wir die alten Schriften lesen.","Los novicios tenemos prohibido el estudio de la magia rúnica, y solo podemos estudiar las antiguas escrituras con permiso de los magos.","","","DIA_NOV_8_JOIN_08_02","",""
"Scripts/Content/Story/B_AssignAmbientInfos/B_AssignAmbientInfos_NOV_8.d:158","Wer leitet das Kloster?","żQuién está al mando del monasterio?","","","DIA_NOV_8_PEOPLE.description","",""
"Scripts/Content/Story/B_AssignAmbientInfos/B_AssignAmbientInfos_NOV_8.d:168","Wer leitet das Kloster?","żQuién está al mando del monasterio?","","","DIA_NOV_8_PEOPLE_15_00","",""
"Scripts/Content/Story/B_AssignAmbientInfos/B_AssignAmbientInfos_NOV_8.d:169","Der hohe Rat. Er wird gebildet von den drei mächtigsten Magiern unseres Ordens. Sie beraten sich täglich in der Kirche.","El Concilio Supremo. Lo forman los tres magos más poderosos de la orden y se reúnen a diario en el templo.","","","DIA_NOV_8_PEOPLE_08_01","",""
"Scripts/Content/Story/B_AssignAmbientInfos/B_AssignAmbientInfos_NOV_8.d:170","Die Erwählten Innos' sind allesamt Magier. Innos hat sie mit dieser Gabe ausgestattet, damit sie seinen Willen auf Erden durchsetzen können.","Todos los elegidos de Innos son magos. Innos les ha otorgado su don para que hagan valer su voluntad en la tierra.","","","DIA_NOV_8_PEOPLE_08_02","",""
"Scripts/Content/Story/B_AssignAmbientInfos/B_AssignAmbientInfos_NOV_8.d:182","Erzähl mir etwas über dieses Kloster.","Háblame del monasterio.","","","DIA_NOV_8_LOCATION.description","",""
"Scripts/Content/Story/B_AssignAmbientInfos/B_AssignAmbientInfos_NOV_8.d:192","Erzähl mir etwas über dieses Kloster.","Háblame del monasterio.","","","DIA_NOV_8_LOCATION_15_00","",""
"Scripts/Content/Story/B_AssignAmbientInfos/B_AssignAmbientInfos_NOV_8.d:193","Es ist uralt. Es stammt noch aus der Zeit vor Rhobar, dem Ersten.","Es antiguo, de la época anterior a Rhobar I.","","","DIA_NOV_8_LOCATION_08_01","",""
"Scripts/Content/Story/B_AssignAmbientInfos/B_AssignAmbientInfos_NOV_8.d:194","Unter dem Kloster sind die Katakomben. Sie erstrecken sich bis tief in den Berg hinein.","Las catacumbas están debajo del monasterio y penetran en lo más hondo de la montańa.","","","DIA_NOV_8_LOCATION_08_02","",""
"Scripts/Content/Story/B_AssignAmbientInfos/B_AssignAmbientInfos_NOV_8.d:207","Gibt's irgendwelche Neuigkeiten?","żHay alguna novedad?","","","DIA_NOV_8_STANDARD.description","",""
"Scripts/Content/Story/B_AssignAmbientInfos/B_AssignAmbientInfos_NOV_8.d:217","Gibt's irgendwelche Neuigkeiten?","żHay alguna novedad?","","","DIA_NOV_8_STANDARD_15_00","",""
"Scripts/Content/Story/B_AssignAmbientInfos/B_AssignAmbientInfos_NOV_8.d:223","Das kann man wohl sagen. Es ist bestimmt schon seit über hundert Jahren nicht mehr vorgekommen, dass ein Novize in so kurzer Zeit in den Kreis des Feuers aufgenommen wurde!","En cierto modo. La última vez que un novicio fue aceptado tan deprisa en el Círculo de Fuego fue hace más de cien ańos.","","","DIA_NOV_8_STANDARD_08_01","",""
"Scripts/Content/Story/B_AssignAmbientInfos/B_AssignAmbientInfos_NOV_8.d:224","Ich hoffe, dass auch mir eines Tages diese Ehre zuteil wird. Ich werde hart dafür arbeiten.","Espero que algún día me otorguen ese mismo honor. Me esforzaré al máximo.","","","DIA_NOV_8_STANDARD_08_02","",""
"Scripts/Content/Story/B_AssignAmbientInfos/B_AssignAmbientInfos_NOV_8.d:228","Vor Kurzem sind die Paladine in Khorinis eingetroffen. Einer von ihnen ist hier im Kloster, um zu beten.","Los paladines han llegado hace poco a Khorinis y uno de ellos ha venido a rezar al monasterio.","","","DIA_NOV_8_STANDARD_08_03","",""
"Scripts/Content/Story/B_AssignAmbientInfos/B_AssignAmbientInfos_NOV_8.d:238","Ich kann es noch gar nicht glauben. Einer von uns hat das Kloster verraten und das Auge Innos' gestohlen.","Aún no me lo creo. Uno de los nuestros ha traicionado al monasterio y ha robado el Ojo de Innos.","","","DIA_NOV_3_STANDARD_08_04","",""
"Scripts/Content/Story/B_AssignAmbientInfos/B_AssignAmbientInfos_NOV_8.d:239","Es war unsere Aufgabe, eine Gemeinschaft zu bilden, doch wir waren zu schwach, nur so konnte es Beliar gelingen, einen der Unsrigen auf seine Seite zu ziehen.","Nos correspondía fundar una comunidad, pero flaqueamos. Solo así podría haber atraído Beliar a uno de los nuestros.","","","DIA_NOV_3_STANDARD_08_05","",""
"Scripts/Content/Story/B_AssignAmbientInfos/B_AssignAmbientInfos_NOV_8.d:243","Innos sei gepriesen, wir konnten dem Feind das Auge Innos' wieder abnehmen.","ˇAlabado sea Innos! Conseguimos recuperar el Ojo de manos del enemigo.","","","DIA_NOV_3_STANDARD_08_06","",""
"Scripts/Content/Story/B_AssignAmbientInfos/B_AssignAmbientInfos_NOV_8.d:244","Dein Mut kann für viele verzweifelte Seelen ein Vorbild sein und ihnen helfen, diese dunklen Zeiten zu überstehen.","Tu valentía puede servir de modelo para muchas almas desesperadas y ayudarlas a sobrevivir en este periodo aciago.","","","DIA_NOV_3_STANDARD_08_07","",""
"Scripts/Content/Story/B_AssignAmbientInfos/B_AssignAmbientInfos_NOV_8.d:250","Ich habe von Drachen gehört und von einer Armee des Bösen. Innos steh uns bei!","He oído hablar de dragones y de un ejército maléfico. ˇQue Innos nos proteja!","","","DIA_NOV_8_STANDARD_08_08","",""
"Scripts/Content/Story/B_AssignAmbientInfos/B_AssignAmbientInfos_NOV_8.d:254","Der hohe Rat ist sehr besorgt über die Situation, in der sich unsere Paladine befinden. Es gibt seit einiger Zeit schon keine Nachricht aus dem Minental.","La situación de nuestros paladines tiene muy preocupado al Concilio Supremo. Llevamos bastante tiempo sin tener noticias del Valle de las Minas.","","","DIA_NOV_8_STANDARD_08_09","",""
"Scripts/Content/Story/B_AssignAmbientInfos/B_AssignAmbientInfos_NOV_8.d:261","Nein. Und ich danke unserem Herrn dafür. Mit dem Auge Innos' wird es uns gelingen, die Drachen zu besiegen!","No, y le doy gracias a nuestro Seńor por ello. ˇCon el Ojo de Innos podremos derrotar a los dragones!","","","DIA_NOV_8_STANDARD_08_10","",""
"Scripts/Content/Story/B_AssignAmbientInfos/B_AssignAmbientInfos_NOV_8.d:266","Ja. Wir haben den Sieg über die Drachen errungen! Innos hat uns gezeigt, dass wir die Hoffnung niemals aufgeben dürfen.","Sí. ˇHemos vencido a los dragones! Innos nos ha demostrado que no debemos desesperar nunca.","","","DIA_NOV_8_STANDARD_08_11","",""
"Scripts/Content/Story/B_AssignAmbientInfos/B_AssignAmbientInfos_NOV_8.d:267","Doch es gibt viele Schatten und wir werden viele Feuer entzünden müssen, um sie zu vertreiben.","No obstante, aún hay muchas sombras y tendremos que encender muchas hogueras para eliminarlas.","","","DIA_NOV_8_STANDARD_08_12","",""
"Scripts/Content/Story/B_AssignAmbientInfos/B_AssignAmbientInfos_OUT_1.d:50","Seit die Barriere um die Strafkolonie weg ist, haben wir ständig Ärger mit Banditen.","Desde que desapareció la barrera que rodeaba la penitenciaría, los bandidos nos han dado guerra de manera constante.","","","DIA_OUT_1_STANDARD_01_00","",""
"Scripts/Content/Story/B_AssignAmbientInfos/B_AssignAmbientInfos_OUT_1.d:55","Auf die Miliz ist kein Verlass. Wir müssen uns selbst verteidigen.","No se puede confiar en la milicia. Tenemos que defendernos por nuestra cuenta.","","","DIA_OUT_1_STANDARD_01_01","",""
"Scripts/Content/Story/B_AssignAmbientInfos/B_AssignAmbientInfos_OUT_1.d:60","Ich lass mich für niemanden einspannen. Weder vom König, noch von dem fetten Onar. Ich kämpfe nur für mich selbst.","No voy a dejar que nadie se aproveche de mí. Ni el rey, ni el gordo Onar. Solo lucho para mí.","","","DIA_OUT_1_STANDARD_01_02","",""
"Scripts/Content/Story/B_AssignAmbientInfos/B_AssignAmbientInfos_OUT_13.d:50","Bisher konnten wir uns die Orks immer vom Hals halten. Aber in letzter Zeit werden es immer mehr.","Hasta ahora, hemos podido mantener a raya a los orcos, pero cada vez hay más.","","","DIA_OUT_1_STANDARD_13_00","",""
"Scripts/Content/Story/B_AssignAmbientInfos/B_AssignAmbientInfos_OUT_13.d:55","Die Miliz kommt uns auch nicht zu Hilfe. Sie kommt nur aus der Stadt, um uns unsere Ernte und unser Vieh wegzunehmen.","La milicia tampoco acude en nuestra ayuda. Solo salen de la ciudad para llevarse la cosecha y el ganado.","","","DIA_OUT_1_STANDARD_13_01","",""
"Scripts/Content/Story/B_AssignAmbientInfos/B_AssignAmbientInfos_OUT_13.d:60","Onar ist verrückt, sich mit der Stadt anzulegen, gerade jetzt, wo die Paladine da sind.","Onar está loco enfrentándose a la ciudad cuando los paladines están allí.","","","DIA_OUT_1_STANDARD_13_02","",""
"Scripts/Content/Story/B_AssignAmbientInfos/B_AssignAmbientInfos_OUT_7.d:50","Hier draußen ist es in letzte Zeit immer gefährlicher geworden. Und die Feldräuber werden zu einer echten Plage.","En los últimos tiempos la zona se ha vuelto mucho más peligrosa y los incursores de campo son una auténtica plaga.","","","DIA_OUT_7_STANDARD_07_00","",""
"Scripts/Content/Story/B_AssignAmbientInfos/B_AssignAmbientInfos_OUT_7.d:55","Wir müssen unseren Teil an die Stadt abgeben. Tun wir's nicht, bekommen wir am Ende noch Ärger mit den Paladinen.","Tenemos que pagar el tributo a la ciudad si no queremos líos con los paladines.","","","DIA_OUT_7_STANDARD_07_01","",""
"Scripts/Content/Story/B_AssignAmbientInfos/B_AssignAmbientInfos_OUT_7.d:60","Der Aufstand von Onar wird noch schwere Folgen haben. Ich halt mich lieber aus der Sache raus.","La rebelión de Onar va a tener graves repercusiones. Prefiero mantenerme al margen.","","","DIA_OUT_7_STANDARD_07_02","",""
"Scripts/Content/Story/B_AssignAmbientInfos/B_AssignAmbientInfos_OcPAL_4.d:32","Wer hat hier das Kommando?","żQuién está al mando?","","","DIA_OCPAL_4_PEOPLE.description","",""
"Scripts/Content/Story/B_AssignAmbientInfos/B_AssignAmbientInfos_OcPAL_4.d:42","Wer hat hier das Kommando?","żQuién está al mando?","","","DIA_OCPAL_4_PEOPLE_15_00","",""
"Scripts/Content/Story/B_AssignAmbientInfos/B_AssignAmbientInfos_OcPAL_4.d:43","Kommandant Garond. Er befindet sich im größten Haus hier in der Burg.","El comandante Garond. Está en el edificio mayor del castillo.","","","DIA_OCPAL_4_PEOPLE_04_01","",""
"Scripts/Content/Story/B_AssignAmbientInfos/B_AssignAmbientInfos_OcPAL_4.d:55","Was kannst du mir über das Minental erzählen?","żQué me cuentas del Valle de las Minas?","","","DIA_OCPAL_4_LOCATION.description","",""
"Scripts/Content/Story/B_AssignAmbientInfos/B_AssignAmbientInfos_OcPAL_4.d:65","Was kannst du mir über das Minental erzählen?","żQué me cuentas del Valle de las Minas?","","","DIA_OCPAL_4_LOCATION_15_00","",""
"Scripts/Content/Story/B_AssignAmbientInfos/B_AssignAmbientInfos_OcPAL_4.d:66","Soviel ich weiß, gibt es mehrere Minen da draußen - wenn die nicht schon alle von den Orks überrannt wurden.","Tengo entendido que allí hay muchas minas... si es que no las han invadido los orcos.","","","DIA_OCPAL_4_LOCATION_04_01","",""
"Scripts/Content/Story/B_AssignAmbientInfos/B_AssignAmbientInfos_OcPAL_4.d:67","Die Trupps bestehen zum größten Teil aus Gefangenen, aber es sind auch einige Paladine unter ihnen.","La mayor parte de los soldados son prisioneros, pero también hay algunos paladines.","","","DIA_OCPAL_4_LOCATION_04_02","",""
"Scripts/Content/Story/B_AssignAmbientInfos/B_AssignAmbientInfos_OcPAL_4.d:79","Wie ist die Lage?","żCómo van las cosas?","","","DIA_OCPAL_4_STANDARD.description","",""
"Scripts/Content/Story/B_AssignAmbientInfos/B_AssignAmbientInfos_OcPAL_4.d:89","Wie ist die Lage?","żCómo van las cosas?","","","DIA_OCPAL_4_STANDARD_15_00","",""
"Scripts/Content/Story/B_AssignAmbientInfos/B_AssignAmbientInfos_OcPAL_4.d:93","Die Orks haben uns umzingelt! Aber wir werden uns bis zum letzten Mann verteidigen! Und Innos wird uns gegen die Drachen beistehen!","ˇLos orcos nos han rodeado, pero nos defenderemos a muerte e Innos nos ayudará contra los dragones!","","","DIA_OCPAL_4_STANDARD_04_01","",""
"Scripts/Content/Story/B_AssignAmbientInfos/B_AssignAmbientInfos_OcPAL_4.d:100","Es wird nicht mehr lange dauern, bis die Orks angreifen. Wo bleibt die verdammte Verstärkung?","Los orcos no van a tardar en atacar. żDónde están los malditos refuerzos?","","","DIA_OCPAL_4_STANDARD_04_02","",""
"Scripts/Content/Story/B_AssignAmbientInfos/B_AssignAmbientInfos_OcPAL_4.d:103","Du glaubst doch nicht im Ernst, dass ihr Drachenjäger wirklich eine Chance gegen ALLE Drachen habt?","żDe veras crees que los cazadores de dragones tenéis alguna oportunidad contra todos los dragones?","","","DIA_OCPAL_4_STANDARD_04_03","",""
"Scripts/Content/Story/B_AssignAmbientInfos/B_AssignAmbientInfos_OcPAL_4.d:107","Diese sogenannten Drachenjäger werden nicht viel ausrichten können!","ˇLos supuestos cazadores de dragones no van a lograr gran cosa!","","","DIA_OCPAL_4_STANDARD_04_04","",""
"Scripts/Content/Story/B_AssignAmbientInfos/B_AssignAmbientInfos_OcPAL_4.d:112","Innos sei Dank! Diese verdammten Bestien sind besiegt worden!","ˇGracias a Innos! ˇEsas bestias infernales han sido derrotadas!","","","DIA_OCPAL_4_STANDARD_04_05","",""
"Scripts/Content/Story/B_AssignAmbientInfos/B_AssignAmbientInfos_OcPAL_4.d:120","Der Tod der Drachen scheint die Orks nicht sonderlich zu beeindrucken. Warum in Innos' Namen ziehen sie nicht ab? Irgendeine Teufelei ist hier im Gange.","Parece que la muerte de los dragones no ha impresionado demasiado a los orcos. En el nombre de Innos, żpor qué no se marchan? Algo malo se trama.","","","DIA_OCPAL_4_STANDARD_04_06","",""
"Scripts/Content/Story/B_AssignAmbientInfos/B_AssignAmbientInfos_OcPAL_4.d:124","Das verdammte Tor ist verklemmt. Die Orks kommen ungehindert in die Burg.","La maldita puerta está atrancada. Los orcos entran en tropel en el castillo y nada se lo impide.","","","DIA_OCPAL_4_STANDARD_04_07","",""
"Scripts/Content/Story/B_AssignAmbientInfos/B_AssignAmbientInfos_OcPAL_4.d:125","Jemand muss Lord Hagen informieren. Wir brauchen ihn jetzt HIER.","Alguien tiene que informar a lord Hagen. Le necesitamos ya.","","","DIA_OCPAL_4_STANDARD_04_08","",""
"Scripts/Content/Story/B_AssignAmbientInfos/B_AssignAmbientInfos_OcPAL_9.d:32","Wer hat hier das Kommando?","żQuién está al mando?","","","DIA_OCPAL_9_PEOPLE.description","",""
"Scripts/Content/Story/B_AssignAmbientInfos/B_AssignAmbientInfos_OcPAL_9.d:42","Wer hat hier das Kommando?","żQuién está al mando?","","","DIA_OCPAL_9_PEOPLE_15_00","",""
"Scripts/Content/Story/B_AssignAmbientInfos/B_AssignAmbientInfos_OcPAL_9.d:43","Garond ist der Kommandant der Burg. Er ist nicht gerade um seine Aufgabe zu beneiden.","Garond es el comandante del castillo. La verdad es que su posición no es envidiable.","","","DIA_OCPAL_9_PEOPLE_09_01","",""
"Scripts/Content/Story/B_AssignAmbientInfos/B_AssignAmbientInfos_OcPAL_9.d:55","Was weißt du über dieses Tal?","żQué sabes de este valle?","","","DIA_OCPAL_9_LOCATION.description","",""
