"location","source","target","id","fuzzy","context","translator_comments","developer_comments"
"Scripts/Content/Story/Dialoge/DIA_NOV_604_Dyrian.d:121","Jetzt warte ich auf die Entscheidung des Hohen Rates, ob ich im Kloster bleiben darf.","Teď čekám na rozhodnutí nejvyšší rady, jestli budu moci zůstat v klášteře.","","","DIA_Dyrian_Job_13_02","",""
"Scripts/Content/Story/Dialoge/DIA_NOV_604_Dyrian.d:133","Erzähl mir, was passiert ist.","Řekni mi, co se stalo.","","","DIA_Dyrian_WhatDone.description","",""
"Scripts/Content/Story/Dialoge/DIA_NOV_604_Dyrian.d:149","Erzähl mir, was passiert ist.","Řekni mi, co se stalo.","","","DIA_Dyrian_WhatDone_15_00","",""
"Scripts/Content/Story/Dialoge/DIA_NOV_604_Dyrian.d:150","Ich habe beim Fegen in den Räumen der Magier ein Buch mitgenommen, um es später zu lesen.","Když jsem zametal, vzal jsem knihu z komnat mágů, abych si ji mohl později přečíst.","","","DIA_Dyrian_WhatDone_13_01","",""
"Scripts/Content/Story/Dialoge/DIA_NOV_604_Dyrian.d:151","Meister Hyglas hat es natürlich sofort bemerkt und mich nach dem Buch gefragt.","Mistr Hyglas si toho samozřejmě okamžitě všiml a na tu knihu se mě zeptal.","","","DIA_Dyrian_WhatDone_13_02","",""
"Scripts/Content/Story/Dialoge/DIA_NOV_604_Dyrian.d:152","Aus Angst vor Bestrafung habe ich es geleugnet - aber als ich später mit dem Buch in meiner Kammer war, hat er mich erwischt.","Ze strachu před trestem jsem zalhal - ale později mě nachytal s tou knihou v mé cele.","","","DIA_Dyrian_WhatDone_13_03","",""
"Scripts/Content/Story/Dialoge/DIA_NOV_604_Dyrian.d:153","Er war ziemlich aufgebracht und hat den Hohen Rat informiert. Jetzt beraten sie, ob ich bleiben kann.","Strašně se rozzlobil a řekl o tom nejvyšší radě. Teď probírají, jestli mohu zůstat.","","","DIA_Dyrian_WhatDone_13_04","",""
"Scripts/Content/Story/Dialoge/DIA_NOV_604_Dyrian.d:166","Kann ich dir irgendwie helfen?","Můžu ti nějak pomoci?","","","DIA_Dyrian_CanHelp.description","",""
"Scripts/Content/Story/Dialoge/DIA_NOV_604_Dyrian.d:182","Kann ich dir irgendwie helfen?","Je něco, jak bych ti mohl pomoci?","","","DIA_Dyrian_CanHelp_15_00","",""
"Scripts/Content/Story/Dialoge/DIA_NOV_604_Dyrian.d:183","Nein, ich bin der Gnade Innos' und der der Magier ausgeliefert.","Ne, odevzdal jsem se na milost Innosovi a mágům.","","","DIA_Dyrian_CanHelp_13_01","",""
"Scripts/Content/Story/Dialoge/DIA_NOV_604_Dyrian.d:210","Hey, hast du tatsächlich die Prüfung des Feuers gefordert?","Hele, vážně jsi požadoval zkoušku ohně?","","","DIA_Dyrian_Scroll_13_00","",""
"Scripts/Content/Story/Dialoge/DIA_NOV_604_Dyrian.d:211","Ja. Und ich habe vor, sie zu bestehen.","Ano. A mám v úmyslu ji složit.","","","DIA_Dyrian_Scroll_15_01","",""
"Scripts/Content/Story/Dialoge/DIA_NOV_604_Dyrian.d:212","Gut - vielleicht kann ich dir dabei helfen. Ich kann dir eine sehr nützliche Spruchrolle geben. Einen SCHLAF-Zauber. Interessiert?","Dobrá - možná bych ti s tím mohl pomoci. Můžu ti dát velice užitečný kouzelný svitek. Kouzlo SPÁNKU. Máš zájem?","","","DIA_Dyrian_Scroll_13_02","",""
"Scripts/Content/Story/Dialoge/DIA_NOV_604_Dyrian.d:215","Nein, ich brauche deine Hilfe nicht.","Ne, nepotřebuji tvou pomoc.","","","DIA_Dyrian_Scroll.DIA_Dyrian_Scroll_No","Info_AddChoice",""
"Scripts/Content/Story/Dialoge/DIA_NOV_604_Dyrian.d:216","Was willst du dafür?","Co za to chceš?","","","DIA_Dyrian_Scroll.DIA_Dyrian_Scroll_How","Info_AddChoice",""
"Scripts/Content/Story/Dialoge/DIA_NOV_604_Dyrian.d:217","Was kann ich damit machen?","K čemu mi bude?","","","DIA_Dyrian_Scroll.DIA_Dyrian_Scroll_What","Info_AddChoice",""
"Scripts/Content/Story/Dialoge/DIA_NOV_604_Dyrian.d:222","Was kann ich damit machen?","K čemu mi bude?","","","DIA_Dyrian_Scroll_What_15_00","",""
"Scripts/Content/Story/Dialoge/DIA_NOV_604_Dyrian.d:223","Mit diesem Zauber kannst du Menschen für kurze Zeit in einen magischen Schlaf versetzen. Allerdings nur, wenn ihr Wille schwächer ist als deiner.","S pomocí tohohle kouzla můžeš kohokoliv na chvíli uvrhnout do magického spánku. Ovšem jenom v případě, že je jeho vůle slabší než tvoje.","","","DIA_Dyrian_Scroll_What_13_01","",""
"Scripts/Content/Story/Dialoge/DIA_NOV_604_Dyrian.d:224","Das kann sehr nützlich sein, wenn dir jemand im Weg steht ...","To by se mohlo hodit, pokud budeš někoho potřebovat odklidit z cesty.","","","DIA_Dyrian_Scroll_What_13_02","",""
"Scripts/Content/Story/Dialoge/DIA_NOV_604_Dyrian.d:225","Und woher weiß ich, ob derjenige einen schwächeren Willen hat?","A jak zjistím, jestli má ten dotyčný slabší vůli než já?","","","DIA_Dyrian_Scroll_What_15_03","",""
"Scripts/Content/Story/Dialoge/DIA_NOV_604_Dyrian.d:226","Bei den Magiern brauchst du es gar nicht erst zu versuchen. Aber die meisten Novizen wirst du schlafen legen können.","Ani se to nenamáhej zkoušet na mágy. Ale většinu noviců bys tak měl uspat.","","","DIA_Dyrian_Scroll_What_13_04","",""
"Scripts/Content/Story/Dialoge/DIA_NOV_604_Dyrian.d:231","Nein, ich brauche deine Hilfe nicht.","Ne, nepotřebuji tvou pomoc.","","","DIA_Dyrian_Scroll_No_15_00","",""
"Scripts/Content/Story/Dialoge/DIA_NOV_604_Dyrian.d:232","Du kannst jederzeit zu mir kommen, wenn du es dir anders überlegen solltest.","Pokud bys náhodou změnil názor, můžeš za mnou kdykoliv přijít.","","","DIA_Dyrian_Scroll_No_13_01","",""
"Scripts/Content/Story/Dialoge/DIA_NOV_604_Dyrian.d:238","Was willst du dafür?","Co za to chceš?","","","DIA_Dyrian_Scroll_How_15_00","",""
"Scripts/Content/Story/Dialoge/DIA_NOV_604_Dyrian.d:239","Jedem Magier steht bei der Aufnahme ein Wunsch zu.","Každý mág, který u zkoušky uspěje, může mít jedno přání.","","","DIA_Dyrian_Scroll_How_13_01","",""
"Scripts/Content/Story/Dialoge/DIA_NOV_604_Dyrian.d:240","Und wenn du tatsächlich die Prüfung des Feuers bestehst, dann kannst du dich dafür einsetzen, dass ich im Kloster bleiben darf.","Pokud se ti opravdu podaří projít zkouškou ohně, možná bys mohl zařídit, abych zůstal tady v klášteře.","","","DIA_Dyrian_Scroll_How_13_02","",""
"Scripts/Content/Story/Dialoge/DIA_NOV_604_Dyrian.d:244","Okay, gib mir die Spruchrolle. ","Dobrá, dej mi ten kouzelný svitek.","","","DIA_Dyrian_Scroll.DIA_Dyrian_Scroll_Yes","Info_AddChoice",""
"Scripts/Content/Story/Dialoge/DIA_NOV_604_Dyrian.d:249","Okay, gib mir die Spruchrolle.","Dobrá, dej mi ten kouzelný svitek.","","","DIA_Dyrian_Scroll_Yes_15_00","",""
"Scripts/Content/Story/Dialoge/DIA_NOV_604_Dyrian.d:250","Viel Glück während deiner Prüfung. Möge Innos dir beistehen.","Přeji ti hodně štěstí u zkoušky. Ať je ti Innos nápomocen.","","","DIA_Dyrian_Scroll_Yes_13_01","",""
"Scripts/Content/Story/Dialoge/DIA_NOV_604_Dyrian.d:270","Ich hab's mir überlegt. Gib mir den Schlaf-Zauber.","Změnil jsem názor. Dej mi to uspávací kouzlo.","","","DIA_Dyrian_Doch.description","",""
"Scripts/Content/Story/Dialoge/DIA_NOV_604_Dyrian.d:285","Ich hab's mir überlegt. Gib mir den Schlaf-Zauber.","Změnil jsem názor. Dej mi to uspávací kouzlo.","","","DIA_Dyrian_Doch_15_00","",""
"Scripts/Content/Story/Dialoge/DIA_NOV_604_Dyrian.d:286","Gut, wenn du die Prüfung bestehst, setzt du dich dafür ein, dass ich im Kloster bleiben kann.","Dobrá, ale když zkouškou projdeš, zařídíš, abych mohl zůstat v klášteře.","","","DIA_Dyrian_Doch_13_01","",""
"Scripts/Content/Story/Dialoge/DIA_NOV_604_Dyrian.d:316","(freudestrahlend) Danke, du hast mich gerettet!","(radostně) Díky, zachránils mě!","","","DIA_Dyrian_HelloAgain_13_00","",""
"Scripts/Content/Story/Dialoge/DIA_NOV_604_Dyrian.d:317","(erschrocken) Oh - verzeih mir Meister- ich wollte nicht aufdringlich erscheinen.","(ustrašeně) Ach, promiň, mistře. Nechtěl jsem se vtírat.","","","DIA_Dyrian_HelloAgain_13_01","",""
"Scripts/Content/Story/Dialoge/DIA_NOV_604_Dyrian.d:318","(ehrerbietend) Ich danke dir dafür, dass ich im Kloster bleiben darf. Mein Leben wird sich von nun an ändern ...","(zdvořile) Děkuji ti, že mohu zůstat zde v klášteře. Od této chvíle se celý můj život změní.","","","DIA_Dyrian_HelloAgain_13_02","",""
"Scripts/Content/Story/Dialoge/DIA_NOV_604_Dyrian.d:329","Wie geht's?","Jak se vede?","","","DIA_Dyrian_HowIsIt_15_00","",""
"Scripts/Content/Story/Dialoge/DIA_NOV_604_Dyrian.d:338","Wie geht's?","Jak se vede?","","","DIA_Dyrian_HowIsIt.description","",""
"Scripts/Content/Story/Dialoge/DIA_NOV_604_Dyrian.d:352","Gut. Die Arbeit macht mir viel Freude, Meister.","Dobře. Mám zdejší práci opravdu rád, mistře.","","","DIA_Dyrian_HowIsIt_13_01","",""
"Scripts/Content/Story/Dialoge/DIA_NOV_604_Dyrian.d:367","Wie geht's?","Jak se vede?","","","DIA_Dyrian_other.description","",""
"Scripts/Content/Story/Dialoge/DIA_NOV_604_Dyrian.d:383","Ich danke Innos, dass ich hier im Kloster sein darf.","Děkuji Innosovi, že mohu být zde v klášteře.","","","DIA_Dyrian_HowIsIt_13_02","",""
"Scripts/Content/Story/Dialoge/DIA_NOV_604_Dyrian.d:398","Wie geht's?","Jak se vede?","","","DIA_Dyrian_Kneipe.description","",""
"Scripts/Content/Story/Dialoge/DIA_NOV_604_Dyrian.d:412","Wie geht's?","Jak se vede?","","","DIA_Dyrian_Kneipe_15_00","",""
"Scripts/Content/Story/Dialoge/DIA_NOV_604_Dyrian.d:413","Das fragst du mich noch? Ich habe alle meine Hoffnungen auf dich gesetzt, aber du hast mich sitzen lassen.","Na co se mě to ptáš? Vkládal jsem do tebe veškeré své naděje, a tys mě nechal na holičkách.","","","DIA_Dyrian_Kneipe_13_01","",""
"Scripts/Content/Story/Dialoge/DIA_NOV_604_Dyrian.d:414","Jetzt bleibt mir nur noch der Alkohol. Und du bist Schuld daran!","Teď už nemám nic než pití. A je to tvoje chyba!","","","DIA_Dyrian_Kneipe_13_02","",""
"Scripts/Content/Story/Dialoge/DIA_NOV_604_Dyrian.d:417","Hier hast Du 5 Gold.","Tady máš 5 zlaťáků.","","","DIA_Dyrian_Kneipe.DIA_Dyrian_Kneipe_Gold","Info_AddChoice",""
"Scripts/Content/Story/Dialoge/DIA_NOV_604_Dyrian.d:418","Ich kann alles erklären.","Můžu všechno vysvětlit.","","","DIA_Dyrian_Kneipe.DIA_Dyrian_Kneipe_CanExplain","Info_AddChoice",""
"Scripts/Content/Story/Dialoge/DIA_NOV_604_Dyrian.d:419","Pass auf was du sagst!","Podívej, co říkáš.","","","DIA_Dyrian_Kneipe.DIA_Dyrian_Kneipe_ShutUp","Info_AddChoice",""
"Scripts/Content/Story/Dialoge/DIA_NOV_604_Dyrian.d:424","Hier hast du 5 Goldstücke.","Na, tady máš 5 zlatých.","","","DIA_Dyrian_Kneipe_Gold_15_00","",""
"Scripts/Content/Story/Dialoge/DIA_NOV_604_Dyrian.d:425","(aufgeregt) 5 Gold? Du gibst mir 5 Gold. Dafür, dass du mein Leben zerstört hast?","(nervózně) 5 zlatých? Dáváš mi 5 zlatých a chceš se tak revanšovat za to, žes mi zničil život?","","","DIA_Dyrian_Kneipe_Gold_13_01","",""
"Scripts/Content/Story/Dialoge/DIA_NOV_604_Dyrian.d:426","Ich werde mir all dein Gold nehmen!","Vezmu si všechno tvoje zlato!","","","DIA_Dyrian_Kneipe_Gold_13_02","",""
"Scripts/Content/Story/Dialoge/DIA_NOV_604_Dyrian.d:434","Ich kann alles erklären.","Můžu všechno vysvětlit.","","","DIA_Dyrian_Kneipe_CanExplain_15_00","",""
"Scripts/Content/Story/Dialoge/DIA_NOV_604_Dyrian.d:435","Spar dir deine billigen Ausreden.","Nech si svoje laciné výmluvy.","","","DIA_Dyrian_Kneipe_CanExplain_13_01","",""
"Scripts/Content/Story/Dialoge/DIA_NOV_604_Dyrian.d:436","Du lügst, wenn du den Mund aufmachst. Jetzt lass mich in Ruhe.","Lžeš pokaždé, když otevřeš ústa. Nech mě být.","","","DIA_Dyrian_Kneipe_CanExplain_13_02","",""
"Scripts/Content/Story/Dialoge/DIA_NOV_604_Dyrian.d:443","Pass auf, was du sagst.","Dávej si pozor na to, co říkáš.","","","DIA_Dyrian_Kneipe_ShutUp_15_00","",""
"Scripts/Content/Story/Dialoge/DIA_NOV_604_Dyrian.d:444","Ja, droh mir nur. Es wird dir nicht nützen.","Jo, jen do toho, jen mě zastrašuj. To ti nijak nepomůže.","","","DIA_Dyrian_Kneipe_ShutUp_13_01","",""
"Scripts/Content/Story/Dialoge/DIA_NOV_604_Dyrian.d:445","Ich werde der ganzen Welt erzählen, was du für ein scheinheiliger Kerl bist! Sobald ich diese Flasche ausgetrunken habe ...","Řeknu celému světu, co jsi za pokryteckou svini! Hned jak dopiju tuhle flašku...","","","DIA_Dyrian_Kneipe_ShutUp_13_02","",""
"Scripts/Content/Story/Dialoge/DIA_NOV_604_Dyrian.d:446","Jetzt geh mir aus den Augen, du widerst mich an!","Běž mi z očí, je mi z tebe nanic!","","","DIA_Dyrian_Kneipe_ShutUp_13_03","",""
"Scripts/Content/Story/Dialoge/DIA_NOV_604_Dyrian.d:461","Wie sieht's aus?","Jak to jde?","","","DIA_Dyrian_nachher.description","",""
"Scripts/Content/Story/Dialoge/DIA_NOV_604_Dyrian.d:474","Wie sieht's aus?","Co se stalo?","","","DIA_Dyrian_nachher_15_00","",""
"Scripts/Content/Story/Dialoge/DIA_NOV_604_Dyrian.d:475","Ach, lass mich bloß in Ruhe! Mit dir will ich nichts mehr zu tun haben!","Aaa, nech mě na pokoji! Už s tebou nechci mít nic společného!","","","DIA_Dyrian_nachher_13_01","",""
"Scripts/Content/Story/Dialoge/DIA_NOV_605_Opolos.d:50","Hallo, Du bist doch der Neue.","Ahoj, ty musíš být ten nový chlapík.","","","DIA_Opolos_Hello_12_00","",""
"Scripts/Content/Story/Dialoge/DIA_NOV_605_Opolos.d:51","Ich bin Opolos. Ich kümmere mich hier um die Schafe.","Jsem Opolos. Starám se tady o ovce.","","","DIA_Opolos_Hello_12_01","",""
"Scripts/Content/Story/Dialoge/DIA_NOV_605_Opolos.d:63","Ich hab hier diese Schafswurst...","Mám tu pro tebe skopovou klobásu...","","","DIA_Opolos_Wurst.description","",""
"Scripts/Content/Story/Dialoge/DIA_NOV_605_Opolos.d:79","Ich hab hier diese Schafswurst...","Mám tu pro tebe skopovou klobásu.","","","DIA_Opolos_Wurst_15_00","",""
"Scripts/Content/Story/Dialoge/DIA_NOV_605_Opolos.d:80","Oh Mann, Wahnsinn! Endlich wieder eine leckere Schafswurst!","No člověče, to je skvělý! Konečně další výborná skopová klobása.","","","DIA_Opolos_Wurst_12_01","",""
"Scripts/Content/Story/Dialoge/DIA_NOV_605_Opolos.d:103","Wie lange bist du schon im Kloster?","Jak dlouho už jsi v klášteře?","","","DIA_Opolos_HowLong.description","",""
"Scripts/Content/Story/Dialoge/DIA_NOV_605_Opolos.d:116","Wie lange bist du schon im Kloster?","Jak dlouho už jsi v klášteře?","","","DIA_Opolos_HowLong_15_00","",""
"Scripts/Content/Story/Dialoge/DIA_NOV_605_Opolos.d:117","Ich bin seit drei Jahren hier. Aber bisher habe ich noch nicht studiert, obwohl ich das gerne würde.","Jsem tady tři roky. Ale zatím jsem vůbec nestudoval, i když bych rád.","","","DIA_Opolos_HowLong_12_01","",""
"Scripts/Content/Story/Dialoge/DIA_NOV_605_Opolos.d:118","Warum nicht?","Proč ne?","","","DIA_Opolos_HowLong_15_02","",""
"Scripts/Content/Story/Dialoge/DIA_NOV_605_Opolos.d:119","Meine Aufgabe ist das Hüten der Schafe - nicht das Studieren der Schriften.","Mojí prací je starat se o ovce - ne studovat spisy.","","","DIA_Opolos_HowLong_12_03","",""
"Scripts/Content/Story/Dialoge/DIA_NOV_605_Opolos.d:120","Und solange Meister Parlan mich nicht von dieser Pflicht entbindet, ist es mir nicht erlaubt, in der Bibliothek zu lernen.","Dokud mě mistr Parlan neuvolní z téhle služby, nemůžu studovat v knihovně.","","","DIA_Opolos_HowLong_12_04","",""
"Scripts/Content/Story/Dialoge/DIA_NOV_605_Opolos.d:137","Auf was muss ich hier im Kloster achten?","Jak se mám tady v klášteře chovat?","","","DIA_Opolos_Monastery.description","",""
"Scripts/Content/Story/Dialoge/DIA_NOV_605_Opolos.d:151","Auf was muss ich hier im Kloster achten?","Jak se mám tady v klášteře chovat?","","","DIA_Opolos_Monastery_15_00","",""
"Scripts/Content/Story/Dialoge/DIA_NOV_605_Opolos.d:152","Belüge niemals einen Magier. Vergehe dich nicht an einem Bruder der Gemeinschaft.","Nikdy nelži mágům. Neprohřeš se proti bratrovi ze společenstva.","","","DIA_Opolos_Monastery_12_01","",""
"Scripts/Content/Story/Dialoge/DIA_NOV_605_Opolos.d:153","Respektiere das Eigentum der Gemeinschaft. Wenn du gegen diese Regeln verstößt, musst du eine Strafe bei Meister Parlan zahlen.","Respektuj majetek společenstva. Pokud tato pravidla porušíš, budeš se zodpovídat mistru Parlanovi.","","","DIA_Opolos_Monastery_12_02","",""
"Scripts/Content/Story/Dialoge/DIA_NOV_605_Opolos.d:154","Ansonsten kann ich dir nur raten, nimm dich vor Agon in acht. Wenn Du nicht aufpasst, ergeht es dir wie Babo.","Kromě toho bych tě měl varovat, aby ses měl na pozoru před Agonem. Když nebudeš dost opatrný, skončíš jako Babo.","","","DIA_Opolos_Monastery_12_03","",""
"Scripts/Content/Story/Dialoge/DIA_NOV_605_Opolos.d:166","Kannst du mir was beibringen?","Můžeš mě něčemu naučit?","","","DIA_Opolos_beibringen.description","",""
"Scripts/Content/Story/Dialoge/DIA_NOV_605_Opolos.d:181","Kannst du mir was beibringen?","Mohl bys mě něco naučit?","","","DIA_Opolos_beibringen_15_00","",""
"Scripts/Content/Story/Dialoge/DIA_NOV_605_Opolos.d:182","Klar, ich hab früher mal Leute verprügelt. Ich kann dir zeigen, wie du deine Arme trainierst.","Jasně, kdysi jsem býval docela dobrý rváč. Můžu ti ukázat, jak posílit paže.","","","DIA_Opolos_beibringen_12_01","",""
"Scripts/Content/Story/Dialoge/DIA_NOV_605_Opolos.d:183","Allerdings will ich gerne etwas über Tränke erfahren. Vor allem über magische Tränke.","Ale já bych se rád naučil něco o lektvarech, hlavně o těch magických.","","","DIA_Opolos_beibringen_12_02","",""
"Scripts/Content/Story/Dialoge/DIA_NOV_605_Opolos.d:184","Wie kann ich dir dabei helfen?","Jak bych ti s tím jen mohl pomoci?","","","DIA_Opolos_beibringen_15_03","",""
"Scripts/Content/Story/Dialoge/DIA_NOV_605_Opolos.d:185","Na ja, wenn du für Neoras arbeitest, bekommst du bestimmt Gelegenheit eins seiner Rezepte kurzfristig 'auszuleihen'.","No, kdybys pracoval pro Neorase, určitě by se ti naskytla příležitost 'vypůjčit' si na chvíli jeden z jeho receptů.","","","DIA_Opolos_beibringen_12_04","",""
"Scripts/Content/Story/Dialoge/DIA_NOV_605_Opolos.d:186","Wenn du es mir bringst, so dass ich einen Blick drauf werfen kann, werde ich dich trainieren.","Když mi ho přineseš, abych se na něj mohl podívat, něco tě určitě naučím.","","","DIA_Opolos_beibringen_12_05","",""
"Scripts/Content/Story/Dialoge/DIA_NOV_605_Opolos.d:203","Wegen des Rezepts...","Co se týče toho receptu...","","","DIA_Opolos_rezept.description","",""
"Scripts/Content/Story/Dialoge/DIA_NOV_605_Opolos.d:223","Ich habe das Rezept, das du wolltest.","Mám ten recept, který jsi chtěl.","","","DIA_Opolos_rezept_15_00","",""
"Scripts/Content/Story/Dialoge/DIA_NOV_605_Opolos.d:224","Gut, dann lass mich mal lesen.","Dobrá, půjč mi ho, ať si ho přečtu.","","","DIA_Opolos_rezept_12_01","",""
"Scripts/Content/Story/Dialoge/DIA_NOV_605_Opolos.d:226","Aha ... hm ... ja ... verstehe ... soso ...","Aha... hm... ano... jo takhle... dobrá, dobrá...","","","DIA_Opolos_rezept_12_02","",""
"Scripts/Content/Story/Dialoge/DIA_NOV_605_Opolos.d:228","Gut, vielen Dank. Wenn du willst, kannst du bei mir trainieren.","A je to. Pokud chceš, můžu tě něco naučit.","","","DIA_Opolos_rezept_12_03","",""
"Scripts/Content/Story/Dialoge/DIA_NOV_605_Opolos.d:241","Ich habe Neoras das Rezept schon wiedergebracht.","Už jsem ten recept vrátil Neorasovi.","","","DIA_Opolos_rezept_15_04","",""
"Scripts/Content/Story/Dialoge/DIA_NOV_605_Opolos.d:242","Ach Scheiße - ich komme hier wohl nie zum Studieren. Was soll's. Ich trainiere dich trotzdem.","A dopr... Asi se tady nic nenaučím. Ale co. Stejně ti něco ukážu.","","","DIA_Opolos_rezept_12_05","",""
"Scripts/Content/Story/Dialoge/DIA_NOV_605_Opolos.d:254","Ich komme später drauf zurück.","K tomu se dostanu později.","","","DIA_Opolos_rezept_15_06","",""
"Scripts/Content/Story/Dialoge/DIA_NOV_605_Opolos.d:268","Ich will stärker werden.","Chci se stát silnějším.","","","DIA_Opolos_TEACH_STR.description","",""
"Scripts/Content/Story/Dialoge/DIA_NOV_605_Opolos.d:283","Ich will stärker werden.","Chtěl bych se stát silnějším.","","","DIA_Opolos_TEACH_STR_15_00","",""
"Scripts/Content/Story/Dialoge/DIA_NOV_605_Opolos.d:295","Du bist ganz schön kräftig geworden. Mehr kann ich dir nicht beibringen.","Už teď jsi dost silný. Těžko bych tě naučil něco nového.","","","DIA_Opolos_TEACH_STR_12_00","",""
"Scripts/Content/Story/Dialoge/DIA_NOV_605_Opolos.d:330","Wer sind Agon und Babo?","Kdo jsou Agon a Babo?","","","DIA_Opolos_Agon.description","",""
"Scripts/Content/Story/Dialoge/DIA_NOV_605_Opolos.d:344","Wer sind Agon und Babo?","Kdo jsou Agon a Babo?","","","DIA_Opolos_Agon_15_00","",""
"Scripts/Content/Story/Dialoge/DIA_NOV_605_Opolos.d:345","Agon kümmert sich um den Kräutergarten. Er ist zwar auch Novize, führt sich aber auf, als wäre er der Erwählte persönlich.","Agon se staré o bylinkovou zahradu. Je také novic, ale chová se, jako by byl sám vyvolený.","","","DIA_Opolos_Agon_12_01","",""
"Scripts/Content/Story/Dialoge/DIA_NOV_605_Opolos.d:346","Babo ist kurz vor dir ins Kloster gekommen. Zuerst hat er Agon im Kräutergarten geholfen.","Babo přišel do kláštera krátce před tebou. Zpočátku pomáhal Agonovi v zahradě.","","","DIA_Opolos_Agon_12_02","",""
"Scripts/Content/Story/Dialoge/DIA_NOV_605_Opolos.d:347","Aber sie hatten wohl einen Streit und seitdem fegt Babo den Hof.","Ale museli se asi nějak poprat a od té doby Babo jen zametá dvůr.","","","DIA_Opolos_Agon_12_03","",""
"Scripts/Content/Story/Dialoge/DIA_NOV_605_Opolos.d:348","Weißt du, was passiert ist?","Víš, co se stalo?","","","DIA_Opolos_Agon_15_04","",""
"Scripts/Content/Story/Dialoge/DIA_NOV_605_Opolos.d:349","Nicht genau. Da musst du schon die beiden fragen. Aber Agons Wort hat mehr Gewicht als das eines anderen Novizen, weil er der Neffe des Stadthalters ist.","Ne tak docela přesně. Na to se budeš muset zeptat jich. Ale Agonovo slovo má větší váhu než kohokoliv z noviců, protože je synovec místodržícího.","","","DIA_Opolos_Agon_12_05","",""
"Scripts/Content/Story/Dialoge/DIA_NOV_605_Opolos.d:362","Ich habe die Liesel mitgebracht","Podívej, přivedl jsem ti Betsy.","","","DIA_Opolos_LIESEL.description","",""
"Scripts/Content/Story/Dialoge/DIA_NOV_605_Opolos.d:376","Ich habe die Liesel mitgebracht. Kann ich sie dir überlassen?","Podívej, přivedl jsem Betsy. Můžu ji nechat u tebe?","","","DIA_Opolos_LIESEL_15_00","",""
"Scripts/Content/Story/Dialoge/DIA_NOV_605_Opolos.d:389","Ja, natürlich. Kein schönes Tier. Ich werde gut auf sie aufpassen.","Ano, samozřejmě. Hezké zvířátko. Dobře se o ni postarám.","","","DIA_Opolos_LIESEL_12_01","",""
"Scripts/Content/Story/Dialoge/DIA_NOV_605_Opolos.d:394","Hm...irgendwie scheint sie mir abhanden gekommen zu sein. Ich komme später wieder.","Hm... zdá se, že jsem to špatně založil. Vrátím se později.","","","DIA_Opolos_Add_15_00","",""
"Scripts/Content/Story/Dialoge/DIA_NOV_605_Opolos.d:408","Wegen der Bibliothek...","Co se týče knihovny...","","","DIA_Opolos_Biblothek.description","",""
"Scripts/Content/Story/Dialoge/DIA_NOV_605_Opolos.d:422","Wegen der Bibliothek...","Co se týče knihovny...","","","DIA_Opolos_Biblothek_15_00","",""
"Scripts/Content/Story/Dialoge/DIA_NOV_605_Opolos.d:426","Das ist der verschlossene Raum links neben der Pforte.","Je to ta zamčená místnost nalevo, vedle vrat.","","","DIA_Opolos_Biblothek_12_01","",""
"Scripts/Content/Story/Dialoge/DIA_NOV_605_Opolos.d:427","Aber du bekommst den Schlüssel erst, wenn Meister Parlan entscheidet, dass du die Lehren studieren darfst.","Ale klíč dostaneš až ve chvíli, kdy mistr Parlan dojde k názoru, že můžeš studovat.","","","DIA_Opolos_Biblothek_12_02","",""
"Scripts/Content/Story/Dialoge/DIA_NOV_605_Opolos.d:431","Du Glücklicher hast den Schlüssel zur Bibliothek bekommen, und dabei bist du erst kurze Zeit hier.","Ty máš víc štěstí než rozumu! Máš klíč ke knihovně, a přitom jsi tady jenom takovou chvilku.","","","DIA_Opolos_Biblothek_12_03","",""
"Scripts/Content/Story/Dialoge/DIA_NOV_605_Opolos.d:432","Nutze die Chance und lerne aus den alten Schriften!","Využij té příležitosti a uč se ze starých spisů!","","","DIA_Opolos_Biblothek_12_04","",""
"Scripts/Content/Story/Dialoge/DIA_NOV_605_Opolos.d:462","Hallo. Danke, dass du mir geholfen hast. Ich werde diese Chance nutzen und viel lernen.","Ahoj. Děkuji, žes mi pomohl. Pokusím se z téhle šance vytěžit co nejvíc a naučit se tolik, co jen půjde.","","","DIA_Opolos_HelloAgain_12_00","",""
"Scripts/Content/Story/Dialoge/DIA_NOV_605_Opolos.d:463","Aber du hast jetzt sicher keine Zeit, dich mit einem einfachen Novizen zu unterhalten, Meister.","Ale určitě nemáš čas jen tak klábosit s obyčejným novicem, mistře.","","","DIA_Opolos_HelloAgain_12_01","",""
"Scripts/Content/Story/Dialoge/DIA_NOV_605_Opolos.d:479","Wie geht's?","Jak se vede?","","","DIA_Opolos_HowIsIt.description","",""
"Scripts/Content/Story/Dialoge/DIA_NOV_605_Opolos.d:492","Wie geht's?","Jak se vede?","","","DIA_Opolos_HowIsIt_15_00","",""
"Scripts/Content/Story/Dialoge/DIA_NOV_605_Opolos.d:496","Ausgezeichnet. Seitdem ich studieren kann, ist alles bestens.","Výborně. Od chvíle, co mohu studovat, je všechno vynikající.","","","DIA_Opolos_HowIsIt_12_01","",""
"Scripts/Content/Story/Dialoge/DIA_NOV_605_Opolos.d:500","Ich erfülle die mir gestellten Aufgaben getreu meiner Pflicht, Meister.","Poslušně plním všechny zadané úkoly, mistře.","","","DIA_Opolos_HowIsIt_12_02","",""
"Scripts/Content/Story/Dialoge/DIA_NOV_605_Opolos.d:501","Innos stellt mich jeden Tag vor neue Herausforderungen. Ich werde weiter an mir arbeiten.","Každý den přede mne Innos klade nové výzvy. Budu nadále pracovat na vlastním zdokonalování.","","","DIA_Opolos_HowIsIt_12_03","",""
"Scripts/Content/Story/Dialoge/DIA_NOV_605_Opolos.d:573","Was machen die Schafe?","Jak je ovečkám?","","","DIA_Opolos_Kap3_PERM.description","",""
