"location","source","target","id","fuzzy","context","translator_comments","developer_comments"
"Scripts/Content/Story/Dialoge/DIA_PC_Mage_OW.d:400","Kannst du mir was beibringen?","Můžeš mě něčemu naučit?","","","DIA_MiltenOW_Lehren.description","",""
"Scripts/Content/Story/Dialoge/DIA_PC_Mage_OW.d:414","Kannst du mir was beibringen?","Můžeš mě něčemu naučit?","","","DIA_MiltenOW_Lehren_15_00","",""
"Scripts/Content/Story/Dialoge/DIA_PC_Mage_OW.d:415","Ich kann dich in einige Zauber aus dem zweiten Kreis der Magie einweihen oder ich kann dir helfen, deine magische Kraft zu steigern.","Mohu tě naučit trochu magie z druhého magického kruhu, případně ti také mohu pomoci zvýšit magické síly.","","","DIA_MiltenOW_Lehren_03_01","",""
"Scripts/Content/Story/Dialoge/DIA_PC_Mage_OW.d:416","Wenn du die Bereitschaft verspürst, deine Macht zu mehren, dann werde ich dich unterweisen.","Jestli jsi připravený na zvýšení magické síly, mohu tě začít učit.","","","DIA_MiltenOW_Lehren_03_02","",""
"Scripts/Content/Story/Dialoge/DIA_PC_Mage_OW.d:429","Lehre mich den zweiten Kreis der Magie!","Nauč mě druhý magický kruh!","","","DIA_MiltenOW_TeachCircle2.description","",""
"Scripts/Content/Story/Dialoge/DIA_PC_Mage_OW.d:444","Lehre mich den zweiten Kreis der Magie!","Nauč mě druhý magický kruh!","","","DIA_Milten_Add_15_00","",""
"Scripts/Content/Story/Dialoge/DIA_PC_Mage_OW.d:445","Normalerweise ist das den Lehrern unseres Ordens vorbehalten.","Většinou to je privilegium vyhrazené učitelům našeho řádu.","","","DIA_Milten_Add_03_01","",""
"Scripts/Content/Story/Dialoge/DIA_PC_Mage_OW.d:446","Aber ich denke, in diesem Fall können wir mal 'ne Ausnahme machen...","Ale myslím, že v tomto případě můžeme udělat výjimku.","","","DIA_Milten_Add_03_02","",""
"Scripts/Content/Story/Dialoge/DIA_PC_Mage_OW.d:450","Ich weiß nicht, ob ich die offiziellen Worte noch weiß...","Nevím, jestli si pamatuju ta oficiální slova správně...","","","DIA_Milten_Add_03_03","",""
"Scripts/Content/Story/Dialoge/DIA_PC_Mage_OW.d:451","Tritt nun in den zweiten Kreis. Äh... Er zeigt dir die Richtung - doch deine Taten formen den Weg - oder so...","Vstup nyní do druhého kruhu. Ehm... Ukáže ti směr - cestu však budou tvořit skutky tvé - nebo tak nějak to bylo...","","","DIA_Milten_Add_03_04","",""
"Scripts/Content/Story/Dialoge/DIA_PC_Mage_OW.d:452","Ich denke, du hast verstanden, worum es geht...","Myslím, že víš, co to má znamenat...","","","DIA_Milten_Add_03_05","",""
"Scripts/Content/Story/Dialoge/DIA_PC_Mage_OW.d:466","Ich will neue Zauber lernen.","Chci se naučit nějaká nová kouzla.","","","DIA_MiltenOW_Teach.description","",""
"Scripts/Content/Story/Dialoge/DIA_PC_Mage_OW.d:481","Ich will neue Zauber lernen.","Chci se naučit nějaká nová kouzla.","","","DIA_MiltenOW_Teach_15_00","",""
"Scripts/Content/Story/Dialoge/DIA_PC_Mage_OW.d:505","Du hast noch nicht den zweiten Kreis der Magie erreicht. Ich kann dir nichts beibringen.","Ještě jsi nevstoupil do druhého magického kruhu. Nemůžu tě nic naučit.","","","DIA_MiltenOW_Teach_03_01","",""
"Scripts/Content/Story/Dialoge/DIA_PC_Mage_OW.d:539","Ich will meine magischen Kräfte steigern.","Chtěl bych posílit svoji magickou moc.","","","DIA_MiltenOW_Mana.description","",""
"Scripts/Content/Story/Dialoge/DIA_PC_Mage_OW.d:554","Ich will meine magischen Kräfte steigern.","Chtěl bych posílit svoji magickou moc.","","","DIA_MiltenOW_Mana_15_00","",""
"Scripts/Content/Story/Dialoge/DIA_PC_Mage_OW.d:566","Deine magische Kraft ist groß. Zu groß, als dass ich dir jetzt noch helfen könnte, sie zu steigern.","Tvá magická síla je veliká. Příliš velká na to, abych ti ji mohl pomoci ještě zvýšit.","","","DIA_MiltenOW_Mana_03_00","",""
"Scripts/Content/Story/Dialoge/DIA_PC_Mage_OW.d:604","Was ist deine Aufgabe hier?","Jakou práci tu vykonáváš?","","","DIA_MiltenOW_Perm.description","",""
"Scripts/Content/Story/Dialoge/DIA_PC_Mage_OW.d:618","Was ist deine Aufgabe hier?","Co tady máš za úkol?","","","DIA_MiltenOW_Perm_15_00","",""
"Scripts/Content/Story/Dialoge/DIA_PC_Mage_OW.d:619","Ursprünglich sollte ich das Erz untersuchen. Aber davon haben wir bisher nicht viel gesehen.","Původně jsem měl provádět rozbor magické rudy. Zatím jsme jí ale moc nedostali.","","","DIA_MiltenOW_Perm_03_01","",""
"Scripts/Content/Story/Dialoge/DIA_PC_Mage_OW.d:620","Jetzt widme ich mich dem Studium der Alchemie.","Teď se soustřeďuji na studium alchymie.","","","DIA_MiltenOW_Perm_03_02","",""
"Scripts/Content/Story/Dialoge/DIA_PC_Mage_OW.d:633","Was sind deine Pläne?","Co máš v plánu?","","","DIA_MiltenOW_Plan.description","",""
"Scripts/Content/Story/Dialoge/DIA_PC_Mage_OW.d:647","Was sind deine Pläne?","Co máš v plánu?","","","DIA_MiltenOW_Plan_15_00","",""
"Scripts/Content/Story/Dialoge/DIA_PC_Mage_OW.d:648","Ich werde wieder zurückkehren. Ich warte noch eine Weile ab, aber da Gorn nun frei ist, kann ich mich zusammen mit ihm absetzen.","Vrátím se. Chvíli ještě počkám, ale teď, když je Gorn na svobodě, můžu vyrazit společně s ním.","","","DIA_MiltenOW_Plan_03_01","",""
"Scripts/Content/Story/Dialoge/DIA_PC_Mage_OW.d:649","Es ist mehr als nötig, dass Pyrokar von der Situation hier erfährt.","Je naprosto nezbytné, aby se Pyrokar dozvěděl, jak to tady vypadá.","","","DIA_MiltenOW_Plan_03_02","",""
"Scripts/Content/Story/Dialoge/DIA_PC_Mage_OW.d:650","Wie du meinst.","Když myslíš.","","","DIA_MiltenOW_Plan_15_03","",""
"Scripts/Content/Story/Dialoge/DIA_PC_Mage_OW.d:651","Ich hoffe, dass Lord Hagen erkennen wird, welche Bedrohung von diesem Tal ausgeht. Nicht auszudenken, was passiert, wenn die Orks über den Pass kommen.","Doufám, že lord Hagen rozpozná, co za hrozbu vychází z tohoto údolí. Lepší si nepředstavovat, co by se stalo, kdyby skřeti přešli přes průsmyk.","","","DIA_MiltenOW_Plan_03_04","",""
"Scripts/Content/Story/Dialoge/DIA_PC_Mage_OW.d:652","Na dann, gute Reise.","No, v tom případě ti přeju bezpečnou cestu.","","","DIA_MiltenOW_Plan_15_05","",""
"Scripts/Content/Story/Dialoge/DIA_PC_Mage_OW.d:665","(Es wäre schwierig seinen Trank zu stehlen)","(Ukrást tenhle lektvar bude dosti obtížné.)","","","DIA_MiltenOW_PICKPOCKET.description","",""
