"location","source","target","id","fuzzy","context","translator_comments","developer_comments"
"Scripts/Content/Story/Dialoge/DIA_Addon_BDT_1084_Senyan.d:315","Ich habe den Verräter gefunden. Es ist Fisk.","Znalazіem zdrajcк. To Fisk.","","True","DIA_Addon_BDT_1084_Senyan_Found.description","",""
"Scripts/Content/Story/Dialoge/DIA_Addon_BDT_1084_Senyan.d:329","Ich habe den Verräter gefunden. Es ist Fisk.","Znalazіem zdrajcк. To Fisk.","","True","DIA_Addon_BDT_1084_Senyan_Found_15_00","",""
"Scripts/Content/Story/Dialoge/DIA_Addon_BDT_1084_Senyan.d:358","(wütend) Du hast unsere Abmachung nicht eingehalten.","Zіamaіeњ umowк.","","True","DIA_Addon_BDT_1084_Senyan_derbe_12_00","",""
"Scripts/Content/Story/Dialoge/DIA_Addon_BDT_1085_Bloodwyn.d:82","Hey, wie bist du hier reingekommen?","Hej, jak siк tutaj dostaіeњ?","","True","DIA_Addon_Bloodwyn_Dead_04_00","",""
"Scripts/Content/Story/Dialoge/DIA_Addon_BDT_1085_Bloodwyn.d:83","Durch den Eingang.","Przez wejњcie.","","True","DIA_Addon_Bloodwyn_Dead_15_01","",""
"Scripts/Content/Story/Dialoge/DIA_Addon_BDT_1085_Bloodwyn.d:84","Witzig ... ich HASSE Witze.","Їartujesz sobie? NIENAWIDZК їartуw.","","True","DIA_Addon_Bloodwyn_Dead_04_02","",""
"Scripts/Content/Story/Dialoge/DIA_Addon_BDT_1085_Bloodwyn.d:95","Und ich dachte ich hätte dich erwischt.","A juї myњlaіem, їe ciк mam.","","True","DIA_Addon_Bloodwyn_Wait.DIA_Addon_Bloodwyn_Wait_GOOD1","Info_AddChoice",""
"Scripts/Content/Story/Dialoge/DIA_Addon_BDT_1085_Bloodwyn.d:96","Alles hat mal ein Ende.","Wszystko siк koсczy.","","True","DIA_Addon_Bloodwyn_Wait.DIA_Addon_Bloodwyn_Wait_BAD1","Info_AddChoice",""
"Scripts/Content/Story/Dialoge/DIA_Addon_BDT_1085_Bloodwyn.d:103","Und wer glaubst du hat die Barriere zum Einsturz gebracht?","Wydaje ci siк, їe kto jest odpowiedzialny za upadek bariery?","","True","DIA_Addon_Bloodwyn_Wait.DIA_Addon_Bloodwyn_Wait_GOOD2","Info_AddChoice",""
"Scripts/Content/Story/Dialoge/DIA_Addon_BDT_1085_Bloodwyn.d:104","Du und viele andere Typen auch...","Ty i wielu innych...","","True","DIA_Addon_Bloodwyn_Wait.DIA_Addon_Bloodwyn_Wait_BAD2","Info_AddChoice",""
"Scripts/Content/Story/Dialoge/DIA_Addon_BDT_1085_Bloodwyn.d:111","Er hatte wohl keine Zeit, um wählerisch zu sein...","Nie s№dzк, їeby miaі czas na staranne wybieranie...","","True","DIA_Addon_Bloodwyn_Wait.DIA_Addon_Bloodwyn_Wait_GOOD3","Info_AddChoice",""
"Scripts/Content/Story/Dialoge/DIA_Addon_BDT_1085_Bloodwyn.d:112","Ja, das war wohl sein größter Fehler...","Tak, to pewnie byі jego najwiкkszy bі№d....","","True","DIA_Addon_Bloodwyn_Wait.DIA_Addon_Bloodwyn_Wait_BAD3","Info_AddChoice",""
"Scripts/Content/Story/Dialoge/DIA_Addon_BDT_1085_Bloodwyn.d:138","Du hast die Minecrawler getötet? Gut. Ich übernehme jetzt. Los, verschwinde.","Zabiіeњ peіzacze? Dobrze, ja zajmк siк reszt№. Zjeїdїaj.","","True","DIA_Addon_Bloodwyn_Wait_04_00","",""
"Scripts/Content/Story/Dialoge/DIA_Addon_BDT_1085_Bloodwyn.d:139","Warte mal.","Nie tak szybko.","","True","DIA_Addon_Bloodwyn_Wait_15_01","",""
"Scripts/Content/Story/Dialoge/DIA_Addon_BDT_1085_Bloodwyn.d:140","Du bist noch nicht weg?","Jeszcze tu jesteњ?","","True","DIA_Addon_Bloodwyn_Wait_04_02","",""
"Scripts/Content/Story/Dialoge/DIA_Addon_BDT_1085_Bloodwyn.d:142","Wir haben noch was zu klären.","Musimy o czymњ porozmawiaж.","","True","DIA_Addon_Bloodwyn_Wait_15_03","",""
"Scripts/Content/Story/Dialoge/DIA_Addon_BDT_1085_Bloodwyn.d:146","Ich suche Raven.","Szukam Kruka.","","True","DIA_Addon_Bloodwyn_Wait.DIA_Addon_Bloodwyn_Wait_Raven","Info_AddChoice",""
"Scripts/Content/Story/Dialoge/DIA_Addon_BDT_1085_Bloodwyn.d:151","Ich suche Raven.","Szukam Kruka.","","True","DIA_Addon_Bloodwyn_Wait_Raven_15_00","",""
"Scripts/Content/Story/Dialoge/DIA_Addon_BDT_1085_Bloodwyn.d:152","Ja - und warum glaubst, dass Raven ausgerechnet mit DIR ... warte mal DU bist ... DU bist das????","Taak. A co Kruk moїe chcieж od CIEBIE... Zaraz... TY jesteњ... To TY?!","","True","DIA_Addon_Bloodwyn_Wait_Raven_04_01","",""
"Scripts/Content/Story/Dialoge/DIA_Addon_BDT_1085_Bloodwyn.d:153","Du bist der Kerl, den wir die ganze Zeit gesucht haben. Was machst DU hier? Du solltest längst tot sein!","To ty jesteњ tym bydlakiem, ktуrego szukamy. Co tu, u diabіa, robisz? Juї dawno powinieneњ gryџж ziemiк!","","True","DIA_Addon_Bloodwyn_Wait_Raven_04_02","",""
"Scripts/Content/Story/Dialoge/DIA_Addon_BDT_1085_Bloodwyn.d:154","Das sagt man mir dauernd.","Sіyszaіem to juї nieraz.","","True","DIA_Addon_Bloodwyn_Wait_Raven_15_03","",""
"Scripts/Content/Story/Dialoge/DIA_Addon_BDT_1085_Bloodwyn.d:155","Diese Pünten haben alle versagt - aber an mir wirst du nicht vorbeikommen. Dieses Mal erledige ich dich!","Nie udaіo siк їadnemu z tamtych nierobуw... Ale koіo mnie nie przejdziesz. Tu koсczy siк twoja podrуї!","","True","DIA_Addon_Bloodwyn_Wait_Raven_04_04","",""
"Scripts/Content/Story/Dialoge/DIA_Addon_BDT_1085_Bloodwyn.d:156","Wie ich bereits sagte - es ist Raven, den ich suche - du bist nicht wichtig für mich.","Jak juї wspominaіem, szukam Kruka. Ty siк dla mnie nie liczysz.","","True","DIA_Addon_Bloodwyn_Wait_Raven_15_05","",""
"Scripts/Content/Story/Dialoge/DIA_Addon_BDT_1085_Bloodwyn.d:157","Ich werde dich töten - Ich habe bis jetzt jeden Kampf überlebt!","Zabijк ciк - wygraіem kaїd№ walkк!","","True","DIA_Addon_Bloodwyn_Wait_Raven_04_06","",""
"Scripts/Content/Story/Dialoge/DIA_Addon_BDT_1085_Bloodwyn.d:164","Genug geredet. Lass uns kämpfen.","Doњж tego gadania. Pokaї, co umiesz.","","True","DIA_Addon_Bloodwyn_Wait_Raven_FIGHT_15_00","",""
"Scripts/Content/Story/Dialoge/DIA_Addon_BDT_1085_Bloodwyn.d:165","(triumphierend) Es ist sowieso zu spät für dich! Raven ist gerade dabei, den Tempel zu öffnen! Hahahaha - Stirb Mistkerl!","I tak siк spуџniіeњ. Kruk wіaњnie przygotowuje siк do otwarcia њwi№tyni - giс, robaku!","","True","DIA_Addon_Bloodwyn_Wait_Raven_FIGHT_04_01","",""
"Scripts/Content/Story/Dialoge/DIA_Addon_BDT_1085_Bloodwyn.d:173","HAHAHA - ich werde dich trotzdem besiegen!","HAHAHA - I tak wygram!","","True","DIA_Addon_Bloodwyn_Lach_04_00","",""
"Scripts/Content/Story/Dialoge/DIA_Addon_BDT_1085_Bloodwyn.d:178","AARGH! Du mieser Hund!","Aaagh! Ty psie!","","True","DIA_Addon_Bloodwyn_Wut_04_00","",""
"Scripts/Content/Story/Dialoge/DIA_Addon_BDT_1085_Bloodwyn.d:187","Und ich habe die Explosion der Barriere ohne einen Kratzer überlebt!","Przetrwaіem upadek bariery bez najmniejszego zadrapania!","","True","DIA_Addon_Bloodwyn_SayChoice_2_04_00","",""
"Scripts/Content/Story/Dialoge/DIA_Addon_BDT_1085_Bloodwyn.d:192","Du kannst mich nicht besiegen, ich bin Ravens engster Vertrauter! Seine rechte Hand!","Nie moїesz mnie pokonaж! Jestem najbardziej zaufanym towarzyszem Kruka! Jego praw№ rкk№!","","True","DIA_Addon_Bloodwyn_SayChoice_3_04_00","",""
"Scripts/Content/Story/Dialoge/DIA_Addon_BDT_1085_Bloodwyn.d:198","Und ich dachte, ich hätte dich erwischt.","A juї myњlaіem, їe ciк mam.","","True","DIA_Addon_Bloodwyn_Wait_Raven_GOOD1_15_00","",""
"Scripts/Content/Story/Dialoge/DIA_Addon_BDT_1085_Bloodwyn.d:207","Alles hat mal ein Ende.","Wszystko siк koсczy.","","True","DIA_Addon_Bloodwyn_Wait_Raven_BAD1_15_00","",""
"Scripts/Content/Story/Dialoge/DIA_Addon_BDT_1085_Bloodwyn.d:217","Und wer glaubst du hat die Barriere zum Einsturz gebracht?","Wydaje ci siк, їe kto jest odpowiedzialny za upadek bariery?","","True","DIA_Addon_Bloodwyn_Wait_Raven_GOOD2_15_00","",""
"Scripts/Content/Story/Dialoge/DIA_Addon_BDT_1085_Bloodwyn.d:226","Du und viele andere Typen auch ...","Ty i wielu innych...","","True","DIA_Addon_Bloodwyn_Wait_Raven_BAD2_15_00","",""
"Scripts/Content/Story/Dialoge/DIA_Addon_BDT_1085_Bloodwyn.d:236","Er hat wohl keine Zeit, um wählerisch zu sein ...","Nie s№dzк, їeby miaі czas na staranne wybieranie...","","True","DIA_Addon_Bloodwyn_Wait_Raven_GOOD3_15_00","",""
"Scripts/Content/Story/Dialoge/DIA_Addon_BDT_1085_Bloodwyn.d:244","Ja, das war wohl sein größter Fehler ...","Tak, to pewnie byі jego najwiкkszy bі№d....","","True","DIA_Addon_Bloodwyn_Wait_Raven_BAD3_15_00","",""
"Scripts/Content/Story/Dialoge/DIA_Addon_BDT_1086_Scatty.d:76","Wie läuft das Geschäft?","Jak ci id№ interesy?","","True","DIA_Addon_Scatty_Hi.description","",""
"Scripts/Content/Story/Dialoge/DIA_Addon_BDT_1086_Scatty.d:86","Wie läuft das Geschäft?","Jak ci id№ interesy?","","True","DIA_Addon_Scatty_Hi_15_00","",""
"Scripts/Content/Story/Dialoge/DIA_Addon_BDT_1086_Scatty.d:87","Seitdem die Gruft offen ist, werde ich nicht mehr viel los.","Od otwarcia krypty coraz gorzej....","","True","DIA_Addon_Scatty_Hi_01_01","",""
"Scripts/Content/Story/Dialoge/DIA_Addon_BDT_1086_Scatty.d:88","Raven hat keine Verwendung mehr für die Sklaven, deshalb hacken sie jetzt das Gold. Auf Anordnung von Bloodwyn.","Kruk nie potrzebuje juї niewolnikуw. Teraz kopi№ zіoto, bo tak kazaі im Bloodwyn.","","True","DIA_Addon_Scatty_Hi_01_02","",""
"Scripts/Content/Story/Dialoge/DIA_Addon_BDT_1086_Scatty.d:89","Und die Buddler ruhen sich aus. (murmelt) Buddler, die sich ausruhen, sind nicht gut für's Geschäft.","A kopacze maj№ wolne. Odpoczywaj№cy kopacze nie wrуї№ dobrze moim interesom.","","True","DIA_Addon_Scatty_Hi_01_03","",""
"Scripts/Content/Story/Dialoge/DIA_Addon_BDT_1086_Scatty.d:108","Bloodwyn? Hat der hier was zu sagen? ","Bloodwyn? To on tu jest szefem? ","","True","DIA_Addon_Scatty_last.description","",""
"Scripts/Content/Story/Dialoge/DIA_Addon_BDT_1086_Scatty.d:122","Bloodwyn? Hat der hier was zu sagen?","Bloodwyn? To on tu jest szefem?","","True","DIA_Addon_Scatty_last_15_00","",""
"Scripts/Content/Story/Dialoge/DIA_Addon_BDT_1086_Scatty.d:123","Er hat die Aufsicht über die Mine. Aber er ist so gut wie nie hier unten. Die meiste Zeit verbringt er bei Raven im Tempel.","Kontroluje kopalniк, ale rzadko do niej zagl№da. Wiкkszoњж czasu spкdza z Krukiem w њwi№tyni.","","True","DIA_Addon_Scatty_last_01_01","",""
"Scripts/Content/Story/Dialoge/DIA_Addon_BDT_1086_Scatty.d:124","Was genau bedeutet 'so gut wie nie'?","Co dokіadnie oznacza 'rzadko'?","","True","DIA_Addon_Scatty_last_15_02","",""
"Scripts/Content/Story/Dialoge/DIA_Addon_BDT_1086_Scatty.d:125","Das letzte Mal habe ich ihn gesehen, als er aus der Gruft kam ...","Ostatnio widziaіem go, gdy wychodziі z krypty...","","True","DIA_Addon_Scatty_last_01_03","",""
"Scripts/Content/Story/Dialoge/DIA_Addon_BDT_1086_Scatty.d:126","(eilig) ... Nein, warte! Das letzte Mal war er hier, als er die Sklaven zum Goldhacken geschickt hat.","Nie, czekaj! To chyba byіo wtedy, gdy wysіaі niewolnikуw, aby wydobywali zіoto.","","True","DIA_Addon_Scatty_last_01_04","",""
"Scripts/Content/Story/Dialoge/DIA_Addon_BDT_1086_Scatty.d:127","Im Gegensatz zu Raven hat ER ein großes Interesse an Gold.","Bardzo je lubi... inaczej niї Kruk.","","True","DIA_Addon_Scatty_last_01_05","",""
"Scripts/Content/Story/Dialoge/DIA_Addon_BDT_1086_Scatty.d:139","Was ist das für eine Gruft?","O jakiej krypcie mуwisz?","","True","DIA_Addon_Scatty_Gruft.description","",""
"Scripts/Content/Story/Dialoge/DIA_Addon_BDT_1086_Scatty.d:152","Was ist das für eine Gruft?","O jakiej krypcie mуwisz?","","True","DIA_Addon_Scatty_Gruft_15_00","",""
"Scripts/Content/Story/Dialoge/DIA_Addon_BDT_1086_Scatty.d:153","Eine verfluchte Unglücksgruft. Die Wächter der Gruft haben viele Männer getötet!","To przeklкta krypta! Jej straїnicy zabili wielu ludzi!","","True","DIA_Addon_Scatty_Gruft_01_01","",""
"Scripts/Content/Story/Dialoge/DIA_Addon_BDT_1086_Scatty.d:154","Wächter? Redest du von Wesen aus Stein? Ziemlich flach mit rundem Kopf?","Straїnicy? Mуwisz o tych kamiennych stworach? O pіaskich twarzach i okr№gіych gіowach?","","True","DIA_Addon_Scatty_Gruft_15_02","",""
"Scripts/Content/Story/Dialoge/DIA_Addon_BDT_1086_Scatty.d:155","Genau die meine ich! Zu Dutzenden kamen sie aus den Tiefen des Steins.","Tak! Ze skaі wyszіy ich caіe tuziny!","","True","DIA_Addon_Scatty_Gruft_01_03","",""
"Scripts/Content/Story/Dialoge/DIA_Addon_BDT_1086_Scatty.d:156","Ich wusste von Anfang an, dass es nicht gut ist, die Gruft auszubuddeln.","Od pocz№tku wiedziaіem, їe otwieranie krypty to nie jest dobry pomysі.","","True","DIA_Addon_Scatty_Gruft_01_04","",""
"Scripts/Content/Story/Dialoge/DIA_Addon_BDT_1086_Scatty.d:157","Aber Raven war wie besessen von der Idee dort zu graben. Und als die Gruft endlich freigelegt war, ist er mit seiner Garde dort reinmarschiert.","Kruk miaі obsesjк na punkcie tych wykopalisk. Gdy tylko krypta zostaіa odsіoniкta, on i jego straїnicy weszli do њrodka.","","True","DIA_Addon_Scatty_Gruft_01_05","",""
"Scripts/Content/Story/Dialoge/DIA_Addon_BDT_1086_Scatty.d:169","Was wollte Raven in der Gruft?","Dlaczego Kruk tak chciaі wejњж do tej krypty?","","True","DIA_Addon_Scatty_GruftAgain.description","",""
"Scripts/Content/Story/Dialoge/DIA_Addon_BDT_1086_Scatty.d:182","Was wollte Raven in der Gruft?","Dlaczego Kruk tak chciaі wejњж do tej krypty?","","True","DIA_Addon_Scatty_GruftAgain_15_00","",""
"Scripts/Content/Story/Dialoge/DIA_Addon_BDT_1086_Scatty.d:183","(stutzt) Hm ... du bist ziemlich neugierig. Erinnerst mich an einen Kerl, den ich mal kannte.","Hmm. Jesteњ doњж wњcibski. Przypominasz mi goњcia, ktуrego kiedyњ znaіem.","","True","DIA_Addon_Scatty_GruftAgain_01_01","",""
"Scripts/Content/Story/Dialoge/DIA_Addon_BDT_1086_Scatty.d:184","Der war genau so neugierig. Und das ist ihm irgendwann zum Verhängnis geworden.","Byі rуwnie wњcibski. A pewnego dnia sprowadziіo to na niego zgubк.","","True","DIA_Addon_Scatty_GruftAgain_01_02","",""
"Scripts/Content/Story/Dialoge/DIA_Addon_BDT_1086_Scatty.d:185","Komm zur Sache. Was ist in der Gruft passiert?","Przestaс beіkotaж. Co siк staіo w krypcie?","","True","DIA_Addon_Scatty_GruftAgain_15_03","",""
"Scripts/Content/Story/Dialoge/DIA_Addon_BDT_1086_Scatty.d:186","Nun ... Ähm ... ich habe 'ne ziemlich trockene Kehle ...","No cуї... Ee, zaschіo mi w ustach. Napiіbym siк czegoњ.","","True","DIA_Addon_Scatty_GruftAgain_01_04","",""
"Scripts/Content/Story/Dialoge/DIA_Addon_BDT_1086_Scatty.d:187","Hey Scatty, NICHT JETZT. Das hier ist wichtig, also was hat Raven dort gemacht?","Hej, Scatt, NIE TERAZ. To waїne. Co Kruk robiі na dole?","","True","DIA_Addon_Scatty_GruftAgain_15_05","",""
"Scripts/Content/Story/Dialoge/DIA_Addon_BDT_1086_Scatty.d:188","Na schön. (atmet tief durch) Er ... er hat etwas gerufen ... beschworen. Er rief immer wieder Worte in einer fremden Sprache.","Dobrze... On... przywoіaі coњ, uїywaj№c sіуw jakiegoњ dziwnego jкzyka.","","True","DIA_Addon_Scatty_GruftAgain_01_06","",""
"Scripts/Content/Story/Dialoge/DIA_Addon_BDT_1086_Scatty.d:189","Helles Licht drang aus der Gruft und dann hörte ich einen Schrei, der mir durch Mark und Bein ging - ein dämonischer Schrei.","Ze њrodka krypty przesi№kaіo lњni№ce њwiatіo, potem usіyszaіem krzyk. Wstrz№saj№cy, demoniczny wrzask.","","True","DIA_Addon_Scatty_GruftAgain_01_07","",""
"Scripts/Content/Story/Dialoge/DIA_Addon_BDT_1086_Scatty.d:190","Und weiter?","Co staіo siк potem?","","True","DIA_Addon_Scatty_GruftAgain_15_08","",""
"Scripts/Content/Story/Dialoge/DIA_Addon_BDT_1086_Scatty.d:191","Mehr weiß ich nicht. In dem Augenblick kam Bloodwyn aus der Gruft und hat mir gesagt ich soll verschwinden. Und das habe ich dann auch getan.","To wszystko, co widziaіem. Z krypty wyszedі Bloodwyn i kazaі mi siк wynosiж. Tak zreszt№ zrobiіem.","","True","DIA_Addon_Scatty_GruftAgain_01_09","",""
"Scripts/Content/Story/Dialoge/DIA_Addon_BDT_1086_Scatty.d:192","Es hat auch gar nicht solange gedauert, und Raven ist mit seinen Jungs wieder im Tempel verschwunden. Seitdem hat sich Raven nicht mehr blicken lassen.","Krуtko potem Kruk i jego ludzie opuњcili њwi№tyniк. Od tamtej pory nie byіo go tu na dole.","","True","DIA_Addon_Scatty_GruftAgain_01_10","",""
"Scripts/Content/Story/Dialoge/DIA_Addon_BDT_1086_Scatty.d:204","Willst du was trinken?","Napijesz siк czegoњ?","","True","DIA_Addon_Scatty_Trinken.description","",""
"Scripts/Content/Story/Dialoge/DIA_Addon_BDT_1086_Scatty.d:217","Willst du was trinken?","Napijesz siк czegoњ?","","True","DIA_Addon_Scatty_Trinken_15_00","",""
"Scripts/Content/Story/Dialoge/DIA_Addon_BDT_1086_Scatty.d:218","Wenn du ein Bier hast, das wäre jetzt genau das Richtige. Bier gibt's nämlich kaum hier im Lager.","Napiіbym siк piwa. Trudno je dostaж w tym obozie.","","True","DIA_Addon_Scatty_Trinken_01_01","",""
"Scripts/Content/Story/Dialoge/DIA_Addon_BDT_1086_Scatty.d:219","Aber vielleicht hat Lucia noch 'ne Flasche ...","Moїe Lucia ma jeszcze gdzieњ butelkк.","","True","DIA_Addon_Scatty_Trinken_01_02","",""
"Scripts/Content/Story/Dialoge/DIA_Addon_BDT_1086_Scatty.d:231","Wohl bekommt's. (Bier geben)","Zdrуwko! (Daj piwo)","","True","DIA_Addon_Scatty_Bier.description","",""
"Scripts/Content/Story/Dialoge/DIA_Addon_BDT_1086_Scatty.d:245","Wohl bekomm's.","Zdrуwko!","","True","DIA_Addon_Scatty_Bier_15_00","",""
"Scripts/Content/Story/Dialoge/DIA_Addon_BDT_1086_Scatty.d:252","Oh, schmeckt das gut. Danke Mann. Du bist mein Held.","Och, ale dobre. Dziкki, jesteњ moim bohaterem.","","True","DIA_Addon_Scatty_Bier_01_01","",""
"Scripts/Content/Story/Dialoge/DIA_Addon_BDT_1086_Scatty.d:277","Eine Spitzhacke in die Hand nehmen und auf 'nen Goldklumpen draufschlagen, das kann jeder.","Bierzesz kilof i walisz w kawaі zіota... Kaїdy to potrafi.","","True","DIA_Addon_Scatty_Gold_01_00","",""
"Scripts/Content/Story/Dialoge/DIA_Addon_BDT_1086_Scatty.d:278","Aber dabei zersplittern viele Nuggets. Deshalb sollten nur Leute hacken, die was davon verstehen.","Jeњli jednak bкdziesz tak robiж, zіoto rozpadnie siк na drobne bryіki. Dlatego wіaњnie kopaж powinni ludzie z doњwiadczeniem.","","True","DIA_Addon_Scatty_Gold_01_01","",""
"Scripts/Content/Story/Dialoge/DIA_Addon_BDT_1086_Scatty.d:279","Ich kann dir noch mehr erzählen, wenn du etwas Erfahrung mitbringst.","Jeїeli masz trochк doњwiadczenia, to mogк ci powiedzieж jeszcze parк rzeczy.","","True","DIA_Addon_Scatty_Gold_01_02","",""
"Scripts/Content/Story/Dialoge/DIA_Addon_BDT_1086_Scatty.d:296","Goldhacken lernen (Kosten: 2 LP/10 Prozent)","Naucz siк wydobywania zіota. (Koszt: 2 PN/10 procent)","","True","DIA_Addon_Scatty_teach.description","",""
"Scripts/Content/Story/Dialoge/DIA_Addon_BDT_1086_Scatty.d:310","Erzähl mir mehr über's Goldhacken.","Powiedz mi coњ o kopaniu zіota.","","True","DIA_Addon_Scatty_teach_15_00","",""
"Scripts/Content/Story/Dialoge/DIA_Addon_BDT_1086_Scatty.d:314","Als vor allem solltest du wissen, dass Gold kein Erz ist. Es ist weich wie Butter. Wenn du zu hart schlägst, zersplittert dir alles.","Musisz pamiкtaж, їe zіoto nie przypomina rudy. Jest miкkkie jak masіo. Jak uderzysz zbyt mocno, rozpadnie siк na drobne kawaіeczki.","","True","DIA_Addon_Scatty_teach_01_01","",""
"Scripts/Content/Story/Dialoge/DIA_Addon_BDT_1086_Scatty.d:315","Jeder Buddler hat seine eigenen Tricks, um ein paar schöne Nuggets aus dem Fels zu kloppen.","Kaїdy z kopaczy zna sztuczki, dziкki ktуrym wydobywa ze skaіy іadne bryіki.","","True","DIA_Addon_Scatty_teach_01_02","",""
"Scripts/Content/Story/Dialoge/DIA_Addon_BDT_1086_Scatty.d:316","Diese Tricks sind es, die letztendlich den Unterschied zwischen einem Buddler und einem guten Buddler ausmachen.","To wіaњnie pomaga rozrуїniж dobrego kopacza od zіego.","","True","DIA_Addon_Scatty_teach_01_03","",""
"Scripts/Content/Story/Dialoge/DIA_Addon_BDT_1086_Scatty.d:317","Außerdem: Übung macht den Meister. Wenn du erst mal 'ne Weile gehackt hast, wirst du auch besser.","No i praktyka teї robi swoje. Jak trochк popracujesz, bкdzie ci szіo lepiej.","","True","DIA_Addon_Scatty_teach_01_04","",""
"Scripts/Content/Story/Dialoge/DIA_Addon_BDT_1086_Scatty.d:338","Bloodwyn ist tot.","Bloodwyn nie їyje.","","True","DIA_Addon_Scatty_tot.description","",""
"Scripts/Content/Story/Dialoge/DIA_Addon_BDT_1086_Scatty.d:351","Bloodwyn ist tot.","Bloodwyn nie їyje.","","True","DIA_Addon_Scatty_tot_15_00","",""
"Scripts/Content/Story/Dialoge/DIA_Addon_BDT_1086_Scatty.d:352","Hm, gibt ja nicht viele, denen ich das wünsche - aber Bloodwyn ist besser dran, wenn er tot ist.","Hmm, taka wiadomoњж nie powinna mnie ucieszyж. Ale Bloodwyn jest kolesiem, ktуrego wolк widzieж martwym.","","True","DIA_Addon_Scatty_tot_01_01","",""
"Scripts/Content/Story/Dialoge/DIA_Addon_BDT_1088_Torwache.d:60","HALT!","СТІЙ!","","","DIA_Addon_BDT_1088_Addon_Torwache_FirstWarn_06_00","",""
"Scripts/Content/Story/Dialoge/DIA_Addon_BDT_1088_Torwache.d:66","Geh mir aus dem Weg, Wache.","Геть з дороги, охоронець.","","","DIA_Addon_BDT_1088_Torwache_FirstWarn_15_01","",""
"Scripts/Content/Story/Dialoge/DIA_Addon_BDT_1088_Torwache.d:67","Ahh, in Ordnung, du kannst passieren.","Ааа, все в порядку, ти можеш пройти.","","False","DIA_Addon_BDT_10018_Torwache_FirstWarn_06_02","",""
"Scripts/Content/Story/Dialoge/DIA_Addon_BDT_1088_Torwache.d:76","Solange du Thorus keinen roten Stein gegeben hast, bist du hier unerwünscht.","Поки Торус не видав тобі червоний камінь, ти тут не потрібний.","","","DIA_Addon_BDT_1088_Addon_Torwache_FirstWarn_06_03","",""
"Scripts/Content/Story/Dialoge/DIA_Addon_BDT_1088_Torwache.d:81","Hast du mich nicht verstanden? (eindringlich) GEH WEG!","Ти мене погано чуєш? (квапливо) ПІШОВ ЗВІДСИ!","","","DIA_Addon_BDT_1088_Addon_Torwache_FirstWarn_06_04","",""
"Scripts/Content/Story/Dialoge/DIA_Addon_BDT_1088_Torwache.d:86","(eindringlich) GEH WEG!","(квапливо) ПІШОВ ЗВІДСИ!","","","DIA_Addon_BDT_1088_Addon_Torwache_FirstWarn_06_05","",""
"Scripts/Content/Story/Dialoge/DIA_Addon_BDT_1088_Torwache.d:91","Hey, solange Thorus sein Okay nicht gegeben hat, kommst du nicht durch.","Гей, ти не пройдеш якщо Торус не дасть на те добро.","","","DIA_Addon_BDT_1088_Addon_Torwache_FirstWarn_06_06","",""
"Scripts/Content/Story/Dialoge/DIA_Addon_BDT_1088_Torwache.d:126","Okay, bleib ganz ruhig. Du hast jetzt noch eine letzte Chance. Du gehst SOFORT zurück, oder du stirbst ...","Гаразд, спокійно... У тебе є останній шанс. Або ти НЕГАЙНО розвертаєшся, або здохнеш...","","False","DIA_Addon_BDT_1088_Addon_Torwache_SecondWarn_06_00","",""
"Scripts/Content/Story/Dialoge/DIA_Addon_BDT_1088_Torwache.d:163","(seufzt) Du glaubst wohl, ich mache Spaß? Dir werd ich's zeigen ...","(зітхає) Ти що, жарутєш? А от я максимально серйозний...","","","DIA_Addon_BDT_1088_Addon_Torwache_Attack_06_00","",""
"Scripts/Content/Story/Dialoge/DIA_Addon_BDT_1090_Raven.d:46","Seht wer gekommen ist.","Подивіться хто прийшов.","","","DIA_Addon_Raven_Add_10_00","",""
"Scripts/Content/Story/Dialoge/DIA_Addon_BDT_1090_Raven.d:54","Mein Meister hat mich davor gewarnt, daß Innos seine Schergen schicken würde.","Мій повелитель попередив мене, що Іннос пришле свого поплічника.","","","DIA_Addon_Raven_Add_10_01","",""
"Scripts/Content/Story/Dialoge/DIA_Addon_BDT_1090_Raven.d:55","Aber das du so früh auftauchst, hätte ich nicht erwartet.","Але я не очікував, що ти прийдеш так швидко.","","","DIA_Addon_Raven_Add_10_02","",""
"Scripts/Content/Story/Dialoge/DIA_Addon_BDT_1090_Raven.d:56","Nun, da du so schnell warst (lacht) werde ich dir auch einen schnellen Tod schenken.","Що ж, якщо ти так поспішив (сміється), то і смерть твоя буде швидкою.","","","DIA_Addon_Raven_Add_10_03","",""
"Scripts/Content/Story/Dialoge/DIA_Addon_BDT_1090_Raven.d:59","DU bist derjenige der sterben wird.","Один з нас помре, і це будеш ТИ!","","","DIA_Addon_Raven_Hi.DIA_Addon_Raven_Hi_DU","Info_AddChoice",""
"Scripts/Content/Story/Dialoge/DIA_Addon_BDT_1090_Raven.d:60","Du hast deine Seele an Beliar verkauft!","Ти продав свою душу Беліару!","","","DIA_Addon_Raven_Hi.DIA_Addon_Raven_Hi_Soul","Info_AddChoice",""
"Scripts/Content/Story/Dialoge/DIA_Addon_BDT_1090_Raven.d:65","DU bist derjenige der sterben wird.","Один з нас помре, і це будеш ТИ!","","","DIA_Addon_Raven_Add_15_00","",""
"Scripts/Content/Story/Dialoge/DIA_Addon_BDT_1090_Raven.d:66","(lacht) Du bist keine Bedrohung für mich. Ich trage Beliars Schwert.","(сміється) Ти для мене не загроза. Я ношу меч Беліара.","","","DIA_Addon_Raven_Add_10_04","",""
"Scripts/Content/Story/Dialoge/DIA_Addon_BDT_1090_Raven.d:67","Ich werde die Drachen auf's Festland führen. Zusammen werden wir die Welt der Menschen in tiefste Dunkelheit tauchen.","Я поведу армію драконів на материк. Разом ми зануримо людський світ у вічну темряву.","","","DIA_Addon_Raven_Add_10_05","",""
"Scripts/Content/Story/Dialoge/DIA_Addon_BDT_1090_Raven.d:72","Du hast deine Seele an Beliar verkauft!","Ти продав свою душу Беліару!","","","DIA_Addon_Raven_Add_15_01","",""
"Scripts/Content/Story/Dialoge/DIA_Addon_BDT_1090_Raven.d:73","Zu einem guten Preis. Als General werde ich seine Armeen befehligen.","Так, і за хорошу ціну. Я буду генералом його армії.","","","DIA_Addon_Raven_Add_10_06","",""
