"location","source","target","id","fuzzy","context","translator_comments","developer_comments"
"Scripts/Content/Story/Dialoge/DIA_Addon_BDT_1098_Snaf.d:299","Dem Mann, den du suchst, wird das gefallen ...","Czіowiek, ktуrego szukasz, bкdzie bardzo zadowolony...","","True","DIA_Addon_Snaf_Abrechnung_01_09","",""
"Scripts/Content/Story/Dialoge/DIA_Addon_BDT_1098_Snaf.d:300","Allerdings besteht die Gefahr, dass er damit zu Esteban rennt - (ironisch) aber das weißt du ja selbst ...","Ale istnieje ryzyko, їe pobiegnie do Estebana – ale sam o tym przecieї wiesz.","","True","DIA_Addon_Snaf_Abrechnung_01_10","",""
"Scripts/Content/Story/Dialoge/DIA_Addon_BDT_1098_Snaf.d:305","Es heißt, du hättest Finn gesagt, du würdest für Esteban arbeiten.","Podobno powiedziaіeњ Finnowi, їe chкtnie pracowaіbyњ dla Estebana.","","True","DIA_Addon_Snaf_Abrechnung_01_11","",""
"Scripts/Content/Story/Dialoge/DIA_Addon_BDT_1098_Snaf.d:306","Ich weiß ja nicht, was du wirklich vorhast, aber der Mann, den du suchst, wird von jetzt an mit Sicherheit vorsichtiger sein.","Nie wiem, co planujesz, ale czіowiek, ktуrego szukasz, bкdzie teraz bardzo ostroїny.","","True","DIA_Addon_Snaf_Abrechnung_01_12","",""
"Scripts/Content/Story/Dialoge/DIA_Addon_BDT_1098_Snaf.d:310","Bis jetzt ist noch alles offen.","No wszystko siк moїe zdarzyж.","","True","DIA_Addon_Snaf_Abrechnung_01_13","",""
"Scripts/Content/Story/Dialoge/DIA_Addon_BDT_1098_Snaf.d:318","Danke.","Dziкkujк.","","True","DIA_Addon_Snaf_Abschied_15_14","",""
"Scripts/Content/Story/Dialoge/DIA_Addon_BDT_1098_Snaf.d:319","(schroff) Hey! Ich hab dir nichts erzählt, was du nicht schon längst wusstest, klar?!","Hej, nie powiedziaіem ci nic, czego byњ wczeњniej nie wiedziaі, jasne?","","True","DIA_Addon_Snaf_Abschied_01_15","",""
"Scripts/Content/Story/Dialoge/DIA_Addon_BDT_1098_Snaf.d:325","Wußte ich's doch ...","No pewnie..","","True","DIA_Addon_Snaf_Abschied_15_16","",""
"Scripts/Content/Story/Dialoge/DIA_Addon_BDT_1098_Snaf.d:326","Eben.","Dokіadnie.","","True","DIA_Addon_Snaf_Abschied_01_17","",""
"Scripts/Content/Story/Dialoge/DIA_Addon_BDT_1098_Snaf.d:340","Huno sagt, ich soll hier jemanden treffen...","Huno mуwi, їe mam kogoњ tu spotkaж.","","True","DIA_Addon_Snaf_HOCH.description","",""
"Scripts/Content/Story/Dialoge/DIA_Addon_BDT_1098_Snaf.d:353","Huno schickt mich","Przysyіa mnie Huno.","","True","DIA_Addon_Snaf_HOCH_15_00","",""
"Scripts/Content/Story/Dialoge/DIA_Addon_BDT_1098_Snaf.d:354","Sieht aus, als hättest du deinen Mann gefunden.","Wygl№da na to, їe znalazіeњ swojego czіowieka.","","True","DIA_Addon_Snaf_HOCH_01_01","",""
"Scripts/Content/Story/Dialoge/DIA_Addon_BDT_1098_Snaf.d:355","Geh doch mal eine Etage höher, dort wartet jemand auf dich.","Idџ na gуrк. Ktoњ tam na ciebie czeka.","","True","DIA_Addon_Snaf_HOCH_01_02","",""
"Scripts/Content/Story/Dialoge/DIA_Addon_BDT_1098_Snaf.d:376","Was halten die Leute hier von Esteban?","Co ludzie s№dz№ o Estebanie?","","True","DIA_Addon_Snaf_People.description","",""
"Scripts/Content/Story/Dialoge/DIA_Addon_BDT_1098_Snaf.d:390","Was halten die Leute hier von Esteban?","Co ludzie s№dz№ o Estebanie?","","True","DIA_Addon_Snaf_People_15_00","",""
"Scripts/Content/Story/Dialoge/DIA_Addon_BDT_1098_Snaf.d:391","Da musst du schon etwas genauer werden ...","O kogo ci dokіadnie chodzi?","","True","DIA_Addon_Snaf_People_01_01","",""
"Scripts/Content/Story/Dialoge/DIA_Addon_BDT_1098_Snaf.d:395","Jede Information kostet dich 'ne Kleinigkeit.","Kaїda informacja kosztuje.","","True","DIA_Addon_Snaf_People_01_02","",""
"Scripts/Content/Story/Dialoge/DIA_Addon_BDT_1098_Snaf.d:396","Wie viel?","Ile?","","True","DIA_Addon_Snaf_People_15_03","",""
"Scripts/Content/Story/Dialoge/DIA_Addon_BDT_1098_Snaf.d:397","10 Goldstücke!","10 sztuk zіota.","","True","DIA_Addon_Snaf_People_01_04","",""
"Scripts/Content/Story/Dialoge/DIA_Addon_BDT_1098_Snaf.d:405","Paul.","Paul.","","True","DIA_Addon_Snaf_People.DIA_Addon_Snaf_People_Paul","Info_AddChoice",""
"Scripts/Content/Story/Dialoge/DIA_Addon_BDT_1098_Snaf.d:406","Huno.","Huno.","","True","DIA_Addon_Snaf_People.DIA_Addon_Snaf_People_Huno","Info_AddChoice",""
"Scripts/Content/Story/Dialoge/DIA_Addon_BDT_1098_Snaf.d:407","Fisk.","Fisk.","","True","DIA_Addon_Snaf_People.DIA_Addon_Snaf_People_Fisk","Info_AddChoice",""
"Scripts/Content/Story/Dialoge/DIA_Addon_BDT_1098_Snaf.d:408","Emilio.","Emilio.","","True","DIA_Addon_Snaf_People.DIA_Addon_Snaf_People_Emilio","Info_AddChoice",""
"Scripts/Content/Story/Dialoge/DIA_Addon_BDT_1098_Snaf.d:411","Senyan.","Senyan.","","True","DIA_Addon_Snaf_People.DIA_Addon_Snaf_People_Senyan","Info_AddChoice",""
"Scripts/Content/Story/Dialoge/DIA_Addon_BDT_1098_Snaf.d:414","Lennar.","Lennar.","","True","DIA_Addon_Snaf_People.DIA_Addon_Snaf_People_Lennar","Info_AddChoice",""
"Scripts/Content/Story/Dialoge/DIA_Addon_BDT_1098_Snaf.d:415","Finn.","Finn.","","True","DIA_Addon_Snaf_People.DIA_Addon_Snaf_People_Finn","Info_AddChoice",""
"Scripts/Content/Story/Dialoge/DIA_Addon_BDT_1098_Snaf.d:421","Du hast nicht genug Gold, Junge!","Nie masz doњж pieniкdzy, maіy!","","True","DIA_Addon_Snaf_NotEnough_01_00","",""
"Scripts/Content/Story/Dialoge/DIA_Addon_BDT_1098_Snaf.d:431","Was ist mit Paul?","Co wiesz na temat Paula?","","True","DIA_Addon_Snaf_People_Paul_15_00","",""
"Scripts/Content/Story/Dialoge/DIA_Addon_BDT_1098_Snaf.d:434","Ich glaube, er mag Esteban nicht besonders. Seit er für Huno arbeitet, kommt er nicht mehr in die Mine.","Wydaje mi siк, їe nie przepada za Estebanem. Pracuje dla Huno, wiкc nie schodzi juї do kopalni.","","True","DIA_Addon_Snaf_People_Paul_01_01","",""
"Scripts/Content/Story/Dialoge/DIA_Addon_BDT_1098_Snaf.d:444","Was denkt Huno über Esteban?","Huno lubi Estebana?","","True","DIA_Addon_Snaf_People_Huno_15_00","",""
"Scripts/Content/Story/Dialoge/DIA_Addon_BDT_1098_Snaf.d:445","Ah! Huno. Über den weiß ich so gut wie nichts.","Ha. Huno. Wіaњciwie nic o nim nie wiem.","","True","DIA_Addon_Snaf_People_Huno_01_01","",""
"Scripts/Content/Story/Dialoge/DIA_Addon_BDT_1098_Snaf.d:446","(grinst) Diese Information ist natürlich gratis.","Ta informacja jest za darmo.","","True","DIA_Addon_Snaf_People_Huno_01_02","",""
"Scripts/Content/Story/Dialoge/DIA_Addon_BDT_1098_Snaf.d:451","Was ist mit Fisk?","Co moїesz mi powiedzieж o Fisku?","","True","DIA_Addon_Snaf_People_Fisk_15_00","",""
"Scripts/Content/Story/Dialoge/DIA_Addon_BDT_1098_Snaf.d:454","Fisk ist Fisk. Er bezahlt seinen Teil an Esteban und verteilt die Waren, die er größtenteils von den Piraten bekommt.","Fisk to Fisk. Pіaci haracz Estebanowi i oddaje mu czкњж towarуw, ktуre dostaje od piratуw.","","True","DIA_Addon_Snaf_People_Fisk_01_01","",""
"Scripts/Content/Story/Dialoge/DIA_Addon_BDT_1098_Snaf.d:455","Ich denke, Esteban ist ihm ziemlich egal.","Wydaje mi siк jednak, їe Esteban za bardzo go nie obchodzi.","","True","DIA_Addon_Snaf_People_Fisk_01_02","",""
"Scripts/Content/Story/Dialoge/DIA_Addon_BDT_1098_Snaf.d:465","Emilio. Was denkt er über Esteban?","Co Emilio s№dzi o Estebanie?","","True","DIA_Addon_Snaf_People_Emilio_15_00","",""
"Scripts/Content/Story/Dialoge/DIA_Addon_BDT_1098_Snaf.d:468","Ich denke, er würde nicht gerade Blumen an Estebans Grab bringen, wenn du verstehst, was ich meine.","Wydaje mi siк, їe nie zapaliіby њwieczki na jego grobie. Rozumiesz, o czym mуwiк?","","True","DIA_Addon_Snaf_People_Emilio_01_01","",""
"Scripts/Content/Story/Dialoge/DIA_Addon_BDT_1098_Snaf.d:478","Was ist mit Senyan?","Co powiesz o Senyanie?","","True","DIA_Addon_Snaf_People_Senyan_15_00","",""
"Scripts/Content/Story/Dialoge/DIA_Addon_BDT_1098_Snaf.d:481","Senyan ist einer von Estebans Jungs. Er arbeitet schon 'ne ganze Weile für ihn.","Senyan jest jednym z ludzi Estebana. Pracuje dla niego juї od pewnego czasu.","","True","DIA_Addon_Snaf_People_Senyan_01_01","",""
"Scripts/Content/Story/Dialoge/DIA_Addon_BDT_1098_Snaf.d:491","Was denkt Lennar über Esteban?","Co Lennar myњli o Estebanie?","","True","DIA_Addon_Snaf_People_Lennar_15_00","",""
"Scripts/Content/Story/Dialoge/DIA_Addon_BDT_1098_Snaf.d:492","So wie ich das beurteilen kann, denkt Lennar GAR nicht.","O ile dobrze wiem, Lennar NIE myњli.","","True","DIA_Addon_Snaf_People_Lennar_01_01","",""
"Scripts/Content/Story/Dialoge/DIA_Addon_BDT_1098_Snaf.d:497","Was ist mit Finn?","Co mi powiesz o Finnie?","","True","DIA_Addon_Snaf_People_Finn_15_00","",""
"Scripts/Content/Story/Dialoge/DIA_Addon_BDT_1098_Snaf.d:500","Ein guter Buddler. Er hat 'ne Nase für's Gold.","Dobry kopacz. Ma zmysі do szukania zіota.","","True","DIA_Addon_Snaf_People_Finn_01_01","",""
"Scripts/Content/Story/Dialoge/DIA_Addon_BDT_1098_Snaf.d:501","Esteban bevorzugt ihn deswegen. Ich denke, er steht ganz gut mit ihm.","Z tego powodu Esteban go szanuje. Wydaje mi siк, їe siк nawzajem dobrze dogaduj№.","","True","DIA_Addon_Snaf_People_Finn_01_02","",""
"Scripts/Content/Story/Dialoge/DIA_Addon_BDT_1098_Snaf.d:518","Was hältst DU von Esteban?","A jakie jest TWOJE zdanie o Estebanie?","","True","DIA_Addon_Snaf_Himself.description","",""
"Scripts/Content/Story/Dialoge/DIA_Addon_BDT_1098_Snaf.d:532","Was hältst DU von Esteban?","A jakie jest TWOJE zdanie o Estebanie?","","True","DIA_Addon_Snaf_Himself_15_00","",""
"Scripts/Content/Story/Dialoge/DIA_Addon_BDT_1098_Snaf.d:533","Wer über ihn redet, ist schnell tot ...","Kto o nim mуwi, szybko koсczy martwy...","","True","DIA_Addon_Snaf_Himself_01_01","",""
"Scripts/Content/Story/Dialoge/DIA_Addon_BDT_1098_Snaf.d:548","Wie läuft der Laden?","Jak id№ interesy?","","True","DIA_Addon_Snaf_PERM.description","",""
"Scripts/Content/Story/Dialoge/DIA_Addon_BDT_1098_Snaf.d:561","Wie läuft der Laden?","Jak id№ interesy?","","True","DIA_Addon_Snaf_PERM_15_00","",""
"Scripts/Content/Story/Dialoge/DIA_Addon_BDT_1098_Snaf.d:562","Gut! Estebans Ableben dürfte wohl für einige hier ein Grund zum Feiern sein ...","Cуї. Њmierж Estebana jest dla paru osуb okazj№ do њwiкtowania...","","True","DIA_Addon_Snaf_PERM_01_01","",""
"Scripts/Content/Story/Dialoge/DIA_Addon_BDT_1099_Huno.d:92","Was willst du noch? Verpiss dich!","Czego jeszcze chcesz? Spadaj!","","True","DIA_Addon_Huno_Abwimmeln_06_00","",""
"Scripts/Content/Story/Dialoge/DIA_Addon_BDT_1099_Huno.d:96","Worauf wartest du? Geh in die Kneipe!","Na co czekasz? Idџ siк napiж!","","True","DIA_Addon_Huno_Abwimmeln_06_01","",""
"Scripts/Content/Story/Dialoge/DIA_Addon_BDT_1099_Huno.d:114","Wie's aussieht, beherrschst du dein Handwerk.","Od razu widaж, їe znasz siк na swoim fachu.","","True","DIA_Addon_Huno_Hi.description","",""
"Scripts/Content/Story/Dialoge/DIA_Addon_BDT_1099_Huno.d:124","Wie's aussieht, beherrschst du dein Handwerk.","Od razu widaж, їe znasz siк na swoim fachu.","","True","DIA_Addon_Huno_Hi_15_00","",""
"Scripts/Content/Story/Dialoge/DIA_Addon_BDT_1099_Huno.d:125","Das habe ich doch schon mal gehört ... bringst du den Stahl?","Juї to kiedyњ sіyszaіem... przynosisz stal?","","True","DIA_Addon_Huno_Hi_06_01","",""
"Scripts/Content/Story/Dialoge/DIA_Addon_BDT_1099_Huno.d:126","Stahl? Nein, ich denke, du verwechselst mich ...","Stal? Nie, chyba mnie z kimњ pomyliіeњ....","","True","DIA_Addon_Huno_Hi_15_02","",""
"Scripts/Content/Story/Dialoge/DIA_Addon_BDT_1099_Huno.d:127","Hm ... irgendwie kommst du mir bekannt vor. Kennen wir uns irgendwo her?","Hmm... wygl№dasz znajomo. Spotkaliњmy siк wczeњniej?","","True","DIA_Addon_Huno_Hi_06_03","",""
"Scripts/Content/Story/Dialoge/DIA_Addon_BDT_1099_Huno.d:130","Klar, aus dem alten Lager.","Oczywiњcie, w Starym Obozie.","","True","DIA_Addon_Huno_Hi.DIA_Addon_Huno_Hi_JA","Info_AddChoice",""
"Scripts/Content/Story/Dialoge/DIA_Addon_BDT_1099_Huno.d:131","Ich wüßte nicht woher.","Nie pamiкtam tego.","","True","DIA_Addon_Huno_Hi.DIA_Addon_Huno_Hi_NO","Info_AddChoice",""
"Scripts/Content/Story/Dialoge/DIA_Addon_BDT_1099_Huno.d:139","Klar, aus dem alten Lager.","Oczywiњcie, w Starym Obozie.","","True","DIA_Addon_Huno_Hi_JA_15_00","",""
"Scripts/Content/Story/Dialoge/DIA_Addon_BDT_1099_Huno.d:140","Das alte Lager ... richtig ... du bist dieser neugierige Typ ... ich dachte, du wärst tot.","W Starym Obozie... racja... to ty jesteњ tym wњcibskim goњciem... myњlaіem, їe nie їyjesz.","","True","DIA_Addon_Huno_Hi_JA_06_01","",""
"Scripts/Content/Story/Dialoge/DIA_Addon_BDT_1099_Huno.d:141","Ja, das denken alle. Wer hat sonst noch überlebt?","Cуї, wszyscy tak s№dzili. Kto jeszcze przeїyі?","","True","DIA_Addon_Huno_Hi_JA_15_02","",""
"Scripts/Content/Story/Dialoge/DIA_Addon_BDT_1099_Huno.d:142","Wenige. Ein paar sind wie ich, mit Raven geflohen. Für viele andere wurde das alte Lager zum Grab.","Paru ludzi. Niektуrzy uciekli z Krukiem, tak jak ja. Wielu zginкіo w obozie.","","True","DIA_Addon_Huno_Hi_JA_06_03","",""
"Scripts/Content/Story/Dialoge/DIA_Addon_BDT_1099_Huno.d:151","Ich wüsste nicht, woher.","Nie pamiкtam tego.","","True","DIA_Addon_Huno_Hi_NO_15_00","",""
"Scripts/Content/Story/Dialoge/DIA_Addon_BDT_1099_Huno.d:152","Hm ... mein Gedächtnis ist ein Sieb ... was soll's ...","Hmm... Sam mam w gіowie mкtlik... Szlag by to trafiі...","","True","DIA_Addon_Huno_Hi_NO_06_01","",""
"Scripts/Content/Story/Dialoge/DIA_Addon_BDT_1099_Huno.d:166","Erzähl mir von deiner Flucht.","Opowiedz mi o ucieczce.","","True","DIA_Addon_Huno_Blitz.description","",""
"Scripts/Content/Story/Dialoge/DIA_Addon_BDT_1099_Huno.d:180","Erzähl mir von deiner Flucht.","Opowiedz mi o ucieczce.","","True","DIA_Addon_Huno_Blitz_15_00","",""
"Scripts/Content/Story/Dialoge/DIA_Addon_BDT_1099_Huno.d:181","An dem Tag als die Barriere fiel, brach Chaos aus.","Kiedy przestaіa istnieж bariera, zapanowaі chaos.","","True","DIA_Addon_Huno_Blitz_06_01","",""
"Scripts/Content/Story/Dialoge/DIA_Addon_BDT_1099_Huno.d:182","Einige versteckten sich - andere flohen und überall wurde geplündert.","Niektуrzy siк ukryli – inni uciekli, a wszystko zostaіo spl№drowane.","","True","DIA_Addon_Huno_Blitz_06_02","",""
"Scripts/Content/Story/Dialoge/DIA_Addon_BDT_1099_Huno.d:183","Was hast du gemacht?","Co zrobiіeњ?","","True","DIA_Addon_Huno_Blitz_15_03","",""
"Scripts/Content/Story/Dialoge/DIA_Addon_BDT_1099_Huno.d:184","Ich wollte gerade das Lager verlassen, da wird es schlagartig hell und ein sengender Schmerz fraß sich durch meine Haut.","Prуbowaіem uciec z obozu, gdy nagle zrobiіo siк strasznie jasno i poczuіem straszliwy bуl.","","True","DIA_Addon_Huno_Blitz_06_04","",""
"Scripts/Content/Story/Dialoge/DIA_Addon_BDT_1099_Huno.d:185","Ein verdammter Blitz hatte mich erwischt! Es ist mir so, als könnte ich ihn immer noch hören ...","Trafiі mnie cholerny piorun! Ci№gle mi siк zdaje, їe go sіyszк...","","True","DIA_Addon_Huno_Blitz_06_05","",""
"Scripts/Content/Story/Dialoge/DIA_Addon_BDT_1099_Huno.d:187","Später erzählte man mir, dass Thorus mich gefunden und mitgenommen hat.","Pуџniej dowiedziaіem siк, їe znalazі mnie Thorus i zabraі ze sob№.","","True","DIA_Addon_Huno_Blitz_06_06","",""
"Scripts/Content/Story/Dialoge/DIA_Addon_BDT_1099_Huno.d:202","Ich brauch 'ne bessere Rüstung.","Potrzebujк lepszej zbroi.","","True","DIA_Addon_Huno_Armor.description","",""
"Scripts/Content/Story/Dialoge/DIA_Addon_BDT_1099_Huno.d:219","Ich brauch 'ne bessere Rüstung.","Potrzebujк lepszej zbroi.","","True","DIA_Addon_Huno_Armor_15_00","",""
"Scripts/Content/Story/Dialoge/DIA_Addon_BDT_1099_Huno.d:222","So - die kannst du haben. Dass sie so teuer ist, liegt an Esteban.","Cуї – moїesz j№ mieж. To, їe jest taka droga, to wina Estebana.","","True","DIA_Addon_Huno_Armor_06_01","",""
"Scripts/Content/Story/Dialoge/DIA_Addon_BDT_1099_Huno.d:223","Dieser verfluchte Hund kassiert nämlich von jeder Rüstung, die ich verkaufe, seinen Teil ab.","Ten parszywy pies њci№ga haracz z kaїdej sprzedanej przeze mnie zbroi.","","True","DIA_Addon_Huno_Armor_06_02","",""
"Scripts/Content/Story/Dialoge/DIA_Addon_BDT_1099_Huno.d:227","Schwere Banditenrüstung kaufen (Schutz vor Waffen: 45, Pfeilen: 45, Kosten: 2100","Kup ciкїk№ zbrojк bandytуw. Ochrona (broс i strzaіy) 45, 2100 sztuk zіota.","","True","DIA_Addon_Huno_Armor.DIA_Addon_Huno_Armor_BUY","Info_AddChoice",""
"Scripts/Content/Story/Dialoge/DIA_Addon_BDT_1099_Huno.d:231","Fisk hat gesagt, du würdest mir 'nen guten Preis machen?","Fisk powiedziaі, їe sprzedasz mi j№ po dobrej cenie.","","True","DIA_Addon_Huno_Armor_15_03","",""
"Scripts/Content/Story/Dialoge/DIA_Addon_BDT_1099_Huno.d:232","Fisk sagst du? Hm, gut, ich schulde ihm noch einen Gefallen.","Fisk, powiadasz... Hmm, dobrze, jestem mu winien przysіugк.","","True","DIA_Addon_Huno_Armor_06_04","",""
"Scripts/Content/Story/Dialoge/DIA_Addon_BDT_1099_Huno.d:247","Okay, ich nehme die Rüstung.","Dobra, biorк zbrojк.","","True","DIA_Addon_Huno_Armor_Buy_15_00","",""
"Scripts/Content/Story/Dialoge/DIA_Addon_BDT_1099_Huno.d:251","Alles klar.","Wygl№da nieџle.","","True","DIA_Addon_Huno_Armor_Buy_06_01","",""
"Scripts/Content/Story/Dialoge/DIA_Addon_BDT_1099_Huno.d:257","Kein Gold, keine Rüstung.","Nie ma zіota, nie ma zbroi.","","True","DIA_Addon_Huno_Armor_Buy_06_02","",""
"Scripts/Content/Story/Dialoge/DIA_Addon_BDT_1099_Huno.d:277","Wegen des Attentats auf Esteban...","A co do prуby zabуjstwa Estebana...","","True","DIA_Addon_Huno_Attentat.description","",""
"Scripts/Content/Story/Dialoge/DIA_Addon_BDT_1099_Huno.d:291","(gefährlich) Was willst du von mir?","Czego ode mnie chcesz?","","True","DIA_Addon_Huno_Attentat_06_00","",""
"Scripts/Content/Story/Dialoge/DIA_Addon_BDT_1099_Huno.d:292","Ich suche den Auftraggeber ...","Szukam osoby, ktуra zleciіa zabуjstwo...","","True","DIA_Addon_Huno_Attentat_15_01","",""
"Scripts/Content/Story/Dialoge/DIA_Addon_BDT_1099_Huno.d:293","Und warum kommst du damit zu mir?","I przyszedіeњ z tym do mnie?","","True","DIA_Addon_Huno_Attentat_06_02","",""
"Scripts/Content/Story/Dialoge/DIA_Addon_BDT_1099_Huno.d:294","Ich hab gedacht, du weißt vielleicht was über die Sache.","Myњlaіem, їe moїesz coњ wiedzieж na ten temat.","","True","DIA_Addon_Huno_Attentat_15_03","",""
"Scripts/Content/Story/Dialoge/DIA_Addon_BDT_1099_Huno.d:295","Weiß ich NICHT!","Ale nie wiem!","","True","DIA_Addon_Huno_Attentat_06_04","",""
"Scripts/Content/Story/Dialoge/DIA_Addon_BDT_1099_Huno.d:308","(seufzt) Jetzt hör mal zu! Du bewegst jetzt deinen Arsch hier weg, bevor ich mich vergesse!","A teraz sіuchaj! Zabieraj st№d swуj tyіek, zanim przestanк nad sob№ panowaж!","","True","DIA_Addon_Huno_Stress_06_00","",""
"Scripts/Content/Story/Dialoge/DIA_Addon_BDT_1099_Huno.d:318","Ich habe da ein paar Dinge über dich gehört...","Sіyszaіem trochк ciekawych rzeczy na twуj temat...","","True","DIA_Addon_Huno_SomeThings.description","",""
"Scripts/Content/Story/Dialoge/DIA_Addon_BDT_1099_Huno.d:333","Ich habe da ein paar Dinge über dich gehört ...","Sіyszaіem trochк ciekawych rzeczy na twуj temat...","","True","DIA_Addon_Huno_SomeThings_15_00","",""
"Scripts/Content/Story/Dialoge/DIA_Addon_BDT_1099_Huno.d:337","So?","Hк?","","True","DIA_Addon_Huno_SomeThings_06_01","",""
"Scripts/Content/Story/Dialoge/DIA_Addon_BDT_1099_Huno.d:342","Schon wieder? (droht) Hoffentlich ist diesmal was wichtiges dabei ...","Znowu zaczynasz? Mam nadziejк, їe tym razem to coњ waїnego...","","True","DIA_Addon_Huno_SomeThings_06_02","",""
"Scripts/Content/Story/Dialoge/DIA_Addon_BDT_1099_Huno.d:349","Ich hab gehört, du warst nicht an deinem Platz, als das Attentat passiert ist!","Podobno w momencie zamachu nie byіo ciк na stanowisku!","","True","DIA_Addon_Huno_SomeThings_15_03","",""
"Scripts/Content/Story/Dialoge/DIA_Addon_BDT_1099_Huno.d:350","(gefährlich) Und weiter?","Tak?","","True","DIA_Addon_Huno_SomeThings_06_04","",""
"Scripts/Content/Story/Dialoge/DIA_Addon_BDT_1099_Huno.d:356","Paul hat gesagt, du würdest Esteban hassen.","Paul powiedziaі, їe nienawidzisz Estebana.","","True","DIA_Addon_Huno_SomeThings_15_05","",""
"Scripts/Content/Story/Dialoge/DIA_Addon_BDT_1099_Huno.d:357","(gefährlich) So? Hat er das? Und weiter?","Czyїby? Coњ jeszcze?","","True","DIA_Addon_Huno_SomeThings_06_06","",""
"Scripts/Content/Story/Dialoge/DIA_Addon_BDT_1099_Huno.d:363","Emilio hat deinen Namen ausgespuckt! Du weißt auf jeden Fall was über's Attentat!","Emilio zdradziі twoje imiк! Na pewno wiesz coњ na temat prуby zabуjstwa!","","True","DIA_Addon_Huno_SomeThings_15_07","",""
"Scripts/Content/Story/Dialoge/DIA_Addon_BDT_1099_Huno.d:364","(ruhig) Du hast dich ein bisschen mit dem alten Emilio unterhalten, was?","A wiкc porozmawiaіeњ sobie ze starym Emiliem, co?","","True","DIA_Addon_Huno_SomeThings_06_08","",""
"Scripts/Content/Story/Dialoge/DIA_Addon_BDT_1099_Huno.d:368","Und er ist nicht er Einzige, der dich verdächtigt!","Nie tylko on ciebie podejrzewa.","","True","DIA_Addon_Huno_SomeThings_15_09","",""
"Scripts/Content/Story/Dialoge/DIA_Addon_BDT_1099_Huno.d:370","Was soll das werden, hm?","Jak to?","","True","DIA_Addon_Huno_SomeThings_06_10","",""
"Scripts/Content/Story/Dialoge/DIA_Addon_BDT_1099_Huno.d:374","Ich will mit dem Attentäter gemeinsame Sache machen!","Chcк siк dogadaж ze zleceniodawc№ zabуjstwa!","","True","DIA_Addon_Huno_SomeThings.DIA_Addon_Huno_SomeThings_Contra","Info_AddChoice",""
"Scripts/Content/Story/Dialoge/DIA_Addon_BDT_1099_Huno.d:375","Wenn du hinter dem Attentat steckst, wirst du dafür bezahlen!","Jeњli stoisz za t№ prуb№ zabуjstwa, to zapіacisz za to!","","True","DIA_Addon_Huno_SomeThings.DIA_Addon_Huno_SomeThings_Pro","Info_AddChoice",""
"Scripts/Content/Story/Dialoge/DIA_Addon_BDT_1099_Huno.d:381","(droht) Vielleicht sollte ich mich auch mal mit ihm unterhalten. Ich bin mir sicher, DANACH behauptet er genau das Gegenteil!","Moїe teї powinienem z nim porozmawiaж. Jestem pewien, їe to pomoїe mu zmieniж zdanie!","","True","DIA_Addon_Huno_SomeThings_06_11","",""
"Scripts/Content/Story/Dialoge/DIA_Addon_BDT_1099_Huno.d:388","Weiter nichts ...","Nic wiкcej...","","True","DIA_Addon_Huno_SomeThings_15_12","",""
"Scripts/Content/Story/Dialoge/DIA_Addon_BDT_1099_Huno.d:396","Wenn du hinter dem Attentat steckst, wirst du dafür bezahlen!","Jeњli stoisz za t№ prуb№ zabуjstwa, to zapіacisz za to!","","True","DIA_Addon_Huno_SomeThings_Pro_15_00","",""
"Scripts/Content/Story/Dialoge/DIA_Addon_BDT_1099_Huno.d:397","(genervt) Du bist ja so ein Idiot! Glaubst du wirklich, du kannst dich bei Esteban einschleimen?","Jesteњ idiot№! Naprawdк zamierzasz podlizywaж siк Estebanowi?","","True","DIA_Addon_Huno_SomeThings_Pro_06_01","",""
"Scripts/Content/Story/Dialoge/DIA_Addon_BDT_1099_Huno.d:398","Mach, dass du wegkommst!","Spadaj st№d!","","True","DIA_Addon_Huno_SomeThings_Pro_06_02","",""
"Scripts/Content/Story/Dialoge/DIA_Addon_BDT_1099_Huno.d:406","Ich will mit dem Attentäter gemeinsame Sache machen!","Chcк siк dogadaж ze zleceniodawc№ zabуjstwa!","","True","DIA_Addon_Huno_SomeThings_Contra_15_00","",""
"Scripts/Content/Story/Dialoge/DIA_Addon_BDT_1099_Huno.d:407","Gegen Esteban? Wirklich? Dann beweise es!","Wyst№pisz przeciwko Estebanowi? Naprawdк? Wiкc to udowodnij!","","True","DIA_Addon_Huno_SomeThings_Contra_06_01","",""
"Scripts/Content/Story/Dialoge/DIA_Addon_BDT_1099_Huno.d:408","Ich warte schon zu lange auf eine Lieferung Stahl von den Piraten.","Zbyt dіugo juї czekam na dostawк stali od piratуw.","","True","DIA_Addon_Huno_SomeThings_Contra_06_02","",""
"Scripts/Content/Story/Dialoge/DIA_Addon_BDT_1099_Huno.d:409","Ich vermute, dass Esteban sie abgefangen hat, um sie mir später teuer zu verkaufen.","Domyњlam siк, їe przej№і j№ Esteban. Chce sprzedaж mi stal po wyїszej cenie.","","True","DIA_Addon_Huno_SomeThings_Contra_06_03","",""
"Scripts/Content/Story/Dialoge/DIA_Addon_BDT_1099_Huno.d:410","Das macht er natürlich nicht selbst. Ein paar der Banditen im Sumpf stehen auf seiner Lohnliste.","Oczywiњcie sam nie brudzi sobie tym r№k. Ma na usіugach paru bandytуw z bagna.","","True","DIA_Addon_Huno_SomeThings_Contra_06_04","",""
"Scripts/Content/Story/Dialoge/DIA_Addon_BDT_1099_Huno.d:411","Woher weißt du das?","Sk№d o tym wiesz?","","True","DIA_Addon_Huno_SomeThings_Contra_15_05","",""
"Scripts/Content/Story/Dialoge/DIA_Addon_BDT_1099_Huno.d:412","Betrunkene Banditen quatschen zuviel ...","Pijani bandyci duїo mуwi№...","","True","DIA_Addon_Huno_SomeThings_Contra_06_06","",""
"Scripts/Content/Story/Dialoge/DIA_Addon_BDT_1099_Huno.d:413","Hat der gesprächige Bandit auch einen Namen?","Ten gadatliwy bandyta ma jakieњ imiк?","","True","DIA_Addon_Huno_SomeThings_Contra_15_07","",""
"Scripts/Content/Story/Dialoge/DIA_Addon_BDT_1099_Huno.d:414","Sein Name geht dich nichts an. Aber der Kerl, den du SUCHST, heißt Juan. Allerdings habe ich ihn schon lange nicht mehr im Lager gesehen.","Nie powinno ciк to obchodziж. Ale goњж, ktуrego SZUKASZ, nazywa siк Juan. Jednak od dawna nie widziaіem go w obozie.","","True","DIA_Addon_Huno_SomeThings_Contra_06_08","",""
"Scripts/Content/Story/Dialoge/DIA_Addon_BDT_1099_Huno.d:415","Du wirst im Sumpf nach ihm suchen müssen.","Bкdziesz musiaі poszukaж go na bagnie.","","True","DIA_Addon_Huno_SomeThings_Contra_06_09","",""
"Scripts/Content/Story/Dialoge/DIA_Addon_BDT_1099_Huno.d:425","Du verrätst mir erst, wer der Auftraggeger ist!","Najpierw powiesz mi, kto zleciі zabуjstwo!","","True","DIA_Addon_Huno_SomeThings.DIA_Addon_Huno_SomeThings_TellMeNow","Info_AddChoice",""
"Scripts/Content/Story/Dialoge/DIA_Addon_BDT_1099_Huno.d:426","Okay, ich mach die Sache für dich!","W porz№dku, zrobiк to dla ciebie!","","True","DIA_Addon_Huno_SomeThings.DIA_Addon_Huno_SomeThings_Mission","Info_AddChoice",""
