"location","source","target","id","fuzzy","context","translator_comments","developer_comments"
"Scripts/Content/Story/Dialoge/DIA_Addon_PIR_1356_Bill.d:411","Zeig mir den Taschendiebstahl. (10 LP)","Pokaї mi, jak okradaж innych. (10 PN)","","","DIA_Addon_Bill_LearnTalent.description","",""
"Scripts/Content/Story/Dialoge/DIA_Addon_PIR_1356_Bill.d:425","Zeig mir den Taschendiebstahl.","Pokaї mi, jak okradaж innych.","","","DIA_Addon_Bill_LearnTalent_15_00","",""
"Scripts/Content/Story/Dialoge/DIA_Addon_PIR_1356_Bill.d:431","Wenn du jemanden beklauen möchtest, musst du dein Opfer in Sicherheit wiegen.","Jeњli chcesz kogoњ okraњж, musisz sprawiж, by poczuі siк bezpiecznie.","","","DIA_Addon_Bill_LearnTalent_03_01","",""
"Scripts/Content/Story/Dialoge/DIA_Addon_PIR_1356_Bill.d:432","Ich habe die Leute immer angequatscht. Das funktioniert prächtig.","Zawsze wci№gam ofiarк w pogawкdkк. Dziaіa bez pudіa.","","","DIA_Addon_Bill_LearnTalent_03_02","",""
"Scripts/Content/Story/Dialoge/DIA_Addon_PIR_1356_Bill.d:433","Wenn du zugreifst, dann sei dir sicher, dass dein Gegenüber nichts merkt.","Kiedy zabierasz siк za kradzieї, upewnij siк, їe ofiara niczego nie zauwaїyіa.","","","DIA_Addon_Bill_LearnTalent_03_03","",""
"Scripts/Content/Story/Dialoge/DIA_Addon_PIR_1356_Bill.d:435","Sonst noch was?","Coњ jeszcze?","","","DIA_Addon_Bill_LearnTalent_15_05","",""
"Scripts/Content/Story/Dialoge/DIA_Addon_PIR_1356_Bill.d:436","Ja, trainiere deine Geschicklichkeit. Je geschickter du bist, desto besser erkennst du eine gute Gelegenheit.","Tak. Potrenuj trochк zrкcznoњж, jako їe zrкczniejszemu zіodziejowi іatwiej spostrzec dobr№ okazjк.","","","DIA_Addon_Bill_LearnTalent_03_06","",""
"Scripts/Content/Story/Dialoge/DIA_Addon_PIR_1356_Bill.d:437","Und desto eher kannst du deinem Opfer seine Sachen abnehmen, ohne dabei ERWISCHT zu werden!","I іatwiej unikn№ж zіapania na gor№cym uczynku.","","","DIA_Addon_Bill_LearnTalent_03_07","",""
"Scripts/Content/Story/Dialoge/DIA_Addon_PIR_1356_Bill.d:438","Das ist alles, zumindest in der Theorie.","Przynajmniej w teorii.","","","DIA_Addon_Bill_LearnTalent_03_08","",""
"Scripts/Content/Story/Dialoge/DIA_Addon_PIR_1356_Bill.d:443","Vergiß es! Du bist nicht geschickt genug!","Zapomnij o tym. Jesteњ zbyt niezdarny!","","","DIA_Addon_Bill_LearnTalent_03_09","",""
"Scripts/Content/Story/Dialoge/DIA_Addon_PIR_1356_Bill.d:444","Du mußt entweder geschickter werden oder dir 'nen besseren Lehrer suchen.","Potrenuj zrкcznoњж albo znajdџ sobie lepszego nauczyciela.","","","DIA_Addon_Bill_LearnTalent_03_10","",""
"Scripts/Content/Story/Dialoge/DIA_Addon_PIR_1357_Garett.d:83","Komm bloß nicht auf die Idee, mich zu fragen, ob ich beim Entertrupp mitmache.","Jeњli chcesz zapytaж, czy do ciebie doі№czк, to moїesz sobie darowaж.","","","DIA_Addon_Garett_Anheuern_09_00","",""
"Scripts/Content/Story/Dialoge/DIA_Addon_PIR_1357_Garett.d:84","Was meinst du, was die anderen Jungs machen, wenn ich weg bin, hm?","Jak s№dzisz, co chіopaki zrobi№, kiedy sobie pуjdк?","","","DIA_Addon_Garett_Anheuern_09_01","",""
"Scripts/Content/Story/Dialoge/DIA_Addon_PIR_1357_Garett.d:85","Wenn ich wiederkomme, hab ich nicht EINE volle Kiste mehr in meiner Hütte!","Po powrocie nie znalazіbym ani jednej peіnej skrzynki w swojej chacie!","","","DIA_Addon_Garett_Anheuern_09_02","",""
"Scripts/Content/Story/Dialoge/DIA_Addon_PIR_1357_Garett.d:86","Ich bleibe hier und passe auf unsere Vorräte auf!","Nie ma mowy. Zostanк tutaj i bкdк pilnowaі zapasуw.","","","DIA_Addon_Garett_Anheuern_09_03","",""
"Scripts/Content/Story/Dialoge/DIA_Addon_PIR_1357_Garett.d:113","Sieh an, ein Neues Gesicht! Und keiner von den dreckigen Banditen, will ich doch hoffen!","Kogo my tu mamy? Ha, mam nadziejк, їe to nie kolejny bandzior na przeszpiegach.","","","DIA_Addon_Garett_Hello_09_00","",""
"Scripts/Content/Story/Dialoge/DIA_Addon_PIR_1357_Garett.d:114","Ich bin Garett. Wenn du irgend etwas brauchen solltest, frag zuerst mich.","Nazywam siк Garett. Jeњli masz na coњ ochotк, najlepiej zwrуж siк do mnie.","","","DIA_Addon_Garett_Hello_09_01","",""
"Scripts/Content/Story/Dialoge/DIA_Addon_PIR_1357_Garett.d:115","Ich kann dir fast alles besorgen, Wein, Waffen und vieles, was man sonst so braucht.","Mam tu wszystko, czego mуgіbyњ potrzebowaж - wino, broс i sporo innych rzeczy.","","","DIA_Addon_Garett_Hello_09_02","",""
"Scripts/Content/Story/Dialoge/DIA_Addon_PIR_1357_Garett.d:116","Außer Schnaps - wenn du 'nen ordentlichen Schnaps willst, geh zu Samuel.","Jeњli jednak szukasz dobrego trunku, lepiej zgіoњ siк do Samuela.","","","DIA_Addon_Garett_Hello_09_03","",""
"Scripts/Content/Story/Dialoge/DIA_Addon_PIR_1357_Garett.d:131","Wer ist Samuel?","Kim jest Samuel?","","","DIA_Addon_Garett_Samuel.description","",""
"Scripts/Content/Story/Dialoge/DIA_Addon_PIR_1357_Garett.d:145","Wer ist Samuel?","Kim jest Samuel?","","","DIA_Addon_Garett_Samuel_15_00","",""
"Scripts/Content/Story/Dialoge/DIA_Addon_PIR_1357_Garett.d:146","Unser Schnapsbrenner. Er hat seine Höhle etwas abseits des Lagers direkt am Strand.","To nasz gorzelnik. Rezyduje w jaskini przy plaїy.","","","DIA_Addon_Garett_Samuel_09_01","",""
"Scripts/Content/Story/Dialoge/DIA_Addon_PIR_1357_Garett.d:147","Nicht schwer zu finden, geh einfach Richtung Norden.","Nietrudno do niego trafiж. Po prostu pod№їaj caіy czas na pуіnoc.","","","DIA_Addon_Garett_Samuel_09_02","",""
"Scripts/Content/Story/Dialoge/DIA_Addon_PIR_1357_Garett.d:148","Ich kann dir nur raten, dich gut mit Grog einzudecken.","Radzк zrobiж maіy zapas grogu.","","","DIA_Addon_Garett_Samuel_09_03","",""
"Scripts/Content/Story/Dialoge/DIA_Addon_PIR_1357_Garett.d:149","Einige der Jungs hier sind Neuen gegenüber nicht gerade aufgeschlossen, verstehst du?","Niektуrzy chіopcy nie s№ zbyt przyjaџni w stosunku do nowych, їe siк tak wyraїк.","","","DIA_Addon_Garett_Samuel_09_04","",""
"Scripts/Content/Story/Dialoge/DIA_Addon_PIR_1357_Garett.d:150","Da kann ein ordentlicher Schluck Grog Wunder wirken!","A w takim wypadku grog moїe zdziaіaж cuda.","","","DIA_Addon_Garett_Samuel_09_05","",""
"Scripts/Content/Story/Dialoge/DIA_Addon_PIR_1357_Garett.d:164","Wo bekommst du deine Waren her?","Sk№d bierzesz swoje towary?","","","DIA_Addon_Garett_Warez.description","",""
"Scripts/Content/Story/Dialoge/DIA_Addon_PIR_1357_Garett.d:174","Wo bekommst du deine Waren her?","Sk№d bierzesz swoje towary?","","","DIA_Addon_Garett_Warez_15_00","",""
"Scripts/Content/Story/Dialoge/DIA_Addon_PIR_1357_Garett.d:175","Skip bringt immer 'ne Menge aus Khorinis mit, wenn er 'rüberfährt.","Skip przynosi je z Khorinis, gdzie czasami bywa.","","","DIA_Addon_Garett_Warez_09_01","",""
"Scripts/Content/Story/Dialoge/DIA_Addon_PIR_1357_Garett.d:176","Bis vor kurzem hat er einiges davon direkt an die Banditen verkauft.","Do niedawna sprzedawaі je bandytom.","","","DIA_Addon_Garett_Warez_09_02","",""
"Scripts/Content/Story/Dialoge/DIA_Addon_PIR_1357_Garett.d:177","Aber seit es mit den Banditen Krieg gibt, landet der ganze Kram bei mir.","Ale od czasu, gdy toczymy z nimi wojnк, wszystko trafia do mnie.","","","DIA_Addon_Garett_Warez_09_03","",""
"Scripts/Content/Story/Dialoge/DIA_Addon_PIR_1357_Garett.d:189","Was weißt du über die Banditen?","Co wiesz na temat bandytуw?","","","DIA_Addon_Garett_Bandits.description","",""
"Scripts/Content/Story/Dialoge/DIA_Addon_PIR_1357_Garett.d:202","Was weißt du über die Banditen?","Co wiesz na temat bandytуw?","","","DIA_Addon_Garett_Bandits_15_00","",""
"Scripts/Content/Story/Dialoge/DIA_Addon_PIR_1357_Garett.d:203","Dazu frag am besten mal Skip.","Najlepiej zapytaj o to Skipa.","","","DIA_Addon_Garett_Bandits_09_01","",""
"Scripts/Content/Story/Dialoge/DIA_Addon_PIR_1357_Garett.d:204","Der hat 'nen ganz schönen Tanz mitgemacht mit den Kerlen, das kann ich dir sagen.","Czкsto siк z nimi kontaktowaі, wiкc powinien sporo wiedzieж o tych draniach.","","","DIA_Addon_Garett_Bandits_09_02","",""
"Scripts/Content/Story/Dialoge/DIA_Addon_PIR_1357_Garett.d:205","Greg hat angeordnet, alle Banditen, die sich in der Nähe des Lagers blicken lassen, abzumurksen.","Greg rozkazaі ostro reagowaж na pojawienie siк choжby jednego bandyty w tym rejonie.","","","DIA_Addon_Garett_Bandits_09_03","",""
"Scripts/Content/Story/Dialoge/DIA_Addon_PIR_1357_Garett.d:222","Dein Kapitän Greg. Wie ist der so?","A ten wasz kapitan... Jaki on jest?","","","DIA_Addon_Garett_Greg.description","",""
"Scripts/Content/Story/Dialoge/DIA_Addon_PIR_1357_Garett.d:232","Dein Kapitän Greg. Wie ist der so?","A ten wasz kapitan... Jaki on jest?","","","DIA_Addon_Garett_Greg_15_00","",""
"Scripts/Content/Story/Dialoge/DIA_Addon_PIR_1357_Garett.d:233","Er ist 'n harter Knochen, das kann ich dir sagen.","Twarda z niego sztuka, bez dwуch zdaс.","","","DIA_Addon_Garett_Greg_09_01","",""
"Scripts/Content/Story/Dialoge/DIA_Addon_PIR_1357_Garett.d:234","Und rafffgierig bis auf's Blut.","I sk№py jak diabli.","","","DIA_Addon_Garett_Greg_09_02","",""
"Scripts/Content/Story/Dialoge/DIA_Addon_PIR_1357_Garett.d:235","Er läßt unseren Schatzmeister Francis immer gerade soviel zahlen, daß es zu keiner Meuterei kommt!","Pozwala naszemu skarbnikowi, Francisowi, pіaciж nam tylko tyle, byњmy siк nie zbuntowali.","","","DIA_Addon_Garett_Greg_09_03","",""
"Scripts/Content/Story/Dialoge/DIA_Addon_PIR_1357_Garett.d:236","Und wenn einer von uns mal was WIRKLICH wertvolles erbeutet, reißt er sich's selber unter'n Nagel.","A kiedy ktуryњ z nas zdobкdzie coњ naprawdк cennego, Greg przywіaszcza to sobie.","","","DIA_Addon_Garett_Greg_09_04","",""
"Scripts/Content/Story/Dialoge/DIA_Addon_PIR_1357_Garett.d:237","Ich hatte mal den Kompass von 'ner königlichen Fregatte mitgehen lassen.","Kiedyњ zabraіem kompas z krуlewskiej fregaty.","","","DIA_Addon_Garett_Greg_09_05","",""
"Scripts/Content/Story/Dialoge/DIA_Addon_PIR_1357_Garett.d:238","Greg, der Mistkerl, hat ihn mir natürlich abgeknöpft.","A Greg, rzecz jasna, odebraі mi go.","","","DIA_Addon_Garett_Greg_09_06","",""
"Scripts/Content/Story/Dialoge/DIA_Addon_PIR_1357_Garett.d:239","Pah! Vermutlich hat er ihn irgendwo verbuddelt, genau wie alle seine anderen Schätze.","Ech... Pewnie go gdzieњ zakopaі jak resztк swoich skarbуw.","","","DIA_Addon_Garett_Greg_09_07","",""
"Scripts/Content/Story/Dialoge/DIA_Addon_PIR_1357_Garett.d:251","Wo könnte Greg den Kompass vergraben haben?","Gdzie Greg mуgі zakopaж kompas?","","","DIA_Addon_Garett_Tips.description","",""
"Scripts/Content/Story/Dialoge/DIA_Addon_PIR_1357_Garett.d:264","Wo könnte Greg den Kompass vergraben haben?","Gdzie Greg mуgі zakopaж kompas?","","","DIA_Addon_Garett_Tips_15_00","",""
"Scripts/Content/Story/Dialoge/DIA_Addon_PIR_1357_Garett.d:265","Greg, sagte mir mal, dass der Tod über meinem Kompass wacht und hat mich ausgelacht.","Greg powiedziaі mi, їe w ten kompas zagl№daіa sama њmierж. A potem mnie wyњmiaі.","","","DIA_Addon_Garett_Tips_09_01","",""
"Scripts/Content/Story/Dialoge/DIA_Addon_PIR_1357_Garett.d:266","Sonst noch was?","Coњ jeszcze?","","","DIA_Addon_Garett_Tips_15_02","",""
"Scripts/Content/Story/Dialoge/DIA_Addon_PIR_1357_Garett.d:267","An der südlichen Küste gibt es einen Strand. Er ist nur über den Seeweg zu erreichen.","Wzdіuї poіudniowego wybrzeїa ci№gnie siк plaїa, do ktуrej moїna siк dostaж wyі№cznie drog№ morsk№.","","","DIA_Addon_Garett_Tips_09_03","",""
"Scripts/Content/Story/Dialoge/DIA_Addon_PIR_1357_Garett.d:268","Greg soll öfter mal dort gewesen sein. Vielleicht findest du da was.","Podobno czкsto widywano na niej Grega. Moїe tam uda ci siк coњ znaleџж.","","","DIA_Addon_Garett_Tips_09_04","",""
"Scripts/Content/Story/Dialoge/DIA_Addon_PIR_1357_Garett.d:269","Ich hab mich selber schonmal dort umgesehen, aber die Gegend wimmelt von Monstern.","Kiedyњ sam siк wybraіem w te rejony, ale za duїo tam potworуw.","","","DIA_Addon_Garett_Tips_09_05","",""
"Scripts/Content/Story/Dialoge/DIA_Addon_PIR_1357_Garett.d:270","Wenn du's wirklich wagen willst, vergiß nicht ne Hacke mitzunehmen.","Jeњli chcesz mimo wszystko zaryzykowaж, nie zapomnij wzi№ж kilofa.","","","DIA_Addon_Garett_Tips_09_06","",""
"Scripts/Content/Story/Dialoge/DIA_Addon_PIR_1357_Garett.d:287","Hier ist dein Kompass.","Oto twуj kompas.","","","DIA_Addon_Garett_GiveKompass.description","",""
"Scripts/Content/Story/Dialoge/DIA_Addon_PIR_1357_Garett.d:301","Hier ist dein Kompass.","Oto twуj kompas.","","","DIA_Addon_Garett_GiveKompass_15_00","",""
"Scripts/Content/Story/Dialoge/DIA_Addon_PIR_1357_Garett.d:309","(freut sich) Ja, das ist er. Hätte nicht gedacht, dass ich ihn noch mal wiedersehe.","Ha, to rzeczywiњcie on! Nie spodziewaіem siк, їe ujrzк go ponownie.","","","DIA_Addon_Garett_GiveKompass_09_01","",""
"Scripts/Content/Story/Dialoge/DIA_Addon_PIR_1357_Garett.d:310","Danke, Mann!","Wielkie dziкki!","","","DIA_Addon_Garett_GiveKompass_09_02","",""
"Scripts/Content/Story/Dialoge/DIA_Addon_PIR_1357_Garett.d:314","Dieses Mal wird ihn Greg NICHT wieder in die Finger kriegen...","Tym razem Greg juї go nie dostanie.","","","DIA_Addon_Garett_GiveKompass_09_03","",""
"Scripts/Content/Story/Dialoge/DIA_Addon_PIR_1357_Garett.d:315","Hier, nimm diesen Gürtel dafür. Er ist mein wertvollstes Stück.","Weџ w nagrodк ten pas. Jest sporo wart.","","","DIA_Addon_Garett_GiveKompass_09_04","",""
"Scripts/Content/Story/Dialoge/DIA_Addon_PIR_1357_Garett.d:320","Du hast doch diesen Gürtel bei mir gekauft, erinnerst du dich?","Pamiкtasz ten pas, ktуry ode mnie kupiіeњ?","","","DIA_Addon_Garett_GiveKompass_09_05","",""
"Scripts/Content/Story/Dialoge/DIA_Addon_PIR_1357_Garett.d:321","Hast 'ne Menge dafü bezahlt - (hastig) und das war er auch wert. Hier - du sollst dein Gold zurückhaben.","Zapіaciіeњ za niego sporo, choж, zwaїywszy na jego wartoњж, na pewno nie przepіaciіeњ. Proszк, weџ swoje pieni№dze z powrotem i potraktuj go jako prezent.","","","DIA_Addon_Garett_GiveKompass_09_06","",""
"Scripts/Content/Story/Dialoge/DIA_Addon_PIR_1357_Garett.d:339","Was kannst du mir über Francis erzählen?","Co moїesz mi powiedzieж o Francisie?","","","DIA_Addon_Garett_Francis.description","",""
"Scripts/Content/Story/Dialoge/DIA_Addon_PIR_1357_Garett.d:352","°Was kannst du mir über Francis erzählen?","Co moїesz mi powiedzieж o Francisie?","","","DIA_Addon_Garett_Francis_15_00","",""
"Scripts/Content/Story/Dialoge/DIA_Addon_PIR_1357_Garett.d:353","Greg hat ihm das Kommando übertragen, während er weg ist.","Greg mianowaі go zastкpc№ na czas swojej nieobecnoњci.","","","DIA_Addon_Garett_Francis_09_01","",""
"Scripts/Content/Story/Dialoge/DIA_Addon_PIR_1357_Garett.d:354","Aber als Käpt'n ist Francis ein Versager!","Niestety, Francis w ogуle nie sprawdza siк w roli kapitana.","","","DIA_Addon_Garett_Francis_09_02","",""
"Scripts/Content/Story/Dialoge/DIA_Addon_PIR_1357_Garett.d:355","Er kriegt Morgan ja noch nicht mal dazu seinen Hintern aus dem Bett zu bewegen.","Nie potrafi nawet њci№gn№ж Morgana z іуїka.","","","DIA_Addon_Garett_Francis_09_03","",""
"Scripts/Content/Story/Dialoge/DIA_Addon_PIR_1357_Garett.d:356","Henry und seine Jungs sind die einzigen, die hier was tun.","Tylko Henry i jego chіopaki w ogуle coњ robi№.","","","DIA_Addon_Garett_Francis_09_04","",""
"Scripts/Content/Story/Dialoge/DIA_Addon_PIR_1357_Garett.d:357","Die anderen machen sich hier einen schönen Tag, statt zu arbeiten.","Reszta obija siк, zamiast pracowaж.","","","DIA_Addon_Garett_Francis_09_05","",""
"Scripts/Content/Story/Dialoge/DIA_Addon_PIR_1357_Garett.d:360","Ich kann nur hoffen, dass Greg bald wieder da ist.","Mam nadziejк, їe Greg szybko wrуci.","","","DIA_Addon_Garett_Francis_09_06","",""
"Scripts/Content/Story/Dialoge/DIA_Addon_PIR_1357_Garett.d:361","Der wird ihnen allen ordentlich in den Arsch treten.","I porozstawia towarzystwo po k№tach.","","","DIA_Addon_Garett_Francis_09_07","",""
"Scripts/Content/Story/Dialoge/DIA_Addon_PIR_1357_Garett.d:375","Gibt's was Neues?","Jakieњ wieњci?","","","DIA_Addon_Garett_PERM.description","",""
"Scripts/Content/Story/Dialoge/DIA_Addon_PIR_1357_Garett.d:385","Gibt's was Neues?","Jakieњ wieњci?","","","DIA_Addon_Garett_PERM_15_00","",""
"Scripts/Content/Story/Dialoge/DIA_Addon_PIR_1357_Garett.d:390","Seit Greg weg ist, passiert hier gar nichts.","Od kiedy Greg znikn№і, nic tu siк nie dzieje.","","","DIA_Addon_Garett_PERM_09_02","",""
"Scripts/Content/Story/Dialoge/DIA_Addon_PIR_1357_Garett.d:394","Jetzt wo Greg wieder da ist, weht hier ein anderer Wind.","Od czasu powrotu kapitana wszystko wrуciіo do normy.","","","DIA_Addon_Garett_PERM_09_01","",""
"Scripts/Content/Story/Dialoge/DIA_Addon_PIR_1360_HammerPirate.d:34","Alles klar?","Все в порядку?","","","DIA_Addon_HammerPirate_Hello.description","",""
"Scripts/Content/Story/Dialoge/DIA_Addon_PIR_1360_HammerPirate.d:44","Alles klar?","Все в порядку?","","","DIA_Addon_HammerPirate_Hello_15_00","",""
"Scripts/Content/Story/Dialoge/DIA_Addon_PIR_1360_HammerPirate.d:49","Jetzt haben wir's ja hinter uns! Die Msitkerle sind platt wie 'ne Flunder!","Вже все позаду! Ті сволочі тепер пласкі як камбала!","","","DIA_Addon_HammerPirate_Hello_07_01","",""
"Scripts/Content/Story/Dialoge/DIA_Addon_PIR_1360_HammerPirate.d:53","Bringen wir's hinter uns!","Давай покінчимо з ними!","","","DIA_Addon_HammerPirate_Hello_07_02","",""
"Scripts/Content/Story/Dialoge/DIA_Addon_PIR_1360_HammerPirate.d:58","Nein! Ich steh' nicht auf Hämmern!","Ні! Я не люблю молотки!.","","","DIA_Addon_HammerPirate_Hello_07_03","",""
"Scripts/Content/Story/Dialoge/DIA_Addon_PIR_1360_HammerPirate.d:76","Du sollst mir helfen.","Ти повинен мені допомогти.","","","DIA_Addon_HammerPirate_Anheuern.description","",""
"Scripts/Content/Story/Dialoge/DIA_Addon_PIR_1360_HammerPirate.d:89","Sag nichts! Du willst, daß ich mit dir die Banditen plattmache!","Тільки не говори, що ти хочеш, щоб я допоміг тобі розправитись з бандитами!","","","DIA_Addon_HammerPirate_Anheuern_07_00","",""
"Scripts/Content/Story/Dialoge/DIA_Addon_PIR_1360_HammerPirate.d:90","Du hast es erfasst.","Ти все правильно зрозумів.","","","DIA_Addon_PIR_6_JoinHenry_15_08","",""
"Scripts/Content/Story/Dialoge/DIA_Addon_PIR_1360_HammerPirate.d:93","Warum fragst du nicht den Typen an der Säge?","Чому б тобі не взяти хлопця біля пилки?","","","DIA_Addon_HammerPirate_Anheuern_07_01","",""
"Scripts/Content/Story/Dialoge/DIA_Addon_PIR_1360_HammerPirate.d:96","Ich... hab keine Lust auf den ganzen Stress...","Я... не хочу відчувати стрес...","","","DIA_Addon_HammerPirate_Anheuern_07_02","",""
"Scripts/Content/Story/Dialoge/DIA_Addon_PIR_1360_HammerPirate.d:109","Komm mit.","Пішли зі мною.","","","DIA_Addon_HammerPirate_ComeOn.description","",""
"Scripts/Content/Story/Dialoge/DIA_Addon_PIR_1360_HammerPirate.d:125","Komm mit.","Пішли зі мною.","","","DIA_Addon_HammerPirate_ComeOn_15_00","",""
"Scripts/Content/Story/Dialoge/DIA_Addon_PIR_1360_HammerPirate.d:128","Henry braucht einen von uns HIER...","Один з нас потрібен для Генрі ТУТ...","","","DIA_Addon_HammerPirate_ComeOn_07_01","",""
"Scripts/Content/Story/Dialoge/DIA_Addon_PIR_1360_HammerPirate.d:132","Lass uns erst ein Stück zurück in Richtung Lager gehen.","Давай спочатку підійдемо трохи ближче до табору.","","","DIA_Addon_HammerPirate_ComeOn_07_02","",""
"Scripts/Content/Story/Dialoge/DIA_Addon_PIR_1360_HammerPirate.d:137","(seufzt) Aye, aye...","(зітхає) Так, так...","","","DIA_Addon_HammerPirate_ComeOn_07_03","",""
"Scripts/Content/Story/Dialoge/DIA_Addon_PIR_1360_HammerPirate.d:154","Ich brauch dich nicht mehr.","Ти мені більше не потрібен.","","","DIA_Addon_HammerPirate_GoHome.description","",""
"Scripts/Content/Story/Dialoge/DIA_Addon_PIR_1360_HammerPirate.d:167","Ich brauch dich nicht mehr.","Ти мені більше не потрібен.","","","DIA_Addon_HammerPirate_GoHome_15_00","",""
"Scripts/Content/Story/Dialoge/DIA_Addon_PIR_1360_HammerPirate.d:168","Wie du meinst...","Як скажеш...","","","DIA_Addon_HammerPirate_GoHome_07_01","",""
"Scripts/Content/Story/Dialoge/DIA_Addon_PIR_1360_HammerPirate.d:198","Wenn du weiter in die Richtung gehen willst, lass dich nicht aufhalten...","Якщо ти підеш далі, то не буду тебе спиняти...","","","DIA_Addon_HammerPirate_TooFar_07_01","",""
"Scripts/Content/Story/Dialoge/DIA_Addon_PIR_1360_HammerPirate.d:199","Ich geh mal lieber wieder zurück.","Але тоді я повернуся назад.","","","DIA_Addon_HammerPirate_GoHome_07_02","",""
"Scripts/Content/Story/Dialoge/DIA_Addon_PIR_1360_HammerPirate.d:231","Weißt da was, ich hab nachgedacht. Du bist doch ganz in Ordnung!","Знаєш що, я тут подумав... а ти не такий вже і поганий хлопець!","","","DIA_Addon_HammerPirate_Success_07_01","",""
"Scripts/Content/Story/Dialoge/DIA_Addon_PIR_1360_HammerPirate.d:232","Ich geh mal wieder zum Lager. Wir sehen uns!","Добре, я повертаюся до табору. Побачимося!","","","DIA_Addon_HammerPirate_Success_07_02","",""
"Scripts/Content/Story/Dialoge/DIA_Addon_PIR_1361_SawPirate.d:34","Wie sieht's aus?","Як справи?","","","DIA_Addon_SawPirate_Hello.description","",""
"Scripts/Content/Story/Dialoge/DIA_Addon_PIR_1361_SawPirate.d:44","Wie sieht's aus?","Як справи?","","","DIA_Addon_SawPirate_Hello_15_00","",""
"Scripts/Content/Story/Dialoge/DIA_Addon_PIR_1361_SawPirate.d:45","Quatsch mich nicht voll!","Не мороч мені голову!","","","DIA_Addon_SawPirate_Hello_09_01","",""
"Scripts/Content/Story/Dialoge/DIA_Addon_PIR_1361_SawPirate.d:62","Gehörst du zu Henrys Jungs?","Ти один із людей Генрі?","","","DIA_Addon_SawPirate_Anheuern.description","",""
"Scripts/Content/Story/Dialoge/DIA_Addon_PIR_1361_SawPirate.d:75","Gehörst du zu Henrys Jungs?","Ти один із людей Генрі?","","","DIA_Addon_Bones_JoinHenry_15_00","",""
"Scripts/Content/Story/Dialoge/DIA_Addon_PIR_1361_SawPirate.d:76","Nein. Ich säge hier zum Spaß ein bißchen am Baum herum.","Ні. Мені ж так весело пиляти дерева.","","","DIA_Addon_SawPirate_Anheuern_09_01","",""
"Scripts/Content/Story/Dialoge/DIA_Addon_PIR_1361_SawPirate.d:77","Was ist los? Hat Henry dir gesagt, was du zu tun hast?","Що таке? Генрі тобі дав тобі завдання?","","","DIA_Addon_SawPirate_Anheuern_09_02","",""
"Scripts/Content/Story/Dialoge/DIA_Addon_PIR_1361_SawPirate.d:78","Ja. Ich soll für ihn einige Banditen aus dem Weg räumen.","Так. Він хоче, щоб я убив декілька бандитів.","","","DIA_Addon_Bones_JoinHenry_15_04","",""
"Scripts/Content/Story/Dialoge/DIA_Addon_PIR_1361_SawPirate.d:79","(wehrt ab) Ooh nein! Sieh mich NICHT so an. Ich will da nicht hingehen.","(відхиляється) Ні-ні-ні! Не дивись на мене так. Я не буду туди іти.","","","DIA_Addon_SawPirate_Anheuern_09_03","",""
"Scripts/Content/Story/Dialoge/DIA_Addon_PIR_1361_SawPirate.d:80","Lass mich lieber weitersägen, okay?","Я краще продовжу пляти, гаразд?","","","DIA_Addon_SawPirate_Anheuern_09_04","",""
"Scripts/Content/Story/Dialoge/DIA_Addon_PIR_1361_SawPirate.d:95","Komm mit.","Пішли зі мною.","","","DIA_Addon_SawPirate_ComeOn.description","",""
"Scripts/Content/Story/Dialoge/DIA_Addon_PIR_1361_SawPirate.d:111","Komm mit.","Пішли зі мною.","","","DIA_Addon_SawPirate_ComeOn_15_00","",""
"Scripts/Content/Story/Dialoge/DIA_Addon_PIR_1361_SawPirate.d:114","Wieso? Du hast doch schon 'nen Mann dabei...","Навіщо? З тобою вже є люди...","","","DIA_Addon_SawPirate_ComeOn_09_01","",""
"Scripts/Content/Story/Dialoge/DIA_Addon_PIR_1361_SawPirate.d:118","Erst gehen wir mal ein Stück zurück in Richtung Lager...","Спочатку давай підійдемо блище до табору...","","","DIA_Addon_SawPirate_ComeOn_09_04","",""
"Scripts/Content/Story/Dialoge/DIA_Addon_PIR_1361_SawPirate.d:124","(zu sich) Warum hat er nicht den ANDEREN gefragt...","(про себе) Чому він не позвав з собою ІНШОГО...","","","DIA_Addon_SawPirate_ComeOn_09_02","",""
"Scripts/Content/Story/Dialoge/DIA_Addon_PIR_1361_SawPirate.d:132","(seufzt) Aye, aye...","(зітхає) Так, так...","","","DIA_Addon_SawPirate_ComeOn_09_03","",""
"Scripts/Content/Story/Dialoge/DIA_Addon_PIR_1361_SawPirate.d:149","Ich brauch dich nicht mehr.","Ти мені більше не потрібен.","","","DIA_Addon_SawPirate_GoHome.description","",""
"Scripts/Content/Story/Dialoge/DIA_Addon_PIR_1361_SawPirate.d:162","Ich brauch dich nicht mehr.","Ти мені більше не потрібен.","","","DIA_Addon_SawPirate_GoHome_15_00","",""
"Scripts/Content/Story/Dialoge/DIA_Addon_PIR_1361_SawPirate.d:163","Dann werd ich mal ein bißchen weitersägen!","Тоді я продовжу пиляти!","","","DIA_Addon_SawPirate_GoHome_09_01","",""
"Scripts/Content/Story/Dialoge/DIA_Addon_PIR_1361_SawPirate.d:193","Wir sind zu weit weg vom Lager.","Ми надто далеко від табору.","","","DIA_Addon_SawPirate_TooFar_09_01","",""
"Scripts/Content/Story/Dialoge/DIA_Addon_PIR_1361_SawPirate.d:194","Das gefällt mir gar nicht. Ich werd' mal wieder zurückgehen.","Мені все це зовсім не подобається. Я повертаюсь.","","","DIA_Addon_SawPirate_GoHome_09_02","",""
