"location","source","target","id","fuzzy","context","translator_comments","developer_comments"
"Scripts/Content/Story/Dialoge/DIA_Addon_PIR_1352_AlligatorJack.d:607","Gut gemacht, so jemanden wie dich können wir brauchen.","Doskonale! Takich ludzi nam potrzeba.","","","DIA_Addon_AlligatorJack_HuntEnd_12_03","",""
"Scripts/Content/Story/Dialoge/DIA_Addon_PIR_1352_AlligatorJack.d:608","Bei deiner ersten Jagd gleich eins von diesen Biestern erlegt. Nicht schlecht.","Pierwsze polowanie i juї zіapaіeњ jednego. Nieџle, nieџle...","","","DIA_Addon_AlligatorJack_HuntEnd_12_04","",""
"Scripts/Content/Story/Dialoge/DIA_Addon_PIR_1352_AlligatorJack.d:612","Du bist ein Jagdtalent.","Masz dryg do polowania, nie ma co.","","","DIA_Addon_AlligatorJack_HuntEnd_12_05","",""
"Scripts/Content/Story/Dialoge/DIA_Addon_PIR_1352_AlligatorJack.d:613","Meine Fresse, wenn du so weiter machst, kann ich demnächst im Lager bleiben.","A niech mnie! Jeњli tak dalej pуjdzie, to nie bкdк miaі co robiж na polowaniach.","","","DIA_Addon_AlligatorJack_HuntEnd_12_06","",""
"Scripts/Content/Story/Dialoge/DIA_Addon_PIR_1352_AlligatorJack.d:616","Hier, nimm das Sumpfrattenfleisch und bringe es zu Morgan, dem Faulpelz.","Weџ szczura i zanieњ go temu leniowi Morganowi.","","","DIA_Addon_AlligatorJack_PassHenry_12_07","",""
"Scripts/Content/Story/Dialoge/DIA_Addon_PIR_1352_AlligatorJack.d:617","Du findest ihn bei uns im Lager.","Znajdziesz go w obozie.","","","DIA_Addon_AlligatorJack_PassHenry_12_08","",""
"Scripts/Content/Story/Dialoge/DIA_Addon_PIR_1352_AlligatorJack.d:618","Er liegt sicher wieder irgendwo am Strand. Ich denke, er wartet schon darauf.","Pewnie bкdzie siк wygrzewaі na plaїy, czekaj№c na ciebie.","","","DIA_Addon_AlligatorJack_PassHenry_12_09","",""
"Scripts/Content/Story/Dialoge/DIA_Addon_PIR_1352_AlligatorJack.d:622","Am Eingang unseres Lagers steht meistens Henry und passt auf, dass uns die Banditen nicht angreifen.","Przy wejњciu spotkasz Henry'ego, ktуry pilnuje, їeby nie podkradli siк tu bandyci.","","","DIA_Addon_AlligatorJack_PassHenry_12_10","",""
"Scripts/Content/Story/Dialoge/DIA_Addon_PIR_1352_AlligatorJack.d:623","Wenn er dich nicht rein lassen will, sag ihm einfach, dass ich dich geschickt habe.","Powiedz mu, їe to ja ciк przysіaіem.","","","DIA_Addon_AlligatorJack_PassHenry_12_11","",""
"Scripts/Content/Story/Dialoge/DIA_Addon_PIR_1352_AlligatorJack.d:624","Vielleicht ist er dann ein bisschen umgänglicher.","Powinien ciк wpuњciж.","","","DIA_Addon_AlligatorJack_PassHenry_12_12","",""
"Scripts/Content/Story/Dialoge/DIA_Addon_PIR_1352_AlligatorJack.d:625","Henry ist etwas übereifrig und markiert immer gerne den Boss.","Henry jest przewraїliwiony, a przy tym lubi zgrywaж waїniaka.","","","DIA_Addon_AlligatorJack_PassHenry_12_13","",""
"Scripts/Content/Story/Dialoge/DIA_Addon_PIR_1352_AlligatorJack.d:650","Kennst du Angus und seinen Freund Hank?","Znasz moїe Angusa i jego kumpla, Hanka?","","","DIA_Addon_AlligatorJack_Angus.description","",""
"Scripts/Content/Story/Dialoge/DIA_Addon_PIR_1352_AlligatorJack.d:663","Kennst du Angus und seinen Freund Hank?","Znasz moїe Angusa i jego kumpla, Hanka?","","","DIA_Addon_AlligatorJack_Angus_15_00","",""
"Scripts/Content/Story/Dialoge/DIA_Addon_PIR_1352_AlligatorJack.d:664","Ich hab sie schon länger nicht mehr gesehen.","Nie widziaіem ich od jakiegoњ czasu.","","","DIA_Addon_AlligatorJack_Angus_12_03","",""
"Scripts/Content/Story/Dialoge/DIA_Addon_PIR_1352_AlligatorJack.d:665","Außerdem hätte ich nichts dagegen, wenn die beiden auch nicht wieder auftauchen.","W sumie nie miaіbym nic przeciwko temu, їeby przepadli na dobre.","","","DIA_Addon_AlligatorJack_Angus_12_04","",""
"Scripts/Content/Story/Dialoge/DIA_Addon_PIR_1352_AlligatorJack.d:666","Warum?","Dlaczego?","","","DIA_Addon_AlligatorJack_Angus_15_05","",""
"Scripts/Content/Story/Dialoge/DIA_Addon_PIR_1352_AlligatorJack.d:667","Ach, die Penner haben ständig am See rumgehangen und das Wild vertrieben.","Ci obwiesie krкc№ siк zwykle w pobliїu jeziora, skutecznie odstraszaj№c zwierzynк.","","","DIA_Addon_AlligatorJack_Angus_12_06","",""
"Scripts/Content/Story/Dialoge/DIA_Addon_PIR_1352_AlligatorJack.d:679","An welchem See hängen sie ständig rum?","A jak myњlisz, nad ktуrym jeziorem przebywaj№ najczкњciej?","","","DIA_Addon_AlligatorJack_Lake.description","",""
"Scripts/Content/Story/Dialoge/DIA_Addon_PIR_1352_AlligatorJack.d:693","An WELCHEM See hängen sie ständig rum?","A jak myњlisz, nad ktуrym jeziorem przebywaj№ najczкњciej?","","","DIA_Addon_AlligatorJack_Lake_15_00","",""
"Scripts/Content/Story/Dialoge/DIA_Addon_PIR_1352_AlligatorJack.d:697","Erinnerst du dich an unsere Jagd?","Pamiкtasz nasze polowanie?","","","DIA_Addon_AlligatorJack_Lake_12_01","",""
"Scripts/Content/Story/Dialoge/DIA_Addon_PIR_1352_AlligatorJack.d:698","Ja.","Tak.","","","DIA_Addon_AlligatorJack_Lake_15_02","",""
"Scripts/Content/Story/Dialoge/DIA_Addon_PIR_1352_AlligatorJack.d:699","Der See in dem Talkessel. Dort habe ich sie meistens gesehen.","Chyba w kotlinie... Tam ich widywaіem najczкњciej.","","","DIA_Addon_AlligatorJack_Lake_12_03","",""
"Scripts/Content/Story/Dialoge/DIA_Addon_PIR_1352_AlligatorJack.d:703","Am See im großen Talkessel.","Nad jeziorem w kotlinie.","","","DIA_Addon_AlligatorJack_Lake_12_04","",""
"Scripts/Content/Story/Dialoge/DIA_Addon_PIR_1352_AlligatorJack.d:704","Du gehst von unserem Lager aus einfach nach Osten. Den Talkessel kannst du gar nicht übersehen.","Na wschуd od naszego obozu. Nie sposуb nie trafiж.","","","DIA_Addon_AlligatorJack_Lake_12_05","",""
"Scripts/Content/Story/Dialoge/DIA_Addon_PIR_1352_AlligatorJack.d:705","Es gibt dort viel kleine Wasserfälle.","Wpada do niego kilka maіych wodospadуw.","","","DIA_Addon_AlligatorJack_Lake_12_06","",""
"Scripts/Content/Story/Dialoge/DIA_Addon_PIR_1352_AlligatorJack.d:706","Aber pass auf, wenn du nur noch trockenen Sand unter den Füßen hast, bist du falsch abgebogen und in den Canyon gelaufen.","Tylko uwaїaj. Kiedy zejdziesz na caіkowicie piaszczysty teren, to znaczy, їe џle skrкciіeњ i wszedіeњ do kanionu.","","","DIA_Addon_AlligatorJack_Lake_12_07","",""
"Scripts/Content/Story/Dialoge/DIA_Addon_PIR_1352_AlligatorJack.d:722","Kannst du mir was beibringen?","Moїesz mnie czegoњ nauczyж?","","","DIA_Addon_AlligatorJack_CanLearn.description","",""
"Scripts/Content/Story/Dialoge/DIA_Addon_PIR_1352_AlligatorJack.d:739","Kannst du mir was beibringen?","Moїesz mnie czegoњ nauczyж?","","","DIA_Addon_AlligatorJack_CanLearn_15_00","",""
"Scripts/Content/Story/Dialoge/DIA_Addon_PIR_1352_AlligatorJack.d:743","Klar, ich bin ein guter Jäger, ich kann dir zeigen wie man Tiere enthäutet und ihnen die Zähne zieht.","Pewnie. Jestem dobrym myњliwym i mogк ci powiedzieж, jak najlepiej њcigaж zwierzynк i pozyskiwaж kіy.","","","DIA_Addon_AlligatorJack_CanLearn_12_01","",""
"Scripts/Content/Story/Dialoge/DIA_Addon_PIR_1352_AlligatorJack.d:744","Wenn du willst, bring ich es dir bei.","Wystarczy, їe zapytasz.","","","DIA_Addon_AlligatorJack_CanLearn_12_02","",""
"Scripts/Content/Story/Dialoge/DIA_Addon_PIR_1352_AlligatorJack.d:753","Zeig mir erst mal, dass du bereit bist für die Jagd.","Najpierw musisz jednak pokazaж, їe wiesz cokolwiek o polowaniu.","","","DIA_Addon_AlligatorJack_CanLearn_12_03","",""
"Scripts/Content/Story/Dialoge/DIA_Addon_PIR_1352_AlligatorJack.d:754","Wenn wir zusammen auf der Jagd waren, werde ich es vielleicht tun."," Jeњli pуjdziesz ze mn№ na polowanie, mogк ciк tego nauczyж.","","","DIA_Addon_AlligatorJack_CanLearn_12_04","",""
"Scripts/Content/Story/Dialoge/DIA_Addon_PIR_1352_AlligatorJack.d:780","Unterrichte mich!","Naucz mnie.","","","DIA_Addon_AlligatorJack_Teach.description","",""
"Scripts/Content/Story/Dialoge/DIA_Addon_PIR_1352_AlligatorJack.d:793","Unterrichte mich!","Naucz mnie.","","","DIA_Addon_AlligatorJack_Teach_15_00","",""
"Scripts/Content/Story/Dialoge/DIA_Addon_PIR_1352_AlligatorJack.d:794","Was soll ich dir beibringen?","Czego chcesz siк dowiedzieж?","","","DIA_Addon_AlligatorJack_Teach_12_01","",""
"Scripts/Content/Story/Dialoge/DIA_Addon_PIR_1352_AlligatorJack.d:825","Und immer nur am Bauch aufschneiden, sonst verminderst du die Qualität.","Zawsze rozcinaj skуrк wzdіuї brzucha, inaczej nie bкdzie siк do niczego nadawaж.","","","DIA_Addon_AlligatorJack_Teach_Fur_12_00","",""
"Scripts/Content/Story/Dialoge/DIA_Addon_PIR_1352_AlligatorJack.d:860","Alles klar.","Rozumiem.","","","DIA_Addon_AlligatorJack_Anheuern_12_01","",""
"Scripts/Content/Story/Dialoge/DIA_Addon_PIR_1352_AlligatorJack.d:870","Lass uns jagen gehen.","Chodџmy na polowanie.","","","DIA_Addon_AlligatorJack_Anheuern.description","",""
"Scripts/Content/Story/Dialoge/DIA_Addon_PIR_1352_AlligatorJack.d:883","Lass uns jagen gehen.","Chodџmy na polowanie.","","","DIA_Addon_AlligatorJack_Anheuern_15_00","",""
"Scripts/Content/Story/Dialoge/DIA_Addon_PIR_1352_AlligatorJack.d:901","Komm mit.","Chodџ ze mn№.","","","DIA_Addon_AlligatorJack_ComeOn.description","",""
"Scripts/Content/Story/Dialoge/DIA_Addon_PIR_1352_AlligatorJack.d:916","Komm mit.","Chodџ ze mn№.","","","DIA_Addon_AlligatorJack_KommMit_15_00","",""
"Scripts/Content/Story/Dialoge/DIA_Addon_PIR_1352_AlligatorJack.d:941","Ich brauch dich nicht mehr.","Nie potrzebujк juї twojej pomocy.","","","DIA_Addon_AlligatorJack_GoHome.description","",""
"Scripts/Content/Story/Dialoge/DIA_Addon_PIR_1352_AlligatorJack.d:955","Ich brauch dich nicht mehr.","Nie potrzebujк juї twojej pomocy.","","","DIA_Addon_AlligatorJack_DontNeedYou_15_00","",""
"Scripts/Content/Story/Dialoge/DIA_Addon_PIR_1352_Morgan.d:25","Leg dich wieder hin.","Idџ spaж.","","","DIA_Addon_Morgan_Perm_15_00","",""
"Scripts/Content/Story/Dialoge/DIA_Addon_PIR_1352_Morgan.d:28","(gähnt) Hervorragende Idee.","Doskonaіy pomysі.","","","DIA_Addon_Morgan_Perm_07_01","",""
"Scripts/Content/Story/Dialoge/DIA_Addon_PIR_1352_Morgan.d:33","(verschlafen)Na dann, gute Nacht.","W takim razie dobranoc.","","","DIA_Addon_Morgan_Perm_07_02","",""
"Scripts/Content/Story/Dialoge/DIA_Addon_PIR_1352_Morgan.d:38","(müde) Nichts lieber, als das.","No i co jeszcze?","","","DIA_Addon_Morgan_Perm_07_03","",""
"Scripts/Content/Story/Dialoge/DIA_Addon_PIR_1352_Morgan.d:43","Weck mich, wenn irgendwas passiert.","Obudџ mnie, kiedy bкdzie siк coњ dziaіo.","","","DIA_Addon_Morgan_Perm_07_04","",""
"Scripts/Content/Story/Dialoge/DIA_Addon_PIR_1352_Morgan.d:110","Toll, jetzt hat Greg mich zum Brettersägen verdonnert!","Wspaniale! Teraz Greg wysіaі mnie do piіowania desek!","","","DIA_Addon_Morgan_Anheuern_07_00","",""
"Scripts/Content/Story/Dialoge/DIA_Addon_PIR_1352_Morgan.d:113","(sarkastisch) Viel Spass beim Monster schlachten!","Miіego szlachtowania potworуw!","","","DIA_Addon_Morgan_Anheuern_07_01","",""
"Scripts/Content/Story/Dialoge/DIA_Addon_PIR_1352_Morgan.d:143","Hey du!","Ej, ty!","","","DIA_Addon_Morgan_Hello_15_00","",""
"Scripts/Content/Story/Dialoge/DIA_Addon_PIR_1352_Morgan.d:144","(verschlafen) Häh? Was willst du?","Tak? Czego chcesz?","","","DIA_Addon_Morgan_Hello_07_01","",""
"Scripts/Content/Story/Dialoge/DIA_Addon_PIR_1352_Morgan.d:145","(verschlafen) Ist Alligator Jack schon wieder da?","Jack Aligator juї wrуciі?","","","DIA_Addon_Morgan_Hello_07_02","",""
"Scripts/Content/Story/Dialoge/DIA_Addon_PIR_1352_Morgan.d:146","(verschlafen) Nein? Dann wird er sicher bald kommen, gute Nacht.","Nie? No to pewnie niedіugo wrуci. Dobranoc.","","","DIA_Addon_Morgan_Hello_07_03","",""
"Scripts/Content/Story/Dialoge/DIA_Addon_PIR_1352_Morgan.d:159","Ich habe hier eine Lieferung Fleisch.","Przynoszк miкso.","","","DIA_Addon_Morgan_Meat.description","",""
"Scripts/Content/Story/Dialoge/DIA_Addon_PIR_1352_Morgan.d:173","Ich habe hier eine Lieferung Fleisch.","Przynoszк miкso.","","","DIA_Addon_Morgan_Meat_15_00","",""
"Scripts/Content/Story/Dialoge/DIA_Addon_PIR_1352_Morgan.d:177","(wird wach) Puh. Ich brauch erst mal einen Schluck zum Wachwerden.","Zaraz. Najpierw muszк siк napiж.","","","DIA_Addon_Morgan_Meat_07_01","",""
"Scripts/Content/Story/Dialoge/DIA_Addon_PIR_1352_Morgan.d:182","So, besser. Also nochmal, was willst du?","No, juї lepiej. Dobrze, powtуrz mi, czego chcesz.","","","DIA_Addon_Morgan_Meat_07_02","",""
"Scripts/Content/Story/Dialoge/DIA_Addon_PIR_1352_Morgan.d:183","Ich bringe eine Lieferung Fleisch. Von Alligator Jack.","Jack Aligator kazaі mi przynieњж to miкso.","","","DIA_Addon_Morgan_Meat_15_03","",""
"Scripts/Content/Story/Dialoge/DIA_Addon_PIR_1352_Morgan.d:186","Ich erinnere mich. Genau! Das Fleisch, gib her!","No tak, teraz sobie przypominam. Dawaj je tu!","","","DIA_Addon_Morgan_Meat_07_04","",""
"Scripts/Content/Story/Dialoge/DIA_Addon_PIR_1352_Morgan.d:199","Was, das ist alles? Hast den Rest Rest selber gefreesen was? Naja, egal...","Co? To wszystko? Resztк pewnie zeїarіeњ? No, niewaїne...","","","DIA_Addon_Morgan_Meat_07_05","",""
"Scripts/Content/Story/Dialoge/DIA_Addon_PIR_1352_Morgan.d:217","Was machst du hier?","Co tu robisz?","","","DIA_Addon_Morgan_Job.description","",""
"Scripts/Content/Story/Dialoge/DIA_Addon_PIR_1352_Morgan.d:230","Was machst du hier?","Co tu robisz?","","","DIA_Addon_Morgan_Job_15_01","",""
"Scripts/Content/Story/Dialoge/DIA_Addon_PIR_1352_Morgan.d:231","Greg hat mir das Kommando über einen der beiden Entertrupps gegeben.","Greg powierzyі mi dowуdztwo nad jedn№ z dwуch grup abordaїowych.","","","DIA_Addon_Morgan_Job_07_01","",""
"Scripts/Content/Story/Dialoge/DIA_Addon_PIR_1352_Morgan.d:232","Ich bin für die Versorgung des Lagers zuständig - darum kümmert sich Alligator Jack.","Jestem odpowiedzialny za zaopatrzenie, ktуre dostarcza nam Jack Aligator.","","","DIA_Addon_Morgan_Job_07_02","",""
"Scripts/Content/Story/Dialoge/DIA_Addon_PIR_1352_Morgan.d:233","Außerdem bin ich dafür verantwortlich, dass die Biester hier in der Gegend nicht zu nah ans Lager kommen.","Odpowiadam teї za to, aby okoliczne stwory nie zbliїyіy siк zanadto do obozu.","","","DIA_Addon_Morgan_Job_07_03","",""
"Scripts/Content/Story/Dialoge/DIA_Addon_PIR_1352_Morgan.d:234","Darum kümmern sich die JUNGS.","Pomagaj№ mi w tym moi chіopcy.","","","DIA_Addon_Morgan_Job_07_04","",""
"Scripts/Content/Story/Dialoge/DIA_Addon_PIR_1352_Morgan.d:237","Ich hab ihnen gesagt, ich will hier kein einziges Vieh mehr in der Nähe sehen, (gähnt) wenn Greg zurückkommt.","Powiedziaіem im, їe ma tu byж spokojnie, kiedy kapitan Greg wrуci.","","","DIA_Addon_Morgan_Job_07_05","",""
"Scripts/Content/Story/Dialoge/DIA_Addon_PIR_1352_Morgan.d:250","Tust du auch mal was?","Robisz coњ konkretnego?","","","DIA_Addon_Morgan_Sleep.description","",""
"Scripts/Content/Story/Dialoge/DIA_Addon_PIR_1352_Morgan.d:263","Tust du auch mal was?","Robisz coњ konkretnego?","","","DIA_Addon_Morgan_Sleep_15_00","",""
"Scripts/Content/Story/Dialoge/DIA_Addon_PIR_1352_Morgan.d:264","Hey, nicht frech werden!","Ej, wolnego!","","","DIA_Addon_Morgan_Sleep_07_01","",""
"Scripts/Content/Story/Dialoge/DIA_Addon_PIR_1352_Morgan.d:265","Ich habe die wichtigste Aufgabe von allen.","Moja praca jest bardzo waїna.","","","DIA_Addon_Morgan_Sleep_07_02","",""
"Scripts/Content/Story/Dialoge/DIA_Addon_PIR_1352_Morgan.d:266","Ich kümmere mich um die Ausbildung meiner Leute.","Nadzorujк szkolenie moich ludzi.","","","DIA_Addon_Morgan_Sleep_07_03","",""
"Scripts/Content/Story/Dialoge/DIA_Addon_PIR_1352_Morgan.d:267","Ich mache sie zu den besten und furchtlosesten Kämpfern, die jemals auf diesen Gewässern gekreuzt sind.","Staram siк ich zmieniж w nieustraszonych wilkуw morskich, najlepszych piratуw, jacy kiedykolwiek їeglowali po tych wodach.","","","DIA_Addon_Morgan_Sleep_07_04","",""
"Scripts/Content/Story/Dialoge/DIA_Addon_PIR_1352_Morgan.d:268","Außerdem ist es ja nicht so, daß die Jungs nichts davon haben, ihre Arbeit zu machen.","Nie wysіugujк siк ludџmi.","","","DIA_Addon_Morgan_Sleep_07_05","",""
"Scripts/Content/Story/Dialoge/DIA_Addon_PIR_1352_Morgan.d:269","Sie bekommen 'nen ordentlichen Sack voll Gold dafür.","Kaїdy z nich dostaje niezіy grosz za swoj№ robotк.","","","DIA_Addon_Morgan_Sleep_07_06","",""
"Scripts/Content/Story/Dialoge/DIA_Addon_PIR_1352_Morgan.d:286","Ich will in deinen Trupp.","Chcк doі№czyж do waszej grupy.","","","DIA_Addon_Morgan_JoinMorgan.description","",""
"Scripts/Content/Story/Dialoge/DIA_Addon_PIR_1352_Morgan.d:300","Ich will in deinen Trupp.","Chcк doі№czyж do waszej grupy.","","","DIA_Addon_Morgan_JoinMorgan_15_00","",""
"Scripts/Content/Story/Dialoge/DIA_Addon_PIR_1352_Morgan.d:301","(lacht) Mein Trupp? Mein Trupp hängt am Strand rum.","Do nas? Moi chіopcy na razie obijaj№ siк na plaїy.","","","DIA_Addon_Morgan_JoinMorgan_07_01","",""
"Scripts/Content/Story/Dialoge/DIA_Addon_PIR_1352_Morgan.d:302","Die Jungs machen keinen Finger krumm, bis der Käpt'n wieder da ist, das kann ich dir versprechen.","I nawet palcem nie kiwn№, pуki kapitan nie wrуci. To wiem na pewno.","","","DIA_Addon_Morgan_JoinMorgan_07_03","",""
"Scripts/Content/Story/Dialoge/DIA_Addon_PIR_1352_Morgan.d:303","Aber wenn du allen zeigen willst, was du drauf hast, kannst du dir ja mal den Strand im Norden vornehmen.","Ale jeњli chcesz pokazaж, na co ciк staж, moїesz oczyњciж plaїк na pуіnocy.","","","DIA_Addon_Morgan_JoinMorgan_07_04","",""
"Scripts/Content/Story/Dialoge/DIA_Addon_PIR_1352_Morgan.d:304","Der ist voller Lurker und was weiß ich noch allem.","Peіno tam rуїnego њmiecia.","","","DIA_Addon_Morgan_JoinMorgan_07_05","",""
"Scripts/Content/Story/Dialoge/DIA_Addon_PIR_1352_Morgan.d:305","Zieh die Sache alleine durch und du verdienst dir den Respekt (gähnt) der Leute...","Jeњli siк tego pozbкdziesz, chіopaki na pewno ciк zaakceptuj№.","","","DIA_Addon_Morgan_JoinMorgan_07_06","",""
"Scripts/Content/Story/Dialoge/DIA_Addon_PIR_1352_Morgan.d:306","Willommen in meinem Trupp. Ha! Ich hau mich wieder hin...","Witam w mojej ekipie. No, a teraz wracam do obowi№zkowego wypoczynku.","","","DIA_Addon_Morgan_JoinMorgan_07_07","",""
"Scripts/Content/Story/Dialoge/DIA_Addon_PIR_1352_Morgan.d:326","Der Strand im Norden ist sauber.","Pуіnocna plaїa zostaіa oczyszczona.","","","DIA_Addon_Morgan_LurkerPlatt.description","",""
"Scripts/Content/Story/Dialoge/DIA_Addon_PIR_1352_Morgan.d:344","Der Strand im Norden ist sauber.","Pуіnocna plaїa zostaіa oczyszczona.","","","DIA_Addon_Morgan_LurkerPlatt_15_00","",""
"Scripts/Content/Story/Dialoge/DIA_Addon_PIR_1352_Morgan.d:345","Was ist mit der Höhle? Warst du da auch schon?","A co z jaskini№? Byіeњ tam?","","","DIA_Addon_Morgan_LurkerPlatt_07_01","",""
"Scripts/Content/Story/Dialoge/DIA_Addon_PIR_1352_Morgan.d:349","Klar.","Pewnie.","","","DIA_Addon_Morgan_LurkerPlatt_15_02","",""
"Scripts/Content/Story/Dialoge/DIA_Addon_PIR_1352_Morgan.d:350","Sauber. Bist ein guter Mann.","Њwietnie. Jesteњ w porz№dku.","","","DIA_Addon_Morgan_LurkerPlatt_07_03","",""
"Scripts/Content/Story/Dialoge/DIA_Addon_PIR_1352_Morgan.d:351","Hier hast du deinen Lohn.","Oto twoja zapіata.","","","DIA_Addon_Morgan_LurkerPlatt_07_04","",""
"Scripts/Content/Story/Dialoge/DIA_Addon_PIR_1352_Morgan.d:363","Äh ...","Eee...","","","DIA_Addon_Morgan_LurkerPlatt_15_05","",""
"Scripts/Content/Story/Dialoge/DIA_Addon_PIR_1352_Morgan.d:364","Die gehört natürlich auch dazu. Komm wieder, wenn du das erledigt hast.","To teї czкњж twojego zadania. Wrуж, kiedy juї z ni№ skoсczysz.","","","DIA_Addon_Morgan_LurkerPlatt_07_06","",""
"Scripts/Content/Story/Dialoge/DIA_Addon_PIR_1352_Morgan.d:382","Gibt's sonst noch was zu tun für mich?","Jest jeszcze coњ, co mogк zrobiж?","","","DIA_Addon_Morgan_Auftrag2.description","",""
"Scripts/Content/Story/Dialoge/DIA_Addon_PIR_1352_Morgan.d:395","Gibt's sonst noch was zu tun für mich?","Jest jeszcze coњ, co mogк zrobiж?","","","DIA_Addon_Morgan_Auftrag2_15_00","",""
"Scripts/Content/Story/Dialoge/DIA_Addon_PIR_1352_Morgan.d:399","Im Moment nicht.","Na razie nie.","","","DIA_Addon_Morgan_Auftrag2_07_01","",""
"Scripts/Content/Story/Dialoge/DIA_Addon_PIR_1352_Morgan.d:400","Such dir erst mal 'ne Koje und trink dir 'ne ordentliche Buddel Rum!","Znajdџ sobie jak№њ kojк i zdob№dџ solidn№ butelkк rumu.","","","DIA_Addon_Morgan_Auftrag2_07_02","",""
"Scripts/Content/Story/Dialoge/DIA_Addon_PIR_1352_Morgan.d:403","Aaah. Das Zeug ist gut.","Aaach. To jest trunek!","","","DIA_Addon_Morgan_Auftrag2_07_03","",""
"Scripts/Content/Story/Dialoge/DIA_Addon_PIR_1352_Morgan.d:407","Da fragst du am besten den Käpt'n.","Najlepiej spytaj o to kapitana.","","","DIA_Addon_Morgan_Auftrag2_07_04","",""
"Scripts/Content/Story/Dialoge/DIA_Addon_PIR_1352_Morgan.d:425","Wegen Angus und Hank...","Jeњli chodzi o Angusa i Hanka...","","","DIA_Addon_Morgan_FOUNDTHEM.description","",""
"Scripts/Content/Story/Dialoge/DIA_Addon_PIR_1352_Morgan.d:439","Wegen Angus und Hank ...","Jeњli chodzi o Angusa i Hanka...","","","DIA_Addon_Morgan_FOUNDTHEM_15_00","",""
"Scripts/Content/Story/Dialoge/DIA_Addon_PIR_1352_Morgan.d:443","Hör bloß auf mit DER Sache.","Nawet mi o tym nie mуw!","","","DIA_Addon_Morgan_FOUNDTHEM_07_01","",""
"Scripts/Content/Story/Dialoge/DIA_Addon_PIR_1352_Morgan.d:444","Die beiden haben sich wahrscheinlich von Banditen umbringen lassen.","Pewnie dorwali ich bandyci.","","","DIA_Addon_Morgan_FOUNDTHEM_07_02","",""
"Scripts/Content/Story/Dialoge/DIA_Addon_PIR_1352_Morgan.d:445","Und Angus hatte meinen Ring dabei.","A ten draс Angus miaі przy sobie mуj pierњcieс.","","","DIA_Addon_Morgan_FOUNDTHEM_07_03","",""
"Scripts/Content/Story/Dialoge/DIA_Addon_PIR_1352_Morgan.d:446","Na gut, eigentlich war es SEIN Ring. Er hat ihn beim Würfeln gewonnen.","No dobra, to byі juї jego pierњcieс. Uczciwie wygraі go w koњci.","","","DIA_Addon_Morgan_FOUNDTHEM_07_04","",""
"Scripts/Content/Story/Dialoge/DIA_Addon_PIR_1352_Morgan.d:447","Aber ich hätte ihn mir wieder zurückgeholt und jetzt ist er WEG!","Ale ja pewnie bym siк odegraі, a tak - jak kamieс w wodк.","","","DIA_Addon_Morgan_FOUNDTHEM_07_05","",""
"Scripts/Content/Story/Dialoge/DIA_Addon_PIR_1352_Morgan.d:454","Ich habe sie gefunden.","Znalazіem ich.","","","DIA_Addon_Morgan_FOUNDTHEM.DIA_Addon_Morgan_FOUNDTHEM_Now","Info_AddChoice",""
"Scripts/Content/Story/Dialoge/DIA_Addon_PIR_1352_Morgan.d:458","Wenn du meinen Ring findest, dann bring ihn zu mir zurück. Du sollst es auch nicht umsonst gemacht haben!","Jeњli znajdziesz gdzieњ mуj pierњcieс, przynieњ mi go, a ja ci to wynagrodzк.","","","DIA_Addon_Morgan_FOUNDTHEM_07_06","",""
"Scripts/Content/Story/Dialoge/DIA_Addon_PIR_1352_Morgan.d:464","Ich habe sie gefunden.","Znalazіem ich.","","","DIA_Addon_Morgan_FOUNDTHEM_15_01","",""
"Scripts/Content/Story/Dialoge/DIA_Addon_PIR_1352_Morgan.d:465","Jetzt lass dir doch nicht jedes Wort aus der Nase ziehen. Wo sind sie?","I co? Mam ci pіaciж za kaїd№ nowinк? Gdzie s№?","","","DIA_Addon_Morgan_FOUNDTHEM_07_07","",""
"Scripts/Content/Story/Dialoge/DIA_Addon_PIR_1352_Morgan.d:466","Sie sind tot.","Nie їyj№.","","","DIA_Addon_Morgan_FOUNDTHEM_15_03","",""
"Scripts/Content/Story/Dialoge/DIA_Addon_PIR_1352_Morgan.d:467","Der Ring, was ist mit dem Ring?","A pierњcieс? Co z nim?","","","DIA_Addon_Morgan_FOUNDTHEM_07_08","",""
"Scripts/Content/Story/Dialoge/DIA_Addon_PIR_1352_Morgan.d:469","Hier ist er.","Oto on.","","","DIA_Addon_Morgan_FOUNDTHEM.DIA_Addon_Morgan_FOUNDTHEM_GiveRing","Info_AddChoice",""
"Scripts/Content/Story/Dialoge/DIA_Addon_PIR_1352_Morgan.d:470","Den hatten sie nicht dabei.","Nie byіo go przy nich.","","","DIA_Addon_Morgan_FOUNDTHEM.DIA_Addon_Morgan_FOUNDTHEM_NoRing","Info_AddChoice",""
"Scripts/Content/Story/Dialoge/DIA_Addon_PIR_1352_Morgan.d:475","Den hatten sie nicht dabei.","Nie byіo go przy nich.","","","DIA_Addon_Morgan_FOUNDTHEM_NoRing_15_00","",""
"Scripts/Content/Story/Dialoge/DIA_Addon_PIR_1352_Morgan.d:476","entsetzt) Was? Geh zurück und suche noch mal. Sie müssen ihn dabei gehabt haben.","Co? Idџ i sprawdџ jeszcze raz! Musieli go mieж.","","","DIA_Addon_Morgan_FOUNDTHEM_NoRing_07_01","",""
"Scripts/Content/Story/Dialoge/DIA_Addon_PIR_1352_Morgan.d:477","Es ist ein kleiner Ring mit vielen kleinen Verzierungen.","To maіy pierњcieс, bardzo іadnie zdobiony.","","","DIA_Addon_Morgan_FOUNDTHEM_NoRing_07_02","",""
"Scripts/Content/Story/Dialoge/DIA_Addon_PIR_1352_Morgan.d:478","Du MUSST ihn finden. Du MUSST!","Musisz go znaleџж! Musisz! Sіyszysz?","","","DIA_Addon_Morgan_FOUNDTHEM_NoRing_07_03","",""
"Scripts/Content/Story/Dialoge/DIA_Addon_PIR_1352_Morgan.d:484","Hier ist er.","Oto on.","","","DIA_Addon_Morgan_FOUNDTHEM_GiveRing_15_00","",""
"Scripts/Content/Story/Dialoge/DIA_Addon_PIR_1352_Morgan.d:486","(freut sich wie ein Kind) Ja, das ist er. Guter Mann!","Tak, to on! Jesteњ naprawdк dobrym czіowiekiem, wiesz?","","","DIA_Addon_Morgan_FOUNDTHEM_GiveRing_07_01","",""
"Scripts/Content/Story/Dialoge/DIA_Addon_PIR_1352_Morgan.d:487","Hier, nimm diese Steintafel. Sie sieht zwar aus wie alter Ramsch, aber Garett wird 'ne Menge Gold dafür springen lassen.","Weџ tк kamienn№ tabliczkк. Moїe wygl№da niepozornie, ale Garett da ci za ni№ niezі№ sumkк.","","","DIA_Addon_Morgan_FOUNDTHEM_GiveRing_07_02","",""
"Scripts/Content/Story/Dialoge/DIA_Addon_PIR_1352_Morgan.d:506","Was hälst du von Francis?","Co myњlisz o Francisie?","","","DIA_Addon_Morgan_Francis.description","",""
"Scripts/Content/Story/Dialoge/DIA_Addon_PIR_1352_Morgan.d:523","Was hältst du von Francis?","Co myњlisz o Francisie?","","","DIA_Addon_Morgan_Francis_15_00","",""
"Scripts/Content/Story/Dialoge/DIA_Addon_PIR_1352_Morgan.d:524","Der ist mir egal, (gefährlich) solange er mich in Ruhe lässt!","A co mnie on obchodzi? Nic do niego nie mam, jeњli on nie ma nic do mnie.","","","DIA_Addon_Morgan_Francis_07_01","",""
