"location","source","target","id","fuzzy","context","translator_comments","developer_comments"
"Scripts/Content/Story/Dialoge/DIA_Addon_PIR_1320_Greg.d:132","Das wirst du jetzt bei mir abarbeiten.","Bкdziesz musiaі odpracowaж swуj dіug.","","","DIA_Addon_Greg_UseRakeBilanz_01_03","",""
"Scripts/Content/Story/Dialoge/DIA_Addon_PIR_1320_Greg.d:136","Ab jetzt wirst du mal richtige Arbeit kennen lernen.","Teraz poznasz prawdziwe znaczenie sіowa 'praca'.","","","DIA_Addon_Greg_UseRakeBilanz_01_04","",""
"Scripts/Content/Story/Dialoge/DIA_Addon_PIR_1320_Greg.d:152","Bisher noch nicht viel.","Nie byіo tego zbyt wiele.","","","DIA_Addon_Greg_ImNew_nich_15_00","",""
"Scripts/Content/Story/Dialoge/DIA_Addon_PIR_1320_Greg.d:153","Macht nichts. Ich werde schon das Passende für dich finden, mein Freundchen.","Niewaїne. Niedіugo ci coњ wynajdк, chіopcze.","","","DIA_Addon_Greg_ImNew_nich_01_01","",""
"Scripts/Content/Story/Dialoge/DIA_Addon_PIR_1320_Greg.d:159","Gearbeitet.","Pracowaіem.","","","DIA_Addon_Greg_ImNew_turm_15_00","",""
"Scripts/Content/Story/Dialoge/DIA_Addon_PIR_1320_Greg.d:160","So? Was denn?","Co takiego?","","","DIA_Addon_Greg_ImNew_turm_01_01","",""
"Scripts/Content/Story/Dialoge/DIA_Addon_PIR_1320_Greg.d:164","Ich habe die Banditen aus dem Turm erledigt.","Pozbyіem siк bandytуw z wieїy.","","","DIA_Addon_Greg_ImNew_turm_15_02","",""
"Scripts/Content/Story/Dialoge/DIA_Addon_PIR_1320_Greg.d:175","Der Strand im Norden ist von Viechern gesäubert.","Plaїa na pуіnocy jest juї bezpieczna.","","","DIA_Addon_Greg_ImNew_turm_15_03","",""
"Scripts/Content/Story/Dialoge/DIA_Addon_PIR_1320_Greg.d:178","Na ja. Das ist ja schon mal ein Anfang.","Dobrze. Ale to i tak dopiero pocz№tek.","","","DIA_Addon_Greg_ImNew_turm_01_04","",""
"Scripts/Content/Story/Dialoge/DIA_Addon_PIR_1320_Greg.d:192","Was gibt's zu tun?","Co mam zrobiж?","","","DIA_Addon_Greg_JoinPirates.description","",""
"Scripts/Content/Story/Dialoge/DIA_Addon_PIR_1320_Greg.d:205","Was gibt's zu tun?","Co mam zrobiж?","","","DIA_Addon_Greg_JoinPirates_15_00","",""
"Scripts/Content/Story/Dialoge/DIA_Addon_PIR_1320_Greg.d:206","Als erstes müssen wir hier wieder ein bisschen Schwung in den Laden bringen.","Najpierw musimy doprowadziж to miejsce do porz№dku.","","","DIA_Addon_Greg_JoinPirates_01_01","",""
"Scripts/Content/Story/Dialoge/DIA_Addon_PIR_1320_Greg.d:210","Morgan, die faule Sau, schick ich zum Bretter sägen.","Morgan, ten obibok, bкdzie piіowaі deski.","","","DIA_Addon_Greg_JoinPirates_01_02","",""
"Scripts/Content/Story/Dialoge/DIA_Addon_PIR_1320_Greg.d:213","DU wirst Morgans Job übernehmen und den verdammten Canyon von Viechern säubern.","A ty przejmiesz jego robotк i oczyњcisz kanion z tych cholernych stworуw.","","","DIA_Addon_Greg_JoinPirates_01_03","",""
"Scripts/Content/Story/Dialoge/DIA_Addon_PIR_1320_Greg.d:222","Dann werde ich mal aufbrechen.","No to idк.","","","DIA_Addon_Greg_JoinPirates.DIA_Addon_Greg_JoinPirates_Leave","Info_AddChoice",""
"Scripts/Content/Story/Dialoge/DIA_Addon_PIR_1320_Greg.d:227","Soll ich das etwa ganz alleine machen?","Mam tam pуjњж sam?","","","DIA_Addon_Greg_JoinPirates.DIA_Addon_Greg_JoinPirates_Compadres","Info_AddChoice",""
"Scripts/Content/Story/Dialoge/DIA_Addon_PIR_1320_Greg.d:230","Welche Viecher?","O jakich stworach mуwiіeњ?","","","DIA_Addon_Greg_JoinPirates.DIA_Addon_Greg_JoinPirates_ClearCanyon","Info_AddChoice",""
"Scripts/Content/Story/Dialoge/DIA_Addon_PIR_1320_Greg.d:235","Dann werde ich mal aufbrechen.","No to idк.","","","DIA_Addon_Greg_JoinPirates_Leave_15_00","",""
"Scripts/Content/Story/Dialoge/DIA_Addon_PIR_1320_Greg.d:236","Noch was. Du bist jetzt einer von uns.","Chwila. Od teraz jesteњ jednym z nas.","","","DIA_Addon_Greg_JoinPirates_Leave_01_01","",""
"Scripts/Content/Story/Dialoge/DIA_Addon_PIR_1320_Greg.d:237","Also ziehst du dir erst mal vernünftige Klamotten für die Jagd an.","Zaіуї jakiњ porz№dny strуj, zanim ruszysz na polowanie.","","","DIA_Addon_Greg_JoinPirates_Leave_01_02","",""
"Scripts/Content/Story/Dialoge/DIA_Addon_PIR_1320_Greg.d:238","Hier hast du eine von unseren Rüstungen. Ich schätze, die wird dir passen.","To jeden z naszych pancerzy. Powinien pasowaж na ciebie.","","","DIA_Addon_Greg_JoinPirates_Leave_01_03","",""
"Scripts/Content/Story/Dialoge/DIA_Addon_PIR_1320_Greg.d:242","Und trödel nicht so lange herum, klar?","I nie oci№gaj siк z robot№.","","","DIA_Addon_Greg_JoinPirates_Leave_01_04","",""
"Scripts/Content/Story/Dialoge/DIA_Addon_PIR_1320_Greg.d:249","Soll ich das etwa ganz alleine machen?","Mam tam pуjњж sam?","","","DIA_Addon_Greg_JoinPirates_Compadres_15_00","",""
"Scripts/Content/Story/Dialoge/DIA_Addon_PIR_1320_Greg.d:250","Am besten schanppst du dir ein paar von den Jungs.","Moїesz wzi№ж paru chіopakуw, jeњli chcesz.","","","DIA_Addon_Greg_JoinPirates_Compadres_01_01","",""
"Scripts/Content/Story/Dialoge/DIA_Addon_PIR_1320_Greg.d:251","Die sollen ihre Heuer verdienen, anstatt den ganzen Tag nur zu tratschen.","Powinni uczciwie popracowaж, zamiast siк leniж.","","","DIA_Addon_Greg_JoinPirates_Compadres_01_02","",""
"Scripts/Content/Story/Dialoge/DIA_Addon_PIR_1320_Greg.d:258","Welche Viecher?","O jakich stworach mуwiіeњ?","","","DIA_Addon_Greg_JoinPirates_ClearCanyon_15_00","",""
"Scripts/Content/Story/Dialoge/DIA_Addon_PIR_1320_Greg.d:259","Die Razor im Canyon kommen immer näher an's Lager.","O brzytwiakach. Co prawda siedz№ w kanionie, ale czasami podchodz№ pod nasz obуz.","","","DIA_Addon_Greg_JoinPirates_ClearCanyon_01_01","",""
"Scripts/Content/Story/Dialoge/DIA_Addon_PIR_1320_Greg.d:260","Ich habe keine Lust, dass einer meiner Männer im Suff von den Biester gefressen wird.","Nie chcк, їeby ktуryњ z moich ludzi zostaі poїarty.","","","DIA_Addon_Greg_JoinPirates_ClearCanyon_01_02","",""
"Scripts/Content/Story/Dialoge/DIA_Addon_PIR_1320_Greg.d:275","Wegen der Sache mit dem Canyon...","W sprawie kanionu...","","","DIA_Addon_Greg_AboutCanyon.description","",""
"Scripts/Content/Story/Dialoge/DIA_Addon_PIR_1320_Greg.d:288","Wegen der Sache mit dem Canyon ...","W sprawie kanionu...","","","DIA_Addon_Greg_AboutCanyon_15_00","",""
"Scripts/Content/Story/Dialoge/DIA_Addon_PIR_1320_Greg.d:289","Ja, was ist damit?","Tak, o co chodzi?","","","DIA_Addon_Greg_AboutCanyon_01_01","",""
"Scripts/Content/Story/Dialoge/DIA_Addon_PIR_1320_Greg.d:298","Wer kann mir dabei helfen?","Ktoњ moїe mi w tym pomуc?","","","DIA_Addon_Greg_AboutCanyon.DIA_Addon_Greg_AboutCanyon_Compadres","Info_AddChoice",""
"Scripts/Content/Story/Dialoge/DIA_Addon_PIR_1320_Greg.d:301","Welche Viecher soll ich töten?","Jakich stworуw mam siк pozbyж?","","","DIA_Addon_Greg_AboutCanyon.DIA_Addon_Greg_AboutCanyon_Job","Info_AddChoice",""
"Scripts/Content/Story/Dialoge/DIA_Addon_PIR_1320_Greg.d:305","Ich habe alle Razor getötet.","Pozbyіem siк wszystkich brzytwiakуw.","","","DIA_Addon_Greg_AboutCanyon.DIA_Addon_Greg_AboutCanyon_RazorsDead","Info_AddChoice",""
"Scripts/Content/Story/Dialoge/DIA_Addon_PIR_1320_Greg.d:316","Wer kann mir dabei helfen?","Ktoњ moїe mi w tym pomуc?","","","DIA_Addon_Greg_AboutCanyon_Compadres_15_00","",""
"Scripts/Content/Story/Dialoge/DIA_Addon_PIR_1320_Greg.d:317","Nimm dir ein paar von den Jungs mit.","Weџ paru chіopakуw ze sob№.","","","DIA_Addon_Greg_AboutCanyon_Compadres_01_01","",""
"Scripts/Content/Story/Dialoge/DIA_Addon_PIR_1320_Greg.d:318","Die hängen sonst die ganze Zeit nur herum.","I tak tylko siк obijaj№.","","","DIA_Addon_Greg_AboutCanyon_Compadres_01_02","",""
"Scripts/Content/Story/Dialoge/DIA_Addon_PIR_1320_Greg.d:324","Welche Viecher soll ich töten?","Jakich stworуw mam siк pozbyж?","","","DIA_Addon_Greg_AboutCanyon_Job_15_00","",""
"Scripts/Content/Story/Dialoge/DIA_Addon_PIR_1320_Greg.d:325","Du sollst die Razor beseitigen! Das andere Viehzeug ist harmlos.","Przede wszystkim zabij brzytwiaki. Reszta menaїerii jest stosunkowo bezpieczna.","","","DIA_Addon_Greg_AboutCanyon_Job_01_01","",""
"Scripts/Content/Story/Dialoge/DIA_Addon_PIR_1320_Greg.d:331","Ich habe alle Razor getötet.","Pozbyіem siк wszystkich brzytwiakуw.","","","DIA_Addon_Greg_AboutCanyon_RazorsDead_15_00","",""
"Scripts/Content/Story/Dialoge/DIA_Addon_PIR_1320_Greg.d:332","Sehr gut. Du scheinst ja ganz brauchbar zu sein.","Dobrze, bardzo dobrze... Widaж, їe potrafisz to i owo.","","","DIA_Addon_Greg_AboutCanyon_RazorsDead_01_01","",""
"Scripts/Content/Story/Dialoge/DIA_Addon_PIR_1320_Greg.d:352","Ich brauche die Banditenrüstung.","Potrzebujк pancerza, jaki nosz№ bandyci.","","","DIA_Addon_Greg_BanditArmor.description","",""
"Scripts/Content/Story/Dialoge/DIA_Addon_PIR_1320_Greg.d:365","Ich brauche die Banditenrüstung.","Potrzebujк pancerza, jaki nosz№ bandyci.","","","DIA_Addon_Greg_BanditArmor_15_00","",""
"Scripts/Content/Story/Dialoge/DIA_Addon_PIR_1320_Greg.d:368","Mach dich erst mal nützlich. Dann können wir darüber reden.","Musisz na niego zasіuїyж. Pokaї, co potrafisz, to pogadamy.","","","DIA_Addon_Greg_BanditArmor_01_01","",""
"Scripts/Content/Story/Dialoge/DIA_Addon_PIR_1320_Greg.d:371","Töte erst mal alle Razor im Canyon!","Najpierw zaіatw wszystkie brzytwiaki.","","","DIA_Addon_Greg_BanditArmor_01_02","",""
"Scripts/Content/Story/Dialoge/DIA_Addon_PIR_1320_Greg.d:378","Hast mächtig was auf dem Kasten.","Nieџle ci idzie.","","","DIA_Addon_Greg_BanditArmor_01_03","",""
"Scripts/Content/Story/Dialoge/DIA_Addon_PIR_1320_Greg.d:379","Eigentlich sollte Bones mit der Rüstung die Banditen ausspionieren.","Chciaіem, їeby Bones zaіoїyі bandycki pancerz i szpiegowaі tych psubratуw...","","","DIA_Addon_Greg_BanditArmor_01_04","",""
"Scripts/Content/Story/Dialoge/DIA_Addon_PIR_1320_Greg.d:380","Aber ich sollte besser DIR den Job überlassen.","Ale s№dzк, їe ty siк lepiej nadasz do takiej roboty.","","","DIA_Addon_Greg_BanditArmor_01_05","",""
"Scripts/Content/Story/Dialoge/DIA_Addon_PIR_1320_Greg.d:381","Du hast vielleicht sogar 'ne Chance, da heil wieder rauszukommen.","Moїe nawet uda ci siк wyjњж stamt№d w jednym kawaіku.","","","DIA_Addon_Greg_BanditArmor_01_06","",""
"Scripts/Content/Story/Dialoge/DIA_Addon_PIR_1320_Greg.d:382","Sprich mit Bones, er soll dir die Rüstung geben. Und dann gehst du damit zum Banditenlager.","Pogadaj z Bonesem, to da ci pancerz. Naіуї go i idџ do obozu bandytуw.","","","DIA_Addon_Greg_BanditArmor_01_07","",""
"Scripts/Content/Story/Dialoge/DIA_Addon_PIR_1320_Greg.d:383","Ich muss wissen, warum die Drecksäcke überhaupt in unser Tal gekommen sind.","Chciaіbym wiedzieж, po co te њwinie sprowadziіy siк do doliny.","","","DIA_Addon_Greg_BanditArmor_01_08","",""
"Scripts/Content/Story/Dialoge/DIA_Addon_PIR_1320_Greg.d:384","Aye, Aye, Käpt'n!","Tak jest, kapitanie!","","","DIA_Addon_Greg_BanditArmor_15_09","",""
"Scripts/Content/Story/Dialoge/DIA_Addon_PIR_1320_Greg.d:405","Hast du sonst noch was zu tun für mich?","Masz dla mnie jeszcze jakieњ zadanie?","","","DIA_Addon_Greg_Auftraege2.description","",""
"Scripts/Content/Story/Dialoge/DIA_Addon_PIR_1320_Greg.d:429","Hast du sonst noch was zu tun für mich?","Masz dla mnie jeszcze jakieњ zadanie?","","","DIA_Addon_Greg_Auftraege2_15_00","",""
"Scripts/Content/Story/Dialoge/DIA_Addon_PIR_1320_Greg.d:438","Der Strand im Norden ist immer noch voller Viecher.","Plaїa na pуіnocy wci№ї jest peіna stworуw.","","","DIA_Addon_Greg_Auftraege2_01_01","",""
"Scripts/Content/Story/Dialoge/DIA_Addon_PIR_1320_Greg.d:439","Morgan hat auch wirklich gar nichts getan.","Morgan jak zwykle siк obija.","","","DIA_Addon_Greg_Auftraege2_01_02","",""
"Scripts/Content/Story/Dialoge/DIA_Addon_PIR_1320_Greg.d:450","Im südlichen Turm auf der Klippe sind immer noch Banditen.","W wieїy stoj№cej wњrуd poіudniowych klifуw wci№ї gnieїdї№ siк bandyci.","","","DIA_Addon_Greg_Auftraege2_01_03","",""
"Scripts/Content/Story/Dialoge/DIA_Addon_PIR_1320_Greg.d:451","Francis hätte sich eigentlich darum kümmern sollen.","W sumie to Francis miaі siк tym zaj№ж.","","","DIA_Addon_Greg_Auftraege2_01_04","",""
"Scripts/Content/Story/Dialoge/DIA_Addon_PIR_1320_Greg.d:460","Wenn du willst, kannst du das auch noch erledigen.","Ale jeњli chcesz, to moїesz zaіatwiж i tк sprawк.","","","DIA_Addon_Greg_Auftraege2_01_05","",""
"Scripts/Content/Story/Dialoge/DIA_Addon_PIR_1320_Greg.d:472","Der Strand im Norden ist sauber.","Pуіnocna plaїa jest juї bezpieczna.","","","DIA_Addon_Greg_Sauber2.description","",""
"Scripts/Content/Story/Dialoge/DIA_Addon_PIR_1320_Greg.d:491","Der Strand im Norden ist sauber.","Pуіnocna plaїa jest juї bezpieczna.","","","DIA_Addon_Greg_Sauber2_15_00","",""
"Scripts/Content/Story/Dialoge/DIA_Addon_PIR_1320_Greg.d:492","Sehr gut. Hier ist die Belohnung.","Wspaniale. Oto twoja nagroda.","","","DIA_Addon_Greg_Sauber2_01_01","",""
"Scripts/Content/Story/Dialoge/DIA_Addon_PIR_1320_Greg.d:511","Die Banditen im Turm sind erledigt.","Bandyci juї nie wrуc№ do wieїy.","","","DIA_Addon_Greg_BanditPlatt2.description","",""
"Scripts/Content/Story/Dialoge/DIA_Addon_PIR_1320_Greg.d:525","Die Banditen im Turm sind erledigt.","Bandyci juї nie wrуc№ do wieїy.","","","DIA_Addon_Greg_BanditPlatt2_15_00","",""
"Scripts/Content/Story/Dialoge/DIA_Addon_PIR_1320_Greg.d:526","Alles klar. Das war gute Arbeit. Hier ist dein Lohn.","Doskonale. Њwietnie siк spisaіeњ. Oto zapіata za twуj trud.","","","DIA_Addon_Greg_BanditPlatt2_01_01","",""
"Scripts/Content/Story/Dialoge/DIA_Addon_PIR_1320_Greg.d:546","Die Banditen haben eine Goldmine gefunden.","Bandyci odkryli kopalniк zіota.","","","DIA_Addon_Greg_BanditGoldmine.description","",""
"Scripts/Content/Story/Dialoge/DIA_Addon_PIR_1320_Greg.d:560","Die Banditen haben eine Goldmine gefunden.","Bandyci odkryli kopalniк zіota.","","","DIA_Addon_Greg_BanditGoldmine_15_00","",""
"Scripts/Content/Story/Dialoge/DIA_Addon_PIR_1320_Greg.d:561","Ich wusste es! DESHALB sind sie hierhergekommen.","Wiedziaіem! Dlatego tylu ich tu przylazіo!","","","DIA_Addon_Greg_BanditGoldmine_01_01","",""
"Scripts/Content/Story/Dialoge/DIA_Addon_PIR_1320_Greg.d:562","Kein Mensch lebt freiwillig in dem monsterverseuchten Sumpf.","Nikt nie mieszkaіby wњrуd tych bagien roj№cych siк od potworуw, jeњli nie miaіby naprawdк solidnego powodu.","","","DIA_Addon_Greg_BanditGoldmine_01_02","",""
"Scripts/Content/Story/Dialoge/DIA_Addon_PIR_1320_Greg.d:563","Gute Arbeit. Hier, ich hab etwas für dich.","Dobra robota. Tu jest coњ dla ciebie.","","","DIA_Addon_Greg_BanditGoldmine_01_03","",""
"Scripts/Content/Story/Dialoge/DIA_Addon_PIR_1320_Greg.d:582","Wer bist du?","Kim jesteњ?","","","DIA_Addon_Greg_WhoAreYou.description","",""
"Scripts/Content/Story/Dialoge/DIA_Addon_PIR_1320_Greg.d:596","Wer bist du?","Kim jesteњ?","","","DIA_Addon_Greg_WhoAreYou_15_00","",""
"Scripts/Content/Story/Dialoge/DIA_Addon_PIR_1320_Greg.d:597","Ich bin Greg, der Anführer von diesem Sauhaufen hier.","Mam na imiк Greg i jestem przywуdc№ tej garstki ludzi.","","","DIA_Addon_Greg_WhoAreYou_01_01","",""
"Scripts/Content/Story/Dialoge/DIA_Addon_PIR_1320_Greg.d:598","Reicht dir das?","Zadowolony?","","","DIA_Addon_Greg_WhoAreYou_01_02","",""
"Scripts/Content/Story/Dialoge/DIA_Addon_PIR_1320_Greg.d:610","Wie bist du eigentlich hier her gekommen?","Jak siк tu dostaіeњ?","","","DIA_Addon_Greg_NiceToSeeYou.description","",""
"Scripts/Content/Story/Dialoge/DIA_Addon_PIR_1320_Greg.d:624","Wie bist eigentlich hierher gekommen?","Jak siк tu dostaіeњ?","","","DIA_Addon_Greg_NiceToSeeYou_15_00","",""
"Scripts/Content/Story/Dialoge/DIA_Addon_PIR_1320_Greg.d:625","Mit mir hast du wohl nicht gerechnet, was?","Nie spodziewaіeњ siк mnie, co?","","","DIA_Addon_Greg_NiceToSeeYou_01_01","",""
"Scripts/Content/Story/Dialoge/DIA_Addon_PIR_1320_Greg.d:626","Nur damit wir das mal klar stellen. Ich bin Greg und das hier ist mein Lager.","Їeby nie byіo niedomуwieс - ja jestem Greg, a to jest mуj obуz.","","","DIA_Addon_Greg_NiceToSeeYou_01_02","",""
"Scripts/Content/Story/Dialoge/DIA_Addon_PIR_1320_Greg.d:627","Genügt dir das?","Wszystko gra?","","","DIA_Addon_Greg_NiceToSeeYou_01_03","",""
"Scripts/Content/Story/Dialoge/DIA_Addon_PIR_1320_Greg.d:640","Eine Sache würde mich noch interesieren.","Interesuje mnie jeszcze jedna rzecz.","","","DIA_Addon_Greg_Story.description","",""
"Scripts/Content/Story/Dialoge/DIA_Addon_PIR_1320_Greg.d:655","Eine Sache würde mich noch interesieren.","Interesuje mnie jeszcze jedna rzecz.","","","DIA_Addon_Greg_Story_15_00","",""
"Scripts/Content/Story/Dialoge/DIA_Addon_PIR_1320_Greg.d:656","Was denn?","Co znowu?","","","DIA_Addon_Greg_Story_01_01","",""
"Scripts/Content/Story/Dialoge/DIA_Addon_PIR_1320_Greg.d:660","Wie bist du hierher gekommen?","Jak siк tu dostaіeњ?","","","DIA_Addon_Greg_Story.DIA_Addon_Greg_Story_Way","Info_AddChoice",""
"Scripts/Content/Story/Dialoge/DIA_Addon_PIR_1320_Greg.d:661","Wo ist dein Schiff?","Gdzie jest twуj statek?","","","DIA_Addon_Greg_Story.DIA_Addon_Greg_Story_Ship","Info_AddChoice",""
"Scripts/Content/Story/Dialoge/DIA_Addon_PIR_1320_Greg.d:665","Was weisst du über Raven?","Co wiesz o Kruku?","","","DIA_Addon_Greg_Story.DIA_Addon_Greg_Story_Raven","Info_AddChoice",""
"Scripts/Content/Story/Dialoge/DIA_Addon_PIR_1320_Greg.d:676","Wie bist du hierher gekommen.","Jak siк tu dostaіeњ?","","","DIA_Addon_Greg_Story_Way_15_00","",""
"Scripts/Content/Story/Dialoge/DIA_Addon_PIR_1320_Greg.d:677","Ich habe einen Tunnel gefunden. Bei der alten Pyramide, war von ein paar Magiern bewacht.","Udaіo mi siк znaleџж tunel. W starej piramidzie pilnowanej przez dwуch magуw.","","","DIA_Addon_Greg_Story_Way_01_01","",""
"Scripts/Content/Story/Dialoge/DIA_Addon_PIR_1320_Greg.d:678","Hab mich an den Blindfischen einfach vorbei geschlichen.","Niby magowie, ale nawet nie zorientowali siк, їe tam byіem.","","","DIA_Addon_Greg_Story_Way_01_02","",""
"Scripts/Content/Story/Dialoge/DIA_Addon_PIR_1320_Greg.d:679","Zuerst dachte ich, das ist wär 'ne alte Grabkammer und wollte nur mal gucken, ob da was zu holen ist.","Najpierw myњlaіem, їe to grobowiec. Chciaіem sprawdziж, czy nie ma w nim czegoњ wartoњciowego.","","","DIA_Addon_Greg_Story_Way_01_03","",""
"Scripts/Content/Story/Dialoge/DIA_Addon_PIR_1320_Greg.d:680","Hab nicht schlecht gestaunt, als ich plötzlich in meinem geliebten Tal rauskam.","I tak sobie szedіem, aї nagle znalazіem siк w mojej ukochanej dolinie.","","","DIA_Addon_Greg_Story_Way_01_04","",""
"Scripts/Content/Story/Dialoge/DIA_Addon_PIR_1320_Greg.d:681","Dachte schon, ich müsste den Rest meines Lebens vor der Miliz wegrennen.","A juї myњlaіem, їe przez resztк їycia bкdк siк ukrywaі przed straї№.","","","DIA_Addon_Greg_Story_Way_01_05","",""
"Scripts/Content/Story/Dialoge/DIA_Addon_PIR_1320_Greg.d:686","Wo ist dein Schiff?","Gdzie jest twуj statek?","","","DIA_Addon_Greg_Story_Ship_15_00","",""
"Scripts/Content/Story/Dialoge/DIA_Addon_PIR_1320_Greg.d:687","Das glaubt mir kein Mensch. Da ist monatelang kein Schiff zwischen hier und dem Festland unterwegs.","Nie uwierzysz. Od miesiкcy nie widziaіem w okolicy їadnego statku.","","","DIA_Addon_Greg_Story_Ship_01_01","",""
"Scripts/Content/Story/Dialoge/DIA_Addon_PIR_1320_Greg.d:688","Monatelang! - Und das erste Schiff, dem man begegnet, ist ein vollbesetztes Kriegschiff des Königs.","Od miesiкcy, wyobraїasz sobie? I kiedy wreszcie jakiњ siк pojawiі, to krуlewski okrкt wojenny!","","","DIA_Addon_Greg_Story_Ship_01_02","",""
"Scripts/Content/Story/Dialoge/DIA_Addon_PIR_1320_Greg.d:689","Vom Kiel bis zum Masttop voll mit Paladinen.","Peіen paladynуw, od topu po kil.","","","DIA_Addon_Greg_Story_Ship_01_03","",""
"Scripts/Content/Story/Dialoge/DIA_Addon_PIR_1320_Greg.d:690","Das nennt man wohl Pech.","Jeњli juї mieж pecha, to na caіego...","","","DIA_Addon_Greg_Story_Ship_15_04","",""
"Scripts/Content/Story/Dialoge/DIA_Addon_PIR_1320_Greg.d:691","Das kannst du laut sagen. Die haben uns kurzerhand versenkt. Ich bin der Einzige, der es bis zum Ufer geschafft hat.","Јatwo ci mуwiж. Roznieњli nas w drzazgi jak pust№ skrzyniк po owocach. Z caіej zaіogi tylko ja dotarіem їywy do brzegu.","","","DIA_Addon_Greg_Story_Ship_01_05","",""
"Scripts/Content/Story/Dialoge/DIA_Addon_PIR_1320_Greg.d:696","Was weißt du über Raven?","Co wiesz o Kruku?","","","DIA_Addon_Greg_Story_Raven_15_00","",""
"Scripts/Content/Story/Dialoge/DIA_Addon_PIR_1320_Greg.d:697","Soweit ich weiß, war er früher Erzbaron. Eine ziemlich große Nummer in der Kolonie.","Z tego, co mi wiadomo, byі jednym z magnatуw. Wielka szycha w Kolonii.","","","DIA_Addon_Greg_Story_Raven_01_01","",""
"Scripts/Content/Story/Dialoge/DIA_Addon_PIR_1320_Greg.d:698","Ich habe keine Ahnung, warum er hier ist und warum die Leute ihm folgen.","Nie mam pojкcia, co teraz porabia, ani czemu jego ludzie poszli za nim.","","","DIA_Addon_Greg_Story_Raven_01_02","",""
"Scripts/Content/Story/Dialoge/DIA_Addon_PIR_1320_Greg.d:699","Aber ich bin mir sicher, er brütet etwas aus. Er ist nicht der Typ, der sich im Sumpf versteckt.","Ale wierz mi, na pewno coњ knuje. Nie naleїy do tych, co zaszywaj№ siк na bagnach i chc№, їeby њwiat o nich zapomniaі.","","","DIA_Addon_Greg_Story_Raven_01_03","",""
"Scripts/Content/Story/Dialoge/DIA_Addon_PIR_1320_Greg.d:711","Raven ist erledigt.","Kruk jest histori№.","","","DIA_Addon_Greg_RavenDead.description","",""
"Scripts/Content/Story/Dialoge/DIA_Addon_PIR_1320_Greg.d:724","Raven ist erledigt.","Kruk jest histori№.","","","DIA_Addon_Greg_RavenDead_15_00","",""
"Scripts/Content/Story/Dialoge/DIA_Addon_PIR_1320_Greg.d:725","Donnerwetter. Das hätte ich ja nicht gedacht. Hast ihn kalt erwischt, was?","Niech mnie diabli porw№! Nie spodziewaіem siк tego. Musiaіeњ go nieџle zaskoczyж!","","","DIA_Addon_Greg_RavenDead_01_01","",""
"Scripts/Content/Story/Dialoge/DIA_Addon_PIR_1320_Greg.d:726","Das ist mir doch glatt 500 Golstücke wert.","Oto 500 sztuk zіota. Naleї№ ci siк.","","","DIA_Addon_Greg_RavenDead_01_02","",""
"Scripts/Content/Story/Dialoge/DIA_Addon_PIR_1320_Greg.d:729","Du bist ein wahrer Teufelskerl. Weiter so.","Masz charakter. Podobasz mi siк.","","","DIA_Addon_Greg_RavenDead_01_03","",""
"Scripts/Content/Story/Dialoge/DIA_Addon_PIR_1350_Francis.d:39","Ist das deine Hütte?","Це твоя хата?","","","DIA_Addon_Francis_First.description","",""
"Scripts/Content/Story/Dialoge/DIA_Addon_PIR_1350_Francis.d:54","Ist das deine Hütte?","Це твоя хата?","","","DIA_Addon_Francis_GregsHut_15_00","",""
"Scripts/Content/Story/Dialoge/DIA_Addon_PIR_1350_Francis.d:55","Nein, sie gehört Greg.","Ні, вона належить Грегу.","","","DIA_Addon_Francis_GregsHut_13_01","",""
"Scripts/Content/Story/Dialoge/DIA_Addon_PIR_1350_Francis.d:68","Ich muss in Gregs Hütte.","Я мушу потрапити в хату Грега.","","","DIA_Addon_Francis_LetMeIn.description","",""
"Scripts/Content/Story/Dialoge/DIA_Addon_PIR_1350_Francis.d:83","Ich muss in Gregs Hütte.","Я мушу потрапити в хату Грега.","","","DIA_Addon_Francis_LetMeIn_15_00","",""
"Scripts/Content/Story/Dialoge/DIA_Addon_PIR_1350_Francis.d:84","Vergiß es!","І не думай!","","","DIA_Addon_Francis_LetMeIn_13_01","",""
"Scripts/Content/Story/Dialoge/DIA_Addon_PIR_1350_Francis.d:85","Greg ist nicht da. Und ich hab' die Tür verschlossen und passe auf, dass niemand auf dumme Gedanken kommt und versucht, die Hütte zu plündern.","Грега зараз немає. А я замкнув двері й стежу, щоб нікому не спала на думку ідея пограбувати її.","","","DIA_Addon_Francis_LetMeIn_13_02","",""
"Scripts/Content/Story/Dialoge/DIA_Addon_PIR_1350_Francis.d:86","Also schipper wieder ab, oder ich mach dir Beine!","Тож вимітайся звідси, або я тобі ноги переламаю!","","","DIA_Addon_Francis_LetMeIn_13_03","",""
"Scripts/Content/Story/Dialoge/DIA_Addon_PIR_1350_Francis.d:98","Greg ist dein Boss?","Грег - ваш капітан?","","","DIA_Addon_Francis_AboutGreg.description","",""
"Scripts/Content/Story/Dialoge/DIA_Addon_PIR_1350_Francis.d:112","Greg ist dein Boss?","Грег - ваш капітан?","","","DIA_Addon_Francis_AboutGreg_15_00","",""
"Scripts/Content/Story/Dialoge/DIA_Addon_PIR_1350_Francis.d:113","Jetzt komm mir bloß nicht damit, daß du ihn kennst!","Тільки не кажи мені, що знаєш його!","","","DIA_Addon_Francis_AboutGreg_13_01","",""
"Scripts/Content/Story/Dialoge/DIA_Addon_PIR_1350_Francis.d:114","Jeder Seefahrer, ach, was sag ich, jede verfluchte Landratte auf der Insel kennt den schrecklichen Käpt'n Greg!","Кожен моряк, та що там, кожен клятий сухопутний щур на острові знає жахливого капітана Грега!","","","DIA_Addon_Francis_AboutGreg_13_02","",""
"Scripts/Content/Story/Dialoge/DIA_Addon_PIR_1350_Francis.d:115","(schnöselig) Er hat MIR das Kommando übergeben!","(зарозуміло) А він назначив МЕНЕ головним!","","","DIA_Addon_Francis_AboutGreg_13_03","",""
"Scripts/Content/Story/Dialoge/DIA_Addon_PIR_1350_Francis.d:116","Ich bin ihm dafür verantwortlich, daß das faule Pack hier das macht, was er angeordnet hat!","Я відповідальний за те, щоб це збірисько ледарів виконувало його накази!","","","DIA_Addon_Francis_AboutGreg_13_04","",""
"Scripts/Content/Story/Dialoge/DIA_Addon_PIR_1350_Francis.d:117","Einige von den Jungs hier denken vielleicht, sie können machen was sie wollen, nur weil der Käpt'n nicht da ist.","Деякі думають, що поки тут немає капітана, їм можна робити все, що завгодно.","","","DIA_Addon_Francis_AboutGreg_13_05","",""
