"location","source","target","id","fuzzy","context","translator_comments","developer_comments"
"Scripts/Content/Story/Dialoge/DIA_Addon_PIR_1300_Greg_NW.d:55","Psst. Hey du. Komm mal her.","Psst. Hej, ty! Podejdџ no na chwilkк.","","","DIA_Addon_Greg_NW_Hallo_01_00","",""
"Scripts/Content/Story/Dialoge/DIA_Addon_PIR_1300_Greg_NW.d:56","Was ist?","O co chodzi?","","","DIA_Addon_Greg_NW_Hallo_15_01","",""
"Scripts/Content/Story/Dialoge/DIA_Addon_PIR_1300_Greg_NW.d:57","Unterwegs in die Stadt? Schwer beschäftigt noch dazu.","Idziesz do miasta? Pewnie w waїnych interesach?","","","DIA_Addon_Greg_NW_Hallo_01_02","",""
"Scripts/Content/Story/Dialoge/DIA_Addon_PIR_1300_Greg_NW.d:58","(schleimig) Hör mal. Du siehst mir wie ein schlaues Kerlchen aus. Ich schätze, du wirst es noch mal sehr weit bringen.","Sіuchaj, wygl№dasz na bystrego goњcia. Jestem pewien, їe daleko zajdziesz.","","","DIA_Addon_Greg_NW_Hallo_01_03","",""
"Scripts/Content/Story/Dialoge/DIA_Addon_PIR_1300_Greg_NW.d:59","Dir macht doch bestimmt keiner was vor. So was erkenne ich sofort.","Od razu widaж, їe nie dasz siк іatwo nabraж.","","","DIA_Addon_Greg_NW_Hallo_01_04","",""
"Scripts/Content/Story/Dialoge/DIA_Addon_PIR_1300_Greg_NW.d:60","Sag mal, du willst dir doch bestimmt ein paar Goldstücke verdienen, nicht wahr?","Moїe chciaіbyњ dorobiж sobie trochк na boku, co?","","","DIA_Addon_Greg_NW_Hallo_01_05","",""
"Scripts/Content/Story/Dialoge/DIA_Addon_PIR_1300_Greg_NW.d:66","Ich muss weiter.","Muszк juї iњж.","","","DIA_Addon_Greg_NW_Hallo.DIA_Addon_Greg_NW_Hallo_weg","Info_AddChoice",""
"Scripts/Content/Story/Dialoge/DIA_Addon_PIR_1300_Greg_NW.d:67","Lass das Gefasel. Sag mir, was du willst.","Skoсcz z tym beіkotem. Mуw, czego chcesz.","","","DIA_Addon_Greg_NW_Hallo.DIA_Addon_Greg_NW_Hallo_schleim","Info_AddChoice",""
"Scripts/Content/Story/Dialoge/DIA_Addon_PIR_1300_Greg_NW.d:68","Du siehst nicht aus wie jemand, der Goldstücke hat.","Nie wygl№dasz na takiego, co ma zіoto.","","","DIA_Addon_Greg_NW_Hallo.DIA_Addon_Greg_NW_Hallo_vorsicht","Info_AddChoice",""
"Scripts/Content/Story/Dialoge/DIA_Addon_PIR_1300_Greg_NW.d:69","Versteckst du dich vor jemandem?","Ukrywasz siк przed kimњ?","","","DIA_Addon_Greg_NW_Hallo.DIA_Addon_Greg_NW_Hallo_hide","Info_AddChoice",""
"Scripts/Content/Story/Dialoge/DIA_Addon_PIR_1300_Greg_NW.d:70","Warum nicht?","Dlaczego nie!","","","DIA_Addon_Greg_NW_Hallo.DIA_Addon_Greg_NW_Hallo_ja","Info_AddChoice",""
"Scripts/Content/Story/Dialoge/DIA_Addon_PIR_1300_Greg_NW.d:75","Ich muss weiter.","Muszк juї iњж.","","","DIA_Addon_Greg_NW_Hallo_weg_15_00","",""
"Scripts/Content/Story/Dialoge/DIA_Addon_PIR_1300_Greg_NW.d:76","(verärgert) Du willst mir also nicht helfen. Das werde ich mir merken, Freundchen. Wir sehen uns noch mal wieder.","A wiкc nie chcesz mi pomуc? Zapamiкtam to, koleњ. Jeszcze siк spotkamy!","","","DIA_Addon_Greg_NW_Hallo_weg_01_01","",""
"Scripts/Content/Story/Dialoge/DIA_Addon_PIR_1300_Greg_NW.d:84","Warum nicht?","Dlaczego nie!","","","DIA_Addon_Greg_NW_Hallo_ja_15_00","",""
"Scripts/Content/Story/Dialoge/DIA_Addon_PIR_1300_Greg_NW.d:85","Du musst es einem unwissenden alten Seemann schon nachsehen, ich bin fremd in dieser Gegend hier und kenne mich noch nicht so gut mit hier herrschenden Regeln aus.","Wybacz staremu wilkowi morskiemu. Jestem po raz pierwszy w tej okolicy i nie znam panuj№cych tu zwyczajуw.","","","DIA_Addon_Greg_NW_Hallo_ja_01_01","",""
"Scripts/Content/Story/Dialoge/DIA_Addon_PIR_1300_Greg_NW.d:86","So musste ich schmerzlich erfahren, dass man als fremder Reisender in der Hafenstadt nicht willkommen ist.","Na wіasnej skуrze przekonaіem siк, їe podrуїni z dalekich stron nie s№ mile widziani w tym portowym mieњcie.","","","DIA_Addon_Greg_NW_Hallo_ja_01_02","",""
"Scripts/Content/Story/Dialoge/DIA_Addon_PIR_1300_Greg_NW.d:87","(übertrieben mitleidig) Nun stehe ich hier und bin völlig ratlos, wie ich in die Stadt kommen soll.","A teraz jestem caіkiem zagubiony! Nie wiem, jak dostaж siк do miasta.","","","DIA_Addon_Greg_NW_Hallo_ja_01_03","",""
"Scripts/Content/Story/Dialoge/DIA_Addon_PIR_1300_Greg_NW.d:88","Ich habe äußerst wichtige Geschäfte zu erledigen und meine Auftraggeber dulden keinen Aufschub, verstehst du?","Mam do zaіatwienia w mieњcie niezwykle waїne interesy, a moi klienci nie toleruj№ opуџnieс, їe tak powiem.","","","DIA_Addon_Greg_NW_Hallo_ja_01_04","",""
"Scripts/Content/Story/Dialoge/DIA_Addon_PIR_1300_Greg_NW.d:89","Du wirst mir doch sicher helfen, einen Weg zu finden, an den Stadtwachen vorbei zu kommen, hab' ich recht?","Pomуgіbyњ mi przedostaж siк przez posterunek straїy miejskiej, co?","","","DIA_Addon_Greg_NW_Hallo_ja_01_05","",""
"Scripts/Content/Story/Dialoge/DIA_Addon_PIR_1300_Greg_NW.d:101","Du siehst nicht aus wie jemand, der Goldstücke hat.","Nie wygl№dasz na takiego, co ma zіoto.","","","DIA_Addon_Greg_NW_Hallo_vorsicht_15_00","",""
"Scripts/Content/Story/Dialoge/DIA_Addon_PIR_1300_Greg_NW.d:102","(übertrieben bescheiden) Nun, ich bin sicherlich nicht der Umgang, den ein Herr wie du gewohnt ist.","Nie naleїк do towarzystwa, do ktуrego zapewne przyzwyczajony jest szanowny pan.","","","DIA_Addon_Greg_NW_Hallo_vorsicht_01_01","",""
"Scripts/Content/Story/Dialoge/DIA_Addon_PIR_1300_Greg_NW.d:103","Aber meinen kleinen Beitrag zu deinem sicherlich beträchtlichen Vermögen wirst du doch nicht ausschlagen, oder?","Jednak nie miaіby pan nic przeciwko drobnemu powiкkszeniu paсskiej pokaџnej fortuny, prawda?","","","DIA_Addon_Greg_NW_Hallo_vorsicht_01_02","",""
"Scripts/Content/Story/Dialoge/DIA_Addon_PIR_1300_Greg_NW.d:104","Nun, was sagst du? Kann ich mit dir rechnen?","Mogк na pana liczyж?","","","DIA_Addon_Greg_NW_Hallo_vorsicht_01_03","",""
"Scripts/Content/Story/Dialoge/DIA_Addon_PIR_1300_Greg_NW.d:109","Lass das Gefasel. Sag mir, was du willst.","Skoсcz z tym beіkotem. Mуw, czego chcesz.","","","DIA_Addon_Greg_NW_Hallo_schleim_15_00","",""
"Scripts/Content/Story/Dialoge/DIA_Addon_PIR_1300_Greg_NW.d:110","Siehst du? Genau das meine ich.","Widzisz, dokіadnie o to mi chodzi.","","","DIA_Addon_Greg_NW_Hallo_schleim_01_01","",""
"Scripts/Content/Story/Dialoge/DIA_Addon_PIR_1300_Greg_NW.d:111","Nur mit schönen Worten allein kann man bei dir nichts werden.","Nie wystarcz№ miіe sіowa, by ciк przekonaж.","","","DIA_Addon_Greg_NW_Hallo_schleim_01_02","",""
"Scripts/Content/Story/Dialoge/DIA_Addon_PIR_1300_Greg_NW.d:112","Ich habe es gleich gewusst. Ich habe es hier mit einem knallharten Geschäftsmann zu tun.","Od razu wiedziaіem, їe targi z tob№ nie bкd№ іatwe.","","","DIA_Addon_Greg_NW_Hallo_schleim_01_03","",""
"Scripts/Content/Story/Dialoge/DIA_Addon_PIR_1300_Greg_NW.d:113","Du bist doch ein Geschäftsmann und hast bestimmt Interesse an einer kleinen Aufbesserung deines Geldbeutels, oder?","Tak przedsiкbiorczy czіowiek, jak ty, na pewno byіby zainteresowany pogrubieniem swojej sakiewki.","","","DIA_Addon_Greg_NW_Hallo_schleim_01_04","",""
"Scripts/Content/Story/Dialoge/DIA_Addon_PIR_1300_Greg_NW.d:118","Versteckst du dich vor jemandem?","Ukrywasz siк przed kimњ?","","","DIA_Addon_Greg_NW_Hallo_hide_15_00","",""
"Scripts/Content/Story/Dialoge/DIA_Addon_PIR_1300_Greg_NW.d:119","Ach was. So ein Unsinn? Ich stehe nur gerne zwischen den Bäumen, damit mir der Wind nicht direkt ins Gesicht weht.","Aleї sk№d. To jakaњ bzdura. Po prostu lubiк chowaж siк za drzewami, aby wiatr nie wiaі mi prosto w twarz.","","","DIA_Addon_Greg_NW_Hallo_hide_01_01","",""
"Scripts/Content/Story/Dialoge/DIA_Addon_PIR_1300_Greg_NW.d:120","Aber was ist jetzt mit dir? Willst du den Job?","No to jak bкdzie? Chcesz tк robotк?","","","DIA_Addon_Greg_NW_Hallo_hide_01_02","",""
"Scripts/Content/Story/Dialoge/DIA_Addon_PIR_1300_Greg_NW.d:133","Wegen den Stadtwachen...","Jeњli chodzi o straїnikуw...","","","DIA_Addon_Greg_NW_Stadtwachen.description","",""
"Scripts/Content/Story/Dialoge/DIA_Addon_PIR_1300_Greg_NW.d:151","Wegen der Stadtwachen ...","Jeњli chodzi o straїnikуw...","","","DIA_Addon_Greg_NW_Stadtwachen_15_00","",""
"Scripts/Content/Story/Dialoge/DIA_Addon_PIR_1300_Greg_NW.d:152","Ja? Schon eine Idee?","Tak. Masz jakiњ pomysі?","","","DIA_Addon_Greg_NW_Stadtwachen_01_01","",""
"Scripts/Content/Story/Dialoge/DIA_Addon_PIR_1300_Greg_NW.d:155","Ich muss darüber erst nochmal nachdenken.","Bкdк musiaі o tym pomyњleж.","","","DIA_Addon_Greg_NW_Stadtwachen.DIA_Addon_Greg_NW_Stadtwachen_nochnicht","Info_AddChoice",""
"Scripts/Content/Story/Dialoge/DIA_Addon_PIR_1300_Greg_NW.d:159","Wie wär's mit Bestechung?","A moїe sprуbujesz іapуwki?","","","DIA_Addon_Greg_NW_Stadtwachen.DIA_Addon_Greg_NW_Stadtwachen_geld","Info_AddChoice",""
"Scripts/Content/Story/Dialoge/DIA_Addon_PIR_1300_Greg_NW.d:165","Ich hab hier einen Passierschein für die Stadt.","Mam przepustkк do miasta.","","","DIA_Addon_Greg_NW_Stadtwachen.DIA_Addon_Greg_NW_Stadtwachen_Schein","Info_AddChoice",""
"Scripts/Content/Story/Dialoge/DIA_Addon_PIR_1300_Greg_NW.d:171","Als Kräutersammler würdest du in die Stadt kommen.","Do miasta mog№ wejњж zbieracze ziуі.","","","DIA_Addon_Greg_NW_Stadtwachen.DIA_Addon_Greg_NW_Stadtwachen_constantino","Info_AddChoice",""
"Scripts/Content/Story/Dialoge/DIA_Addon_PIR_1300_Greg_NW.d:176","Mit dieser Bauernkleidung hier sollten sie dich vorbei lassen.","Powinni ciк wpuњciж, jeњli zaіoїysz ten strуj rolnika.","","","DIA_Addon_Greg_NW_Stadtwachen.DIA_Addon_Greg_NW_Stadtwachen_klamotten","Info_AddChoice",""
"Scripts/Content/Story/Dialoge/DIA_Addon_PIR_1300_Greg_NW.d:182","Mit dieser Bauernkleidung hier sollten sie dich vorbei lassen.","Powinni ciк wpuњciж, jeњli zaіoїysz ten strуj rolnika.","","","DIA_Addon_Greg_NW_Stadtwachen_klamotten_15_00","",""
"Scripts/Content/Story/Dialoge/DIA_Addon_PIR_1300_Greg_NW.d:193","Das ist genau das, was ich jetzt brauche. Mensch, ich wusste, ich kann mich auf dich verlassen.","Tego mi wіaњnie trzeba. Wiedziaіem, їe mogк na ciebie liczyж.","","","DIA_Addon_Greg_NW_Stadtwachen_klamotten_01_01","",""
"Scripts/Content/Story/Dialoge/DIA_Addon_PIR_1300_Greg_NW.d:194","(hämisch) Getarnt als einheimischer Bauerntölpel wird mich hier niemand mehr behelligen. Ha ha.","Nikt na mnie nie zwrуci uwagi, jeњli przebiorк siк za wsiowego gіupka. Ha, ha!","","","DIA_Addon_Greg_NW_Stadtwachen_klamotten_01_02","",""
"Scripts/Content/Story/Dialoge/DIA_Addon_PIR_1300_Greg_NW.d:205","Ausgezeichnet. Das hast du wirklich gut gemacht. Hier hast du deine versprochene Belohnung.","Doskonale. Dobrze siк spisaіeњ. Oto obiecana zapіata.","","","DIA_Addon_Greg_NW_Stadtwachen_klamotten_01_03","",""
"Scripts/Content/Story/Dialoge/DIA_Addon_PIR_1300_Greg_NW.d:211","(verärgert) Was denn? 50 läppische Goldmünzen? Das ist doch wohl nicht dein Ernst?","Co? Nкdzne 50 zіotych monet? Chyba їartujesz.","","","DIA_Addon_Greg_NW_Stadtwachen_klamotten_15_04","",""
"Scripts/Content/Story/Dialoge/DIA_Addon_PIR_1300_Greg_NW.d:212","(gönnerhaft) Gold ist nicht alles, mein Freund. Nimm sie erst mal.","Zіoto to nie wszystko, przyjacielu. Niech ci to na razie wystarczy.","","","DIA_Addon_Greg_NW_Stadtwachen_klamotten_01_05","",""
"Scripts/Content/Story/Dialoge/DIA_Addon_PIR_1300_Greg_NW.d:213","Ich hab' so das Gefühl, dass wir uns bald wieder begegnen werden.","Mam przeczucie, їe wkrуtce siк spotkamy.","","","DIA_Addon_Greg_NW_Stadtwachen_klamotten_01_06","",""
"Scripts/Content/Story/Dialoge/DIA_Addon_PIR_1300_Greg_NW.d:214","Und wer weiß? Vielleicht werde ich mich noch mal revanchieren. Mach's gut.","I kto wie? Mogк byж wtedy bardziej szczodry. Trzymaj siк.","","","DIA_Addon_Greg_NW_Stadtwachen_klamotten_01_07","",""
"Scripts/Content/Story/Dialoge/DIA_Addon_PIR_1300_Greg_NW.d:226","Ich muss darüber erst noch mal nachdenken.","Bкdк musiaі o tym pomyњleж.","","","DIA_Addon_Greg_NW_Stadtwachen_nochnicht_15_00","",""
"Scripts/Content/Story/Dialoge/DIA_Addon_PIR_1300_Greg_NW.d:227","(ernst) Na schön. Aber beeil dich damit. Ich hab' keine Zeit zu verlieren.","Dobra. Ale niech to nie trwa za dіugo. Nie mam czasu do stracenia.","","","DIA_Addon_Greg_NW_Stadtwachen_nochnicht_01_01","",""
"Scripts/Content/Story/Dialoge/DIA_Addon_PIR_1300_Greg_NW.d:233","Ich hab hier einen Passierschein für die Stadt.","Mam przepustkк do miasta.","","","DIA_Addon_Greg_NW_Stadtwachen_Schein_15_00","",""
"Scripts/Content/Story/Dialoge/DIA_Addon_PIR_1300_Greg_NW.d:234","(zynisch) Ach so. Ich soll jetzt so tun, als ob ich ein Bürger der Stadt wär', oder wie?","Oczywiњcie. Po prostu bкdк udawaж mieszkaсca tego piкknego miasta...","","","DIA_Addon_Greg_NW_Stadtwachen_Schein_01_01","",""
"Scripts/Content/Story/Dialoge/DIA_Addon_PIR_1300_Greg_NW.d:235","(verärgert) Jetzt kuck mich doch mal an, Junge. Das glaubt mir doch keine Sau.","Przyjrzyj mi siк uwaїnie, chіopcze. Nabraіby siк na to chyba tylko њlepiec.","","","DIA_Addon_Greg_NW_Stadtwachen_Schein_01_02","",""
"Scripts/Content/Story/Dialoge/DIA_Addon_PIR_1300_Greg_NW.d:241","Als Kräutersammler würdest du in die Stadt kommen.","Do miasta mog№ wejњж zbieracze ziуі.","","","DIA_Addon_Greg_NW_Stadtwachen_constantino_15_00","",""
"Scripts/Content/Story/Dialoge/DIA_Addon_PIR_1300_Greg_NW.d:242","(verärgert) Was? Sehe ich etwa so aus, als würde ich im Wald Blümchen pflücken?","Co? Czy ja wygl№dam, jakbym hasaі po lesie, zbieraj№c kwiatki?","","","DIA_Addon_Greg_NW_Stadtwachen_constantino_01_01","",""
"Scripts/Content/Story/Dialoge/DIA_Addon_PIR_1300_Greg_NW.d:248","Wie wär's mit Bestechung?","A moїe sprуbujesz іapуwki?","","","DIA_Addon_Greg_NW_Stadtwachen_geld_15_00","",""
"Scripts/Content/Story/Dialoge/DIA_Addon_PIR_1300_Greg_NW.d:249","(verschmitzt) Tja, wenn das bei mir funktionieren würde, hätte ich das sicher schon versucht.","Tak, gdyby to mogіo siк udaж, juї pewnie bym sprуbowaі.","","","DIA_Addon_Greg_NW_Stadtwachen_geld_01_01","",""
"Scripts/Content/Story/Dialoge/DIA_Addon_PIR_1300_Greg_NW.d:263","Eine Sache noch...","Jeszcze jedno...","","","DIA_Addon_Greg_NW_PERM.description","",""
"Scripts/Content/Story/Dialoge/DIA_Addon_PIR_1300_Greg_NW.d:277","Eine Sache noch ...","Jeszcze jedno...","","","DIA_Addon_Greg_NW_PERM_15_00","",""
"Scripts/Content/Story/Dialoge/DIA_Addon_PIR_1300_Greg_NW.d:278","(überheblich) Hör zu, Kleiner. Ich hab im Moment wichtige Dinge zu erledigen.","Posіuchaj mnie, chіopcze. Muszк siк teraz zaj№ж waїnymi sprawami.","","","DIA_Addon_Greg_NW_PERM_01_01","",""
"Scripts/Content/Story/Dialoge/DIA_Addon_PIR_1300_Greg_NW.d:279","(drohend) Wir werden uns später unterhalten. Klar?","Pogadamy pуџniej. Jasne?","","","DIA_Addon_Greg_NW_PERM_01_02","",""
"Scripts/Content/Story/Dialoge/DIA_Addon_PIR_1300_Greg_NW.d:313","Sieh mal an, wer da reingeschneit kommt.","Patrzcie, kogo my tu mamy.","","","DIA_Addon_Greg_NW_MeetGregSecondTime_01_00","",""
"Scripts/Content/Story/Dialoge/DIA_Addon_PIR_1300_Greg_NW.d:317","Der Bauernjunge.","Nasz pastuch.","","","DIA_Addon_Greg_NW_MeetGregSecondTime_01_01","",""
"Scripts/Content/Story/Dialoge/DIA_Addon_PIR_1300_Greg_NW.d:321","Der Kerl, der mich so schnöde hat abblitzen lassen. So sieht man sich wieder, was?","Dureс, ktуry postanowiі mi odmуwiж. Nie oczekiwaіeњ, їe mnie jeszcze spotkasz, co?","","","DIA_Addon_Greg_NW_MeetGregSecondTime_01_02","",""
"Scripts/Content/Story/Dialoge/DIA_Addon_PIR_1300_Greg_NW.d:325","(sauer) Ich dachte, du wolltest mir helfen. Und was macht du? Verpisst dich einfach.","Myњlaіem, їe chcesz mi pomуc. A ty co zrobiіeњ? Po prostu zwiaіeњ.","","","DIA_Addon_Greg_NW_MeetGregSecondTime_01_03","",""
"Scripts/Content/Story/Dialoge/DIA_Addon_PIR_1300_Greg_NW.d:326","Hast wohl gedacht, ich würde da ewig versauern, was?","S№dziіeњ, їe bкdк tam uziemiony na zawsze, co?","","","DIA_Addon_Greg_NW_MeetGregSecondTime_01_04","",""
"Scripts/Content/Story/Dialoge/DIA_Addon_PIR_1300_Greg_NW.d:327","Das sieht man's mal wieder. Hilf dir selbst, sonst hilft dir niemand. Aber noch mal lass ich dir das nicht durchgehen.","No i masz. Jak sam siк o siebie nie zatroszczysz, to nikt ci nie pomoїe. Nastкpnym razem tak іatwo ci nie pуjdzie, wiкc lepiej dotrzymuj sіowa.","","","DIA_Addon_Greg_NW_MeetGregSecondTime_01_05","",""
"Scripts/Content/Story/Dialoge/DIA_Addon_PIR_1300_Greg_NW.d:330","Du kommst mir gerade recht.","Zreszt№ potrzebujк wіaњnie kogoњ takiego jak ty.","","","DIA_Addon_Greg_NW_MeetGregSecondTime_01_06","",""
"Scripts/Content/Story/Dialoge/DIA_Addon_PIR_1300_Greg_NW.d:343","Wer bist du überhaupt?","A kim ty wіaњciwie jesteњ?","","","DIA_Addon_Greg_NW_wer.description","",""
"Scripts/Content/Story/Dialoge/DIA_Addon_PIR_1300_Greg_NW.d:356","Wer bist du überhaupt?","A kim ty wіaњciwie jesteњ?","","","DIA_Addon_Greg_NW_wer_15_00","",""
"Scripts/Content/Story/Dialoge/DIA_Addon_PIR_1300_Greg_NW.d:357","Das geht dich einen feuchten Dreck an.","To nie twoja sprawa.","","","DIA_Addon_Greg_NW_wer_01_01","",""
"Scripts/Content/Story/Dialoge/DIA_Addon_PIR_1300_Greg_NW.d:358","Wenn ich dir erzählen wollte, wer ich bin, dann hätte ich das schon getan, klar?","Gdybym chciaі ci powiedzieж, kim jestem, to chyba bym to zrobiі, nie?","","","DIA_Addon_Greg_NW_wer_01_02","",""
"Scripts/Content/Story/Dialoge/DIA_Addon_PIR_1300_Greg_NW.d:370","Was willst du denn von mir?","Czego ode mnie chcesz?","","","DIA_Addon_Greg_NW_was.description","",""
"Scripts/Content/Story/Dialoge/DIA_Addon_PIR_1300_Greg_NW.d:383","Ich suche einen Kerl. In der Stadt war er nicht zu finden und die Geigen hier haben auch keine Ahnung.","Szukam pewnego goњcia. Nie mogіem go znaleџж w mieњcie, a ci durnie tutaj teї nic nie wiedz№.","","","DIA_Addon_Greg_NW_Search_Dexter_01_00","",""
"Scripts/Content/Story/Dialoge/DIA_Addon_PIR_1300_Greg_NW.d:384","Er ist schlank, dunkelhaarig und trägt meist eine rote Rüstung.","Jest szczupіy, ma ciemne wіosy i nosi czerwon№ zbrojк.","","","DIA_Addon_Greg_NW_Search_Dexter_01_01","",""
"Scripts/Content/Story/Dialoge/DIA_Addon_PIR_1300_Greg_NW.d:385","Soviel ich weiß, war er damals ein Sträfling in der Kolonie. Ich glaube, seine Name beginnt mit einem 'D'.","O ile wiem, byі skazaсcem w starej kolonii. Jego imiк zaczynaіo siк chyba na D.","","","DIA_Addon_Greg_NW_Search_Dexter_01_02","",""
"Scripts/Content/Story/Dialoge/DIA_Addon_PIR_1300_Greg_NW.d:396","Was willst du denn von mir?","Czego ode mnie chcesz?","","","DIA_Addon_Greg_NW_was_15_00","",""
"Scripts/Content/Story/Dialoge/DIA_Addon_PIR_1300_Greg_NW.d:400","Hast du immer noch Probleme mit den Stadtwachen?","Wci№ї masz problemy ze straїnikami miejskimi?","","","DIA_Addon_Greg_NW_was_15_01","",""
"Scripts/Content/Story/Dialoge/DIA_Addon_PIR_1300_Greg_NW.d:401","(droht) Ich GEB' dir gleich Probleme, du Wicht.","Sam zaraz ZAЈATWIК ci problemy, durniu.","","","DIA_Addon_Greg_NW_was_01_02","",""
"Scripts/Content/Story/Dialoge/DIA_Addon_PIR_1300_Greg_NW.d:407","Du redest von Diego.","Mуwisz o Diego.","","","DIA_Addon_Greg_NW_was.DIA_Addon_Greg_NW_was_Diego","Info_AddChoice",""
"Scripts/Content/Story/Dialoge/DIA_Addon_PIR_1300_Greg_NW.d:412","Heißt er vielleicht Dexter?","Czy ma na imiк Dexter?","","","DIA_Addon_Greg_NW_was.DIA_Addon_Greg_NW_was_Dexter","Info_AddChoice",""
"Scripts/Content/Story/Dialoge/DIA_Addon_PIR_1300_Greg_NW.d:415","Ich kenne niemanden, auf den die Beschreibung passt.","Nie znam nikogo, kto pasowaіby do tego opisu.","","","DIA_Addon_Greg_NW_was.DIA_Addon_Greg_NW_was_no","Info_AddChoice",""
"Scripts/Content/Story/Dialoge/DIA_Addon_PIR_1300_Greg_NW.d:420","Kann sein, dass das sein Name ist. Ich bin mir nicht sicher.","Moїliwe, їe tak ma na imiк. Nie jestem pewien.","","","DIA_Addon_Greg_NW_was_GregUnsicher_01_00","",""
"Scripts/Content/Story/Dialoge/DIA_Addon_PIR_1300_Greg_NW.d:421","Ich werd's wohl erst wissen, wenn ich vor ihm stehe.","Bкdк musiaі poczekaж, aї stanк z nim twarz№ w twarz.","","","DIA_Addon_Greg_NW_was_GregUnsicher_01_01","",""
"Scripts/Content/Story/Dialoge/DIA_Addon_PIR_1300_Greg_NW.d:426","Sonst noch was?","Coњ jeszcze?","","","DIA_Addon_Greg_NW_was_UnNun_15_00","",""
"Scripts/Content/Story/Dialoge/DIA_Addon_PIR_1300_Greg_NW.d:427","(sauer) Ja, du Großmaul. Ich hab' noch was.","Tak, ty pyszaіku. Jest coњ jeszcze.","","","DIA_Addon_Greg_NW_was_UnNun_01_01","",""
"Scripts/Content/Story/Dialoge/DIA_Addon_PIR_1300_Greg_NW.d:428","Ich brauche Waffen. Ich brauche Proviant. Gold wäre auch nicht schlecht.","Potrzebujк broni. Potrzebujк prowiantu. Trochк zіota teї by nie zaszkodziіo.","","","DIA_Addon_Greg_NW_was_UnNun_01_02","",""
"Scripts/Content/Story/Dialoge/DIA_Addon_PIR_1300_Greg_NW.d:431","Ich kann dir nicht helfen.","Nie mogк ci w tym pomуc.","","","DIA_Addon_Greg_NW_was.DIA_Addon_Greg_NW_was_NoHelp","Info_AddChoice",""
"Scripts/Content/Story/Dialoge/DIA_Addon_PIR_1300_Greg_NW.d:432","Proviant? Du bist hier in einer Taverne.","Prowiant? Przecieї wіaњnie stoisz przed karczm№!","","","DIA_Addon_Greg_NW_was.DIA_Addon_Greg_NW_was_Orlan","Info_AddChoice",""
"Scripts/Content/Story/Dialoge/DIA_Addon_PIR_1300_Greg_NW.d:433","Waffen? Die Söldner haben Waffen.","Broс? Maj№ j№ najemnicy.","","","DIA_Addon_Greg_NW_was.DIA_Addon_Greg_NW_was_SLD","Info_AddChoice",""
"Scripts/Content/Story/Dialoge/DIA_Addon_PIR_1300_Greg_NW.d:434","Hier hast du 10 Goldmünzen.","Oto 10 zіotych monet.","","","DIA_Addon_Greg_NW_was.DIA_Addon_Greg_NW_was_HierGold","Info_AddChoice",""
"Scripts/Content/Story/Dialoge/DIA_Addon_PIR_1300_Greg_NW.d:435","Hast du in der Stadt keinen Waffenhändler gefunden?","W mieњcie nie byіo їadnych handlarzy broni№?","","","DIA_Addon_Greg_NW_was.DIA_Addon_Greg_NW_was_Waffenhaendler","Info_AddChoice",""
"Scripts/Content/Story/Dialoge/DIA_Addon_PIR_1300_Greg_NW.d:436","Gold? Wir alle wollen Gold.","Zіoto? Wszyscy chcemy zіota.","","","DIA_Addon_Greg_NW_was.DIA_Addon_Greg_NW_was_Gold","Info_AddChoice",""
"Scripts/Content/Story/Dialoge/DIA_Addon_PIR_1300_Greg_NW.d:441","Ich kann dir nicht helfen.","Nie mogк ci w tym pomуc.","","","DIA_Addon_Greg_NW_was_NoHelp_15_00","",""
"Scripts/Content/Story/Dialoge/DIA_Addon_PIR_1300_Greg_NW.d:442","(verärgert) So. Du WILLST also nicht.","Czyїby? A moїe po prostu NIE CHCESZ?","","","DIA_Addon_Greg_NW_was_NoHelp_01_01","",""
"Scripts/Content/Story/Dialoge/DIA_Addon_PIR_1300_Greg_NW.d:446","Das ist jetzt schon das zweite Mal, dass du mich hängen lässt.","Juї po raz drugi wpкdzasz mnie w tarapaty.","","","DIA_Addon_Greg_NW_was_NoHelp_01_02","",""
"Scripts/Content/Story/Dialoge/DIA_Addon_PIR_1300_Greg_NW.d:447","Ich kann dir nur den guten Rat geben: Sorge dafür, dass wir uns nicht nochmal begegnen.","Pozwуl, їe dam ci maі№ radк: upewnij siк, їe juї wiкcej siк nie spotkamy.","","","DIA_Addon_Greg_NW_was_NoHelp_01_03","",""
"Scripts/Content/Story/Dialoge/DIA_Addon_PIR_1300_Greg_NW.d:451","Das werde ich mir merken. Da kannst du dich drauf verlassen.","Zapamiкtam to. Moїesz byж pewien.","","","DIA_Addon_Greg_NW_was_NoHelp_01_04","",""
"Scripts/Content/Story/Dialoge/DIA_Addon_PIR_1300_Greg_NW.d:464","Gold? Wir alle wollen Gold.","Zіoto? Wszyscy chcemy zіota.","","","DIA_Addon_Greg_NW_was_Gold_15_00","",""
"Scripts/Content/Story/Dialoge/DIA_Addon_PIR_1300_Greg_NW.d:465","Mag schon sein. Und was machst du damit? Versäufst dein Gold in der Kneipe oder verprasst es im Bordell, so wie ich dich einschätze.","Zapewne. Tylko co z nim zrobisz? S№dz№c po twoim wygl№dzie, wydasz je na wуdkк albo przepuњcisz w burdelu.","","","DIA_Addon_Greg_NW_was_Gold_01_01","",""
"Scripts/Content/Story/Dialoge/DIA_Addon_PIR_1300_Greg_NW.d:466","Und du hast einen besseren Plan, ja?","A ty masz pewnie lepszy plan, co?","","","DIA_Addon_Greg_NW_was_Gold_15_02","",""
"Scripts/Content/Story/Dialoge/DIA_Addon_PIR_1300_Greg_NW.d:467","(sauer) Du würdest dich unter einem Stein verkriechen, wenn du wüsstest, was ich schon alles auf die Beine gestellt habe.","Gdybyњ wiedziaі, co osi№gn№іem, to ze strachu wlazіbyњ pod kamieс.","","","DIA_Addon_Greg_NW_was_Gold_01_03","",""
"Scripts/Content/Story/Dialoge/DIA_Addon_PIR_1300_Greg_NW.d:468","Also sei nicht so vorlaut, sonst stopf ich dir dein großes Maul.","Wiкc przestaс mleж ozorem, bo bкdк musiaі zamkn№ж ci buџkк.","","","DIA_Addon_Greg_NW_was_Gold_01_04","",""
"Scripts/Content/Story/Dialoge/DIA_Addon_PIR_1300_Greg_NW.d:473","Hast du in der Stadt keinen Waffenhändler gefunden?","W mieњcie nie byіo їadnych handlarzy broni№?","","","DIA_Addon_Greg_NW_was_Waffenhaendler_15_00","",""
"Scripts/Content/Story/Dialoge/DIA_Addon_PIR_1300_Greg_NW.d:474","Das ist nicht dein Ernst, oder? Die haben doch nur Schrott.","Chyba їartujesz? Maj№ tylko jakieњ њmieci.","","","DIA_Addon_Greg_NW_was_Waffenhaendler_01_01","",""
"Scripts/Content/Story/Dialoge/DIA_Addon_PIR_1300_Greg_NW.d:479","Hier hast du 10 Goldmünzen.","Oto 10 zіotych monet.","","","DIA_Addon_Greg_NW_was_HierGold_15_00","",""
"Scripts/Content/Story/Dialoge/DIA_Addon_PIR_1300_Greg_NW.d:480","(lacht) Du armer Schlucker kannst deine Kröten behalten. Ich habe da eine bessere Idee.","Ty biedaku. Zatrzymaj te grosze. Mam lepszy pomysі.","","","DIA_Addon_Greg_NW_was_HierGold_01_01","",""
"Scripts/Content/Story/Dialoge/DIA_Addon_PIR_1300_Greg_NW.d:481","Nicht weit von hier gibt es eine Höhle! Ich bin früher schon mal hier gewesen und habe an einigen Stellen meinen Kram vergraben.","Niedaleko st№d jest jaskinia. Zakopaіem tam swoje rzeczy.","","","DIA_Addon_Greg_NW_was_HierGold_01_02","",""
"Scripts/Content/Story/Dialoge/DIA_Addon_PIR_1300_Greg_NW.d:482","Die Höhle ist mir alleine ein wenig zu gefährlich. Ich will, dass du mir dabei hilfst.","W jaskini jest niebezpiecznie i nie mogк tam iњж sam. Chcк, їebyњ mi pomуgі.","","","DIA_Addon_Greg_NW_was_HierGold_01_03","",""
