"location","source","target","id","fuzzy","context","translator_comments","developer_comments"
"Scripts/Content/Story/Dialoge/DIA_Addon_BDT_10004_Finn.d:70","Wieder bei der Arbeit?","Знову працюєш?","","False","DIA_Addon_Finn_Hacker.description","",""
"Scripts/Content/Story/Dialoge/DIA_Addon_BDT_10004_Finn.d:83","Wieder bei der Arbeit?","Знову працюєш?","","True","DIA_Addon_BDT_10004_Finn_Hacker_15_00","",""
"Scripts/Content/Story/Dialoge/DIA_Addon_BDT_10004_Finn.d:84","Ja, jetzt hole ich auch noch das letzte Stück Gold aus dieser Mine.","Tak, mam zamiar zdobyж ostatni kawaіek zіota z tej kopalni.","","True","DIA_Addon_BDT_10004_Finn_Hacker_07_01","",""
"Scripts/Content/Story/Dialoge/DIA_Addon_BDT_10004_Finn.d:109","Hi!","Czeњж.","","True","DIA_Addon_BDT_10004_Finn_Hi_15_00","",""
"Scripts/Content/Story/Dialoge/DIA_Addon_BDT_10004_Finn.d:110","(brummig) Was willst du?","Czego chcesz?","","True","DIA_Addon_BDT_10004_Finn_Hi_07_01","",""
"Scripts/Content/Story/Dialoge/DIA_Addon_BDT_10004_Finn.d:122","Wo kriege ich 'ne Spitzhacke her?","Gdzie dostanк kilof?","","True","DIA_Addon_Finn_Hacke.description","",""
"Scripts/Content/Story/Dialoge/DIA_Addon_BDT_10004_Finn.d:132","Wo kriege ich 'ne Spitzhacke her?","Gdzie dostanк kilof?","","True","DIA_Addon_Finn_Hacke_15_00","",""
"Scripts/Content/Story/Dialoge/DIA_Addon_BDT_10004_Finn.d:133","Geh zu Huno dem Schmied. Aber selbst wenn du eine Hacke hast, heißt das noch nicht, dass du auch in die Mine kommst.","Idџ do Huno, kowala. Ale posiadanie kilofa wcale nie otworzy ci drogi do kopalni.","","True","DIA_Addon_Finn_Hacke_07_01","",""
"Scripts/Content/Story/Dialoge/DIA_Addon_BDT_10004_Finn.d:134","Wenn du rein willst, musst du mit Esteban sprechen.","Jeњli chcesz wejњж, musisz najpierw porozmawiaж z Estebanem.","","True","DIA_Addon_Finn_Hacke_07_02","",""
"Scripts/Content/Story/Dialoge/DIA_Addon_BDT_10004_Finn.d:135","Zu Thorus brauchst du gar nicht erst zu gehen - der lässt dich nur rein, wenn du 'nen roten Stein hast.","Do Thorusa moїesz nawet nie iњж - jeњli nie masz czerwonego kamienia, to ciк nie wpuњci.","","True","DIA_Addon_Finn_Hacke_07_03","",""
"Scripts/Content/Story/Dialoge/DIA_Addon_BDT_10004_Finn.d:147","Sag mal, was hältst du von Esteban?","Co myњlisz o Estebanie?","","True","DIA_Addon_Finn_Esteban.description","",""
"Scripts/Content/Story/Dialoge/DIA_Addon_BDT_10004_Finn.d:160","Sag mal, was hältst du von Esteban?","Co myњlisz o Estebanie?","","True","DIA_Addon_Finn_Esteban_15_00","",""
"Scripts/Content/Story/Dialoge/DIA_Addon_BDT_10004_Finn.d:161","(vorsichtig) Er ist der Boss hier ... er ... ist ganz okay, denke ich.","On tu jest szefem... Myњlк, їe jest w porz№dku.","","True","DIA_Addon_Finn_Esteban_07_01","",""
"Scripts/Content/Story/Dialoge/DIA_Addon_BDT_10004_Finn.d:162","(zögernd) Die guten Jungs lässt er immer in die Mine. Die was vom Schürfen verstehen, meine ich.","Porz№dnych chіopakуw zawsze wpuszcza do kopalni. To znaczy takich, ktуrzy maj№ pojкcie o gуrnictwie.","","True","DIA_Addon_Finn_Esteban_07_02","",""
"Scripts/Content/Story/Dialoge/DIA_Addon_BDT_10004_Finn.d:174","Und du verstehst was vom Schürfen?","Znasz siк na gуrnictwie?","","True","DIA_Addon_Finn_Profi.description","",""
"Scripts/Content/Story/Dialoge/DIA_Addon_BDT_10004_Finn.d:187","Und du verstehst was vom Schürfen?","Znasz siк na gуrnictwie?","","True","DIA_Addon_Finn_Profi_15_00","",""
"Scripts/Content/Story/Dialoge/DIA_Addon_BDT_10004_Finn.d:188","Ich bin der Beste!","Jestem najlepszy!","","True","DIA_Addon_Finn_Profi_07_01","",""
"Scripts/Content/Story/Dialoge/DIA_Addon_BDT_10004_Finn.d:217","Alles klar, Chef. Du willst den Besten in der Mine sehen? Dann will ich mal wieder ...","W porz№dku, szefie. Chcesz, їeby w kopalni pracowali najlepsi? Czyli znowu wkraczam do akcji.","","True","DIA_Addon_BDT_10004_Finn_Mine_07_00","",""
"Scripts/Content/Story/Dialoge/DIA_Addon_BDT_10004_Finn.d:219","Ach, noch was. Ich verrate dir mal ein Buddlergeheimnis.","I jeszcze jedno: zdradzк ci sekret Kopaczy.","","True","DIA_Addon_BDT_10004_Finn_Mine_07_01","",""
"Scripts/Content/Story/Dialoge/DIA_Addon_BDT_10004_Finn.d:220","Ab und zu bietet es sich an, einen Trümmerschlag anzusetzen.","Czas poіupaж nieco gіazуw.","","True","DIA_Addon_BDT_10004_Finn_Mine_07_02","",""
"Scripts/Content/Story/Dialoge/DIA_Addon_BDT_10004_Finn.d:221","Wenn du ein paar mal gehackt hast und es ist nichts dabei rumgekommen, dann zieh die Spitze der Hacke quer über den Fels.","Jak uderzyіeњ juї kilka razy, ale nic nie odkopaіeњ, to przeci№gnij ostrzem kilofa po skale.","","True","DIA_Addon_BDT_10004_Finn_Mine_07_03","",""
"Scripts/Content/Story/Dialoge/DIA_Addon_BDT_10004_Finn.d:222","Mit etwas Glück kriegst du so gleich mehrere Brocken.","Przy odrobinie szczкњcia zdobкdziesz sporo kawaіkуw.","","True","DIA_Addon_BDT_10004_Finn_Mine_07_04","",""
"Scripts/Content/Story/Dialoge/DIA_Addon_BDT_10004_Finn.d:256","Na, da gibt's einiges zu wissen. Gold ist kein Erz. Das ist ein verdammt wichtiger Unterschied.","Trzeba wiedzieж kilka rzeczy. Zіoto to nie ruda. To piekielnie duїa rуїnica.","","True","DIA_Addon_Finn_Gold_07_00","",""
"Scripts/Content/Story/Dialoge/DIA_Addon_BDT_10004_Finn.d:257","Ich meine, welche Frau hängt sich schon 'ne Kette aus Erz um den Hals? (lacht)","Jaka kobieta nosiіaby na szyi іaсcuch wykonany z rudy?","","True","DIA_Addon_Finn_Gold_07_01","",""
"Scripts/Content/Story/Dialoge/DIA_Addon_BDT_10004_Finn.d:258","Beim Hacken arbeitet man von oben nach unten. So kannst du die Nuggets am besten freilegen.","Zacznij kopaж od gуry do doіu. Tym sposobem najіatwiej odkopaж samorodki.","","True","DIA_Addon_Finn_Gold_07_02","",""
"Scripts/Content/Story/Dialoge/DIA_Addon_BDT_10004_Finn.d:259","Es gibt auch Buddler, die es umgekehrt machen - aber das ist ungleich schwieriger.","Niektуrzy kopacze robi№ odwrotnie, ale to o wiele trudniejsze.","","True","DIA_Addon_Finn_Gold_07_03","",""
"Scripts/Content/Story/Dialoge/DIA_Addon_BDT_10004_Finn.d:274","Kannst du meine Fähigkeit im Goldhacken einschätzen?","Potrafisz oceniж moje umiejкtnoњci kopania zіota?","","True","DIA_Addon_Finn_ein.description","",""
"Scripts/Content/Story/Dialoge/DIA_Addon_BDT_10004_Finn.d:289","Kannst du meine Fähigkeit im Goldhacken einschätzen?","Potrafisz oceniж moje umiejкtnoњci kopania zіota?","","True","DIA_Addon_Finn_ein_15_00","",""
"Scripts/Content/Story/Dialoge/DIA_Addon_BDT_10004_Finn.d:293","Klar. Ich mache das schon seit über 35 Jahren. Es gibt nichts, das ich nicht erkenne!","Pewnie. Robiк tu juї od ponad 35 lat. Wszystko poznam!","","True","DIA_Addon_Finn_ein_07_01","",""
"Scripts/Content/Story/Dialoge/DIA_Addon_BDT_10004_Finn.d:297","Bei dir würde ich sagen, du bist ein ...","Powiedziaіbym, їe jesteњ...","","True","DIA_Addon_Finn_ein_07_02","",""
"Scripts/Content/Story/Dialoge/DIA_Addon_BDT_10004_Finn.d:301","blutiger Anfänger.","nieopierzonym їуіtodziobem.","","True","DIA_Addon_Finn_ein_07_03","",""
"Scripts/Content/Story/Dialoge/DIA_Addon_BDT_10004_Finn.d:305","ganz passabler Schürfer.","przeciкtnym kopaczem.","","True","DIA_Addon_Finn_ein_07_04","",""
"Scripts/Content/Story/Dialoge/DIA_Addon_BDT_10004_Finn.d:309","erfahrener Goldschürfer.","doњwiadczonym kopaczem.","","True","DIA_Addon_Finn_ein_07_05","",""
"Scripts/Content/Story/Dialoge/DIA_Addon_BDT_10004_Finn.d:313","wachechter Buddler.","urodzonym kopaczem.","","True","DIA_Addon_Finn_ein_07_06","",""
"Scripts/Content/Story/Dialoge/DIA_Addon_BDT_10004_Finn.d:317","verdammt guter Buddler.","piekielnie dobrym kopaczem.","","True","DIA_Addon_Finn_ein_07_07","",""
"Scripts/Content/Story/Dialoge/DIA_Addon_BDT_10004_Finn.d:321","Meister Buddler.","mistrzem kopania.","","True","DIA_Addon_Finn_ein_07_08","",""
"Scripts/Content/Story/Dialoge/DIA_Addon_BDT_10004_Finn.d:325","Guru - unter den Buddlern.","guru kopaczy.","","True","DIA_Addon_Finn_ein_07_09","",""
"Scripts/Content/Story/Dialoge/DIA_Addon_BDT_10004_Finn.d:329","Damit bist du jetzt so gut wie ich. Herzlichen Glückwunsch, Partner!","Teraz jesteњ tak dobry, jak ja. Gratulujк, partnerze!","","True","DIA_Addon_Finn_ein_07_10","",""
"Scripts/Content/Story/Dialoge/DIA_Addon_BDT_10004_Finn.d:352","Wegen des Attentats auf Esteban...","A co do prуby zabуjstwa Estebana...","","True","DIA_Addon_Finn_Attentat.description","",""
"Scripts/Content/Story/Dialoge/DIA_Addon_BDT_10004_Finn.d:366","(misstrauisch) Ja?","Tak?","","True","DIA_Addon_Finn_Attentat_07_00","",""
"Scripts/Content/Story/Dialoge/DIA_Addon_BDT_10004_Finn.d:367","Hast du 'ne Ahnung, wer dahinter steckt?","Wiesz, kto stoi za tym wszystkim?","","True","DIA_Addon_Finn_Attentat_15_01","",""
"Scripts/Content/Story/Dialoge/DIA_Addon_BDT_10004_Finn.d:368","Warum willst du das wissen?","Dlaczego chcesz to wiedzieж?","","True","DIA_Addon_Finn_Attentat_07_02","",""
"Scripts/Content/Story/Dialoge/DIA_Addon_BDT_10004_Finn.d:371","Ich will mit dem Typen reden...","Chcк porozmawiaж z tym goњciem.","","True","DIA_Addon_Finn_Attentat.DIA_Addon_Finn_Attentat_WannaTalk","Info_AddChoice",""
"Scripts/Content/Story/Dialoge/DIA_Addon_BDT_10004_Finn.d:372","Esteban will ihn tot sehen!","Esteban chce go widzieж martwym!","","True","DIA_Addon_Finn_Attentat.DIA_Addon_Finn_Attentat_ForTheBoss","Info_AddChoice",""
"Scripts/Content/Story/Dialoge/DIA_Addon_BDT_10004_Finn.d:377","(erzählt) Als das Attentat passierte, wollte ich mir von Huno, dem Schmied, meine Spitzhacke abholen.","Po prуbie zabуjstwa chciaіem odebraж swуj kilof od kowala Huno.","","True","DIA_Addon_Finn_TellAll_07_00","",""
"Scripts/Content/Story/Dialoge/DIA_Addon_BDT_10004_Finn.d:378","Aber er war nicht da.","Nie byіo go tam jednak.","","True","DIA_Addon_Finn_TellAll_07_01","",""
"Scripts/Content/Story/Dialoge/DIA_Addon_BDT_10004_Finn.d:379","Und?","No i?","","True","DIA_Addon_Finn_TellAll_15_02","",""
"Scripts/Content/Story/Dialoge/DIA_Addon_BDT_10004_Finn.d:380","Er ist sonst IMMER da. SEHR verdächtig, wenn du mich fragst.","On ZAWSZE tam jest. Wedіug mnie to DOЊЖ podejrzane.","","True","DIA_Addon_Finn_TellAll_07_03","",""
"Scripts/Content/Story/Dialoge/DIA_Addon_BDT_10004_Finn.d:388","Esteban will ihn tot sehen!","Esteban chce go widzieж martwym!","","True","DIA_Addon_Finn_ForTheBoss_15_00","",""
"Scripts/Content/Story/Dialoge/DIA_Addon_BDT_10004_Finn.d:389","Oh! Du arbeitest für den Boss?","Och! Pracujesz dla szefa?","","True","DIA_Addon_Finn_ForTheBoss_07_01","",""
"Scripts/Content/Story/Dialoge/DIA_Addon_BDT_10004_Finn.d:390","Dann werd' ich dir sagen, was ich weiß.","W takim razie powiem ci, co wiem.","","True","DIA_Addon_Finn_ForTheBoss_07_02","",""
"Scripts/Content/Story/Dialoge/DIA_Addon_BDT_10004_Finn.d:399","Ich will mit dem Typen reden ...","Chcк porozmawiaж z tym goњciem.","","True","DIA_Addon_Finn_WannaTalk_15_00","",""
"Scripts/Content/Story/Dialoge/DIA_Addon_BDT_10004_Finn.d:400","(misstrauisch) So? Und was willst du von ihm?","A czego od niego chcesz?","","True","DIA_Addon_Finn_WannaTalk_07_01","",""
"Scripts/Content/Story/Dialoge/DIA_Addon_BDT_10004_Finn.d:403","Das geht dich nichts an!","To nie twoja sprawa!","","True","DIA_Addon_Finn_Attentat.DIA_Addon_Finn_Attentat_ForgetIt","Info_AddChoice",""
"Scripts/Content/Story/Dialoge/DIA_Addon_BDT_10004_Finn.d:404","Ich habe interessante Informationen für ihn!","Mam dla niego ciekawe informacje!","","True","DIA_Addon_Finn_Attentat.DIA_Addon_Finn_Attentat_HaveInfos","Info_AddChoice",""
"Scripts/Content/Story/Dialoge/DIA_Addon_BDT_10004_Finn.d:405","Ich will Esteban umlegen und suche einen Verbündeten!","Chcк zaіatwiж Estebana i szukam sprzymierzeсca!","","True","DIA_Addon_Finn_Attentat.DIA_Addon_Finn_Attentat_KillEsteban","Info_AddChoice",""
"Scripts/Content/Story/Dialoge/DIA_Addon_BDT_10004_Finn.d:410","Ich will Esteban umlegen und suche einen Verbündeten!","Chcк zaіatwiж Estebana i szukam sprzymierzeсca!","","True","DIA_Addon_Finn_KillEsteban_15_00","",""
"Scripts/Content/Story/Dialoge/DIA_Addon_BDT_10004_Finn.d:411","Damit will ich nichts zu tun haben!","Nie chcк mieж z tym nic wspуlnego!","","True","DIA_Addon_Finn_KillEsteban_07_01","",""
"Scripts/Content/Story/Dialoge/DIA_Addon_BDT_10004_Finn.d:421","Ich habe interessante Informationen für ihn!","Mam dla niego ciekawe informacje!","","True","DIA_Addon_Finn_HaveInfos_15_00","",""
"Scripts/Content/Story/Dialoge/DIA_Addon_BDT_10004_Finn.d:422","Du steckst doch nicht etwa mit dem Auftraggeber unter einer Decke, was?","Nie jesteњ w zmowie z tym klientem, prawda?","","True","DIA_Addon_Finn_HaveInfos_07_01","",""
"Scripts/Content/Story/Dialoge/DIA_Addon_BDT_10004_Finn.d:427","Auf keinen Fall!","W їadnym razie!","","True","DIA_Addon_Finn_Attentat.DIA_Addon_Finn_Attentat_NoNo","Info_AddChoice",""
"Scripts/Content/Story/Dialoge/DIA_Addon_BDT_10004_Finn.d:432","Auf keinen Fall!","W їadnym razie!","","True","DIA_Addon_Finn_NoNo_15_00","",""
"Scripts/Content/Story/Dialoge/DIA_Addon_BDT_10004_Finn.d:433","(abschätzend) Gut! Ich werde dir sagen, was ich weiß.","Dobrze! Powiem ci, co wiem.","","True","DIA_Addon_Finn_NoNo_07_01","",""
"Scripts/Content/Story/Dialoge/DIA_Addon_BDT_10004_Finn.d:441","Das geht dich nichts an!","To nie twoja sprawa!","","True","DIA_Addon_Finn_ForgetIt_15_00","",""
"Scripts/Content/Story/Dialoge/DIA_Addon_BDT_10004_Finn.d:442","So? Tja, dann weiß ich auch nichts über die Sache.","No i? Cуї, na ten temat takїe nic nie wiem.","","True","DIA_Addon_Finn_ForgetIt_07_01","",""
"Scripts/Content/Story/Dialoge/DIA_Addon_BDT_10004_Finn.d:457","Nochmal wegen des Attentats...","A wracaj№c do tej prуby zabуjstwa...","","True","DIA_Addon_Finn_Again.description","",""
"Scripts/Content/Story/Dialoge/DIA_Addon_BDT_10004_Finn.d:471","Nochmal wegen des Attentats ...","A wracaj№c do tej prуby zabуjstwa...","","True","DIA_Addon_Finn_Again_15_00","",""
"Scripts/Content/Story/Dialoge/DIA_Addon_BDT_10004_Finn.d:474","Ich hab dir alles gesagt, was ich weiß.","Powiedziaіem ci juї wszystko...","","True","DIA_Addon_Finn_Again_07_01","",""
"Scripts/Content/Story/Dialoge/DIA_Addon_BDT_10004_Finn.d:477","Okay... (zurück)","Dobrze... (wrуж)","","True","DIA_Addon_Finn_Again.DIA_Addon_Finn_Again_Exit","Info_AddChoice",""
"Scripts/Content/Story/Dialoge/DIA_Addon_BDT_10004_Finn.d:478","Dann erzähl's mir nochmal!","No cуї, opowiedz mi to raz jeszcze.","","True","DIA_Addon_Finn_Again.DIA_Addon_Finn_Again_Nochmal","Info_AddChoice",""
"Scripts/Content/Story/Dialoge/DIA_Addon_BDT_10004_Finn.d:482","Lass mich bloß in Ruhe mit der Scheiße!","Zostaw mnie samego z tym badziewiem!","","True","DIA_Addon_Finn_Again_07_02","",""
"Scripts/Content/Story/Dialoge/DIA_Addon_BDT_10004_Finn.d:489","(abschätzend) Okay ...","Dobrze...","","True","DIA_Addon_Finn_Again_Exit_15_00","",""
"Scripts/Content/Story/Dialoge/DIA_Addon_BDT_10004_Finn.d:495","Dann erzähl's mir noch mal!","No cуї, opowiedz mi to raz jeszcze.","","True","DIA_Addon_Finn_Again_Nochmal_15_00","",""
"Scripts/Content/Story/Dialoge/DIA_Addon_BDT_10005_Wache_02.d:69","Wie sieht's aus?","Як справи?","","","DIA_Addon_Wache_02_Hi.description","",""
"Scripts/Content/Story/Dialoge/DIA_Addon_BDT_10005_Wache_02.d:79","Wie sieht's aus?","Як справи?","","","DIA_Addon_Wache_02_Hi_15_00","",""
"Scripts/Content/Story/Dialoge/DIA_Addon_BDT_10005_Wache_02.d:80","Warte mal, kenne ich dich nicht irgendwo her?","Хвилинку, я тебе часом не знаю?","","","DIA_Addon_Wache_02_Hi_13_01","",""
"Scripts/Content/Story/Dialoge/DIA_Addon_BDT_10005_Wache_02.d:82","Hmm ... nein. Das bist du nicht. Los, verpiss dich.","Хм-м... ні, то не ти. Все, іди до чорта.","","","DIA_Addon_Wache_02_Hi_13_02","",""
"Scripts/Content/Story/Dialoge/DIA_Addon_BDT_10005_Wache_02.d:94","Was weißt du über das Attentat?","Що тобі відомо про напад?","","","DIA_Addon_Wache_02_Attentat.description","",""
"Scripts/Content/Story/Dialoge/DIA_Addon_BDT_10005_Wache_02.d:108","Was weißt du über das Attentat?","Що тобі відомо про напад?","","","DIA_Addon_Wache_02_Attentat_15_00","",""
"Scripts/Content/Story/Dialoge/DIA_Addon_BDT_10005_Wache_02.d:109","Was ich darüber weiß? (lacht) Ich hab dem Kerl die Beine gebrochen.","Що я про це знаю? (сміється) Я зламав тому хлопцеві ноги.","","","DIA_Addon_Wache_02_Attentat_13_01","",""
"Scripts/Content/Story/Dialoge/DIA_Addon_BDT_10005_Wache_02.d:110","(droht) Und das werde ich auch mit jedem anderen machen, der sich mit Esteban anlegen will ...","(погрозливо) І я зроблю це з кожним, хто захоче тягатися з Естебаном...","","","DIA_Addon_Wache_02_Attentat_13_02","",""
"Scripts/Content/Story/Dialoge/DIA_Addon_BDT_10005_Wache_02.d:123","Wie sieht's aus?","Як справи?","","","DIA_Addon_Wache_02_perm.description","",""
"Scripts/Content/Story/Dialoge/DIA_Addon_BDT_10005_Wache_02.d:136","Wie sieht's aus?","Як справи?","","","DIA_Addon_Wache_02_perm_15_00","",""
"Scripts/Content/Story/Dialoge/DIA_Addon_BDT_10005_Wache_02.d:137","Bisher ist alles ruhig.","Все поки спокійно.","","","DIA_Addon_Wache_02_perm_13_01","",""
"Scripts/Content/Story/Dialoge/DIA_Addon_BDT_10005_Wache_02.d:141","Such du mal den Verräter - wir werden uns dann um ihn kümmern ...","Іди шукай зрадника, а ми про нього подбаємо...","","","DIA_Addon_Wache_02_perm_13_02","",""
"Scripts/Content/Story/Dialoge/DIA_Addon_BDT_10008_Bandit.d:84","NICHT wecken!","НЕ БУДИ ЙОГО!","","","DIA_Addon_10008_Bandit_Hi_01_00","",""
"Scripts/Content/Story/Dialoge/DIA_Addon_BDT_10008_Bandit.d:85","Was???","Що???","","","DIA_Addon_10008_Bandit_Hi_15_01","",""
"Scripts/Content/Story/Dialoge/DIA_Addon_BDT_10008_Bandit.d:86","Wenn du dir selbst einen Gefallen tun willst, dann halte dich von Skinner fern.","Тримайся подалі від Скіннера, якщо не хочеш заробити проблем для себе.","","","DIA_Addon_10008_Bandit_Hi_01_02","",""
"Scripts/Content/Story/Dialoge/DIA_Addon_BDT_10008_Bandit.d:87","Der Kerl ist unberechenbar. Den Letzten, der ihn geweckt hat, hat er umgebracht.","Цей хлопець непередбачуваний. Він убив останнього, хто його розбудив.","","","DIA_Addon_10008_Bandit_Hi_01_03","",""
"Scripts/Content/Story/Dialoge/DIA_Addon_BDT_10008_Bandit.d:88","Lass ihn schlafen, das ist das Beste für alle.","Нехай він спить, так краще для всіх.","","","DIA_Addon_10008_Bandit_Hi_01_04","",""
"Scripts/Content/Story/Dialoge/DIA_Addon_BDT_10008_Bandit.d:100","Bist du ein Buddler?","Ти рудокоп?","","","DIA_Addon_10008_Bandit_soup.description","",""
"Scripts/Content/Story/Dialoge/DIA_Addon_BDT_10008_Bandit.d:110","Bist du ein Buddler?","Ти рудокоп?","","","DIA_Addon_10008_Bandit_soup_15_00","",""
"Scripts/Content/Story/Dialoge/DIA_Addon_BDT_10008_Bandit.d:111","Wegen der Hose? Nein, ich trage sie nur, weil sie bequem ist.","Ти через штани так вирішив? Ні, я ношу їх лише тому, що це зручно.","","","DIA_Addon_10008_Bandit_soup_01_01","",""
"Scripts/Content/Story/Dialoge/DIA_Addon_BDT_10008_Bandit.d:112","Ich koche hier nur Fleischsuppe. Hier, kannst ja mal probieren - die macht stark.","Все, що я роблю - готую тушковане м'ясо. Можеш спробувати, він додасть тобі сил.","","","DIA_Addon_10008_Bandit_soup_01_02","",""
"Scripts/Content/Story/Dialoge/DIA_Addon_BDT_10008_Bandit.d:114","Es ist immer wichtig, seine eigene Stärke zu trainieren - draußen gibt's viele Gefahren.","Це дуже важливо - підіймати свої сили. Навколо багато небезпек.","","","DIA_Addon_10008_Bandit_soup_01_03","",""
"Scripts/Content/Story/Dialoge/DIA_Addon_BDT_10008_Bandit.d:115","Wenn du willst, kann ich dir helfen, stärker zu werden.","Якщо хочеш, я готовий допомогти тобі стати сильніше.","","","DIA_Addon_10008_Bandit_soup_01_04","",""
"Scripts/Content/Story/Dialoge/DIA_Addon_BDT_10008_Bandit.d:131","Ich will stärker werden","Я хочу стати сильнішим.","","","DIA_Addon_10008_Bandit_Teach.description","",""
"Scripts/Content/Story/Dialoge/DIA_Addon_BDT_10008_Bandit.d:144","Ich will stärker werden.","Я хочу стати сильнішим.","","","DIA_Addon_10008_Bandit_Teach_15_00","",""
"Scripts/Content/Story/Dialoge/DIA_Addon_BDT_10014_Thorus.d:46","Du kennst die Regel. Ohne rote Steintafel kommt keiner in die Mine.","Znasz zasadк. Bez czerwonego kamienia nikt nie wejdzie do kopalni.","","True","DIA_Addon_BDT_10014_Thorus_Hi_12_00","",""
"Scripts/Content/Story/Dialoge/DIA_Addon_BDT_10014_Thorus.d:47","Vergiss die Mine - ich muss zu Raven.","Zapomnij o kopalni. Muszк siк dostaж do Kruka.","","True","DIA_Addon_BDT_10014_Thorus_Hi_15_01","",""
"Scripts/Content/Story/Dialoge/DIA_Addon_BDT_10014_Thorus.d:48","Selbst wenn. Wir haben hier Regeln und die gelten für alle. Auch für dich.","Pewnie, ale zasady dotycz№ wszystkich. Nawet ciebie.","","True","DIA_Addon_BDT_10014_Thorus_Hi_12_02","",""
"Scripts/Content/Story/Dialoge/DIA_Addon_BDT_10014_Thorus.d:49","Kehr wieder um. Wenn du versuchst, ohne Erlaubnis den oberen Platz zu betreten, werden die anderen Gardisten dich umbringen. DAS sind die Regeln.","Idџ z powrotem. Jeїeli sprуbujesz wejњж na gуrк bez pozwolenia, straїnicy ciк zabij№. Takie s№ zasady.","","True","DIA_Addon_BDT_10014_Thorus_Hi_12_03","",""
"Scripts/Content/Story/Dialoge/DIA_Addon_BDT_10014_Thorus.d:53","Wenn du was zu beanstanden hast, geh und sprich mit Esteban. Er ist für das Lager zuständig.","Jak ci siк coњ nie podoba, to idџ porozmawiaж z Estebanem. On jest odpowiedzialny za obуz.","","True","DIA_Addon_BDT_10014_Thorus_Hi_12_04","",""
"Scripts/Content/Story/Dialoge/DIA_Addon_BDT_10014_Thorus.d:69","Es ist wichtig, das ich Raven erreiche...","To naprawdк waїne, abym dostaі siк do Kruka...","","True","DIA_Addon_BDT_10014_Thorus_Raven.description","",""
"Scripts/Content/Story/Dialoge/DIA_Addon_BDT_10014_Thorus.d:82","Es ist wichtig, dass ich Raven erreiche ...","To naprawdк waїne, їebym dostaі siк do Kruka...","","True","DIA_Addon_BDT_10014_Thorus_Raven_15_00","",""
"Scripts/Content/Story/Dialoge/DIA_Addon_BDT_10014_Thorus.d:83","Ach ja? Glaubst du etwa du kannst bis zu ihm vordringen?","No i co z tego? Naprawdк s№dzisz, їe zdoіasz do niego dotrzeж?","","True","DIA_Addon_BDT_10014_Thorus_Raven_12_01","",""
"Scripts/Content/Story/Dialoge/DIA_Addon_BDT_10014_Thorus.d:84","Seine Garde hat Anordnung, NIEMANDEN vorzulassen. Du wärst tot, bevor du ihn auch nur zu Gesicht bekommen würdest.","Jego straїnik ma rozkaz NIKOGO nie wpuszczaж. Bкdziesz martwy, zanim zdoіasz go zobaczyж.","","True","DIA_Addon_BDT_10014_Thorus_Raven_12_02","",""
"Scripts/Content/Story/Dialoge/DIA_Addon_BDT_10014_Thorus.d:85","Also schlag dir das aus dem Kopf.","Tak wiкc wybij to sobie z gіowy.","","True","DIA_Addon_BDT_10014_Thorus_Raven_12_03","",""
"Scripts/Content/Story/Dialoge/DIA_Addon_BDT_10014_Thorus.d:101","Erkennst du mich nicht? Aus dem alten Lager?","Nie pamiкtasz mnie? Ze Starego Obozu?","","True","DIA_Addon_BDT_10014_Thorus_Zeit.description","",""
"Scripts/Content/Story/Dialoge/DIA_Addon_BDT_10014_Thorus.d:114","Erkennst du mich nicht? Aus dem alten Lager ...","Nie pamiкtasz mnie? Ze Starego Obozu?","","True","DIA_Addon_BDT_10014_Thorus_Zeit_15_00","",""
"Scripts/Content/Story/Dialoge/DIA_Addon_BDT_10014_Thorus.d:115","Du bist einer der Gefangenen?! Vielleicht warst du einer meiner Gardisten. Und? Macht uns das jetzt zu Verbündeten?","Jesteњ jednym z wiкџniуw? A moїe byіeњ jednym z moich straїnikуw. Co z tego? Wydaje ci siк, їe teraz jesteњmy sojusznikami?","","True","DIA_Addon_BDT_10014_Thorus_Zeit_12_01","",""
"Scripts/Content/Story/Dialoge/DIA_Addon_BDT_10014_Thorus.d:116","Nein, das macht es uns nicht.","Nie, nie wydaje mi siк.","","True","DIA_Addon_BDT_10014_Thorus_Zeit_12_02","",""
"Scripts/Content/Story/Dialoge/DIA_Addon_BDT_10014_Thorus.d:117","Vielleicht bist du der Typ, der die Barriere zum Einsturz gebracht hat - vielleicht hast du auch meine Kumpels umgebracht.","Moїe to ty obaliіeњ barierк... moїe to ty zabiіeњ moich kumpli.","","True","DIA_Addon_BDT_10014_Thorus_Zeit_12_03","",""
"Scripts/Content/Story/Dialoge/DIA_Addon_BDT_10014_Thorus.d:118","Na und?","No i co z tego?","","True","DIA_Addon_BDT_10014_Thorus_Zeit_12_04","",""
"Scripts/Content/Story/Dialoge/DIA_Addon_BDT_10014_Thorus.d:119","Die Zeiten sind vorbei.","Te dni juї minкіy.","","True","DIA_Addon_BDT_10014_Thorus_Zeit_12_05","",""
"Scripts/Content/Story/Dialoge/DIA_Addon_BDT_10014_Thorus.d:123","Du willst rein? Dann besorg dir einen roten Stein und verschwende nicht meine Zeit.","Chcesz wejњж? To zdob№dџ czerwony kamieс i nie marnuj mojego czasu.","","True","DIA_Addon_BDT_10014_Thorus_Zeit_12_06","",""
"Scripts/Content/Story/Dialoge/DIA_Addon_BDT_10014_Thorus.d:139","Komm, lass mich rein. Um der guten alten Zeiten Willen.","Daj spokуj, wpuњж mnie. Przez wzgl№d na stare, dobre czasy.","","True","DIA_Addon_BDT_10014_Thorus_GoodOldPerm.description","",""
"Scripts/Content/Story/Dialoge/DIA_Addon_BDT_10014_Thorus.d:154","Komm, lass mich rein. Um der guten alten Zeiten Willen.","Daj spokуj, wpuњж mnie. Przez wzgl№d na stare, dobre czasy.","","True","DIA_Addon_Thorus_Add_15_00","",""
