"location","source","target","id","fuzzy","context","translator_comments","developer_comments"
"Scripts/Content/Story/Dialoge/DIA_Addon_BDT_1070_Paul.d:69","Handelst du mit Schmiedezubehör?","Handlujesz moїe sprzкtem kowalskim?","","True","DIA_Addon_Paul_Hi.description","",""
"Scripts/Content/Story/Dialoge/DIA_Addon_BDT_1070_Paul.d:79","Handelst du mit Schmiedezubehör?","Handlujesz moїe sprzкtem kowalskim?","","True","DIA_Addon_Paul_Hi_15_00","",""
"Scripts/Content/Story/Dialoge/DIA_Addon_BDT_1070_Paul.d:80","Stahl gibt's bei Huno. Ich habe nur ein paar Brocken Erz.","Huno chyba ma stal. Ja mam tylko kilka kawaіkуw rudy.","","True","DIA_Addon_Paul_Hi_03_01","",""
"Scripts/Content/Story/Dialoge/DIA_Addon_BDT_1070_Paul.d:81","Aber die gebe ich nicht her. Es ist das einzige von Wert, was ich habe.","Ale one nie s№ na sprzedaї. Ruda to jedyna cenna rzecz, jak№ posiadam.","","True","DIA_Addon_Paul_Hi_03_02","",""
"Scripts/Content/Story/Dialoge/DIA_Addon_BDT_1070_Paul.d:93","Arbeitest du für Huno?","Pracujesz dla Huno?","","True","DIA_Addon_Paul_Huno.description","",""
"Scripts/Content/Story/Dialoge/DIA_Addon_BDT_1070_Paul.d:106","Arbeitest du für Huno?","Pracujesz dla Huno?","","True","DIA_Addon_Paul_Huno_15_00","",""
"Scripts/Content/Story/Dialoge/DIA_Addon_BDT_1070_Paul.d:107","Ich wollte ein bisschen Gold machen und hab bei Huno angefangen. Aber seitdem kriege ich von Esteban gar nichts mehr.","Chciaіem zarobiж trochк zіota, zacz№іem wiкc pracowaж dla Huno. Od tamtej pory od Estebana nie dostaіem juї nic.","","True","DIA_Addon_Paul_Huno_03_01","",""
"Scripts/Content/Story/Dialoge/DIA_Addon_BDT_1070_Paul.d:108","Er hat gesagt, er kann mich nicht mehr gebrauchen.","Powiedziaі mi, їe nie jestem juї potrzebny.","","True","DIA_Addon_Paul_Huno_03_02","",""
"Scripts/Content/Story/Dialoge/DIA_Addon_BDT_1070_Paul.d:109","Was bleibt mir übrig, als weiterhin für Huno zu schuften?","Tak wiкc praca dla Huno to moja jedyna szansa.","","True","DIA_Addon_Paul_Huno_03_03","",""
"Scripts/Content/Story/Dialoge/DIA_Addon_BDT_1070_Paul.d:135","Gar nichts Mann! Ich habe damit nichts zu tun! Was willst du von mir?","Nic! Nie mam z tym nic wspуlnego. Czego ode mnie chcesz?","","True","DIA_Addon_Paul_Attentat_03_00","",""
"Scripts/Content/Story/Dialoge/DIA_Addon_BDT_1070_Paul.d:147","Huno wird verdächtigt, was mit dem Attentat zu tun zu haben...","Huno jest podejrzanym w sprawie usiіowania zabуjstwa...","","True","DIA_Addon_Paul_HunoVerdacht.description","",""
"Scripts/Content/Story/Dialoge/DIA_Addon_BDT_1070_Paul.d:161","Huno wird verdächtigt, was mit dem Attentat zu tun zu haben ...","Huno jest podejrzanym w sprawie usiіowania zabуjstwa...","","True","DIA_Addon_Paul_HunoVerdacht_15_00","",""
"Scripts/Content/Story/Dialoge/DIA_Addon_BDT_1070_Paul.d:162","Ich weiß nichts darüber!","Nic o tym nie wiem!","","True","DIA_Addon_Paul_HunoVerdacht_03_01","",""
"Scripts/Content/Story/Dialoge/DIA_Addon_BDT_1070_Paul.d:174","Du arbeitest für Huno! Also weißt du auch was!","Pracujesz dla niego! MUSISZ coњ wiedzieж!","","True","DIA_Addon_Paul_HunoArbeit.description","",""
"Scripts/Content/Story/Dialoge/DIA_Addon_BDT_1070_Paul.d:189","Du arbeitest doch für Huno! Also weißt du auch was!","Pracujesz dla niego! MUSISZ coњ wiedzieж!","","True","DIA_Addon_Paul_HunoArbeit_15_00","",""
"Scripts/Content/Story/Dialoge/DIA_Addon_BDT_1070_Paul.d:190","(verzweifelt) Ich weiß nichts - ehrlich! Ich muss jetzt weitermachen!","Nic nie wiem - naprawdк! Muszк dalej pracowaж.","","True","DIA_Addon_Paul_HunoArbeit_03_01","",""
"Scripts/Content/Story/Dialoge/DIA_Addon_BDT_1070_Paul.d:204","Weißt du, was Esteban mit dir macht, wenn er erfährt, daß du Huno deckst?","Wiesz, co zrobi Esteban, gdy siк dowie, їe kryjesz Huno?","","True","DIA_Addon_Paul_FearEsteban.description","",""
"Scripts/Content/Story/Dialoge/DIA_Addon_BDT_1070_Paul.d:218","Weißt du, was Esteban mit dir macht, wenn er erfährt, dass du Huno deckst?","Wiesz, co zrobi Esteban, gdy siк dowie, їe kryjesz Huno?","","True","DIA_Addon_Paul_FearEsteban_15_00","",""
"Scripts/Content/Story/Dialoge/DIA_Addon_BDT_1070_Paul.d:219","Mann! Lass mich in Ruhe. Ich hab doch nichts mit der Sache zu tun.","Czіowieku, zostaw mnie w spokoju! Nie miaіem z tym nic wspуlnego!","","True","DIA_Addon_Paul_FearEsteban_03_01","",""
"Scripts/Content/Story/Dialoge/DIA_Addon_BDT_1070_Paul.d:233","Du sagst mit jetzt, was du weißt!","Dobrze, a teraz powiesz mi wszystko, co wiesz!","","True","DIA_Addon_Paul_MaulPaul.description","",""
"Scripts/Content/Story/Dialoge/DIA_Addon_BDT_1070_Paul.d:247","(freundlich) Du sagst mit jetzt, was du weißt, oder es gibt'n paar aufs Maul, Paul!","Dobrze, a teraz powiesz mi wszystko, co wiesz, albo stіukк ciк na kwaњne jabіko!","","True","DIA_Addon_Paul_MaulPaul_15_00","",""
"Scripts/Content/Story/Dialoge/DIA_Addon_BDT_1070_Paul.d:248","Nur, weil du für den Boss arbeitest, kannst du noch lange nicht so mit mir umspringen!","N-nie, nie moїesz mnie tak traktowaж tylko dlatego, їe pracujesz dla szefa!","","True","DIA_Addon_Paul_MaulPaul_03_01","",""
"Scripts/Content/Story/Dialoge/DIA_Addon_BDT_1070_Paul.d:249","(nett) Ich kann!","Aleї oczywiњcie, їe mogк!","","True","DIA_Addon_Paul_MaulPaul_15_02","",""
"Scripts/Content/Story/Dialoge/DIA_Addon_BDT_1070_Paul.d:250","Mach kein' Scheiß!","Nie zbliїaj siк!","","True","DIA_Addon_Paul_MaulPaul_03_03","",""
"Scripts/Content/Story/Dialoge/DIA_Addon_BDT_1070_Paul.d:251","(ungeduldig) Paul ...","Paul...","","True","DIA_Addon_Paul_MaulPaul_15_04","",""
"Scripts/Content/Story/Dialoge/DIA_Addon_BDT_1070_Paul.d:252","(hektisch) Alles was ich weiß, ist, dass Huno nicht gut auf Esteban zu sprechen ist.","Wiem tylko tyle, їe Huno nie lubi Estebana.","","True","DIA_Addon_Paul_MaulPaul_03_05","",""
"Scripts/Content/Story/Dialoge/DIA_Addon_BDT_1070_Paul.d:253","(hektisch) Dauernd liegt er mir in den Ohren über diesen Esteban. dass er ihm sein Geschäft versaut und so ...","Dziaіa mi na nerwy, opowiadaj№c, їe Esteban caіy czas psuje mu interes...","","True","DIA_Addon_Paul_MaulPaul_03_06","",""
"Scripts/Content/Story/Dialoge/DIA_Addon_BDT_1070_Paul.d:254","Ich hab nur zugehört und nie was gesagt.","Nigdy nie komentowaіem tych spraw.","","True","DIA_Addon_Paul_MaulPaul_03_07","",""
"Scripts/Content/Story/Dialoge/DIA_Addon_BDT_1070_Paul.d:255","Ganz bestimmt! Siehst du. War doch gar nicht so schlimm.","Mogіem siк domyњliж. Widzisz, to nie byіo takie trudne, prawda?","","True","DIA_Addon_Paul_MaulPaul_15_08","",""
"Scripts/Content/Story/Dialoge/DIA_Addon_BDT_1070_Paul.d:289","Endlich! Hier, du sollst mein Erz dafür haben.","W koсcu! Oto twoja ruda.","","True","DIA_Addon_BDT_1070_Paul_Mine_03_00","",""
"Scripts/Content/Story/Dialoge/DIA_Addon_BDT_1070_Paul.d:308","Sonst alles klar bei dir?","Wszystko w porz№dku?","","True","DIA_Addon_Paul_PERM.description","",""
"Scripts/Content/Story/Dialoge/DIA_Addon_BDT_1070_Paul.d:321","Sonst alles klar bei dir?","Wszystko w porz№dku?","","True","DIA_Addon_Paul_PERM_15_00","",""
"Scripts/Content/Story/Dialoge/DIA_Addon_BDT_1070_Paul.d:325","Ja, ich werde einen Haufen Gold aus diesem Fels holen!","Tak, zamierzam wydobyж z tej skaіy trochк zіota.","","True","DIA_Addon_Paul_PERM_03_01","",""
"Scripts/Content/Story/Dialoge/DIA_Addon_BDT_1070_Paul.d:332","Ich hab dir alles gesagt, was ich weiß!","Powiedziaіem ci wszystko, co wiem!","","True","DIA_Addon_Paul_PERM_03_02","",""
"Scripts/Content/Story/Dialoge/DIA_Addon_BDT_1070_Paul.d:336","Ich will hier nur meine Arbeit machen, Mann!","Czіowieku, ja chcк tylko spokojnie pracowaж.","","True","DIA_Addon_Paul_PERM_03_03","",""
"Scripts/Content/Story/Dialoge/DIA_Addon_BDT_1071_Ramon.d:62","Hey, was ist da unten passiert?","Hej, co tu siк staіo?","","True","DIA_Addon_Ramon_FirstWarn_07_00","",""
"Scripts/Content/Story/Dialoge/DIA_Addon_BDT_1071_Ramon.d:63","Ich habe Franco umgehauen.","Pobiіem Franka.","","True","DIA_Addon_Ramon_FirstWarn_15_01","",""
"Scripts/Content/Story/Dialoge/DIA_Addon_BDT_1071_Ramon.d:64","So? Dann ist es jetzt DEINE Aufgabe, dafür zu sorgen, dass die faulen Säcke jeden Tag ihre Arbeit machen.","No i co? To teraz TY musisz zadbaж, by te lenie odwalaіy swoj№ robotк.","","True","DIA_Addon_Ramon_FirstWarn_07_02","",""
"Scripts/Content/Story/Dialoge/DIA_Addon_BDT_1071_Ramon.d:65","Hey, ich bin nicht hier, um mich mit Jägern rumzuärgern. Ich will in's Lager.","Hej, nie zamierzam marnowaж tu czasu. Chcк wejњж do obozu.","","True","DIA_Addon_Ramon_FirstWarn_15_03","",""
"Scripts/Content/Story/Dialoge/DIA_Addon_BDT_1071_Ramon.d:66","Nichts da. Du hast Franco umgehauen - du bist jetzt der Anführer. Also mach deinen Job.","Nie teraz. Pokonaіeњ Franka. Czyli jesteњ nowym przywуdc№. No to rуb swoje.","","True","DIA_Addon_Ramon_FirstWarn_07_04","",""
"Scripts/Content/Story/Dialoge/DIA_Addon_BDT_1071_Ramon.d:67","Wenn ich der Anführer bin, dann kann ich bestimmen, wer als Nächstes reinkommt.","Skoro jestem przywуdc№, to mogк wybraж nastкpn№ osobк, ktуra wejdzie do obozu.","","True","DIA_Addon_Ramon_FirstWarn_15_05","",""
"Scripts/Content/Story/Dialoge/DIA_Addon_BDT_1071_Ramon.d:68","Und ich bestimme, dass ICH als Nächster reinkomme.","No to mуwiк, їe nastкpny mam byж JA.","","True","DIA_Addon_Ramon_FirstWarn_15_06","",""
"Scripts/Content/Story/Dialoge/DIA_Addon_BDT_1071_Ramon.d:69","(lacht) Ganz so einfach ist es nicht. Wir haben NIEMANDEN angefordert, also kommt auch NIEMAND rein.","To nie takie proste. Nie potrzebujemy nikogo nowego, wiкc nikt nie wejdzie do њrodka.","","True","DIA_Addon_Ramon_FirstWarn_07_07","",""
"Scripts/Content/Story/Dialoge/DIA_Addon_BDT_1071_Ramon.d:70","Thorus kann doch einen neuen Anführer für die Jäger schicken, dann wird drinnen ein Platz für mich frei.","Thorus moїe wysіaж nowego przywуdcк myњliwych, zwalniaj№c tym samym w obozie miejsce dla mnie.","","True","DIA_Addon_Ramon_FirstWarn_15_08","",""
"Scripts/Content/Story/Dialoge/DIA_Addon_BDT_1071_Ramon.d:71","(lacht) Du gibst nicht auf, was? Okay, dann schieb deinen Hintern rein.","Nie poddajesz siк, co? Dobra, pakuj do obozu swoje cztery litery.","","True","DIA_Addon_Ramon_FirstWarn_07_09","",""
"Scripts/Content/Story/Dialoge/DIA_Addon_BDT_1071_Ramon.d:72","Thorus wird sich darum kümmern, dass die Jäger nicht ohne Anführer leben müssen.","Thorus siк tym zajmie i przyњle nowego przywуdcк.","","True","DIA_Addon_Ramon_FirstWarn_07_10","",""
"Scripts/Content/Story/Dialoge/DIA_Addon_BDT_1071_Ramon.d:73","Worauf wartest du noch? Und besorg dir 'ne Spitzhacke!","No to na co czekasz? Nie zapomnij zabraж kilofa.","","True","DIA_Addon_Ramon_FirstWarn_07_11","",""
"Scripts/Content/Story/Dialoge/DIA_Addon_BDT_1071_Ramon.d:87","Hey, was willst du? Kann mir nicht vorstellen, dass du 'ne Erlaubnis für's Lager hast.","Hej, kim jesteњ? Nie mogк sobie wyobraziж, їeby ktoњ taki jak ty miaі pozwolenie na wejњcie.","","True","DIA_Addon_Ramon_FirstWarn_07_12","",""
"Scripts/Content/Story/Dialoge/DIA_Addon_BDT_1071_Ramon.d:91","Franco schickt mich. Er will wissen, ob jemand im Lager gebraucht wird.","Franko mnie przysyіaі. Chce wiedzieж, czy nie potrzeba nowych robotnikуw.","","True","DIA_Addon_Ramon_FirstWarn_15_13","",""
"Scripts/Content/Story/Dialoge/DIA_Addon_BDT_1071_Ramon.d:94","Ja, wir brauchen jemanden. Gestern hat wieder einer von den Kerlen den Löffel abgegeben.","Tak, w zasadzie potrzeba. Wczoraj jeden goњж strzeliі w kalendarz.","","True","DIA_Addon_Ramon_FirstWarn_07_14","",""
"Scripts/Content/Story/Dialoge/DIA_Addon_BDT_1071_Ramon.d:95","Dieser Idiot hat sich mit Esteban angelegt.","Ten idiota zdenerwowaі Estebana.","","True","DIA_Addon_Ramon_FirstWarn_07_15","",""
"Scripts/Content/Story/Dialoge/DIA_Addon_BDT_1071_Ramon.d:96","Wer ist Esteban?","Kto to jest Esteban?","","True","DIA_Addon_Ramon_FirstWarn_15_16","",""
"Scripts/Content/Story/Dialoge/DIA_Addon_BDT_1071_Ramon.d:97","Der Anführer des unteren Lagers. Er entscheidet, wer in die Mine kommt.","To szef obozowiska. On decyduje, komu pozwoliж na wejњcie do kopalni.","","True","DIA_Addon_Ramon_FirstWarn_07_17","",""
"Scripts/Content/Story/Dialoge/DIA_Addon_BDT_1071_Ramon.d:98","Also sag Franco, dass Thorus nach einem neuen Mann verlangt. Alles klar?","Powiedz Frankowi, їe Thorus prosi o nowego robotnika. Jasne?","","True","DIA_Addon_Ramon_FirstWarn_07_18","",""
"Scripts/Content/Story/Dialoge/DIA_Addon_BDT_1071_Ramon.d:105","Thorus? DER Thorus?","Thorus? TEN Thorus?","","True","DIA_Addon_Ramon_FirstWarn.DIA_Addon_Ramon_FirstWarn_YES","Info_AddChoice",""
"Scripts/Content/Story/Dialoge/DIA_Addon_BDT_1071_Ramon.d:106","Thorus? Nie gehört...","Thorus? Pierwsze sіyszк...","","True","DIA_Addon_Ramon_FirstWarn.DIA_Addon_Ramon_FirstWarn_NO","Info_AddChoice",""
"Scripts/Content/Story/Dialoge/DIA_Addon_BDT_1071_Ramon.d:112","Hey, langsam! Du kommst nicht rein - also verschwinde!","Hej, stуj! Nie wejdziesz tam, wiкc zjeїdїaj.","","True","DIA_Addon_Ramon_FirstWarn_07_19","",""
"Scripts/Content/Story/Dialoge/DIA_Addon_BDT_1071_Ramon.d:122","Thorus? DER Thorus?","Thorus? TEN Thorus?","","True","DIA_Addon_Ramon_FirstWarn_YES_15_00","",""
"Scripts/Content/Story/Dialoge/DIA_Addon_BDT_1071_Ramon.d:123","Ja. DER Thorus. DER Mann, der die neuen Leute anfordert.","Tak. TEN Thorus. Czіowiek, ktуry prosi o nowych robotnikуw.","","True","DIA_Addon_Ramon_FirstWarn_YES_07_01","",""
"Scripts/Content/Story/Dialoge/DIA_Addon_BDT_1071_Ramon.d:124","Der Mann, der entscheidet, ob und wann ein neuer Typ aus dem Sumpf ins Lager kommt.","Czіowiek, ktуry decyduje, czy ktoњ nowy moїe przejњж z bagien do obozu.","","True","DIA_Addon_Ramon_FirstWarn_YES_07_02","",""
"Scripts/Content/Story/Dialoge/DIA_Addon_BDT_1071_Ramon.d:125","Du willst mir doch nicht erzählen, dass du ihn von früher kennst?","Nie chcesz mi chyba powiedzieж, їe znasz go z wczeњniejszych czasуw?","","True","DIA_Addon_Ramon_FirstWarn_YES_07_03","",""
"Scripts/Content/Story/Dialoge/DIA_Addon_BDT_1071_Ramon.d:126","Naja, ... Ja ...","No cуї... Tak.","","True","DIA_Addon_Ramon_FirstWarn_YES_15_04","",""
"Scripts/Content/Story/Dialoge/DIA_Addon_BDT_1071_Ramon.d:127","Pass auf - JEDER kennt Thorus.","Rozumiem... KAЇDY zna Thorusa.","","True","DIA_Addon_Ramon_FirstWarn_YES_07_05","",""
"Scripts/Content/Story/Dialoge/DIA_Addon_BDT_1071_Ramon.d:128","Trotzdem kommst du nicht rein - und ich werde ihm NICHTS ausrichten!","Niemniej jednak to ci wcale nie pomoїe. I nie zamierzam przekazywaж ЇADNYCH wiadomoњci.","","True","DIA_Addon_Ramon_FirstWarn_YES_07_06","",""
"Scripts/Content/Story/Dialoge/DIA_Addon_BDT_1071_Ramon.d:135","Thorus? Nie gehört ...","Thorus? Pierwsze sіyszк...","","True","DIA_Addon_Ramon_FirstWarn_NO_15_00","",""
"Scripts/Content/Story/Dialoge/DIA_Addon_BDT_1071_Ramon.d:136","Oh Mann, du kennst ihn nicht? Er war Chef der Gardisten im alten Lager.","Oj, chіopie, nie znasz go? Byі dowуdc№ straїnikуw w Starym Obozie.","","True","DIA_Addon_Ramon_FirstWarn_NO_07_01","",""
"Scripts/Content/Story/Dialoge/DIA_Addon_BDT_1071_Ramon.d:137","Er ist der Mann, der das Vertrauen von allen genießt.","Jest czіowiekiem, ktуrego wszyscy szanuj№ i ktуremu ufaj№.","","True","DIA_Addon_Ramon_FirstWarn_NO_07_02","",""
"Scripts/Content/Story/Dialoge/DIA_Addon_BDT_1071_Ramon.d:138","Er fordert die neuen Leute an und er entscheidet, ob und wann ein neuer Mann in's Lager geholt wird.","On moїe poprosiж o nowych ludzi.","","True","DIA_Addon_Ramon_FirstWarn_NO_07_03","",""
"Scripts/Content/Story/Dialoge/DIA_Addon_BDT_1071_Ramon.d:139","Wenn du lange genug lebst, wirst du ihn kennenlernen.","Jeњli poїyjesz dostatecznie dіugo, to bкdziesz miaі okazjк go poznaж.","","True","DIA_Addon_Ramon_FirstWarn_NO_07_04","",""
"Scripts/Content/Story/Dialoge/DIA_Addon_BDT_1071_Ramon.d:170","Mach noch einen Schritt und es ist dein Letzter!","Zrуb jeszcze jeden krok bliїej, a bкdzie to twуj ostatni!","","True","DIA_Addon_Ramon_SecondWarn_07_00","",""
"Scripts/Content/Story/Dialoge/DIA_Addon_BDT_1071_Ramon.d:207","Manche lernen es nie ...","Niektуrzy nigdy siк nie naucz№...","","True","DIA_Addon_Ramon_Attack_07_00","",""
"Scripts/Content/Story/Dialoge/DIA_Addon_BDT_1071_Ramon.d:222","Ich bin der neue Mann.","Jestem tym nowym.","","True","DIA_Addon_Ramon_News.description","",""
"Scripts/Content/Story/Dialoge/DIA_Addon_BDT_1071_Ramon.d:235","Ich bin der neue Mann.","Jestem tym nowym.","","True","DIA_Addon_Ramon_News_15_00","",""
"Scripts/Content/Story/Dialoge/DIA_Addon_BDT_1071_Ramon.d:236","Hey, versuch nicht, mich zu verarschen. Es entscheidet immer noch Franco, wer von euch in's Lager kommt.","Nie prуbuj sobie ze mnie їartowaж. Decyzja o tym, kto moїe wejњж do obozu, wci№ї naleїy do Franko.","","True","DIA_Addon_Ramon_News_07_01","",""
"Scripts/Content/Story/Dialoge/DIA_Addon_BDT_1071_Ramon.d:248","Franco hat mich geschickt...","To wіaњnie Franko mnie przysіaі...","","True","DIA_Addon_Ramon_Lie.description","",""
"Scripts/Content/Story/Dialoge/DIA_Addon_BDT_1071_Ramon.d:262","Franco hat mich geschickt ...","To wіaњnie Franko mnie przysіaі...","","True","DIA_Addon_Ramon_Lie_15_00","",""
"Scripts/Content/Story/Dialoge/DIA_Addon_BDT_1071_Ramon.d:263","Hat er nicht. Also verschwinde, sonst brech ich dir die Knochen ...","Nie zrobiі tego. A teraz zjeїdїaj, bo porachujк ci gnaty.","","True","DIA_Addon_Ramon_Lie_07_01","",""
"Scripts/Content/Story/Dialoge/DIA_Addon_BDT_1071_Ramon.d:278","Und? Hast du alles im Griff?","I jak? Wszystko w porz№dku?","","True","DIA_Addon_Ramon_Perm.description","",""
"Scripts/Content/Story/Dialoge/DIA_Addon_BDT_1071_Ramon.d:292","Und? Hast du alles im Griff?","I jak? Wszystko w porz№dku?","","True","DIA_Addon_Ramon_Perm_15_00","",""
"Scripts/Content/Story/Dialoge/DIA_Addon_BDT_1071_Ramon.d:293","Hier ist alles in Ordnung - solange niemand rein will, der nicht rein SOLL.","Wszystko dobrze - przynajmniej dopуki ktoњ niepowoіany nie prуbuje siк dostaж do њrodka.","","True","DIA_Addon_Ramon_Perm_07_01","",""
"Scripts/Content/Story/Dialoge/DIA_Addon_BDT_1072_Logan.d:11","Ich komme später wieder...","Przyjdк pуџniej...","","True","DIA_Addon_Logan_EXIT.description","",""
"Scripts/Content/Story/Dialoge/DIA_Addon_BDT_1072_Logan.d:21","Ich komme später wieder ...","Przyjdк pуџniej...","","True","DIA_Addon_Logan_EXIT_15_00","",""
"Scripts/Content/Story/Dialoge/DIA_Addon_BDT_1072_Logan.d:27","(knurrt) Jaaa, lauf du nur weg. Ich werde hier stehen und alles aufhalten, was zu dicht rankommt.","Tak, uciekaj. Bкdк tu staі i zatrzymam kaїdego, kto sprуbuje siк zbliїyж.","","True","DIA_Addon_Logan_EXIT_10_01","",""
"Scripts/Content/Story/Dialoge/DIA_Addon_BDT_1072_Logan.d:96","Du hast es also geschafft, hm? Okay, gut, dass du mich nicht hängen lässt.","Udaіo ci siк, co? W porz№dku, dobrze, їe mi pomagasz.","","True","DIA_Addon_BDT_1072_Logan_Mine_10_00","",""
"Scripts/Content/Story/Dialoge/DIA_Addon_BDT_1072_Logan.d:113","Wie läuft's bei dir?","Co u ciebie sіychaж?","","True","DIA_Addon_Logan_How2.description","",""
"Scripts/Content/Story/Dialoge/DIA_Addon_BDT_1072_Logan.d:127","Wie läuft's bei dir?","Co u ciebie sіychaж?","","True","DIA_Addon_Logan_How2_15_00","",""
"Scripts/Content/Story/Dialoge/DIA_Addon_BDT_1072_Logan.d:128","Na ja, wenigstens bin ich schon mal drin. Lucia brennt einen harten Schnaps.","No cуї, przynajmniej jestem w њrodku. Lucia pкdzi naprawdк mocny bimber.","","True","DIA_Addon_Logan_How2_10_01","",""
"Scripts/Content/Story/Dialoge/DIA_Addon_BDT_1072_Logan.d:129","Aber Esteban lässt mich nicht in die Mine. Jedenfalls noch nicht. Er hat mir noch 'ne andere Aufgabe gegeben.","Esteban nie pozwala mi jednak wejњж do kopalni. Przynajmniej na razie. Ale dostaіem kilka innych zadaс.","","True","DIA_Addon_Logan_How2_10_02","",""
"Scripts/Content/Story/Dialoge/DIA_Addon_BDT_1072_Logan.d:130","Und? Was will er von dir?","No i? Co ci kazaі robiж?","","True","DIA_Addon_Logan_How2_15_03","",""
"Scripts/Content/Story/Dialoge/DIA_Addon_BDT_1072_Logan.d:131","Es wurde ein Attentat auf Esteban verübt. Er will wissen, wer dahinter steckt.","Ktoњ prуbowaі zabiж Estebana. Chce wiedzieж, kto za tym stoi.","","True","DIA_Addon_Logan_How2_10_04","",""
"Scripts/Content/Story/Dialoge/DIA_Addon_BDT_1072_Logan.d:132","(leise) Esteban glaubt, daß Snaf da mit drin hängt. Ich soll ihn im Auge behalten...","Esteban s№dzi, їe w sprawк zamieszany jest Snaf. Mam mieж na niego oko...","","True","DIA_Addon_Logan_How2_10_05","",""
"Scripts/Content/Story/Dialoge/DIA_Addon_BDT_1072_Logan.d:159","Du suchst nach den Typen, die dahinter stecken, was?","A wiкc szukasz ludzi, ktуrzy s№ za to odpowiedzialni?","","True","DIA_Addon_Logan_Attentat_10_00","",""
"Scripts/Content/Story/Dialoge/DIA_Addon_BDT_1072_Logan.d:160","Aber ich weiß nichts darüber. Wie sollte ich auch? Zu der Zeit saß ich noch im Sumpf ...","Nic o tym nie wiem. Sk№d niby miaіem siк dowiedzieж? Siedziaіem jeszcze w bagnie, gdy caіa ta historia miaіa miejsce.","","True","DIA_Addon_Logan_Attentat_10_01","",""
"Scripts/Content/Story/Dialoge/DIA_Addon_BDT_1072_Logan.d:186","Schau an, ein neues Gesicht.","Patrzcie, paсstwo, nowa twarz.","","True","DIA_Addon_Logan_HI_10_00","",""
"Scripts/Content/Story/Dialoge/DIA_Addon_BDT_1072_Logan.d:187","Willst du nur im Weg rumstehen oder bist du gekommen, um mir zu helfen?","Zamierzasz tak staж czy przyszedіeњ mi pomуc?","","True","DIA_Addon_Logan_HI_10_01","",""
"Scripts/Content/Story/Dialoge/DIA_Addon_BDT_1072_Logan.d:191","Franco schickt mich. Er meint, du kannst Hilfe brauchen. Also was gibt's?","Franko mnie przysіaі. Mуwiі, їe przyda ci siк pomoc. To o co chodzi?","","True","DIA_Addon_Logan_HI_15_02","",""
"Scripts/Content/Story/Dialoge/DIA_Addon_BDT_1072_Logan.d:195","Kommt darauf an - wobei brauchst du denn Hilfe?","To zaleїy - jakiej pomocy ci trzeba?","","True","DIA_Addon_Logan_HI_15_03","",""
"Scripts/Content/Story/Dialoge/DIA_Addon_BDT_1072_Logan.d:198","Die Sumpfhaie kommen mir ein bisschen zu nahe - wird Zeit, ein paar von ihnen zu erledigen.","Bіotne wкїe ostatnimi czasy trochк za bardzo siк do nas zbliїaj№. Pora zabiж czкњж z nich.","","True","DIA_Addon_Logan_HI_10_04","",""
"Scripts/Content/Story/Dialoge/DIA_Addon_BDT_1072_Logan.d:214","Was kriege ich für meine Hilfe?","A co za to dostanк?","","True","DIA_Addon_Logan_Why.description","",""
"Scripts/Content/Story/Dialoge/DIA_Addon_BDT_1072_Logan.d:228","Was kriege ich für meine Hilfe?","A co za to dostanк?","","True","DIA_Addon_Logan_Why_15_00","",""
"Scripts/Content/Story/Dialoge/DIA_Addon_BDT_1072_Logan.d:229","(knurrt) Franco lässt dich hier verschimmeln, wenn du nichts tust.","Franko pozwoli ci tu gniж, jeњli nie bкdzie dla ciebie lepszego zastosowania.","","True","DIA_Addon_Logan_Why_10_01","",""
"Scripts/Content/Story/Dialoge/DIA_Addon_BDT_1072_Logan.d:230","Wenn du in's Lager willst, musst du schon mit anpacken. Nur mit Worten kommst du hier nicht weiter.","Chcesz wejњж do obozu? No to musisz pomagaж. Same sіowa nie przybliї№ ciк do celu.","","True","DIA_Addon_Logan_Why_10_02","",""
"Scripts/Content/Story/Dialoge/DIA_Addon_BDT_1072_Logan.d:231","Außerdem kann ich dir zeigen, wie du die Viecher ausweiden kannst.","Poza tym mogк ci pokazaж, jak patroszyж te bestie.","","True","DIA_Addon_Logan_Why_10_03","",""
"Scripts/Content/Story/Dialoge/DIA_Addon_BDT_1072_Logan.d:232","Aber bild' dir ja nicht ein, dass Franco dich direkt ins Lager schickt, nur weil wir beide hier ein bisschen Spaß mit Sumpfhaien hatten.","Nie s№dzк jednak, їeby Franko wpuњciі ciк do њrodka tylko dlatego, їe zabijesz parк wкїy.","","True","DIA_Addon_Logan_Why_10_04","",""
"Scripts/Content/Story/Dialoge/DIA_Addon_BDT_1072_Logan.d:233","Es gibt Leute hier draußen, die warten schon 'ne ganze Weile darauf, reinzukommen.","Jest tu sporo ludzi, ktуrzy juї trochк czekaj№.","","True","DIA_Addon_Logan_Why_10_05","",""
"Scripts/Content/Story/Dialoge/DIA_Addon_BDT_1072_Logan.d:234","Und der Nächste, der reinkommt, bin ich ... (knurrt) ... und wehe nicht ...","I lepiej bкdzie, jeњli nastкpn№ osob№, ktуra wejdzie do obozu, bкdк ja...","","True","DIA_Addon_Logan_Why_10_06","",""
"Scripts/Content/Story/Dialoge/DIA_Addon_BDT_1072_Logan.d:249","Was gibt's denn im Lager?","Czym jest obуz?","","True","DIA_Addon_Logan_Lager.description","",""
"Scripts/Content/Story/Dialoge/DIA_Addon_BDT_1072_Logan.d:263","Was gibt's denn im Lager?","Czym jest obуz?","","True","DIA_Addon_Logan_Lager_15_00","",""
"Scripts/Content/Story/Dialoge/DIA_Addon_BDT_1072_Logan.d:264","(knurrt) Die Frage ist doch was gibt es NICHT im Lager. Es gibt dort keine Sumpfhaie, keine Sumpflöcher ... keinen SUMPF halt.","Pytanie powinno brzmieж: czym NIE jest obуz. Bez wкїy, bez mokrych dziur... No wiesz, bez BAGNA.","","True","DIA_Addon_Logan_Lager_10_01","",""
"Scripts/Content/Story/Dialoge/DIA_Addon_BDT_1072_Logan.d:265","Stattdessen haben sie Schnaps und Gold. Soviel ich weiß, haben sie da auch eine Frau. Alles klar?","Zamiast tego maj№ gorzaік i zіoto. Z tego, co wiem, jest tam nawet jakaњ kobieta. Teraz rozumiesz?","","True","DIA_Addon_Logan_Lager_10_02","",""
"Scripts/Content/Story/Dialoge/DIA_Addon_BDT_1072_Logan.d:277","Lass uns die Sumpfhaie angreifen.","Chodџmy zabiж parк bіotnych wкїy.","","True","DIA_Addon_Logan_MIS.description","",""
"Scripts/Content/Story/Dialoge/DIA_Addon_BDT_1072_Logan.d:290","Lass uns die Sumpfhaie angreifen.","Chodџmy zabiж parк bіotnych wкїy.","","True","DIA_Addon_Logan_MIS_15_00","",""
