"location","source","target","id","fuzzy","context","translator_comments","developer_comments"
"Scripts/Content/Story/Dialoge/DIA_DMT_1200_Dementor.d:56","Wir wussten, dass du kommen wirst!","Ми знали, що ти прийдеш!","","False","DIA_BridgeDementor_19_00","",""
"Scripts/Content/Story/Dialoge/DIA_DMT_1200_Dementor.d:57","Mein Meister wird triumphieren und die Herrschaft der Welt an sich reißen.","Незабаром мій Повелитель переможе і схиле весь світ біля своїх ніг.","","","DIA_BridgeDementor_19_01","",""
"Scripts/Content/Story/Dialoge/DIA_DMT_1200_Dementor.d:58","Du törichter Narr, du hast nicht gewusst, mit wem du dich anlegst, und dafür werde ich dich hier und jetzt bestrafen!","Наївний дурень. Ти і гадки не маєш, проти кого ідеш, і за цю зухвалість я покараю тебе тут і зараз!","","","DIA_BridgeDementor_19_02","",""
"Scripts/Content/Story/Dialoge/DIA_DMT_1299_OberDementor_DI.d:21","Du schleimiger Wurm wagst es also tatsächlich, bis vor die Tore des Meisters zu treten.","Що ж, слизький хробаче, ти нарешті насмілився підійти до воріт обителі мого Господаря.","","False","DIA_Schwarzmagier_HELLO_09_00","",""
"Scripts/Content/Story/Dialoge/DIA_DMT_1299_OberDementor_DI.d:22","Bist du hier der Drahtzieher?","Це ти тут тягнеш за ниточки?","","False","DIA_Schwarzmagier_HELLO_15_01","",""
"Scripts/Content/Story/Dialoge/DIA_DMT_1299_OberDementor_DI.d:23","Ich bin der Wächter der Hallen von Irdorath. Die mächtigste Quelle Beliars Macht auf Erden. Durch meine Hände fließt die göttliche Kraft des Meisters.","Я - Охоронець Чертогів Ірдорату. Наймогутнішого джерела влади Беліара на землі. По моїх жилах тече божественна сила Господаря.","","False","DIA_Schwarzmagier_HELLO_09_02","",""
"Scripts/Content/Story/Dialoge/DIA_DMT_1299_OberDementor_DI.d:24","Nur ein Wort von mir und du wirst auf ewig dem Wahnsinn verfallen.","Досить одного мого слова, щоб приректи тебе на вічне божевілля.","","False","DIA_Schwarzmagier_HELLO_09_03","",""
"Scripts/Content/Story/Dialoge/DIA_DMT_1299_OberDementor_DI.d:25","Verstehe. Noch so ein Unterhändler, den ich aus dem Weg räumen muss.","Я бачу, знову якийсь посередник із занадто великими амбіціями.","","False","DIA_Schwarzmagier_HELLO_15_04","",""
"Scripts/Content/Story/Dialoge/DIA_DMT_1299_OberDementor_DI.d:31","Bring mich zu deinem Meister.","Відведи мене до свого Господаря.","","False","DIA_Schwarzmagier_HELLO.DIA_Schwarzmagier_HELLO_meister","Info_AddChoice",""
"Scripts/Content/Story/Dialoge/DIA_DMT_1299_OberDementor_DI.d:32","Wieviel von eurer Sorte muß ich denn noch töten?","Скількох ще з твого роду мені доведеться вбити?","","False","DIA_Schwarzmagier_HELLO.DIA_Schwarzmagier_HELLO_dmt","Info_AddChoice",""
"Scripts/Content/Story/Dialoge/DIA_DMT_1299_OberDementor_DI.d:33","Was verbirgt sich dort hinter dem großen Tor?","Що ховається за цим величезним порталом?","","False","DIA_Schwarzmagier_HELLO.DIA_Schwarzmagier_HELLO_hinterTor","Info_AddChoice",""
"Scripts/Content/Story/Dialoge/DIA_DMT_1299_OberDementor_DI.d:34","Wer ist dein Meister?","Хто твій Господар?","","False","DIA_Schwarzmagier_HELLO.DIA_Schwarzmagier_HELLO_wer","Info_AddChoice",""
"Scripts/Content/Story/Dialoge/DIA_DMT_1299_OberDementor_DI.d:38","Du warst einmal ein Anhänger des Schläfers.","Ти був послідовником Сплячого.","","False","DIA_Schwarzmagier_HELLO.DIA_Schwarzmagier_HELLO_schlaefer","Info_AddChoice",""
"Scripts/Content/Story/Dialoge/DIA_DMT_1299_OberDementor_DI.d:44","Wer ist dein Meister?","Хто твій Господар?","","False","DIA_Schwarzmagier_HELLO_wer_15_00","",""
"Scripts/Content/Story/Dialoge/DIA_DMT_1299_OberDementor_DI.d:45","Er ist ein Wanderer zwischen den Welten. Seine göttliche Weisheit erleuchtet uns.","Mуj pan podrуїuje miкdzy њwiatami, a jego boska m№droњж nas oњwieca.","","True","DIA_Schwarzmagier_HELLO_wer_09_01","",""
"Scripts/Content/Story/Dialoge/DIA_DMT_1299_OberDementor_DI.d:46","Er ist der Erwählte Beliars, das Reich von den elenden Innos-Anhängern zu befreien.","Jest wybraсcem Beliara, ktуry uwolni krуlestwo od cuchn№cych wyznawcуw Innosa.","","True","DIA_Schwarzmagier_HELLO_wer_09_02","",""
"Scripts/Content/Story/Dialoge/DIA_DMT_1299_OberDementor_DI.d:47","Er bringt allen den Tod, die an seiner Herrlichkeit zweifeln.","Tym, ktуrzy w№tpi№ w jego potкgк, przynosi cierpienie i њmierж.","","True","DIA_Schwarzmagier_HELLO_wer_09_03","",""
"Scripts/Content/Story/Dialoge/DIA_DMT_1299_OberDementor_DI.d:48","Kommt mir bekannt vor.","Sk№d ja to znam?","","True","DIA_Schwarzmagier_HELLO_wer_15_04","",""
"Scripts/Content/Story/Dialoge/DIA_DMT_1299_OberDementor_DI.d:53","Was verbirgt sich dort hinter dem großen Tor?","Co kryje w sobie ten portal?","","True","DIA_Schwarzmagier_HELLO_hinterTor_15_00","",""
"Scripts/Content/Story/Dialoge/DIA_DMT_1299_OberDementor_DI.d:54","(lacht) Die Gemächer meines Herren bleiben unerreichbar für dich. Ich werde dir keine Gelegenheit geben, das Tor zu öffnen.","Komnaty mego pana pozostan№ dla ciebie niedostкpne. Nigdy nie zezwolк ci na otwarcie bramy!","","True","DIA_Schwarzmagier_HELLO_hinterTor_09_01","",""
"Scripts/Content/Story/Dialoge/DIA_DMT_1299_OberDementor_DI.d:59","Du warst einmal ein Anhänger des Schläfers.","Byіeњ wyznawc№ Њni№cego.","","True","DIA_Schwarzmagier_HELLO_schlaefer_15_00","",""
"Scripts/Content/Story/Dialoge/DIA_DMT_1299_OberDementor_DI.d:60","Das ist graue Vergangenheit. Der Meister hat uns die Augen geöffnet. Jetzt wird uns niemand mehr aufhalten.","To odlegіa przeszіoњж. Pan otworzyі mi oczy. Nikt nas juї nie powstrzyma.","","True","DIA_Schwarzmagier_HELLO_schlaefer_09_01","",""
"Scripts/Content/Story/Dialoge/DIA_DMT_1299_OberDementor_DI.d:61","Der Meister hat uns den einzig gangbaren Weg gezeigt, mit euch Ungläubigen fertig zu werden.","Mуj Mistrz ukazaі mi jedyny sposуb postкpowania z wami, niewiernymi.","","True","DIA_Schwarzmagier_HELLO_schlaefer_09_02","",""
"Scripts/Content/Story/Dialoge/DIA_DMT_1299_OberDementor_DI.d:69","Wie viel von eurer Sorte muss ich denn noch töten?","Ilu jeszcze tobie podobnych bкdк musiaі zabiж?","","True","DIA_Schwarzmagier_HELLO_dmt_15_00","",""
"Scripts/Content/Story/Dialoge/DIA_DMT_1299_OberDementor_DI.d:70","Der unsrigen sind viele. Du hast ja keine Ahnung, wie zahlreich wir schon auf diese Zeit der Befreiung warten.","Jest nas wielu. Nie masz nawet pojкcia, jak wielu. Wszyscy czekamy na ostateczne wyzwolenie.","","True","DIA_Schwarzmagier_HELLO_dmt_09_01","",""
"Scripts/Content/Story/Dialoge/DIA_DMT_1299_OberDementor_DI.d:71","Ein Strom von Klageschreien wird sich über das Land ergießen, wenn wir in die Welt hinausziehen.","Okrzyki i lament zalej№ њwiat wszкdzie tam, gdzie bкdziemy st№paж.","","True","DIA_Schwarzmagier_HELLO_dmt_09_02","",""
"Scripts/Content/Story/Dialoge/DIA_DMT_1299_OberDementor_DI.d:72","Um die Welt von den Barbaren, die sich selbst die Hüter des Feuers nennen, zu befreien. Unsere Zusammenkunft hier im Tempel wird nicht von großer Dauer sein.","Uwolnimy њwiat od barbarzyсcуw nazywaj№cych siк Straїnikami Ognia. Nie zabawimy dіugo w tej њwi№tyni.","","True","DIA_Schwarzmagier_HELLO_dmt_09_03","",""
"Scripts/Content/Story/Dialoge/DIA_DMT_1299_OberDementor_DI.d:73","Ja.","To prawda.","","True","DIA_Schwarzmagier_HELLO_dmt_15_04","",""
"Scripts/Content/Story/Dialoge/DIA_DMT_1299_OberDementor_DI.d:83","(bedrohlich) Schluss mit dem Gefasel! Ich werde dich vernichten.","Doњж tych bredni! Teraz nadejdzie twуj koniec.","","True","DIA_Schwarzmagier_HELLO_meister_09_00","",""
"Scripts/Content/Story/Dialoge/DIA_DMT_1299_OberDementor_DI.d:84","Dein Augenlicht wird schwinden und dein Geist wird in der Dunkelheit vergehen.","Twoje oczy zakryje ciemnoњж, a twa dusza zniknie w zaњwiatach.","","True","DIA_Schwarzmagier_HELLO_meister_09_01","",""
"Scripts/Content/Story/Dialoge/DIA_DMT_1299_OberDementor_DI.d:88","(zu sich) Ohne das Seelenruf-Amulett hätte ich jetzt ein ernstes Problem.","Bez amuletu przyzwania dusz bкdzie mi trochк trudno.","","True","DIA_Schwarzmagier_HELLO_meister_15_02","",""
