"location","source","target","id","fuzzy","context","translator_comments","developer_comments"
"Scripts/Content/Story/Dialoge/DIA_Addon_PIR_1352_AlligatorJack.d:665","Außerdem hätte ich nichts dagegen, wenn die beiden auch nicht wieder auftauchen.","","","False","DIA_Addon_AlligatorJack_Angus_12_04","",""
"Scripts/Content/Story/Dialoge/DIA_Addon_PIR_1352_AlligatorJack.d:666","Warum?","","","False","DIA_Addon_AlligatorJack_Angus_15_05","",""
"Scripts/Content/Story/Dialoge/DIA_Addon_PIR_1352_AlligatorJack.d:667","Ach, die Penner haben ständig am See rumgehangen und das Wild vertrieben.","","","False","DIA_Addon_AlligatorJack_Angus_12_06","",""
"Scripts/Content/Story/Dialoge/DIA_Addon_PIR_1352_AlligatorJack.d:679","An welchem See hängen sie ständig rum?","","","False","DIA_Addon_AlligatorJack_Lake.description","",""
"Scripts/Content/Story/Dialoge/DIA_Addon_PIR_1352_AlligatorJack.d:693","An WELCHEM See hängen sie ständig rum?","","","False","DIA_Addon_AlligatorJack_Lake_15_00","",""
"Scripts/Content/Story/Dialoge/DIA_Addon_PIR_1352_AlligatorJack.d:697","Erinnerst du dich an unsere Jagd?","","","False","DIA_Addon_AlligatorJack_Lake_12_01","",""
"Scripts/Content/Story/Dialoge/DIA_Addon_PIR_1352_AlligatorJack.d:698","Ja.","","","False","DIA_Addon_AlligatorJack_Lake_15_02","",""
"Scripts/Content/Story/Dialoge/DIA_Addon_PIR_1352_AlligatorJack.d:699","Der See in dem Talkessel. Dort habe ich sie meistens gesehen.","","","False","DIA_Addon_AlligatorJack_Lake_12_03","",""
"Scripts/Content/Story/Dialoge/DIA_Addon_PIR_1352_AlligatorJack.d:703","Am See im großen Talkessel.","","","False","DIA_Addon_AlligatorJack_Lake_12_04","",""
"Scripts/Content/Story/Dialoge/DIA_Addon_PIR_1352_AlligatorJack.d:704","Du gehst von unserem Lager aus einfach nach Osten. Den Talkessel kannst du gar nicht übersehen.","","","False","DIA_Addon_AlligatorJack_Lake_12_05","",""
"Scripts/Content/Story/Dialoge/DIA_Addon_PIR_1352_AlligatorJack.d:705","Es gibt dort viel kleine Wasserfälle.","","","False","DIA_Addon_AlligatorJack_Lake_12_06","",""
"Scripts/Content/Story/Dialoge/DIA_Addon_PIR_1352_AlligatorJack.d:706","Aber pass auf, wenn du nur noch trockenen Sand unter den Füßen hast, bist du falsch abgebogen und in den Canyon gelaufen.","","","False","DIA_Addon_AlligatorJack_Lake_12_07","",""
"Scripts/Content/Story/Dialoge/DIA_Addon_PIR_1352_AlligatorJack.d:722","Kannst du mir was beibringen?","","","False","DIA_Addon_AlligatorJack_CanLearn.description","",""
"Scripts/Content/Story/Dialoge/DIA_Addon_PIR_1352_AlligatorJack.d:739","Kannst du mir was beibringen?","","","False","DIA_Addon_AlligatorJack_CanLearn_15_00","",""
"Scripts/Content/Story/Dialoge/DIA_Addon_PIR_1352_AlligatorJack.d:743","Klar, ich bin ein guter Jäger, ich kann dir zeigen wie man Tiere enthäutet und ihnen die Zähne zieht.","","","False","DIA_Addon_AlligatorJack_CanLearn_12_01","",""
"Scripts/Content/Story/Dialoge/DIA_Addon_PIR_1352_AlligatorJack.d:744","Wenn du willst, bring ich es dir bei.","","","False","DIA_Addon_AlligatorJack_CanLearn_12_02","",""
"Scripts/Content/Story/Dialoge/DIA_Addon_PIR_1352_AlligatorJack.d:753","Zeig mir erst mal, dass du bereit bist für die Jagd.","","","False","DIA_Addon_AlligatorJack_CanLearn_12_03","",""
"Scripts/Content/Story/Dialoge/DIA_Addon_PIR_1352_AlligatorJack.d:754","Wenn wir zusammen auf der Jagd waren, werde ich es vielleicht tun.","","","False","DIA_Addon_AlligatorJack_CanLearn_12_04","",""
"Scripts/Content/Story/Dialoge/DIA_Addon_PIR_1352_AlligatorJack.d:780","Unterrichte mich!","","","False","DIA_Addon_AlligatorJack_Teach.description","",""
"Scripts/Content/Story/Dialoge/DIA_Addon_PIR_1352_AlligatorJack.d:793","Unterrichte mich!","","","False","DIA_Addon_AlligatorJack_Teach_15_00","",""
"Scripts/Content/Story/Dialoge/DIA_Addon_PIR_1352_AlligatorJack.d:794","Was soll ich dir beibringen?","","","False","DIA_Addon_AlligatorJack_Teach_12_01","",""
"Scripts/Content/Story/Dialoge/DIA_Addon_PIR_1352_AlligatorJack.d:825","Und immer nur am Bauch aufschneiden, sonst verminderst du die Qualität.","","","False","DIA_Addon_AlligatorJack_Teach_Fur_12_00","",""
"Scripts/Content/Story/Dialoge/DIA_Addon_PIR_1352_AlligatorJack.d:860","Alles klar.","","","False","DIA_Addon_AlligatorJack_Anheuern_12_01","",""
"Scripts/Content/Story/Dialoge/DIA_Addon_PIR_1352_AlligatorJack.d:870","Lass uns jagen gehen.","","","False","DIA_Addon_AlligatorJack_Anheuern.description","",""
"Scripts/Content/Story/Dialoge/DIA_Addon_PIR_1352_AlligatorJack.d:883","Lass uns jagen gehen.","","","False","DIA_Addon_AlligatorJack_Anheuern_15_00","",""
"Scripts/Content/Story/Dialoge/DIA_Addon_PIR_1352_AlligatorJack.d:901","Komm mit.","","","False","DIA_Addon_AlligatorJack_ComeOn.description","",""
"Scripts/Content/Story/Dialoge/DIA_Addon_PIR_1352_AlligatorJack.d:916","Komm mit.","","","False","DIA_Addon_AlligatorJack_KommMit_15_00","",""
"Scripts/Content/Story/Dialoge/DIA_Addon_PIR_1352_AlligatorJack.d:941","Ich brauch dich nicht mehr.","","","False","DIA_Addon_AlligatorJack_GoHome.description","",""
"Scripts/Content/Story/Dialoge/DIA_Addon_PIR_1352_AlligatorJack.d:955","Ich brauch dich nicht mehr.","","","False","DIA_Addon_AlligatorJack_DontNeedYou_15_00","",""
"Scripts/Content/Story/Dialoge/DIA_Addon_PIR_1352_Morgan.d:25","Leg dich wieder hin.","","","False","DIA_Addon_Morgan_Perm_15_00","",""
"Scripts/Content/Story/Dialoge/DIA_Addon_PIR_1352_Morgan.d:28","(gähnt) Hervorragende Idee.","","","False","DIA_Addon_Morgan_Perm_07_01","",""
"Scripts/Content/Story/Dialoge/DIA_Addon_PIR_1352_Morgan.d:33","(verschlafen)Na dann, gute Nacht.","","","False","DIA_Addon_Morgan_Perm_07_02","",""
"Scripts/Content/Story/Dialoge/DIA_Addon_PIR_1352_Morgan.d:38","(müde) Nichts lieber, als das.","","","False","DIA_Addon_Morgan_Perm_07_03","",""
"Scripts/Content/Story/Dialoge/DIA_Addon_PIR_1352_Morgan.d:43","Weck mich, wenn irgendwas passiert.","","","False","DIA_Addon_Morgan_Perm_07_04","",""
"Scripts/Content/Story/Dialoge/DIA_Addon_PIR_1352_Morgan.d:110","Toll, jetzt hat Greg mich zum Brettersägen verdonnert!","","","False","DIA_Addon_Morgan_Anheuern_07_00","",""
"Scripts/Content/Story/Dialoge/DIA_Addon_PIR_1352_Morgan.d:113","(sarkastisch) Viel Spass beim Monster schlachten!","","","False","DIA_Addon_Morgan_Anheuern_07_01","",""
"Scripts/Content/Story/Dialoge/DIA_Addon_PIR_1352_Morgan.d:143","Hey du!","","","False","DIA_Addon_Morgan_Hello_15_00","",""
"Scripts/Content/Story/Dialoge/DIA_Addon_PIR_1352_Morgan.d:144","(verschlafen) Häh? Was willst du?","","","False","DIA_Addon_Morgan_Hello_07_01","",""
"Scripts/Content/Story/Dialoge/DIA_Addon_PIR_1352_Morgan.d:145","(verschlafen) Ist Alligator Jack schon wieder da?","","","False","DIA_Addon_Morgan_Hello_07_02","",""
"Scripts/Content/Story/Dialoge/DIA_Addon_PIR_1352_Morgan.d:146","(verschlafen) Nein? Dann wird er sicher bald kommen, gute Nacht.","","","False","DIA_Addon_Morgan_Hello_07_03","",""
"Scripts/Content/Story/Dialoge/DIA_Addon_PIR_1352_Morgan.d:159","Ich habe hier eine Lieferung Fleisch.","","","False","DIA_Addon_Morgan_Meat.description","",""
"Scripts/Content/Story/Dialoge/DIA_Addon_PIR_1352_Morgan.d:173","Ich habe hier eine Lieferung Fleisch.","","","False","DIA_Addon_Morgan_Meat_15_00","",""
"Scripts/Content/Story/Dialoge/DIA_Addon_PIR_1352_Morgan.d:177","(wird wach) Puh. Ich brauch erst mal einen Schluck zum Wachwerden.","","","False","DIA_Addon_Morgan_Meat_07_01","",""
"Scripts/Content/Story/Dialoge/DIA_Addon_PIR_1352_Morgan.d:182","So, besser. Also nochmal, was willst du?","","","False","DIA_Addon_Morgan_Meat_07_02","",""
"Scripts/Content/Story/Dialoge/DIA_Addon_PIR_1352_Morgan.d:183","Ich bringe eine Lieferung Fleisch. Von Alligator Jack.","","","False","DIA_Addon_Morgan_Meat_15_03","",""
"Scripts/Content/Story/Dialoge/DIA_Addon_PIR_1352_Morgan.d:186","Ich erinnere mich. Genau! Das Fleisch, gib her!","","","False","DIA_Addon_Morgan_Meat_07_04","",""
"Scripts/Content/Story/Dialoge/DIA_Addon_PIR_1352_Morgan.d:199","Was, das ist alles? Hast den Rest Rest selber gefreesen was? Naja, egal...","","","False","DIA_Addon_Morgan_Meat_07_05","",""
"Scripts/Content/Story/Dialoge/DIA_Addon_PIR_1352_Morgan.d:217","Was machst du hier?","","","False","DIA_Addon_Morgan_Job.description","",""
"Scripts/Content/Story/Dialoge/DIA_Addon_PIR_1352_Morgan.d:230","Was machst du hier?","","","False","DIA_Addon_Morgan_Job_15_01","",""
"Scripts/Content/Story/Dialoge/DIA_Addon_PIR_1352_Morgan.d:231","Greg hat mir das Kommando über einen der beiden Entertrupps gegeben.","","","False","DIA_Addon_Morgan_Job_07_01","",""
"Scripts/Content/Story/Dialoge/DIA_Addon_PIR_1352_Morgan.d:232","Ich bin für die Versorgung des Lagers zuständig - darum kümmert sich Alligator Jack.","","","False","DIA_Addon_Morgan_Job_07_02","",""
"Scripts/Content/Story/Dialoge/DIA_Addon_PIR_1352_Morgan.d:233","Außerdem bin ich dafür verantwortlich, dass die Biester hier in der Gegend nicht zu nah ans Lager kommen.","","","False","DIA_Addon_Morgan_Job_07_03","",""
"Scripts/Content/Story/Dialoge/DIA_Addon_PIR_1352_Morgan.d:234","Darum kümmern sich die JUNGS.","","","False","DIA_Addon_Morgan_Job_07_04","",""
"Scripts/Content/Story/Dialoge/DIA_Addon_PIR_1352_Morgan.d:237","Ich hab ihnen gesagt, ich will hier kein einziges Vieh mehr in der Nähe sehen, (gähnt) wenn Greg zurückkommt.","","","False","DIA_Addon_Morgan_Job_07_05","",""
"Scripts/Content/Story/Dialoge/DIA_Addon_PIR_1352_Morgan.d:250","Tust du auch mal was?","","","False","DIA_Addon_Morgan_Sleep.description","",""
"Scripts/Content/Story/Dialoge/DIA_Addon_PIR_1352_Morgan.d:263","Tust du auch mal was?","","","False","DIA_Addon_Morgan_Sleep_15_00","",""
"Scripts/Content/Story/Dialoge/DIA_Addon_PIR_1352_Morgan.d:264","Hey, nicht frech werden!","","","False","DIA_Addon_Morgan_Sleep_07_01","",""
"Scripts/Content/Story/Dialoge/DIA_Addon_PIR_1352_Morgan.d:265","Ich habe die wichtigste Aufgabe von allen.","","","False","DIA_Addon_Morgan_Sleep_07_02","",""
"Scripts/Content/Story/Dialoge/DIA_Addon_PIR_1352_Morgan.d:266","Ich kümmere mich um die Ausbildung meiner Leute.","","","False","DIA_Addon_Morgan_Sleep_07_03","",""
"Scripts/Content/Story/Dialoge/DIA_Addon_PIR_1352_Morgan.d:267","Ich mache sie zu den besten und furchtlosesten Kämpfern, die jemals auf diesen Gewässern gekreuzt sind.","","","False","DIA_Addon_Morgan_Sleep_07_04","",""
"Scripts/Content/Story/Dialoge/DIA_Addon_PIR_1352_Morgan.d:268","Außerdem ist es ja nicht so, daß die Jungs nichts davon haben, ihre Arbeit zu machen.","","","False","DIA_Addon_Morgan_Sleep_07_05","",""
"Scripts/Content/Story/Dialoge/DIA_Addon_PIR_1352_Morgan.d:269","Sie bekommen 'nen ordentlichen Sack voll Gold dafür.","","","False","DIA_Addon_Morgan_Sleep_07_06","",""
"Scripts/Content/Story/Dialoge/DIA_Addon_PIR_1352_Morgan.d:286","Ich will in deinen Trupp.","","","False","DIA_Addon_Morgan_JoinMorgan.description","",""
"Scripts/Content/Story/Dialoge/DIA_Addon_PIR_1352_Morgan.d:300","Ich will in deinen Trupp.","","","False","DIA_Addon_Morgan_JoinMorgan_15_00","",""
"Scripts/Content/Story/Dialoge/DIA_Addon_PIR_1352_Morgan.d:301","(lacht) Mein Trupp? Mein Trupp hängt am Strand rum.","","","False","DIA_Addon_Morgan_JoinMorgan_07_01","",""
"Scripts/Content/Story/Dialoge/DIA_Addon_PIR_1352_Morgan.d:302","Die Jungs machen keinen Finger krumm, bis der Käpt'n wieder da ist, das kann ich dir versprechen.","","","False","DIA_Addon_Morgan_JoinMorgan_07_03","",""
"Scripts/Content/Story/Dialoge/DIA_Addon_PIR_1352_Morgan.d:303","Aber wenn du allen zeigen willst, was du drauf hast, kannst du dir ja mal den Strand im Norden vornehmen.","","","False","DIA_Addon_Morgan_JoinMorgan_07_04","",""
"Scripts/Content/Story/Dialoge/DIA_Addon_PIR_1352_Morgan.d:304","Der ist voller Lurker und was weiß ich noch allem.","","","False","DIA_Addon_Morgan_JoinMorgan_07_05","",""
"Scripts/Content/Story/Dialoge/DIA_Addon_PIR_1352_Morgan.d:305","Zieh die Sache alleine durch und du verdienst dir den Respekt (gähnt) der Leute...","","","False","DIA_Addon_Morgan_JoinMorgan_07_06","",""
"Scripts/Content/Story/Dialoge/DIA_Addon_PIR_1352_Morgan.d:306","Willommen in meinem Trupp. Ha! Ich hau mich wieder hin...","","","False","DIA_Addon_Morgan_JoinMorgan_07_07","",""
"Scripts/Content/Story/Dialoge/DIA_Addon_PIR_1352_Morgan.d:326","Der Strand im Norden ist sauber.","","","False","DIA_Addon_Morgan_LurkerPlatt.description","",""
"Scripts/Content/Story/Dialoge/DIA_Addon_PIR_1352_Morgan.d:344","Der Strand im Norden ist sauber.","","","False","DIA_Addon_Morgan_LurkerPlatt_15_00","",""
"Scripts/Content/Story/Dialoge/DIA_Addon_PIR_1352_Morgan.d:345","Was ist mit der Höhle? Warst du da auch schon?","","","False","DIA_Addon_Morgan_LurkerPlatt_07_01","",""
"Scripts/Content/Story/Dialoge/DIA_Addon_PIR_1352_Morgan.d:349","Klar.","","","False","DIA_Addon_Morgan_LurkerPlatt_15_02","",""
"Scripts/Content/Story/Dialoge/DIA_Addon_PIR_1352_Morgan.d:350","Sauber. Bist ein guter Mann.","","","False","DIA_Addon_Morgan_LurkerPlatt_07_03","",""
"Scripts/Content/Story/Dialoge/DIA_Addon_PIR_1352_Morgan.d:351","Hier hast du deinen Lohn.","","","False","DIA_Addon_Morgan_LurkerPlatt_07_04","",""
"Scripts/Content/Story/Dialoge/DIA_Addon_PIR_1352_Morgan.d:363","Äh ...","","","False","DIA_Addon_Morgan_LurkerPlatt_15_05","",""
"Scripts/Content/Story/Dialoge/DIA_Addon_PIR_1352_Morgan.d:364","Die gehört natürlich auch dazu. Komm wieder, wenn du das erledigt hast.","","","False","DIA_Addon_Morgan_LurkerPlatt_07_06","",""
"Scripts/Content/Story/Dialoge/DIA_Addon_PIR_1352_Morgan.d:382","Gibt's sonst noch was zu tun für mich?","","","False","DIA_Addon_Morgan_Auftrag2.description","",""
"Scripts/Content/Story/Dialoge/DIA_Addon_PIR_1352_Morgan.d:395","Gibt's sonst noch was zu tun für mich?","","","False","DIA_Addon_Morgan_Auftrag2_15_00","",""
"Scripts/Content/Story/Dialoge/DIA_Addon_PIR_1352_Morgan.d:399","Im Moment nicht.","","","False","DIA_Addon_Morgan_Auftrag2_07_01","",""
"Scripts/Content/Story/Dialoge/DIA_Addon_PIR_1352_Morgan.d:400","Such dir erst mal 'ne Koje und trink dir 'ne ordentliche Buddel Rum!","","","False","DIA_Addon_Morgan_Auftrag2_07_02","",""
"Scripts/Content/Story/Dialoge/DIA_Addon_PIR_1352_Morgan.d:403","Aaah. Das Zeug ist gut.","","","False","DIA_Addon_Morgan_Auftrag2_07_03","",""
"Scripts/Content/Story/Dialoge/DIA_Addon_PIR_1352_Morgan.d:407","Da fragst du am besten den Käpt'n.","","","False","DIA_Addon_Morgan_Auftrag2_07_04","",""
"Scripts/Content/Story/Dialoge/DIA_Addon_PIR_1352_Morgan.d:425","Wegen Angus und Hank...","","","False","DIA_Addon_Morgan_FOUNDTHEM.description","",""
"Scripts/Content/Story/Dialoge/DIA_Addon_PIR_1352_Morgan.d:439","Wegen Angus und Hank ...","","","False","DIA_Addon_Morgan_FOUNDTHEM_15_00","",""
"Scripts/Content/Story/Dialoge/DIA_Addon_PIR_1352_Morgan.d:443","Hör bloß auf mit DER Sache.","","","False","DIA_Addon_Morgan_FOUNDTHEM_07_01","",""
"Scripts/Content/Story/Dialoge/DIA_Addon_PIR_1352_Morgan.d:444","Die beiden haben sich wahrscheinlich von Banditen umbringen lassen.","","","False","DIA_Addon_Morgan_FOUNDTHEM_07_02","",""
"Scripts/Content/Story/Dialoge/DIA_Addon_PIR_1352_Morgan.d:445","Und Angus hatte meinen Ring dabei.","","","False","DIA_Addon_Morgan_FOUNDTHEM_07_03","",""
"Scripts/Content/Story/Dialoge/DIA_Addon_PIR_1352_Morgan.d:446","Na gut, eigentlich war es SEIN Ring. Er hat ihn beim Würfeln gewonnen.","","","False","DIA_Addon_Morgan_FOUNDTHEM_07_04","",""
"Scripts/Content/Story/Dialoge/DIA_Addon_PIR_1352_Morgan.d:447","Aber ich hätte ihn mir wieder zurückgeholt und jetzt ist er WEG!","","","False","DIA_Addon_Morgan_FOUNDTHEM_07_05","",""
"Scripts/Content/Story/Dialoge/DIA_Addon_PIR_1352_Morgan.d:454","Ich habe sie gefunden.","","","False","DIA_Addon_Morgan_FOUNDTHEM.DIA_Addon_Morgan_FOUNDTHEM_Now","Info_AddChoice",""
"Scripts/Content/Story/Dialoge/DIA_Addon_PIR_1352_Morgan.d:458","Wenn du meinen Ring findest, dann bring ihn zu mir zurück. Du sollst es auch nicht umsonst gemacht haben!","","","False","DIA_Addon_Morgan_FOUNDTHEM_07_06","",""
"Scripts/Content/Story/Dialoge/DIA_Addon_PIR_1352_Morgan.d:464","Ich habe sie gefunden.","","","False","DIA_Addon_Morgan_FOUNDTHEM_15_01","",""
"Scripts/Content/Story/Dialoge/DIA_Addon_PIR_1352_Morgan.d:465","Jetzt lass dir doch nicht jedes Wort aus der Nase ziehen. Wo sind sie?","","","False","DIA_Addon_Morgan_FOUNDTHEM_07_07","",""
"Scripts/Content/Story/Dialoge/DIA_Addon_PIR_1352_Morgan.d:466","Sie sind tot.","","","False","DIA_Addon_Morgan_FOUNDTHEM_15_03","",""
"Scripts/Content/Story/Dialoge/DIA_Addon_PIR_1352_Morgan.d:467","Der Ring, was ist mit dem Ring?","","","False","DIA_Addon_Morgan_FOUNDTHEM_07_08","",""
"Scripts/Content/Story/Dialoge/DIA_Addon_PIR_1352_Morgan.d:469","Hier ist er.","","","False","DIA_Addon_Morgan_FOUNDTHEM.DIA_Addon_Morgan_FOUNDTHEM_GiveRing","Info_AddChoice",""
"Scripts/Content/Story/Dialoge/DIA_Addon_PIR_1352_Morgan.d:470","Den hatten sie nicht dabei.","","","False","DIA_Addon_Morgan_FOUNDTHEM.DIA_Addon_Morgan_FOUNDTHEM_NoRing","Info_AddChoice",""
"Scripts/Content/Story/Dialoge/DIA_Addon_PIR_1352_Morgan.d:475","Den hatten sie nicht dabei.","","","False","DIA_Addon_Morgan_FOUNDTHEM_NoRing_15_00","",""
"Scripts/Content/Story/Dialoge/DIA_Addon_PIR_1352_Morgan.d:476","entsetzt) Was? Geh zurück und suche noch mal. Sie müssen ihn dabei gehabt haben.","","","False","DIA_Addon_Morgan_FOUNDTHEM_NoRing_07_01","",""
"Scripts/Content/Story/Dialoge/DIA_Addon_PIR_1352_Morgan.d:477","Es ist ein kleiner Ring mit vielen kleinen Verzierungen.","","","False","DIA_Addon_Morgan_FOUNDTHEM_NoRing_07_02","",""
"Scripts/Content/Story/Dialoge/DIA_Addon_PIR_1352_Morgan.d:478","Du MUSST ihn finden. Du MUSST!","","","False","DIA_Addon_Morgan_FOUNDTHEM_NoRing_07_03","",""
"Scripts/Content/Story/Dialoge/DIA_Addon_PIR_1352_Morgan.d:484","Hier ist er.","","","False","DIA_Addon_Morgan_FOUNDTHEM_GiveRing_15_00","",""
"Scripts/Content/Story/Dialoge/DIA_Addon_PIR_1352_Morgan.d:486","(freut sich wie ein Kind) Ja, das ist er. Guter Mann!","","","False","DIA_Addon_Morgan_FOUNDTHEM_GiveRing_07_01","",""
"Scripts/Content/Story/Dialoge/DIA_Addon_PIR_1352_Morgan.d:487","Hier, nimm diese Steintafel. Sie sieht zwar aus wie alter Ramsch, aber Garett wird 'ne Menge Gold dafür springen lassen.","","","False","DIA_Addon_Morgan_FOUNDTHEM_GiveRing_07_02","",""
"Scripts/Content/Story/Dialoge/DIA_Addon_PIR_1352_Morgan.d:506","Was hälst du von Francis?","","","False","DIA_Addon_Morgan_Francis.description","",""
"Scripts/Content/Story/Dialoge/DIA_Addon_PIR_1352_Morgan.d:523","Was hältst du von Francis?","","","False","DIA_Addon_Morgan_Francis_15_00","",""
"Scripts/Content/Story/Dialoge/DIA_Addon_PIR_1352_Morgan.d:524","Der ist mir egal, (gefährlich) solange er mich in Ruhe lässt!","","","False","DIA_Addon_Morgan_Francis_07_01","",""
"Scripts/Content/Story/Dialoge/DIA_Addon_PIR_1352_Morgan.d:525","Ist er nicht der Boss hier?","","","False","DIA_Addon_Morgan_Francis_15_02","",""
"Scripts/Content/Story/Dialoge/DIA_Addon_PIR_1352_Morgan.d:526","(lacht dreckig) Er HÄLT sich für den Boss.","","","False","DIA_Addon_Morgan_Francis_07_03","",""
"Scripts/Content/Story/Dialoge/DIA_Addon_PIR_1352_Morgan.d:527","(schadenfroh) Aber irgendwann ist Greg wieder da, und dann wird Francis wieder schön - brav - Bretter sägen.","","","False","DIA_Addon_Morgan_Francis_07_04","",""
"Scripts/Content/Story/Dialoge/DIA_Addon_PIR_1352_Morgan.d:545","Kannst du mich auch trainieren?","","","False","DIA_Addon_Morgan_TRAIN.description","",""
"Scripts/Content/Story/Dialoge/DIA_Addon_PIR_1352_Morgan.d:558","Kannst du mich AUCH trainieren?","","","False","DIA_Addon_Morgan_TRAIN_15_00","",""
"Scripts/Content/Story/Dialoge/DIA_Addon_PIR_1352_Morgan.d:559","Klar, ich kann ich dir zeigen, wie man mit Einhandwaffen kämpft.","","","False","DIA_Addon_Morgan_TRAIN_07_01","",""
"Scripts/Content/Story/Dialoge/DIA_Addon_PIR_1352_Morgan.d:580","Unterrichte mich!","","","False","DIA_Addon_Morgan_Teach.description","",""
"Scripts/Content/Story/Dialoge/DIA_Addon_PIR_1352_Morgan.d:593","Unterrichte mich!","","","False","DIA_Addon_Morgan_Teach_15_00","",""
"Scripts/Content/Story/Dialoge/DIA_Addon_PIR_1352_Morgan.d:609","Und denk dran, an diesem Geschwätz von Ehre ist nichts dran. Entweder du tötest ihn, oder er tötet dich.","","","False","DIA_Addon_Morgan_CommentFightSkill_07_00","",""
"Scripts/Content/Story/Dialoge/DIA_Addon_PIR_1352_Morgan.d:614","In Zukunft musst du noch lernen mehr Kraft in deine Schläge zu legen.","","","False","DIA_Addon_Morgan_CommentFightSkill_07_01","",""
"Scripts/Content/Story/Dialoge/DIA_Addon_PIR_1352_Morgan.d:619","Hahaha, zumindest weisst du mittlerweile, wie man ein Schwert hält.","","","False","DIA_Addon_Morgan_CommentFightSkill_07_02","",""
"Scripts/Content/Story/Dialoge/DIA_Addon_PIR_1352_Morgan.d:625","Wenn du noch besser werden willst, dann musst du dir 'nen Anderen suchen.","","","False","DIA_Addon_Morgan_Teach_Back_07_00","",""
"Scripts/Content/Story/Dialoge/DIA_Addon_PIR_1354_Henry.d:29","500 Goldstücke.","","","False","DIA_Addon_Henry_Gold500_04_00","",""
"Scripts/Content/Story/Dialoge/DIA_Addon_PIR_1354_Henry.d:33","400 Goldstücke.","","","False","DIA_Addon_Henry_Gold400_04_00","",""
"Scripts/Content/Story/Dialoge/DIA_Addon_PIR_1354_Henry.d:37","300 Goldstücke.","","","False","DIA_Addon_Henry_Gold300_04_00","",""
"Scripts/Content/Story/Dialoge/DIA_Addon_PIR_1354_Henry.d:41","200 Goldstücke.","","","False","DIA_Addon_Henry_Gold200_04_00","",""
"Scripts/Content/Story/Dialoge/DIA_Addon_PIR_1354_Henry.d:45","100 Goldstücke.","","","False","DIA_Addon_Henry_Gold100_04_00","",""
"Scripts/Content/Story/Dialoge/DIA_Addon_PIR_1354_Henry.d:95","ADW_PIRATECAMP_WAY_02","","","False","PIR_1354_Checkpoint","",""
"Scripts/Content/Story/Dialoge/DIA_Addon_PIR_1354_Henry.d:126","HALT!","","","False","DIA_Addon_Henry_Hello_04_00","",""
"Scripts/Content/Story/Dialoge/DIA_Addon_PIR_1354_Henry.d:127","Freund oder Feind?","","","False","DIA_Addon_Henry_Hello_04_01","",""
"Scripts/Content/Story/Dialoge/DIA_Addon_PIR_1354_Henry.d:130","Feind!","","","False","DIA_Addon_Henry_Hello.DIA_Addon_Henry_Hello_Feind","Info_AddChoice",""
"Scripts/Content/Story/Dialoge/DIA_Addon_PIR_1354_Henry.d:131","Freund!","","","False","DIA_Addon_Henry_Hello.DIA_Addon_Henry_Hello_Freund","Info_AddChoice",""
"Scripts/Content/Story/Dialoge/DIA_Addon_PIR_1354_Henry.d:137","Feind!","","","False","DIA_Addon_Henry_Hello_Feind_15_00","",""
"Scripts/Content/Story/Dialoge/DIA_Addon_PIR_1354_Henry.d:138","Du willst wohl, dass ich dir den Arsch versohle, du Spassvogel?","","","False","DIA_Addon_Henry_Hello_Feind_04_01","",""
"Scripts/Content/Story/Dialoge/DIA_Addon_PIR_1354_Henry.d:139","Sag' was du hier willst oder verschwinde ganz schnell wieder.","","","False","DIA_Addon_Henry_Hello_Feind_04_02","",""
"Scripts/Content/Story/Dialoge/DIA_Addon_PIR_1354_Henry.d:151","Freund!","","","False","DIA_Addon_Henry_Hello_Freund_15_00","",""
"Scripts/Content/Story/Dialoge/DIA_Addon_PIR_1354_Henry.d:152","Das kann ja jeder behaupten! Ich kenne dich nicht, was willst du hier?","","","False","DIA_Addon_Henry_Hello_Freund_04_01","",""
"Scripts/Content/Story/Dialoge/DIA_Addon_PIR_1354_Henry.d:186","Noch ein Schritt Richtung Lager, und ich werde dich den Haien zu Frass vorwerfen.","","","False","DIA_Addon_Henry_SecondWarn_04_00","",""
"Scripts/Content/Story/Dialoge/DIA_Addon_PIR_1354_Henry.d:223","Du hast es so gewollt ...","","","False","DIA_Addon_Henry_Attack_04_00","",""
"Scripts/Content/Story/Dialoge/DIA_Addon_PIR_1354_Henry.d:245","Ich will da rein.","","","False","DIA_Addon_Henry_WantEnter.description","",""
"Scripts/Content/Story/Dialoge/DIA_Addon_PIR_1354_Henry.d:258","Ich will da rein!","","","False","DIA_Addon_Henry_WantEnter_15_00","",""
"Scripts/Content/Story/Dialoge/DIA_Addon_PIR_1354_Henry.d:259","Tatsächlich? Das kostet dich aber 'ne Kleinigkeit.","","","False","DIA_Addon_Henry_WantEnter_04_01","",""
"Scripts/Content/Story/Dialoge/DIA_Addon_PIR_1354_Henry.d:265","Was? Wofür?","","","False","DIA_Addon_Henry_WantEnter_15_02","",""
"Scripts/Content/Story/Dialoge/DIA_Addon_PIR_1354_Henry.d:266","Jetzt stell dich mal nicht so an.","","","False","DIA_Addon_Henry_WantEnter_04_03","",""
"Scripts/Content/Story/Dialoge/DIA_Addon_PIR_1354_Henry.d:267","Hier im Lager gibt's 'ne MENGE Sachen, die für dich interesant sein könnten...","","","False","DIA_Addon_Henry_WantEnter_04_04","",""
"Scripts/Content/Story/Dialoge/DIA_Addon_PIR_1354_Henry.d:279","Und für mich siehst du aus, wie jemand, der Gold hat.","","","False","DIA_Addon_Henry_WantEnter_04_07","",""
"Scripts/Content/Story/Dialoge/DIA_Addon_PIR_1354_Henry.d:280","Also wird dich so ein kleiner Zoll nicht gleich umbringen.","","","False","DIA_Addon_Henry_WantEnter_04_08","",""
"Scripts/Content/Story/Dialoge/DIA_Addon_PIR_1354_Henry.d:281","Oder sind deine feinen Klamotten etwa geklaut?","","","False","DIA_Addon_Henry_WantEnter_04_09","",""
"Scripts/Content/Story/Dialoge/DIA_Addon_PIR_1354_Henry.d:285","Du hast doch Gold, oder?","","","False","DIA_Addon_Henry_WantEnter_04_10","",""
"Scripts/Content/Story/Dialoge/DIA_Addon_PIR_1354_Henry.d:294","Wenn du vorhast, bei uns anzuheuern, muß ich dich enttäuschen, Junge!","","","False","DIA_Addon_Henry_Add_04_00","",""
"Scripts/Content/Story/Dialoge/DIA_Addon_PIR_1354_Henry.d:295","Der Käpt'n ist mir der halben Besatzung auf Kaperfahrt gegangen, und er ist der einzige, der entscheidet, wer bei uns anheuern darf..","","","False","DIA_Addon_Henry_Add_04_01","",""
"Scripts/Content/Story/Dialoge/DIA_Addon_PIR_1354_Henry.d:296","Aber du kannst bleiben, bis er wieder da ist.","","","False","DIA_Addon_Henry_Add_04_02","",""
"Scripts/Content/Story/Dialoge/DIA_Addon_PIR_1354_Henry.d:297","Vorausgesetzt du machst hier keinen Ärger!","","","False","DIA_Addon_Henry_Add_04_03","",""
