"location","source","target","id","fuzzy","context","translator_comments","developer_comments"
"Scripts/Content/Story/Dialoge/DIA_DJG_713_Biff.d:268","Und noch was, ich will keine Waffe oder anderen Krempel, den du hier aufsammelst. Mich interessiert nur das Gold, kapiert?","","","False","DIA_Biff_ARBEITEN_HalbeHalbe_07_02","",""
"Scripts/Content/Story/Dialoge/DIA_DJG_713_Biff.d:284","Aber, was sag ich. Das weißt du doch alles schon.","","","False","DIA_Biff_ARBEITEN_HalbeHalbe_07_03","",""
"Scripts/Content/Story/Dialoge/DIA_DJG_713_Biff.d:290","Du kannst froh sein, wenn ich dich leben lasse.","","","False","DIA_Biff_ARBEITEN_lebenlassen_15_00","",""
"Scripts/Content/Story/Dialoge/DIA_DJG_713_Biff.d:328","Moment mal! Hast du nicht gesagt, die Hälfte deiner Beute gehört mir? Her damit!","","","False","DIA_Biff_GELDEINTREIBEN_07_00","",""
"Scripts/Content/Story/Dialoge/DIA_DJG_713_Biff.d:335","Du bist mir zu teuer.","","","False","DIA_Biff_GELDEINTREIBEN.DIA_Biff_GELDEINTREIBEN_zuTeuer","Info_AddChoice",""
"Scripts/Content/Story/Dialoge/DIA_DJG_713_Biff.d:336","Hier ist dein Anteil.","","","False","DIA_Biff_GELDEINTREIBEN.DIA_Biff_GELDEINTREIBEN_geben","Info_AddChoice",""
"Scripts/Content/Story/Dialoge/DIA_DJG_713_Biff.d:341","Hier ist dein Anteil.","","","False","DIA_Biff_GELDEINTREIBEN_geben_15_00","",""
"Scripts/Content/Story/Dialoge/DIA_DJG_713_Biff.d:342","Alles klar. Lass uns weiter gehen.","","","False","DIA_Biff_GELDEINTREIBEN_geben_07_01","",""
"Scripts/Content/Story/Dialoge/DIA_DJG_713_Biff.d:352","Du bist mir zu teuer.","","","False","DIA_Biff_GELDEINTREIBEN_zuTeuer_15_00","",""
"Scripts/Content/Story/Dialoge/DIA_DJG_713_Biff.d:353","Heul mir jetzt nicht die Ohren voll. Die Hälfte war abgemacht.","","","False","DIA_Biff_GELDEINTREIBEN_zuTeuer_07_01","",""
"Scripts/Content/Story/Dialoge/DIA_DJG_713_Biff.d:356","Ich fürchte, ich muß mich von dir trennen.","","","False","DIA_Biff_GELDEINTREIBEN.DIA_Biff_GELDEINTREIBEN_zuTeuer_trennen","Info_AddChoice",""
"Scripts/Content/Story/Dialoge/DIA_DJG_713_Biff.d:362","Ich fürchte, ich muss mich von dir trennen.","我必须和你分手。","","False","DIA_Biff_GELDEINTREIBEN_zuTeuer_trennen_15_00","",""
"Scripts/Content/Story/Dialoge/DIA_DJG_713_Biff.d:363","Wie du willst. Dann muss ich mir eben meinen Anteil holen.","","","False","DIA_Biff_GELDEINTREIBEN_zuTeuer_trennen_07_01","",""
"Scripts/Content/Story/Dialoge/DIA_DJG_713_Biff.d:416","Ziemlich brenzlige Gegend hier. Geh du vor. Ich halte mich im Hintergrund.","","","False","DIA_Biff_ICHBLEIBHIER_07_00","",""
"Scripts/Content/Story/Dialoge/DIA_DJG_713_Biff.d:460","(Biff wieder mitnehmen)","","","False","DIA_Biff_Stay_AwayFromOC.description","",""
"Scripts/Content/Story/Dialoge/DIA_DJG_713_Biff.d:511","Verteil nicht dein ganzes Gold in der Weltgeschichte.","","","False","DIA_Biff_KOHLEWEGGEBEN_07_00","",""
"Scripts/Content/Story/Dialoge/DIA_DJG_713_Biff.d:512","Dann gib es lieber mir.","","","False","DIA_Biff_KOHLEWEGGEBEN_07_01","",""
"Scripts/Content/Story/Dialoge/DIA_DJG_713_Biff.d:528","Ich denke, ab hier beenden wir unsere Zusammenarbeit.","","","False","DIA_Biff_BIFFLOSWERDEN.description","",""
"Scripts/Content/Story/Dialoge/DIA_DJG_713_Biff.d:541","Ich denke, ab hier beenden wir unsere Zusammenarbeit.","","","False","DIA_Biff_BIFFLOSWERDEN_15_00","",""
"Scripts/Content/Story/Dialoge/DIA_DJG_713_Biff.d:542","Wie du meinst. Ich kann mir auch was besseres vorstellen. Mach's gut.","","","False","DIA_Biff_BIFFLOSWERDEN_07_01","",""
"Scripts/Content/Story/Dialoge/DIA_DJG_713_Biff.d:578","So langsam bekomme ich das Gefühl, dass ich mehr Geld von dir bekommen sollte.","","","False","DIA_Biff_MEHRGELD_07_00","",""
"Scripts/Content/Story/Dialoge/DIA_DJG_713_Biff.d:582","Also 100 Goldmünzen sollten es schon sein.","","","False","DIA_Biff_MEHRGELD_07_01","",""
"Scripts/Content/Story/Dialoge/DIA_DJG_713_Biff.d:585","Keine Sorge. Ich hab natürlich nicht vergessen, dass wir die Beute teilen.","","","False","DIA_Biff_MEHRGELD_07_02","",""
"Scripts/Content/Story/Dialoge/DIA_DJG_713_Biff.d:586","Deshalb werde ich dich auch nicht so häufig damit nerven, mir mehr Geld zu geben.","","","False","DIA_Biff_MEHRGELD_07_03","",""
"Scripts/Content/Story/Dialoge/DIA_DJG_713_Biff.d:592","Ich will weitere 100 Goldmünzen.","","","False","DIA_Biff_MEHRGELD_07_04","",""
"Scripts/Content/Story/Dialoge/DIA_DJG_713_Biff.d:597","Du bist mir zu teuer.","","","False","DIA_Biff_MEHRGELD.DIA_Biff_MEHRGELD_zuTeuer","Info_AddChoice",""
"Scripts/Content/Story/Dialoge/DIA_DJG_713_Biff.d:598","In Ordnung. Du bist es wert.","","","False","DIA_Biff_MEHRGELD.DIA_Biff_MEHRGELD_ok","Info_AddChoice",""
"Scripts/Content/Story/Dialoge/DIA_DJG_713_Biff.d:603","In Ordnung. Du bist es wert.","","","False","DIA_Biff_MEHRGELD_ok_15_00","",""
"Scripts/Content/Story/Dialoge/DIA_DJG_713_Biff.d:607","Das will ich meinen. Dann also weiter.","","","False","DIA_Biff_MEHRGELD_ok_07_01","",""
"Scripts/Content/Story/Dialoge/DIA_DJG_713_Biff.d:620","Du armer Schlucker kannst ja nicht mal einen Waffenknecht bezahlen.","","","False","DIA_Biff_MEHRGELD_ok_07_02","",""
"Scripts/Content/Story/Dialoge/DIA_DJG_713_Biff.d:621","Ich such mir lieber einen anderen Geschäftspartner.","","","False","DIA_Biff_MEHRGELD_ok_07_03","",""
"Scripts/Content/Story/Dialoge/DIA_DJG_713_Biff.d:634","Du bist mir zu teuer.","","","False","DIA_Biff_MEHRGELD_zuTeuer_15_00","",""
"Scripts/Content/Story/Dialoge/DIA_DJG_713_Biff.d:635","Dann mach gefälligst deinen Dreck von jetzt an alleine.","","","False","DIA_Biff_MEHRGELD_zuTeuer_07_01","",""
"Scripts/Content/Story/Dialoge/DIA_DJG_713_Biff.d:654","Brauchst du Heilung?","","","False","DIA_Biff_HEILUNG.description","",""
"Scripts/Content/Story/Dialoge/DIA_DJG_713_Biff.d:667","Brauchst du Heilung?","","","False","DIA_Biff_HEILUNG_15_00","",""
"Scripts/Content/Story/Dialoge/DIA_DJG_713_Biff.d:668","Klar. Schaden kann's nicht.","","","False","DIA_Biff_HEILUNG_07_01","",""
"Scripts/Content/Story/Dialoge/DIA_DJG_713_Biff.d:671","Ich werde dir später etwas geben.","","","False","DIA_Biff_HEILUNG.DIA_Biff_HEILUNG_spaeter","Info_AddChoice",""
"Scripts/Content/Story/Dialoge/DIA_DJG_713_Biff.d:672","(den kleinsten Heiltrank.)","","","False","DIA_Biff_HEILUNG.DIA_Biff_HEILUNG_heiltrankLow","Info_AddChoice",""
"Scripts/Content/Story/Dialoge/DIA_DJG_713_Biff.d:673","(den besten Heiltrank.)","","","False","DIA_Biff_HEILUNG.DIA_Biff_HEILUNG_heiltrank","Info_AddChoice",""
"Scripts/Content/Story/Dialoge/DIA_DJG_713_Biff.d:692","Ich schätze, ich muss warten, bis du einen übrig hast.","","","False","DIA_Biff_HEILUNG_heiltrank_07_00","",""
"Scripts/Content/Story/Dialoge/DIA_DJG_713_Biff.d:714","Im Moment hast du leider keinen. Ich komm später noch mal darauf zurück.","","","False","DIA_Biff_HEILUNG_heiltrankLow_07_00","",""
"Scripts/Content/Story/Dialoge/DIA_DJG_713_Biff.d:722","Ich werde dir später etwas geben.","","","False","DIA_Biff_HEILUNG_spaeter_15_00","",""
"Scripts/Content/Story/Dialoge/DIA_DJG_713_Biff.d:723","Vergiss es aber nicht.","","","False","DIA_Biff_HEILUNG_spaeter_07_01","",""
"Scripts/Content/Story/Dialoge/DIA_DJG_713_Biff.d:737","Das wäre geschafft. Alle Drachen sind tot.","","","False","DIA_Biff_DRACHENTOT.description","",""
"Scripts/Content/Story/Dialoge/DIA_DJG_713_Biff.d:750","Das wäre geschafft. Alle Drachen sind tot.","","","False","DIA_Biff_DRACHENTOT_15_00","",""
"Scripts/Content/Story/Dialoge/DIA_DJG_713_Biff.d:751","Ja. Und ich stehe noch.","","","False","DIA_Biff_DRACHENTOT_07_01","",""
"Scripts/Content/Story/Dialoge/DIA_DJG_713_Biff.d:752","Bist du dir sicher, dass es der letzte war?","","","False","DIA_Biff_DRACHENTOT_07_02","",""
"Scripts/Content/Story/Dialoge/DIA_DJG_713_Biff.d:753","Ich denke schon.","","","False","DIA_Biff_DRACHENTOT_15_03","",""
"Scripts/Content/Story/Dialoge/DIA_DJG_713_Biff.d:754","Schade. Ich war gerade so schön in Fahrt.","","","False","DIA_Biff_DRACHENTOT_07_04","",""
"Scripts/Content/Story/Dialoge/DIA_DJG_713_Biff.d:776","Lust auf eine kleine Weltreise?","","","False","DIA_Biff_KnowWhereEnemy.description","",""
"Scripts/Content/Story/Dialoge/DIA_DJG_713_Biff.d:790","Lust auf eine kleine Weltreise?","","","False","DIA_Biff_KnowWhereEnemy_15_00","",""
"Scripts/Content/Story/Dialoge/DIA_DJG_713_Biff.d:791","Was?","","","False","DIA_Biff_KnowWhereEnemy_07_01","",""
"Scripts/Content/Story/Dialoge/DIA_DJG_713_Biff.d:795","Schon gut. Mein Schiff ist ohnehin schon voll.","","","False","DIA_Biff_KnowWhereEnemy_15_02","",""
"Scripts/Content/Story/Dialoge/DIA_DJG_713_Biff.d:796","Hör auf mich zu verarschen, Mann.","","","False","DIA_Biff_KnowWhereEnemy_07_03","",""
"Scripts/Content/Story/Dialoge/DIA_DJG_713_Biff.d:800","Ich werde Khorinis verlassen und auf einer Insel nach neuen Gegnern suchen.","","","False","DIA_Biff_KnowWhereEnemy_15_04","",""
"Scripts/Content/Story/Dialoge/DIA_DJG_713_Biff.d:803","Aber das nur so am Rande.","","","False","DIA_Biff_KnowWhereEnemy.DIA_Biff_KnowWhereEnemy_No","Info_AddChoice",""
"Scripts/Content/Story/Dialoge/DIA_DJG_713_Biff.d:804","Komm doch mit.","","","False","DIA_Biff_KnowWhereEnemy.DIA_Biff_KnowWhereEnemy_Yes","Info_AddChoice",""
"Scripts/Content/Story/Dialoge/DIA_DJG_713_Biff.d:810","Komm doch mit.","","","False","DIA_Biff_KnowWhereEnemy_Yes_15_00","",""
"Scripts/Content/Story/Dialoge/DIA_DJG_713_Biff.d:811","Mehr Gegner sind mir egal. Ich will ...","","","False","DIA_Biff_KnowWhereEnemy_Yes_07_01","",""
"Scripts/Content/Story/Dialoge/DIA_DJG_713_Biff.d:812","Dort, wo wir hingehen, wird es mehr Gold geben, als du tragen kannst.","","","False","DIA_Biff_KnowWhereEnemy_Yes_15_02","",""
"Scripts/Content/Story/Dialoge/DIA_DJG_713_Biff.d:813","Wenn das so ist, bin ich dabei. Wo geht's hin?","","","False","DIA_Biff_KnowWhereEnemy_Yes_07_03","",""
"Scripts/Content/Story/Dialoge/DIA_DJG_713_Biff.d:814","Wir müssen dich erst mal aus dem Minental heraus holen.","","","False","DIA_Biff_KnowWhereEnemy_Yes_15_04","",""
"Scripts/Content/Story/Dialoge/DIA_DJG_713_Biff.d:815","Kein Problem. Ich bin schon unterwegs. Treff mich am Pass.","","","False","DIA_Biff_KnowWhereEnemy_Yes_07_05","",""
"Scripts/Content/Story/Dialoge/DIA_DJG_713_Biff.d:835","Aber das nur so am Rande.","","","False","DIA_Biff_KnowWhereEnemy_No_15_00","",""
"Scripts/Content/Story/Dialoge/DIA_DJG_713_Biff.d:836","So so. Na dann, viel Spaß.","","","False","DIA_Biff_KnowWhereEnemy_No_07_01","",""
"Scripts/Content/Story/Dialoge/DIA_DJG_713_Biff.d:852","Schaffst du's über den Pass?","","","False","DIA_Biff_Pass.description","",""
"Scripts/Content/Story/Dialoge/DIA_DJG_713_Biff.d:866","Schaffst du's über den Pass?","","","False","DIA_Biff_Pass_15_00","",""
"Scripts/Content/Story/Dialoge/DIA_DJG_713_Biff.d:867","Quatsch hier nicht rum. Geh weiter. Ich will endlich rüber.","","","False","DIA_Biff_Pass_07_01","",""
"Scripts/Content/Story/Dialoge/DIA_DJG_713_Biff_DI.d:47","Und? Wo sind nun die Reichtümer, die du mir versprochen hast?","","","False","DIA_Biff_DI_HALLO_07_00","",""
"Scripts/Content/Story/Dialoge/DIA_DJG_713_Biff_DI.d:51","Was hab ich dir denn vorhin auf See gesagt?","","","False","DIA_Biff_DI_HALLO_15_01","",""
"Scripts/Content/Story/Dialoge/DIA_DJG_713_Biff_DI.d:54","Deine Aufgabe ist erstmal, dieses Schiff zu bewachen.","","","False","DIA_Biff_DI_HALLO_15_02","",""
"Scripts/Content/Story/Dialoge/DIA_DJG_713_Biff_DI.d:55","Ich habe keine Lust zurückzuschwimmen.","","","False","DIA_Biff_DI_HALLO_15_03","",""
"Scripts/Content/Story/Dialoge/DIA_DJG_713_Biff_DI.d:56","So ein Dreck. Wenn ich das gewusst hätte, wäre ich in Khorinis geblieben.","","","False","DIA_Biff_DI_HALLO_07_04","",""
"Scripts/Content/Story/Dialoge/DIA_DJG_713_Biff_DI.d:70","Auf dem Schiff alles klar?","","","False","DIA_Biff_DI_perm.description","",""
"Scripts/Content/Story/Dialoge/DIA_DJG_713_Biff_DI.d:84","Auf dem Schiff alles klar?","","","False","DIA_Biff_DI_perm_15_00","",""
"Scripts/Content/Story/Dialoge/DIA_DJG_713_Biff_DI.d:85","(genervt) Ja, ja. Alles ruhig.","","","False","DIA_Biff_DI_perm_07_01","",""
"Scripts/Content/Story/Dialoge/DIA_DJG_713_Biff_DI.d:113","Diese Drecksviecher!","","","False","DIA_Biff_DI_ORKS_07_00","",""
"Scripts/Content/Story/Dialoge/DIA_DJG_713_Biff_DI.d:114","Was machst du hier oben, verdammt! Du sollst auf das Schiff aufpassen.","","","False","DIA_Biff_DI_ORKS_15_01","",""
"Scripts/Content/Story/Dialoge/DIA_DJG_713_Biff_DI.d:115","Das geht schon nicht unter, Mann.","","","False","DIA_Biff_DI_ORKS_07_02","",""
"Scripts/Content/Story/Dialoge/DIA_DJG_713_Biff_DI.d:143","War's das jetzt?","","","False","DIA_Biff_DI_UNDEADDRGDEAD_07_00","",""
"Scripts/Content/Story/Dialoge/DIA_DJG_713_Biff_DI.d:144","Das war's jetzt.","","","False","DIA_Biff_DI_UNDEADDRGDEAD_15_01","",""
"Scripts/Content/Story/Dialoge/DIA_DJG_713_Biff_DI.d:145","Kann ich mir jetzt ...","","","False","DIA_Biff_DI_UNDEADDRGDEAD_07_02","",""
"Scripts/Content/Story/Dialoge/DIA_DJG_713_Biff_DI.d:146","Von mir aus kannst du die ganze Insel plündern.","","","False","DIA_Biff_DI_UNDEADDRGDEAD_15_03","",""
"Scripts/Content/Story/Dialoge/DIA_DJG_713_Biff_DI.d:147","Klasse.","","","False","DIA_Biff_DI_UNDEADDRGDEAD_07_04","",""
"Scripts/Content/Story/Dialoge/DIA_DJG_713_Biff_DI.d:177","Verdammt. Nicht jetzt.","","","False","DIA_Biff_DI_plunder_07_00","",""
"Scripts/Content/Story/Dialoge/DIA_DJG_713_Biff_NW.d:34","So. Bald geht's los.","","","False","DIA_Biff_NW_HAfen.description","",""
"Scripts/Content/Story/Dialoge/DIA_DJG_713_Biff_NW.d:44","So. Bald geht's los.","","","False","DIA_Biff_NW_HAfen_15_00","",""
"Scripts/Content/Story/Dialoge/DIA_DJG_713_Biff_NW.d:45","Da bin ich ja mal gespannt.","","","False","DIA_Biff_NW_HAfen_07_01","",""
"Scripts/Content/Story/Dialoge/DIA_DJG_714_Jan.d:48","War eine Riesenschnapsidee, hier herzukommen.","","","False","DIA_Jan_Hello_10_00","",""
"Scripts/Content/Story/Dialoge/DIA_DJG_714_Jan.d:49","Ich dachte, hier gibt's was zu holen. Aber hier ist nichts, außer ein paar eingebildeten Paladinen und Orks.","","","False","DIA_Jan_Hello_10_01","",""
"Scripts/Content/Story/Dialoge/DIA_DJG_714_Jan.d:61","Du hast die Drachen vergessen!","","","False","DIA_JAN_Dragons.description","",""
"Scripts/Content/Story/Dialoge/DIA_DJG_714_Jan.d:77","Du hast die Drachen vergessen!","","","False","DIA_Jan_Dragons_15_00","",""
"Scripts/Content/Story/Dialoge/DIA_DJG_714_Jan.d:78","(spöttisch) Wie konnte ich die nur vergessen. Ich sag dir mal was. Ich bin Schmied, kein Kämpfer.","","","False","DIA_Jan_Dragons_10_01","",""
"Scripts/Content/Story/Dialoge/DIA_DJG_714_Jan.d:79","Ich stelle Waffen her, das Kämpfen überlasse ich lieber anderen.","","","False","DIA_Jan_Dragons_10_02","",""
"Scripts/Content/Story/Dialoge/DIA_DJG_714_Jan.d:80","Warum stehst du dann nicht hinter dem Amboss?","","","False","DIA_Jan_Dragons_15_03","",""
"Scripts/Content/Story/Dialoge/DIA_DJG_714_Jan.d:81","Die Paladine hier lassen mich nicht in die Schmiede. Ich darf hier nichts machen, sonst wandere ich direkt in den Kerker.","","","False","DIA_Jan_Dragons_10_04","",""
"Scripts/Content/Story/Dialoge/DIA_DJG_714_Jan.d:85","Du gehörst doch auch zu dem Verein. Du könntest eigentlich mal ein gutes Wort für mich einlegen.","","","False","DIA_Jan_Dragons_10_05","",""
"Scripts/Content/Story/Dialoge/DIA_DJG_714_Jan.d:89","Ich muß weiter.","","","False","DIA_JAN_Dragons.DIA_JAN_Dragons_ShitHappen","Info_AddChoice",""
"Scripts/Content/Story/Dialoge/DIA_DJG_714_Jan.d:90","Was krieg ich, wenn ich dir helfe?","","","False","DIA_JAN_Dragons.DIA_JAN_Dragons_Reward","Info_AddChoice",""
"Scripts/Content/Story/Dialoge/DIA_DJG_714_Jan.d:91","Ich werde versuche dir zu helfen.","","","False","DIA_JAN_Dragons.DIA_JAN_Dragons_HelpYou","Info_AddChoice",""
"Scripts/Content/Story/Dialoge/DIA_DJG_714_Jan.d:96","Ich werde versuchen, dir zu helfen.","","","False","DIA_JAN_Dragons_HelpYou_15_00","",""
"Scripts/Content/Story/Dialoge/DIA_DJG_714_Jan.d:97","Wie willst du das denn erreichen? Parcival hat befohlen, uns im Auge zu behalten.","","","False","DIA_JAN_Dragons_HelpYou_10_01","",""
"Scripts/Content/Story/Dialoge/DIA_DJG_714_Jan.d:98","Niemand wird wagen, sich darüber hinwegzusetzen.","","","False","DIA_JAN_Dragons_HelpYou_10_02","",""
"Scripts/Content/Story/Dialoge/DIA_DJG_714_Jan.d:99","Ich werde versuchen, was ich kann.","","","False","DIA_JAN_Dragons_HelpYou_15_03","",""
"Scripts/Content/Story/Dialoge/DIA_DJG_714_Jan.d:100","Ich kann mir nicht vorstellen, dass er auf dich hört.","","","False","DIA_JAN_Dragons_HelpYou_10_04","",""
"Scripts/Content/Story/Dialoge/DIA_DJG_714_Jan.d:112","Was kriege ich, wenn ich dir helfe?","","","False","DIA_JAN_Dragons_Reward_15_00","",""
"Scripts/Content/Story/Dialoge/DIA_DJG_714_Jan.d:113","Ich habe nichts. Ich könnte dir höchstens etwas beibringen.","","","False","DIA_JAN_Dragons_Reward_10_01","",""
"Scripts/Content/Story/Dialoge/DIA_DJG_714_Jan.d:117","Ich kenne eine Methode, wie man Klingen aus magischem Erz noch härter machen kann.","","","False","DIA_JAN_Dragons_Reward_10_02","",""
"Scripts/Content/Story/Dialoge/DIA_DJG_714_Jan.d:125","Ich muss weiter.","","","False","DIA_JAN_Dragons_ShitHappen_15_00","",""
"Scripts/Content/Story/Dialoge/DIA_DJG_714_Jan.d:126","Großartig. Ich komme nicht mehr aus der Burg raus und schmieden kann ich auch nicht.","","","False","DIA_JAN_Dragons_ShitHappen_10_01","",""
"Scripts/Content/Story/Dialoge/DIA_DJG_714_Jan.d:140","Wo kommst du her?","","","False","DIA_JAN_Home.description","",""
"Scripts/Content/Story/Dialoge/DIA_DJG_714_Jan.d:155","Wo kommst du her?","","","False","DIA_Jan_Home_15_00","",""
"Scripts/Content/Story/Dialoge/DIA_DJG_714_Jan.d:156","Ich hab mich ein paar Männern aus den Bergen angeschlossen. Wir wollten ins Tal und bei der Drachenjagd richtig Gewinn machen.","","","False","DIA_Jan_Home_10_01","",""
"Scripts/Content/Story/Dialoge/DIA_DJG_714_Jan.d:157","Ihr Anführer hieß Sylvio. Junge, war das ein Arsch. Er hat mich behandelt, als wäre ich sein Eigentum.","","","False","DIA_Jan_Home_10_02","",""
"Scripts/Content/Story/Dialoge/DIA_DJG_714_Jan.d:170","Was ist in der Burg alles passiert?","","","False","DIA_JAN_OldCamp.description","",""
"Scripts/Content/Story/Dialoge/DIA_DJG_714_Jan.d:185","Was ist in der Burg alles passiert?","","","False","DIA_Jan_OldCamp_15_00","",""
"Scripts/Content/Story/Dialoge/DIA_DJG_714_Jan.d:186","Nichts, was ich mitbekommen hätte. Allerdings mach ich mir Sorgen über das, was VOR der Burg passiert ist.","","","False","DIA_Jan_OldCamp_10_01","",""
"Scripts/Content/Story/Dialoge/DIA_DJG_714_Jan.d:198","Ich hab mit Parcival geredet.","","","False","DIA_JAN_Parcival.description","",""
"Scripts/Content/Story/Dialoge/DIA_DJG_714_Jan.d:213","Ich hab mit Parcival geredet.","","","False","DIA_Jan_Parcival_15_00","",""
"Scripts/Content/Story/Dialoge/DIA_DJG_714_Jan.d:214","Und?","","","False","DIA_Jan_Parcival_10_01","",""
"Scripts/Content/Story/Dialoge/DIA_DJG_714_Jan.d:218","Er traut uns Drachenjägern nicht.","","","False","DIA_Jan_Parcival_15_02","",""
"Scripts/Content/Story/Dialoge/DIA_DJG_714_Jan.d:222","Er traut euch Drachenjägern nicht.","","","False","DIA_Jan_Parcival_15_03","",""
"Scripts/Content/Story/Dialoge/DIA_DJG_714_Jan.d:225","Verdammt. Ich will doch nur arbeiten.","","","False","DIA_Jan_Parcival_10_04","",""
"Scripts/Content/Story/Dialoge/DIA_DJG_714_Jan.d:226","Dann kann ich das wohl aufgeben. Nur Garond könnte mir weiterhelfen.","","","False","DIA_Jan_Parcival_10_05","",""
"Scripts/Content/Story/Dialoge/DIA_DJG_714_Jan.d:238","Hol deinen Hammer, du hast Arbeit.","","","False","DIA_JAN_JanIsSmith.description","",""
"Scripts/Content/Story/Dialoge/DIA_DJG_714_Jan.d:252","Hol deinen Hammer, du hast Arbeit.","","","False","DIA_Jan_JanIsSmith_15_00","",""
"Scripts/Content/Story/Dialoge/DIA_DJG_714_Jan.d:253","Du hast es geschafft? Wie hast du das denn angestellt?","","","False","DIA_Jan_JanIsSmith_10_01","",""
"Scripts/Content/Story/Dialoge/DIA_DJG_714_Jan.d:254","Ich musste für dich bürgen, also enttäusch mich nicht.","","","False","DIA_Jan_JanIsSmith_15_02","",""
"Scripts/Content/Story/Dialoge/DIA_DJG_714_Jan.d:255","Du kannst ganz beruhigt sein. Ich bin froh, dass ich überhaupt arbeiten kann.","","","False","DIA_Jan_JanIsSmith_10_03","",""
"Scripts/Content/Story/Dialoge/DIA_DJG_714_Jan.d:271","Verkaufst du Waffen?","","","False","DIA_JAN_SellWeapons.description","",""
"Scripts/Content/Story/Dialoge/DIA_DJG_714_Jan.d:287","Verkaufst du Waffen?","","","False","DIA_Jan_SellWeapons_15_00","",""
"Scripts/Content/Story/Dialoge/DIA_DJG_714_Jan.d:291","Von wegen. Und dann werde ich wegen Schwarzhandel von deinen Kollegen hier in den Knast gesteckt, was? Ne, lass das mal.","","","False","DIA_Jan_SellWeapons_10_01","",""
"Scripts/Content/Story/Dialoge/DIA_DJG_714_Jan.d:295","Ich würde, wenn ich könnte. Doch zunächst muss ich die Paladine hier in der Burg mit Waffen versorgen.","","","False","DIA_Jan_SellWeapons_10_02","",""
"Scripts/Content/Story/Dialoge/DIA_DJG_714_Jan.d:298","Aber ich kann dir zeigen, wie du selber deine Waffe schmieden kannst.","","","False","DIA_Jan_SellWeapons_10_03","",""
"Scripts/Content/Story/Dialoge/DIA_DJG_714_Jan.d:313","Bring mir Schmieden bei.","","","False","Jan_Training_Talente.description","",""
"Scripts/Content/Story/Dialoge/DIA_DJG_714_Jan.d:328","Bring mir Schmieden bei.","","","False","DIA_Jan_TeachPlayer_15_00","",""
"Scripts/Content/Story/Dialoge/DIA_DJG_714_Jan.d:329","Was genau willst du schmieden?","","","False","DIA_Jan_TeachPlayer_10_01","",""
"Scripts/Content/Story/Dialoge/DIA_DJG_714_Jan.d:416","Kann ich bei dir eine Rüstung kaufen?","","","False","DIA_JAN_SellArmor.description","",""
"Scripts/Content/Story/Dialoge/DIA_DJG_714_Jan.d:432","Kann ich bei dir eine Rüstung kaufen?","","","False","DIA_Jan_SellArmor_15_00","",""
"Scripts/Content/Story/Dialoge/DIA_DJG_714_Jan.d:436","Nichts, was besser wäre als deine Rüstung. Also sollten wir das lassen.","","","False","DIA_Jan_SellArmor_10_01","",""
"Scripts/Content/Story/Dialoge/DIA_DJG_714_Jan.d:440","Ein Magier, der eine Rüstung haben will? Nein, du solltest einen Schneider aufsuchen. Ich kann dir keine Rüstung machen.","","","False","DIA_Jan_SellArmor_10_02","",""
"Scripts/Content/Story/Dialoge/DIA_DJG_714_Jan.d:444","Wenn ich welche hätte, würde ich sie dir verkaufen. Leider habe ich keine.","","","False","DIA_Jan_SellArmor_10_03","",""
"Scripts/Content/Story/Dialoge/DIA_DJG_714_Jan.d:447","Da kann man wohl nichts machen.","","","False","DIA_JAN_SellArmor.DIA_JAN_SellArmor_Sorry","Info_AddChoice",""
"Scripts/Content/Story/Dialoge/DIA_DJG_714_Jan.d:448","Kannst du mir denn eine anfertigen?","","","False","DIA_JAN_SellArmor.DIA_JAN_SellArmor_BuildOne","Info_AddChoice",""
"Scripts/Content/Story/Dialoge/DIA_DJG_714_Jan.d:454","Da kann man wohl nichts machen.","","","False","DIA_JAN_SellArmor_Sorry_15_00","",""
"Scripts/Content/Story/Dialoge/DIA_DJG_714_Jan.d:455","Wenn du doch was hast, melde dich einfach wieder bei mir.","","","False","DIA_JAN_SellArmor_Sorry_10_01","",""
"Scripts/Content/Story/Dialoge/DIA_DJG_714_Jan.d:462","Kannst du mir denn eine anfertigen?","","","False","DIA_JAN_SellArmor_BuildOne_15_00","",""
"Scripts/Content/Story/Dialoge/DIA_DJG_714_Jan.d:463","Nun, wenn du was Besseres haben willst, musst du mir schon die Materialen beschaffen.","","","False","DIA_JAN_SellArmor_BuildOne_10_01","",""
"Scripts/Content/Story/Dialoge/DIA_DJG_714_Jan.d:464","Was brauchst du?","","","False","DIA_JAN_SellArmor_BuildOne_15_02","",""
"Scripts/Content/Story/Dialoge/DIA_DJG_714_Jan.d:465","Du willst doch gegen die Drachen kämpfen. Bring mir Drachenschuppen, damit müsste ich dir was zusammenzimmern können.","","","False","DIA_JAN_SellArmor_BuildOne_10_03","",""
"Scripts/Content/Story/Dialoge/DIA_DJG_714_Jan.d:466","20 Stück sollten reichen.","","","False","DIA_JAN_SellArmor_BuildOne_10_04","",""
"Scripts/Content/Story/Dialoge/DIA_DJG_714_Jan.d:486","Ich habe die Drachenschuppen für dich.","","","False","DIA_JAN_Dragonscales.description","",""
"Scripts/Content/Story/Dialoge/DIA_DJG_714_Jan.d:505","Ich habe die Drachenschuppen für dich.","","","False","DIA_JAN_Dragonscales_15_00","",""
"Scripts/Content/Story/Dialoge/DIA_DJG_714_Jan.d:509","Gut, damit wird sich was machen lassen.","","","False","DIA_JAN_Dragonscales_10_01","",""
"Scripts/Content/Story/Dialoge/DIA_DJG_714_Jan.d:510","Komm morgen wieder, dann sollte das Teil eigentlich fertig sein.","","","False","DIA_JAN_Dragonscales_10_02","",""
"Scripts/Content/Story/Dialoge/DIA_DJG_714_Jan.d:522","Ich brauche 20 Drachenschuppen, sonst kann ich dir keine Rüstung bauen.","","","False","DIA_JAN_Dragonscales_10_03","",""
"Scripts/Content/Story/Dialoge/DIA_DJG_714_Jan.d:541","Ist die Rüstung fertig?","","","False","DIA_JAN_ArmorReady.description","",""
"Scripts/Content/Story/Dialoge/DIA_DJG_714_Jan.d:556","Ist die Rüstung fertig?","","","False","DIA_JAN_ArmorReady_15_00","",""
"Scripts/Content/Story/Dialoge/DIA_DJG_714_Jan.d:559","Nein, noch nicht. Komm morgen wieder.","","","False","DIA_JAN_ArmorReady_10_01","",""
"Scripts/Content/Story/Dialoge/DIA_DJG_714_Jan.d:563","Ja, ein wahres Prachtstück. Wenn du willst, kannst du sie kaufen.","","","False","DIA_JAN_ArmorReady_10_02","",""
"Scripts/Content/Story/Dialoge/DIA_DJG_714_Jan.d:564","Für dich mach ich einen Freundschaftspreis. 12000 Goldstücke.","","","False","DIA_JAN_ArmorReady_10_03","",""
"Scripts/Content/Story/Dialoge/DIA_DJG_714_Jan.d:565","Was? Nach allem, was ich für dich getan habe?","","","False","DIA_JAN_ArmorReady_15_04","",""
"Scripts/Content/Story/Dialoge/DIA_DJG_714_Jan.d:566","Komm mir nicht so. Irgend wovon muss ich ja auch leben. Also kauf sie, oder lass es bleiben.","","","False","DIA_JAN_ArmorReady_10_05","",""
