"location","source","target","id","fuzzy","context","translator_comments","developer_comments"
"Scripts/Content/Story/Dialoge/DIA_DJG_700_Sylvio.d:56","Jetzt brat mir doch einer 'nen Storch. Auch auf der Suche nach Profit, was? Ich wusste es doch! Doch 'ne Söldnerseele.","嗯 ， 我 会 遭 到 谴 责 的 。 想 发 财 ， 嗯 ？ 我 就 知 道 ！ 你 有 雇 佣 兵 的 精 神 。","","False","DIA_SylvioDJG_HelloAgain_09_00","",""
"Scripts/Content/Story/Dialoge/DIA_DJG_700_Sylvio.d:57","Hör zu, wenn du meinst, dass du hier absahnen kannst, dann bist du schief gewickelt. Ich war zuerst hier.","听 着 ， 如 果 你 以 为 能 在 这 里 发 财 ， 那 就 彻 底 错 了 。 我 先 到 这 里 的 。","","False","DIA_SylvioDJG_HelloAgain_09_01","",""
"Scripts/Content/Story/Dialoge/DIA_DJG_700_Sylvio.d:61","Hey du! Magier machen mich immer nervös! Geh woanders hin! Hier gibt's nichts zu holen.","嘿 ， 你 ！ 魔 法 师 让 我 感 到 不 安 ！ 去 别 的 地 方 ！ 这 里 什 么 都 没 有 。","","False","DIA_SylvioDJG_HelloAgain_09_02","",""
"Scripts/Content/Story/Dialoge/DIA_DJG_700_Sylvio.d:65","Hey du, Paladin! Geh wieder zu deiner Erzmine. Hier gibt's nichts zu holen.","嘿 ， 你 ， 圣 骑 士 ！ 回 你 的 矿 井 去 。 这 里 没 东 西 。","","False","DIA_SylvioDJG_HelloAgain_09_03","",""
"Scripts/Content/Story/Dialoge/DIA_DJG_700_Sylvio.d:68","Schon klar. Wer gibt schon gerne seine Beute her.","明 白 。 没 人 愿 意 放 弃 他 的 利 益 。","","False","DIA_SylvioDJG_HelloAgain_15_04","",""
"Scripts/Content/Story/Dialoge/DIA_DJG_700_Sylvio.d:69","Du sagst es. Verschwinde.","你 说 对 了 。 走 开 。","","False","DIA_SylvioDJG_HelloAgain_09_05","",""
"Scripts/Content/Story/Dialoge/DIA_DJG_700_Sylvio.d:81","Und wenn ich nicht gehe?","如 果 我 没 走 呢 ？","","False","DIA_Sylvio_VERSAGER.description","",""
"Scripts/Content/Story/Dialoge/DIA_DJG_700_Sylvio.d:95","Und wenn ich nicht gehe?","如 果 我 没 走 呢 ？","","False","DIA_Sylvio_VERSAGER_15_00","",""
"Scripts/Content/Story/Dialoge/DIA_DJG_700_Sylvio.d:96","Jetzt spiel hier nicht den starken Mann, du Würstchen, sonst geht es dir wie den armen Schweinen, die dahinten tot im Schnee liegen.","别 在 这 里 装 大 人 物 ， 年 青 人 ， 否 则 你 就 会 象 躺 在 那 边 雪 地 里 的 可 怜 混 蛋 一 样 完 蛋 。","","False","DIA_Sylvio_VERSAGER_09_01","",""
"Scripts/Content/Story/Dialoge/DIA_DJG_700_Sylvio.d:108","Das waren deine Leute?","那 些 是 你 的 人 ？","","False","DIA_Sylvio_DEINELEUTE.description","",""
"Scripts/Content/Story/Dialoge/DIA_DJG_700_Sylvio.d:123","Das waren deine Leute?","那 些 是 你 的 人 ？","","False","DIA_Sylvio_DEINELEUTE_15_00","",""
"Scripts/Content/Story/Dialoge/DIA_DJG_700_Sylvio.d:124","Jetzt nicht mehr. Ist kein großer Verlust. Die Idioten haben sowieso nichts getaugt.","不 要 再 来 一 次 了 。 没 什 么 大 损 失 。 那 些 白 痴 们 根 本 不 值 那 个 价 。","","False","DIA_Sylvio_DEINELEUTE_09_01","",""
"Scripts/Content/Story/Dialoge/DIA_DJG_700_Sylvio.d:136","Was ist mit ihnen passiert?","他 们 怎 么 了 ？","","False","DIA_Sylvio_WASISTPASSIERT.description","",""
"Scripts/Content/Story/Dialoge/DIA_DJG_700_Sylvio.d:150","Was ist mit ihnen passiert?","他 们 怎 么 了 ？","","False","DIA_Sylvio_WASISTPASSIERT_15_00","",""
"Scripts/Content/Story/Dialoge/DIA_DJG_700_Sylvio.d:151","Sie haben es nicht geschafft, an den dicken Eisriesen da hinten vorbeizukommen und sind von ihnen überrannt worden.","他 们 连 那 边 的 冰 巨 人 都 过 不 去 ， 还 被 它 们 消 灭 了 。","","False","DIA_Sylvio_WASISTPASSIERT_09_01","",""
"Scripts/Content/Story/Dialoge/DIA_DJG_700_Sylvio.d:152","Wenn du so ein harter Bursche bist, warum versuchst du es nicht mal?","如 果 你 真 是 这 样 的 硬 汉 的 话 ， 为 什 么 你 不 去 试 试 ？","","False","DIA_Sylvio_WASISTPASSIERT_09_02","",""
"Scripts/Content/Story/Dialoge/DIA_DJG_700_Sylvio.d:154","Na gut. Warum nicht.","那 好 吧 。 为 什 么 不 呢 ？","","False","DIA_Sylvio_WASISTPASSIERT.DIA_Sylvio_WASISTPASSIERT_ok","Info_AddChoice",""
"Scripts/Content/Story/Dialoge/DIA_DJG_700_Sylvio.d:155","Was hast du davon, wenn ich es tun würde?","如 果 我 这 么 做 会 帮 你 什 么 忙 ？","","False","DIA_Sylvio_WASISTPASSIERT.DIA_Sylvio_WASISTPASSIERT_washastdudavon","Info_AddChoice",""
"Scripts/Content/Story/Dialoge/DIA_DJG_700_Sylvio.d:156","Was springt für mich dabei raus?","我 有 什 么 好 处 ？","","False","DIA_Sylvio_WASISTPASSIERT.DIA_Sylvio_WASISTPASSIERT_warum","Info_AddChoice",""
"Scripts/Content/Story/Dialoge/DIA_DJG_700_Sylvio.d:157","Warum räumst du sie nicht selbst weg?","为 什 么 你 不 亲 自 消 灭 他 们 ？","","False","DIA_Sylvio_WASISTPASSIERT.DIA_Sylvio_WASISTPASSIERT_selbst","Info_AddChoice",""
"Scripts/Content/Story/Dialoge/DIA_DJG_700_Sylvio.d:168","Warum räumst du sie nicht selbst weg?","为 什 么 你 不 亲 自 消 灭 他 们 ？","","False","DIA_Sylvio_WASISTPASSIERT_selbst_15_00","",""
"Scripts/Content/Story/Dialoge/DIA_DJG_700_Sylvio.d:169","Komm, komm. Jetzt blas dich mal nicht so auf.","喂 ， 喂 。 不 要 那 么 吹 嘘 你 自 己 。","","False","DIA_Sylvio_WASISTPASSIERT_selbst_09_01","",""
"Scripts/Content/Story/Dialoge/DIA_DJG_700_Sylvio.d:170","Wenn du mich fragst, hast du die Hosen gestrichen voll.","我 认 为 ， 你 已 经 吓 的 要 命 了 。","","False","DIA_Sylvio_WASISTPASSIERT_selbst_09_02","",""
"Scripts/Content/Story/Dialoge/DIA_DJG_700_Sylvio.d:172","Ich lass´ mich auf deine Spielchen nicht ein.","我 不 会 玩 你 的 小 游 戏 。","","False","DIA_Sylvio_WASISTPASSIERT.DIA_Sylvio_WASISTPASSIERT_keinInteresse","Info_AddChoice",""
"Scripts/Content/Story/Dialoge/DIA_DJG_700_Sylvio.d:178","Was springt für mich dabei raus?","我 有 什 么 好 处 ？","","False","DIA_Sylvio_WASISTPASSIERT_warum_15_00","",""
"Scripts/Content/Story/Dialoge/DIA_DJG_700_Sylvio.d:179","Weiß nicht. Sagen wir ... 1000 Goldmünzen. Ist das nichts?","我 不 知 道 。 比 如 说 … …1000枚 金 币 。 听 起 来 怎 么 样 ？","","False","DIA_Sylvio_WASISTPASSIERT_warum_09_01","",""
"Scripts/Content/Story/Dialoge/DIA_DJG_700_Sylvio.d:186","Was hast du davon, wenn ich es tun würde?","如 果 我 这 么 做 会 帮 你 什 么 忙 ？","","False","DIA_Sylvio_WASISTPASSIERT_washastdudavon_15_00","",""
"Scripts/Content/Story/Dialoge/DIA_DJG_700_Sylvio.d:187","Das kann dir doch egal sein. Aber um deine Frage zu beantworten, ich will in die Eisregion.","你 们 都 是 一 个 样 。 但 是 我 回 答 你 的 问 题 ， 我 想 要 进 入 冰 封 地 区 。","","False","DIA_Sylvio_WASISTPASSIERT_washastdudavon_09_01","",""
"Scripts/Content/Story/Dialoge/DIA_DJG_700_Sylvio.d:188","Dummerweise stehen mir diese verdammten Dinger im Weg.","不 幸 的 是 ， 那 些 该 死 的 东 西 挡 住 了 我 的 路 。","","False","DIA_Sylvio_WASISTPASSIERT_washastdudavon_09_02","",""
"Scripts/Content/Story/Dialoge/DIA_DJG_700_Sylvio.d:190","Was willst du in der Eisregion?","你 想 在 冰 封 地 区 做 什 么 ？","","False","DIA_Sylvio_WASISTPASSIERT.DIA_Sylvio_WASISTPASSIERT_Eisregion","Info_AddChoice",""
"Scripts/Content/Story/Dialoge/DIA_DJG_700_Sylvio.d:195","Ich lass mich auf deine Spielchen nicht ein.","我 不 会 玩 你 的 小 游 戏 。","","False","DIA_Sylvio_WASISTPASSIERT_keinInteresse_NEIN_15_00","",""
"Scripts/Content/Story/Dialoge/DIA_DJG_700_Sylvio.d:196","Ach. Dann verschwinde doch, du Feigling.","啊 。 那 么 滚 出 去 ， 你 这 懦 夫 。","","False","DIA_Sylvio_WASISTPASSIERT_keinInteresse_NEIN_09_01","",""
"Scripts/Content/Story/Dialoge/DIA_DJG_700_Sylvio.d:203","Was willst du in der Eisregion?","你 想 在 冰 封 地 区 做 什 么 ？","","False","DIA_Sylvio_WASISTPASSIERT_keinInteresse_15_00","",""
"Scripts/Content/Story/Dialoge/DIA_DJG_700_Sylvio.d:204","Du hörst nicht auf zu fragen, was? Na gut, ich werde es dir verraten.","你 不 会 停 止 问 问 题 的 ， 是 吗 ？ 好 吧 ， 那 我 会 告 诉 你 。","","False","DIA_Sylvio_WASISTPASSIERT_keinInteresse_09_01","",""
"Scripts/Content/Story/Dialoge/DIA_DJG_700_Sylvio.d:205","Hier, hinter diesen Felsen findest du ein Ödland aus Eis, wie du es noch nicht gesehen hast.","这 里 ， 在 这 些 悬 崖 的 后 面 ， 是 一 片 你 以 前 从 未 见 过 的 冰 封 荒 地 。","","False","DIA_Sylvio_WASISTPASSIERT_keinInteresse_09_02","",""
"Scripts/Content/Story/Dialoge/DIA_DJG_700_Sylvio.d:206","Dort verbirgt sich ein Schmuckstück von einem Eisdrachen mit seinem fetten Hort.","一 头 稀 有 的 冰 龙 和 它 巨 大 的 宝 藏 就 藏 在 那 里 。","","False","DIA_Sylvio_WASISTPASSIERT_keinInteresse_09_03","",""
"Scripts/Content/Story/Dialoge/DIA_DJG_700_Sylvio.d:207","Den will ich. Also, was ist jetzt? Ja oder nein?","我 想 要 它 。 那 么 怎 么 决 定 ？ 是 还 是 否 ？","","False","DIA_Sylvio_WASISTPASSIERT_keinInteresse_09_04","",""
"Scripts/Content/Story/Dialoge/DIA_DJG_700_Sylvio.d:212","Na gut. Warum nicht.","那 好 吧 。 为 什 么 不 呢 ？","","False","DIA_Sylvio_WASISTPASSIERT_ok_15_00","",""
"Scripts/Content/Story/Dialoge/DIA_DJG_700_Sylvio.d:213","Dann beeil dich. Ich hab nicht den ganzen Tag Zeit.","那 就 赶 快 。 我 时 间 不 多 。","","False","DIA_Sylvio_WASISTPASSIERT_ok_09_01","",""
"Scripts/Content/Story/Dialoge/DIA_DJG_700_Sylvio.d:227","Der Weg ist frei!","你 的 道 路 已 经 肃 清 了 ！ 你 的 冰 巨 人 没 有 了 。","","False","DIA_Sylvio_ICEGOLEMSKILLED.description","",""
"Scripts/Content/Story/Dialoge/DIA_DJG_700_Sylvio.d:243","Der Weg ist frei! Deine Eisriesen sind nicht mehr.","你 的 道 路 已 经 肃 清 了 ！ 你 的 冰 巨 人 没 有 了 。","","False","DIA_Sylvio_ICEGOLEMSKILLED_15_00","",""
"Scripts/Content/Story/Dialoge/DIA_DJG_700_Sylvio.d:244","Gute Arbeit. Dann lass doch mal sehen, was wir da haben.","干 的 不 错 。 我 们 看 看 弄 到 了 什 么 。","","False","DIA_Sylvio_ICEGOLEMSKILLED_09_01","",""
"Scripts/Content/Story/Dialoge/DIA_DJG_700_Sylvio.d:248","Moment. Was ist mit dem Geld?","等 一 下 。 钱 怎 么 办 ？","","False","DIA_Sylvio_ICEGOLEMSKILLED_15_02","",""
"Scripts/Content/Story/Dialoge/DIA_DJG_700_Sylvio.d:249","Alles zu seiner Zeit.","一 切 顺 利 。","","False","DIA_Sylvio_ICEGOLEMSKILLED_09_03","",""
"Scripts/Content/Story/Dialoge/DIA_DJG_700_Sylvio.d:269","Was jetzt?","下 面 是 什 么 ？","","False","DIA_Sylvio_WASJETZT.description","",""
"Scripts/Content/Story/Dialoge/DIA_DJG_700_Sylvio.d:283","Was jetzt?","下 面 是 什 么 ？","","False","DIA_Sylvio_WASJETZT_15_00","",""
"Scripts/Content/Story/Dialoge/DIA_DJG_700_Sylvio.d:284","Tja. Sieht übel aus, würde ich sagen.","嗯 。 我 得 说 他 看 起 来 非 常 糟 糕 。","","False","DIA_Sylvio_WASJETZT_09_01","",""
"Scripts/Content/Story/Dialoge/DIA_DJG_700_Sylvio.d:285","Am besten du gehst vor und ich folge dir einfach.","最 好 是 你 走 在 前 面 ， 我 紧 跟 着 你 。","","False","DIA_Sylvio_WASJETZT_09_02","",""
"Scripts/Content/Story/Dialoge/DIA_DJG_700_Sylvio.d:287","Von mir aus.","那 好 。","","False","DIA_Sylvio_WASJETZT.DIA_Sylvio_WASJETZT_ok","Info_AddChoice",""
"Scripts/Content/Story/Dialoge/DIA_DJG_700_Sylvio.d:288","Hast du Angst?","你 害 怕 了 ？","","False","DIA_Sylvio_WASJETZT.DIA_Sylvio_WASJETZT_trennen","Info_AddChoice",""
"Scripts/Content/Story/Dialoge/DIA_DJG_700_Sylvio.d:289","Ich mach nicht die Drecksarbeit für dich.","我 不 会 为 你 做 那 些 卑 鄙 的 事 情 。","","False","DIA_Sylvio_WASJETZT.DIA_Sylvio_WASJETZT_nein","Info_AddChoice",""
"Scripts/Content/Story/Dialoge/DIA_DJG_700_Sylvio.d:292","Erst will ich mein Geld sehen.","首 先 ， 我 要 看 到 我 的 钱 。","","False","DIA_Sylvio_WASJETZT.DIA_Sylvio_WASJETZT_Geld","Info_AddChoice",""
"Scripts/Content/Story/Dialoge/DIA_DJG_700_Sylvio.d:298","Hast du Angst?","你 害 怕 了 ？","","False","DIA_Sylvio_WASJETZT_trennen_15_00","",""
"Scripts/Content/Story/Dialoge/DIA_DJG_700_Sylvio.d:299","Quatsch hier keinen Blödsinn. Jetzt lauf.","胡 扯 ， 不 要 再 说 傻 话 了 。 现 在 行 动 。","","False","DIA_Sylvio_WASJETZT_trennen_09_01","",""
"Scripts/Content/Story/Dialoge/DIA_DJG_700_Sylvio.d:304","Von mir aus.","那 好 。","","False","DIA_Sylvio_WASJETZT_ok_15_00","",""
"Scripts/Content/Story/Dialoge/DIA_DJG_700_Sylvio.d:305","Na dann los. Hopp Hopp.","嗯 ， 继 续 。 开 始 做 事 。","","False","DIA_Sylvio_WASJETZT_ok_09_01","",""
"Scripts/Content/Story/Dialoge/DIA_DJG_700_Sylvio.d:312","Ich mach nicht die Drecksarbeit für dich.","我 不 会 为 你 做 那 些 卑 鄙 的 事 情 。","","False","DIA_Sylvio_WASJETZT_nein_15_00","",""
"Scripts/Content/Story/Dialoge/DIA_DJG_700_Sylvio.d:313","Feigling!","懦 夫 ！","","False","DIA_Sylvio_WASJETZT_nein_09_01","",""
"Scripts/Content/Story/Dialoge/DIA_DJG_700_Sylvio.d:320","Erst will ich mein Geld sehen.","首 先 ， 我 要 看 到 我 的 钱 。","","False","DIA_Sylvio_WASJETZT_Geld_15_00","",""
"Scripts/Content/Story/Dialoge/DIA_DJG_700_Sylvio.d:321","Wenn wir erst mal den Drachen haben, kannst du so viel Geld haben, wie du tragen kannst.","一 旦 我 们 干 掉 了 那 条 龙 ， 你 能 带 多 少 金 子 就 拿 多 少 。","","False","DIA_Sylvio_WASJETZT_Geld_09_01","",""
"Scripts/Content/Story/Dialoge/DIA_DJG_700_Sylvio.d:323","Ich will mein Geld jetzt.","我 现 在 就 要 我 的 钱 。","","False","DIA_Sylvio_WASJETZT.DIA_Sylvio_WASJETZT_jetztGeld","Info_AddChoice",""
"Scripts/Content/Story/Dialoge/DIA_DJG_700_Sylvio.d:328","Ich will mein Geld jetzt.","我 现 在 就 要 我 的 钱 。","","False","DIA_Sylvio_WASJETZT_jetztGeld_15_00","",""
"Scripts/Content/Story/Dialoge/DIA_DJG_700_Sylvio.d:329","Entweder du gehst jetzt vor oder du wirst mich kennen lernen.","要 么 你 走 在 前 面 ， 要 么 你 听 我 的 安 排 。","","False","DIA_Sylvio_WASJETZT_jetztGeld_09_01","",""
"Scripts/Content/Story/Dialoge/DIA_DJG_700_Sylvio.d:342","Ich dachte, du wolltest in die Eisregion.","我 想 你 正 要 去 冰 封 地 区 。","","False","DIA_Sylvio_KOMMSTDU.description","",""
"Scripts/Content/Story/Dialoge/DIA_DJG_700_Sylvio.d:356","Ich dachte, du wolltest in die Eisregion.","我 想 你 正 要 去 冰 封 地 区 。","","False","DIA_Sylvio_KOMMSTDU_15_00","",""
"Scripts/Content/Story/Dialoge/DIA_DJG_700_Sylvio.d:357","Geh ruhig schon vor. Ich komm dann schon.","走 在 前 面 。 我 跟 着 你 。","","False","DIA_Sylvio_KOMMSTDU_09_01","",""
"Scripts/Content/Story/Dialoge/DIA_DJG_700_Sylvio.d:372","Ich könnte Hilfe gebrauchen.","我 需 要 一 些 帮 助 。","","False","DIA_Sylvio_DUHIER.description","",""
"Scripts/Content/Story/Dialoge/DIA_DJG_700_Sylvio.d:386","Ich könnte Hilfe gebrauchen.","我 需 要 一 些 帮 助 。","","False","DIA_Sylvio_DUHIER_15_00","",""
"Scripts/Content/Story/Dialoge/DIA_DJG_700_Sylvio.d:387","Ach was. Du machst das großartig.","胡 扯 。 你 正 在 做 伟 大 的 事 。","","False","DIA_Sylvio_DUHIER_09_01","",""
"Scripts/Content/Story/Dialoge/DIA_DJG_700_Sylvio.d:414","Der Eisdrache ist tot! Und du gibst mir jetzt alles, was du bei dir hast!","冰 龙 死 了 ！ 现 在 把 你 身 上 的 东 西 都 给 我 ！","","False","DIA_SylvioDJG_WHATNEXT_09_00","",""
"Scripts/Content/Story/Dialoge/DIA_DJG_700_Sylvio.d:415","Ich denk ja gar nicht dran!","决 不 ！","","False","DIA_SylvioDJG_WHATNEXT_15_01","",""
"Scripts/Content/Story/Dialoge/DIA_DJG_700_Sylvio.d:416","Ich werde derjenige sein, der als Eisdrachentöter gefeiert wird.","我 将 因 为 杀 死 冰 龙 而 出 名 。","","False","DIA_SylvioDJG_WHATNEXT_09_02","",""
"Scripts/Content/Story/Dialoge/DIA_DJG_700_Sylvio.d:417","Deine kleine Rolle bei der Sache wird jetzt aus der Welt geschafft!","你 在 这 件 事 中 的 小 角 色 演 完 了 ！","","False","DIA_SylvioDJG_WHATNEXT_09_03","",""
"Scripts/Content/Story/Dialoge/DIA_DJG_700_Sylvio.d:464","Jetzt wird abgerechnet.","到 算 账 的 时 候 了 。","","False","DIA_SylvioDJG_BUTNOW_09_00","",""
"Scripts/Content/Story/Dialoge/DIA_DJG_701_Bullco.d:41","Was ist los?","发 生 了 什 么 事 ？","","False","DIA_BullcoDJG_HALLO.description","",""
"Scripts/Content/Story/Dialoge/DIA_DJG_701_Bullco.d:54","Was ist los??","发 生 了 什 么 事 ？","","False","DIA_BullcoDJG_HALLO_15_00","",""
"Scripts/Content/Story/Dialoge/DIA_DJG_701_Bullco.d:55","Verdammt kalt hier, Mann! Verstehe nicht, wieso Sylvio ausgerechnet hierher wollte.","这 里 真 的 很 冷 ， 老 兄 ！ 我 不 知 道 有 那 么 多 的 地 方 ， 为 什 么 席 尔 维 欧 偏 要 来 这 里 。","","False","DIA_BullcoDJG_HALLO_06_01","",""
"Scripts/Content/Story/Dialoge/DIA_DJG_701_Bullco.d:56","Es gibt doch genug andere Gegenden hier, wo's was zu holen gibt!","这 附 近 形 势 危 及 的 地 方 非 常 多 ！","","False","DIA_BullcoDJG_HALLO_06_02","",""
"Scripts/Content/Story/Dialoge/DIA_DJG_701_Bullco.d:70","Sonst alles klar?","其 它 事 情 都 好 吗 ？","","False","DIA_BullcoDJG_WARTEMAL.description","",""
"Scripts/Content/Story/Dialoge/DIA_DJG_701_Bullco.d:84","Sonst alles klar?","其 它 事 情 都 好 吗 ？","","False","DIA_BullcoDJG_WARTEMAL_15_00","",""
"Scripts/Content/Story/Dialoge/DIA_DJG_701_Bullco.d:88","Geh mir nicht auf die Nerven.","只 是 不 要 刺 激 我 。","","False","DIA_BullcoDJG_WARTEMAL_06_01","",""
"Scripts/Content/Story/Dialoge/DIA_DJG_701_Bullco.d:92","Jetzt nicht! Mir ist kalt! Ich will so schnell wie möglich hier wieder raus.","现 在 不 ！ 我 要 冻 僵 了 ！ 我 只 想 尽 快 离 开 这 里 。","","False","DIA_BullcoDJG_WARTEMAL_06_02","",""
"Scripts/Content/Story/Dialoge/DIA_DJG_701_Bullco.d:120","Verdammt. Sylvio ist tot.","该 死 。 席 尔 维 欧 死 了 。","","False","DIA_Bullco_SYLVIODEAD_06_00","",""
"Scripts/Content/Story/Dialoge/DIA_DJG_701_Bullco.d:135","Was willst du jetzt machen?","那 个 席 尔 维 欧 死 了 ， 现 在 你 有 什 么 计 划？","","False","DIA_Bullco_WASNUN.description","",""
"Scripts/Content/Story/Dialoge/DIA_DJG_701_Bullco.d:149","Was willst du jetzt machen, wo Sylvio tot ist?","那 个 席 尔 维 欧 死 了 ， 现 在 你 有 什 么 计 划 ？","","False","DIA_Bullco_WASNUN_15_00","",""
"Scripts/Content/Story/Dialoge/DIA_DJG_701_Bullco.d:150","Keine Ahnung. Wahrscheinlich werde ich mich den anderen Drachenjägern anschließen, wenn sie mich noch haben wollen.","不 知 道 。 我 想 和 其 它 龙 猎 手 一 起 走 ， 如 果 他 们 还 要 我 的 话 。","","False","DIA_Bullco_WASNUN_06_01","",""
"Scripts/Content/Story/Dialoge/DIA_DJG_701_Bullco.d:152","Ich sollte dir den Kopf abreißen.","我 应 该 马 上 扭 掉 你 的 脑 袋 。","","False","DIA_Bullco_WASNUN.DIA_Bullco_WASNUN_kopfab","Info_AddChoice",""
"Scripts/Content/Story/Dialoge/DIA_DJG_701_Bullco.d:153","Weißt du, wo die anderen sind?","你 知 道 其 它 人 在 哪 里 吗 ？","","False","DIA_Bullco_WASNUN.DIA_Bullco_WASNUN_woandere","Info_AddChoice",""
"Scripts/Content/Story/Dialoge/DIA_DJG_701_Bullco.d:158","Weißt du, wo die anderen sind?","你 知 道 其 它 人 在 哪 里 吗 ？","","False","DIA_Bullco_WASNUN_woandere_15_00","",""
"Scripts/Content/Story/Dialoge/DIA_DJG_701_Bullco.d:159","Ich denke schon. Ich habe zumindest einen von ihnen drüben am Fluss gesehen.","我 想 是 这 样 的 。 至 少 我 在 那 边 的 河 边 见 到 过 一 个 。","","False","DIA_Bullco_WASNUN_woandere_06_01","",""
"Scripts/Content/Story/Dialoge/DIA_DJG_701_Bullco.d:161","Bring mich zu den anderen Drachenjägern.","带 我 到 其 它 的 龙 猎 手 那 里 去 。","","False","DIA_Bullco_WASNUN.DIA_Bullco_WASNUN_woandere_zuihnen","Info_AddChoice",""
"Scripts/Content/Story/Dialoge/DIA_DJG_701_Bullco.d:166","Bring mich zu den anderen Drachenjägern.","带 我 到 其 它 的 龙 猎 手 那 里 去 。","","False","DIA_Bullco_WASNUN_woandere_zuihnen_15_00","",""
"Scripts/Content/Story/Dialoge/DIA_DJG_701_Bullco.d:167","Ich bin doch nicht dein Lakai.","嘿 ， 我 不 是 你 的 仆 人 。","","False","DIA_Bullco_WASNUN_woandere_zuihnen_06_01","",""
"Scripts/Content/Story/Dialoge/DIA_DJG_701_Bullco.d:171","Dann eben nicht.","随 便 你 吧 。 我 肯 定 我 能 找 到 他 们 。","","False","DIA_Bullco_WASNUN.DIA_Bullco_WASNUN_woandere_zuihnen_alleine","Info_AddChoice",""
"Scripts/Content/Story/Dialoge/DIA_DJG_701_Bullco.d:172","Du kannst froh sein, wenn ich dich leben lasse.","如 果 我 让 你 活 下 去 的 话 ， 就 算 你 有 运 气 。","","False","DIA_Bullco_WASNUN.DIA_Bullco_WASNUN_woandere_zuihnen_lebenlassen","Info_AddChoice",""
"Scripts/Content/Story/Dialoge/DIA_DJG_701_Bullco.d:173","Ich zahle dir 50 Goldmünzen dafür.","我 愿 意 付 给 你 ５ ０ 金 币 。","","False","DIA_Bullco_WASNUN.DIA_Bullco_WASNUN_woandere_zuihnen_Geld","Info_AddChoice",""
"Scripts/Content/Story/Dialoge/DIA_DJG_701_Bullco.d:178","Du kannst froh sein, wenn ich dich leben lasse.","如 果 我 让 你 活 下 去 的 话 ， 就 算 你 有 运 气 。","","False","DIA_Bullco_WASNUN_woandere_zuihnen_lebenlassen_15_00","",""
"Scripts/Content/Story/Dialoge/DIA_DJG_701_Bullco.d:179","Lass mich zufrieden.","别 烦 我 。","","False","DIA_Bullco_WASNUN_woandere_zuihnen_lebenlassen_06_01","",""
"Scripts/Content/Story/Dialoge/DIA_DJG_701_Bullco.d:185","Ich zahle dir 50 Goldmünzen dafür.","我 愿 意 付 给 你 ５ ０ 金 币 。","","False","DIA_Bullco_WASNUN_woandere_zuihnen_Geld_15_00","",""
"Scripts/Content/Story/Dialoge/DIA_DJG_701_Bullco.d:189","Alles klar. Her mit dem Geld.","那 好 吧 。 把 钱 交 出 来 。","","False","DIA_Bullco_WASNUN_woandere_zuihnen_Geld_06_01","",""
"Scripts/Content/Story/Dialoge/DIA_DJG_701_Bullco.d:190","Folge mir. Ich bringe dich dahin, wo ich zuletzt einen der anderen Drachenjäger gesehen habe.","跟 我 来 。 我 会 把 你 带 到 我 上 次 见 到 龙 猎 手 的 地 方 。","","False","DIA_Bullco_WASNUN_woandere_zuihnen_Geld_06_02","",""
"Scripts/Content/Story/Dialoge/DIA_DJG_701_Bullco.d:196","Du hast keine 50 Goldmünzen und ich habe keinen Bock, mich verarschen zu lassen. Verschwinde.","你 没 有 5 0 枚 金 币 ， 我 不 会 被 那 种 废 话 欺 骗 的 。 走 开 。","","False","DIA_Bullco_WASNUN_woandere_zuihnen_Geld_06_03","",""
"Scripts/Content/Story/Dialoge/DIA_DJG_701_Bullco.d:203","Dann eben nicht. Ich werde sie schon finden.","随 便 你 吧 。 我 肯 定 我 能 找 到 他 们 。","","False","DIA_Bullco_WASNUN_woandere_zuihnen_alleine_15_00","",""
"Scripts/Content/Story/Dialoge/DIA_DJG_701_Bullco.d:204","Dann verlauf dich nicht.","那 么 不 要 走 开 。","","False","DIA_Bullco_WASNUN_woandere_zuihnen_alleine_06_01","",""
"Scripts/Content/Story/Dialoge/DIA_DJG_701_Bullco.d:211","Ich sollte dir den Kopf abreißen.","我 应 该 马 上 扭 掉 你 的 脑 袋 。","","False","DIA_Bullco_WASNUN_kopfab_15_00","",""
"Scripts/Content/Story/Dialoge/DIA_DJG_701_Bullco.d:212","Schwing hier keine großen Reden.","闭 嘴 。","","False","DIA_Bullco_WASNUN_kopfab_06_01","",""
"Scripts/Content/Story/Dialoge/DIA_DJG_701_Bullco.d:214","Zieh deine Waffe. Wir bringen das jetzt zuende.","拔 出 你 的 武 器 。 我 们 现 在 做 个 了 断 。","","False","DIA_Bullco_WASNUN.DIA_Bullco_WASNUN_kopfab_angriff","Info_AddChoice",""
"Scripts/Content/Story/Dialoge/DIA_DJG_701_Bullco.d:219","Zieh deine Waffe. Wir bringen das jetzt zu Ende.","拔 出 你 的 武 器 。 我 们 现 在 做 个 了 断 。","","False","DIA_Bullco_WASNUN_kopfab_angriff_15_00","",""
"Scripts/Content/Story/Dialoge/DIA_DJG_701_Bullco.d:220","So sei es.","那 就 这 样 吧 。","","False","DIA_Bullco_WASNUN_kopfab_angriff_06_01","",""
"Scripts/Content/Story/Dialoge/DIA_DJG_702_Rod.d:41","Alles klar bei dir?","你 一 切 都 好 吗 ？","","False","DIA_RodDJG_HALLO.description","",""
"Scripts/Content/Story/Dialoge/DIA_DJG_702_Rod.d:54","Alles klar bei dir?","你 一 切 都 好 吗 ？","","False","DIA_RodDJG_HALLO_15_00","",""
"Scripts/Content/Story/Dialoge/DIA_DJG_702_Rod.d:55","Diese Stiefel bringen mich noch um! Die neue Rüstung ist zwar Klasse, aber wieso müssen die Riemen an den Stiefeln bloß so fest sitzen.","这 靴 子 快 把 我 害 死 了 ！ 新 的 盔 甲 真 的 很 棒 ， 但 是 为 什 么 这 靴 子 上 的 带 子 会 这 么 紧 ？。","","False","DIA_RodDJG_HALLO_06_01","",""
"Scripts/Content/Story/Dialoge/DIA_DJG_702_Rod.d:56","Mach ich sie lockerer, fallen sie mir fast von den Füßen.","如 果 我 把 它 们 松 开 ， 靴 子 几 乎 要 从 我 的 脚 上 掉 下 去 了 。","","False","DIA_RodDJG_HALLO_06_02","",""
"Scripts/Content/Story/Dialoge/DIA_DJG_702_Rod.d:63","Worauf wartest du?","你 在 等 什 么 ？","","False","DIA_RodDJG_HALLO.DIA_RodDJG_HALLO_warten","Info_AddChoice",""
"Scripts/Content/Story/Dialoge/DIA_DJG_702_Rod.d:66","Wo hast du die Stiefel her?","你 从 哪 里 得 到 那 些 靴 子 ？","","False","DIA_RodDJG_HALLO.DIA_RodDJG_HALLO_Woher","Info_AddChoice",""
"Scripts/Content/Story/Dialoge/DIA_DJG_702_Rod.d:71","Wo hast du die Stiefel her?","你 从 哪 里 得 到 那 些 靴 子 ？","","False","DIA_RodDJG_HALLO_Woher_15_00","",""
"Scripts/Content/Story/Dialoge/DIA_DJG_702_Rod.d:72","Bennet, der alte Haudegen, hat sie uns Drachenjägern angefertigt und hat sich den Mist auch noch großzügig bezahlen lassen.","它 们 是 那 个 老 兵 贝 尼 特 为 我 们 龙 猎 手 打 造 的 ， 而 且 要 我 们 为 那 双 破 靴 子 付 了 一 大 笔 钱 。","","False","DIA_RodDJG_HALLO_Woher_06_01","",""
