"location","source","target","id","fuzzy","context","translator_comments","developer_comments"
"Scripts/Content/Story/Dialoge/DIA_Addon_PIR_1301_Skip_NW.d:185","Er hat die Hosen gestrichen voll, was? Naja. Was will man von so einer Händlerpfeife auch erwarten?","","","False","DIA_Addon_Skip_BaltramPaket_08_02","",""
"Scripts/Content/Story/Dialoge/DIA_Addon_PIR_1301_Skip_NW.d:187","Er sagte, er will 3 Flaschen von deinem Rum dafür.","","","False","DIA_Addon_Skip_BaltramPaket_15_03","",""
"Scripts/Content/Story/Dialoge/DIA_Addon_PIR_1301_Skip_NW.d:188","(lacht) Das hätte er wohl gerne. Erst lässt er mich hier ewig warten, kommt nicht einmal persönlich und stellt obendrein auch noch Forderungen.","","","False","DIA_Addon_Skip_BaltramPaket_08_04","",""
"Scripts/Content/Story/Dialoge/DIA_Addon_PIR_1301_Skip_NW.d:189","Hier, gib ihm 2 Flaschen. Damit soll er zufrieden sein.","","","False","DIA_Addon_Skip_BaltramPaket_08_05","",""
"Scripts/Content/Story/Dialoge/DIA_Addon_PIR_1301_Skip_NW.d:207","Wo kommst du her?","","","False","DIA_Addon_Skip_NW_Woher.description","",""
"Scripts/Content/Story/Dialoge/DIA_Addon_PIR_1301_Skip_NW.d:220","Wo kommst du her?","","","False","DIA_Addon_Skip_NW_Woher_15_00","",""
"Scripts/Content/Story/Dialoge/DIA_Addon_PIR_1301_Skip_NW.d:221","Du willst wissen, wo unser Unterschlupf ist?","","","False","DIA_Addon_Skip_NW_Woher_08_01","",""
"Scripts/Content/Story/Dialoge/DIA_Addon_PIR_1301_Skip_NW.d:225","Das werde ich einem Typen von der Miliz ganz bestimmt nicht auf die Nase binden.","","","False","DIA_Addon_Skip_NW_Woher_08_02","",""
"Scripts/Content/Story/Dialoge/DIA_Addon_PIR_1301_Skip_NW.d:229","Wenn ich dir das erzähle, dann könnte ich mich ja gleich der Miliz stellen.","","","False","DIA_Addon_Skip_NW_Woher_08_03","",""
"Scripts/Content/Story/Dialoge/DIA_Addon_PIR_1301_Skip_NW.d:232","Außerdem würde dir das sowieso nichts nutzen, falls du vor haben solltest uns aufzusuchen.","","","False","DIA_Addon_Skip_NW_Woher_08_04","",""
"Scripts/Content/Story/Dialoge/DIA_Addon_PIR_1301_Skip_NW.d:233","Die Insel Khorinis ist groß und da, wo wir sind, kommt sowieso niemand hin. Es sei denn, er fährt mit einer Kogge oder einem Schiff.","","","False","DIA_Addon_Skip_NW_Woher_08_05","",""
"Scripts/Content/Story/Dialoge/DIA_Addon_PIR_1301_Skip_NW.d:234","Dann müsstest du auch noch ein Weg durch die Klippen finden. Niemand kommt da durch, es sei denn, er kennt den geheimen Weg.","","","False","DIA_Addon_Skip_NW_Woher_08_06","",""
"Scripts/Content/Story/Dialoge/DIA_Addon_PIR_1301_Skip_NW.d:235","Es gibt nur zwei Menschen, die den Weg kennen, und du bist keiner von ihnen.","","","False","DIA_Addon_Skip_NW_Woher_08_07","",""
"Scripts/Content/Story/Dialoge/DIA_Addon_PIR_1301_Skip_NW.d:247","Kennst du jemanden mit einer Augenklappe?","","","False","DIA_Addon_Skip_SCSawGreg.description","",""
"Scripts/Content/Story/Dialoge/DIA_Addon_PIR_1301_Skip_NW.d:261","Kennst du jemanden mit einer Augenklappe?","","","False","DIA_Addon_Skip_SCSawGreg_15_00","",""
"Scripts/Content/Story/Dialoge/DIA_Addon_PIR_1301_Skip_NW.d:262","Ich kenne eine Menge Männer mit Augenklappe.","","","False","DIA_Addon_Skip_SCSawGreg_08_01","",""
"Scripts/Content/Story/Dialoge/DIA_Addon_PIR_1301_Skip_NW.d:263","Da gibt es so jemanden, der über das Land von Khorinis läuft und er scheint dich gut zu kennen.","","","False","DIA_Addon_Skip_SCSawGreg_15_02","",""
"Scripts/Content/Story/Dialoge/DIA_Addon_PIR_1301_Skip_NW.d:264","Kann ich mir nicht vorstellen. Die Männer, mit denen ich zu tun habe, sind keine Landratten.","","","False","DIA_Addon_Skip_SCSawGreg_08_03","",""
"Scripts/Content/Story/Dialoge/DIA_Addon_PIR_1301_Skip_NW.d:265","Aber ...","","","False","DIA_Addon_Skip_SCSawGreg_15_04","",""
"Scripts/Content/Story/Dialoge/DIA_Addon_PIR_1301_Skip_NW.d:266","Hör schon auf, mich interessiert das wirklich nicht.","","","False","DIA_Addon_Skip_SCSawGreg_08_05","",""
"Scripts/Content/Story/Dialoge/DIA_Addon_PIR_1301_Skip_NW.d:279","Eine Menge Einwohner werden vermisst.","","","False","DIA_Addon_Skip_NW_MissingPeople.description","",""
"Scripts/Content/Story/Dialoge/DIA_Addon_PIR_1301_Skip_NW.d:293","Eine Menge Einwohner werden vermisst. Und alles deutet darauf hin, dass du daran nicht ganz unschuldig zu sein scheinst.","","","False","DIA_Addon_Skip_NW_MissingPeople_15_00","",""
"Scripts/Content/Story/Dialoge/DIA_Addon_PIR_1301_Skip_NW.d:294","(fühlt sich erwischt) Äh ... verdammt, aber die Sache ist nicht so, wie du denkst.","","","False","DIA_Addon_Skip_NW_MissingPeople_08_01","",""
"Scripts/Content/Story/Dialoge/DIA_Addon_PIR_1301_Skip_NW.d:295","Seh ich etwa aus wie ein Menschenhändler? Nein, ich transportiere Waren, was das für Waren sind oder wo sie herkommen, geht mich nichts an.","","","False","DIA_Addon_Skip_NW_MissingPeople_08_02","",""
"Scripts/Content/Story/Dialoge/DIA_Addon_PIR_1301_Skip_NW.d:296","Wir haben viele Dinge für diese Schweine geschippert.","","","False","DIA_Addon_Skip_NW_MissingPeople_08_03","",""
"Scripts/Content/Story/Dialoge/DIA_Addon_PIR_1301_Skip_NW.d:297","Am Anfang war es ganz normaler Kram. Naja, das eine oder andere war Schmuggelware.","","","False","DIA_Addon_Skip_NW_MissingPeople_08_04","",""
"Scripts/Content/Story/Dialoge/DIA_Addon_PIR_1301_Skip_NW.d:298","Doch irgendwann fingen sie an, die Bewohner der Stadt zu entführen. Keine Ahnung, was sie mit ihnen vorhaben.","","","False","DIA_Addon_Skip_NW_MissingPeople_08_05","",""
"Scripts/Content/Story/Dialoge/DIA_Addon_PIR_1301_Skip_NW.d:299","Wir haben sie nur übergefahren.","","","False","DIA_Addon_Skip_NW_MissingPeople_08_06","",""
"Scripts/Content/Story/Dialoge/DIA_Addon_PIR_1301_Skip_NW.d:311","Von wem sprichst du?","","","False","DIA_Addon_Skip_NW_Dexter.description","",""
"Scripts/Content/Story/Dialoge/DIA_Addon_PIR_1301_Skip_NW.d:324","Von wem sprichst du?","","","False","DIA_Addon_Skip_NW_Dexter_15_00","",""
"Scripts/Content/Story/Dialoge/DIA_Addon_PIR_1301_Skip_NW.d:325","Von den Banditen, Mann. Von wem sonst? Das schmierige Pack, das sich hier überall auf der Insel breit macht.","","","False","DIA_Addon_Skip_NW_Dexter_08_01","",""
"Scripts/Content/Story/Dialoge/DIA_Addon_PIR_1301_Skip_NW.d:326","Und nicht nur hier um Khorinis.","","","False","DIA_Addon_Skip_NW_Dexter_08_02","",""
"Scripts/Content/Story/Dialoge/DIA_Addon_PIR_1301_Skip_NW.d:331","Jetzt fällt mir auch sein Name wieder ein. Dexter. Ja, ich meine, sein Name war Dexter.","","","False","DIA_Addon_Skip_SaysDextersName_08_00","",""
"Scripts/Content/Story/Dialoge/DIA_Addon_PIR_1301_Skip_NW.d:350","'Banditen!' reicht mir nicht. Ich will einen Namen...","","","False","DIA_Addon_Skip_NW_Name.description","",""
"Scripts/Content/Story/Dialoge/DIA_Addon_PIR_1301_Skip_NW.d:364","Banditen!' reicht mir nicht. Ich will einen Namen ...","","","False","DIA_Addon_Skip_NW_Name_15_00","",""
"Scripts/Content/Story/Dialoge/DIA_Addon_PIR_1301_Skip_NW.d:365","Einen Namen? Du willst wissen, wer der Kopf der Banditen ist? Verdammt, wie hieß denn der Hund noch mal ...","","","False","DIA_Addon_Skip_NW_Name_08_01","",""
"Scripts/Content/Story/Dialoge/DIA_Addon_PIR_1301_Skip_NW.d:366","Mmh. Mir fällt der Name von dem Kerl nicht mehr ein. Dabei war er eigentlich ganz einfach zu merken.","","","False","DIA_Addon_Skip_NW_Name_08_02","",""
"Scripts/Content/Story/Dialoge/DIA_Addon_PIR_1301_Skip_NW.d:367","Aber ich kann dir zeigen, wo du den Boss der Bande in diesem Teil von Khorinis finden kannst.","","","False","DIA_Addon_Skip_NW_Name_08_03","",""
"Scripts/Content/Story/Dialoge/DIA_Addon_PIR_1301_Skip_NW.d:368","Hast du eine ordentliche Landkarte dabei?","","","False","DIA_Addon_Skip_NW_Name_08_04","",""
"Scripts/Content/Story/Dialoge/DIA_Addon_PIR_1301_Skip_NW.d:376","Ich hab hier eine Landkarte.","","","False","DIA_Addon_Skip_NW_Name_15_05","",""
"Scripts/Content/Story/Dialoge/DIA_Addon_PIR_1301_Skip_NW.d:377","Die ist ja schon vollgemalt. Da macht mir das ja gar keinen Spaß, dir deine Karte zu verschandeln.","","","False","DIA_Addon_Skip_NW_Name_08_06","",""
"Scripts/Content/Story/Dialoge/DIA_Addon_PIR_1301_Skip_NW.d:381","Nein.","","","False","DIA_Addon_Skip_NW_Name_15_07","",""
"Scripts/Content/Story/Dialoge/DIA_Addon_PIR_1301_Skip_NW.d:384","Dann werde ich's dir wohl beschreiben müssen, was?","","","False","DIA_Addon_Skip_NW_Name_08_08","",""
"Scripts/Content/Story/Dialoge/DIA_Addon_PIR_1301_Skip_NW.d:385","Weit im Osten gibt es einen sehr großen Bauernhof. Ich glaube, der Bauer dort heißt Onar.","","","False","DIA_Addon_Skip_NW_Name_08_09","",""
"Scripts/Content/Story/Dialoge/DIA_Addon_PIR_1301_Skip_NW.d:386","Er hat ziemliche große Felder da. Im Süden dieser Felder gibt es eine kleine Festung auf einem hohen Felsen.","","","False","DIA_Addon_Skip_NW_Name_08_10","",""
"Scripts/Content/Story/Dialoge/DIA_Addon_PIR_1301_Skip_NW.d:387","Da sitzt der Typ, den du suchst.","","","False","DIA_Addon_Skip_NW_Name_08_11","",""
"Scripts/Content/Story/Dialoge/DIA_Addon_PIR_1301_Skip_NW.d:401","Hier. Ich hab eine Landkarte von Khorinis.","","","False","DIA_Addon_Skip_NW_Landkarte.description","",""
"Scripts/Content/Story/Dialoge/DIA_Addon_PIR_1301_Skip_NW.d:416","Hier. Ich habe eine Landkarte von Khorinis.","","","False","DIA_Addon_Skip_NW_Landkarte_15_00","",""
"Scripts/Content/Story/Dialoge/DIA_Addon_PIR_1301_Skip_NW.d:417","Das ist gut. Dann werde ich dir den Sitz von diesem Kerl einzeichnen.","","","False","DIA_Addon_Skip_NW_Landkarte_08_01","",""
"Scripts/Content/Story/Dialoge/DIA_Addon_PIR_1301_Skip_NW.d:420","Hier. Deine Karte.","","","False","DIA_Addon_Skip_NW_Landkarte_08_02","",""
"Scripts/Content/Story/Dialoge/DIA_Addon_PIR_1301_Skip_NW.d:437","Wo habt ihr die Leute hingebracht?","","","False","DIA_Addon_Skip_NW_Wohin.description","",""
"Scripts/Content/Story/Dialoge/DIA_Addon_PIR_1301_Skip_NW.d:451","Wo habt ihr die Leute hingebracht?","","","False","DIA_Addon_Skip_NW_Wohin_15_00","",""
"Scripts/Content/Story/Dialoge/DIA_Addon_PIR_1301_Skip_NW.d:452","Ich hab dir schon gesagt, ich werde dir nicht verraten, wo sich unsere Bucht befindet.","","","False","DIA_Addon_Skip_NW_Wohin_08_01","",""
"Scripts/Content/Story/Dialoge/DIA_Addon_PIR_1320_Greg.d:79","(droht) Sag mal. Was machst du in meiner Hütte?","","","False","DIA_Addon_Greg_Hello_01_00","",""
"Scripts/Content/Story/Dialoge/DIA_Addon_PIR_1320_Greg.d:80","Ich ...","","","False","DIA_Addon_Greg_Hello_15_01","",""
"Scripts/Content/Story/Dialoge/DIA_Addon_PIR_1320_Greg.d:81","(wütend) Kaum ist man mal ein paar Tage nicht da, da glaubt jeder, er kann mir auf der Nase rumtanzen.","","","False","DIA_Addon_Greg_Hello_01_02","",""
"Scripts/Content/Story/Dialoge/DIA_Addon_PIR_1320_Greg.d:85","Was ist eigentlich hier los?","","","False","DIA_Addon_Greg_ImNew_01_03","",""
"Scripts/Content/Story/Dialoge/DIA_Addon_PIR_1320_Greg.d:86","Die Palisade ist noch nicht fertig? Der Canyon quillt fast über vor Viechern und alle machen sich einen schönen Tag.","","","False","DIA_Addon_Greg_ImNew_01_04","",""
"Scripts/Content/Story/Dialoge/DIA_Addon_PIR_1320_Greg.d:93","(laut) Ist das etwa alles, was du zustande gebracht hast, Francis?","","","False","DIA_Addon_Greg_ImNew_01_05","",""
"Scripts/Content/Story/Dialoge/DIA_Addon_PIR_1320_Greg.d:97","(laut) Verzieh dich sofort von meiner Bank!","","","False","DIA_Addon_Greg_ImNew_01_06","",""
"Scripts/Content/Story/Dialoge/DIA_Addon_PIR_1320_Greg.d:103","Und DU? Was hast DU gemacht?","","","False","DIA_Addon_Greg_ImNew_01_07","",""
"Scripts/Content/Story/Dialoge/DIA_Addon_PIR_1320_Greg.d:106","Bisher noch nicht viel.","","","False","DIA_Addon_Greg_ImNew.DIA_Addon_Greg_ImNew_nich","Info_AddChoice",""
"Scripts/Content/Story/Dialoge/DIA_Addon_PIR_1320_Greg.d:119","Gearbeitet.","","","False","DIA_Addon_Greg_ImNew.DIA_Addon_Greg_ImNew_turm","Info_AddChoice",""
"Scripts/Content/Story/Dialoge/DIA_Addon_PIR_1320_Greg.d:129","Glaub jetzt aber bloß nicht, ich hätte vergessen, dass du mir noch was schuldig bist.","","","False","DIA_Addon_Greg_UseRakeBilanz_01_00","",""
"Scripts/Content/Story/Dialoge/DIA_Addon_PIR_1320_Greg.d:130","Es waren Sachen im Wert von mehreren hundert Goldmünzen, die ich überall in Khorinis vergraben habe.","","","False","DIA_Addon_Greg_UseRakeBilanz_01_01","",""
"Scripts/Content/Story/Dialoge/DIA_Addon_PIR_1320_Greg.d:131","Die hast du dir alle eingesackt, was?","","","False","DIA_Addon_Greg_UseRakeBilanz_01_02","",""
"Scripts/Content/Story/Dialoge/DIA_Addon_PIR_1320_Greg.d:132","Das wirst du jetzt bei mir abarbeiten.","","","False","DIA_Addon_Greg_UseRakeBilanz_01_03","",""
"Scripts/Content/Story/Dialoge/DIA_Addon_PIR_1320_Greg.d:136","Ab jetzt wirst du mal richtige Arbeit kennen lernen.","","","False","DIA_Addon_Greg_UseRakeBilanz_01_04","",""
"Scripts/Content/Story/Dialoge/DIA_Addon_PIR_1320_Greg.d:152","Bisher noch nicht viel.","","","False","DIA_Addon_Greg_ImNew_nich_15_00","",""
"Scripts/Content/Story/Dialoge/DIA_Addon_PIR_1320_Greg.d:153","Macht nichts. Ich werde schon das Passende für dich finden, mein Freundchen.","","","False","DIA_Addon_Greg_ImNew_nich_01_01","",""
"Scripts/Content/Story/Dialoge/DIA_Addon_PIR_1320_Greg.d:159","Gearbeitet.","","","False","DIA_Addon_Greg_ImNew_turm_15_00","",""
"Scripts/Content/Story/Dialoge/DIA_Addon_PIR_1320_Greg.d:160","So? Was denn?","","","False","DIA_Addon_Greg_ImNew_turm_01_01","",""
"Scripts/Content/Story/Dialoge/DIA_Addon_PIR_1320_Greg.d:164","Ich habe die Banditen aus dem Turm erledigt.","","","False","DIA_Addon_Greg_ImNew_turm_15_02","",""
"Scripts/Content/Story/Dialoge/DIA_Addon_PIR_1320_Greg.d:175","Der Strand im Norden ist von Viechern gesäubert.","","","False","DIA_Addon_Greg_ImNew_turm_15_03","",""
"Scripts/Content/Story/Dialoge/DIA_Addon_PIR_1320_Greg.d:178","Na ja. Das ist ja schon mal ein Anfang.","","","False","DIA_Addon_Greg_ImNew_turm_01_04","",""
"Scripts/Content/Story/Dialoge/DIA_Addon_PIR_1320_Greg.d:192","Was gibt's zu tun?","","","False","DIA_Addon_Greg_JoinPirates.description","",""
"Scripts/Content/Story/Dialoge/DIA_Addon_PIR_1320_Greg.d:205","Was gibt's zu tun?","","","False","DIA_Addon_Greg_JoinPirates_15_00","",""
"Scripts/Content/Story/Dialoge/DIA_Addon_PIR_1320_Greg.d:206","Als erstes müssen wir hier wieder ein bisschen Schwung in den Laden bringen.","","","False","DIA_Addon_Greg_JoinPirates_01_01","",""
"Scripts/Content/Story/Dialoge/DIA_Addon_PIR_1320_Greg.d:210","Morgan, die faule Sau, schick ich zum Bretter sägen.","","","False","DIA_Addon_Greg_JoinPirates_01_02","",""
"Scripts/Content/Story/Dialoge/DIA_Addon_PIR_1320_Greg.d:213","DU wirst Morgans Job übernehmen und den verdammten Canyon von Viechern säubern.","","","False","DIA_Addon_Greg_JoinPirates_01_03","",""
"Scripts/Content/Story/Dialoge/DIA_Addon_PIR_1320_Greg.d:222","Dann werde ich mal aufbrechen.","","","False","DIA_Addon_Greg_JoinPirates.DIA_Addon_Greg_JoinPirates_Leave","Info_AddChoice",""
"Scripts/Content/Story/Dialoge/DIA_Addon_PIR_1320_Greg.d:227","Soll ich das etwa ganz alleine machen?","","","False","DIA_Addon_Greg_JoinPirates.DIA_Addon_Greg_JoinPirates_Compadres","Info_AddChoice",""
"Scripts/Content/Story/Dialoge/DIA_Addon_PIR_1320_Greg.d:230","Welche Viecher?","","","False","DIA_Addon_Greg_JoinPirates.DIA_Addon_Greg_JoinPirates_ClearCanyon","Info_AddChoice",""
"Scripts/Content/Story/Dialoge/DIA_Addon_PIR_1320_Greg.d:235","Dann werde ich mal aufbrechen.","","","False","DIA_Addon_Greg_JoinPirates_Leave_15_00","",""
"Scripts/Content/Story/Dialoge/DIA_Addon_PIR_1320_Greg.d:236","Noch was. Du bist jetzt einer von uns.","","","False","DIA_Addon_Greg_JoinPirates_Leave_01_01","",""
"Scripts/Content/Story/Dialoge/DIA_Addon_PIR_1320_Greg.d:237","Also ziehst du dir erst mal vernünftige Klamotten für die Jagd an.","","","False","DIA_Addon_Greg_JoinPirates_Leave_01_02","",""
"Scripts/Content/Story/Dialoge/DIA_Addon_PIR_1320_Greg.d:238","Hier hast du eine von unseren Rüstungen. Ich schätze, die wird dir passen.","","","False","DIA_Addon_Greg_JoinPirates_Leave_01_03","",""
"Scripts/Content/Story/Dialoge/DIA_Addon_PIR_1320_Greg.d:242","Und trödel nicht so lange herum, klar?","","","False","DIA_Addon_Greg_JoinPirates_Leave_01_04","",""
"Scripts/Content/Story/Dialoge/DIA_Addon_PIR_1320_Greg.d:249","Soll ich das etwa ganz alleine machen?","","","False","DIA_Addon_Greg_JoinPirates_Compadres_15_00","",""
"Scripts/Content/Story/Dialoge/DIA_Addon_PIR_1320_Greg.d:250","Am besten schanppst du dir ein paar von den Jungs.","","","False","DIA_Addon_Greg_JoinPirates_Compadres_01_01","",""
"Scripts/Content/Story/Dialoge/DIA_Addon_PIR_1320_Greg.d:251","Die sollen ihre Heuer verdienen, anstatt den ganzen Tag nur zu tratschen.","","","False","DIA_Addon_Greg_JoinPirates_Compadres_01_02","",""
"Scripts/Content/Story/Dialoge/DIA_Addon_PIR_1320_Greg.d:258","Welche Viecher?","","","False","DIA_Addon_Greg_JoinPirates_ClearCanyon_15_00","",""
"Scripts/Content/Story/Dialoge/DIA_Addon_PIR_1320_Greg.d:259","Die Razor im Canyon kommen immer näher an's Lager.","","","False","DIA_Addon_Greg_JoinPirates_ClearCanyon_01_01","",""
"Scripts/Content/Story/Dialoge/DIA_Addon_PIR_1320_Greg.d:260","Ich habe keine Lust, dass einer meiner Männer im Suff von den Biester gefressen wird.","","","False","DIA_Addon_Greg_JoinPirates_ClearCanyon_01_02","",""
"Scripts/Content/Story/Dialoge/DIA_Addon_PIR_1320_Greg.d:275","Wegen der Sache mit dem Canyon...","","","False","DIA_Addon_Greg_AboutCanyon.description","",""
"Scripts/Content/Story/Dialoge/DIA_Addon_PIR_1320_Greg.d:288","Wegen der Sache mit dem Canyon ...","","","False","DIA_Addon_Greg_AboutCanyon_15_00","",""
"Scripts/Content/Story/Dialoge/DIA_Addon_PIR_1320_Greg.d:289","Ja, was ist damit?","","","False","DIA_Addon_Greg_AboutCanyon_01_01","",""
"Scripts/Content/Story/Dialoge/DIA_Addon_PIR_1320_Greg.d:298","Wer kann mir dabei helfen?","","","False","DIA_Addon_Greg_AboutCanyon.DIA_Addon_Greg_AboutCanyon_Compadres","Info_AddChoice",""
"Scripts/Content/Story/Dialoge/DIA_Addon_PIR_1320_Greg.d:301","Welche Viecher soll ich töten?","","","False","DIA_Addon_Greg_AboutCanyon.DIA_Addon_Greg_AboutCanyon_Job","Info_AddChoice",""
"Scripts/Content/Story/Dialoge/DIA_Addon_PIR_1320_Greg.d:305","Ich habe alle Razor getötet.","","","False","DIA_Addon_Greg_AboutCanyon.DIA_Addon_Greg_AboutCanyon_RazorsDead","Info_AddChoice",""
"Scripts/Content/Story/Dialoge/DIA_Addon_PIR_1320_Greg.d:316","Wer kann mir dabei helfen?","","","False","DIA_Addon_Greg_AboutCanyon_Compadres_15_00","",""
"Scripts/Content/Story/Dialoge/DIA_Addon_PIR_1320_Greg.d:317","Nimm dir ein paar von den Jungs mit.","","","False","DIA_Addon_Greg_AboutCanyon_Compadres_01_01","",""
"Scripts/Content/Story/Dialoge/DIA_Addon_PIR_1320_Greg.d:318","Die hängen sonst die ganze Zeit nur herum.","","","False","DIA_Addon_Greg_AboutCanyon_Compadres_01_02","",""
"Scripts/Content/Story/Dialoge/DIA_Addon_PIR_1320_Greg.d:324","Welche Viecher soll ich töten?","","","False","DIA_Addon_Greg_AboutCanyon_Job_15_00","",""
"Scripts/Content/Story/Dialoge/DIA_Addon_PIR_1320_Greg.d:325","Du sollst die Razor beseitigen! Das andere Viehzeug ist harmlos.","","","False","DIA_Addon_Greg_AboutCanyon_Job_01_01","",""
"Scripts/Content/Story/Dialoge/DIA_Addon_PIR_1320_Greg.d:331","Ich habe alle Razor getötet.","","","False","DIA_Addon_Greg_AboutCanyon_RazorsDead_15_00","",""
"Scripts/Content/Story/Dialoge/DIA_Addon_PIR_1320_Greg.d:332","Sehr gut. Du scheinst ja ganz brauchbar zu sein.","","","False","DIA_Addon_Greg_AboutCanyon_RazorsDead_01_01","",""
"Scripts/Content/Story/Dialoge/DIA_Addon_PIR_1320_Greg.d:352","Ich brauche die Banditenrüstung.","","","False","DIA_Addon_Greg_BanditArmor.description","",""
"Scripts/Content/Story/Dialoge/DIA_Addon_PIR_1320_Greg.d:365","Ich brauche die Banditenrüstung.","","","False","DIA_Addon_Greg_BanditArmor_15_00","",""
"Scripts/Content/Story/Dialoge/DIA_Addon_PIR_1320_Greg.d:368","Mach dich erst mal nützlich. Dann können wir darüber reden.","","","False","DIA_Addon_Greg_BanditArmor_01_01","",""
"Scripts/Content/Story/Dialoge/DIA_Addon_PIR_1320_Greg.d:371","Töte erst mal alle Razor im Canyon!","","","False","DIA_Addon_Greg_BanditArmor_01_02","",""
"Scripts/Content/Story/Dialoge/DIA_Addon_PIR_1320_Greg.d:378","Hast mächtig was auf dem Kasten.","","","False","DIA_Addon_Greg_BanditArmor_01_03","",""
"Scripts/Content/Story/Dialoge/DIA_Addon_PIR_1320_Greg.d:379","Eigentlich sollte Bones mit der Rüstung die Banditen ausspionieren.","","","False","DIA_Addon_Greg_BanditArmor_01_04","",""
"Scripts/Content/Story/Dialoge/DIA_Addon_PIR_1320_Greg.d:380","Aber ich sollte besser DIR den Job überlassen.","","","False","DIA_Addon_Greg_BanditArmor_01_05","",""
"Scripts/Content/Story/Dialoge/DIA_Addon_PIR_1320_Greg.d:381","Du hast vielleicht sogar 'ne Chance, da heil wieder rauszukommen.","","","False","DIA_Addon_Greg_BanditArmor_01_06","",""
"Scripts/Content/Story/Dialoge/DIA_Addon_PIR_1320_Greg.d:382","Sprich mit Bones, er soll dir die Rüstung geben. Und dann gehst du damit zum Banditenlager.","","","False","DIA_Addon_Greg_BanditArmor_01_07","",""
"Scripts/Content/Story/Dialoge/DIA_Addon_PIR_1320_Greg.d:383","Ich muss wissen, warum die Drecksäcke überhaupt in unser Tal gekommen sind.","","","False","DIA_Addon_Greg_BanditArmor_01_08","",""
"Scripts/Content/Story/Dialoge/DIA_Addon_PIR_1320_Greg.d:384","Aye, Aye, Käpt'n!","","","False","DIA_Addon_Greg_BanditArmor_15_09","",""
"Scripts/Content/Story/Dialoge/DIA_Addon_PIR_1320_Greg.d:405","Hast du sonst noch was zu tun für mich?","","","False","DIA_Addon_Greg_Auftraege2.description","",""
"Scripts/Content/Story/Dialoge/DIA_Addon_PIR_1320_Greg.d:429","Hast du sonst noch was zu tun für mich?","","","False","DIA_Addon_Greg_Auftraege2_15_00","",""
"Scripts/Content/Story/Dialoge/DIA_Addon_PIR_1320_Greg.d:438","Der Strand im Norden ist immer noch voller Viecher.","","","False","DIA_Addon_Greg_Auftraege2_01_01","",""
"Scripts/Content/Story/Dialoge/DIA_Addon_PIR_1320_Greg.d:439","Morgan hat auch wirklich gar nichts getan.","","","False","DIA_Addon_Greg_Auftraege2_01_02","",""
"Scripts/Content/Story/Dialoge/DIA_Addon_PIR_1320_Greg.d:450","Im südlichen Turm auf der Klippe sind immer noch Banditen.","","","False","DIA_Addon_Greg_Auftraege2_01_03","",""
"Scripts/Content/Story/Dialoge/DIA_Addon_PIR_1320_Greg.d:451","Francis hätte sich eigentlich darum kümmern sollen.","","","False","DIA_Addon_Greg_Auftraege2_01_04","",""
"Scripts/Content/Story/Dialoge/DIA_Addon_PIR_1320_Greg.d:460","Wenn du willst, kannst du das auch noch erledigen.","","","False","DIA_Addon_Greg_Auftraege2_01_05","",""
"Scripts/Content/Story/Dialoge/DIA_Addon_PIR_1320_Greg.d:472","Der Strand im Norden ist sauber.","","","False","DIA_Addon_Greg_Sauber2.description","",""
"Scripts/Content/Story/Dialoge/DIA_Addon_PIR_1320_Greg.d:491","Der Strand im Norden ist sauber.","","","False","DIA_Addon_Greg_Sauber2_15_00","",""
"Scripts/Content/Story/Dialoge/DIA_Addon_PIR_1320_Greg.d:492","Sehr gut. Hier ist die Belohnung.","","","False","DIA_Addon_Greg_Sauber2_01_01","",""
"Scripts/Content/Story/Dialoge/DIA_Addon_PIR_1320_Greg.d:511","Die Banditen im Turm sind erledigt.","","","False","DIA_Addon_Greg_BanditPlatt2.description","",""
"Scripts/Content/Story/Dialoge/DIA_Addon_PIR_1320_Greg.d:525","Die Banditen im Turm sind erledigt.","","","False","DIA_Addon_Greg_BanditPlatt2_15_00","",""
"Scripts/Content/Story/Dialoge/DIA_Addon_PIR_1320_Greg.d:526","Alles klar. Das war gute Arbeit. Hier ist dein Lohn.","","","False","DIA_Addon_Greg_BanditPlatt2_01_01","",""
"Scripts/Content/Story/Dialoge/DIA_Addon_PIR_1320_Greg.d:546","Die Banditen haben eine Goldmine gefunden.","","","False","DIA_Addon_Greg_BanditGoldmine.description","",""
"Scripts/Content/Story/Dialoge/DIA_Addon_PIR_1320_Greg.d:560","Die Banditen haben eine Goldmine gefunden.","","","False","DIA_Addon_Greg_BanditGoldmine_15_00","",""
"Scripts/Content/Story/Dialoge/DIA_Addon_PIR_1320_Greg.d:561","Ich wusste es! DESHALB sind sie hierhergekommen.","","","False","DIA_Addon_Greg_BanditGoldmine_01_01","",""
"Scripts/Content/Story/Dialoge/DIA_Addon_PIR_1320_Greg.d:562","Kein Mensch lebt freiwillig in dem monsterverseuchten Sumpf.","","","False","DIA_Addon_Greg_BanditGoldmine_01_02","",""
"Scripts/Content/Story/Dialoge/DIA_Addon_PIR_1320_Greg.d:563","Gute Arbeit. Hier, ich hab etwas für dich.","","","False","DIA_Addon_Greg_BanditGoldmine_01_03","",""
"Scripts/Content/Story/Dialoge/DIA_Addon_PIR_1320_Greg.d:582","Wer bist du?","","","False","DIA_Addon_Greg_WhoAreYou.description","",""
"Scripts/Content/Story/Dialoge/DIA_Addon_PIR_1320_Greg.d:596","Wer bist du?","","","False","DIA_Addon_Greg_WhoAreYou_15_00","",""
"Scripts/Content/Story/Dialoge/DIA_Addon_PIR_1320_Greg.d:597","Ich bin Greg, der Anführer von diesem Sauhaufen hier.","","","False","DIA_Addon_Greg_WhoAreYou_01_01","",""
"Scripts/Content/Story/Dialoge/DIA_Addon_PIR_1320_Greg.d:598","Reicht dir das?","","","False","DIA_Addon_Greg_WhoAreYou_01_02","",""
"Scripts/Content/Story/Dialoge/DIA_Addon_PIR_1320_Greg.d:610","Wie bist du eigentlich hier her gekommen?","","","False","DIA_Addon_Greg_NiceToSeeYou.description","",""
"Scripts/Content/Story/Dialoge/DIA_Addon_PIR_1320_Greg.d:624","Wie bist eigentlich hierher gekommen?","","","False","DIA_Addon_Greg_NiceToSeeYou_15_00","",""
"Scripts/Content/Story/Dialoge/DIA_Addon_PIR_1320_Greg.d:625","Mit mir hast du wohl nicht gerechnet, was?","","","False","DIA_Addon_Greg_NiceToSeeYou_01_01","",""
"Scripts/Content/Story/Dialoge/DIA_Addon_PIR_1320_Greg.d:626","Nur damit wir das mal klar stellen. Ich bin Greg und das hier ist mein Lager.","","","False","DIA_Addon_Greg_NiceToSeeYou_01_02","",""
"Scripts/Content/Story/Dialoge/DIA_Addon_PIR_1320_Greg.d:627","Genügt dir das?","","","False","DIA_Addon_Greg_NiceToSeeYou_01_03","",""
"Scripts/Content/Story/Dialoge/DIA_Addon_PIR_1320_Greg.d:640","Eine Sache würde mich noch interesieren.","","","False","DIA_Addon_Greg_Story.description","",""
