"location","source","target","id","fuzzy","context","translator_comments","developer_comments"
"Scripts/Content/Story/Dialoge/DIA_BAU_960_Bengar.d:440","Da bin ja mal gespannt. Da vorne kommen sie nämlich schon. Hab ich's dir doch gesagt.","Je suis impatient de voir ça. Tenez les voilà. Je vous l'avais bien dit.","","","DIA_Bengar_MILIZKLATSCHEN_10_01","",""
"Scripts/Content/Story/Dialoge/DIA_BAU_960_Bengar.d:443","Vermassel es bloß nicht!","Ne gâchez pas tout.","","","DIA_Bengar_MILIZKLATSCHEN_10_02","",""
"Scripts/Content/Story/Dialoge/DIA_BAU_960_Bengar.d:447","Na dann, viel Glück! Zeig's ihnen!","Bon, ben bonne chance ! Faites-leur en voir.","","","DIA_Bengar_MILIZKLATSCHEN_10_03","",""
"Scripts/Content/Story/Dialoge/DIA_BAU_960_Bengar.d:480","Euer Milizproblem ist Vergangenheit.","Votre problème avec la milice est une affaire réglée.","","","DIA_Bengar_MILIZWEG.description","",""
"Scripts/Content/Story/Dialoge/DIA_BAU_960_Bengar.d:498","Euer Milizproblem ist Vergangenheit.","Votre problème de milice appartient au passé.","","","DIA_Bengar_MILIZWEG_15_00","",""
"Scripts/Content/Story/Dialoge/DIA_BAU_960_Bengar.d:502","Bist du verrückt? Weißt du, was die Kerle mit mir machen, wenn du weg bist?","Etes-vous fou ? Savez-vous ce qu'ils me feront quand vous serez parti ?","","","DIA_Bengar_MILIZWEG_10_01","",""
"Scripts/Content/Story/Dialoge/DIA_BAU_960_Bengar.d:503","Die stehen doch noch da vorne rum. Sag ihnen, sie sollen GANZ verschwinden!","Ils traînent encore dans le coin. Dites-leur de disparaître complètement !","","","DIA_Bengar_MILIZWEG_10_02","",""
"Scripts/Content/Story/Dialoge/DIA_BAU_960_Bengar.d:507","Nicht übel. Vielleicht bleibt am Ende des Monats jetzt ja auch mal was übrig. Danke.","Pas mal. Peut-être qu'il nous restera quelque chose à la fin du mois pour changer. Merci.","","","DIA_Bengar_MILIZWEG_10_03","",""
"Scripts/Content/Story/Dialoge/DIA_BAU_960_Bengar.d:511","Du wolltest sogar für mich bezahlen. Sehr anständig von dir.","Vous vouliez même payer pour moi. C'est très aimable à vous.","","","DIA_Bengar_MILIZWEG_10_04","",""
"Scripts/Content/Story/Dialoge/DIA_BAU_960_Bengar.d:532","Balthasar der Schafhirte darf nicht auf deine Weide?","Balthasar le berger n'a pas le droit de se rendre sur vos pâturages ?","","","DIA_Bengar_BALTHASAR.description","",""
"Scripts/Content/Story/Dialoge/DIA_BAU_960_Bengar.d:548","Balthasar der Schafhirte darf nicht auf deine Weide?","Balthasar le berger n'a pas le droit d'aller sur vos pâturages ?","","","DIA_Bengar_BALTHASAR_15_00","",""
"Scripts/Content/Story/Dialoge/DIA_BAU_960_Bengar.d:549","Ach so. Die Geschichte. Ich habe ihm erzählt, Sekob soll mir Geld bezahlen, wenn er die Schafe auf meine Weide führt.","Ah oui ! Cette histoire. Je lui ai dit que Sékob devait me payer s'il voulait mener ses moutons sur mes pâturages.","","","DIA_Bengar_BALTHASAR_10_01","",""
"Scripts/Content/Story/Dialoge/DIA_BAU_960_Bengar.d:550","Wenn ich ehrlich bin, ist das nur Schikane. Ich kann Balthasar einfach nicht leiden.","Pour dire la vérité, c'est juste pour l'embêter. Je ne supporte pas Balthasar.","","","DIA_Bengar_BALTHASAR_10_02","",""
"Scripts/Content/Story/Dialoge/DIA_BAU_960_Bengar.d:564","Die Miliz ist weg und Balthasar kann wieder auf dein Land.","La milice est partie et Balthasar peut de nouveau se rendre sur vos terres.","","","DIA_Bengar_BALTHASARDARFAUFWEIDE.description","",""
"Scripts/Content/Story/Dialoge/DIA_BAU_960_Bengar.d:581","Die Miliz ist weg und Balthasar kann wieder auf dein Land.","La milice est partie et Balthasar peut de nouveau se rendre sur vos terres.","","","DIA_Bengar_BALTHASARDARFAUFWEIDE_15_00","",""
"Scripts/Content/Story/Dialoge/DIA_BAU_960_Bengar.d:582","Wieso?","Pourquoi ?","","","DIA_Bengar_BALTHASARDARFAUFWEIDE_10_01","",""
"Scripts/Content/Story/Dialoge/DIA_BAU_960_Bengar.d:583","(droht) Weil ich es gesagt habe.","(menaçant) Parce que j'en ai décidé ainsi.","","","DIA_Bengar_BALTHASARDARFAUFWEIDE_15_02","",""
"Scripts/Content/Story/Dialoge/DIA_BAU_960_Bengar.d:584","Mmh. Na gut, wie du meinst.","Hum. Très bien, comme vous voulez.","","","DIA_Bengar_BALTHASARDARFAUFWEIDE_10_03","",""
"Scripts/Content/Story/Dialoge/DIA_BAU_960_Bengar.d:585","Soll er sich hinter dem Feld eine Stelle mit seinen Viechern suchen.","Qu'il trouve un endroit pour ses bêtes quelque part derrière les champs.","","","DIA_Bengar_BALTHASARDARFAUFWEIDE_10_04","",""
"Scripts/Content/Story/Dialoge/DIA_BAU_960_Bengar.d:601","Bleib senkrecht.","Faites attention à vous.","","","DIA_Bengar_PERMKAP1.description","",""
"Scripts/Content/Story/Dialoge/DIA_BAU_960_Bengar.d:615","Bleib senkrecht.","Prenez soin de vous.","","","DIA_Bengar_PERMKAP1_15_00","",""
"Scripts/Content/Story/Dialoge/DIA_BAU_960_Bengar.d:616","Du auch.","Vous aussi.","","","DIA_Bengar_PERMKAP1_10_01","",""
"Scripts/Content/Story/Dialoge/DIA_BAU_960_Bengar.d:664","Wie ist die Lage?","Comment ça se passe ?","","","DIA_Bengar_ALLEIN.description","",""
"Scripts/Content/Story/Dialoge/DIA_BAU_960_Bengar.d:677","Wie ist die Lage?","Où en est la situation ?","","","DIA_Bengar_ALLEIN_15_00","",""
"Scripts/Content/Story/Dialoge/DIA_BAU_960_Bengar.d:681","Malak ist verschwunden und hat alles und jeden mitgenommen, der für mich arbeiten wollte. Er sagte, er wollte in die Berge.","Malak a disparu avec tous ceux qui travaillaient pour moi et toutes nos affaires. Il a dit qu'il se dirigeait vers les montagnes.","","","DIA_Bengar_ALLEIN_10_01","",""
"Scripts/Content/Story/Dialoge/DIA_BAU_960_Bengar.d:682","Er hat es hier nicht mehr ausgehalten.","Il ne supportait plus sa situation ici.","","","DIA_Bengar_ALLEIN_10_02","",""
"Scripts/Content/Story/Dialoge/DIA_BAU_960_Bengar.d:687","Schwere Zeiten sind das. Ich weiß nicht, ob ich noch länger durchhalte.","Les temps sont durs. Je ne sais pas encore combien de temps je pourrai tenir.","","","DIA_Bengar_ALLEIN_10_03","",""
"Scripts/Content/Story/Dialoge/DIA_BAU_960_Bengar.d:690","Die Horden von Monstern, die täglich aus dem Pass aufs Weidenplateau kommen, machen mich ganz fertig.","Les hordes de monstres qui se déversent par le col chaque jour dans les hauts pâturages m'inquiètent.","","","DIA_Bengar_ALLEIN_10_04","",""
"Scripts/Content/Story/Dialoge/DIA_BAU_960_Bengar.d:691","Wenn ich wenigstens ein paar Helfer oder Söldner hätte.","Si au moins j'avais un peu d'aide ou quelques mercenaires.","","","DIA_Bengar_ALLEIN_10_05","",""
"Scripts/Content/Story/Dialoge/DIA_BAU_960_Bengar.d:692","Es gab sogar schon mal einen, der für mich arbeiten wollte. Hat es aber dann doch nicht getan. Ich glaube, 'Wolf' war sein Name.","Il y en avait un qui voulait bien m'aider mais il a changé d'avis. Je crois que son nom était Wolf.","","","DIA_Bengar_ALLEIN_10_06","",""
"Scripts/Content/Story/Dialoge/DIA_BAU_960_Bengar.d:710","Malak ist tot.","Malak est mort.","","","DIA_Bengar_MALAKTOT.description","",""
"Scripts/Content/Story/Dialoge/DIA_BAU_960_Bengar.d:724","Malak ist tot.","Malak est mort.","","","DIA_Bengar_MALAKTOT_15_00","",""
"Scripts/Content/Story/Dialoge/DIA_BAU_960_Bengar.d:725","Dann wird alles nur noch schlimmer werden.","Alors la situation ne peut qu'empirer.","","","DIA_Bengar_MALAKTOT_10_01","",""
"Scripts/Content/Story/Dialoge/DIA_BAU_960_Bengar.d:737","Ich habe dir den Söldner besorgt, den du wolltest.","Je vous ai dégoté le mercenaire que vous vouliez.","","","DIA_Bengar_SLDDA.description","",""
"Scripts/Content/Story/Dialoge/DIA_BAU_960_Bengar.d:752","Ich habe dir den Söldner besorgt, den du wolltest.","Je vous ai trouvé le mercenaire dont vous aviez besoin.","","","DIA_Bengar_SLDDA_15_00","",""
"Scripts/Content/Story/Dialoge/DIA_BAU_960_Bengar.d:753","Ich hatte noch nie so jemanden auf meinem Hof. Hoffentlich geht das gut.","Je n'ai jamais vu quelqu'un comme lui ici. J'espère simplement que ça va marcher.","","","DIA_Bengar_SLDDA_10_01","",""
"Scripts/Content/Story/Dialoge/DIA_BAU_960_Bengar.d:754","Hier, nimm dies. Ich denke, das kannst du gebrauchen.","Tenez, prenez ceci. Je pense que cela vous sera utile.","","","DIA_Bengar_SLDDA_10_02","",""
"Scripts/Content/Story/Dialoge/DIA_BAU_960_Bengar.d:769","Malak ist wieder da.","Malak est de retour.","","","DIA_Bengar_MALAKWIEDERDA.description","",""
"Scripts/Content/Story/Dialoge/DIA_BAU_960_Bengar.d:784","Malak ist wieder da.","Malak est de retour.","","","DIA_Bengar_MALAKWIEDERDA_15_00","",""
"Scripts/Content/Story/Dialoge/DIA_BAU_960_Bengar.d:785","Das wurde auch Zeit. Ich dachte schon, ich würde ihn nie wiedersehen.","Il était temps. J'ai bien cru que je ne le reverrais jamais.","","","DIA_Bengar_MALAKWIEDERDA_10_01","",""
"Scripts/Content/Story/Dialoge/DIA_BAU_960_Bengar.d:799","Das wird schon wieder.","Tout ira bien.","","","DIA_Bengar_PERM.description","",""
"Scripts/Content/Story/Dialoge/DIA_BAU_960_Bengar.d:813","Das wird schon wieder.","Tout ira bien.","","","DIA_Bengar_PERM_15_00","",""
"Scripts/Content/Story/Dialoge/DIA_BAU_960_Bengar.d:818","Malak ist zwar wieder da, aber die Situation hat sich kaum verändert.","Malak est de retour mais la situation est toujours la même.","","","DIA_Bengar_PERM_10_01","",""
"Scripts/Content/Story/Dialoge/DIA_BAU_960_Bengar.d:819","Wenn kein Wunder geschieht, werden wir hier alle noch zu Grunde gehen.","A moins qu'il n'y ait un miracle, nous allons tous être balayés.","","","DIA_Bengar_PERM_10_02","",""
"Scripts/Content/Story/Dialoge/DIA_BAU_960_Bengar.d:825","Wolf ist schon ein merkwürdiger Kerl, aber ich denke, das wird schon irgendwie gehen.","Wolf est un étrange individu mais je crois que ça va marcher.","","","DIA_Bengar_PERM_10_03","",""
"Scripts/Content/Story/Dialoge/DIA_BAU_960_Bengar.d:829","Ohne Malak läuft hier gar nichts mehr. Wenn nicht bald etwas passiert, muss ich meinen Hof aufgeben.","Sans Malak, tout est laissé à l'abandon. S'il ne se passe pas quelque chose très vite, je vais devoir renoncer à ma ferme.","","","DIA_Bengar_PERM_10_04","",""
"Scripts/Content/Story/Dialoge/DIA_BAU_960_Bengar.d:834","Hoffentlich kommt er bald zurück.","Heureusement, il reviendra bientôt.","","","DIA_Bengar_PERM_10_05","",""
"Scripts/Content/Story/Dialoge/DIA_BAU_961_Gaan.d:57","Ein neues Gesicht in unserer Runde. Willkommen im 'Ring des Wassers'.","Une nouvelle tête parmi nous. Bienvenue à 'L'Anneau de l'eau'.","","","DIA_Addon_Gaan_MeetingIsRunning_03_00","",""
"Scripts/Content/Story/Dialoge/DIA_BAU_961_Gaan.d:62","Vatras möchte dich sehen. Am besten, du gehst gleich zu ihm.","Vatras veut vous voir. Allez-y maintenant.","","","DIA_Addon_Gaan_MeetingIsRunning_03_01","",""
"Scripts/Content/Story/Dialoge/DIA_BAU_961_Gaan.d:77","Ziemlich weitläufig, euer Land hier oben.","Vous bénéficiez de beaucoup d'espace ici.","","","DIA_Gaan_HALLO.description","",""
"Scripts/Content/Story/Dialoge/DIA_BAU_961_Gaan.d:87","Ziemlich weitläufig, euer Land hier oben.","Vous avez beaucoup d'espace ici.","","","DIA_Gaan_HALLO_15_00","",""
"Scripts/Content/Story/Dialoge/DIA_BAU_961_Gaan.d:88","Ist ganz nett. Aber wenn du durch den Pass da hinten gehst, dann wirst du das nicht mehr denken.","C'est pas mal mais si vous franchissez le col là-bas, vous changerez vite d'avis.","","","DIA_Gaan_HALLO_03_01","",""
"Scripts/Content/Story/Dialoge/DIA_BAU_961_Gaan.d:89","Wenn dich dieser kleine Landstrich hier schon beeindruckt, dann wird es das Minental dahinter erst recht.","Si cette petite parcelle de terre vous impressionne, attendez de voir la Vallée des mines.","","","DIA_Gaan_HALLO_03_02","",""
"Scripts/Content/Story/Dialoge/DIA_BAU_961_Gaan.d:101","Wer bist du?","Qui êtes-vous ?","","","DIA_Gaan_WASMACHSTDU.description","",""
"Scripts/Content/Story/Dialoge/DIA_BAU_961_Gaan.d:116","Wer bist du?","Qui êtes-vous ?","","","DIA_Gaan_WASMACHSTDU_15_00","",""
"Scripts/Content/Story/Dialoge/DIA_BAU_961_Gaan.d:117","Mein Name ist Gaan. Ich bin Jäger und arbeite für Bengar, den Bauern hier auf dem Weidenplateau.","Je m'appelle Gaan. Je suis chasseur et je travaille pour Bengar, le fermier des hauts pâturages.","","","DIA_Gaan_WASMACHSTDU_03_01","",""
"Scripts/Content/Story/Dialoge/DIA_BAU_961_Gaan.d:118","Ich bin meistens hier draußen und lass mir die Sonne auf den Bauch scheinen.","Je passe le plus clair de mon temps dehors à me baigner au soleil.","","","DIA_Gaan_WASMACHSTDU_03_02","",""
"Scripts/Content/Story/Dialoge/DIA_BAU_961_Gaan.d:130","Warum schaust du so ernst?","Pourquoi êtes-vous aussi solennel ?","","","DIA_Addon_Gaan_Ranger.description","",""
"Scripts/Content/Story/Dialoge/DIA_BAU_961_Gaan.d:145","Warum schaust du so ernst?","Pourquoi êtes-vous aussi solennel ?","","","DIA_Addon_Gaan_Ranger_15_00","",""
"Scripts/Content/Story/Dialoge/DIA_BAU_961_Gaan.d:146","Du trägst unseren Aquamarinring.","Vous portez notre anneau d'aigue-marine.","","","DIA_Addon_Gaan_Ranger_03_01","",""
"Scripts/Content/Story/Dialoge/DIA_BAU_961_Gaan.d:147","Du gehörst zum 'Ring des Wassers'?","Vous appartenez à 'L'Anneau de l'eau' ?","","","DIA_Addon_Gaan_Ranger_15_02","",""
"Scripts/Content/Story/Dialoge/DIA_BAU_961_Gaan.d:148","Allerdings. Endlich wieder ein neues Gesicht in unseren Reihen.","Tout à fait. Heureux de voir une nouvelle tête dans nos rangs.","","","DIA_Addon_Gaan_Ranger_03_03","",""
"Scripts/Content/Story/Dialoge/DIA_BAU_961_Gaan.d:161","Was ist deine Aufgabe beim 'Ring des Wassers'?","Quelles sont vos fonctions au sein de 'L'Anneau de l'eau' ?","","","DIA_Addon_Gaan_AufgabeBeimRing.description","",""
"Scripts/Content/Story/Dialoge/DIA_BAU_961_Gaan.d:176","Was ist deine Aufgabe beim 'Ring des Wassers'?","Quelles sont vos fonctions au sein de 'L'Anneau de l'eau' ?","","","DIA_Addon_Gaan_AufgabeBeimRing_15_00","",""
"Scripts/Content/Story/Dialoge/DIA_BAU_961_Gaan.d:177","Ich halte für uns, den Eingang zum Pass im Auge. Wer rein geht und wer raus kommt.","Je surveille l'accès au col pour savoir qui entre et qui sort.","","","DIA_Addon_Gaan_AufgabeBeimRing_03_01","",""
"Scripts/Content/Story/Dialoge/DIA_BAU_961_Gaan.d:178","Seit die Paladine das Tor zum Pass verschlossen haben, tat sich da allerdings recht wenig.","Depuis que les paladins ont fermé la porte donnant sur le col, il n'y a plus beaucoup de passage.","","","DIA_Addon_Gaan_AufgabeBeimRing_03_02","",""
"Scripts/Content/Story/Dialoge/DIA_BAU_961_Gaan.d:190","Schon etwas von den vermissten Leuten gehört?","Avez-vous entendu parler des disparitions ?","","","DIA_Addon_Gaan_MissingPeople.description","",""
"Scripts/Content/Story/Dialoge/DIA_BAU_961_Gaan.d:204","Schon etwas von den vermissten Leuten gehört?","Avez-vous entendu parler des disparitions ?","","","DIA_Addon_Gaan_MissingPeople_15_00","",""
"Scripts/Content/Story/Dialoge/DIA_BAU_961_Gaan.d:205","Natürlich. Deswegen sollten wir ja auch alle die Augen aufhalten.","Bien sûr. C'est pour cela que nous devons rester vigilants.","","","DIA_Addon_Gaan_MissingPeople_03_01","",""
"Scripts/Content/Story/Dialoge/DIA_BAU_961_Gaan.d:206","Aber um ehrlich zu sein, habe ich noch nicht sehr viel davon mitbekommen.","Mais je dois vous avouer que je n'ai rien vu qui puisse vous aider.","","","DIA_Addon_Gaan_MissingPeople_03_02","",""
"Scripts/Content/Story/Dialoge/DIA_BAU_961_Gaan.d:218","Was muss ich über das Minental wissen?","Que dois-je savoir sur la Vallée des mines ?","","","DIA_Gaan_WALD.description","",""
"Scripts/Content/Story/Dialoge/DIA_BAU_961_Gaan.d:228","Was muss ich über das Minental wissen?","Que dois-je savoir sur la Vallée des mines ?","","","DIA_Gaan_WALD_15_00","",""
"Scripts/Content/Story/Dialoge/DIA_BAU_961_Gaan.d:229","Keine Ahnung. Ich habe nur einmal einen flüchtigen Blick über das Tal geworfen. Sah ziemlich gefährlich aus.","Aucune idée. Je n'ai fait qu'y jeter un coup d'œil. Ça m'a l'air assez dangereux.","","","DIA_Gaan_WALD_03_01","",""
"Scripts/Content/Story/Dialoge/DIA_BAU_961_Gaan.d:230","Am besten, du entfernst dich nicht all zu weit von den Trampelpfaden, wenn du durch den Pass dort hin gehst.","La meilleure chose à faire si vous y aller par le col, c'est de ne pas vous éloigner de la piste.","","","DIA_Gaan_WALD_03_02","",""
"Scripts/Content/Story/Dialoge/DIA_BAU_961_Gaan.d:231","Entweder du nimmst den Weg durch die große Schlucht oder den Weg über die Steinbrücke. Der ist kürzer und ungefährlicher.","Soit vous prenez le chemin par la grande gorge ou la route du pont de pierre. Celle-ci est la plus courte et la plus sûre.","","","DIA_Gaan_WALD_03_03","",""
"Scripts/Content/Story/Dialoge/DIA_BAU_961_Gaan.d:232","Jetzt, da die Orks überall herumstreunen, sollte man sich schon ein wenig vorsehen.","Maintenant que les orques sont partout, vous devrez être prudent.","","","DIA_Gaan_WALD_03_04","",""
"Scripts/Content/Story/Dialoge/DIA_BAU_961_Gaan.d:233","Ich will dich ja nicht zur Kräuterhexe schleppen müssen.","Je ne voudrais pas avoir à vous conduire auprès de la sorcière herboriste.","","","DIA_Gaan_WALD_03_05","",""
"Scripts/Content/Story/Dialoge/DIA_BAU_961_Gaan.d:245","Kräuterhexe?","La sorcière herboriste ?","","","DIA_Gaan_SAGITTA.description","",""
"Scripts/Content/Story/Dialoge/DIA_BAU_961_Gaan.d:258","Kräuterhexe?","La sorcière herboriste ?","","","DIA_Gaan_SAGITTA_15_00","",""
"Scripts/Content/Story/Dialoge/DIA_BAU_961_Gaan.d:259","Ihr Name ist Sagitta. Sie ist die Heilerin der Bauern und der anderen Bewohner außerhalb der Hafenstadt.","Elle s'appelle Sagitta. C'est la guérisseuse des fermiers et de ceux qui vivent hors de la ville portuaire.","","","DIA_Gaan_SAGITTA_03_01","",""
"Scripts/Content/Story/Dialoge/DIA_BAU_961_Gaan.d:260","Ein recht seltsames Frauenzimmer.","Une femme vraiment curieuse.","","","DIA_Gaan_SAGITTA_03_02","",""
"Scripts/Content/Story/Dialoge/DIA_BAU_961_Gaan.d:261","Niemand geht wirklich gerne zu ihr und alle zerreißen sich gerne das Maul über sie.","Personne n'aime vraiment aller la voir et tout le monde adore faire des commérages à son sujet.","","","DIA_Gaan_SAGITTA_03_03","",""
"Scripts/Content/Story/Dialoge/DIA_BAU_961_Gaan.d:262","Aber wenn du krank bist, findest du keine bessere Hilfe als Sagitta und ihre Heilkräuterküche.","Mais si vous êtes malade, vous ne trouverez personne qui puisse mieux vous aider que Sagitta et sa cuisine pleine d'herbes médicinales.","","","DIA_Gaan_SAGITTA_03_04","",""
"Scripts/Content/Story/Dialoge/DIA_BAU_961_Gaan.d:263","Du findest sie in dem Waldstreifen hinter Sekobs Hof.","Vous la trouverez dans le petit bois près de la ferme de Sékob.","","","DIA_Gaan_SAGITTA_03_05","",""
"Scripts/Content/Story/Dialoge/DIA_BAU_961_Gaan.d:275","Wie sieht dieses gefährliche Tier aus?","A quoi ressemble cette bête si dangereuse ?","","","DIA_Gaan_MONSTER.description","",""
"Scripts/Content/Story/Dialoge/DIA_BAU_961_Gaan.d:291","Wie sieht dieses gefährliche Tier aus?","A quoi ressemble cette bête si dangereuse ?","","","DIA_Gaan_MONSTER_15_00","",""
"Scripts/Content/Story/Dialoge/DIA_BAU_961_Gaan.d:292","Ich weiß es nicht genau. Ich habe es bisher nur hauptsächlich schnauben und kratzen hören. Aber ich habe gesehen, was es anrichten kann.","Je ne sais pas exactement. Pour l'instant je n'ai fait qu'entendre des grognements et des grattements. Mais j'ai vu ce qu'elle pouvait faire.","","","DIA_Gaan_MONSTER_03_01","",""
"Scripts/Content/Story/Dialoge/DIA_BAU_961_Gaan.d:293","Selbst Wölfe sind vor ihm nicht sicher. Einem hat das Biest sogar den Kopf abgebissen.","Même les loups en ont peur. La bête a mordu la tête de l'un d'eux.","","","DIA_Gaan_MONSTER_03_02","",""
"Scripts/Content/Story/Dialoge/DIA_BAU_961_Gaan.d:305","Was würdest du zahlen, wenn ich das Tier für dich erledige?","Combien m'offrez-vous pour tuer cette bête ?","","","DIA_Gaan_WASZAHLSTDU.description","",""
"Scripts/Content/Story/Dialoge/DIA_BAU_961_Gaan.d:321","Was würdest du zahlen, wenn ich das Tier für dich erledige?","Combien me donneriez-vous si je tuais la bête pour vous ?","","","DIA_Gaan_WASZAHLSTDU_15_00","",""
"Scripts/Content/Story/Dialoge/DIA_BAU_961_Gaan.d:322","Ich würde demjenigen, der es tötet, alles geben, was ich entbehren kann.","Je donnerais tout ce que je peux à la personne qui la tuera.","","","DIA_Gaan_WASZAHLSTDU_03_01","",""
"Scripts/Content/Story/Dialoge/DIA_BAU_961_Gaan.d:338","Woher kommt dieses Mistvieh?","D'où vient cette bête immonde ?","","","DIA_Gaan_WOHERMONSTER.description","",""
"Scripts/Content/Story/Dialoge/DIA_BAU_961_Gaan.d:354","Woher kommt dieses Mistvieh?","D'où vient cette bête ?","","","DIA_Gaan_WOHERMONSTER_15_00","",""
"Scripts/Content/Story/Dialoge/DIA_BAU_961_Gaan.d:355","Irgendwo aus den Wäldern. Vielleicht auch aus dem Minental. Aber genau weiß ich das nicht.","De quelque part hors de la forêt. Peut-être la Vallée des mines. Mais je n'en suis pas sûr.","","","DIA_Gaan_WOHERMONSTER_03_01","",""
"Scripts/Content/Story/Dialoge/DIA_BAU_961_Gaan.d:356","Ich war noch nie im Minental.","Je ne suis jamais allé dans la Vallée des mines.","","","DIA_Gaan_WOHERMONSTER_03_02","",""
"Scripts/Content/Story/Dialoge/DIA_BAU_961_Gaan.d:382","Dieses furchtbare Tier ist tot, nehme ich an.","Je présume que cet horrible animal est mort.","","","DIA_Gaan_MONSTERTOT_03_00","",""
"Scripts/Content/Story/Dialoge/DIA_BAU_961_Gaan.d:383","Dann kann ich mich bei der Jagd endlich wieder frei bewegen.","Je peux donc de nouveau chasser en paix.","","","DIA_Gaan_MONSTERTOT_03_01","",""
"Scripts/Content/Story/Dialoge/DIA_BAU_961_Gaan.d:387","Hier hast du das versprochene Geld.","Voici l'argent que je vous ai promis.","","","DIA_Gaan_MONSTERTOT_03_02","",""
"Scripts/Content/Story/Dialoge/DIA_BAU_961_Gaan.d:407","Kannst du mir was über die Jagd beibringen?","Pouvez-vous m'apprendre des choses sur la chasse ?","","","DIA_Gaan_AskTeacher.description","",""
"Scripts/Content/Story/Dialoge/DIA_BAU_961_Gaan.d:417","Kannst du mir was über die Jagd beibringen?","Pouvez-vous m'apprendre à chasser ?","","","DIA_Gaan_AskTeacher_15_00","",""
"Scripts/Content/Story/Dialoge/DIA_BAU_961_Gaan.d:418","Kein Problem. Für 100 Goldmünzen könnte ich dir zeigen, wie du die Tiere, die du erlegst, ausweiden kannst.","Pas de problème. Pour 100 pièces d'or je peux vous apprendre à dépecer les animaux que vous abattez.","","","DIA_Gaan_AskTeacher_03_01","",""
"Scripts/Content/Story/Dialoge/DIA_BAU_961_Gaan.d:419","Felle und andere Tiertrophäen bringen eine Menge Geld auf dem Markt.","Les peaux et les autres trophées rapportent beaucoup d'argent au marché.","","","DIA_Gaan_AskTeacher_03_02","",""
"Scripts/Content/Story/Dialoge/DIA_BAU_961_Gaan.d:435","Hier. 100 Goldmünzen für dein Wissen, Tiere auszunehmen.","Tenez. 100 pièces d'or pour m'enseigner à dépecer les animaux.","","","DIA_Gaan_PayTeacher.description","",""
"Scripts/Content/Story/Dialoge/DIA_BAU_961_Gaan.d:451","Hier. 100 Goldmünzen für dein Wissen, Tiere auszunehmen.","Tenez. 100 pièces d'or pour m'apprendre à dépecer les animaux.","","","DIA_Gaan_PayTeacher_15_00","",""
"Scripts/Content/Story/Dialoge/DIA_BAU_961_Gaan.d:455","Danke. Jetzt kommen wir ins Geschäft.","Merci.","","","DIA_Gaan_PayTeacher_03_01","",""
"Scripts/Content/Story/Dialoge/DIA_BAU_961_Gaan.d:461","Frag mich später noch mal, wenn du das Geld hast.","Revenez plus tard quand vous aurez de l'argent.","","","DIA_Gaan_PayTeacher_03_02","",""
"Scripts/Content/Story/Dialoge/DIA_BAU_961_Gaan.d:475","Was kannst du mir beibringen?","Que pouvez-vous m'enseigner ?","","","DIA_Gaan_TEACHHUNTING.description","",""
"Scripts/Content/Story/Dialoge/DIA_BAU_961_Gaan.d:488","Was kannst du mir beibringen?","Que pouvez-vous m'apprendre ?","","","DIA_Gaan_TEACHHUNTING_15_00","",""
"Scripts/Content/Story/Dialoge/DIA_BAU_961_Gaan.d:498","Kommt darauf an, was du wissen willst.","Cela dépend de ce que vous voulez savoir.","","","DIA_Gaan_TEACHHUNTING_03_01","",""
"Scripts/Content/Story/Dialoge/DIA_BAU_961_Gaan.d:535","Ich kann dir im Moment nicht mehr beibringen, als du ohnehin schon weißt. Tut mir Leid.","Pour le moment je ne peux rien vous apprendre que vous ne sachiez déjà. Navré.","","","DIA_Gaan_TEACHHUNTING_03_02","",""
"Scripts/Content/Story/Dialoge/DIA_BAU_961_Gaan.d:549","Tiere geben ihre Klauen nicht sehr gerne her. Du musst schon sehr genau den Punkt treffen, an dem du mit deinem Messer ansetzt.","Les animaux n'aiment pas se séparer de leurs griffes. Vous devez placer votre couteau avec une grande précision.","","","DIA_Gaan_TEACHHUNTING_Claws_03_00","",""
"Scripts/Content/Story/Dialoge/DIA_BAU_961_Gaan.d:550","Die Haltung deiner Hand sollte etwas verschränkt sein. Mit einem kräftigen Ruck trennst du dann die Klaue ab.","Les mains légèrement croisées, vous ôtez les griffes d'un coup sec et ferme.","","","DIA_Gaan_TEACHHUNTING_Claws_03_01","",""
"Scripts/Content/Story/Dialoge/DIA_BAU_961_Gaan.d:551","Klauen sind immer ein begehrtes Zahlungsmittel bei einem Händler.","Les marchands adorent être payés en griffes.","","","DIA_Gaan_TEACHHUNTING_Claws_03_02","",""
"Scripts/Content/Story/Dialoge/DIA_BAU_961_Gaan.d:563","Das einfachste, was du Tieren entnehmen kannst, sind seine Zähne. Du fährst mit deinem Messer in seinem Maul um das Gebiss.","La chose la plus facile à prendre sur un animal, ce sont ses crocs. Vous faites glisser le couteau autour de la racine.","","","DIA_Gaan_TEACHHUNTING_Teeth_03_00","",""
"Scripts/Content/Story/Dialoge/DIA_BAU_961_Gaan.d:564","Dann trennst es geschickt mit einem Ruck vom Schädel des Tieres.","Puis vous les arrachez de la mâchoire d'un coup sec.","","","DIA_Gaan_TEACHHUNTING_Teeth_03_01","",""
"Scripts/Content/Story/Dialoge/DIA_BAU_961_Gaan.d:576","Felle ziehst du am besten ab, indem du einen tiefen Schnitt an den Hinterläufen des Tieres vornimmst.","Le meilleur moyen d'écorcher la peau est de pratiquer une profonde incision le long des pattes arrières.","","","DIA_Gaan_TEACHHUNTING_Fur_03_00","",""
