"location","source","target","id","fuzzy","context","translator_comments","developer_comments"
"Scripts/Content/Story/Dialoge/DIA_BAU_912_Pepe.d:362","Hier sind 100 Goldstücke. Gib mir ein Schaf.","Tenez, voici 100 pièces d'or. Donnez-moi un mouton.","","","DIA_Pepe_BuyLiesel_15_00","",""
"Scripts/Content/Story/Dialoge/DIA_BAU_912_Pepe.d:368","Gut. Dann nimm dir die Liesel mit - du findest sie hier auf der Weide.","Bien. Prenez Betsy, vous la trouverez dans les pâturages.","","","DIA_Pepe_BuyLiesel_03_01","",""
"Scripts/Content/Story/Dialoge/DIA_BAU_912_Pepe.d:369","Sag ihr einfach, sie soll dir folgen. Sie ist ziemlich klug für ein Schaf. Behandele sie gut!","Dites-lui juste de vous suivre. Elle est plutôt intelligente pour une brebis. Traitez-la bien !","","","DIA_Pepe_BuyLiesel_03_02","",""
"Scripts/Content/Story/Dialoge/DIA_BAU_912_Pepe.d:373","Schon wieder? Na schön. Nimm dir die Liesel mit.","Encore ? D'accord. Prenez Betsy.","","","DIA_Pepe_BuyLiesel_03_03","",""
"Scripts/Content/Story/Dialoge/DIA_BAU_912_Pepe.d:374","Liesel? Das letzte Schaf hieß schon Liesel ...","Betsy ? Mais le dernier mouton s'appelait aussi Betsy...","","","DIA_Pepe_BuyLiesel_15_04","",""
"Scripts/Content/Story/Dialoge/DIA_BAU_912_Pepe.d:375","Alle Schafe heißen Liesel.","Tous les moutons s'appellent Betsy.","","","DIA_Pepe_BuyLiesel_03_05","",""
"Scripts/Content/Story/Dialoge/DIA_BAU_912_Pepe.d:378","Bis auf die Hammel, natürlich.","Sauf les béliers bien entendu.","","","DIA_Pepe_BuyLiesel_03_06","",""
"Scripts/Content/Story/Dialoge/DIA_BAU_912_Pepe.d:379","Und wie heißen die?","Et quel est leur nom ?","","","DIA_Pepe_BuyLiesel_15_07","",""
"Scripts/Content/Story/Dialoge/DIA_BAU_912_Pepe.d:380","Horst.","Bruce.","","","DIA_Pepe_BuyLiesel_03_08","",""
"Scripts/Content/Story/Dialoge/DIA_BAU_912_Pepe.d:391","Soviel Gold hast du nicht. Billiger kann ich dir keins geben.","Vous n'avez pas assez d'or. Je ne peux vous donner un mouton pour moins.","","","DIA_Pepe_BuyLiesel_03_09","",""
"Scripts/Content/Story/Dialoge/DIA_BAU_913_Thekla.d:43","Was machst du hier in meiner Küche?","Que faites-vous dans ma cuisine ?","","","DIA_Thekla_HALLO_17_00","",""
"Scripts/Content/Story/Dialoge/DIA_BAU_913_Thekla.d:55","Das riecht aber lecker hier!","Quelque chose sent très bon ici !","","","DIA_Thekla_Lecker.description","",""
"Scripts/Content/Story/Dialoge/DIA_BAU_913_Thekla.d:68","Das riecht aber lecker hier!","Il y a quelque chose qui sent très bon ici.","","","DIA_Thekla_Lecker_15_00","",""
"Scripts/Content/Story/Dialoge/DIA_BAU_913_Thekla.d:69","Oh ja! Ich kenne Typen wie dich. Die rennen hier zuhauf rum.","Oh ! Je vous vois venir ! Vous êtes comme tous les autres qui ne cessent de venir ici !","","","DIA_Thekla_Lecker_17_01","",""
"Scripts/Content/Story/Dialoge/DIA_BAU_913_Thekla.d:70","Wollen sich erst einschmeicheln, und wenn man sie mal braucht, sind sie nirgendwo zu sehen!","Ils essayent d'abord de vous amadouer et puis quand on a besoin d'eux, il n'y a plus personne !","","","DIA_Thekla_Lecker_17_02","",""
"Scripts/Content/Story/Dialoge/DIA_BAU_913_Thekla.d:84","Ich habe Hunger!","Je suis affamé !","","","DIA_Thekla_Hunger.description","",""
"Scripts/Content/Story/Dialoge/DIA_BAU_913_Thekla.d:97","Ich habe Hunger!","Je suis affamé !","","","DIA_Thekla_Hunger_15_00","",""
"Scripts/Content/Story/Dialoge/DIA_BAU_913_Thekla.d:100","Ich verteile kein Essen an Landstreicher. Hier gibt's nur was für die Leute, die arbeiten.","Je ne sers pas de repas aux vagabonds. Je ne donne à manger qu'à ceux qui travaillent.","","","DIA_Thekla_Hunger_17_01","",""
"Scripts/Content/Story/Dialoge/DIA_BAU_913_Thekla.d:101","(verächtlich) Und für das Söldnerpack natürlich.","(méprisante) Et à cette racaille de mercenaires, naturellement.","","","DIA_Thekla_Hunger_17_02","",""
"Scripts/Content/Story/Dialoge/DIA_BAU_913_Thekla.d:106","Hier, friss!","Tenez, votre bouffe.","","","DIA_Thekla_Hunger_17_03","",""
"Scripts/Content/Story/Dialoge/DIA_BAU_913_Thekla.d:112","Milizen werden hier nicht bedient.","On ne sert pas la milice ici.","","","DIA_Thekla_Hunger_17_04","",""
"Scripts/Content/Story/Dialoge/DIA_BAU_913_Thekla.d:116","Wie könnte ich einem Vertreter Innos' eine Bitte abschlagen.","Comment pourrais-je refuser quoi que ce soit à un représentant d'Innos ?","","","DIA_Thekla_Hunger_17_05","",""
"Scripts/Content/Story/Dialoge/DIA_BAU_913_Thekla.d:131","Ich suche Arbeit.","Je cherche du travail.","","","DIA_Thekla_Arbeit.description","",""
"Scripts/Content/Story/Dialoge/DIA_BAU_913_Thekla.d:144","Ich suche Arbeit...","Je cherche du travail...","","","DIA_Thekla_Arbeit_15_00","",""
"Scripts/Content/Story/Dialoge/DIA_BAU_913_Thekla.d:145","Du willst hier auf dem Hof arbeiten?","Vous voulez travailler à la ferme ?","","","DIA_Thekla_Arbeit_17_01","",""
"Scripts/Content/Story/Dialoge/DIA_BAU_913_Thekla.d:146","Das kann nur Onar entscheiden. Ihm gehört der Hof und das ganze Tal.","Seul Onar peut prendre la décision. La ferme lui appartient ainsi que toute la vallée.","","","DIA_Thekla_Arbeit_17_02","",""
"Scripts/Content/Story/Dialoge/DIA_BAU_913_Thekla.d:158","Ich wollte mich eigentlich den Söldnern anschließen...","En fait, j'envisageais de rejoindre les mercenaires...","","","DIA_Thekla_WannaJoin.description","",""
"Scripts/Content/Story/Dialoge/DIA_BAU_913_Thekla.d:172","Ich wollte mich eigentlich den Söldnern anschließen...","En fait, j'envisageais de me joindre aux mercenaires.","","","DIA_Thekla_WannaJoin_15_00","",""
"Scripts/Content/Story/Dialoge/DIA_BAU_913_Thekla.d:173","Du bist wohl auch einer von diesen Verbrechern aus der Strafkolonie?","Ainsi vous êtes encore un de ces gars de la colonie pénitentiaire ?","","","DIA_Thekla_WannaJoin_17_01","",""
"Scripts/Content/Story/Dialoge/DIA_BAU_913_Thekla.d:174","Hätte ich mir gleich denken können! Lass mich bloß in Ruhe! Hier gibt's schon genug Männer wie dich!","J'aurais dû m'en douter ! Laissez-moi tranquille ! Vous êtes suffisamment nombreux comme ça dans le coin !","","","DIA_Thekla_WannaJoin_17_02","",""
"Scripts/Content/Story/Dialoge/DIA_BAU_913_Thekla.d:186","Ich brauche einen Platz zum Schlafen.","J'ai besoin d'un endroit où dormir.","","","DIA_Thekla_Schlafen.description","",""
"Scripts/Content/Story/Dialoge/DIA_BAU_913_Thekla.d:199","Ich brauche einen Platz zum Schlafen.","J'ai besoin d'un endroit où dormir.","","","DIA_Thekla_Schlafen_15_00","",""
"Scripts/Content/Story/Dialoge/DIA_BAU_913_Thekla.d:200","Lass dir bloß nicht einfallen, in meiner Küche zu pennen. Such dir einen Platz in der Scheune.","Ne songez même pas à dormir dans ma cuisine. Allez vous trouver une place dans la grange.","","","DIA_Thekla_Schlafen_17_01","",""
"Scripts/Content/Story/Dialoge/DIA_BAU_913_Thekla.d:212","Was hast du für ein Problem mit den Söldnern?","Quel est votre problème avec les mercenaires ?","","","DIA_Thekla_Problem.description","",""
"Scripts/Content/Story/Dialoge/DIA_BAU_913_Thekla.d:226","Was hast du für ein Problem mit den Söldnern?","Quel est votre problème avec les mercenaires ?","","","DIA_Thekla_Problem_15_00","",""
"Scripts/Content/Story/Dialoge/DIA_BAU_913_Thekla.d:227","Ach, die Kerle gehen mir auf die Nerven! Vor allem Sylvio und sein fetter Freund Bullco.","Ah ! Ces crétins me tapent sur les nerfs ! Surtout Sylvio et son gros copain Bullco.","","","DIA_Thekla_Problem_17_01","",""
"Scripts/Content/Story/Dialoge/DIA_BAU_913_Thekla.d:228","Die beiden sitzen jetzt schon Tage lang in ihrer Ecke und machen mir das Leben zur Hölle.","Ces deux-là restent assis dans leur coin depuis des jours et ils ne cessent de m'ennuyer.","","","DIA_Thekla_Problem_17_02","",""
"Scripts/Content/Story/Dialoge/DIA_BAU_913_Thekla.d:229","Die Suppe ist zu heiß, das Fleisch ist zu zäh, und so weiter und so weiter.","La soupe est trop chaude, la viande est trop dure, etc.","","","DIA_Thekla_Problem_17_03","",""
"Scripts/Content/Story/Dialoge/DIA_BAU_913_Thekla.d:232","Warum unternimmst du nichts dagegen?","Et pourquoi ne faites-vous rien pour régler le problème ?","","","DIA_Thekla_Problem_15_04","",""
"Scripts/Content/Story/Dialoge/DIA_BAU_913_Thekla.d:233","Du Klugscheißer! Was soll ich denn machen? Mit dem Nudelholz draufhauen? Das kann ich bei den Bauern machen, aber diese miesen Kerle schlagen zurück.","Et que suis-je censée faire, monsieur Je-Sais-Tout ? Les taper avec mon rouleau à pâtisserie ? Je peux le faire aux fermiers mais ces bâtards de mercenaires ripostent.","","","DIA_Thekla_Problem_17_05","",""
"Scripts/Content/Story/Dialoge/DIA_BAU_913_Thekla.d:246","Soll ich den beiden Manieren beibringen?","Vous voulez que je leur enseigne les bonnes manières ?","","","DIA_Thekla_Manieren.description","",""
"Scripts/Content/Story/Dialoge/DIA_BAU_913_Thekla.d:262","Soll ich den beiden Manieren beibringen?","Voulez-vous que je leur apprenne les bonnes manières ?","","","DIA_Thekla_Manieren_15_00","",""
"Scripts/Content/Story/Dialoge/DIA_BAU_913_Thekla.d:263","Mach dich nicht unglücklich, Schätzchen. Soweit ich weiß, hat Sylvio hat eine magische Rüstung. Du kannst ihn nicht besiegen.","Vous feriez mieux d'éviter, chéri. D'après ce que je sais, Sylvio a une armure magique. Il ne peut être vaincu.","","","DIA_Thekla_Manieren_17_01","",""
"Scripts/Content/Story/Dialoge/DIA_BAU_913_Thekla.d:264","Und was ist mit Bullco?","Et en ce qui concerne Bullco ?","","","DIA_Thekla_Manieren_15_02","",""
"Scripts/Content/Story/Dialoge/DIA_BAU_913_Thekla.d:265","Der Kerl ist stark wie ein Bär. Er hat bisher jeden umgehauen, der ihm oder Sylvio krumm gekommen ist.","Ce type est aussi fort qu'un bœuf. Jusqu'à présent, il a étalé tous ceux qui leur ont cherché des noises, à lui ou à Sylvio.","","","DIA_Thekla_Manieren_17_03","",""
"Scripts/Content/Story/Dialoge/DIA_BAU_913_Thekla.d:295","Du hast es Bullco aber ganz schön gezeigt, Schätzchen.","Vous avez bien fait de donner à Bullco ce qu'il méritait, chéri.","","","DIA_Thekla_AfterFight_17_00","",""
"Scripts/Content/Story/Dialoge/DIA_BAU_913_Thekla.d:296","War bestimmt anstrengend, das fette Schwein zu verprügeln.","Cela a dû être épuisant de molester ce gros porc.","","","DIA_Thekla_AfterFight_17_01","",""
"Scripts/Content/Story/Dialoge/DIA_BAU_913_Thekla.d:300","Du hast dich ja ganz schön verprügeln lassen, Schätzchen.","Vous vous êtes pris une sacrée raclée, chéri.","","","DIA_Thekla_AfterFight_17_02","",""
"Scripts/Content/Story/Dialoge/DIA_BAU_913_Thekla.d:301","Hab ich's dir nicht gesagt? Jetzt weißt du, was ich meine.","Je ne vous avais pas prévenu ? Maintenant vous savez ce que je voulais dire.","","","DIA_Thekla_AfterFight_17_03","",""
"Scripts/Content/Story/Dialoge/DIA_BAU_913_Thekla.d:302","Freut mich, wenn du dich amüsierst.","Je suis heureux de voir que ça vous amuse.","","","DIA_Thekla_AfterFight_15_04","",""
"Scripts/Content/Story/Dialoge/DIA_BAU_913_Thekla.d:303","Jetzt zieh mal nicht so'n Gesicht. Du bist nicht der Erste, der von dem Abschaum verprügelt wurde.","Ne faites pas cette tête-là. Vous n'êtes pas le premier à vous faire rosser par cette vermine.","","","DIA_Thekla_AfterFight_17_05","",""
"Scripts/Content/Story/Dialoge/DIA_BAU_913_Thekla.d:306","Hier, iss dir erst mal 'n Happen, damit du wieder zu Kräften kommst.","Tenez, mangez un morceau pour reprendre des forces.","","","DIA_Thekla_AfterFight_17_06","",""
"Scripts/Content/Story/Dialoge/DIA_BAU_913_Thekla.d:321","Hier ist das Päckchen von Sagitta.","Voici le paquet de Sagitta.","","","DIA_Thekla_SagittaPaket.description","",""
"Scripts/Content/Story/Dialoge/DIA_BAU_913_Thekla.d:336","Hier ist das Päckchen von Sagitta.","Voici le paquet de Sagitta.","","","DIA_Thekla_SagittaPaket_15_00","",""
"Scripts/Content/Story/Dialoge/DIA_BAU_913_Thekla.d:337","Danke sehr. Bist ja doch zu etwas zu gebrauchen.","Merci beaucoup. Après tout, vous savez vous rendre utile.","","","DIA_Thekla_SagittaPaket_17_01","",""
"Scripts/Content/Story/Dialoge/DIA_BAU_913_Thekla.d:356","Kann ich noch etwas von deinem Eintopf haben?","Puis-je avoir encore un peu de votre ragoût ?","","","DIA_Thekla_PERM.description","",""
"Scripts/Content/Story/Dialoge/DIA_BAU_913_Thekla.d:369","Kann ich noch etwas von deinem Eintopf haben?","Puis-je avoir encore un peu de ragoût ?","","","DIA_Thekla_PERM_15_00","",""
"Scripts/Content/Story/Dialoge/DIA_BAU_913_Thekla.d:373","Ich hab nichts mehr.","Je n'en ai pas pour l'instant.","","","DIA_Thekla_PERM_17_01","",""
"Scripts/Content/Story/Dialoge/DIA_BAU_913_Thekla.d:374","Nicht mal mehr ein kleines Schüsselchen?","Même pas un tout petit peu ?","","","DIA_Thekla_PERM_15_02","",""
"Scripts/Content/Story/Dialoge/DIA_BAU_913_Thekla.d:375","Nein.","Non.","","","DIA_Thekla_PERM_17_03","",""
"Scripts/Content/Story/Dialoge/DIA_BAU_913_Thekla.d:376","Kann ich den Topf auslecken?","Puis-je lécher le plat alors ?","","","DIA_Thekla_PERM_15_04","",""
"Scripts/Content/Story/Dialoge/DIA_BAU_913_Thekla.d:377","Jetzt hör aber auf!","Vous allez arrêter oui !","","","DIA_Thekla_PERM_17_05","",""
"Scripts/Content/Story/Dialoge/DIA_BAU_913_Thekla.d:378","Wenn du so wild bist auf den Eintopf, dann musst du auch was dafür tun.","Si vous aimez tant mon ragoût, il va falloir le mériter.","","","DIA_Thekla_PERM_17_06","",""
"Scripts/Content/Story/Dialoge/DIA_BAU_913_Thekla.d:379","Was?","Quoi ?","","","DIA_Thekla_PERM_15_07","",""
"Scripts/Content/Story/Dialoge/DIA_BAU_913_Thekla.d:380","Geh zu Sagitta, der Heilerin hinter Sekobs Hof, und bring mir ein Päckchen mit Kräutern von ihr.","Allez voir Sagitta, la guérisseuse qui vit derrière la ferme de Sékob, et ramenez-moi un paquet de ses herbes.","","","DIA_Thekla_PERM_17_08","",""
"Scripts/Content/Story/Dialoge/DIA_BAU_913_Thekla.d:381","Wenn du mir die Kräuter bringst, mach ich dir deinen Eintopf.","Si vous me rapportez les herbes, je vous ferai du ragoût.","","","DIA_Thekla_PERM_17_09","",""
"Scripts/Content/Story/Dialoge/DIA_BAU_913_Thekla.d:397","Na schön. Dann will ich mal nicht so sein. Hier. Sonst fällst du mir noch vom Fleisch.","Très bien, je vais être gentille. Tenez. Comme ça vous ne mourrez pas de faim sous mes yeux.","","","DIA_Thekla_PERM_17_10","",""
"Scripts/Content/Story/Dialoge/DIA_BAU_913_Thekla.d:403","Na, na, na, wer wird denn so gierig sein! Ich sag dir Bescheid, wenn ich mal wieder was für dich zu tun hab.","Hé hé hé ! Ne soyez pas aussi avide ! Je vous le ferai savoir quand j'aurai autre chose à vous faire faire.","","","DIA_Thekla_PERM_17_11","",""
"Scripts/Content/Story/Dialoge/DIA_BAU_913_Thekla.d:404","DANN gibt's auch wieder Eintopf, klar?","Et ALORS vous aurez encore du ragoût, compris ?","","","DIA_Thekla_PERM_17_12","",""
"Scripts/Content/Story/Dialoge/DIA_BAU_913_Thekla.d:414","Ich hab gehört, du hast Bennet geholfen, aus dem Gefängnis zu entkommen. Reife Leistung, Kleiner.","J'ai entendu dire que vous aviez aidé Bennet à sortir de prison. Beau travail, mon garçon.","","","DIA_Thekla_PERM_17_13","",""
"Scripts/Content/Story/Dialoge/DIA_BAU_913_Thekla.d:422","Diese Mistkerle von der Miliz haben Bennet ins Gefängnis gesteckt.","Ces bâtards de miliciens ont mis Bennet au trou.","","","DIA_Thekla_PERM_17_14","",""
"Scripts/Content/Story/Dialoge/DIA_BAU_913_Thekla.d:423","Tu mir einen Gefallen und hol ihn da wieder raus, ja? Ich mach dir in der Zwischenzeit einen leckeren Eintopf.","Rendez-moi service et faites-le sortir de là, voulez-vous ? Pendant ce temps je vais vous préparer un délicieux ragoût.","","","DIA_Thekla_PERM_17_15","",""
"Scripts/Content/Story/Dialoge/DIA_BAU_913_Thekla.d:427","Ich hab nichts mehr. Komm später noch mal wieder.","Je n'en ai plus. Revenez plus tard.","","","DIA_Thekla_PERM_17_16","",""
"Scripts/Content/Story/Dialoge/DIA_BAU_913_Thekla.d:436","Du bist auch immer hungrig, was? Was machst du eigentlich die ganze Zeit?","Vous êtes toujours affamé, n'est pas ? A quoi passez-vous donc vos journées ?","","","DIA_Thekla_PERM_17_17","",""
"Scripts/Content/Story/Dialoge/DIA_BAU_913_Thekla.d:437","Ich hab ein paar Drachen erledigt.","Je me suis occupé de quelques dragons.","","","DIA_Thekla_PERM_15_18","",""
"Scripts/Content/Story/Dialoge/DIA_BAU_913_Thekla.d:438","Oh! Na dann wird's wohl mal wieder Zeit für einen ordentlichen Eintopf.","Oh ! Alors je crois qu'il est l'heure de déguster un bon vieux ragoût revigorant.","","","DIA_Thekla_PERM_17_19","",""
"Scripts/Content/Story/Dialoge/DIA_BAU_913_Thekla.d:444","Das war's. Kein Eintopf mehr da.","Ça y est. Plus de ragoût.","","","DIA_Thekla_PERM_17_20","",""
"Scripts/Content/Story/Dialoge/DIA_BAU_913_Thekla.d:450","Ohne die Kräuter kein Eintopf - klar?","Pas d'herbes, pas de ragoût, compris ?","","","DIA_Thekla_PERM_17_21","",""
"Scripts/Content/Story/Dialoge/DIA_BAU_930_Sekob.d:50","Was willst du auf meinem Land? Hier gibt's nichts zu klauen. Scher dich weg.","Que faites-vous sur mes terres ? Il n'y a rien à voler ici. Dégagez.","","","DIA_Sekob_HALLO_01_00","",""
"Scripts/Content/Story/Dialoge/DIA_BAU_930_Sekob.d:51","Gibt es in diesem verfluchten Land eigentlich ein Fleckchen Erde, das nicht irgendjemand gehört?","Y a-t-il un morceau de terre dans ce maudit pays qui n'appartienne à personne ?","","","DIA_Sekob_HALLO_15_01","",""
"Scripts/Content/Story/Dialoge/DIA_BAU_930_Sekob.d:52","Geh arbeiten, dann kannst du vielleicht auch irgendwann mal ein Stück Land dein Eigen nennen. Aber bis dahin lungerst du gefälligst woanders rum.","Allez travailler, alors peut-être qu'un jour vous pourrez vous payer un lopin de terre. Mais, en attendant, allez traîner ailleurs.","","","DIA_Sekob_HALLO_01_02","",""
"Scripts/Content/Story/Dialoge/DIA_BAU_930_Sekob.d:65","Hör mal...","Ecoutez...","","","DIA_Sekob_PermVorMis.description","",""
"Scripts/Content/Story/Dialoge/DIA_BAU_930_Sekob.d:79","Hör mal...","Ecoutez...","","","DIA_Sekob_PermVorMis_15_00","",""
"Scripts/Content/Story/Dialoge/DIA_BAU_930_Sekob.d:80","Ich hab zurzeit keine Arbeit für dich! Jetzt geh!","Je n'ai pas de travail pour vous pour le moment. Maintenant, partez !","","","DIA_Sekob_PermVorMis_01_01","",""
"Scripts/Content/Story/Dialoge/DIA_BAU_930_Sekob.d:92","Onar will, daß du endlich deine Pacht bezahlst.","Onar veut que vous payiez votre loyer.","","","DIA_Sekob_ZAHLPACHT.description","",""
"Scripts/Content/Story/Dialoge/DIA_BAU_930_Sekob.d:105","Das Land gehört dem Großbauern. Du bist hier nur der Pächter. Onar will, dass du endlich deine Pacht bezahlst. Du bist schon seit Wochen überfällig.","Cette terre appartient au propriétaire terrien. Vous n'en êtes que le locataire. Onar veut que vous payiez votre loyer. Vous avez plusieurs semaines de retard.","","","DIA_Sekob_ZAHLPACHT_15_00","",""
"Scripts/Content/Story/Dialoge/DIA_BAU_930_Sekob.d:106","Was? Und da schickt er einen Halunken wie dich? Das glaubst du doch selber nicht.","Quoi ? Et il m'envoie un mécréant comme vous ? J'en reviens pas.","","","DIA_Sekob_ZAHLPACHT_01_01","",""
"Scripts/Content/Story/Dialoge/DIA_BAU_930_Sekob.d:107","Mach, dass du weg kommst, bevor ich mich vergesse.","Partez d'ici avant que je ne m'énerve.","","","DIA_Sekob_ZAHLPACHT_01_02","",""
"Scripts/Content/Story/Dialoge/DIA_BAU_930_Sekob.d:122","Rück die Kohle raus oder ich schlag dir die Zähne ein!","Envoyez la monnaie ou je vous casse les dents.","","","DIA_Sekob_KohleRaus.description","",""
"Scripts/Content/Story/Dialoge/DIA_BAU_930_Sekob.d:136","Rück die Kohle raus oder ich schlag dir die Zähne ein!","Donnez-moi le pognon ou je vous cogne.","","","DIA_Sekob_KohleRaus_15_00","",""
"Scripts/Content/Story/Dialoge/DIA_BAU_930_Sekob.d:137","Du Verbrecher gehst mir nicht an den Geldbeutel, DU NICHT!","Vous n'allez certainement pas me détrousser espèce de criminel. PAS VOUS !","","","DIA_Sekob_KohleRaus_01_01","",""
"Scripts/Content/Story/Dialoge/DIA_BAU_930_Sekob.d:151","Ich werde dann wohl Onar darüber informieren müssen...","Je crois que je vais devoir en parler à Onar.","","","DIA_Sekob_InformOnar.description","",""
"Scripts/Content/Story/Dialoge/DIA_BAU_930_Sekob.d:165","Ich werde dann wohl Onar darüber informieren müssen...","Alors je vais devoir en parler à Onar.","","","DIA_Sekob_InformOnar_15_00","",""
"Scripts/Content/Story/Dialoge/DIA_BAU_930_Sekob.d:166","Von mir aus! Du kannst Onar sagen, ich habe nichts. Das ist die traurige Wahrheit.","Je m'en fiche ! Vous pouvez dire à Onar que je n'ai rien. C'est la triste vérité.","","","DIA_Sekob_InformOnar_01_01","",""
"Scripts/Content/Story/Dialoge/DIA_BAU_930_Sekob.d:180","Wo hast du das Geld!?!","Où est l'argent ?!","","","DIA_Sekob_Defeated.description","",""
"Scripts/Content/Story/Dialoge/DIA_BAU_930_Sekob.d:195","Wo hast du das Geld!?!","Où avez-vous mis l'argent ?","","","DIA_Sekob_Defeated_15_00","",""
"Scripts/Content/Story/Dialoge/DIA_BAU_930_Sekob.d:196","Nicht mehr schlagen, bitte. Ich will ja alles machen.","Ne me frappez plus, s'il vous plaît. Je ferai ce que vous voulez.","","","DIA_Sekob_Defeated_01_01","",""
"Scripts/Content/Story/Dialoge/DIA_BAU_930_Sekob.d:197","Dann zahl' deine Pacht.","Alors payez votre loyer.","","","DIA_Sekob_Defeated_15_02","",""
"Scripts/Content/Story/Dialoge/DIA_BAU_930_Sekob.d:198","(weinerlich) Aber Herr, ich hab doch nichts. Ich bin doch nur ein armes Schwein und halb verhungert.","(plaintif) Mais monsieur, je n'ai plus rien. Je ne suis qu'un pauvre diable à moitié affamé.","","","DIA_Sekob_Defeated_01_03","",""
"Scripts/Content/Story/Dialoge/DIA_BAU_930_Sekob.d:199","Meine letzte Ernte ist völlig vertrocknet. Ich WILL meine Pacht bezahlen, aber ich HABE einfach nichts. Hab doch Mitleid.","J'ai perdu ma dernière récolte à cause de la sécheresse. Je VEUX payer mon loyer mais je n'ai PAS d'argent. Ayez pitié.","","","DIA_Sekob_Defeated_01_04","",""
"Scripts/Content/Story/Dialoge/DIA_BAU_930_Sekob.d:202","Bezahl´ jetzt deine Pacht oder ich bring´ dich um.","Payez votre loyer ou je vous tue.","","","DIA_Sekob_Defeated.DIA_Sekob_Defeated_hart","Info_AddChoice",""
"Scripts/Content/Story/Dialoge/DIA_BAU_930_Sekob.d:203","Gut, ich werde mit Onar reden.","Très bien, j'irai parler à Onar.","","","DIA_Sekob_Defeated.DIA_Sekob_Defeated_weich","Info_AddChoice",""
"Scripts/Content/Story/Dialoge/DIA_BAU_930_Sekob.d:208","Gut, ich werde mit Onar reden.","Très bien, je vais aller parler à Onar.","","","DIA_Sekob_Defeated_weich_15_00","",""
"Scripts/Content/Story/Dialoge/DIA_BAU_930_Sekob.d:209","Tausend Dank, Herr. Tausend Dank!","Merci monsieur. Merci mille fois !","","","DIA_Sekob_Defeated_weich_01_01","",""
"Scripts/Content/Story/Dialoge/DIA_BAU_930_Sekob.d:217","Rede keinen Unsinn. Hier regnet's ständig und deine Vorratskammer ist voll. Bezahl' jetzt deine Pacht oder ich bring dich um.","Arrêtez avec ces balivernes. Il pleut tout le temps ici et vos greniers sont pleins. Payez votre loyer maintenant ou je vous tue.","","","DIA_Sekob_Kassieren_15_00","",""
"Scripts/Content/Story/Dialoge/DIA_BAU_930_Sekob.d:218","(unterwürfig) Nein, bitte, hier nimm das Gold. Ich leg sogar noch einen Bonus drauf, wenn du mich nur leben lässt.","(obséquieux) Non, s'il vous plaît. Tenez prenez l'or. Je vous en donne même un peu plus si vous me laissez la vie.","","","DIA_Sekob_Kassieren_01_01","",""
"Scripts/Content/Story/Dialoge/DIA_BAU_930_Sekob.d:220","Es geht doch.","Vous voyez, ce n'était pas si difficile.","","","DIA_Sekob_Kassieren_15_02","",""
"Scripts/Content/Story/Dialoge/DIA_BAU_930_Sekob.d:221","(verzweifelt) Das ist mein Ruin.","(désespéré) Je suis ruiné.","","","DIA_Sekob_Kassieren_01_03","",""
"Scripts/Content/Story/Dialoge/DIA_BAU_930_Sekob.d:242","Wegen deiner Pacht...","Au sujet de votre loyer...","","","DIA_Sekob_Again.description","",""
"Scripts/Content/Story/Dialoge/DIA_BAU_930_Sekob.d:257","Wegen deiner Pacht...","A propos de votre loyer...","","","DIA_Sekob_Again_15_00","",""
"Scripts/Content/Story/Dialoge/DIA_BAU_930_Sekob.d:258","Du redest mit Onar, ja?","Vous parlerez à Onar, n'est-ce pas ?","","","DIA_Sekob_Again_01_01","",""
"Scripts/Content/Story/Dialoge/DIA_BAU_930_Sekob.d:261","Ich hab's mir anders überlegt.","J'ai changé d'avis.","","","DIA_Sekob_Again.DIA_Sekob_Again_Nein","Info_AddChoice",""
"Scripts/Content/Story/Dialoge/DIA_BAU_930_Sekob.d:265","Das habe ich...","C'est ce que j'ai fait...","","","DIA_Sekob_Again.DIA_Sekob_Again_verarscht","Info_AddChoice",""
"Scripts/Content/Story/Dialoge/DIA_BAU_930_Sekob.d:269","Klar.","Bien sûr.","","","DIA_Sekob_Again.DIA_Sekob_Again_Ja","Info_AddChoice",""
"Scripts/Content/Story/Dialoge/DIA_BAU_930_Sekob.d:275","Ich hab's mir anders überlegt.","J'ai changé d'avis.","","","DIA_Sekob_Again_Nein_15_00","",""
"Scripts/Content/Story/Dialoge/DIA_BAU_930_Sekob.d:281","Klar.","Bien sûr.","","","DIA_Sekob_Again_Ja_15_00","",""
"Scripts/Content/Story/Dialoge/DIA_BAU_930_Sekob.d:282","Du wirst das schaffen.","Vous pouvez le faire.","","","DIA_Sekob_Again_Ja_01_01","",""
"Scripts/Content/Story/Dialoge/DIA_BAU_930_Sekob.d:290","Das habe ich ...","C'est ce que j'ai fait...","","","DIA_Sekob_Again_verarscht_15_00","",""
"Scripts/Content/Story/Dialoge/DIA_BAU_930_Sekob.d:291","Und? Was hat er gesagt?","Et ? Qu'a-t-il dit ?","","","DIA_Sekob_Again_verarscht_01_01","",""
"Scripts/Content/Story/Dialoge/DIA_BAU_930_Sekob.d:292","Tut mir leid, aber ich muss dir jetzt den Kopf abreißen.","Je regrette mais je vais devoir vous arracher la tête.","","","DIA_Sekob_Again_verarscht_15_02","",""
"Scripts/Content/Story/Dialoge/DIA_BAU_930_Sekob.d:293","Aber warum? Was habe ich getan?","Mais pourquoi ? Qu'ai-je fait ?","","","DIA_Sekob_Again_verarscht_01_03","",""
"Scripts/Content/Story/Dialoge/DIA_BAU_930_Sekob.d:294","Mich verarscht.","Vous vous êtes fichu de moi.","","","DIA_Sekob_Again_verarscht_15_04","",""
