"location","source","target","id","fuzzy","context","translator_comments","developer_comments"
"Scripts/Content/Story/Dialoge/DIA_NONE_100_Xardas.d:855","Vatras hat mich zu dir geschickt.","Vatras sent me to you.","","","DIA_Xardas_RITUALREQUEST_15_00","",""
"Scripts/Content/Story/Dialoge/DIA_NONE_100_Xardas.d:856","Das ist gut. Was hat er gesagt?","That's good. What did he say?","","","DIA_Xardas_RITUALREQUEST_14_01","",""
"Scripts/Content/Story/Dialoge/DIA_NONE_100_Xardas.d:857","Er sagte etwas von einem Umkehrritual am Sonnenkreis.","He said something about a reversal ritual at the Circle of the Sun.","","","DIA_Xardas_RITUALREQUEST_15_02","",""
"Scripts/Content/Story/Dialoge/DIA_NONE_100_Xardas.d:858","(lacht) Der alte Teufel. Ich ahne schon, was er vor hat. Du bist gekommen, um mich zu ihm zu rufen.","(laughs) That old devil. I think I know what he's up to. You have come to summon me to him.","","","DIA_Xardas_RITUALREQUEST_14_03","",""
"Scripts/Content/Story/Dialoge/DIA_NONE_100_Xardas.d:859","So sieht's aus. Wann wirst du aufbrechen?","Looks like it. When will you set out?","","","DIA_Xardas_RITUALREQUEST_15_04","",""
"Scripts/Content/Story/Dialoge/DIA_NONE_100_Xardas.d:865","Ich werde Vatras nicht warten lassen und mache mich sofort auf den Weg. Erledige deine Aufgaben und komm dann später nach.","I must not keep Vatras waiting. I shall be on my way immediately. You must fulfill your tasks and then join me again.","","","DIA_Xardas_RITUALREQUEST_14_05","",""
"Scripts/Content/Story/Dialoge/DIA_NONE_100_Xardas.d:874","Ich werde erst dem Ritual beiwohnen, wenn ich mir sicher bin, dass du bereit bist, den Drachen die Stirn zu bieten.","I shall only assist with the ritual when I can be sure that you are ready to face the dragons.","","","DIA_Xardas_RITUALREQUEST_14_06","",""
"Scripts/Content/Story/Dialoge/DIA_NONE_100_Xardas.d:889","Warum gehst du nicht jetzt GLEICH zu Vatras?","Why don't you go see Vatras RIGHT AWAY?","","","DIA_Xardas_WARUMNICHTJETZT.description","",""
"Scripts/Content/Story/Dialoge/DIA_NONE_100_Xardas.d:905","Warum gehst du nicht jetzt GLEICH zu Vatras? Manchmal verstehe ich dich nicht.","Why don't you go see Vatras RIGHT AWAY?","","","DIA_Xardas_WARUMNICHTJETZT_15_00","",""
"Scripts/Content/Story/Dialoge/DIA_NONE_100_Xardas.d:906","Erst gab es nichts Wichtigeres als das Auge Innos' und nun, wo du dich selbst bewegen musst, da kneifst du.","Sometimes I just don't understand you.","","","DIA_Xardas_WARUMNICHTJETZT_15_01","",""
"Scripts/Content/Story/Dialoge/DIA_NONE_100_Xardas.d:907","(verärgert) Sprich nicht in diesem Ton mit mir. Ohne MICH würde dein armseliger Körper noch im Tempel liegen und vermodern.","(irritated) Do not talk to me in that tone. If it weren't for ME, your wretched body would still be rotting in that temple.","","","DIA_Xardas_WARUMNICHTJETZT_14_02","",""
"Scripts/Content/Story/Dialoge/DIA_NONE_100_Xardas.d:909","Schon gut. Sag mir einfach, was ich tun muß.","Never mind. Just tell me what I need to do.","","","DIA_Xardas_WARUMNICHTJETZT.DIA_Xardas_WARUMNICHTJETZT_wastun","Info_AddChoice",""
"Scripts/Content/Story/Dialoge/DIA_NONE_100_Xardas.d:910","Dann erkläre mir wenigstens den Grund deines Zögerns.","Then, at least, explain to me why you hesitate.","","","DIA_Xardas_WARUMNICHTJETZT.DIA_Xardas_WARUMNICHTJETZT_grund","Info_AddChoice",""
"Scripts/Content/Story/Dialoge/DIA_NONE_100_Xardas.d:915","Dann erkläre mir wenigstens den Grund deines Zögerns.","Then, at least, explain to me why you hesitate.","","","DIA_Xardas_WARUMNICHTJETZT_grund_15_00","",""
"Scripts/Content/Story/Dialoge/DIA_NONE_100_Xardas.d:916","Seit ich mich von den Feuermagiern abgewendet habe, bin ich ihnen aus dem Weg gegangen.","Ever since I abandoned the Fire Magicians, I have stayed well away from them.","","","DIA_Xardas_WARUMNICHTJETZT_grund_14_01","",""
"Scripts/Content/Story/Dialoge/DIA_NONE_100_Xardas.d:917","Ich bin auch nicht gewillt, das zu ändern, es sei denn, ich habe keine andere Wahl.","And I do not intend to change that, unless I do not have a choice.","","","DIA_Xardas_WARUMNICHTJETZT_grund_14_02","",""
"Scripts/Content/Story/Dialoge/DIA_NONE_100_Xardas.d:918","Doch bevor ich mich den strafenden Blicken der Magier aussetze, will ich mir erst sicher sein, dass du überhaupt den Hauch einer Chance gegen die Drachen hast.","But before I expose myself to the magicians' reproachful glances, I first want to be sure that you stand even the slightest chance against the dragons.","","","DIA_Xardas_WARUMNICHTJETZT_grund_14_03","",""
"Scripts/Content/Story/Dialoge/DIA_NONE_100_Xardas.d:919","Mit deiner schäbigen Ausrüstung wirst du jedoch nicht weit kommen. Komm erst wieder, wenn du stark genug bist.","You will not get far, however, with that shabby equipment of yours. Come back, but only when you are strong enough.","","","DIA_Xardas_WARUMNICHTJETZT_grund_14_04","",""
"Scripts/Content/Story/Dialoge/DIA_NONE_100_Xardas.d:925","Schon gut. Sag mir einfach, was ich tun muss.","Never mind. Just tell me what I need to do.","","","DIA_Xardas_WARUMNICHTJETZT_wastun_15_00","",""
"Scripts/Content/Story/Dialoge/DIA_NONE_100_Xardas.d:926","Du bist noch zu schwach für den Kampf gegen die Drachen. Mit der Ausrüstung hast du nicht einmal den Hauch einer Chance.","You are still too weak to fight the dragons. With this equipment, you stand no chance whatsoever.","","","DIA_Xardas_WARUMNICHTJETZT_wastun_14_01","",""
"Scripts/Content/Story/Dialoge/DIA_NONE_100_Xardas.d:927","Komm erst wieder, wenn du dich besser vorbereitet hast. Dann werde ich mich Vatras anschließen.","Do not come back until you are better prepared. Then I will go and join Vatras.","","","DIA_Xardas_WARUMNICHTJETZT_wastun_14_02","",""
"Scripts/Content/Story/Dialoge/DIA_NONE_100_Xardas.d:940","Ich bin bereit für den Kampf gegen die Drachen.","I'm ready to fight the dragons.","","","DIA_Xardas_BEREIT.description","",""
"Scripts/Content/Story/Dialoge/DIA_NONE_100_Xardas.d:956","Ich bin bereit für den Kampf gegen die Drachen.","I'm ready to fight the dragons.","","","DIA_Xardas_BEREIT_15_00","",""
"Scripts/Content/Story/Dialoge/DIA_NONE_100_Xardas.d:957","Dann lass uns keine Zeit verlieren. Ich werde umgehend zum Sonnenkreis aufbrechen. Erledige deine Aufgaben. Wir treffen uns dann dort.","We must not lose any more time, then. I shall be on my way to the Circle of the Sun immediately. Fulfill your tasks. I shall meet you there.","","","DIA_Xardas_BEREIT_14_01","",""
"Scripts/Content/Story/Dialoge/DIA_NONE_100_Xardas.d:975","Wird das Umkehrritual funktionieren?","Is the reversal ritual going to work?","","","DIA_Xardas_BINGESPANNT.description","",""
"Scripts/Content/Story/Dialoge/DIA_NONE_100_Xardas.d:990","Wird das Umkehrritual funktionieren?","Is the reversal ritual going to work?","","","DIA_Xardas_BINGESPANNT_15_00","",""
"Scripts/Content/Story/Dialoge/DIA_NONE_100_Xardas.d:991","Ich bin mir nicht sicher. Kommt darauf an, was Vatras genau tun wird.","I cannot be sure. That depends on what exactly Vatras is going to do.","","","DIA_Xardas_BINGESPANNT_14_01","",""
"Scripts/Content/Story/Dialoge/DIA_NONE_100_Xardas.d:1003","Pyrokar weigert sich, zum Ritual zu erscheinen.","Pyrokar refuses to show up for the ritual.","","","DIA_Xardas_PYROWILLNICHT.description","",""
"Scripts/Content/Story/Dialoge/DIA_NONE_100_Xardas.d:1018","Pyrokar weigert sich, zum Ritual zu erscheinen.","Pyrokar refuses to show up for the ritual.","","","DIA_Xardas_PYROWILLNICHT_15_00","",""
"Scripts/Content/Story/Dialoge/DIA_NONE_100_Xardas.d:1019","Er will erst einen Beweis dafür, dass er dir vertrauen kann.","First, he wants proof that he can trust you.","","","DIA_Xardas_PYROWILLNICHT_15_01","",""
"Scripts/Content/Story/Dialoge/DIA_NONE_100_Xardas.d:1020","So so. Pyrokar also. Mmh, interessant.","Ah really. Pyrokar. How interesting.","","","DIA_Xardas_PYROWILLNICHT_14_02","",""
"Scripts/Content/Story/Dialoge/DIA_NONE_100_Xardas.d:1021","Der alte Zausel wird langsam lästig. Aber ich denke, ich habe da etwas für dich, was dir helfen kann.","That old geezer is getting to be a nuisance. But I think I've got something for you that will be useful.","","","DIA_Xardas_PYROWILLNICHT_14_03","",""
"Scripts/Content/Story/Dialoge/DIA_NONE_100_Xardas.d:1022","Damals, als ich den Orden der Feuermagier verließ, habe ich einige Dinge aus dem Kloster mit mir genommen.","Back when I left the Order of the Fire Magicians, I took a few things with me from the monastery.","","","DIA_Xardas_PYROWILLNICHT_14_04","",""
"Scripts/Content/Story/Dialoge/DIA_NONE_100_Xardas.d:1025","Ich wollte nicht, dass eines Tages eine Truppe von Paladinen oder Feuermagiern meinen Turm auf den Kopf stellt und den Kram bei mir findet.","I didn't want a troop of paladins or Fire Magicians to turn my tower upside down at some point, and find all those things.","","","DIA_Xardas_PYROWILLNICHT_14_06","",""
"Scripts/Content/Story/Dialoge/DIA_NONE_100_Xardas.d:1026","Also habe ich sie an sichere Orte gebracht, an dem die Magier sicherlich nicht danach suchen würden.","So I hid them in safe places where the magicians would certainly never look for them.","","","DIA_Xardas_PYROWILLNICHT_14_07","",""
"Scripts/Content/Story/Dialoge/DIA_NONE_100_Xardas.d:1027","Und wo?","And where?","","","DIA_Xardas_PYROWILLNICHT_15_08","",""
"Scripts/Content/Story/Dialoge/DIA_NONE_100_Xardas.d:1028","Ein Teil davon liegt in einer Truhe verschlossen auf Sekobs Bauernhof.","Some of them lie locked in a chest on Sekob's farm.","","","DIA_Xardas_PYROWILLNICHT_14_09","",""
"Scripts/Content/Story/Dialoge/DIA_NONE_100_Xardas.d:1030","Du traust diesem Sekob?","You trust that Sekob?","","","DIA_Xardas_PYROWILLNICHT_15_10","",""
"Scripts/Content/Story/Dialoge/DIA_NONE_100_Xardas.d:1031","Nein. Aber er ist käuflich und stellt keine unangenehmen Fragen. Außerdem habe ich die Truhe verschlossen. Hier ist der Schlüssel.","No. But he can be bought and asks no awkward questions. Also, the chest is locked. Here's the key.","","","DIA_Xardas_PYROWILLNICHT_14_11","",""
"Scripts/Content/Story/Dialoge/DIA_NONE_100_Xardas.d:1036","Es ist ein sehr altes Buch dabei. Wenn Pyrokar dieses Buch bekommt, wird er wissen, dass es von mir kommt.","There's a very old book among those things. When Pyrokar sees that book, he'll know it came from me.","","","DIA_Xardas_PYROWILLNICHT_14_12","",""
"Scripts/Content/Story/Dialoge/DIA_NONE_100_Xardas.d:1037","Ich habe keine Verwendung mehr dafür. Vielleicht erfüllt es ja somit noch einen Zweck.","It is of no further use to me. So I guess it can at least fulfill this purpose.","","","DIA_Xardas_PYROWILLNICHT_14_13","",""
"Scripts/Content/Story/Dialoge/DIA_NONE_100_Xardas.d:1064","Nun, da das Auge Innos geheilt ist, mußt du den Drachen entgegentreten!","Now that the Eye of Innos is healed, you must face the dragons!","","","DIA_Xardas_Add_14_06","",""
"Scripts/Content/Story/Dialoge/DIA_NONE_100_Xardas.d:1065","Sie alle dienen Beliar, dem Gott der Finsternis.","They all serve Beliar, the god of darkness.","","","DIA_Xardas_Add_14_07","",""
"Scripts/Content/Story/Dialoge/DIA_NONE_100_Xardas.d:1066","Aber es muß eine irdische Macht geben, die sie kontrolliert. Soviel ist mir inzwischen klar.","But there must be an earthly power that controls them. That much has become clear to me.","","","DIA_Xardas_Add_14_08","",""
"Scripts/Content/Story/Dialoge/DIA_NONE_100_Xardas.d:1067","Finde heraus, was die Quelle dieser Macht ist.","Find out what the source of their power is.","","","DIA_Xardas_Add_14_09","",""
"Scripts/Content/Story/Dialoge/DIA_NONE_100_Xardas.d:1068","Sobald du etwas herausgefunden hast, kommst du zu mir zurück!","As soon as you have found that out, come back to me!","","","DIA_Xardas_Add_14_10","",""
"Scripts/Content/Story/Dialoge/DIA_NONE_100_Xardas.d:1091","Das Auge Innos' ist geheilt, was nun?","The Eye of Innos is healed. So what next?","","","DIA_Xardas_WASNUN.description","",""
"Scripts/Content/Story/Dialoge/DIA_NONE_100_Xardas.d:1105","Das Auge Innos' ist geheilt, was nun?","The Eye of Innos is healed. So what next?","","","DIA_Xardas_WASNUN_15_00","",""
"Scripts/Content/Story/Dialoge/DIA_NONE_100_Xardas.d:1106","Vergiss nicht, es zu tragen, wenn du gegen die Drachen antrittst.","Do not forget to wear it when you finally face the dragons.","","","DIA_Xardas_WASNUN_14_01","",""
"Scripts/Content/Story/Dialoge/DIA_NONE_100_Xardas.d:1110","Verliere keine Zeit. Geh nun ins Minental und töte die Drachen.","Do not lose any time. Now go to the Valley of Mines and kill those dragons.","","","DIA_Xardas_WASNUN_14_02","",""
"Scripts/Content/Story/Dialoge/DIA_NONE_100_Xardas.d:1114","Geh zu Pyrokar und lass dir von ihm den Umgang mit dem Auge erklären.","Go to Pyrokar and have him explain to you how to use the Eye.","","","DIA_Xardas_WASNUN_14_03","",""
"Scripts/Content/Story/Dialoge/DIA_NONE_100_Xardas.d:1162","Was gibt es neues?","What's new?","","","DIA_Xardas_PERM4.description","",""
"Scripts/Content/Story/Dialoge/DIA_NONE_100_Xardas.d:1175","Was gibt es Neues?","What's new?","","","DIA_Xardas_PERM4_15_00","",""
"Scripts/Content/Story/Dialoge/DIA_NONE_100_Xardas.d:1176","Die Suchenden sind noch nicht gegangen. Sie werden nicht eher ruhen, bis sie dich zur Strecke gebracht haben.","The Seekers have not left yet. They will not rest before they have hunted you down.","","","DIA_Xardas_PERM4_14_01","",""
"Scripts/Content/Story/Dialoge/DIA_NONE_100_Xardas.d:1177","Töte die Drachen im Minental und finde heraus, wer hinter diesen Angriffen steckt. Sonst wird ihre Übermacht nur noch größer.","Kill the dragons in the Valley of Mines and find out who's behind those attacks. Otherwise, their strength will only grow more.","","","DIA_Xardas_PERM4_14_02","",""
"Scripts/Content/Story/Dialoge/DIA_NONE_101_Mario.d:34","Was machst du hier?","What are you doing here?","","","DIA_None_101_Mario_Job.description","",""
"Scripts/Content/Story/Dialoge/DIA_NONE_101_Mario.d:49","Was machst du hier?","What are you doing here?","","","DIA_None_101_Mario_Job_15_00","",""
"Scripts/Content/Story/Dialoge/DIA_NONE_101_Mario.d:50","Ich hoffe, dass hier in absehbarer Zeit ein Schiff reinkommt, auf dem ich anheuern kann.","I hope it won't be too long before a ship comes in where I can hire on.","","","DIA_None_101_Mario_Job_07_01","",""
"Scripts/Content/Story/Dialoge/DIA_NONE_101_Mario.d:51","Das Rumgehänge geht mir ganz schön auf die Nerven.","This hanging around is really getting on my nerves.","","","DIA_None_101_Mario_Job_07_02","",""
"Scripts/Content/Story/Dialoge/DIA_NONE_101_Mario.d:77","Ich hab gehört, du suchst Leute für dein Schiff?","I've heard that you're looking for people for your ship?","","","DIA_None_101_Mario_YouNeedMe_07_00","",""
"Scripts/Content/Story/Dialoge/DIA_NONE_101_Mario.d:78","Und?","And?","","","DIA_None_101_Mario_YouNeedMe_15_01","",""
"Scripts/Content/Story/Dialoge/DIA_NONE_101_Mario.d:79","Ich bin dabei!","I'm in!","","","DIA_None_101_Mario_YouNeedMe_07_02","",""
"Scripts/Content/Story/Dialoge/DIA_NONE_101_Mario.d:95","Warum sollte ich dich mitnehmen?","Why would I take you along?","","","DIA_None_101_Mario_WhyNeedYou.description","",""
"Scripts/Content/Story/Dialoge/DIA_NONE_101_Mario.d:109","Warum sollte ich dich mitnehmen?","Why would I take you along?","","","DIA_None_101_Mario_WhyNeedYou_15_00","",""
"Scripts/Content/Story/Dialoge/DIA_NONE_101_Mario.d:110","Ganz einfach, weil du mich brauchst.","Quite simply, because you need me.","","","DIA_None_101_Mario_WhyNeedYou_07_01","",""
"Scripts/Content/Story/Dialoge/DIA_NONE_101_Mario.d:111","Ich bin ... ich war Leutnant bei der Königlichen Kriegsmarine.","I'm ... I was a lieutenant with the royal navy.","","","DIA_None_101_Mario_WhyNeedYou_07_02","",""
"Scripts/Content/Story/Dialoge/DIA_NONE_101_Mario.d:112","Ich habe als Seesoldat auf der König Rhobar und auf der Myrtanas Stolz gedient.","I've served as a marine on the King Rhobar and the Pride of Myrtana.","","","DIA_None_101_Mario_WhyNeedYou_07_03","",""
"Scripts/Content/Story/Dialoge/DIA_NONE_101_Mario.d:113","In der Schlacht um das Östliche Archipel habe ich eigenhändig zwei Dutzend Orks zurück in Beliars Reich geschickt.","In the Battle of the Eastern Archipelago, I single-handedly sent two dozen orcs back to Beliar's realm.","","","DIA_None_101_Mario_WhyNeedYou_07_04","",""
"Scripts/Content/Story/Dialoge/DIA_NONE_101_Mario.d:114","Leider waren wir zu wenige, nachdem unser Flaggschiff versenkt worden ist, mussten wir uns zurückziehen.","Unfortunately, there were too few of us after our flagship sank, and we were forced to retreat.","","","DIA_None_101_Mario_WhyNeedYou_07_05","",""
"Scripts/Content/Story/Dialoge/DIA_NONE_101_Mario.d:126","Wieso bist du dann hier? ","Why are you here, then?","","","DIA_None_101_Mario_WhyHere.description","",""
"Scripts/Content/Story/Dialoge/DIA_NONE_101_Mario.d:140","Wieso bist du dann hier?","Why are you here, then?","","","DIA_None_101_Mario_WhyHere_15_00","",""
"Scripts/Content/Story/Dialoge/DIA_NONE_101_Mario.d:141","Die Flotte ist geschlagen und die Soldkassen sind leer.","The fleet is routed, and the payroll coffers are empty.","","","DIA_None_101_Mario_WhyHere_07_01","",""
"Scripts/Content/Story/Dialoge/DIA_NONE_101_Mario.d:142","Nach meiner Entlassung bin ich dann hier in diesem Nest gestrandet und suche eine neue Heuer.","After my discharge I wound up stranded in this dump, and I'm looking for a new berth.","","","DIA_None_101_Mario_WhyHere_07_02","",""
"Scripts/Content/Story/Dialoge/DIA_NONE_101_Mario.d:154","Was kannst du?","What can you do?","","","DIA_None_101_Mario_Abilities.description","",""
"Scripts/Content/Story/Dialoge/DIA_NONE_101_Mario.d:168","Was kannst du?","What can you do?","","","DIA_None_101_Mario_Abilities_15_00","",""
"Scripts/Content/Story/Dialoge/DIA_NONE_101_Mario.d:169","Ich bin ausgebildet für den Enterkrieg und im Nahkampf, ferner bin ich ein ganz brauchbarer Schütze mit der Schiffskanone.","I'm trained for boarding and close combat, plus I'm a passable shot with the ship's cannon.","","","DIA_None_101_Mario_Abilities_07_01","",""
"Scripts/Content/Story/Dialoge/DIA_NONE_101_Mario.d:170","Ich wette, es gibt die eine oder andere Sache, die ich dir auf der Reise beibringen kann.","I bet there's a thing or two that I can teach you on the trip.","","","DIA_None_101_Mario_Abilities_07_02","",""
"Scripts/Content/Story/Dialoge/DIA_NONE_101_Mario.d:184","Was verlangst du?","What are you asking?","","","DIA_None_101_Mario_YourPrice.description","",""
"Scripts/Content/Story/Dialoge/DIA_NONE_101_Mario.d:198","Was verlangst du?","What are you asking?","","","DIA_None_101_Mario_YourPrice_15_00","",""
"Scripts/Content/Story/Dialoge/DIA_NONE_101_Mario.d:199","Was kann ich denn verlangen? Ich bin froh, wenn ich von hier wegkomme.","What can I ask? I'd be glad to get away from here.","","","DIA_None_101_Mario_YourPrice_07_01","",""
"Scripts/Content/Story/Dialoge/DIA_NONE_101_Mario.d:200","Hand gegen Koje. Ich helfe dir und dafür nimmst du mich mit.","A hand for a bunk. I help you and you take me along.","","","DIA_None_101_Mario_YourPrice_07_02","",""
"Scripts/Content/Story/Dialoge/DIA_NONE_101_Mario.d:212","Die Reise kann gefährlich werden.","The journey may be perilous.","","","DIA_None_101_Mario_CouldBeDangerous.description","",""
"Scripts/Content/Story/Dialoge/DIA_NONE_101_Mario.d:226","Die Reise kann gefährlich werden.","The journey may be perilous.","","","DIA_None_101_Mario_CouldBeDangerous_15_00","",""
"Scripts/Content/Story/Dialoge/DIA_NONE_101_Mario.d:227","Ich bin Gefahr gewohnt. Wenn du da draußen bist, ist jeder Tag gefährlich.","I'm used to danger. When you're out there, every day is dangerous.","","","DIA_None_101_Mario_CouldBeDangerous_07_01","",""
"Scripts/Content/Story/Dialoge/DIA_NONE_101_Mario.d:228","Der nächste Sturm kann dein Tod sein und die Ungeheuer aus den Tiefen können dein ganzes Schiff am Stück verschlingen.","The next storm could be your death, and the monsters of the deep could swallow your ship whole.","","","DIA_None_101_Mario_CouldBeDangerous_07_02","",""
"Scripts/Content/Story/Dialoge/DIA_NONE_101_Mario.d:229","Die Orkischen Galeeren muss ich wohl nicht extra erwähnen oder? Glaub mir, es gibt nichts, wovor ich Angst habe. Ein Seemann, der Angst hat, ist schon tot","And I don't need to mention the orcish galleys, do I? Believe me, there's nothing I'm afraid of. A sailor who's afraid is already dead.","","","DIA_None_101_Mario_CouldBeDangerous_07_03","",""
"Scripts/Content/Story/Dialoge/DIA_NONE_101_Mario.d:241","Ich kann dich nicht gebrauchen.","I have no use for you.","","","DIA_None_101_Mario_DontNeedYou.description","",""
"Scripts/Content/Story/Dialoge/DIA_NONE_101_Mario.d:255","Ich kann dich nicht gebrauchen.","I have no use for you.","","","DIA_None_101_Mario_DontNeedYou_15_00","",""
"Scripts/Content/Story/Dialoge/DIA_NONE_101_Mario.d:256","Ich bin der beste Seeman, den du hier finden wirst.","I'm the best sailor you'll find here.","","","DIA_None_101_Mario_DontNeedYou_07_01","",""
"Scripts/Content/Story/Dialoge/DIA_NONE_101_Mario.d:257","Wie du aussiehst, hast du keine Ahnung von der Seefahrt.","From the look of you, you don't know the first thing about navigation.","","","DIA_None_101_Mario_DontNeedYou_07_02","",""
"Scripts/Content/Story/Dialoge/DIA_NONE_101_Mario.d:258","Also überleg dir sehr gut, wem du vertraust.","So think twice before you trust anyone.","","","DIA_None_101_Mario_DontNeedYou_07_03","",""
"Scripts/Content/Story/Dialoge/DIA_NONE_101_Mario.d:270","Gute Leute kann ich immer brauchen.","I can always use good people.","","","DIA_None_101_Mario_NeedGoodMen.description","",""
"Scripts/Content/Story/Dialoge/DIA_NONE_101_Mario.d:284","Gute Leute kann ich immer brauchen.","I can always use good people.","","","DIA_None_101_Mario_NeedGoodMen_15_00","",""
"Scripts/Content/Story/Dialoge/DIA_NONE_101_Mario.d:285","Alles klar, wir sehen uns dann am Schiff.","Sure thing, I'll see you on the ship.","","","DIA_None_101_Mario_NeedGoodMen_07_01","",""
"Scripts/Content/Story/Dialoge/DIA_NONE_101_Mario.d:312","Ich kann dich doch nicht gebrauchen!","I can't use you after all!","","","DIA_Mario_LeaveMyShip.description","",""
"Scripts/Content/Story/Dialoge/DIA_NONE_101_Mario.d:326","Ich kann dich doch nicht gebrauchen!","I can't use you after all!","","","DIA_Mario_LeaveMyShip_15_00","",""
"Scripts/Content/Story/Dialoge/DIA_NONE_101_Mario.d:327","Wie du meinst, du weißt ja, wo du mich findest!","As you like. You know where to find me!","","","DIA_Mario_LeaveMyShip_07_01","",""
"Scripts/Content/Story/Dialoge/DIA_NONE_101_Mario.d:345","Ich kann dich doch gebrauchen!","I can use you after all!","","","DIA_Mario_StillNeedYou.description","",""
"Scripts/Content/Story/Dialoge/DIA_NONE_101_Mario.d:360","Ich kann dich doch gebrauchen!","I can use you after all!","","","DIA_Mario_StillNeedYou_15_00","",""
"Scripts/Content/Story/Dialoge/DIA_NONE_101_Mario.d:364","Ich hab's doch gewusst. Wir sehen uns am Schiff!","I knew it! I'll see you on the ship!","","","DIA_Mario_StillNeedYou_07_01","",""
"Scripts/Content/Story/Dialoge/DIA_NONE_101_Mario.d:380","So kannst du nicht mit mir umspringen. Ich werde dich aufschlitzen!","You can't treat me like that. I'll gut you!","","","DIA_Mario_StillNeedYou_07_02","",""
"Scripts/Content/Story/Dialoge/DIA_NONE_101_Mario_DI.d:34","Jetzt kannst du deine Kampfkraft unter Beweis stellen.","Here's your chance to prove your fighting abilities.","","","DIA_NONE_101_MARIO_DI_Job.description","",""
"Scripts/Content/Story/Dialoge/DIA_NONE_101_Mario_DI.d:48","Jetzt kannst du deine Kampfkraft unter Beweis stellen.","Here's your chance to prove your fighting abilities.","","","DIA_NONE_101_MARIO_DI_Job_15_00","",""
"Scripts/Content/Story/Dialoge/DIA_NONE_101_Mario_DI.d:49","Langsam. Alles zu seiner Zeit.","Slowly. Everything in its time.","","","DIA_NONE_101_MARIO_DI_Job_07_01","",""
"Scripts/Content/Story/Dialoge/DIA_NONE_101_Mario_DI.d:50","Mmh. Hab auch nichts anderes von dir erwartet.","Mmh. That's just what I'd expected from you.","","","DIA_NONE_101_MARIO_DI_Job_15_02","",""
"Scripts/Content/Story/Dialoge/DIA_NONE_101_Mario_DI.d:51","Abwarten.","Just wait.","","","DIA_NONE_101_MARIO_DI_Job_07_03","",""
"Scripts/Content/Story/Dialoge/DIA_NONE_101_Mario_DI.d:76","Komm ruhig näher. So, mein Freundchen. Jetzt zeig mal, was du kannst.","Come closer. So, my friend. Now show me what you've got.","","","DIA_NONE_101_MARIO_DI_ambush_07_00","",""
"Scripts/Content/Story/Dialoge/DIA_NONE_101_Mario_DI.d:77","Was soll das heißen?","What do you mean by that?","","","DIA_NONE_101_MARIO_DI_ambush_15_01","",""
"Scripts/Content/Story/Dialoge/DIA_NONE_101_Mario_DI.d:78","Ganz einfach. Der Meister hat von dir gehörig die Nase voll.","Quite simple. The Master has had more than enough of you.","","","DIA_NONE_101_MARIO_DI_ambush_07_02","",""
"Scripts/Content/Story/Dialoge/DIA_NONE_101_Mario_DI.d:79","Ich hätte schon viel früher töten sollen. Aber diesen Fehler werden ich und meine Freunde hier jetzt korrigieren.","I should have killed you sooner. But my friends and I will correct that mistake here and now.","","","DIA_NONE_101_MARIO_DI_ambush_07_03","",""
