"location","source","target","id","fuzzy","context","translator_comments","developer_comments"
"Scripts/Content/Story/Dialoge/DIA_Addon_NONE_111_Quarhodron.d:53","Warum störst du meine Ruhe, Wächter?","Why do you disturb my rest, guardian?","","","DIA_Addon_Quarhodron_Hello_11_00","",""
"Scripts/Content/Story/Dialoge/DIA_Addon_NONE_111_Quarhodron.d:54","(verärgert) Sag mir, was ist dein Begehren?","(angry) Tell me, what do you desire?","","","DIA_Addon_Quarhodron_Hello_11_01","",""
"Scripts/Content/Story/Dialoge/DIA_Addon_NONE_111_Quarhodron.d:57","Was befindet sich im Tempel Adanos?","What is there in the temple of Adanos?","","","DIA_Addon_Quarhodron_Hello.DIA_Addon_Quarhodron_Hello_schwert","Info_AddChoice",""
"Scripts/Content/Story/Dialoge/DIA_Addon_NONE_111_Quarhodron.d:58","Jemand ist in den Tempel Adanos eingedrungen.","Someone has forced his way into the temple of Adanos.","","","DIA_Addon_Quarhodron_Hello.DIA_Addon_Quarhodron_Hello_raven","Info_AddChoice",""
"Scripts/Content/Story/Dialoge/DIA_Addon_NONE_111_Quarhodron.d:59","Gewähre mir Zugang zum Tempel Adanos.","Grant me access to the temple of Adanos.","","","DIA_Addon_Quarhodron_Hello.DIA_Addon_Quarhodron_Hello_tempel","Info_AddChoice",""
"Scripts/Content/Story/Dialoge/DIA_Addon_NONE_111_Quarhodron.d:60","Das Land wird von Erdbeben heimgesucht.","The land is afflicted with earthquakes.","","","DIA_Addon_Quarhodron_Hello.DIA_Addon_Quarhodron_Hello_erdbeben","Info_AddChoice",""
"Scripts/Content/Story/Dialoge/DIA_Addon_NONE_111_Quarhodron.d:67","Bengla anthani, Osiri?","Bengla anthani, Osiri?","","","DIA_Addon_Quarhodron_Hello_11_02","",""
"Scripts/Content/Story/Dialoge/DIA_Addon_NONE_111_Quarhodron.d:69","(laut) Bengla anthani?","(loudly) Bengla anthani?","","","DIA_Addon_Quarhodron_Hello_11_03","",""
"Scripts/Content/Story/Dialoge/DIA_Addon_NONE_111_Quarhodron.d:81","Die gepriesene Weisheit der Ahnen ist geradezu überwältigend.","The praised wisdom of the ancestors is truly overwhelming.","","","DIA_Addon_Quarhodron_Hello.DIA_Addon_Quarhodron_Hello_frech","Info_AddChoice",""
"Scripts/Content/Story/Dialoge/DIA_Addon_NONE_111_Quarhodron.d:88","Das Land wird von Erdbeben heimgesucht. Wir müssen etwas unternehmen, sonst wird die ganze Insel im Meer versinken.","The land is plagued by earthquakes. We must do something or the entire island will sink into the sea.","","","DIA_Addon_Quarhodron_Hello_erdbeben_15_00","",""
"Scripts/Content/Story/Dialoge/DIA_Addon_NONE_111_Quarhodron.d:89","Es gibt nichts, was wir noch tun könnten.","There is nothing left for us to do.","","","DIA_Addon_Quarhodron_Hello_erdbeben_11_01","",""
"Scripts/Content/Story/Dialoge/DIA_Addon_NONE_111_Quarhodron.d:90","Adanos' Zorn ist über Jharkendar gekommen, um die Ungläubigen zu vernichten.","The wrath of Adanos has fallen upon Jharkendar to punish the unbelievers.","","","DIA_Addon_Quarhodron_Hello_erdbeben_11_02","",""
"Scripts/Content/Story/Dialoge/DIA_Addon_NONE_111_Quarhodron.d:97","Jemand ist in den Tempel Adanos' eingedrungen.","Someone has forced his way into the temple of Adanos.","","","DIA_Addon_Quarhodron_Hello_raven_15_00","",""
"Scripts/Content/Story/Dialoge/DIA_Addon_NONE_111_Quarhodron.d:98","Unsinn. Ich selbst habe das Tor verriegelt. Es ist unmöglich zu passieren.","Nonsense. I myself sealed the door. It is impossible to pass.","","","DIA_Addon_Quarhodron_Hello_raven_11_01","",""
"Scripts/Content/Story/Dialoge/DIA_Addon_NONE_111_Quarhodron.d:99","Tatsächlich?","Indeed?","","","DIA_Addon_Quarhodron_Hello_raven_15_02","",""
"Scripts/Content/Story/Dialoge/DIA_Addon_NONE_111_Quarhodron.d:106","Gewähre mir Zugang zum Tempel Adanos'.","Grant me access to the temple of Adanos.","","","DIA_Addon_Quarhodron_Hello_tempel_15_00","",""
"Scripts/Content/Story/Dialoge/DIA_Addon_NONE_111_Quarhodron.d:107","Der Tempel bleibt verschlossen bis in alle Ewigkeit. So wie der Rat es entschieden hat.","The temple will remain closed for all eternity. Thus did we in the council decide.","","","DIA_Addon_Quarhodron_Hello_tempel_11_01","",""
"Scripts/Content/Story/Dialoge/DIA_Addon_NONE_111_Quarhodron.d:114","Was befindet sich im Tempel Adanos'?","What is there in the temple of Adanos?","","","DIA_Addon_Quarhodron_Hello_schwert_15_00","",""
"Scripts/Content/Story/Dialoge/DIA_Addon_NONE_111_Quarhodron.d:115","Mein größtes Leid, meine größte Enttäuschung.","My greatest sorrow, my greatest disappointment.","","","DIA_Addon_Quarhodron_Hello_schwert_11_01","",""
"Scripts/Content/Story/Dialoge/DIA_Addon_NONE_111_Quarhodron.d:122","Die gepriesene Weisheit der Ahnen ist geradezu überwältigend.","The praised wisdom of the ancestors is truly overwhelming.","","","DIA_Addon_Quarhodron_Hello_frech_15_00","",""
"Scripts/Content/Story/Dialoge/DIA_Addon_NONE_111_Quarhodron.d:123","Ein Mann deines Standes spricht nicht so mit mir.","A man of your standing does not speak to me thus.","","","DIA_Addon_Quarhodron_Hello_frech_11_01","",""
"Scripts/Content/Story/Dialoge/DIA_Addon_NONE_111_Quarhodron.d:124","Ich kann mich des Eindrucks nicht erwehren, dass du nicht der bist, der du vorgibst zu sein.","I cannot free myself of the impression that you are not the one you pretend to be.","","","DIA_Addon_Quarhodron_Hello_frech_11_02","",""
"Scripts/Content/Story/Dialoge/DIA_Addon_NONE_111_Quarhodron.d:125","Wenn du meiner Hilfe bedarfst, hast du mir erst Zeugnis über dich selbst abzulegen.","If you require my aid, you must first prove yourself to me.","","","DIA_Addon_Quarhodron_Hello_frech_11_03","",""
"Scripts/Content/Story/Dialoge/DIA_Addon_NONE_111_Quarhodron.d:126","Beantworte meine Fragen, damit ich Gewissheit habe, mich keinem Fremden zu offenbaren.","Answer my questions, so that I may be sure that I do not reveal myself to strangers.","","","DIA_Addon_Quarhodron_Hello_frech_11_04","",""
"Scripts/Content/Story/Dialoge/DIA_Addon_NONE_111_Quarhodron.d:145","Stell deine Fragen.","Ask away.","","","DIA_Addon_Quarhodron_Fragen.description","",""
"Scripts/Content/Story/Dialoge/DIA_Addon_NONE_111_Quarhodron.d:164","Deine Antworten sind so falsch wie deine Absichten.","Your wrong answers reveal your evil intentions.","","","DIA_Addon_Quarhodron_TestFailed_11_00","",""
"Scripts/Content/Story/Dialoge/DIA_Addon_NONE_111_Quarhodron.d:165","Ich werde dir nicht helfen.","I shall not help you.","","","DIA_Addon_Quarhodron_TestFailed_11_01","",""
"Scripts/Content/Story/Dialoge/DIA_Addon_NONE_111_Quarhodron.d:182","Das glaube ich dir nicht.","I do not believe you.","","","DIA_Addon_Quarhodron_Fragen_Choices_11_00","",""
"Scripts/Content/Story/Dialoge/DIA_Addon_NONE_111_Quarhodron.d:183","Ich denke, du kommst erst wieder, wenn du dich dazu entschließt, mir die Wahrheit zu sagen.","I think you should only return when you have decided to tell me the truth.","","","DIA_Addon_Quarhodron_Fragen_Choices_11_01","",""
"Scripts/Content/Story/Dialoge/DIA_Addon_NONE_111_Quarhodron.d:192","(nachdenklich) Die Fähigkeiten eines Totenwächter hätten es dir ermöglicht, mich zu erwecken, das ist wahr.","(thinking) The abilities of a guardian of the dead would have allowed you to waken me, that is true.","","","DIA_Addon_Quarhodron_Fragen_Choices_11_02","",""
"Scripts/Content/Story/Dialoge/DIA_Addon_NONE_111_Quarhodron.d:193","Wenn du wirklich der bist, der du vorgibst zu sein, wirst du alle meine Fragen beantworten können.","If you are truly the one you claim to be, you will be able to answer all of my questions.","","","DIA_Addon_Quarhodron_Fragen_Choices_11_03","",""
"Scripts/Content/Story/Dialoge/DIA_Addon_NONE_111_Quarhodron.d:194","Bis auf eine ...","Except for one...","","","DIA_Addon_Quarhodron_Add_11_00","",""
"Scripts/Content/Story/Dialoge/DIA_Addon_NONE_111_Quarhodron.d:204","Wer hat das Portal verschlossen, um die Welt vor dem Bösen zu schützen?","Who sealed the portal to guard the world from Evil?","","","DIA_Addon_Quarhodron_Fragen_Choices_11_04","",""
"Scripts/Content/Story/Dialoge/DIA_Addon_NONE_111_Quarhodron.d:210","Wer lindert das Leid und versorgt die Kranken?","Who alleviates suffering and attends to the ill?","","","DIA_Addon_Quarhodron_Fragen_Choices_11_05","",""
"Scripts/Content/Story/Dialoge/DIA_Addon_NONE_111_Quarhodron.d:216","Wer hat das letzte Wort im Rat der Fünf?","Who has the final word in the Council of Five?","","","DIA_Addon_Quarhodron_Fragen_Choices_11_06","",""
"Scripts/Content/Story/Dialoge/DIA_Addon_NONE_111_Quarhodron.d:222","Wer ist Schuld am dem Übel, das über uns gekommen ist?","Who brought the Evil upon us?","","","DIA_Addon_Quarhodron_Fragen_Choices_11_07","",""
"Scripts/Content/Story/Dialoge/DIA_Addon_NONE_111_Quarhodron.d:228","Wer kann mir einen direkten Befehl erteilen?","Who can give me a direct order?","","","DIA_Addon_Quarhodron_Fragen_Choices_11_08","",""
"Scripts/Content/Story/Dialoge/DIA_Addon_NONE_111_Quarhodron.d:234","Wer schützte einst das Volk von Jharkendar vor feindlichen Angriffen?","Who once protected the people of Jharkendar from enemy attacks?","","","DIA_Addon_Quarhodron_Fragen_Choices_11_09","",""
"Scripts/Content/Story/Dialoge/DIA_Addon_NONE_111_Quarhodron.d:243","Das kann ich gar nicht wissen.","There's no way I could know that.","","","DIA_Addon_Quarhodron_Fragen.DIA_Addon_Quarhodron_Fragen_NoPlan","Info_AddChoice",""
"Scripts/Content/Story/Dialoge/DIA_Addon_NONE_111_Quarhodron.d:250","Die Gelehrten.","The scholars.","","","DIA_Addon_Quarhodron_Fragen.DIA_Addon_Quarhodron_Fragen_gele","Info_AddChoice",""
"Scripts/Content/Story/Dialoge/DIA_Addon_NONE_111_Quarhodron.d:251","Die Totenwächter.","The guardians of the dead.","","","DIA_Addon_Quarhodron_Fragen.DIA_Addon_Quarhodron_Fragen_totenw","Info_AddChoice",""
"Scripts/Content/Story/Dialoge/DIA_Addon_NONE_111_Quarhodron.d:252","Die Priester.","The priests.","","","DIA_Addon_Quarhodron_Fragen.DIA_Addon_Quarhodron_Fragen_prie","Info_AddChoice",""
"Scripts/Content/Story/Dialoge/DIA_Addon_NONE_111_Quarhodron.d:253","Die Kriegerkaste.","The warrior caste.","","","DIA_Addon_Quarhodron_Fragen.DIA_Addon_Quarhodron_Fragen_warr","Info_AddChoice",""
"Scripts/Content/Story/Dialoge/DIA_Addon_NONE_111_Quarhodron.d:254","Die Heiler.","The healers.","","","DIA_Addon_Quarhodron_Fragen.DIA_Addon_Quarhodron_Fragen_heiler","Info_AddChoice",""
"Scripts/Content/Story/Dialoge/DIA_Addon_NONE_111_Quarhodron.d:265","Stell deine Fragen.","Ask away.","","","DIA_Addon_Quarhodron_Fragen_15_00","",""
"Scripts/Content/Story/Dialoge/DIA_Addon_NONE_111_Quarhodron.d:269","Ich bin Quarhodron, der alte Kriegsherr von Jharkendar.","I am Quarhodron, the old warlord of Jharkendar.","","","DIA_Addon_Quarhodron_Fragen_11_01","",""
"Scripts/Content/Story/Dialoge/DIA_Addon_NONE_111_Quarhodron.d:270","Du hast mich erweckt.","You have woken me.","","","DIA_Addon_Quarhodron_Fragen_11_02","",""
"Scripts/Content/Story/Dialoge/DIA_Addon_NONE_111_Quarhodron.d:275","Welche Kaste von Jharkendar ist es, der du angehörst?","To which caste of Jharkendar do you belong?","","","DIA_Addon_Quarhodron_Fragen_11_03","",""
"Scripts/Content/Story/Dialoge/DIA_Addon_NONE_111_Quarhodron.d:282","Die Kriegerkaste.","The warrior caste.","","","DIA_Addon_Quarhodron_Fragen_warr_15_00","",""
"Scripts/Content/Story/Dialoge/DIA_Addon_NONE_111_Quarhodron.d:291","Die Priester.","The priests.","","","DIA_Addon_Quarhodron_Fragen_prie_15_00","",""
"Scripts/Content/Story/Dialoge/DIA_Addon_NONE_111_Quarhodron.d:299","Die Gelehrten.","The scholars.","","","DIA_Addon_Quarhodron_Fragen_gele_15_00","",""
"Scripts/Content/Story/Dialoge/DIA_Addon_NONE_111_Quarhodron.d:307","Die Totenwächter.","The guardians of the dead.","","","DIA_Addon_Quarhodron_Fragen_totenw_15_00","",""
"Scripts/Content/Story/Dialoge/DIA_Addon_NONE_111_Quarhodron.d:315","Die Heiler.","The healers.","","","DIA_Addon_Quarhodron_Fragen_heiler_15_00","",""
"Scripts/Content/Story/Dialoge/DIA_Addon_NONE_111_Quarhodron.d:323","Ich weiß es nicht.","I don't know.","","","DIA_Addon_Quarhodron_Fragen_NoPlan_15_00","",""
"Scripts/Content/Story/Dialoge/DIA_Addon_NONE_111_Quarhodron.d:328","Gut. Ich vertraue dir und werde dir meine Hilfe gewähren.","Good. I trust you and shall grant you my aid.","","","DIA_Addon_Quarhodron_Fragen_NoPlan_11_01","",""
"Scripts/Content/Story/Dialoge/DIA_Addon_NONE_111_Quarhodron.d:338","Dann verschwende nicht meine Zeit.","Then do not waste my time.","","","DIA_Addon_Quarhodron_Fragen_NoPlan_11_02","",""
"Scripts/Content/Story/Dialoge/DIA_Addon_NONE_111_Quarhodron.d:352","(Schlüssel zum Tempel verlangen)","(demand the key to the temple)","","","DIA_Addon_Quarhodron_GibMirKey.description","",""
"Scripts/Content/Story/Dialoge/DIA_Addon_NONE_111_Quarhodron.d:365","Jetzt hör mal zu, Meister. Ein ganz übler Bursche hat sich Zugang zum Tempel Adanos' verschafft.","Now listen here. A truly evil fellow has gained access to the temple of Adanos.","","","DIA_Addon_Quarhodron_GibMirKey_15_00","",""
"Scripts/Content/Story/Dialoge/DIA_Addon_NONE_111_Quarhodron.d:366","Wenn du mich nicht gleich in den Tempel lässt, ist es vielleicht schon zu spät und es geht hier alles den Bach runter.","If you don't let me into the temple right now, it will probably be too late and everything will go down the drain.","","","DIA_Addon_Quarhodron_GibMirKey_15_01","",""
"Scripts/Content/Story/Dialoge/DIA_Addon_NONE_111_Quarhodron.d:367","Das kann nicht sein! Der Hohepriester KHARDIMON und ich sind die einzigen in Jharkendar, die wissen, wie man das Eingangstor zum Tempel Adanos' öffnet.","That cannot be! The high priest KHARDIMON and I are the only ones in Jharkendar who know how to open the gate to Adanos' temple.","","","DIA_Addon_Quarhodron_GibMirKey_11_02","",""
"Scripts/Content/Story/Dialoge/DIA_Addon_NONE_111_Quarhodron.d:368","Tja. Dann wird wohl dein Kumpel KHARDIMON geplaudert haben.","Well. Then your pal KHARDIMON must have blabbed.","","","DIA_Addon_Quarhodron_GibMirKey_15_03","",""
"Scripts/Content/Story/Dialoge/DIA_Addon_NONE_111_Quarhodron.d:369","Ich sage dir, das Tor war offen. Ich habe es selbst gesehen.","I'm telling you, the gate was open. I saw it myself.","","","DIA_Addon_Quarhodron_GibMirKey_15_04","",""
"Scripts/Content/Story/Dialoge/DIA_Addon_NONE_111_Quarhodron.d:370","Nun. Es liegt Wahrheit in deiner Stimme. Ich werde nicht mehr an deinen Worten zweifeln.","Well. There is truth in your voice. I shall no longer doubt your words.","","","DIA_Addon_Quarhodron_GibMirKey_11_05","",""
"Scripts/Content/Story/Dialoge/DIA_Addon_NONE_111_Quarhodron.d:371","Das will ich auch hoffen.","I should hope so.","","","DIA_Addon_Quarhodron_GibMirKey_15_06","",""
"Scripts/Content/Story/Dialoge/DIA_Addon_NONE_111_Quarhodron.d:372","So nimm denn das Losungwort. Es steht auf dieser Steintafel. Sage die Worte am verschlossenen Tor des Tempels und es wird sich öffnen.","Take, then, the password. It is written on this stone tablet. Speak the words at the sealed gate of the temple and it will open.","","","DIA_Addon_Quarhodron_GibMirKey_11_07","",""
"Scripts/Content/Story/Dialoge/DIA_Addon_NONE_111_Quarhodron.d:375","(schon halb tot) Meine Zeit ist abgelaufen. Ich kann dir leider nicht mehr helfen.","(already half dead) My time is done. Alas, I can no longer help you.","","","DIA_Addon_Quarhodron_GibMirKey_11_08","",""
"Scripts/Content/Story/Dialoge/DIA_Addon_NONE_111_Quarhodron.d:376","(schon halb tot) Doch bedenke. Hüte dich vor den Kammern Adanos'. Sonst ist es dein sicherer Tod.","(already half dead) But remember: beware the chambers of Adanos. Else your death is certain.","","","DIA_Addon_Quarhodron_GibMirKey_11_09","",""
"Scripts/Content/Story/Dialoge/DIA_Addon_NONE_111_Quarhodron.d:377","Moment mal. Was IST mit den Kammern?","Wait. What ABOUT the chambers?","","","DIA_Addon_Quarhodron_GibMirKey_15_10","",""
"Scripts/Content/Story/Dialoge/DIA_Addon_NONE_111_Quarhodron.d:378","(schon halb tot) Meine Kräfte schwinden. Leb wohl. Wir sehen uns wieder im Reich der Toten ...","(already half dead) My strength is failing. Farewell. We shall meet again in the realm of the dead.","","","DIA_Addon_Quarhodron_GibMirKey_11_11","",""
"Scripts/Content/Story/Dialoge/DIA_Addon_NONE_112_Rhademes.d:11","Ich werde mir selbst einen Weg suchen! (ENDE)","I shall find my own way! (THE END)","","","DIA_Addon_Rhademes_EXIT.description","",""
"Scripts/Content/Story/Dialoge/DIA_Addon_NONE_112_Rhademes.d:21","Ich werde mir selbst einen Weg suchen!","I'll find a way myself!","","","DIA_Addon_Rhademes_EXIT_15_00","",""
"Scripts/Content/Story/Dialoge/DIA_Addon_NONE_112_Rhademes.d:22","Wie du willst ...","As you will ...","","","DIA_Addon_Rhademes_EXIT_03_01","",""
"Scripts/Content/Story/Dialoge/DIA_Addon_NONE_112_Rhademes.d:55","Eine Ewigkeit lang war mein Geist gefangen.","My spirit has been held captive for an eternity.","","","DIA_Addon_Rhademes_First_03_00","",""
"Scripts/Content/Story/Dialoge/DIA_Addon_NONE_112_Rhademes.d:56","Nun bin ich endlich frei. Das Schwert hat einen NEUEN Träger.","At last I am free. The sword has a NEW bearer.","","","DIA_Addon_Rhademes_First_03_01","",""
"Scripts/Content/Story/Dialoge/DIA_Addon_NONE_112_Rhademes.d:57","Die letzte Kammer wurde geöffnet.","The final chamber has been opened.","","","DIA_Addon_Rhademes_First_03_02","",""
"Scripts/Content/Story/Dialoge/DIA_Addon_NONE_112_Rhademes.d:58","Aber die Pforte sieht ziemlich verschlossen aus!","But the gate appears closed!","","","DIA_Addon_Rhademes_First_15_03","",""
"Scripts/Content/Story/Dialoge/DIA_Addon_NONE_112_Rhademes.d:59","Dies hier ist nicht die Pforte zur letzten Kammer.","This is not the gate to the final chamber.","","","DIA_Addon_Rhademes_First_03_04","",""
"Scripts/Content/Story/Dialoge/DIA_Addon_NONE_112_Rhademes.d:60","DIESE Pforte führt dich in den Raum davor.","THIS gate merely leads to the antechamber.","","","DIA_Addon_Rhademes_First_03_05","",""
"Scripts/Content/Story/Dialoge/DIA_Addon_NONE_112_Rhademes.d:61","Der Träger ... hat sie hinter sich verschlossen.","The bearer ... has closed it behind him.","","","DIA_Addon_Rhademes_First_03_06","",""
"Scripts/Content/Story/Dialoge/DIA_Addon_NONE_112_Rhademes.d:67","(leidend) Ghanima en Kandra Adanos?!","(strained) Ghanima en Kandra Adanos?!","","","DIA_Addon_Rhademes_First_03_07","",""
"Scripts/Content/Story/Dialoge/DIA_Addon_NONE_112_Rhademes.d:69","(verärgert) Bengla anthani!","(angry)  Bengla anthani!","","","DIA_Addon_Rhademes_First_03_08","",""
"Scripts/Content/Story/Dialoge/DIA_Addon_NONE_112_Rhademes.d:84","Wie öffne ich die Pforte?","How do I open the gate?","","","DIA_Addon_Rhademes_Pforte.description","",""
"Scripts/Content/Story/Dialoge/DIA_Addon_NONE_112_Rhademes.d:94","Wie öffne ich die Pforte?","How do I open the gate?","","","DIA_Addon_Rhademes_Pforte_15_00","",""
"Scripts/Content/Story/Dialoge/DIA_Addon_NONE_112_Rhademes.d:95","Bewege ... einen der Hebel.","Move ... one of the levers.","","","DIA_Addon_Rhademes_Pforte_03_01","",""
"Scripts/Content/Story/Dialoge/DIA_Addon_NONE_112_Rhademes.d:96","Irgendeinen?","Any one?","","","DIA_Addon_Rhademes_Pforte_15_02","",""
"Scripts/Content/Story/Dialoge/DIA_Addon_NONE_112_Rhademes.d:97","All diese Hebel öffnen die Pforte.","All of these levers open the gate.","","","DIA_Addon_Rhademes_Pforte_03_03","",""
"Scripts/Content/Story/Dialoge/DIA_Addon_NONE_112_Rhademes.d:109","Nicht alle Hebel lösen die Falle aus, richtig?","Not all of the levers trigger the trap, right?","","","DIA_Addon_Rhademes_Hebel.description","",""
"Scripts/Content/Story/Dialoge/DIA_Addon_NONE_112_Rhademes.d:123","Nicht alle Hebel lösen die Falle aus, richtig?","Not all of the levers trigger the trap, right?","","","DIA_Addon_Rhademes_Hebel_15_00","",""
"Scripts/Content/Story/Dialoge/DIA_Addon_NONE_112_Rhademes.d:124","Doch, das tun sie!","Yes, they do!","","","DIA_Addon_Rhademes_Hebel_03_01","",""
"Scripts/Content/Story/Dialoge/DIA_Addon_NONE_112_Rhademes.d:136","Ich glaube dir nicht!","I don't believe you!","","","DIA_Addon_Rhademes_DontBelieve.description","",""
"Scripts/Content/Story/Dialoge/DIA_Addon_NONE_112_Rhademes.d:150","Ich glaube dir nicht!","I don't believe you!","","","DIA_Addon_Rhademes_DontBelieve_15_00","",""
"Scripts/Content/Story/Dialoge/DIA_Addon_NONE_112_Rhademes.d:151","Doch ich ... sage nur die Wahrheit.","Yet, I ... speak only the truth.","","","DIA_Addon_Rhademes_DontBelieve_03_01","",""
"Scripts/Content/Story/Dialoge/DIA_Addon_NONE_112_Rhademes.d:163","Dein Vater hat die Falle erbaut, woher willst DU wissen, wie sie funktioniert?!","Your father built the trap, how would YOU know how it works?!","","","DIA_Addon_Rhademes_DeinVater.description","",""
"Scripts/Content/Story/Dialoge/DIA_Addon_NONE_112_Rhademes.d:177","Dein Vater hat die Falle erbaut, woher willst DU wissen, wie sie funktioniert?!","Your father built the trap, how would YOU know how it works?!","","","DIA_Addon_Rhademes_DeinVater_15_00","",""
"Scripts/Content/Story/Dialoge/DIA_Addon_NONE_112_Rhademes.d:178","QUARHODRON! Ich höre noch immer die Hammerschläge ... auf der anderen Seite des Tores ... seit so langer Zeit ...","QUARHODRON! I can still hear the pounding of the hammers ... on the other side of the gate ... after so long a time...","","","DIA_Addon_Rhademes_DeinVater_03_01","",""
"Scripts/Content/Story/Dialoge/DIA_Addon_NONE_112_Rhademes.d:179","Das Schwert ... ließ mich sehen ... seine Rache ... für mein Versagen ...","The sword ... showed me ... revenge ... for my failure ...","","","DIA_Addon_Rhademes_DeinVater_03_02","",""
"Scripts/Content/Story/Dialoge/DIA_Addon_NONE_112_Rhademes.d:180","Das heißt, du hast gesehen, welcher Hebel der richtige ist?","You mean you have seen which lever is the right one?","","","DIA_Addon_Rhademes_DeinVater_15_03","",""
"Scripts/Content/Story/Dialoge/DIA_Addon_NONE_112_Rhademes.d:181","Ich habe es seit langem vergessen.","I have long forgotten it.","","","DIA_Addon_Rhademes_DeinVater_03_04","",""
"Scripts/Content/Story/Dialoge/DIA_Addon_NONE_112_Rhademes.d:184","Dann Rate!","Then guess!","","","DIA_Addon_Rhademes_DeinVater.DIA_Addon_Rhademes_DeinVater_Guess","Info_AddChoice",""
"Scripts/Content/Story/Dialoge/DIA_Addon_NONE_112_Rhademes.d:185","Versuch dich zu erinnern!","Try to remember!","","","DIA_Addon_Rhademes_DeinVater.DIA_Addon_Rhademes_DeinVater_Remember","Info_AddChoice",""
"Scripts/Content/Story/Dialoge/DIA_Addon_NONE_112_Rhademes.d:186","Denk nach!","Think!","","","DIA_Addon_Rhademes_DeinVater.DIA_Addon_Rhademes_DeinVater_Think","Info_AddChoice",""
"Scripts/Content/Story/Dialoge/DIA_Addon_NONE_112_Rhademes.d:195","Es ist so lange her...","It was so long ago ...","","","DIA_Addon_Rhademes_Lever_03_00","",""
"Scripts/Content/Story/Dialoge/DIA_Addon_NONE_112_Rhademes.d:218","Denk nach!","Think!","","","DIA_Addon_Rhademes_DeinVater_Think_15_00","",""
"Scripts/Content/Story/Dialoge/DIA_Addon_NONE_112_Rhademes.d:224","Versuch dich zu errinnern!","Try to remember!","","","DIA_Addon_Rhademes_DeinVater_Remember_15_00","",""
"Scripts/Content/Story/Dialoge/DIA_Addon_NONE_112_Rhademes.d:230","Dann rate!","Then guess!","","","DIA_Addon_Rhademes_DeinVater_Guess_15_00","",""
"Scripts/Content/Story/Dialoge/DIA_Addon_NONE_112_Rhademes.d:258","Wenn du die Kraft dazu hast ... versenke es ... in den Tiefen des Meeres ...","If you have the strength ... sink it ... in the depths of the sea ...","","","DIA_Addon_Rhademes_PERM_03_00","",""
"Scripts/Content/Story/Dialoge/DIA_Addon_NONE_115_Eremit.d:47","(verwundert) Was machst du denn hier?","(amazed) What are you doing here?","","","DIA_Addon_Eremit_Add_15_00","",""
"Scripts/Content/Story/Dialoge/DIA_Addon_NONE_115_Eremit.d:48","Was ICH hier mache?! Was zum Teufel machst DU hier?","What am I doing here?! What the hell are YOU doing here?","","","DIA_Addon_Eremit_Add_04_00","",""
"Scripts/Content/Story/Dialoge/DIA_Addon_NONE_115_Eremit.d:49","Ich bin an den entlegensten Ort der Insel gegangen, weil ich endlich meine Ruhe haben wollte!","I came to the remotest spot on the island because I finally wanted some peace!","","","DIA_Addon_Eremit_Add_04_01","",""
"Scripts/Content/Story/Dialoge/DIA_Addon_NONE_115_Eremit.d:50","Bürgerkrieg, Banditenüberfälle, Horden von Orks vor meiner Haustür...","Civil war, bandit raids, hordes of orcs outside my door ...","","","DIA_Addon_Eremit_Add_04_02","",""
"Scripts/Content/Story/Dialoge/DIA_Addon_NONE_115_Eremit.d:51","Das war nichts mehr für mich. Ich bin aus diesem ganzen Wahnsinn ausgestiegen.","That just wasn't my thing. I've retired from that madness.","","","DIA_Addon_Eremit_Add_04_03","",""
"Scripts/Content/Story/Dialoge/DIA_Addon_NONE_115_Eremit.d:52","Hier gibt es zwar auch Orks, aber lange nicht so viele.","There may be orcs here, but not very many.","","","DIA_Addon_Eremit_Add_04_04","",""
"Scripts/Content/Story/Dialoge/DIA_Addon_NONE_115_Eremit.d:53","Und andere MENSCHEN lassen sich - Innos sei Dank - nie hier blicken. (brummig) Bis heute.","And other PEOPLE - thank Innos - never show up here. (grumpily) Until today.","","","DIA_Addon_Eremit_Add_04_05","",""
"Scripts/Content/Story/Dialoge/DIA_Addon_NONE_115_Eremit.d:65","Ich bin auf der Suche nach Steintafeln...","I am looking for some stone tablets...","","","DIA_Addon_Eremit_SeekTafeln.description","",""
"Scripts/Content/Story/Dialoge/DIA_Addon_NONE_115_Eremit.d:75","Ich bin auf der Suche nach Steintafeln, du hast nicht zufällig welche gefunden?","I am searching for stone tablets. You wouldn't happen to have found any?","","","DIA_Addon_Eremit_Add_15_02","",""
"Scripts/Content/Story/Dialoge/DIA_Addon_NONE_115_Eremit.d:76","(vorsichtig) Doch... Aber die werde ich behalten!","(carefully) Yes ... But I'm keeping them!","","","DIA_Addon_Eremit_Add_04_06","",""
"Scripts/Content/Story/Dialoge/DIA_Addon_NONE_115_Eremit.d:77","Sie sind das einzige, was es hier zu lesen gibt.","They're the only thing there is to read around here.","","","DIA_Addon_Eremit_Add_04_07","",""
