"location","source","target","id","fuzzy","context","translator_comments","developer_comments"
"Scripts/Content/Story/Dialoge/DIA_Addon_PIR_1356_Bill.d:433","Wenn du zugreifst, dann sei dir sicher, dass dein Gegenüber nichts merkt.","Kiedy zabierasz się za kradzież, upewnij się, że ofiara niczego nie zauważyła.","","","DIA_Addon_Bill_LearnTalent_03_03","",""
"Scripts/Content/Story/Dialoge/DIA_Addon_PIR_1356_Bill.d:435","Sonst noch was?","Coś jeszcze?","","","DIA_Addon_Bill_LearnTalent_15_05","",""
"Scripts/Content/Story/Dialoge/DIA_Addon_PIR_1356_Bill.d:436","Ja, trainiere deine Geschicklichkeit. Je geschickter du bist, desto besser erkennst du eine gute Gelegenheit.","Tak. Potrenuj trochę zręczność, jako że zręczniejszemu złodziejowi łatwiej spostrzec dobrą okazję.","","","DIA_Addon_Bill_LearnTalent_03_06","",""
"Scripts/Content/Story/Dialoge/DIA_Addon_PIR_1356_Bill.d:437","Und desto eher kannst du deinem Opfer seine Sachen abnehmen, ohne dabei ERWISCHT zu werden!","I łatwiej uniknąć złapania na gorącym uczynku.","","","DIA_Addon_Bill_LearnTalent_03_07","",""
"Scripts/Content/Story/Dialoge/DIA_Addon_PIR_1356_Bill.d:438","Das ist alles, zumindest in der Theorie.","Przynajmniej w teorii.","","","DIA_Addon_Bill_LearnTalent_03_08","",""
"Scripts/Content/Story/Dialoge/DIA_Addon_PIR_1356_Bill.d:443","Vergiß es! Du bist nicht geschickt genug!","Zapomnij o tym. Jesteś zbyt niezdarny!","","","DIA_Addon_Bill_LearnTalent_03_09","",""
"Scripts/Content/Story/Dialoge/DIA_Addon_PIR_1356_Bill.d:444","Du mußt entweder geschickter werden oder dir 'nen besseren Lehrer suchen.","Potrenuj zręczność albo znajdź sobie lepszego nauczyciela.","","","DIA_Addon_Bill_LearnTalent_03_10","",""
"Scripts/Content/Story/Dialoge/DIA_Addon_PIR_1357_Garett.d:83","Komm bloß nicht auf die Idee, mich zu fragen, ob ich beim Entertrupp mitmache.","Jeśli chcesz zapytać, czy do ciebie dołączę, to możesz sobie darować.","","","DIA_Addon_Garett_Anheuern_09_00","",""
"Scripts/Content/Story/Dialoge/DIA_Addon_PIR_1357_Garett.d:84","Was meinst du, was die anderen Jungs machen, wenn ich weg bin, hm?","Jak sądzisz, co chłopaki zrobią, kiedy sobie pójdę?","","","DIA_Addon_Garett_Anheuern_09_01","",""
"Scripts/Content/Story/Dialoge/DIA_Addon_PIR_1357_Garett.d:85","Wenn ich wiederkomme, hab ich nicht EINE volle Kiste mehr in meiner Hütte!","Po powrocie nie znalazłbym ani jednej pełnej skrzynki w swojej chacie!","","","DIA_Addon_Garett_Anheuern_09_02","",""
"Scripts/Content/Story/Dialoge/DIA_Addon_PIR_1357_Garett.d:86","Ich bleibe hier und passe auf unsere Vorräte auf!","Nie ma mowy. Zostanę tutaj i będę pilnował zapasów.","","","DIA_Addon_Garett_Anheuern_09_03","",""
"Scripts/Content/Story/Dialoge/DIA_Addon_PIR_1357_Garett.d:113","Sieh an, ein Neues Gesicht! Und keiner von den dreckigen Banditen, will ich doch hoffen!","Kogo my tu mamy? Ha, mam nadzieję, że to nie kolejny bandzior na przeszpiegach.","","","DIA_Addon_Garett_Hello_09_00","",""
"Scripts/Content/Story/Dialoge/DIA_Addon_PIR_1357_Garett.d:114","Ich bin Garett. Wenn du irgend etwas brauchen solltest, frag zuerst mich.","Nazywam się Garett. Jeśli masz na coś ochotę, najlepiej zwróć się do mnie.","","","DIA_Addon_Garett_Hello_09_01","",""
"Scripts/Content/Story/Dialoge/DIA_Addon_PIR_1357_Garett.d:115","Ich kann dir fast alles besorgen, Wein, Waffen und vieles, was man sonst so braucht.","Mam tu wszystko, czego mógłbyś potrzebować - wino, broń i sporo innych rzeczy.","","","DIA_Addon_Garett_Hello_09_02","",""
"Scripts/Content/Story/Dialoge/DIA_Addon_PIR_1357_Garett.d:116","Außer Schnaps - wenn du 'nen ordentlichen Schnaps willst, geh zu Samuel.","Jeśli jednak szukasz dobrego trunku, lepiej zgłoś się do Samuela.","","","DIA_Addon_Garett_Hello_09_03","",""
"Scripts/Content/Story/Dialoge/DIA_Addon_PIR_1357_Garett.d:131","Wer ist Samuel?","Kim jest Samuel?","","","DIA_Addon_Garett_Samuel.description","",""
"Scripts/Content/Story/Dialoge/DIA_Addon_PIR_1357_Garett.d:145","Wer ist Samuel?","Kim jest Samuel?","","","DIA_Addon_Garett_Samuel_15_00","",""
"Scripts/Content/Story/Dialoge/DIA_Addon_PIR_1357_Garett.d:146","Unser Schnapsbrenner. Er hat seine Höhle etwas abseits des Lagers direkt am Strand.","To nasz gorzelnik. Rezyduje w jaskini przy plaży.","","","DIA_Addon_Garett_Samuel_09_01","",""
"Scripts/Content/Story/Dialoge/DIA_Addon_PIR_1357_Garett.d:147","Nicht schwer zu finden, geh einfach Richtung Norden.","Nietrudno do niego trafić. Po prostu podążaj cały czas na północ.","","","DIA_Addon_Garett_Samuel_09_02","",""
"Scripts/Content/Story/Dialoge/DIA_Addon_PIR_1357_Garett.d:148","Ich kann dir nur raten, dich gut mit Grog einzudecken.","Radzę zrobić mały zapas grogu.","","","DIA_Addon_Garett_Samuel_09_03","",""
"Scripts/Content/Story/Dialoge/DIA_Addon_PIR_1357_Garett.d:149","Einige der Jungs hier sind Neuen gegenüber nicht gerade aufgeschlossen, verstehst du?","Niektórzy chłopcy nie są zbyt przyjaźni w stosunku do nowych, że się tak wyrażę.","","","DIA_Addon_Garett_Samuel_09_04","",""
"Scripts/Content/Story/Dialoge/DIA_Addon_PIR_1357_Garett.d:150","Da kann ein ordentlicher Schluck Grog Wunder wirken!","A w takim wypadku grog może zdziałać cuda.","","","DIA_Addon_Garett_Samuel_09_05","",""
"Scripts/Content/Story/Dialoge/DIA_Addon_PIR_1357_Garett.d:164","Wo bekommst du deine Waren her?","Skąd bierzesz swoje towary?","","","DIA_Addon_Garett_Warez.description","",""
"Scripts/Content/Story/Dialoge/DIA_Addon_PIR_1357_Garett.d:174","Wo bekommst du deine Waren her?","Skąd bierzesz swoje towary?","","","DIA_Addon_Garett_Warez_15_00","",""
"Scripts/Content/Story/Dialoge/DIA_Addon_PIR_1357_Garett.d:175","Skip bringt immer 'ne Menge aus Khorinis mit, wenn er 'rüberfährt.","Skip przynosi je z Khorinis, gdzie czasami bywa.","","","DIA_Addon_Garett_Warez_09_01","",""
"Scripts/Content/Story/Dialoge/DIA_Addon_PIR_1357_Garett.d:176","Bis vor kurzem hat er einiges davon direkt an die Banditen verkauft.","Do niedawna sprzedawał je bandytom.","","","DIA_Addon_Garett_Warez_09_02","",""
"Scripts/Content/Story/Dialoge/DIA_Addon_PIR_1357_Garett.d:177","Aber seit es mit den Banditen Krieg gibt, landet der ganze Kram bei mir.","Ale od czasu, gdy toczymy z nimi wojnę, wszystko trafia do mnie.","","","DIA_Addon_Garett_Warez_09_03","",""
"Scripts/Content/Story/Dialoge/DIA_Addon_PIR_1357_Garett.d:189","Was weißt du über die Banditen?","Co wiesz na temat bandytów?","","","DIA_Addon_Garett_Bandits.description","",""
"Scripts/Content/Story/Dialoge/DIA_Addon_PIR_1357_Garett.d:202","Was weißt du über die Banditen?","Co wiesz na temat bandytów?","","","DIA_Addon_Garett_Bandits_15_00","",""
"Scripts/Content/Story/Dialoge/DIA_Addon_PIR_1357_Garett.d:203","Dazu frag am besten mal Skip.","Najlepiej zapytaj o to Skipa.","","","DIA_Addon_Garett_Bandits_09_01","",""
"Scripts/Content/Story/Dialoge/DIA_Addon_PIR_1357_Garett.d:204","Der hat 'nen ganz schönen Tanz mitgemacht mit den Kerlen, das kann ich dir sagen.","Często się z nimi kontaktował, więc powinien sporo wiedzieć o tych draniach.","","","DIA_Addon_Garett_Bandits_09_02","",""
"Scripts/Content/Story/Dialoge/DIA_Addon_PIR_1357_Garett.d:205","Greg hat angeordnet, alle Banditen, die sich in der Nähe des Lagers blicken lassen, abzumurksen.","Greg rozkazał ostro reagować na pojawienie się choćby jednego bandyty w tym rejonie.","","","DIA_Addon_Garett_Bandits_09_03","",""
"Scripts/Content/Story/Dialoge/DIA_Addon_PIR_1357_Garett.d:222","Dein Kapitän Greg. Wie ist der so?","A ten wasz kapitan... Jaki on jest?","","","DIA_Addon_Garett_Greg.description","",""
"Scripts/Content/Story/Dialoge/DIA_Addon_PIR_1357_Garett.d:232","Dein Kapitän Greg. Wie ist der so?","A ten wasz kapitan... Jaki on jest?","","","DIA_Addon_Garett_Greg_15_00","",""
"Scripts/Content/Story/Dialoge/DIA_Addon_PIR_1357_Garett.d:233","Er ist 'n harter Knochen, das kann ich dir sagen.","Twarda z niego sztuka, bez dwóch zdań.","","","DIA_Addon_Garett_Greg_09_01","",""
"Scripts/Content/Story/Dialoge/DIA_Addon_PIR_1357_Garett.d:234","Und rafffgierig bis auf's Blut.","I skąpy jak diabli.","","","DIA_Addon_Garett_Greg_09_02","",""
"Scripts/Content/Story/Dialoge/DIA_Addon_PIR_1357_Garett.d:235","Er läßt unseren Schatzmeister Francis immer gerade soviel zahlen, daß es zu keiner Meuterei kommt!","Pozwala naszemu skarbnikowi, Francisowi, płacić nam tylko tyle, byśmy się nie zbuntowali.","","","DIA_Addon_Garett_Greg_09_03","",""
"Scripts/Content/Story/Dialoge/DIA_Addon_PIR_1357_Garett.d:236","Und wenn einer von uns mal was WIRKLICH wertvolles erbeutet, reißt er sich's selber unter'n Nagel.","A kiedy któryś z nas zdobędzie coś naprawdę cennego, Greg przywłaszcza to sobie.","","","DIA_Addon_Garett_Greg_09_04","",""
"Scripts/Content/Story/Dialoge/DIA_Addon_PIR_1357_Garett.d:237","Ich hatte mal den Kompass von 'ner königlichen Fregatte mitgehen lassen.","Kiedyś zabrałem kompas z królewskiej fregaty.","","","DIA_Addon_Garett_Greg_09_05","",""
"Scripts/Content/Story/Dialoge/DIA_Addon_PIR_1357_Garett.d:238","Greg, der Mistkerl, hat ihn mir natürlich abgeknöpft.","A Greg, rzecz jasna, odebrał mi go.","","","DIA_Addon_Garett_Greg_09_06","",""
"Scripts/Content/Story/Dialoge/DIA_Addon_PIR_1357_Garett.d:239","Pah! Vermutlich hat er ihn irgendwo verbuddelt, genau wie alle seine anderen Schätze.","Ech... Pewnie go gdzieś zakopał jak resztę swoich skarbów.","","","DIA_Addon_Garett_Greg_09_07","",""
"Scripts/Content/Story/Dialoge/DIA_Addon_PIR_1357_Garett.d:251","Wo könnte Greg den Kompass vergraben haben?","Gdzie Greg mógł zakopać kompas?","","","DIA_Addon_Garett_Tips.description","",""
"Scripts/Content/Story/Dialoge/DIA_Addon_PIR_1357_Garett.d:264","Wo könnte Greg den Kompass vergraben haben?","Gdzie Greg mógł zakopać kompas?","","","DIA_Addon_Garett_Tips_15_00","",""
"Scripts/Content/Story/Dialoge/DIA_Addon_PIR_1357_Garett.d:265","Greg, sagte mir mal, dass der Tod über meinem Kompass wacht und hat mich ausgelacht.","Greg powiedział mi, że w ten kompas zaglądała sama śmierć. A potem mnie wyśmiał.","","","DIA_Addon_Garett_Tips_09_01","",""
"Scripts/Content/Story/Dialoge/DIA_Addon_PIR_1357_Garett.d:266","Sonst noch was?","Coś jeszcze?","","","DIA_Addon_Garett_Tips_15_02","",""
"Scripts/Content/Story/Dialoge/DIA_Addon_PIR_1357_Garett.d:267","An der südlichen Küste gibt es einen Strand. Er ist nur über den Seeweg zu erreichen.","Wzdłuż południowego wybrzeża ciągnie się plaża, do której można się dostać wyłącznie drogą morską.","","","DIA_Addon_Garett_Tips_09_03","",""
"Scripts/Content/Story/Dialoge/DIA_Addon_PIR_1357_Garett.d:268","Greg soll öfter mal dort gewesen sein. Vielleicht findest du da was.","Podobno często widywano na niej Grega. Może tam uda ci się coś znaleźć.","","","DIA_Addon_Garett_Tips_09_04","",""
"Scripts/Content/Story/Dialoge/DIA_Addon_PIR_1357_Garett.d:269","Ich hab mich selber schonmal dort umgesehen, aber die Gegend wimmelt von Monstern.","Kiedyś sam się wybrałem w te rejony, ale za dużo tam potworów.","","","DIA_Addon_Garett_Tips_09_05","",""
"Scripts/Content/Story/Dialoge/DIA_Addon_PIR_1357_Garett.d:270","Wenn du's wirklich wagen willst, vergiß nicht ne Hacke mitzunehmen.","Jeśli chcesz mimo wszystko zaryzykować, nie zapomnij wziąć kilofa.","","","DIA_Addon_Garett_Tips_09_06","",""
"Scripts/Content/Story/Dialoge/DIA_Addon_PIR_1357_Garett.d:287","Hier ist dein Kompass.","Oto twój kompas.","","","DIA_Addon_Garett_GiveKompass.description","",""
"Scripts/Content/Story/Dialoge/DIA_Addon_PIR_1357_Garett.d:301","Hier ist dein Kompass.","Oto twój kompas.","","","DIA_Addon_Garett_GiveKompass_15_00","",""
"Scripts/Content/Story/Dialoge/DIA_Addon_PIR_1357_Garett.d:309","(freut sich) Ja, das ist er. Hätte nicht gedacht, dass ich ihn noch mal wiedersehe.","Ha, to rzeczywiście on! Nie spodziewałem się, że ujrzę go ponownie.","","","DIA_Addon_Garett_GiveKompass_09_01","",""
"Scripts/Content/Story/Dialoge/DIA_Addon_PIR_1357_Garett.d:310","Danke, Mann!","Wielkie dzięki!","","","DIA_Addon_Garett_GiveKompass_09_02","",""
"Scripts/Content/Story/Dialoge/DIA_Addon_PIR_1357_Garett.d:314","Dieses Mal wird ihn Greg NICHT wieder in die Finger kriegen...","Tym razem Greg już go nie dostanie.","","","DIA_Addon_Garett_GiveKompass_09_03","",""
"Scripts/Content/Story/Dialoge/DIA_Addon_PIR_1357_Garett.d:315","Hier, nimm diesen Gürtel dafür. Er ist mein wertvollstes Stück.","Weź w nagrodę ten pas. Jest sporo wart.","","","DIA_Addon_Garett_GiveKompass_09_04","",""
"Scripts/Content/Story/Dialoge/DIA_Addon_PIR_1357_Garett.d:320","Du hast doch diesen Gürtel bei mir gekauft, erinnerst du dich?","Pamiętasz ten pas, który ode mnie kupiłeś?","","","DIA_Addon_Garett_GiveKompass_09_05","",""
"Scripts/Content/Story/Dialoge/DIA_Addon_PIR_1357_Garett.d:321","Hast 'ne Menge dafü bezahlt - (hastig) und das war er auch wert. Hier - du sollst dein Gold zurückhaben.","Zapłaciłeś za niego sporo, choć, zważywszy na jego wartość, na pewno nie przepłaciłeś. Proszę, weź swoje pieniądze z powrotem i potraktuj go jako prezent.","","","DIA_Addon_Garett_GiveKompass_09_06","",""
"Scripts/Content/Story/Dialoge/DIA_Addon_PIR_1357_Garett.d:339","Was kannst du mir über Francis erzählen?","Co możesz mi powiedzieć o Francisie?","","","DIA_Addon_Garett_Francis.description","",""
"Scripts/Content/Story/Dialoge/DIA_Addon_PIR_1357_Garett.d:352","°Was kannst du mir über Francis erzählen?","Co możesz mi powiedzieć o Francisie?","","","DIA_Addon_Garett_Francis_15_00","",""
"Scripts/Content/Story/Dialoge/DIA_Addon_PIR_1357_Garett.d:353","Greg hat ihm das Kommando übertragen, während er weg ist.","Greg mianował go zastępcą na czas swojej nieobecności.","","","DIA_Addon_Garett_Francis_09_01","",""
"Scripts/Content/Story/Dialoge/DIA_Addon_PIR_1357_Garett.d:354","Aber als Käpt'n ist Francis ein Versager!","Niestety, Francis w ogóle nie sprawdza się w roli kapitana.","","","DIA_Addon_Garett_Francis_09_02","",""
"Scripts/Content/Story/Dialoge/DIA_Addon_PIR_1357_Garett.d:355","Er kriegt Morgan ja noch nicht mal dazu seinen Hintern aus dem Bett zu bewegen.","Nie potrafi nawet ściągnąć Morgana z łóżka.","","","DIA_Addon_Garett_Francis_09_03","",""
"Scripts/Content/Story/Dialoge/DIA_Addon_PIR_1357_Garett.d:356","Henry und seine Jungs sind die einzigen, die hier was tun.","Tylko Henry i jego chłopaki w ogóle coś robią.","","","DIA_Addon_Garett_Francis_09_04","",""
"Scripts/Content/Story/Dialoge/DIA_Addon_PIR_1357_Garett.d:357","Die anderen machen sich hier einen schönen Tag, statt zu arbeiten.","Reszta obija się, zamiast pracować.","","","DIA_Addon_Garett_Francis_09_05","",""
"Scripts/Content/Story/Dialoge/DIA_Addon_PIR_1357_Garett.d:360","Ich kann nur hoffen, dass Greg bald wieder da ist.","Mam nadzieję, że Greg szybko wróci.","","","DIA_Addon_Garett_Francis_09_06","",""
"Scripts/Content/Story/Dialoge/DIA_Addon_PIR_1357_Garett.d:361","Der wird ihnen allen ordentlich in den Arsch treten.","I porozstawia towarzystwo po kątach.","","","DIA_Addon_Garett_Francis_09_07","",""
"Scripts/Content/Story/Dialoge/DIA_Addon_PIR_1357_Garett.d:375","Gibt's was Neues?","Jakieś wieści?","","","DIA_Addon_Garett_PERM.description","",""
"Scripts/Content/Story/Dialoge/DIA_Addon_PIR_1357_Garett.d:385","Gibt's was Neues?","Jakieś wieści?","","","DIA_Addon_Garett_PERM_15_00","",""
"Scripts/Content/Story/Dialoge/DIA_Addon_PIR_1357_Garett.d:390","Seit Greg weg ist, passiert hier gar nichts.","Od kiedy Greg zniknął, nic tu się nie dzieje.","","","DIA_Addon_Garett_PERM_09_02","",""
"Scripts/Content/Story/Dialoge/DIA_Addon_PIR_1357_Garett.d:394","Jetzt wo Greg wieder da ist, weht hier ein anderer Wind.","Od czasu powrotu kapitana wszystko wróciło do normy.","","","DIA_Addon_Garett_PERM_09_01","",""
"Scripts/Content/Story/Dialoge/DIA_Addon_PIR_1360_HammerPirate.d:34","Alles klar?","Wszystko w porządku?","","","DIA_Addon_HammerPirate_Hello.description","",""
"Scripts/Content/Story/Dialoge/DIA_Addon_PIR_1360_HammerPirate.d:44","Alles klar?","Wszystko w porządku?","","","DIA_Addon_HammerPirate_Hello_15_00","",""
"Scripts/Content/Story/Dialoge/DIA_Addon_PIR_1360_HammerPirate.d:49","Jetzt haben wir's ja hinter uns! Die Msitkerle sind platt wie 'ne Flunder!","Pobiliśmy ich! Skurczybyki nie miały żadnych szans!","","","DIA_Addon_HammerPirate_Hello_07_01","",""
"Scripts/Content/Story/Dialoge/DIA_Addon_PIR_1360_HammerPirate.d:53","Bringen wir's hinter uns!","No, wykrztuś to z siebie!","","","DIA_Addon_HammerPirate_Hello_07_02","",""
"Scripts/Content/Story/Dialoge/DIA_Addon_PIR_1360_HammerPirate.d:58","Nein! Ich steh' nicht auf Hämmern!","Nie mam zamiaru się mieszać.","","","DIA_Addon_HammerPirate_Hello_07_03","",""
"Scripts/Content/Story/Dialoge/DIA_Addon_PIR_1360_HammerPirate.d:76","Du sollst mir helfen.","Powinieneś mi pomóc.","","","DIA_Addon_HammerPirate_Anheuern.description","",""
"Scripts/Content/Story/Dialoge/DIA_Addon_PIR_1360_HammerPirate.d:89","Sag nichts! Du willst, daß ich mit dir die Banditen plattmache!","Nie musisz nic mówić. Chcesz, żebym pomógł ci walczyć z bandytami?","","","DIA_Addon_HammerPirate_Anheuern_07_00","",""
"Scripts/Content/Story/Dialoge/DIA_Addon_PIR_1360_HammerPirate.d:90","Du hast es erfasst.","Nie ma sprawy. Mówisz i masz.","","","DIA_Addon_PIR_6_JoinHenry_15_08","",""
"Scripts/Content/Story/Dialoge/DIA_Addon_PIR_1360_HammerPirate.d:93","Warum fragst du nicht den Typen an der Säge?","Czemu nie poprosisz o pomoc kolesi piłujących drewno?","","","DIA_Addon_HammerPirate_Anheuern_07_01","",""
"Scripts/Content/Story/Dialoge/DIA_Addon_PIR_1360_HammerPirate.d:96","Ich... hab keine Lust auf den ganzen Stress...","W sumie... Nie mam ochoty na tę całą zabawę.","","","DIA_Addon_HammerPirate_Anheuern_07_02","",""
"Scripts/Content/Story/Dialoge/DIA_Addon_PIR_1360_HammerPirate.d:109","Komm mit.","Chodź ze mną.","","","DIA_Addon_HammerPirate_ComeOn.description","",""
"Scripts/Content/Story/Dialoge/DIA_Addon_PIR_1360_HammerPirate.d:125","Komm mit.","Chodź ze mną.","","","DIA_Addon_HammerPirate_ComeOn_15_00","",""
"Scripts/Content/Story/Dialoge/DIA_Addon_PIR_1360_HammerPirate.d:128","Henry braucht einen von uns HIER...","Henry chce, żeby jeden z nas został tutaj. Rozumiesz?","","","DIA_Addon_HammerPirate_ComeOn_07_01","",""
"Scripts/Content/Story/Dialoge/DIA_Addon_PIR_1360_HammerPirate.d:132","Lass uns erst ein Stück zurück in Richtung Lager gehen.","Pójdźmy kawałek w kierunku obozu.","","","DIA_Addon_HammerPirate_ComeOn_07_02","",""
"Scripts/Content/Story/Dialoge/DIA_Addon_PIR_1360_HammerPirate.d:137","(seufzt) Aye, aye...","Tak, tak...","","","DIA_Addon_HammerPirate_ComeOn_07_03","",""
"Scripts/Content/Story/Dialoge/DIA_Addon_PIR_1360_HammerPirate.d:154","Ich brauch dich nicht mehr.","Nie potrzebuję już twojej pomocy.","","","DIA_Addon_HammerPirate_GoHome.description","",""
"Scripts/Content/Story/Dialoge/DIA_Addon_PIR_1360_HammerPirate.d:167","Ich brauch dich nicht mehr.","Nie potrzebuję już twojej pomocy.","","","DIA_Addon_HammerPirate_GoHome_15_00","",""
"Scripts/Content/Story/Dialoge/DIA_Addon_PIR_1360_HammerPirate.d:168","Wie du meinst...","Jak sobie życzysz.","","","DIA_Addon_HammerPirate_GoHome_07_01","",""
"Scripts/Content/Story/Dialoge/DIA_Addon_PIR_1360_HammerPirate.d:198","Wenn du weiter in die Richtung gehen willst, lass dich nicht aufhalten...","Jeżeli chcesz tam iść, to nie będę cię zatrzymywać.","","","DIA_Addon_HammerPirate_TooFar_07_01","",""
"Scripts/Content/Story/Dialoge/DIA_Addon_PIR_1360_HammerPirate.d:199","Ich geh mal lieber wieder zurück.","Chyba wrócę.","","","DIA_Addon_HammerPirate_GoHome_07_02","",""
"Scripts/Content/Story/Dialoge/DIA_Addon_PIR_1360_HammerPirate.d:231","Weißt da was, ich hab nachgedacht. Du bist doch ganz in Ordnung!","Wiesz co? Trochę nad tym myślałem i chyba masz rację!","","","DIA_Addon_HammerPirate_Success_07_01","",""
"Scripts/Content/Story/Dialoge/DIA_Addon_PIR_1360_HammerPirate.d:232","Ich geh mal wieder zum Lager. Wir sehen uns!","Wracam do obozu. Zobaczymy się wkrótce.","","","DIA_Addon_HammerPirate_Success_07_02","",""
"Scripts/Content/Story/Dialoge/DIA_Addon_PIR_1361_SawPirate.d:34","Wie sieht's aus?","Co słychać?","","","DIA_Addon_SawPirate_Hello.description","",""
"Scripts/Content/Story/Dialoge/DIA_Addon_PIR_1361_SawPirate.d:44","Wie sieht's aus?","Co słychać?","","","DIA_Addon_SawPirate_Hello_15_00","",""
"Scripts/Content/Story/Dialoge/DIA_Addon_PIR_1361_SawPirate.d:45","Quatsch mich nicht voll!","Przestań mi zawracać głowę!","","","DIA_Addon_SawPirate_Hello_09_01","",""
"Scripts/Content/Story/Dialoge/DIA_Addon_PIR_1361_SawPirate.d:62","Gehörst du zu Henrys Jungs?","Jesteś jednym z chłopaków Henry'ego?","","","DIA_Addon_SawPirate_Anheuern.description","",""
"Scripts/Content/Story/Dialoge/DIA_Addon_PIR_1361_SawPirate.d:75","Gehörst du zu Henrys Jungs?","Jesteś jednym z chłopaków Henry'ego?","","","DIA_Addon_Bones_JoinHenry_15_00","",""
"Scripts/Content/Story/Dialoge/DIA_Addon_PIR_1361_SawPirate.d:76","Nein. Ich säge hier zum Spaß ein bißchen am Baum herum.","Nie, tak sobie piłuję dla zabawy! Naprawdę!","","","DIA_Addon_SawPirate_Anheuern_09_01","",""
"Scripts/Content/Story/Dialoge/DIA_Addon_PIR_1361_SawPirate.d:77","Was ist los? Hat Henry dir gesagt, was du zu tun hast?","Co się dzieje? Henry nie powiedział ci, co masz robić?","","","DIA_Addon_SawPirate_Anheuern_09_02","",""
"Scripts/Content/Story/Dialoge/DIA_Addon_PIR_1361_SawPirate.d:78","Ja. Ich soll für ihn einige Banditen aus dem Weg räumen.","Tak, powiedział, że mam zająć się bandytami.","","","DIA_Addon_Bones_JoinHenry_15_04","",""
"Scripts/Content/Story/Dialoge/DIA_Addon_PIR_1361_SawPirate.d:79","(wehrt ab) Ooh nein! Sieh mich NICHT so an. Ich will da nicht hingehen.","Ooo nie! Nie patrz tak na mnie! Nie chcę mieć z tym nic wspólnego!","","","DIA_Addon_SawPirate_Anheuern_09_03","",""
"Scripts/Content/Story/Dialoge/DIA_Addon_PIR_1361_SawPirate.d:80","Lass mich lieber weitersägen, okay?","Lepiej będzie, jak wrócę do roboty, dobra?","","","DIA_Addon_SawPirate_Anheuern_09_04","",""
"Scripts/Content/Story/Dialoge/DIA_Addon_PIR_1361_SawPirate.d:95","Komm mit.","Chodź ze mną.","","","DIA_Addon_SawPirate_ComeOn.description","",""
"Scripts/Content/Story/Dialoge/DIA_Addon_PIR_1361_SawPirate.d:111","Komm mit.","Chodź ze mną.","","","DIA_Addon_SawPirate_ComeOn_15_00","",""
"Scripts/Content/Story/Dialoge/DIA_Addon_PIR_1361_SawPirate.d:114","Wieso? Du hast doch schon 'nen Mann dabei...","Czemu? Masz już kogoś do pomocy...","","","DIA_Addon_SawPirate_ComeOn_09_01","",""
"Scripts/Content/Story/Dialoge/DIA_Addon_PIR_1361_SawPirate.d:118","Erst gehen wir mal ein Stück zurück in Richtung Lager...","Najpierw pójdziemy kawałek w kierunku obozu.","","","DIA_Addon_SawPirate_ComeOn_09_04","",""
"Scripts/Content/Story/Dialoge/DIA_Addon_PIR_1361_SawPirate.d:124","(zu sich) Warum hat er nicht den ANDEREN gefragt...","Jakby innych nie było...","","","DIA_Addon_SawPirate_ComeOn_09_02","",""
"Scripts/Content/Story/Dialoge/DIA_Addon_PIR_1361_SawPirate.d:132","(seufzt) Aye, aye...","Dobrze, dobrze...","","","DIA_Addon_SawPirate_ComeOn_09_03","",""
"Scripts/Content/Story/Dialoge/DIA_Addon_PIR_1361_SawPirate.d:149","Ich brauch dich nicht mehr.","Nie potrzebuję już twojej pomocy.","","","DIA_Addon_SawPirate_GoHome.description","",""
"Scripts/Content/Story/Dialoge/DIA_Addon_PIR_1361_SawPirate.d:162","Ich brauch dich nicht mehr.","Nie potrzebuję już twojej pomocy.","","","DIA_Addon_SawPirate_GoHome_15_00","",""
"Scripts/Content/Story/Dialoge/DIA_Addon_PIR_1361_SawPirate.d:163","Dann werd ich mal ein bißchen weitersägen!","To wrócę do piłowania.","","","DIA_Addon_SawPirate_GoHome_09_01","",""
"Scripts/Content/Story/Dialoge/DIA_Addon_PIR_1361_SawPirate.d:193","Wir sind zu weit weg vom Lager.","Oddaliliśmy się zbytnio od obozu. ","","","DIA_Addon_SawPirate_TooFar_09_01","",""
"Scripts/Content/Story/Dialoge/DIA_Addon_PIR_1361_SawPirate.d:194","Das gefällt mir gar nicht. Ich werd' mal wieder zurückgehen.","Nie podoba mi się to. Lepiej wrócę.","","","DIA_Addon_SawPirate_GoHome_09_02","",""
"Scripts/Content/Story/Dialoge/DIA_Addon_PIR_1361_SawPirate.d:226","Weißt da was, ich hab nachgedacht. Du bist ein Arschloch!","Kawał drania z ciebie.","","","DIA_Addon_SawPirate_Success_09_01","",""
"Scripts/Content/Story/Dialoge/DIA_Addon_PIR_1361_SawPirate.d:227","Ich geh zurück zum Lager. Wir sehen uns hoffentlich nie wieder!","Wracam do obozu. Mam nadzieję, że już się nie spotkamy!","","","DIA_Addon_SawPirate_Success_09_02","",""
"Scripts/Content/Story/Dialoge/DIA_Addon_PIR_1362_Bones.d:65","Tut mir Leid. Ich hab gerade keine Zeit.","Przepraszam, ale nie mam czasu.","","","DIA_Addon_Bones_Train_01_01","",""
"Scripts/Content/Story/Dialoge/DIA_Addon_PIR_1362_Bones.d:66","Ich muss trainieren.","Muszę trenować.","","","DIA_Addon_Bones_Train_01_02","",""
"Scripts/Content/Story/Dialoge/DIA_Addon_PIR_1362_Bones.d:76","Der Canyon wartet.","Kanion czeka.","","","DIA_Addon_Bones_Anheuern.description","",""
"Scripts/Content/Story/Dialoge/DIA_Addon_PIR_1362_Bones.d:89","Der Canyon wartet.","Kanion czeka...","","","DIA_Addon_Bones_Anheuern_15_01","",""
"Scripts/Content/Story/Dialoge/DIA_Addon_PIR_1362_Bones.d:102","Wie läuft's?","Co słychać?","","","DIA_Addon_Bones_Hello.description","",""
"Scripts/Content/Story/Dialoge/DIA_Addon_PIR_1362_Bones.d:112","Wie läuft's?","Co słychać?","","","DIA_Addon_Bones_Hello_15_00","",""
"Scripts/Content/Story/Dialoge/DIA_Addon_PIR_1362_Bones.d:113","Naja, ich komm klar. Is'n bisschen langweilig, aber wenigstens muss ich nicht arbeiten.","Nie narzekam. Co prawda trochę się nudzę, ale przynajmniej nie muszę pracować.","","","DIA_Addon_Bones_Hello_01_01","",""
