"location","source","target","id","fuzzy","context","translator_comments","developer_comments"
"Scripts/Content/Story/Dialoge/DIA_Addon_NONE_111_Quarhodron.d:53","Warum störst du meine Ruhe, Wächter?","Dlaczego zakłócasz mój spokój, strażniku?","","","DIA_Addon_Quarhodron_Hello_11_00","",""
"Scripts/Content/Story/Dialoge/DIA_Addon_NONE_111_Quarhodron.d:54","(verärgert) Sag mir, was ist dein Begehren?","Powiedz mi, z czym do mnie przychodzisz?","","","DIA_Addon_Quarhodron_Hello_11_01","",""
"Scripts/Content/Story/Dialoge/DIA_Addon_NONE_111_Quarhodron.d:57","Was befindet sich im Tempel Adanos?","Co znajduje się w świątyni Adanosa?","","","DIA_Addon_Quarhodron_Hello.DIA_Addon_Quarhodron_Hello_schwert","Info_AddChoice",""
"Scripts/Content/Story/Dialoge/DIA_Addon_NONE_111_Quarhodron.d:58","Jemand ist in den Tempel Adanos eingedrungen.","Ktoś dostał się do świątyni Adanosa.","","","DIA_Addon_Quarhodron_Hello.DIA_Addon_Quarhodron_Hello_raven","Info_AddChoice",""
"Scripts/Content/Story/Dialoge/DIA_Addon_NONE_111_Quarhodron.d:59","Gewähre mir Zugang zum Tempel Adanos.","Pozwól mi wejść do świątyni Adanosa.","","","DIA_Addon_Quarhodron_Hello.DIA_Addon_Quarhodron_Hello_tempel","Info_AddChoice",""
"Scripts/Content/Story/Dialoge/DIA_Addon_NONE_111_Quarhodron.d:60","Das Land wird von Erdbeben heimgesucht.","Kraj rozdzierają trzęsienia ziemi. ","","","DIA_Addon_Quarhodron_Hello.DIA_Addon_Quarhodron_Hello_erdbeben","Info_AddChoice",""
"Scripts/Content/Story/Dialoge/DIA_Addon_NONE_111_Quarhodron.d:67","Bengla anthani, Osiri?","Bengla anthani, Osiri?","","","DIA_Addon_Quarhodron_Hello_11_02","",""
"Scripts/Content/Story/Dialoge/DIA_Addon_NONE_111_Quarhodron.d:69","(laut) Bengla anthani?","Bengla anthani?","","","DIA_Addon_Quarhodron_Hello_11_03","",""
"Scripts/Content/Story/Dialoge/DIA_Addon_NONE_111_Quarhodron.d:81","Die gepriesene Weisheit der Ahnen ist geradezu überwältigend.","Wielka mądrość starożytnych musi cię przytłaczać.","","","DIA_Addon_Quarhodron_Hello.DIA_Addon_Quarhodron_Hello_frech","Info_AddChoice",""
"Scripts/Content/Story/Dialoge/DIA_Addon_NONE_111_Quarhodron.d:88","Das Land wird von Erdbeben heimgesucht. Wir müssen etwas unternehmen, sonst wird die ganze Insel im Meer versinken.","Kraj rozdzierają trzęsienia ziemi. Jeśli czegoś nie zrobimy, cała wyspa zostanie zatopiona.","","","DIA_Addon_Quarhodron_Hello_erdbeben_15_00","",""
"Scripts/Content/Story/Dialoge/DIA_Addon_NONE_111_Quarhodron.d:89","Es gibt nichts, was wir noch tun könnten.","Nic już nie możemy zrobić.","","","DIA_Addon_Quarhodron_Hello_erdbeben_11_01","",""
"Scripts/Content/Story/Dialoge/DIA_Addon_NONE_111_Quarhodron.d:90","Adanos' Zorn ist über Jharkendar gekommen, um die Ungläubigen zu vernichten.","Na Jarkendar spadł gniew Adanosa, który zniszczy wszystkich niewiernych.","","","DIA_Addon_Quarhodron_Hello_erdbeben_11_02","",""
"Scripts/Content/Story/Dialoge/DIA_Addon_NONE_111_Quarhodron.d:97","Jemand ist in den Tempel Adanos' eingedrungen.","Ktoś dostał się do świątyni Adanosa.","","","DIA_Addon_Quarhodron_Hello_raven_15_00","",""
"Scripts/Content/Story/Dialoge/DIA_Addon_NONE_111_Quarhodron.d:98","Unsinn. Ich selbst habe das Tor verriegelt. Es ist unmöglich zu passieren.","Niemożliwe. Sam zablokowałem bramę. Nie można jej sforsować.","","","DIA_Addon_Quarhodron_Hello_raven_11_01","",""
"Scripts/Content/Story/Dialoge/DIA_Addon_NONE_111_Quarhodron.d:99","Tatsächlich?","Czyżby?","","","DIA_Addon_Quarhodron_Hello_raven_15_02","",""
"Scripts/Content/Story/Dialoge/DIA_Addon_NONE_111_Quarhodron.d:106","Gewähre mir Zugang zum Tempel Adanos'.","Pozwól mi wejść do świątyni Adanosa.","","","DIA_Addon_Quarhodron_Hello_tempel_15_00","",""
"Scripts/Content/Story/Dialoge/DIA_Addon_NONE_111_Quarhodron.d:107","Der Tempel bleibt verschlossen bis in alle Ewigkeit. So wie der Rat es entschieden hat.","Świątynia ma pozostać zamknięta na całą wieczność. Tak zdecydowała rada.","","","DIA_Addon_Quarhodron_Hello_tempel_11_01","",""
"Scripts/Content/Story/Dialoge/DIA_Addon_NONE_111_Quarhodron.d:114","Was befindet sich im Tempel Adanos'?","Co znajduje się w świątyni Adanosa?","","","DIA_Addon_Quarhodron_Hello_schwert_15_00","",""
"Scripts/Content/Story/Dialoge/DIA_Addon_NONE_111_Quarhodron.d:115","Mein größtes Leid, meine größte Enttäuschung.","Moje największe nieszczęście, moje największe rozczarowanie.","","","DIA_Addon_Quarhodron_Hello_schwert_11_01","",""
"Scripts/Content/Story/Dialoge/DIA_Addon_NONE_111_Quarhodron.d:122","Die gepriesene Weisheit der Ahnen ist geradezu überwältigend.","Wielka mądrość starożytnych musi cię przytłaczać.","","","DIA_Addon_Quarhodron_Hello_frech_15_00","",""
"Scripts/Content/Story/Dialoge/DIA_Addon_NONE_111_Quarhodron.d:123","Ein Mann deines Standes spricht nicht so mit mir.","Człowiek twojej pozycji nie może się tak do mnie zwracać.","","","DIA_Addon_Quarhodron_Hello_frech_11_01","",""
"Scripts/Content/Story/Dialoge/DIA_Addon_NONE_111_Quarhodron.d:124","Ich kann mich des Eindrucks nicht erwehren, dass du nicht der bist, der du vorgibst zu sein.","Nie mogę oprzeć się wrażeniu, że nie jesteś tym, za kogo się podajesz.","","","DIA_Addon_Quarhodron_Hello_frech_11_02","",""
"Scripts/Content/Story/Dialoge/DIA_Addon_NONE_111_Quarhodron.d:125","Wenn du meiner Hilfe bedarfst, hast du mir erst Zeugnis über dich selbst abzulegen.","Jeśli naprawdę potrzebujesz mej pomocy, będziesz musiał udowodnić swe intencje.","","","DIA_Addon_Quarhodron_Hello_frech_11_03","",""
"Scripts/Content/Story/Dialoge/DIA_Addon_NONE_111_Quarhodron.d:126","Beantworte meine Fragen, damit ich Gewissheit habe, mich keinem Fremden zu offenbaren.","Odpowiedz na moje pytania, abym miał pewność, że nie wyjawię tajemnic obcemu.","","","DIA_Addon_Quarhodron_Hello_frech_11_04","",""
"Scripts/Content/Story/Dialoge/DIA_Addon_NONE_111_Quarhodron.d:145","Stell deine Fragen.","Zadawaj swe pytania.","","","DIA_Addon_Quarhodron_Fragen.description","",""
"Scripts/Content/Story/Dialoge/DIA_Addon_NONE_111_Quarhodron.d:164","Deine Antworten sind so falsch wie deine Absichten.","Twoje odpowiedzi są tak złe, jak twoje intencje.","","","DIA_Addon_Quarhodron_TestFailed_11_00","",""
"Scripts/Content/Story/Dialoge/DIA_Addon_NONE_111_Quarhodron.d:165","Ich werde dir nicht helfen.","Nie pomogę ci.","","","DIA_Addon_Quarhodron_TestFailed_11_01","",""
"Scripts/Content/Story/Dialoge/DIA_Addon_NONE_111_Quarhodron.d:182","Das glaube ich dir nicht.","Nie wierzę ci.","","","DIA_Addon_Quarhodron_Fragen_Choices_11_00","",""
"Scripts/Content/Story/Dialoge/DIA_Addon_NONE_111_Quarhodron.d:183","Ich denke, du kommst erst wieder, wenn du dich dazu entschließt, mir die Wahrheit zu sagen.","Lepiej wróć, kiedy zdecydujesz się mówić prawdę.","","","DIA_Addon_Quarhodron_Fragen_Choices_11_01","",""
"Scripts/Content/Story/Dialoge/DIA_Addon_NONE_111_Quarhodron.d:192","(nachdenklich) Die Fähigkeiten eines Totenwächter hätten es dir ermöglicht, mich zu erwecken, das ist wahr.","Zdolności strażnika umarłych pozwoliły ci mnie obudzić, to prawda.","","","DIA_Addon_Quarhodron_Fragen_Choices_11_02","",""
"Scripts/Content/Story/Dialoge/DIA_Addon_NONE_111_Quarhodron.d:193","Wenn du wirklich der bist, der du vorgibst zu sein, wirst du alle meine Fragen beantworten können.","Jeśli naprawdę jesteś tym, za kogo się podajesz, zdołasz odpowiedzieć na wszystkie moje pytania.","","","DIA_Addon_Quarhodron_Fragen_Choices_11_03","",""
"Scripts/Content/Story/Dialoge/DIA_Addon_NONE_111_Quarhodron.d:194","Bis auf eine ...","Za wyjątkiem jednego...","","","DIA_Addon_Quarhodron_Add_11_00","",""
"Scripts/Content/Story/Dialoge/DIA_Addon_NONE_111_Quarhodron.d:204","Wer hat das Portal verschlossen, um die Welt vor dem Bösen zu schützen?","Kto zamknął portal, by uchronić ludzi przed złem?","","","DIA_Addon_Quarhodron_Fragen_Choices_11_04","",""
"Scripts/Content/Story/Dialoge/DIA_Addon_NONE_111_Quarhodron.d:210","Wer lindert das Leid und versorgt die Kranken?","Kto łagodzi cierpienia i opiekuje się chorymi?","","","DIA_Addon_Quarhodron_Fragen_Choices_11_05","",""
"Scripts/Content/Story/Dialoge/DIA_Addon_NONE_111_Quarhodron.d:216","Wer hat das letzte Wort im Rat der Fünf?","Kto ma decydujący głos w radzie pięciu?","","","DIA_Addon_Quarhodron_Fragen_Choices_11_06","",""
"Scripts/Content/Story/Dialoge/DIA_Addon_NONE_111_Quarhodron.d:222","Wer ist Schuld am dem Übel, das über uns gekommen ist?","Kto jest odpowiedzialny za zło, które na nas spadło?","","","DIA_Addon_Quarhodron_Fragen_Choices_11_07","",""
"Scripts/Content/Story/Dialoge/DIA_Addon_NONE_111_Quarhodron.d:228","Wer kann mir einen direkten Befehl erteilen?","Kto może wydać mi bezpośredni rozkaz?","","","DIA_Addon_Quarhodron_Fragen_Choices_11_08","",""
"Scripts/Content/Story/Dialoge/DIA_Addon_NONE_111_Quarhodron.d:234","Wer schützte einst das Volk von Jharkendar vor feindlichen Angriffen?","Kto niegdyś bronił mieszkańców Jarkendaru przed wrogimi atakami?","","","DIA_Addon_Quarhodron_Fragen_Choices_11_09","",""
"Scripts/Content/Story/Dialoge/DIA_Addon_NONE_111_Quarhodron.d:243","Das kann ich gar nicht wissen.","Skąd mam to wiedzieć?","","","DIA_Addon_Quarhodron_Fragen.DIA_Addon_Quarhodron_Fragen_NoPlan","Info_AddChoice",""
"Scripts/Content/Story/Dialoge/DIA_Addon_NONE_111_Quarhodron.d:250","Die Gelehrten.","Uczeni.","","","DIA_Addon_Quarhodron_Fragen.DIA_Addon_Quarhodron_Fragen_gele","Info_AddChoice",""
"Scripts/Content/Story/Dialoge/DIA_Addon_NONE_111_Quarhodron.d:251","Die Totenwächter.","Strażnicy Umarłych.","","","DIA_Addon_Quarhodron_Fragen.DIA_Addon_Quarhodron_Fragen_totenw","Info_AddChoice",""
"Scripts/Content/Story/Dialoge/DIA_Addon_NONE_111_Quarhodron.d:252","Die Priester.","Kapłani.","","","DIA_Addon_Quarhodron_Fragen.DIA_Addon_Quarhodron_Fragen_prie","Info_AddChoice",""
"Scripts/Content/Story/Dialoge/DIA_Addon_NONE_111_Quarhodron.d:253","Die Kriegerkaste.","Kasta Wojowników.","","","DIA_Addon_Quarhodron_Fragen.DIA_Addon_Quarhodron_Fragen_warr","Info_AddChoice",""
"Scripts/Content/Story/Dialoge/DIA_Addon_NONE_111_Quarhodron.d:254","Die Heiler.","Uzdrowiciele.","","","DIA_Addon_Quarhodron_Fragen.DIA_Addon_Quarhodron_Fragen_heiler","Info_AddChoice",""
"Scripts/Content/Story/Dialoge/DIA_Addon_NONE_111_Quarhodron.d:265","Stell deine Fragen.","Zadawaj swe pytania.","","","DIA_Addon_Quarhodron_Fragen_15_00","",""
"Scripts/Content/Story/Dialoge/DIA_Addon_NONE_111_Quarhodron.d:269","Ich bin Quarhodron, der alte Kriegsherr von Jharkendar.","Jestem Quarhodron, dawny generał Jarkendaru.","","","DIA_Addon_Quarhodron_Fragen_11_01","",""
"Scripts/Content/Story/Dialoge/DIA_Addon_NONE_111_Quarhodron.d:270","Du hast mich erweckt.","Przebudziłeś mnie.","","","DIA_Addon_Quarhodron_Fragen_11_02","",""
"Scripts/Content/Story/Dialoge/DIA_Addon_NONE_111_Quarhodron.d:275","Welche Kaste von Jharkendar ist es, der du angehörst?","Do której kasty należysz?","","","DIA_Addon_Quarhodron_Fragen_11_03","",""
"Scripts/Content/Story/Dialoge/DIA_Addon_NONE_111_Quarhodron.d:282","Die Kriegerkaste.","Kasta wojowników.","","","DIA_Addon_Quarhodron_Fragen_warr_15_00","",""
"Scripts/Content/Story/Dialoge/DIA_Addon_NONE_111_Quarhodron.d:291","Die Priester.","Kapłani.","","","DIA_Addon_Quarhodron_Fragen_prie_15_00","",""
"Scripts/Content/Story/Dialoge/DIA_Addon_NONE_111_Quarhodron.d:299","Die Gelehrten.","Uczeni.","","","DIA_Addon_Quarhodron_Fragen_gele_15_00","",""
"Scripts/Content/Story/Dialoge/DIA_Addon_NONE_111_Quarhodron.d:307","Die Totenwächter.","Strażnicy umarłych.","","","DIA_Addon_Quarhodron_Fragen_totenw_15_00","",""
"Scripts/Content/Story/Dialoge/DIA_Addon_NONE_111_Quarhodron.d:315","Die Heiler.","Uzdrowiciele.","","","DIA_Addon_Quarhodron_Fragen_heiler_15_00","",""
"Scripts/Content/Story/Dialoge/DIA_Addon_NONE_111_Quarhodron.d:323","Ich weiß es nicht.","Nie wiem.","","","DIA_Addon_Quarhodron_Fragen_NoPlan_15_00","",""
"Scripts/Content/Story/Dialoge/DIA_Addon_NONE_111_Quarhodron.d:328","Gut. Ich vertraue dir und werde dir meine Hilfe gewähren.","Dobrze. Ufam ci i udzielę pomocy.","","","DIA_Addon_Quarhodron_Fragen_NoPlan_11_01","",""
"Scripts/Content/Story/Dialoge/DIA_Addon_NONE_111_Quarhodron.d:338","Dann verschwende nicht meine Zeit.","Więc nie marnuj mego czasu.","","","DIA_Addon_Quarhodron_Fragen_NoPlan_11_02","",""
"Scripts/Content/Story/Dialoge/DIA_Addon_NONE_111_Quarhodron.d:352","(Schlüssel zum Tempel verlangen)","(Zażądaj klucza od świątyni)","","","DIA_Addon_Quarhodron_GibMirKey.description","",""
"Scripts/Content/Story/Dialoge/DIA_Addon_NONE_111_Quarhodron.d:365","Jetzt hör mal zu, Meister. Ein ganz übler Bursche hat sich Zugang zum Tempel Adanos' verschafft.","Jakiś parszywy drań dostał się do świątyni Adanosa!","","","DIA_Addon_Quarhodron_GibMirKey_15_00","",""
"Scripts/Content/Story/Dialoge/DIA_Addon_NONE_111_Quarhodron.d:366","Wenn du mich nicht gleich in den Tempel lässt, ist es vielleicht schon zu spät und es geht hier alles den Bach runter.","Jeśli natychmiast nie wpuścisz mnie do świątyni, rozpęta się tu piekło.","","","DIA_Addon_Quarhodron_GibMirKey_15_01","",""
"Scripts/Content/Story/Dialoge/DIA_Addon_NONE_111_Quarhodron.d:367","Das kann nicht sein! Der Hohepriester KHARDIMON und ich sind die einzigen in Jharkendar, die wissen, wie man das Eingangstor zum Tempel Adanos' öffnet.","Niemożliwe! Najwyższy kapłan Khardimon i ja jesteśmy jedynymi w Jarkendarze, którzy wiedzą, jak otworzyć portal w świątyni Adanosa.","","","DIA_Addon_Quarhodron_GibMirKey_11_02","",""
"Scripts/Content/Story/Dialoge/DIA_Addon_NONE_111_Quarhodron.d:368","Tja. Dann wird wohl dein Kumpel KHARDIMON geplaudert haben.","Cóż. Wygląda na to, że ten Khardimon się wygadał.","","","DIA_Addon_Quarhodron_GibMirKey_15_03","",""
"Scripts/Content/Story/Dialoge/DIA_Addon_NONE_111_Quarhodron.d:369","Ich sage dir, das Tor war offen. Ich habe es selbst gesehen.","Powtarzam, brama została otwarta. Widziałem to na własne oczy.","","","DIA_Addon_Quarhodron_GibMirKey_15_04","",""
"Scripts/Content/Story/Dialoge/DIA_Addon_NONE_111_Quarhodron.d:370","Nun. Es liegt Wahrheit in deiner Stimme. Ich werde nicht mehr an deinen Worten zweifeln.","Dobrze. Słyszę prawdę w twoim głosie. Nie będę już wątpić w twe słowa.","","","DIA_Addon_Quarhodron_GibMirKey_11_05","",""
"Scripts/Content/Story/Dialoge/DIA_Addon_NONE_111_Quarhodron.d:371","Das will ich auch hoffen.","Mam nadzieję.","","","DIA_Addon_Quarhodron_GibMirKey_15_06","",""
"Scripts/Content/Story/Dialoge/DIA_Addon_NONE_111_Quarhodron.d:372","So nimm denn das Losungwort. Es steht auf dieser Steintafel. Sage die Worte am verschlossenen Tor des Tempels und es wird sich öffnen.","Weź zatem słowo, które otworzy ci przejście. Zapisane jest na tej kamiennej tablicy. Wypowiedz je przy zamkniętej bramie świątyni, a stanie ona otworem.","","","DIA_Addon_Quarhodron_GibMirKey_11_07","",""
"Scripts/Content/Story/Dialoge/DIA_Addon_NONE_111_Quarhodron.d:375","(schon halb tot) Meine Zeit ist abgelaufen. Ich kann dir leider nicht mehr helfen.","Mój czas dobiega końca. Nie mogę ci więcej pomóc.","","","DIA_Addon_Quarhodron_GibMirKey_11_08","",""
"Scripts/Content/Story/Dialoge/DIA_Addon_NONE_111_Quarhodron.d:376","(schon halb tot) Doch bedenke. Hüte dich vor den Kammern Adanos'. Sonst ist es dein sicherer Tod.","Ale strzeż się. Pamiętaj o komnatach Adanosa. Albo spotka cię pewna śmierć...","","","DIA_Addon_Quarhodron_GibMirKey_11_09","",""
"Scripts/Content/Story/Dialoge/DIA_Addon_NONE_111_Quarhodron.d:377","Moment mal. Was IST mit den Kammern?","Zaczekaj. O co chodzi z tymi komnatami?","","","DIA_Addon_Quarhodron_GibMirKey_15_10","",""
"Scripts/Content/Story/Dialoge/DIA_Addon_NONE_111_Quarhodron.d:378","(schon halb tot) Meine Kräfte schwinden. Leb wohl. Wir sehen uns wieder im Reich der Toten ...","Gasną me siły. Żegnaj. Spotkamy się ponownie w krainie umarłych...","","","DIA_Addon_Quarhodron_GibMirKey_11_11","",""
"Scripts/Content/Story/Dialoge/DIA_Addon_NONE_112_Rhademes.d:11","Ich werde mir selbst einen Weg suchen! (ENDE)","Sam poszukam drogi! (KONIEC)","","","DIA_Addon_Rhademes_EXIT.description","",""
"Scripts/Content/Story/Dialoge/DIA_Addon_NONE_112_Rhademes.d:21","Ich werde mir selbst einen Weg suchen!","Sam poszukam drogi!","","","DIA_Addon_Rhademes_EXIT_15_00","",""
"Scripts/Content/Story/Dialoge/DIA_Addon_NONE_112_Rhademes.d:22","Wie du willst ...","Jak sobie życzysz...","","","DIA_Addon_Rhademes_EXIT_03_01","",""
"Scripts/Content/Story/Dialoge/DIA_Addon_NONE_112_Rhademes.d:55","Eine Ewigkeit lang war mein Geist gefangen.","Mój duch był uwięziony przez całą wieczność.","","","DIA_Addon_Rhademes_First_03_00","",""
"Scripts/Content/Story/Dialoge/DIA_Addon_NONE_112_Rhademes.d:56","Nun bin ich endlich frei. Das Schwert hat einen NEUEN Träger.","W końcu jestem wolny. Miecz ma NOWEGO powiernika.","","","DIA_Addon_Rhademes_First_03_01","",""
"Scripts/Content/Story/Dialoge/DIA_Addon_NONE_112_Rhademes.d:57","Die letzte Kammer wurde geöffnet.","Ostatnia komnata została otwarta.","","","DIA_Addon_Rhademes_First_03_02","",""
"Scripts/Content/Story/Dialoge/DIA_Addon_NONE_112_Rhademes.d:58","Aber die Pforte sieht ziemlich verschlossen aus!","Ale brama wygląda na zamkniętą!","","","DIA_Addon_Rhademes_First_15_03","",""
"Scripts/Content/Story/Dialoge/DIA_Addon_NONE_112_Rhademes.d:59","Dies hier ist nicht die Pforte zur letzten Kammer.","To nie jest brama do ostatniej komnaty.","","","DIA_Addon_Rhademes_First_03_04","",""
"Scripts/Content/Story/Dialoge/DIA_Addon_NONE_112_Rhademes.d:60","DIESE Pforte führt dich in den Raum davor.","TA brama prowadzi do poprzedniego pomieszczenia.","","","DIA_Addon_Rhademes_First_03_05","",""
"Scripts/Content/Story/Dialoge/DIA_Addon_NONE_112_Rhademes.d:61","Der Träger ... hat sie hinter sich verschlossen.","Powiernik... zamknął ją za sobą.","","","DIA_Addon_Rhademes_First_03_06","",""
"Scripts/Content/Story/Dialoge/DIA_Addon_NONE_112_Rhademes.d:67","(leidend) Ghanima en Kandra Adanos?!","Ghanima en Kandra Adanos?","","","DIA_Addon_Rhademes_First_03_07","",""
"Scripts/Content/Story/Dialoge/DIA_Addon_NONE_112_Rhademes.d:69","(verärgert) Bengla anthani!","Bengla anthani!","","","DIA_Addon_Rhademes_First_03_08","",""
"Scripts/Content/Story/Dialoge/DIA_Addon_NONE_112_Rhademes.d:84","Wie öffne ich die Pforte?","Jak mogę otworzyć bramę?","","","DIA_Addon_Rhademes_Pforte.description","",""
"Scripts/Content/Story/Dialoge/DIA_Addon_NONE_112_Rhademes.d:94","Wie öffne ich die Pforte?","Jak mogę otworzyć bramę?","","","DIA_Addon_Rhademes_Pforte_15_00","",""
"Scripts/Content/Story/Dialoge/DIA_Addon_NONE_112_Rhademes.d:95","Bewege ... einen der Hebel.","Przesuń... jedną z dźwigni.","","","DIA_Addon_Rhademes_Pforte_03_01","",""
"Scripts/Content/Story/Dialoge/DIA_Addon_NONE_112_Rhademes.d:96","Irgendeinen?","Dowolną?","","","DIA_Addon_Rhademes_Pforte_15_02","",""
"Scripts/Content/Story/Dialoge/DIA_Addon_NONE_112_Rhademes.d:97","All diese Hebel öffnen die Pforte.","Wszystkie dźwignie otwierają bramę.","","","DIA_Addon_Rhademes_Pforte_03_03","",""
"Scripts/Content/Story/Dialoge/DIA_Addon_NONE_112_Rhademes.d:109","Nicht alle Hebel lösen die Falle aus, richtig?","Nie wszystkie dźwignie uruchamiają pułapkę, tak?","","","DIA_Addon_Rhademes_Hebel.description","",""
"Scripts/Content/Story/Dialoge/DIA_Addon_NONE_112_Rhademes.d:123","Nicht alle Hebel lösen die Falle aus, richtig?","Nie wszystkie dźwignie uruchamiają pułapkę, tak?","","","DIA_Addon_Rhademes_Hebel_15_00","",""
"Scripts/Content/Story/Dialoge/DIA_Addon_NONE_112_Rhademes.d:124","Doch, das tun sie!","Tak!","","","DIA_Addon_Rhademes_Hebel_03_01","",""
"Scripts/Content/Story/Dialoge/DIA_Addon_NONE_112_Rhademes.d:136","Ich glaube dir nicht!","Nie wierzę ci!","","","DIA_Addon_Rhademes_DontBelieve.description","",""
"Scripts/Content/Story/Dialoge/DIA_Addon_NONE_112_Rhademes.d:150","Ich glaube dir nicht!","Nie wierzę ci!","","","DIA_Addon_Rhademes_DontBelieve_15_00","",""
"Scripts/Content/Story/Dialoge/DIA_Addon_NONE_112_Rhademes.d:151","Doch ich ... sage nur die Wahrheit.","Nie, ja... zawsze mówię prawdę.","","","DIA_Addon_Rhademes_DontBelieve_03_01","",""
"Scripts/Content/Story/Dialoge/DIA_Addon_NONE_112_Rhademes.d:163","Dein Vater hat die Falle erbaut, woher willst DU wissen, wie sie funktioniert?!","Twój ojciec zbudował tę pułapkę. Skąd możesz wiedzieć o jej działaniu?","","","DIA_Addon_Rhademes_DeinVater.description","",""
"Scripts/Content/Story/Dialoge/DIA_Addon_NONE_112_Rhademes.d:177","Dein Vater hat die Falle erbaut, woher willst DU wissen, wie sie funktioniert?!","Twój ojciec zbudował tę pułapkę. Skąd możesz wiedzieć o jej działaniu?","","","DIA_Addon_Rhademes_DeinVater_15_00","",""
"Scripts/Content/Story/Dialoge/DIA_Addon_NONE_112_Rhademes.d:178","QUARHODRON! Ich höre noch immer die Hammerschläge ... auf der anderen Seite des Tores ... seit so langer Zeit ...","QUARHODRON! Wciąż słyszę uderzenia młota... po drugiej stronie bramy... od tak dawna...","","","DIA_Addon_Rhademes_DeinVater_03_01","",""
"Scripts/Content/Story/Dialoge/DIA_Addon_NONE_112_Rhademes.d:179","Das Schwert ... ließ mich sehen ... seine Rache ... für mein Versagen ...","Miecz... pozwolił mi zobaczyć... jego zemstę... za moją porażkę...","","","DIA_Addon_Rhademes_DeinVater_03_02","",""
"Scripts/Content/Story/Dialoge/DIA_Addon_NONE_112_Rhademes.d:180","Das heißt, du hast gesehen, welcher Hebel der richtige ist?","To znaczy, że widziałeś, która dźwignia jest właściwa?","","","DIA_Addon_Rhademes_DeinVater_15_03","",""
"Scripts/Content/Story/Dialoge/DIA_Addon_NONE_112_Rhademes.d:181","Ich habe es seit langem vergessen.","Zapomniałem to bardzo dawno temu.","","","DIA_Addon_Rhademes_DeinVater_03_04","",""
"Scripts/Content/Story/Dialoge/DIA_Addon_NONE_112_Rhademes.d:184","Dann Rate!","No to domyśl się!","","","DIA_Addon_Rhademes_DeinVater.DIA_Addon_Rhademes_DeinVater_Guess","Info_AddChoice",""
"Scripts/Content/Story/Dialoge/DIA_Addon_NONE_112_Rhademes.d:185","Versuch dich zu erinnern!","Spróbuj sobie przypomnieć!","","","DIA_Addon_Rhademes_DeinVater.DIA_Addon_Rhademes_DeinVater_Remember","Info_AddChoice",""
"Scripts/Content/Story/Dialoge/DIA_Addon_NONE_112_Rhademes.d:186","Denk nach!","Myśl!","","","DIA_Addon_Rhademes_DeinVater.DIA_Addon_Rhademes_DeinVater_Think","Info_AddChoice",""
"Scripts/Content/Story/Dialoge/DIA_Addon_NONE_112_Rhademes.d:195","Es ist so lange her...","To było tak dawno temu...","","","DIA_Addon_Rhademes_Lever_03_00","",""
"Scripts/Content/Story/Dialoge/DIA_Addon_NONE_112_Rhademes.d:218","Denk nach!","Myśl!","","","DIA_Addon_Rhademes_DeinVater_Think_15_00","",""
"Scripts/Content/Story/Dialoge/DIA_Addon_NONE_112_Rhademes.d:224","Versuch dich zu errinnern!","Spróbuj sobie przypomnieć!","","","DIA_Addon_Rhademes_DeinVater_Remember_15_00","",""
"Scripts/Content/Story/Dialoge/DIA_Addon_NONE_112_Rhademes.d:230","Dann rate!","No to domyśl się!","","","DIA_Addon_Rhademes_DeinVater_Guess_15_00","",""
"Scripts/Content/Story/Dialoge/DIA_Addon_NONE_112_Rhademes.d:258","Wenn du die Kraft dazu hast ... versenke es ... in den Tiefen des Meeres ...","Jeśli masz dość siły... wrzuć go... w morskie odmęty...","","","DIA_Addon_Rhademes_PERM_03_00","",""
"Scripts/Content/Story/Dialoge/DIA_Addon_NONE_115_Eremit.d:47","(verwundert) Was machst du denn hier?","Co tutaj robisz?","","","DIA_Addon_Eremit_Add_15_00","",""
"Scripts/Content/Story/Dialoge/DIA_Addon_NONE_115_Eremit.d:48","Was ICH hier mache?! Was zum Teufel machst DU hier?","Co ja tutaj robię?! Do diabła! Co TY tutaj robisz?","","","DIA_Addon_Eremit_Add_04_00","",""
"Scripts/Content/Story/Dialoge/DIA_Addon_NONE_115_Eremit.d:49","Ich bin an den entlegensten Ort der Insel gegangen, weil ich endlich meine Ruhe haben wollte!","Osiedliłem się w najbardziej odosobnionej części wyspy, ponieważ potrzebowałem trochę spokoju!","","","DIA_Addon_Eremit_Add_04_01","",""
"Scripts/Content/Story/Dialoge/DIA_Addon_NONE_115_Eremit.d:50","Bürgerkrieg, Banditenüberfälle, Horden von Orks vor meiner Haustür...","Wojna domowa, nachalni bandyci, hordy orków u progu mego domu...","","","DIA_Addon_Eremit_Add_04_02","",""
"Scripts/Content/Story/Dialoge/DIA_Addon_NONE_115_Eremit.d:51","Das war nichts mehr für mich. Ich bin aus diesem ganzen Wahnsinn ausgestiegen.","To nie dla mnie. Już nie. Miałem dość tego całego szaleństwa.","","","DIA_Addon_Eremit_Add_04_03","",""
"Scripts/Content/Story/Dialoge/DIA_Addon_NONE_115_Eremit.d:52","Hier gibt es zwar auch Orks, aber lange nicht so viele.","Jest tu trochę orków, ale wcale nie tak dużo.","","","DIA_Addon_Eremit_Add_04_04","",""
"Scripts/Content/Story/Dialoge/DIA_Addon_NONE_115_Eremit.d:53","Und andere MENSCHEN lassen sich - Innos sei Dank - nie hier blicken. (brummig) Bis heute.","A innych ludzi – chwała niech będzie Innosowi – ani widu, ani słychu. Aż do dzisiaj!","","","DIA_Addon_Eremit_Add_04_05","",""
"Scripts/Content/Story/Dialoge/DIA_Addon_NONE_115_Eremit.d:65","Ich bin auf der Suche nach Steintafeln...","Szukam kamiennych tabliczek. ","","","DIA_Addon_Eremit_SeekTafeln.description","",""
"Scripts/Content/Story/Dialoge/DIA_Addon_NONE_115_Eremit.d:75","Ich bin auf der Suche nach Steintafeln, du hast nicht zufällig welche gefunden?","Szukam kamiennych tabliczek. Nie znalazłeś może jakichś?","","","DIA_Addon_Eremit_Add_15_02","",""
"Scripts/Content/Story/Dialoge/DIA_Addon_NONE_115_Eremit.d:76","(vorsichtig) Doch... Aber die werde ich behalten!","No cóż, znalazłem... Ale nie oddam ci!","","","DIA_Addon_Eremit_Add_04_06","",""
"Scripts/Content/Story/Dialoge/DIA_Addon_NONE_115_Eremit.d:77","Sie sind das einzige, was es hier zu lesen gibt.","To jedyne, co mam tu do czytania.","","","DIA_Addon_Eremit_Add_04_07","",""
