"location","source","target","id","fuzzy","context","translator_comments","developer_comments"
"Scripts/Content/Story/Dialoge/DIA_Addon_KDW_14000_Saturas_ADW.d:22","Adanos möge dich schützen.","Niech cię chroni Adanos.","","","DIA_Addon_Saturas_ADW_EXIT_14_00","",""
"Scripts/Content/Story/Dialoge/DIA_Addon_KDW_14000_Saturas_ADW.d:99","Adanos sei Dank. Da bist du ja endlich. Wir dachten schon, du tauchst gar nicht mehr auf.","Dzięki Adanosowi. Nareszcie jesteś. Myśleliśmy, że już się nie pokażesz.","","","DIA_Addon_Saturas_ADWStart_14_00","",""
"Scripts/Content/Story/Dialoge/DIA_Addon_KDW_14000_Saturas_ADW.d:100","(irritiert) Was? Wieso seid ihr schon HIER?","Co? Skąd się tu wzięliście?","","","DIA_Addon_Saturas_ADWStart_15_01","",""
"Scripts/Content/Story/Dialoge/DIA_Addon_KDW_14000_Saturas_ADW.d:101","Du bist durch das Portal gegangen und wir folgten dir. Es dauerte nicht lang, da sind wir hier angekommen.","Przeszedłeś przez portal, a my za tobą. Wkrótce potem przybyliśmy tutaj.","","","DIA_Addon_Saturas_ADWStart_14_02","",""
"Scripts/Content/Story/Dialoge/DIA_Addon_KDW_14000_Saturas_ADW.d:102","Doch du warst nicht da. Wir sind schon einige Tage hier.","Jesteśmy tu już od kilku dni.","","","DIA_Addon_Saturas_ADWStart_14_03","",""
"Scripts/Content/Story/Dialoge/DIA_Addon_KDW_14000_Saturas_ADW.d:103","(überrascht) EINIGE TAGE? Wie kann das sein?","KILKU DNI?","","","DIA_Addon_Saturas_ADWStart_15_04","",""
"Scripts/Content/Story/Dialoge/DIA_Addon_KDW_14000_Saturas_ADW.d:104","Nachdem wir dich hier nirgendwo finden konnten, hat Nefarius versucht zu ergründen, was schief gelaufen sein könnte. Er wirkte bisher ziemlich ratlos.","Kiedy nie mogliśmy cię nigdzie znaleźć, Nefarius próbował ustalić, co się mogło stać. Bez rezultatów.","","","DIA_Addon_Saturas_ADWStart_14_05","",""
"Scripts/Content/Story/Dialoge/DIA_Addon_KDW_14000_Saturas_ADW.d:105","Naja. Du bist ja jetzt hier und kannst mit deiner Arbeit beginnen.","No dobrze. W końcu jesteś i możesz rozpocząć pracę.","","","DIA_Addon_Saturas_ADWStart_14_06","",""
"Scripts/Content/Story/Dialoge/DIA_Addon_KDW_14000_Saturas_ADW.d:111","Was ist in der Zwischenzeit passiert?","Co działo się w międzyczasie?","","","DIA_Addon_Saturas_ADWStart.DIA_Addon_Saturas_ADWStart_was","Info_AddChoice",""
"Scripts/Content/Story/Dialoge/DIA_Addon_KDW_14000_Saturas_ADW.d:116","Was ist in der Zwischenzeit passiert?","Co działo się w międzyczasie?","","","DIA_Addon_Saturas_ADWStart_was_15_00","",""
"Scripts/Content/Story/Dialoge/DIA_Addon_KDW_14000_Saturas_ADW.d:117","Wir haben eine Menge neuer Erkenntnisse gesammelt.","Doszliśmy do wielu wniosków.","","","DIA_Addon_Saturas_ADWStart_was_14_01","",""
"Scripts/Content/Story/Dialoge/DIA_Addon_KDW_14000_Saturas_ADW.d:118","Die Erdbeben scheinen hier tatsächlich STÄRKER zu werden. Wir sind nicht mehr weit von ihrem Zentrum entfernt.","Trzęsienia ziemi są coraz silniejsze. Znajdujemy się blisko epicentrum.","","","DIA_Addon_Saturas_ADWStart_was_14_02","",""
"Scripts/Content/Story/Dialoge/DIA_Addon_KDW_14000_Saturas_ADW.d:119","Die Erbauer dieser alten Bauwerke hatten damals hier eine Stadt errichtet, so viel können wir schon mal sagen.","Twórcy tych starych budowli założyli tu kiedyś miasto, które udało nam się odkryć.","","","DIA_Addon_Saturas_ADWStart_was_14_03","",""
"Scripts/Content/Story/Dialoge/DIA_Addon_KDW_14000_Saturas_ADW.d:120","Doch aus irgendeinem Grund ist ihre Kultur untergegangen.","Jednak z jakiegoś powodu ich cywilizacja została zniszczona.","","","DIA_Addon_Saturas_ADWStart_was_14_04","",""
"Scripts/Content/Story/Dialoge/DIA_Addon_KDW_14000_Saturas_ADW.d:121","Bisher können wir allerdings nur Vermutungen anstellen, warum.","Możemy się jedynie domyślać dlaczego.","","","DIA_Addon_Saturas_ADWStart_was_14_05","",""
"Scripts/Content/Story/Dialoge/DIA_Addon_KDW_14000_Saturas_ADW.d:123","Habt ihr schon eine Spur der vermissten Leute ausgemacht?","Odkryłeś jakieś ślady zaginionych ludzi?","","","DIA_Addon_Saturas_ADWStart.DIA_Addon_Saturas_ADWStart_missingPeople","Info_AddChoice",""
"Scripts/Content/Story/Dialoge/DIA_Addon_KDW_14000_Saturas_ADW.d:124","Was ist mit Raven?","Co się dzieje z Krukiem?","","","DIA_Addon_Saturas_ADWStart.DIA_Addon_Saturas_ADWStart_Raven","Info_AddChoice",""
"Scripts/Content/Story/Dialoge/DIA_Addon_KDW_14000_Saturas_ADW.d:129","Was ist mit Raven?","Co się dzieje z Krukiem?","","","DIA_Addon_Saturas_ADWStart_Raven_15_00","",""
"Scripts/Content/Story/Dialoge/DIA_Addon_KDW_14000_Saturas_ADW.d:130","In Ravens Brief war von einem Tempel die Rede, und dass er versucht, hineinzugelangen.","W liście Kruk pisał o świątyni i o tym, że spróbuje dostać się do środka.","","","DIA_Addon_Saturas_ADWStart_Raven_14_01","",""
"Scripts/Content/Story/Dialoge/DIA_Addon_KDW_14000_Saturas_ADW.d:131","Wir sind einstimmig der Meinung, dass es sich dabei um einen Tempel Adanos' handelt, den Raven zu entweihen versucht.","Jesteśmy pewni, że chodzi o świątynię Adanosa, którą Kruk będzie próbował zbezcześcić.","","","DIA_Addon_Saturas_ADWStart_Raven_14_02","",""
"Scripts/Content/Story/Dialoge/DIA_Addon_KDW_14000_Saturas_ADW.d:132","Die Erdbeben sind offenkundig das Resultat von unheiligen Beschwörungen, die ständig gegen einen mächtigen Zauber prallen.","Trzęsienia ziemi są bez wątpienia wynikiem rzucania bezbożnych czarów, mających przełamać potężne zaklęcie.","","","DIA_Addon_Saturas_ADWStart_Raven_14_03","",""
"Scripts/Content/Story/Dialoge/DIA_Addon_KDW_14000_Saturas_ADW.d:133","Die Tore des Tempels sind magisch verschlossen und genau dieser Zauber ist es, der die Steinwächter auferstehen lässt.","Bramy świątyni są zamknięte magią, a to zaklęcie ożywia kamiennych strażników.","","","DIA_Addon_Saturas_ADWStart_Raven_14_04","",""
"Scripts/Content/Story/Dialoge/DIA_Addon_KDW_14000_Saturas_ADW.d:134","Der Tempel wehrt sich. Wir müssen Raven aufhalten, bevor er ins Allerheiligste eindringen kann.","Świątynia się broni. Musimy powstrzymać Kruka, zanim dostanie się do sanktuarium.","","","DIA_Addon_Saturas_ADWStart_Raven_14_05","",""
"Scripts/Content/Story/Dialoge/DIA_Addon_KDW_14000_Saturas_ADW.d:136","Wie geht's jetzt weiter?","Co zrobimy później?","","","DIA_Addon_Saturas_ADWStart.DIA_Addon_Saturas_ADWStart_wastun","Info_AddChoice",""
"Scripts/Content/Story/Dialoge/DIA_Addon_KDW_14000_Saturas_ADW.d:137","Raven ist nur ein ehemaliger Erzbaron, kein Magier.","Kruk jest byłym magnatem, a nie magiem. ","","","DIA_Addon_Saturas_ADWStart.DIA_Addon_Saturas_ADWStart_RavenOnlyBaron","Info_AddChoice",""
"Scripts/Content/Story/Dialoge/DIA_Addon_KDW_14000_Saturas_ADW.d:138","Was will Raven in dem Tempel?","Co Kruk chce zrobić w świątyni?","","","DIA_Addon_Saturas_ADWStart.DIA_Addon_Saturas_ADWStart_RavenAim","Info_AddChoice",""
"Scripts/Content/Story/Dialoge/DIA_Addon_KDW_14000_Saturas_ADW.d:143","Was will Raven im Tempel?","Co Kruk chce zrobić w świątyni?","","","DIA_Addon_Saturas_ADWStart_RavenAim_15_00","",""
"Scripts/Content/Story/Dialoge/DIA_Addon_KDW_14000_Saturas_ADW.d:146","Wir wissen nur, daß es sich um ein mächtiges Artefakt handelt, daß irgendwie mit Adanos und Beliar in Verbindung steht.","Wiemy tylko, że chodzi mu o potężny artefakt, związany z Adanosem i Beliarem.","","","DIA_Addon_Bodo_14_01","",""
"Scripts/Content/Story/Dialoge/DIA_Addon_KDW_14000_Saturas_ADW.d:147","(grimmig) Wir können wohl davon ausgehen, daß er damit nichts Gutes im Schilde führt...","Na pewno nie ma dobrych zamiarów...","","","DIA_Addon_Bodo_14_02","",""
"Scripts/Content/Story/Dialoge/DIA_Addon_KDW_14000_Saturas_ADW.d:152","Raven ist nur ein ehemaliger Erzbaron, kein Magier. Wie soll ER so eine Beschwörung durchführen?","Kruk jest byłym magnatem, a nie magiem. Jak mógłby przygotować taki czar?","","","DIA_Addon_Saturas_ADWStart_RavenOnlyBaron_15_00","",""
"Scripts/Content/Story/Dialoge/DIA_Addon_KDW_14000_Saturas_ADW.d:153","Vielleicht ist er es nicht selbst. Sondern ein abtrünniger Magier, der in seinem Auftrag handelt.","Może to nie on. Może jakiś mag renegat, który wypełnia jego rozkazy.","","","DIA_Addon_Saturas_ADWStart_RavenOnlyBaron_14_01","",""
"Scripts/Content/Story/Dialoge/DIA_Addon_KDW_14000_Saturas_ADW.d:154","So oder so, wir MÜSSEN das Übel abwenden.","Tak czy inaczej, MUSIMY zapobiec złu.","","","DIA_Addon_Saturas_ADWStart_RavenOnlyBaron_14_02","",""
"Scripts/Content/Story/Dialoge/DIA_Addon_KDW_14000_Saturas_ADW.d:159","Habt ihr schon eine Spur der vermissten Leute ausgemacht?","Odkryłeś jakieś ślady zaginionych ludzi?","","","DIA_Addon_Saturas_ADWStart_missingPeople_15_00","",""
"Scripts/Content/Story/Dialoge/DIA_Addon_KDW_14000_Saturas_ADW.d:160","Erst gestern haben wir die Leiche eines Fischers gefunden. Sie liegt unten in einer der Ruinen im Osten.","Zaledwie wczoraj, w ruinach na wschodzie, znaleźliśmy zwłoki rybaka.","","","DIA_Addon_Saturas_ADWStart_missingPeople_14_01","",""
"Scripts/Content/Story/Dialoge/DIA_Addon_KDW_14000_Saturas_ADW.d:161","Sieht ganz so aus, als ob es ein Fischer aus Khorinis gewesen ist. Das solltest du dir ansehen.","Wygląda na to, że pochodził z Khorinis. Powinieneś zobaczyć ciało.","","","DIA_Addon_Saturas_ADWStart_missingPeople_14_02","",""
"Scripts/Content/Story/Dialoge/DIA_Addon_KDW_14000_Saturas_ADW.d:169","Wie geht's jetzt weiter?","Co zrobimy później?","","","DIA_Addon_Saturas_ADWStart_wastun_15_00","",""
"Scripts/Content/Story/Dialoge/DIA_Addon_KDW_14000_Saturas_ADW.d:170","WIR werden hier bleiben und weiter die alte Kultur studieren.","Zostaniemy tutaj i będziemy dalej badali tę pradawną cywilizację.","","","DIA_Addon_Saturas_ADWStart_wastun_14_01","",""
"Scripts/Content/Story/Dialoge/DIA_Addon_KDW_14000_Saturas_ADW.d:171","Die alten Schriften der Erbauer bergen noch eine Menge Geheimnisse, die wir lüften müssen - wenn wir verstehen wollen, was damals hier geschehen ist.","Stare zwoje budowniczych zawierają mnóstwo tajemnic, które musimy odkryć – jeśli chcemy zrozumieć, co stało się w przeszłości.","","","DIA_Addon_Saturas_ADWStart_wastun_14_02","",""
"Scripts/Content/Story/Dialoge/DIA_Addon_KDW_14000_Saturas_ADW.d:172","DU musst in der Zwischenzeit einiges für uns erledigen ...","A teraz musisz coś dla nas zrobić...","","","DIA_Addon_Saturas_ADWStart_wastun_14_03","",""
"Scripts/Content/Story/Dialoge/DIA_Addon_KDW_14000_Saturas_ADW.d:174","Was soll ich tun?","O co chodzi?","","","DIA_Addon_Saturas_ADWStart.DIA_Addon_Saturas_ADWStart_wastun2","Info_AddChoice",""
"Scripts/Content/Story/Dialoge/DIA_Addon_KDW_14000_Saturas_ADW.d:179","Was soll ich tun?","O co chodzi?","","","DIA_Addon_Saturas_ADWStart_wastun2_15_00","",""
"Scripts/Content/Story/Dialoge/DIA_Addon_KDW_14000_Saturas_ADW.d:180","Du musst Raven finden und ihn daran hindern, den Tempel Adanos' zu entweihen.","Musisz znaleźć Kruka i powstrzymać go przed bezczeszczeniem świątyni Adanosa.","","","DIA_Addon_Saturas_ADWStart_wastun2_14_01","",""
"Scripts/Content/Story/Dialoge/DIA_Addon_KDW_14000_Saturas_ADW.d:181","Du meinst, ich soll ihn TÖTEN.","Mam go zabić?","","","DIA_Addon_Saturas_ADWStart_wastun2_15_02","",""
"Scripts/Content/Story/Dialoge/DIA_Addon_KDW_14000_Saturas_ADW.d:182","Wenn das der einzige Weg ist, ihn aufzuhalten, in Adanos' Namen … JA!","Jeśli to jedyny sposób, by go powstrzymać, to... TAK! W imię Adanosa!","","","DIA_Addon_Saturas_ADWStart_wastun2_14_03","",""
"Scripts/Content/Story/Dialoge/DIA_Addon_KDW_14000_Saturas_ADW.d:183","Sammle auf deinem Weg auch alle alten Reliquien und Niederschriften der Erbauer, die du finden kannst und bringe sie zu uns.","Zbierz wszystkie zapiski i relikty budowniczych, które zdołasz znaleźć, i przynieś je do nas.","","","DIA_Addon_Saturas_ADWStart_wastun2_14_04","",""
"Scripts/Content/Story/Dialoge/DIA_Addon_KDW_14000_Saturas_ADW.d:184","Wir müssen noch mehr wissen über dieses Volk und seinen Untergang.","Musimy dowiedzieć się więcej na temat tych ludzi i tego, co ich spotkało.","","","DIA_Addon_Saturas_ADWStart_wastun2_14_05","",""
"Scripts/Content/Story/Dialoge/DIA_Addon_KDW_14000_Saturas_ADW.d:185","Nur wenn wir Ravens Pläne durchschauen, können wir sie auch durchkreuzen.","Kiedy przejrzymy zamiary Kruka, będziemy mogli mu przeszkodzić.","","","DIA_Addon_Saturas_ADWStart_wastun2_14_06","",""
"Scripts/Content/Story/Dialoge/DIA_Addon_KDW_14000_Saturas_ADW.d:186","Desweiteren musst du einen Weg finden, die Sklaven zu befreien.","Musisz też znaleźć sposób na uwolnienie niewolników.","","","DIA_Addon_Saturas_ADWStart_wastun2_14_07","",""
"Scripts/Content/Story/Dialoge/DIA_Addon_KDW_14000_Saturas_ADW.d:187","(zynisch) Ist das alles? Das mach' ich doch mit links.","To wszystko? Zrobię to z zamkniętymi oczami.","","","DIA_Addon_Saturas_ADWStart_wastun2_15_08","",""
"Scripts/Content/Story/Dialoge/DIA_Addon_KDW_14000_Saturas_ADW.d:188","(verärgert) Ich weiß, dass es viel verlangt ist. Sieh es als eine Chance, mein Vertrauen zurückzugewinnen.","Wiem, że to niełatwe zadanie. Zrozum, to twoja szansa na odzyskanie mojego zaufania.","","","DIA_Addon_Saturas_ADWStart_wastun2_14_09","",""
"Scripts/Content/Story/Dialoge/DIA_Addon_KDW_14000_Saturas_ADW.d:204","Ich werd' mich dann mal auf den Weg machen.","W takim razie ruszam w drogę.","","","DIA_Addon_Saturas_ADWStart.DIA_Addon_Saturas_ADWStart_back","Info_AddChoice",""
"Scripts/Content/Story/Dialoge/DIA_Addon_KDW_14000_Saturas_ADW.d:209","Ich werd' mich dann mal auf den Weg machen.","W takim razie ruszam w drogę.","","","DIA_Addon_Saturas_ADWStart_back_15_00","",""
"Scripts/Content/Story/Dialoge/DIA_Addon_KDW_14000_Saturas_ADW.d:210","Eine Sache noch … Raven hat eine Menge Banditen um sich geschart.","Jeszcze jedno... Krukowi towarzyszy wielu bandytów.","","","DIA_Addon_Saturas_ADWStart_back_14_01","",""
"Scripts/Content/Story/Dialoge/DIA_Addon_KDW_14000_Saturas_ADW.d:211","In deiner Abwesenheit haben wir ein anderes Mitglied vom 'Ring des Wassers' hierher geholt.","Podczas twojej nieobecności przyjęliśmy kolejnego członka Wodnego Kręgu.","","","DIA_Addon_Saturas_ADWStart_back_14_02","",""
"Scripts/Content/Story/Dialoge/DIA_Addon_KDW_14000_Saturas_ADW.d:212","Wir haben ihn in den Sumpf geschickt. Er kam nicht zurück.","Wysłaliśmy go na bagna. Nie wrócił.","","","DIA_Addon_Saturas_ADWStart_back_14_03","",""
"Scripts/Content/Story/Dialoge/DIA_Addon_KDW_14000_Saturas_ADW.d:213","Wir vermuten, die Banditen greifen alles an, was nicht aussieht wie sie selbst.","Sądzimy, że bandyci atakują każdego, kto nie wygląda jak oni.","","","DIA_Addon_Saturas_ADWStart_back_14_04","",""
"Scripts/Content/Story/Dialoge/DIA_Addon_KDW_14000_Saturas_ADW.d:214","Besorg dir also eine Rüstung der Banditen.","Załatw sobie ich zbroję.","","","DIA_Addon_Saturas_ADWStart_back_14_05","",""
"Scripts/Content/Story/Dialoge/DIA_Addon_KDW_14000_Saturas_ADW.d:215","Nur so wirst du dich ihnen nähern können, ohne dass sie dich gleich angreifen.","Będziesz mógł podejść bliżej ich obozu, nie ryzykując, że cię zaatakują.","","","DIA_Addon_Saturas_ADWStart_back_14_06","",""
"Scripts/Content/Story/Dialoge/DIA_Addon_KDW_14000_Saturas_ADW.d:234","Welches arme Schwein habt ihr in den Sumpf geschickt?","Którego to nieszczęśnika wysłałeś na bagna?","","","DIA_Addon_Saturas_PoorRanger.description","",""
"Scripts/Content/Story/Dialoge/DIA_Addon_KDW_14000_Saturas_ADW.d:244","Welches arme Schwein habt ihr in den Sumpf geschickt?","Którego to nieszczęśnika wysłałeś na bagna?","","","DIA_Addon_Saturas_PoorRanger_15_00","",""
"Scripts/Content/Story/Dialoge/DIA_Addon_KDW_14000_Saturas_ADW.d:245","Sein Name war Lance.","Nazywał się Lance.","","","DIA_Addon_Saturas_PoorRanger_14_01","",""
"Scripts/Content/Story/Dialoge/DIA_Addon_KDW_14000_Saturas_ADW.d:246","Ich fürchte, er ist nicht sehr weit gekommen.","Chyba nie zaszedł daleko.","","","DIA_Addon_Saturas_PoorRanger_14_02","",""
"Scripts/Content/Story/Dialoge/DIA_Addon_KDW_14000_Saturas_ADW.d:262","Wo werde ich eine Banditenrüstung finden, die mir passt?","Gdzie znajdę pasującą na mnie zbroję bandytów?","","","DIA_Addon_Saturas_Piraten.description","",""
"Scripts/Content/Story/Dialoge/DIA_Addon_KDW_14000_Saturas_ADW.d:276","Wo werde ich eine Banditenrüstung finden, die mir passt?","Gdzie znajdę pasującą na mnie zbroję bandytów?","","","DIA_Addon_Saturas_Piraten_15_00","",""
"Scripts/Content/Story/Dialoge/DIA_Addon_KDW_14000_Saturas_ADW.d:277","Im Westen scheint es ein Lager der Piraten zu geben.","Na zachodzie jest obóz piratów.","","","DIA_Addon_Saturas_Piraten_14_01","",""
"Scripts/Content/Story/Dialoge/DIA_Addon_KDW_14000_Saturas_ADW.d:278","Soviel wir wissen, stehen sie in Kontakt mit den Banditen.","Z tego, co wiem, utrzymują kontakty z bandytami.","","","DIA_Addon_Saturas_Piraten_14_02","",""
"Scripts/Content/Story/Dialoge/DIA_Addon_KDW_14000_Saturas_ADW.d:279","Ich denke nicht, dass sie dich angreifen werden, wenn du zu ihnen gehst.","Nie sądzę, żeby cię zaatakowali.","","","DIA_Addon_Saturas_Piraten_14_03","",""
"Scripts/Content/Story/Dialoge/DIA_Addon_KDW_14000_Saturas_ADW.d:280","Vielleicht kannst du bei ihnen Hilfe finden ...","Może uda ci się znaleźć u nich jakąś pomoc...","","","DIA_Addon_Saturas_Piraten_14_04","",""
"Scripts/Content/Story/Dialoge/DIA_Addon_KDW_14000_Saturas_ADW.d:294","Ich habe Lances Leiche gefunden.","Znalazłem ciało Lance'a.","","","DIA_Addon_Saturas_LanceLeiche.description","",""
"Scripts/Content/Story/Dialoge/DIA_Addon_KDW_14000_Saturas_ADW.d:308","Ich habe Lances Leiche gefunden.","Znalazłem ciało Lance'a.","","","DIA_Addon_Saturas_LanceLeiche_15_00","",""
"Scripts/Content/Story/Dialoge/DIA_Addon_KDW_14000_Saturas_ADW.d:309","Möge seine Seele in Adanos' Reich eingehen.","Oby jego dusza dostąpiła królestwa Adanosa.","","","DIA_Addon_Saturas_LanceLeiche_14_01","",""
"Scripts/Content/Story/Dialoge/DIA_Addon_KDW_14000_Saturas_ADW.d:310","Pass auf dich auf, mein Sohn. Noch so einen Verlust dieser Art will ich nicht beklagen müssen.","Uważaj na siebie, synu. Nie chcę opłakiwać kolejnej straty.","","","DIA_Addon_Saturas_LanceLeiche_14_02","",""
"Scripts/Content/Story/Dialoge/DIA_Addon_KDW_14000_Saturas_ADW.d:325","Ich habe hier Lances Aquamarinring.","Mam akwamarynowy pierścień Lance'a.","","","DIA_Addon_Saturas_LanceRing.description","",""
"Scripts/Content/Story/Dialoge/DIA_Addon_KDW_14000_Saturas_ADW.d:339","Ich habe hier Lances Aquamarinring.","Mam akwamarynowy pierścień Lance'a.","","","DIA_Addon_Saturas_LanceRing_15_00","",""
"Scripts/Content/Story/Dialoge/DIA_Addon_KDW_14000_Saturas_ADW.d:340","Am besten du gibst ihn mir, damit er nicht in falsche Hände gerät.","Najlepiej oddaj mi go, zanim wpadnie w niepowołane ręce.","","","DIA_Addon_Saturas_LanceRing_14_01","",""
"Scripts/Content/Story/Dialoge/DIA_Addon_KDW_14000_Saturas_ADW.d:355","Wegen der Reliquien...","Jeśli chodzi o relikty...","","","DIA_Addon_Saturas_Tokens.description","",""
"Scripts/Content/Story/Dialoge/DIA_Addon_KDW_14000_Saturas_ADW.d:378","Wegen der Reliquien ...","Jeśli chodzi o relikty...","","","DIA_Addon_Saturas_Tokens_15_00","",""
"Scripts/Content/Story/Dialoge/DIA_Addon_KDW_14000_Saturas_ADW.d:384","Ich denke, ich habe hier etwas für dich.","Wydaje mi się, że mam tu coś dla ciebie.","","","DIA_Addon_Saturas_Tokens_15_01","",""
"Scripts/Content/Story/Dialoge/DIA_Addon_KDW_14000_Saturas_ADW.d:385","Diese Art von Steintafeln kennen wir bereits. Die bringen uns jetzt nicht weiter.","Mamy już podobne kamienne tablice. Te już nam się nie przydadzą.","","","DIA_Addon_Saturas_Tokens_14_02","",""
"Scripts/Content/Story/Dialoge/DIA_Addon_KDW_14000_Saturas_ADW.d:386","Es muss noch mehr geben als das.","Tam musi być coś więcej.","","","DIA_Addon_Saturas_Tokens_14_03","",""
"Scripts/Content/Story/Dialoge/DIA_Addon_KDW_14000_Saturas_ADW.d:399","Was ist HIERMIT?","A to możecie wykorzystać?","","","DIA_Addon_Saturas_Tokens_15_04","",""
"Scripts/Content/Story/Dialoge/DIA_Addon_KDW_14000_Saturas_ADW.d:400","Das sieht gut aus. Wo hast du das gefunden?","Wygląda nieźle. Gdzie to znalazłeś?","","","DIA_Addon_Saturas_Tokens_14_05","",""
"Scripts/Content/Story/Dialoge/DIA_Addon_KDW_14000_Saturas_ADW.d:409","Die Banditen benutzen diese Steintafeln als eine Art Zahlungsmittel.","Bandyci używają tych tabliczek jako waluty.","","","DIA_Addon_Saturas_Tokens_15_06","",""
"Scripts/Content/Story/Dialoge/DIA_Addon_KDW_14000_Saturas_ADW.d:410","Die Tafeln tragen das Zeichen Quahodrons, eines großen Kriegers.","Na tablicach jest symbol Quarhodrona, wielkiego wojownika i dowódcy.","","","DIA_Addon_Saturas_Tokens_14_07","",""
"Scripts/Content/Story/Dialoge/DIA_Addon_KDW_14000_Saturas_ADW.d:411","Er ist der Feldherr, dessen Sohn Rhademes die ganze Stadt in den Untergang getrieben hat.","Jego syn – Rademes – doprowadził do zagłady całego miasta.","","","DIA_Addon_Saturas_Tokens_14_08","",""
"Scripts/Content/Story/Dialoge/DIA_Addon_KDW_14000_Saturas_ADW.d:412","(verächtlich) Ts. Ich wette, die Banditen wissen nicht einmal, mit was sie da handeln.","Phi. Założę się, że bandyci nie mają pojęcia, co wpadło im w ręce.","","","DIA_Addon_Saturas_Tokens_14_09","",""
"Scripts/Content/Story/Dialoge/DIA_Addon_KDW_14000_Saturas_ADW.d:421","Diese Tafel fand ich in einem Gebäude im Süden.","Tę tabliczkę znalazłem w budynku na południu.","","","DIA_Addon_Saturas_Tokens_15_10","",""
"Scripts/Content/Story/Dialoge/DIA_Addon_KDW_14000_Saturas_ADW.d:422","Ah! Eine Tafel der Totenwächter. Sie waren es, die die Geister ihrer Verstorbenen beschworen.","Ach! Tablica strażników umarłych. Przywołuje duchy zmarłych.","","","DIA_Addon_Saturas_Tokens_14_11","",""
"Scripts/Content/Story/Dialoge/DIA_Addon_KDW_14000_Saturas_ADW.d:423","Die Verbindung zu ihren Ahnen war bei den Erbauern sehr stark.","Związki pomiędzy budowniczymi i ich przodkami były bardzo silne.","","","DIA_Addon_Saturas_Tokens_14_12","",""
"Scripts/Content/Story/Dialoge/DIA_Addon_KDW_14000_Saturas_ADW.d:432","Ich fand diese Tafel in einem Bauwerk im Südwesten.","Znalazłem tę tabliczkę w budynku na południowym zachodzie.","","","DIA_Addon_Saturas_Tokens_15_13","",""
"Scripts/Content/Story/Dialoge/DIA_Addon_KDW_14000_Saturas_ADW.d:433","Der Tafel nach zu urteilen, handelt es sich dabei um die Behausung der Priester dieser Stadt.","Z tego, co na niej napisano, wynika, że był to dom kapłanów miasta.","","","DIA_Addon_Saturas_Tokens_14_14","",""
"Scripts/Content/Story/Dialoge/DIA_Addon_KDW_14000_Saturas_ADW.d:434","Der Name des obersten Priesters war KHARDIMON. Wir wissen noch nicht viel über ihn.","Najwyższy kapłan nazywał się KHARDIMON. Nie wiemy wiele więcej na jego temat.","","","DIA_Addon_Saturas_Tokens_14_15","",""
"Scripts/Content/Story/Dialoge/DIA_Addon_KDW_14000_Saturas_ADW.d:443","Dieses Ding hier lag in einem Gebäude nahe des großen Sumpfes.","Ta tabliczka leżała w budynku niedaleko wielkiego bagna.","","","DIA_Addon_Saturas_Tokens_15_15","",""
"Scripts/Content/Story/Dialoge/DIA_Addon_KDW_14000_Saturas_ADW.d:444","Das wird das Haus der Heiler gewesen sein.","Na pewno był to dom uzdrowicieli.","","","DIA_Addon_Saturas_Tokens_14_16","",""
"Scripts/Content/Story/Dialoge/DIA_Addon_KDW_14000_Saturas_ADW.d:445","Wir wissen sehr wenig über sie. Sie scheinen die ersten gewesen zu sein, die verschwanden.","Nie wiemy o nich zbyt wiele. Wygląda na to, że zniknęli pierwsi.","","","DIA_Addon_Saturas_Tokens_14_17","",""
"Scripts/Content/Story/Dialoge/DIA_Addon_KDW_14000_Saturas_ADW.d:454","Das Teil hier lag in einem großen Gebäude in einer großen Schlucht.","Ta część leżała w wielkim budynku w kanionie.","","","DIA_Addon_Saturas_Tokens_15_18","",""
"Scripts/Content/Story/Dialoge/DIA_Addon_KDW_14000_Saturas_ADW.d:455","Das war die Bibliothek des alten Volkes.","To była biblioteka tego pradawnego ludu.","","","DIA_Addon_Saturas_Tokens_14_19","",""
"Scripts/Content/Story/Dialoge/DIA_Addon_KDW_14000_Saturas_ADW.d:456","Scheinbar eine Tafel der Gelehrten.","Najwyraźniej jest to tablica uczonych.","","","DIA_Addon_Saturas_Tokens_14_20","",""
"Scripts/Content/Story/Dialoge/DIA_Addon_KDW_14000_Saturas_ADW.d:457","Viele der Schriften, die wir gefunden haben, stammen vom Anführer der 'Kaste der Gelehrten'.","Większość pism, które znaleźliśmy, jest autorstwa przywódcy Kasty Uczonych.","","","DIA_Addon_Saturas_Tokens_14_80","",""
"Scripts/Content/Story/Dialoge/DIA_Addon_KDW_14000_Saturas_ADW.d:458","Merkwürdigerweise hat er seinen eigenen Namen nirgendwo hinterlassen ...","Co dziwne, nie zostawił swojego imienia na żadnym z pism...","","","DIA_Addon_Saturas_Tokens_14_81","",""
"Scripts/Content/Story/Dialoge/DIA_Addon_KDW_14000_Saturas_ADW.d:475","Sehr gut. Das Bild dieser Stadt wird schon klarer, aber wir wissen noch nicht genug.","Bardzo dobrze. Mamy coraz wyraźniejszy obraz miasta, ale jeszcze nie wiemy wszystkiego.","","","DIA_Addon_Saturas_Tokens_14_21","",""
"Scripts/Content/Story/Dialoge/DIA_Addon_KDW_14000_Saturas_ADW.d:478","Es müssen insgesamt fünf dieser Art Steintafeln hier in der Gegend versteckt sein.","Na tym terenie musi być ukrytych pięć takich kamiennych tablic.","","","DIA_Addon_Saturas_Tokens_14_22","",""
"Scripts/Content/Story/Dialoge/DIA_Addon_KDW_14000_Saturas_ADW.d:479","Finde sie und bring sie zu mir.","Znajdź je i przynieś do mnie.","","","DIA_Addon_Saturas_Tokens_14_23","",""
"Scripts/Content/Story/Dialoge/DIA_Addon_KDW_14000_Saturas_ADW.d:482","Hier hast du etwas Gold zu deiner Entlohnung.","Weź to złoto jako swe wynagrodzenie.","","","DIA_Addon_Saturas_Tokens_14_24","",""
"Scripts/Content/Story/Dialoge/DIA_Addon_KDW_14000_Saturas_ADW.d:495","Jetzt haben wir alle Reliquien zusammen, die wir brauchen.","Mamy już wszystkie potrzebne relikty.","","","DIA_Addon_Saturas_Tokens_14_25","",""
