"location","source","target","id","fuzzy","context","translator_comments","developer_comments"
"Scripts/Content/Story/Dialoge/DIA_Addon_NONE_115_Eremit.d:78","Ich verstehe zwar noch nicht alles, aber einige der Texte kann ich mittlerweile entziffern.","Nie rozumiem jeszcze wszystkiego, ale potrafię rozszyfrować większość z nich.","","","DIA_Addon_Eremit_Add_04_08","",""
"Scripts/Content/Story/Dialoge/DIA_Addon_NONE_115_Eremit.d:93","Wegen der Steintafeln...","Jeśli chodzi o te kamienne tablice...","","","DIA_Addon_Eremit_Teach.description","",""
"Scripts/Content/Story/Dialoge/DIA_Addon_NONE_115_Eremit.d:108","Wegen der Steintafeln...","Jeśli chodzi o te kamienne tablice...","","","DIA_Addon_Eremit_Add_15_03","",""
"Scripts/Content/Story/Dialoge/DIA_Addon_NONE_115_Eremit.d:109","Soll ich dir beibringen, sie zu lesen?","Mam ci pokazać, jak je odczytywać?","","","DIA_Addon_Eremit_Add_04_25","",""
"Scripts/Content/Story/Dialoge/DIA_Addon_NONE_115_Eremit.d:112","(hastig) Aber meine bekommst du nicht! Du mußt dir deine eigenen suchen!","Ale nie oddam ci moich! Musisz załatwić sobie własne.","","","DIA_Addon_Eremit_Add_04_26","",""
"Scripts/Content/Story/Dialoge/DIA_Addon_NONE_115_Eremit.d:138","Also, es es ganz einfach. Ein G ist ein O, ein T ist ein H ind ein I ist ein C.","To naprawdę bardzo proste. 'G' oznacza 'O', 'T' oznacza 'H', a 'I' to 'C'. ","","","DIA_Addon_Eremit_Add_04_27","",""
"Scripts/Content/Story/Dialoge/DIA_Addon_NONE_115_Eremit.d:139","Wenn du das mal kapiert hast, ist der Rest eigentlich logisch...","Kiedy to opanujesz, reszta przyjdzie z łatwością...","","","DIA_Addon_Eremit_Add_04_28","",""
"Scripts/Content/Story/Dialoge/DIA_Addon_NONE_115_Eremit.d:171","Ich glaube nicht, daß ich dir noch was darüber beibringen kann...","Nie sądzę, żebym mógł nauczyć cię czegoś więcej...","","","DIA_Addon_Eremit_Add_04_29","",""
"Scripts/Content/Story/Dialoge/DIA_Addon_NONE_115_Eremit.d:207","Ich habe hier ein paar Klamotten für dich...","Mam dla ciebie jakieś ubranie...","","","DIA_Addon_Eremit_Klamotten.description","",""
"Scripts/Content/Story/Dialoge/DIA_Addon_NONE_115_Eremit.d:220","Ich habe hier ein paar Klamotten für dich...","Mam dla ciebie jakieś ubranie...","","","DIA_Addon_Eremit_Add_15_01","",""
"Scripts/Content/Story/Dialoge/DIA_Addon_NONE_115_Eremit.d:221","Wirklich? Zeig her, lass mich sehen ob sie mir passen!","Serio? Dawaj! Zobaczymy, czy pasuje.","","","DIA_Addon_Eremit_Add_04_19","",""
"Scripts/Content/Story/Dialoge/DIA_Addon_NONE_115_Eremit.d:227","Leichte Piratenrüstung geben","Daj lekką zbroję piratów","","","DIA_Addon_Eremit_Klamotten.DIA_Addon_Eremit_Klamotten_PIR_L","Info_AddChoice",""
"Scripts/Content/Story/Dialoge/DIA_Addon_NONE_115_Eremit.d:232","Mittlere Piratenrüstung geben","Daj średnią zbroję piratów","","","DIA_Addon_Eremit_Klamotten.DIA_Addon_Eremit_Klamotten_PIR_M","Info_AddChoice",""
"Scripts/Content/Story/Dialoge/DIA_Addon_NONE_115_Eremit.d:237","Rüstung des Piratenkäpitäns geben","Daj zbroję kapitana piratów","","","DIA_Addon_Eremit_Klamotten.DIA_Addon_Eremit_Klamotten_PIR_H","Info_AddChoice",""
"Scripts/Content/Story/Dialoge/DIA_Addon_NONE_115_Eremit.d:258","Rüstung vom Ring des Wassers geben","Daj zbroję Wodnego Kręgu","","","DIA_Addon_Eremit_Klamotten.DIA_Addon_Eremit_Klamotten_Ranger","Info_AddChoice",""
"Scripts/Content/Story/Dialoge/DIA_Addon_NONE_115_Eremit.d:263","Leichte Robe vom Kreis des Wassers geben","Daj lekką togę Maga Wody","","","DIA_Addon_Eremit_Klamotten.DIA_Addon_Eremit_Klamotten_KDW_L","Info_AddChoice",""
"Scripts/Content/Story/Dialoge/DIA_Addon_NONE_115_Eremit.d:268","Schwere Robe vom Kreis des Wassers geben","Daj ciężką szatę Maga Wody","","","DIA_Addon_Eremit_Klamotten.DIA_Addon_Eremit_Klamotten_KDW_H","Info_AddChoice",""
"Scripts/Content/Story/Dialoge/DIA_Addon_NONE_115_Eremit.d:273","Wams des Statthalters geben","Daj tunikę gubernatora","","","DIA_Addon_Eremit_Klamotten.DIA_Addon_Eremit_Klamotten_Governor","Info_AddChoice",""
"Scripts/Content/Story/Dialoge/DIA_Addon_NONE_115_Eremit.d:278","Robe des Richters geben","Daj sędziowską togę","","","DIA_Addon_Eremit_Klamotten.DIA_Addon_Eremit_Klamotten_Judge","Info_AddChoice",""
"Scripts/Content/Story/Dialoge/DIA_Addon_NONE_115_Eremit.d:283","Schürze des Schmieds geben","Daj fartuch kowalski","","","DIA_Addon_Eremit_Klamotten.DIA_Addon_Eremit_Klamotten_Smith","Info_AddChoice",""
"Scripts/Content/Story/Dialoge/DIA_Addon_NONE_115_Eremit.d:288","Schürze des Wirts geben","Daj fartuch obszarnika","","","DIA_Addon_Eremit_Klamotten.DIA_Addon_Eremit_Klamotten_Barkeeper","Info_AddChoice",""
"Scripts/Content/Story/Dialoge/DIA_Addon_NONE_115_Eremit.d:293","Bürgerkleidung I geben","Daj strój mieszczanina I","","","DIA_Addon_Eremit_Klamotten.DIA_Addon_Eremit_Klamotten_VLK_L","Info_AddChoice",""
"Scripts/Content/Story/Dialoge/DIA_Addon_NONE_115_Eremit.d:298","Bürgerkleidung II geben","Daj strój mieszczanina II","","","DIA_Addon_Eremit_Klamotten.DIA_Addon_Eremit_Klamotten_VLK_M","Info_AddChoice",""
"Scripts/Content/Story/Dialoge/DIA_Addon_NONE_115_Eremit.d:303","Bürgerkleidung III geben","Daj strój mieszczanina III","","","DIA_Addon_Eremit_Klamotten.DIA_Addon_Eremit_Klamotten_VLK_H","Info_AddChoice",""
"Scripts/Content/Story/Dialoge/DIA_Addon_NONE_115_Eremit.d:308","Bürgerinnen Kleid I geben","Daj suknię mieszczanki I","","","DIA_Addon_Eremit_Klamotten.DIA_Addon_Eremit_Klamotten_VlkBabe_L","Info_AddChoice",""
"Scripts/Content/Story/Dialoge/DIA_Addon_NONE_115_Eremit.d:313","Bürgerinnen Kleid II geben","Daj suknię mieszczanki II","","","DIA_Addon_Eremit_Klamotten.DIA_Addon_Eremit_Klamotten_VlkBabe_M","Info_AddChoice",""
"Scripts/Content/Story/Dialoge/DIA_Addon_NONE_115_Eremit.d:318","Bürgerinnen Kleid III geben","Daj suknię mieszczanki III","","","DIA_Addon_Eremit_Klamotten.DIA_Addon_Eremit_Klamotten_VlkBabe_H","Info_AddChoice",""
"Scripts/Content/Story/Dialoge/DIA_Addon_NONE_115_Eremit.d:345","Verwitterte Paladinrüstung geben","Daj podniszczoną zbroję paladyna","","","DIA_Addon_Eremit_Klamotten.DIA_Addon_Eremit_Klamotten_PAL_SKEL","Info_AddChoice",""
"Scripts/Content/Story/Dialoge/DIA_Addon_NONE_115_Eremit.d:350","Leichte Bauernkleidung geben","Daj lekki strój farmera","","","DIA_Addon_Eremit_Klamotten.DIA_Addon_Eremit_Klamotten_BAU_L","Info_AddChoice",""
"Scripts/Content/Story/Dialoge/DIA_Addon_NONE_115_Eremit.d:355","Mittlere Bauernkleidung geben","Daj średni strój farmera","","","DIA_Addon_Eremit_Klamotten.DIA_Addon_Eremit_Klamotten_BAU_M","Info_AddChoice",""
"Scripts/Content/Story/Dialoge/DIA_Addon_NONE_115_Eremit.d:360","Leichtes Bäuerinnenkleid geben","Daj lekką suknię farmerki","","","DIA_Addon_Eremit_Klamotten.DIA_Addon_Eremit_Klamotten_BauBabe_L","Info_AddChoice",""
"Scripts/Content/Story/Dialoge/DIA_Addon_NONE_115_Eremit.d:365","Mittleres Bäuerinnenkleid geben","Daj średnią suknię farmerki","","","DIA_Addon_Eremit_Klamotten.DIA_Addon_Eremit_Klamotten_BauBabe_M","Info_AddChoice",""
"Scripts/Content/Story/Dialoge/DIA_Addon_NONE_115_Eremit.d:387","Crawlerrüstung geben","Daj zbroję z pancerzy pełzaczy","","","DIA_Addon_Eremit_Klamotten.DIA_Addon_Eremit_Klamotten_DJG_Crawler","Info_AddChoice",""
"Scripts/Content/Story/Dialoge/DIA_Addon_NONE_115_Eremit.d:424","Lederrüstung geben","Daj skórzaną zbroję","","","DIA_Addon_Eremit_Klamotten.DIA_Addon_Eremit_Klamotten_Leather","Info_AddChoice",""
"Scripts/Content/Story/Dialoge/DIA_Addon_NONE_115_Eremit.d:437","Robe der dunklen Künste geben","Daj szatę mrocznych sztuk","","","DIA_Addon_Eremit_Klamotten.DIA_Addon_Eremit_Klamotten_Xardas","Info_AddChoice",""
"Scripts/Content/Story/Dialoge/DIA_Addon_NONE_115_Eremit.d:442","Lesters Robe geben","Daj szatę Lestera","","","DIA_Addon_Eremit_Klamotten.DIA_Addon_Eremit_Klamotten_Lester","Info_AddChoice",""
"Scripts/Content/Story/Dialoge/DIA_Addon_NONE_115_Eremit.d:447","Diegos Rüstung geben","Daj zbroję Diego","","","DIA_Addon_Eremit_Klamotten.DIA_Addon_Eremit_Klamotten_Diego","Info_AddChoice",""
"Scripts/Content/Story/Dialoge/DIA_Addon_NONE_115_Eremit.d:452","Cor Angars Rüstung geben","Daj zbroję Cor Angara","","","DIA_Addon_Eremit_Klamotten.DIA_Addon_Eremit_Klamotten_CorAngar","Info_AddChoice",""
"Scripts/Content/Story/Dialoge/DIA_Addon_NONE_115_Eremit.d:457","Buddlerhosen geben","Daj spodnie kopacza","","","DIA_Addon_Eremit_Klamotten.DIA_Addon_Eremit_Klamotten_Prisoner","Info_AddChoice",""
"Scripts/Content/Story/Dialoge/DIA_Addon_NONE_115_Eremit.d:462","Robe der Suchenden geben","Daj szatę poszukiwacza","","","DIA_Addon_Eremit_Klamotten.DIA_Addon_Eremit_Klamotten_Dementor","Info_AddChoice",""
"Scripts/Content/Story/Dialoge/DIA_Addon_NONE_115_Eremit.d:470","Tatsache!","Jak ulał!","","","DIA_Addon_Eremit_Add_04_20","",""
"Scripts/Content/Story/Dialoge/DIA_Addon_NONE_115_Eremit.d:471","Tja, was mach ich denn jetzt? Ich hab mein ganzes Gold einem Piraten für die Überfahrt gegeben.","Hmm, jak mógłbym się odwdzięczyć? Całe złoto oddałem piratowi za transport.","","","DIA_Addon_Eremit_Add_04_21","",""
"Scripts/Content/Story/Dialoge/DIA_Addon_NONE_115_Eremit.d:472","Alles, was ich dir geben kann, sind ein paar alte Steintafeln.","Mogę ci dać parę starych kamiennych tablic. ","","","DIA_Addon_Eremit_Add_04_22","",""
"Scripts/Content/Story/Dialoge/DIA_Addon_NONE_115_Eremit.d:473","Hier, nimm sie ruhig. Ich such mir ein paar neue.","Masz, weź je. Zawsze mogę znaleźć więcej.","","","DIA_Addon_Eremit_Add_04_23","",""
"Scripts/Content/Story/Dialoge/DIA_Addon_NONE_115_Eremit.d:488","Na toll. Erst machst du mich heiß und dann... (seufzt)","Świetnie. Najpierw robisz mi nadzieję, a potem...","","","DIA_Addon_Eremit_Add_04_24","",""
"Scripts/Content/Story/Dialoge/DIA_Addon_NONE_115_Eremit.d:790","Und? Wie lebt sich's so als Aussteiger?","No i? Jak się żyje jako wyrzutek?","","","DIA_Addon_Eremit_PERM.description","",""
"Scripts/Content/Story/Dialoge/DIA_Addon_NONE_115_Eremit.d:800","Und? Wie lebt sich's so als Aussteiger?","No i? Jak się żyje jako wyrzutek?","","","DIA_Addon_Eremit_Add_15_04","",""
"Scripts/Content/Story/Dialoge/DIA_Addon_NONE_115_Eremit.d:804","(stolz) Ich habe mir alles selber gebaut. Meine Waffen, meine Werkzeuge, meine Hütte, einfach alles.","Wszystko zrobiłem sam. Moją broń, narzędzia, szałas, po prostu wszystko.","","","DIA_Addon_Eremit_Add_04_09","",""
"Scripts/Content/Story/Dialoge/DIA_Addon_NONE_115_Eremit.d:805","Bin hier mit nichts hingegangen, außer meiner guten Laune...","A przybyłem tu, nie mając nic oprócz dobrego humoru.","","","DIA_Addon_Eremit_Add_04_10","",""
"Scripts/Content/Story/Dialoge/DIA_Addon_NONE_115_Eremit.d:806","Manchmal allerdings...","Jednak czasami...","","","DIA_Addon_Eremit_Add_04_11","",""
"Scripts/Content/Story/Dialoge/DIA_Addon_NONE_115_Eremit.d:807","Ja?","Tak? ","","","DIA_Addon_Eremit_Doppelt_15_01","",""
"Scripts/Content/Story/Dialoge/DIA_Addon_NONE_115_Eremit.d:808","Manchmal wünschte ich mit, ich hätte wenigstens ein paar Klamotten mitgenommen.","Czasami żałuję, że nie wziąłem żadnych ubrań.","","","DIA_Addon_Eremit_Add_04_12","",""
"Scripts/Content/Story/Dialoge/DIA_Addon_NONE_115_Eremit.d:809","Ich verstehe nichts von Weberei oder der Verarbeitung von Fellen...","Nie mam pojęcia o tkactwie czy wyprawianiu skór...","","","DIA_Addon_Eremit_Add_04_13","",""
"Scripts/Content/Story/Dialoge/DIA_Addon_NONE_115_Eremit.d:810","Und die Nächte sind nicht gerade warm in diesem Teil der Insel.","A noce w tej części wyspy nie są szczególnie ciepłe.","","","DIA_Addon_Eremit_Add_04_14","",""
"Scripts/Content/Story/Dialoge/DIA_Addon_NONE_115_Eremit.d:815","Ich komm klar.","Jakoś sobie radzę. ","","","DIA_Addon_Eremit_Add_04_15","",""
"Scripts/Content/Story/Dialoge/DIA_Addon_NONE_115_Eremit.d:818","Mit den Klamotten komme ich über den Winter! Danach... sehen wir weiter...","Mając te ubrania, przetrwam zimę! A później... zobaczymy...","","","DIA_Addon_Eremit_Add_04_18","",""
"Scripts/Content/Story/Dialoge/DIA_Addon_NONE_115_Eremit.d:822","Jedenfalls besser als in Khorinis!","W każdym razie i tak jest tu lepiej niż w Khorinis!","","","DIA_Addon_Eremit_Add_04_16","",""
"Scripts/Content/Story/Dialoge/DIA_Addon_NONE_115_Eremit.d:823","Selbst ohne Klamotten","Nawet mimo braku ubrań.","","","DIA_Addon_Eremit_Add_04_17","",""
"Scripts/Content/Story/Dialoge/DIA_NONE_100_Xardas.d:10","Ich werde so schnell wie möglich aufbrechen! (ENDE)","Wyruszę w drogę najszybciej, jak się tylko da!","","","DIA_Xardas_FirstEXIT.description","",""
"Scripts/Content/Story/Dialoge/DIA_NONE_100_Xardas.d:24","Ich werde so schnell wie möglich aufbrechen!","Wyruszę w drogę najszybciej, jak się da!","","","DIA_Xardas_FirstEXIT_15_00","",""
"Scripts/Content/Story/Dialoge/DIA_NONE_100_Xardas.d:25","Gut! Und eines noch: Verrate niemandem, dass du mit mir gesprochen hast. Vor allem keinem Magier.","Świetnie! I jeszcze coś: nie zdradź nikomu, że ze mną rozmawiałeś. A już w żadnym wypadku nie mów o tym żadnemu magowi.","","","DIA_Xardas_FirstEXIT_14_01","",""
"Scripts/Content/Story/Dialoge/DIA_NONE_100_Xardas.d:26","Seit ich ins Exil gegangen bin, hält mich der Kreis des Feuers für tot, und das ist auch gut so.","Odkąd obrałem własną ścieżkę, Krąg Ognia ma mnie za zmarłego, i niech tak pozostanie.","","","DIA_Xardas_FirstEXIT_14_02","",""
"Scripts/Content/Story/Dialoge/DIA_NONE_100_Xardas.d:83","Da bist du ja wieder! (schmunzelt) Ich hätte nicht gedacht, daß wir uns nochmal wiedersehen.","Aha! Jesteś już. A ja straciłem nadzieję, że się jeszcze kiedyś spotkamy.","","","DIA_Addon_Xardas_Hello_14_00","",""
"Scripts/Content/Story/Dialoge/DIA_NONE_100_Xardas.d:84","Ich fühle mich, als hätte ich drei Wochen unter Steinen gelegen.","Czuję się... Czuję się, jakbym kilka tygodni leżał pod stertą głazów.","","","DIA_Addon_Xardas_Hello_15_01","",""
"Scripts/Content/Story/Dialoge/DIA_NONE_100_Xardas.d:85","So war es auch. Nur die Magie deiner Rüstung hat dich am Leben gehalten","Hmm... Dokładnie tak było. Życie zawdzięczasz tylko i wyłącznie swemu magicznemu pancerzowi. ","","","DIA_Addon_Xardas_Hello_14_02","",""
"Scripts/Content/Story/Dialoge/DIA_NONE_100_Xardas.d:86","Ich hatte schon befürchtet, dich nicht mehr aus den Trümmern des Tempels befreien zu können.","Bałem się, że nie zdołam cię wydostać z ruin świątyni...","","","DIA_Addon_Xardas_Hello_14_03","",""
"Scripts/Content/Story/Dialoge/DIA_NONE_100_Xardas.d:87","Aber genug davon. Jetzt bist du ja hier.","Ale dość już o tym.","","","DIA_Addon_Xardas_Hello_14_04","",""
"Scripts/Content/Story/Dialoge/DIA_NONE_100_Xardas.d:88","Es gibt eine NEUE Bedrohung, um die wir uns kümmern müssen.","Musimy zająć się nowym niebezpieczeństwem grożącym tej okolicy.","","","DIA_Addon_Xardas_Hello_14_05","",""
"Scripts/Content/Story/Dialoge/DIA_NONE_100_Xardas.d:91","Genug Zeit haben wir ja jetzt. Der Schläfer ist besiegt.","Mamy na to wystarczająco dużo czasu. Śniący został wygnany.","","","DIA_Xardas_Hello.DIA_Addon_Xardas_Hello_Dragons","Info_AddChoice",""
"Scripts/Content/Story/Dialoge/DIA_NONE_100_Xardas.d:92","Von welcher NEUEN Bedrohung sprichst du?","O jakim NOWYM zagrożeniu mówisz?","","","DIA_Xardas_Hello.DIA_Addon_Xardas_Hello_Man","Info_AddChoice",""
"Scripts/Content/Story/Dialoge/DIA_NONE_100_Xardas.d:98","Verbünde dich mit ihnen! Nur so können wir Beliar Einhalt gebieten!","Musisz się z nimi sprzymierzyć! Tylko w ten sposób zdołamy powstrzymać Beliara!","","","DIA_Addon_Xardas_AddonIntro_Add_14_10","",""
"Scripts/Content/Story/Dialoge/DIA_NONE_100_Xardas.d:105","Genug Zeit haben wir ja jetzt. Ich habe es geschafft. Der Schläfer ...","Mam na to wystarczająco dużo czasu. W końcu zwyciężyłem! Śniący został...","","","DIA_Xardas_Hello_15_03","",""
"Scripts/Content/Story/Dialoge/DIA_NONE_100_Xardas.d:106","... wurde verbannt. Du hast ihn besiegt, das ist richtig - aber den Krieg, der jetzt folgt, können wir nicht mehr aufhalten.","...wygnany z naszego świata. Przepędziłeś go, to prawda, ale powstrzymanie nadciągającej wojny nie leży już w naszej mocy.","","","DIA_Xardas_Hello_14_04","",""
"Scripts/Content/Story/Dialoge/DIA_NONE_100_Xardas.d:109","Der Schläfer hat mit seinem letzten, wutentbrannten Schrei die Armeen der Finsternis in Bewegung gesetzt.","Swym ostatnim krzykiem rozpaczy Śniący przywołał potężną armię zła.","","","DIA_Xardas_Hello_14_07","",""
"Scripts/Content/Story/Dialoge/DIA_NONE_100_Xardas.d:110","Es war ein Befehl an alle bösen Kreaturen. Ein Wort der Macht, dem sie alle gehorchen mussten.","Był to wyraźny rozkaz dla wszystkich istot ciemności. Potężne słowo magii, któremu nie mogły odmówić.","","","DIA_Xardas_Hello_14_08","",""
"Scripts/Content/Story/Dialoge/DIA_NONE_100_Xardas.d:111","Sein letzter Befehl war: KOMMT! Und sie kamen. Alle. Sogar die Drachen.","Jego ostatni rozkaz brzmiał 'PRZYBYWAJCIE'. I przybyły wszystkie... nawet smoki.","","","DIA_Xardas_Hello_14_09","",""
"Scripts/Content/Story/Dialoge/DIA_NONE_100_Xardas.d:112","(erstaunt) ... Drachen!","Smoki!","","","DIA_Xardas_Hello_15_10","",""
"Scripts/Content/Story/Dialoge/DIA_NONE_100_Xardas.d:113","Es sind Kreaturen von uralter Macht. Ich kann ihre Gegenwart spüren - selbst hier.","Tak, nawet te potężne, prastare istoty. Wyczuwam ich obecność także tutaj.","","","DIA_Xardas_Hello_14_11","",""
"Scripts/Content/Story/Dialoge/DIA_NONE_100_Xardas.d:114","Und sie haben eine ganze Armee von niederen Dienerkreaturen um sich geschart.","Smoki zebrały wokół siebie liczną armię służących im istot.","","","DIA_Xardas_Hello_14_12","",""
"Scripts/Content/Story/Dialoge/DIA_NONE_100_Xardas.d:115","Wo ist diese Armee jetzt?","Gdzie jest teraz ta armia?","","","DIA_Xardas_Hello_15_13","",""
"Scripts/Content/Story/Dialoge/DIA_NONE_100_Xardas.d:116","Die Armee lagert nicht weit von hier, im Minental von Khorinis, und sie bereitet sich auf den Angriff vor.","Zaległa obozem całkiem blisko stąd, w Górniczej Dolinie, niedaleko Khorinis. Teraz przygotowuje się do ostatecznego ataku.","","","DIA_Xardas_Hello_14_14","",""
"Scripts/Content/Story/Dialoge/DIA_NONE_100_Xardas.d:120","(nachdenklich) Uns bleibt nicht mehr viel Zeit.","Zostało nam niewiele czasu.","","","DIA_Xardas_Hello_14_15","",""
"Scripts/Content/Story/Dialoge/DIA_NONE_100_Xardas.d:124","Aber das ist nicht alles. Es gibt noch eine ANDERE Bedrohung, von der ich erst kürzlich erfahren habe.","Ale to nie wszystko... Niedawno doszły mnie słuchy o jeszcze innym zagrożeniu.","","","DIA_Addon_Xardas_Hello_Dragons_14_06","",""
"Scripts/Content/Story/Dialoge/DIA_NONE_100_Xardas.d:139","Dann lass uns machen, dass wir hier wegkommen!","Zatem wynośmy się stąd czym prędzej!","","","DIA_Xardas_AWAY.description","",""
"Scripts/Content/Story/Dialoge/DIA_NONE_100_Xardas.d:154","Dann lass uns machen, dass wir hier wegkommen!","Zatem wynośmy się stąd czym prędzej!","","","DIA_Xardas_AWAY_15_00","",""
"Scripts/Content/Story/Dialoge/DIA_NONE_100_Xardas.d:155","Wenn wir fliehen, dann nur, um uns den Drachen später zu stellen.","Jeśli nawet zdołamy teraz uciec, smoki w końcu nas odnajdą.","","","DIA_Xardas_AWAY_14_01","",""
"Scripts/Content/Story/Dialoge/DIA_NONE_100_Xardas.d:156","Mit der Hilfe der Soldaten und der Magier aus dieser Gegend können wir sie aufhalten, bevor sie sich ihre Armee vollständig formiert hat.","Ale z pomocą tutejszych żołnierzy i magów, możemy je jeszcze powstrzymać, nim zbytnio urosną w siłę.","","","DIA_Xardas_AWAY_14_02","",""
"Scripts/Content/Story/Dialoge/DIA_NONE_100_Xardas.d:157","Eine bessere Chance werden wir nicht bekommen.","Lepszej szansy chyba już nie dostaniemy.","","","DIA_Xardas_AWAY_14_03","",""
"Scripts/Content/Story/Dialoge/DIA_NONE_100_Xardas.d:169","Was können wir tun?","Co możemy zrobić?","","","DIA_Xardas_TODO.description","",""
"Scripts/Content/Story/Dialoge/DIA_NONE_100_Xardas.d:182","Was können wir tun?","Co możemy zrobić?","","","DIA_Xardas_TODO_15_00","",""
"Scripts/Content/Story/Dialoge/DIA_NONE_100_Xardas.d:183","Diesmal schaffen wir es nicht alleine. Nur die Macht Innos' kann uns gegen die Drachen helfen.","Tym razem sami sobie nie poradzimy. W walce ze smokami może nam pomóc tylko moc Innosa.","","","DIA_Xardas_TODO_14_01","",""
"Scripts/Content/Story/Dialoge/DIA_NONE_100_Xardas.d:184","In der Stadt Khorinis, nicht weit von hier, lagert eine Gruppe von Paladinen.","W pobliskim mieście Khorinis stacjonuje oddział paladynów.","","","DIA_Xardas_TODO_14_02","",""
"Scripts/Content/Story/Dialoge/DIA_NONE_100_Xardas.d:185","Sie verfügen über ein mächtiges Artefakt, mit dessen Hilfe wir die Drachen besiegen können.","W ich posiadaniu znajduje się pewien potężny artefakt, dzięki któremu możemy pokonać paskudne gady.","","","DIA_Xardas_TODO_14_03","",""
"Scripts/Content/Story/Dialoge/DIA_NONE_100_Xardas.d:186","Sie nennen es 'Das Auge Innos'. Du musst dir dieses Artefakt besorgen.","Nazywają go 'Okiem Innosa'. Musisz koniecznie zdobyć to Oko.","","","DIA_Xardas_TODO_14_04","",""
"Scripts/Content/Story/Dialoge/DIA_NONE_100_Xardas.d:187","Berichte den Paladinen von der Bedrohung. Du MUSST ihren Anführer überzeugen, uns zu helfen!","Ostrzeż paladynów o smokach i za wszelką cenę przekonaj ich dowódcę, by nam pomógł.","","","DIA_Xardas_TODO_14_05","",""
"Scripts/Content/Story/Dialoge/DIA_NONE_100_Xardas.d:188","Und sobald du mit ihm gesprochen hast, mußt du das Artefakt Beliarts finden.","Gdy tylko z nim porozmawiasz, musisz odszukać artefakt Beliara.","","","DIA_Addon_Xardas_Add_14_07","",""
"Scripts/Content/Story/Dialoge/DIA_NONE_100_Xardas.d:189","Es ist das Gegenstück zum Auge Innos. Es darf nicht in die Hände des Bösen fallen.","To odpowiednik Oka Innosa - nie wolno dopuścić, aby wpadł w ręce sług zła.","","","DIA_Addon_Xardas_Add_14_08","",""
"Scripts/Content/Story/Dialoge/DIA_NONE_100_Xardas.d:204","Kannst du mir etwas über diese Steintafel sagen?","Co mi możesz powiedzieć o tej kamiennej tablicy?","","","DIA_Addon_Xardas_StonePlate.description","",""
"Scripts/Content/Story/Dialoge/DIA_NONE_100_Xardas.d:217","Kannst du mir etwas über diese Steintafel sagen?","Co mi możesz powiedzieć o tej kamiennej tablicy?","","","DIA_Addon_Xardas_StonePlate_15_00","",""
"Scripts/Content/Story/Dialoge/DIA_NONE_100_Xardas.d:220","Ich hatte erst die Vermutung, dass es sich dabei um ein magisches Artefakt handelt, aber letztlich bin ich zu dem Schluss gekommen, dass es nicht von grosser Bedeutung ist.","Sądziłem, że to jakiś magiczny artefakt. Okazało się jednak, że jej znaczenie jest znacznie mniejsze.","","","DIA_Addon_Xardas_StonePlate_14_03","",""
"Scripts/Content/Story/Dialoge/DIA_NONE_100_Xardas.d:221","Ich habe den Sinn dieser Tafel nicht gänzlich entschlüsseln können, aber es scheint sich um die Geschichte einer sehr alten Kultur zu handeln.","Nie udało mi się do końca rozszyfrować wyrytych na niej znaków, ale wydają się one przekazywać historię prastarej kultury.","","","DIA_Addon_Xardas_StonePlate_14_04","",""
"Scripts/Content/Story/Dialoge/DIA_NONE_100_Xardas.d:222","Wenn du die Tafel haben willst, dann soll sie dir gehören, ich habe keine Verwendung dafür.","Weź ją, jeśli chcesz, do niczego mi się nie przyda.","","","DIA_Addon_Xardas_StonePlate_14_05","",""
"Scripts/Content/Story/Dialoge/DIA_NONE_100_Xardas.d:241","Die Wassermagier haben ein Portal zu einem unbekannten Teil der Insel entdeckt...","Mag wody odkrył portal prowadzący do nieznanej dotąd części wyspy.","","","DIA_Addon_Xardas_Portal.description","",""
"Scripts/Content/Story/Dialoge/DIA_NONE_100_Xardas.d:256","Die Wassermagier haben ein Portal zu einem unbekannten Teil der Insel entdeckt...","Mag Wody odkrył portal prowadzący do nieznanej dotąd części wyspy.","","","DIA_Addon_Xardas_AddonSuccess_15_00","",""
"Scripts/Content/Story/Dialoge/DIA_NONE_100_Xardas.d:257","Interessant...","To ciekawe...","","","DIA_Addon_Xardas_AddonSuccess_14_01","",""
"Scripts/Content/Story/Dialoge/DIA_NONE_100_Xardas.d:258","Sobald du etwas finden solltest, was uns WIRKLICH weiterhilft, berichte mir davon!","Zgłoś się do mnie, gdy tylko znajdziesz cokolwiek, co może nam naprawdę pomóc.","","","DIA_Addon_Xardas_AddonSuccess_14_02","",""
"Scripts/Content/Story/Dialoge/DIA_NONE_100_Xardas.d:259","Irgendwo dort könnte das Artefakt Beliars verborgen sein. Finde es!","Może ukryto tam artefakt Beliara? Odszukaj go!","","","DIA_Addon_Xardas_AddonSuccess_14_03","",""
"Scripts/Content/Story/Dialoge/DIA_NONE_100_Xardas.d:272","Wegen des unbekannten Teiles der Insel...","Co do niezbadanej dotąd części wyspy...","","","DIA_Addon_Xardas_PortalAgain.description","",""
"Scripts/Content/Story/Dialoge/DIA_NONE_100_Xardas.d:287","Wegen des unbekannten Teiles der Insel...","Co do niezbadanej dotąd części wyspy...","","","DIA_Addon_Xardas_AddonSuccess_15_17","",""
"Scripts/Content/Story/Dialoge/DIA_NONE_100_Xardas.d:288","Belästige mich nicht mit Details. Komm wieder, wenn du wirklich etwas Brauchbares gefunden hast.","Nie męcz mnie zbędnymi szczegółami. Wróć, gdy będziesz mieć coś przydatnego.","","","DIA_Addon_Xardas_AddonSuccess_14_18","",""
"Scripts/Content/Story/Dialoge/DIA_NONE_100_Xardas.d:300","Ich habe den unbekannten Teil der Insel erforscht...","Przeszukałem nieznaną część wyspy.","","","DIA_Addon_Xardas_AddonSuccess.description","",""
"Scripts/Content/Story/Dialoge/DIA_NONE_100_Xardas.d:314","Ich habe den unbekannten Teil der Insel erforscht...","Przeszukałem nieznaną część wyspy.","","","DIA_Addon_Xardas_AddonSuccess_15_03","",""
"Scripts/Content/Story/Dialoge/DIA_NONE_100_Xardas.d:315","Und, was hast du gefunden?","Z jakim rezultatem?","","","DIA_Addon_Xardas_AddonSuccess_14_04","",""
