"location","source","target","id","fuzzy","context","translator_comments","developer_comments"
"Scripts/Content/Story/Dialoge/DIA_NONE_100_Xardas.d:316","Die ganze Sache drehte sich um ein mächtiges Artefakt. Die Klaue Beliars.","Wszystko wydaje się obracać wokół potężnego artefaktu znanego jako Szpon Beliara.","","","DIA_Addon_Xardas_AddonSuccess_15_05","",""
"Scripts/Content/Story/Dialoge/DIA_NONE_100_Xardas.d:317","Die Klaue Beliars?! Wo ist sie jetzt? Trägst du sie bei dir?","Szpon Beliara? Gdzie on jest? Masz go przy sobie?","","","DIA_Addon_Xardas_AddonSuccess_14_06","",""
"Scripts/Content/Story/Dialoge/DIA_NONE_100_Xardas.d:321","Ja, ich habe sie hier.","Owszem.","","","DIA_Addon_Xardas_AddonSuccess_15_07","",""
"Scripts/Content/Story/Dialoge/DIA_NONE_100_Xardas.d:322","(gierig) Höchstinteressant.","To bardzo ciekawe...","","","DIA_Addon_Xardas_AddonSuccess_14_08","",""
"Scripts/Content/Story/Dialoge/DIA_NONE_100_Xardas.d:323","Diese Waffe kann uns von großem Nutzen sein. Aber sie ist auch äußerst gefährlich.","Ta broń może się nam bardzo przydać, jest jednak również niezwykle niebezpieczna.","","","DIA_Addon_Xardas_AddonSuccess_14_09","",""
"Scripts/Content/Story/Dialoge/DIA_NONE_100_Xardas.d:324","Gib gut auf dich acht! Und vor allem: Verliere sie nicht!","Zachowaj ostrożność i pod żadnym pozorem jej nie zgub!","","","DIA_Addon_Xardas_AddonSuccess_14_10","",""
"Scripts/Content/Story/Dialoge/DIA_NONE_100_Xardas.d:329","Ich habe sie nicht mehr...","Nie, już nie.","","","DIA_Addon_Xardas_AddonSuccess_15_11","",""
"Scripts/Content/Story/Dialoge/DIA_NONE_100_Xardas.d:330","Ich habe sie den Wassermagiern gegeben, damit sie sie im Meer versenken...","Przekazałem go Magom Wody, aby wrzucili go do morza.","","","DIA_Addon_Xardas_AddonSuccess_15_12","",""
"Scripts/Content/Story/Dialoge/DIA_NONE_100_Xardas.d:331","(poltert) Bist du von Sinnen? Weißt du, was du da aus deinen Händen gegeben hast?","Oszalałeś?! Wiesz chociaż, czego się pozbyłeś lekką ręką?!","","","DIA_Addon_Xardas_AddonSuccess_14_13","",""
"Scripts/Content/Story/Dialoge/DIA_NONE_100_Xardas.d:332","Diese Waffe hätte uns von großem Nutzen sein können!","Ta broń mogła się nam ogromnie przysłużyć!","","","DIA_Addon_Xardas_AddonSuccess_14_14","",""
"Scripts/Content/Story/Dialoge/DIA_NONE_100_Xardas.d:333","Ich glaube, es war besser so.","Sądzę, że tak będzie lepiej.","","","DIA_Addon_Xardas_AddonSuccess_15_15","",""
"Scripts/Content/Story/Dialoge/DIA_NONE_100_Xardas.d:334","(seufzt) Die Wege der Götter sind unergründlich...","Niezbadane są wyroki bogów...","","","DIA_Addon_Xardas_AddonSuccess_14_16","",""
"Scripts/Content/Story/Dialoge/DIA_NONE_100_Xardas.d:349","Ich brauche Waffen","Potrzebuję broni.","","","DIA_Xardas_WEAPON.description","",""
"Scripts/Content/Story/Dialoge/DIA_NONE_100_Xardas.d:362","Ich brauche Waffen.","Potrzebuję broni.","","","DIA_Xardas_WEAPON_15_00","",""
"Scripts/Content/Story/Dialoge/DIA_NONE_100_Xardas.d:363","Ich kann dir nur das Wenige geben, was ich hier habe.","Mogę ci dać tylko to, co znajdziesz w mojej wieży.","","","DIA_Xardas_WEAPON_14_01","",""
"Scripts/Content/Story/Dialoge/DIA_NONE_100_Xardas.d:364","Sieh dich in meinem Turm um. Alles, was du gebrauchen kannst, gehört dir.","Rozejrzyj się tu trochę. Cokolwiek uznasz za przydatne, należy do ciebie.","","","DIA_Xardas_WEAPON_14_02","",""
"Scripts/Content/Story/Dialoge/DIA_NONE_100_Xardas.d:376","Was genau ist das 'Auge Innos'?","Czym dokładnie jest 'Oko Innosa'?","","","DIA_Xardas_ARTEFAKT.description","",""
"Scripts/Content/Story/Dialoge/DIA_NONE_100_Xardas.d:390","Was genau ist das 'Auge Innos'?","Czym dokładnie jest 'Oko Innosa'?","","","DIA_Xardas_ARTEFAKT_15_00","",""
"Scripts/Content/Story/Dialoge/DIA_NONE_100_Xardas.d:391","Es ist ein Amulett. Der Sage nach hat Innos selbst einen Teil seiner Macht in dieses Amulett gelegt.","To magiczny amulet. Legenda głosi, że sam Innos wlał weń część swojej boskiej mocy.","","","DIA_Xardas_ARTEFAKT_14_01","",""
"Scripts/Content/Story/Dialoge/DIA_NONE_100_Xardas.d:392","Es wird dir einen Teil deiner verlorenen Kraft wiedergeben, und uns helfen, die Drachen zu besiegen.","Dzięki niemu odzyskasz część dawnych sił i będziesz mógł stawić czoła smokom.","","","DIA_Xardas_ARTEFAKT_14_02","",""
"Scripts/Content/Story/Dialoge/DIA_NONE_100_Xardas.d:393","Und es hat noch einige andere verborgene Fähigkeiten. Doch dazu mehr, wenn du das Amulett hast.","Oko ma też inne, tajemnicze właściwości, ale o nich opowiem ci, gdy już zdobędziesz amulet.","","","DIA_Xardas_ARTEFAKT_14_03","",""
"Scripts/Content/Story/Dialoge/DIA_NONE_100_Xardas.d:405","Warum sollten mir die Paladine das Auge Innos' geben?","Dlaczego paladyni mieliby mi dać Oko Innosa?","","","DIA_Xardas_PALADIN.description","",""
"Scripts/Content/Story/Dialoge/DIA_NONE_100_Xardas.d:419","Warum sollten mir die Paladine das Auge Innos' geben?","Dlaczego paladyni mieliby mi dać Oko Innosa?","","","DIA_Xardas_PALADIN_15_00","",""
"Scripts/Content/Story/Dialoge/DIA_NONE_100_Xardas.d:420","Weil du derjenige bist, der dazu bestimmt ist, es zu tragen.","Bo twoim przeznaczeniem jest nosić ten amulet.","","","DIA_Xardas_PALADIN_14_01","",""
"Scripts/Content/Story/Dialoge/DIA_NONE_100_Xardas.d:421","Woher willst du das wissen?","Skąd ta pewność?","","","DIA_Xardas_PALADIN_15_02","",""
"Scripts/Content/Story/Dialoge/DIA_NONE_100_Xardas.d:422","Es gibt eine Reihe von Gründen. Der Wichtigste ist: Du hast den Schläfer besiegt. Stündest du nicht in der Gunst der Götter, wärst du jetzt tot.","Jest kilka przesłanek. Najważniejszą z nich jest fakt, że pokonałeś Śniącego. Gdybyś nie był ulubieńcem bogów, już dawno byś nie żył.","","","DIA_Xardas_PALADIN_14_03","",""
"Scripts/Content/Story/Dialoge/DIA_NONE_100_Xardas.d:423","Nehmen wir mal an, du hast Recht und ich bin dazu bestimmt, das Auge Innos' zu tragen. Woher wissen die Paladine, dass es so ist?","Załóżmy, że masz rację i rzeczywiście pisane mi jest posiadanie Oka Innosa. Jak mam o tym przekonać paladynów?","","","DIA_Xardas_PALADIN_15_04","",""
"Scripts/Content/Story/Dialoge/DIA_NONE_100_Xardas.d:424","Das Auge sucht sich seinen Träger selbst - sobald du es in die Finger bekommst und es dir anlegst, werden die Paladine nicht mehr an deinen Worten zweifeln.","Oko Innosa samo wybiera swojego posiadacza. Jeśli uda ci się je zdobyć i założyć, paladyni będą musieli uznać prawdziwość twoich słów.","","","DIA_Xardas_PALADIN_14_05","",""
"Scripts/Content/Story/Dialoge/DIA_NONE_100_Xardas.d:436","Wie komme ich zur Stadt?","Jak się dostać do miasta?","","","DIA_Xardas_Khorinis.description","",""
"Scripts/Content/Story/Dialoge/DIA_NONE_100_Xardas.d:451","Wie komme ich zur Stadt?","Jak się dostać do miasta?","","","DIA_Xardas_Khorinis_15_00","",""
"Scripts/Content/Story/Dialoge/DIA_NONE_100_Xardas.d:452","Folge einfach dem Weg von hier aus durch die Berge. Die Stadt ist groß. Du kannst sie nicht verfehlen.","Idź po prostu w dół ścieżki prowadzącej od drzwi mojej wieży. Miasto jest duże, z pewnością je zauważysz.","","","DIA_Xardas_Khorinis_14_01","",""
"Scripts/Content/Story/Dialoge/DIA_NONE_100_Xardas.d:453","Aber sieh dich vor! Der Weg zur Stadt ist nicht ungefährlich. Und du bist noch lange nicht wieder so stark, wie du einst warst.","Tylko uważaj! Droga do miasta najeżona jest niebezpieczeństwami, a ty nie jesteś tak silny jak kiedyś.","","","DIA_Xardas_Khorinis_14_02","",""
"Scripts/Content/Story/Dialoge/DIA_NONE_100_Xardas.d:465","Wo genau sind wir hier?","Gdzie my w ogóle jesteśmy?","","","DIA_Xardas_WhereEx.description","",""
"Scripts/Content/Story/Dialoge/DIA_NONE_100_Xardas.d:479","Wo genau sind wir hier?","Gdzie my w ogóle jesteśmy?","","","DIA_Xardas_Add_15_00","",""
"Scripts/Content/Story/Dialoge/DIA_NONE_100_Xardas.d:480","Wie ich bereits sagte, in der Nähe der Stadt Khorinis.","Mówiłem ci już - niedaleko miasta Khorinis.","","","DIA_Xardas_Add_14_01","",""
"Scripts/Content/Story/Dialoge/DIA_NONE_100_Xardas.d:481","Ich habe meinen Turm hier neu errichtet.","Odbudowałem tutaj moją wieżę.","","","DIA_Xardas_Add_14_02","",""
"Scripts/Content/Story/Dialoge/DIA_NONE_100_Xardas.d:482","Aber es ist erst wenige Tage her, daß wir uns das letzte Mal im Minental gesehen haben...","Przecież nie minął miesiąc, odkąd widzieliśmy się w Górniczej Dolinie!","","","DIA_Xardas_Add_15_03","",""
"Scripts/Content/Story/Dialoge/DIA_NONE_100_Xardas.d:483","Die Diener, die ich rief, um meinen Turm zu bauen haben ganze Arbeit geleistet...","Słudzy, których wezwałem do budowy mojej wieży, uwinęli się bardzo sprawnie...","","","DIA_Xardas_Add_14_04","",""
"Scripts/Content/Story/Dialoge/DIA_NONE_100_Xardas.d:484","Das kann man wohl sagen.","Trudno zaprzeczyć.","","","DIA_Xardas_Add_15_05","",""
"Scripts/Content/Story/Dialoge/DIA_NONE_100_Xardas.d:492","Woher bekomme ich bessere Ausrüstung?","Gdzie mogę znaleźć lepsze wyposażenie?","","","DIA_Xardas_EQUIPMENT.description","",""
"Scripts/Content/Story/Dialoge/DIA_NONE_100_Xardas.d:507","Woher bekomme ich bessere Ausrüstung?","Gdzie mogę znaleźć lepsze wyposażenie?","","","DIA_Xardas_EQUIPMENT_15_00","",""
"Scripts/Content/Story/Dialoge/DIA_NONE_100_Xardas.d:508","Der nächste Ort, an dem du bessere Waffen und Rüstungen bekommen kannst, ist die Stadt Khorinis.","Jeśli chcesz kupić broń i pancerz, musisz pewnie udać się do Khorinis.","","","DIA_Xardas_EQUIPMENT_14_01","",""
"Scripts/Content/Story/Dialoge/DIA_NONE_100_Xardas.d:509","Aber unten im Tal findest du einige Heilpflanzen, die dir helfen werden, wenn du im Kampf verwundet werden solltest.","Ale w dolinie znajdziesz lecznicze zioła, które przywrócą ci siły utracone w walce.","","","DIA_Xardas_EQUIPMENT_14_02","",""
"Scripts/Content/Story/Dialoge/DIA_NONE_100_Xardas.d:510","Direkt vor meinem Turm ist ein See. Von dort aus gibt es einen versteckten Zugang zum Tal.","Wybierz się też nad jezioro, tuż przed moją wieżą. Znajdziesz tam ukryte przejście do doliny.","","","DIA_Xardas_EQUIPMENT_14_03","",""
"Scripts/Content/Story/Dialoge/DIA_NONE_100_Xardas.d:522","Hast du schon mit Lester gesprochen?","Rozmawiałeś już z Lesterem?","","","DIA_Xardas_ABOUTLESTER.description","",""
"Scripts/Content/Story/Dialoge/DIA_NONE_100_Xardas.d:537","Hast du schon mit Lester gesprochen?","Rozmawiałeś już z Lesterem?","","","DIA_Xardas_ABOUTLESTER_15_00","",""
"Scripts/Content/Story/Dialoge/DIA_NONE_100_Xardas.d:538","Ja, ich habe ihn ordentlich gelöchert. Er konnte mir viel berichten, aber er ist völlig erschöpft.","Tak, zasypałem go pytaniami. Dużo się od niego dowiedziałem. Jest teraz kompletnie wyczerpany.","","","DIA_Xardas_ABOUTLESTER_14_01","",""
"Scripts/Content/Story/Dialoge/DIA_NONE_100_Xardas.d:539","Dass er diese Flucht überhaupt überlebt hat, grenzt schon an ein Wunder. Ich habe ihn erstmal ins Bett geschickt.","To prawdziwy cud, że w ogóle przeżył tę ucieczkę. Kazałem mu trochę odpocząć.","","","DIA_Xardas_ABOUTLESTER_14_02","",""
"Scripts/Content/Story/Dialoge/DIA_NONE_100_Xardas.d:540","Was hat er erzählt?","Czego się od niego dowiedziałeś?","","","DIA_Xardas_ABOUTLESTER_15_03","",""
"Scripts/Content/Story/Dialoge/DIA_NONE_100_Xardas.d:541","Nichts Gutes. Er hat nicht nur einen Drachen gesehen, sondern auch Männer in dunklen Kapuzenmänteln.","Niestety, niczego dobrego. Nie dość, że widział smoka, to spotkał też ludzi w czarnych kapturach.","","","DIA_Xardas_ABOUTLESTER_14_04","",""
"Scripts/Content/Story/Dialoge/DIA_NONE_100_Xardas.d:542","Und?","To takie ważne?","","","DIA_Xardas_ABOUTLESTER_15_05","",""
"Scripts/Content/Story/Dialoge/DIA_NONE_100_Xardas.d:543","Wenn es diese Männer gibt, dann stellt ihre Anwesenheit eine mögliche Bedrohung dar.","Jeśli ci ludzie rzeczywiście istnieją, będą dla nas poważnym zagrożeniem.","","","DIA_Xardas_ABOUTLESTER_14_06","",""
"Scripts/Content/Story/Dialoge/DIA_NONE_100_Xardas.d:544","Und das gefällt mir nicht. Hier, nimm meinen Ring. Er wird dich vor Magie beschützen.","Niepokoi mnie to. Proszę, weź mój pierścień. Będzie cię chronił przed magią.","","","DIA_Xardas_ABOUTLESTER_14_07","",""
"Scripts/Content/Story/Dialoge/DIA_NONE_100_Xardas.d:565","Ich war in der Stadt...","Byłem w mieście...","","","DIA_Xardas_FirstPal.description","",""
"Scripts/Content/Story/Dialoge/DIA_NONE_100_Xardas.d:580","Ich war in der Stadt...","Byłem w mieście...","","","DIA_Xardas_FirstPal_15_00","",""
"Scripts/Content/Story/Dialoge/DIA_NONE_100_Xardas.d:581","Und? Konntest du mit dem Anführer der Paladine reden?","Udało ci się porozmawiać z przywódcą paladynów?","","","DIA_Xardas_FirstPal_14_01","",""
"Scripts/Content/Story/Dialoge/DIA_NONE_100_Xardas.d:582","Ich werde nicht bei ihm vorgelassen ...","Nie. Nie chcą mnie dopuścić przed jego oblicze...","","","DIA_Xardas_FirstPal_15_02","",""
"Scripts/Content/Story/Dialoge/DIA_NONE_100_Xardas.d:583","Unsinn! Du wirst doch einen Weg finden, zu ihm zu kommen.","Głupcy! Musi być jakiś sposób, byś do niego dotarł.","","","DIA_Xardas_FirstPal_14_03","",""
"Scripts/Content/Story/Dialoge/DIA_NONE_100_Xardas.d:584","Notfalls geh ins Kloster und werde einer der Magier.","Gdyby nie było innego wyjścia, dostań się do klasztoru i zostań magiem.","","","DIA_Xardas_FirstPal_14_04","",""
"Scripts/Content/Story/Dialoge/DIA_NONE_100_Xardas.d:585","Das ist zwar von meinem Standpunkt aus gesehen moralisch fragwürdig. Aber es bringt dich auch zum Ziel.","Może to trochę moralnie dwuznaczne, ale przynajmniej osiągniesz swój cel.","","","DIA_Xardas_FirstPal_14_05","",""
"Scripts/Content/Story/Dialoge/DIA_NONE_100_Xardas.d:586","Als Magier wirst du auf jeden Fall vorgelassen.","Gdybyś był magiem, przywódca paladynów musiałby się z tobą spotkać.","","","DIA_Xardas_FirstPal_14_06","",""
"Scripts/Content/Story/Dialoge/DIA_NONE_100_Xardas.d:599","Wie geht's jetzt weiter? ","Więc co mam teraz robić?","","","DIA_Xardas_Weiter.description","",""
"Scripts/Content/Story/Dialoge/DIA_NONE_100_Xardas.d:613","Wie geht's jetzt weiter?","Więc co mam teraz robić?","","","DIA_Xardas_Weiter_15_00","",""
"Scripts/Content/Story/Dialoge/DIA_NONE_100_Xardas.d:614","Wir machen weiter wie geplant, eine andere Chance haben wir nicht.","Postępujmy dalej zgodnie z planem. Chwilowo nie widzę innej drogi.","","","DIA_Xardas_Weiter_14_01","",""
"Scripts/Content/Story/Dialoge/DIA_NONE_100_Xardas.d:615","Du besorgst dir das Auge Innos' und ich werde weiter nach den Antworten suchen.","Postaraj się zdobyć Oko Innosa. Ja w tym czasie poszukam odpowiedzi na moje pytania.","","","DIA_Xardas_Weiter_14_02","",""
"Scripts/Content/Story/Dialoge/DIA_NONE_100_Xardas.d:623","Warum darf der Kreis des Feuers nichts von dir wissen?","Dlaczego Krąg Ognia nie może się o tobie dowiedzieć?","","","DIA_Xardas_KdfSecret.description","",""
"Scripts/Content/Story/Dialoge/DIA_NONE_100_Xardas.d:636","Warum darf der Kreis des Feuers nichts von dir wissen?","Dlaczego Krąg Ognia nie może się o tobie dowiedzieć?","","","DIA_Xardas_KdfSecret_15_00","",""
"Scripts/Content/Story/Dialoge/DIA_NONE_100_Xardas.d:637","Früher war ich ein hohes Mitglied des Kreises. Ich ahnte schon damals, dass die Dämonenmagie der Schlüssel zur magischen Barriere war.","Kiedyś byłem wysoko w hierarchii kręgu. Jednak już wtedy podejrzewałem, że kluczem do Bariery jest magia demonów.","","","DIA_Xardas_KdfSecret_14_01","",""
"Scripts/Content/Story/Dialoge/DIA_NONE_100_Xardas.d:638","Aber die anderen Mitglieder dieses Kreises hätte ich nie von diesem Weg überzeugen können.","Oczywiście nigdy nie udało mi się przekonać o tym pozostałych magów.","","","DIA_Xardas_KdfSecret_14_02","",""
"Scripts/Content/Story/Dialoge/DIA_NONE_100_Xardas.d:639","Also habe ich den Kreis verlassen, um die schwarzen Künste zu studieren.","Dlatego opuściłem Krąg i oddałem się badaniu tajemnic mrocznych sztuk.","","","DIA_Xardas_KdfSecret_14_03","",""
"Scripts/Content/Story/Dialoge/DIA_NONE_100_Xardas.d:640","Für dieses Vergehen gibt es in den Augen der Feuermagier, (abfällig) der 'Geweihten Innos', der immer 'Guten' und 'Rechtschaffenen', keine Entschuldigung.","To zbrodnia, której 'Bogobojni Wyznawcy Innosa', 'Dobrzy' i 'Cnotliwi' Magowie Ognia nigdy mi nie wybaczą.","","","DIA_Xardas_KdfSecret_14_04","",""
"Scripts/Content/Story/Dialoge/DIA_NONE_100_Xardas.d:641","Sie wissen mit Sicherheit, dass ich noch lebe, aber nicht, wo sie mich finden können - und das ist auch gut so.","Zapewne wiedzą, że wciąż żyję, ale nie mają pojęcia, gdzie mnie szukać. I niech tak pozostanie.","","","DIA_Xardas_KdfSecret_14_05","",""
"Scripts/Content/Story/Dialoge/DIA_NONE_100_Xardas.d:687","Ich bin zurück aus dem Minental.","Wracam z Górniczej Doliny.","","","DIA_Xardas_BACKFROMOW.description","",""
"Scripts/Content/Story/Dialoge/DIA_NONE_100_Xardas.d:700","Ich bin zurück aus dem Minental.","Wracam z Górniczej Doliny.","","","DIA_Xardas_BACKFROMOW_15_00","",""
"Scripts/Content/Story/Dialoge/DIA_NONE_100_Xardas.d:701","Das wurde auch Zeit. Was hast du gesehen?","Najwyższy czas. Co tam widziałeś?","","","DIA_Xardas_BACKFROMOW_14_01","",""
"Scripts/Content/Story/Dialoge/DIA_NONE_100_Xardas.d:702","Du hattest Recht. Das Land wurde überschwemmt von einer ganzen Armee des Feindes.","Miałeś rację. W dolinie stacjonuje potężna armia nieprzyjaciela.","","","DIA_Xardas_BACKFROMOW_15_02","",""
"Scripts/Content/Story/Dialoge/DIA_NONE_100_Xardas.d:703","Orks belagern die Burg und Drachen haben ganze Landstriche verwüstet.","Orkowie oblegają zamek, a smoki pustoszą okoliczne tereny.","","","DIA_Xardas_BACKFROMOW_15_03","",""
"Scripts/Content/Story/Dialoge/DIA_NONE_100_Xardas.d:704","Wenn mich nicht alles täuscht, dann wird es nicht mehr lange dauern, bis sie Khorinis angreifen.","Jeśli się nie mylę, wkrótce cała armia ruszy na Khorinis.","","","DIA_Xardas_BACKFROMOW_15_04","",""
"Scripts/Content/Story/Dialoge/DIA_NONE_100_Xardas.d:717","Was zur Hölle ist in der Zwischenzeit hier passiert?","Co się tu do diabła działo pod moją nieobecność?","","","DIA_Xardas_DMTSINDDA.description","",""
"Scripts/Content/Story/Dialoge/DIA_NONE_100_Xardas.d:733","Lester sagte, du wolltest mich sofort sehen.","Lester powiedział, że chcesz się ze mną widzieć.","","","DIA_Xardas_DMTSINDDA_15_00","",""
"Scripts/Content/Story/Dialoge/DIA_NONE_100_Xardas.d:736","Was zur Hölle ist in der Zwischenzeit hier passiert?","Co się tu do diabła działo pod moją nieobecność?","","","DIA_Xardas_DMTSINDDA_15_01","",""
"Scripts/Content/Story/Dialoge/DIA_NONE_100_Xardas.d:737","Der Feind hat erfahren, wer du wirklich bist, und dass du das Auge Innos' in deinen Besitz bringen willst.","Nasz przeciwnik dowiedział się, kim jesteś naprawdę, i że zamierzasz zdobyć Oko Innosa.","","","DIA_Xardas_DMTSINDDA_14_02","",""
"Scripts/Content/Story/Dialoge/DIA_NONE_100_Xardas.d:738","Er hat die Bedrohung erkannt. Er sah sich gezwungen, aus seiner Deckung hervor zu treten und offen anzugreifen.","Zdał sobie sprawę z zagrożenia, więc postanowił wyjść z ukrycia i zaatakować otwarcie.","","","DIA_Xardas_DMTSINDDA_14_03","",""
"Scripts/Content/Story/Dialoge/DIA_NONE_100_Xardas.d:739","Das Versteckspiel hat ein Ende. Während gestern noch nicht klar war, wie der Angriff des Gegners aussehen würde, kann man es jetzt kaum noch übersehen.","Zabawa w chowanego już się skończyła. Jeszcze wczoraj nikt nie wiedział, z której strony nadejdzie cios. Dziś nie ma co do tego żadnych wątpliwości.","","","DIA_Xardas_DMTSINDDA_14_04","",""
"Scripts/Content/Story/Dialoge/DIA_NONE_100_Xardas.d:744","Ich bin von Magiern in schwarzer Robe angegriffen worden.","Zaatakowali mnie magowie w czarnych szatach.","","","DIA_Xardas_DMTSINDDA.DIA_Xardas_DMTSINDDA_DMT","Info_AddChoice",""
"Scripts/Content/Story/Dialoge/DIA_NONE_100_Xardas.d:745","Ich habe den Beweis für Lord Hagen.","Wreszcie udało mi się zdobyć dowód dla Lorda Hagena.","","","DIA_Xardas_DMTSINDDA.DIA_Xardas_DMTSINDDA_Beweis","Info_AddChoice",""
"Scripts/Content/Story/Dialoge/DIA_NONE_100_Xardas.d:750","Ich bin von Magiern in schwarzen Roben angegriffen worden.","Zaatakowali mnie magowie w czarnych szatach.","","","DIA_Xardas_DMTSINDDA_DMT_15_00","",""
"Scripts/Content/Story/Dialoge/DIA_NONE_100_Xardas.d:751","Der Feind hat viele Gesichter. Die Suchenden sind eines davon. Sie sind die eigentlichen Drahtzieher des Feindes.","Wróg ma wiele twarzy. Poszukiwacze to właśnie jedna z nich. Ale oni tylko przygotowują teren na przybycie prawdziwego przeciwnika.","","","DIA_Xardas_DMTSINDDA_DMT_14_01","",""
"Scripts/Content/Story/Dialoge/DIA_NONE_100_Xardas.d:752","Sie haben sich an den wichtigsten Orten in Stellung begeben und wartet nur noch auf eine Gelegenheit, die Falle zuschnappen zu lassen.","Zajęli już pozycje w strategicznych miejscach. Teraz czekają tylko na dogodną okazję, by zacisnąć pętlę sideł.","","","DIA_Xardas_DMTSINDDA_DMT_14_02","",""
"Scripts/Content/Story/Dialoge/DIA_NONE_100_Xardas.d:753","Geh ihnen aus dem Weg. Sie sind sehr mächtige magische Wesen und werden versuchen, dich mit allen Mitteln aufzuhalten.","Trzymaj się od nich z dala. To potężne, magiczne istoty, które za wszelką cenę spróbują cię powstrzymać.","","","DIA_Xardas_DMTSINDDA_DMT_14_03","",""
"Scripts/Content/Story/Dialoge/DIA_NONE_100_Xardas.d:765","Ich habe endlich den Beweis, den Lord Hagen von mir verlagt hat.","Znalazłem wreszcie dowód, którego domagał się Lord Hagen.","","","DIA_Xardas_DMTSINDDA_Beweis_15_00","",""
"Scripts/Content/Story/Dialoge/DIA_NONE_100_Xardas.d:766","Was für ein Beweis ist das?","Co to za dowód?","","","DIA_Xardas_DMTSINDDA_Beweis_14_01","",""
"Scripts/Content/Story/Dialoge/DIA_NONE_100_Xardas.d:767","Ich habe einen Brief von Garond, dem Kommandanten der Paladine im Minental, erhalten. Darin fordert er Verstärkung an.","Otrzymałem list od Garonda, dowódcy paladynów w Górniczej Dolinie. Prosi w nim o posiłki.","","","DIA_Xardas_DMTSINDDA_Beweis_15_02","",""
"Scripts/Content/Story/Dialoge/DIA_NONE_100_Xardas.d:768","Das sollte diesen militanten Feldherrn überzeugen. Gut gemacht.","To powinno wystarczyć, by przekonać Hagena. Dobra robota.","","","DIA_Xardas_DMTSINDDA_Beweis_14_03","",""
"Scripts/Content/Story/Dialoge/DIA_NONE_100_Xardas.d:770","Was ist jetzt der nächste Schritt?","Co mam teraz robić?","","","DIA_Xardas_DMTSINDDA.DIA_Xardas_DMTSINDDA_DMT_WhatToDo","Info_AddChoice",""
"Scripts/Content/Story/Dialoge/DIA_NONE_100_Xardas.d:776","Was ist jetzt der nächste Schritt?","Co mam teraz robić?","","","DIA_Xardas_DMTSINDDA_DMT_WhatToDo_15_00","",""
"Scripts/Content/Story/Dialoge/DIA_NONE_100_Xardas.d:777","Geh und bringe Lord Hagen den Brief von Garond, damit er dir den Zugang zum Auge Innos' gewährt.","Zanieś Hagenowi list od Garonda. Z takim dowodem w ręku zostaniesz dopuszczony do Oka Innosa.","","","DIA_Xardas_DMTSINDDA_DMT_WhatToDo_14_01","",""
"Scripts/Content/Story/Dialoge/DIA_NONE_100_Xardas.d:778","Dann begib dich ins Kloster und sprich mit Pyrokar. Er muss dir das Auge aushändigen.","Potem udaj się do Pyrokara. To on da ci Oko.","","","DIA_Xardas_DMTSINDDA_DMT_WhatToDo_14_02","",""
"Scripts/Content/Story/Dialoge/DIA_NONE_100_Xardas.d:779","Es gibt nichts Wichtigeres, als das Artefakt in Sicherheit zu bringen.","Musisz koniecznie zabrać ten artefakt w bezpieczne miejsce.","","","DIA_Xardas_DMTSINDDA_DMT_WhatToDo_14_03","",""
"Scripts/Content/Story/Dialoge/DIA_NONE_100_Xardas.d:780","Geh jetzt, bevor es zu spät ist. Der Feind wird ebenfalls versuchen, sich dessen zu bemächtigen.","Idź już, zanim będzie za późno. Wróg też spróbuje zdobyć amulet dla siebie.","","","DIA_Xardas_DMTSINDDA_DMT_WhatToDo_14_04","",""
"Scripts/Content/Story/Dialoge/DIA_NONE_100_Xardas.d:793","Das Auge Innos' ist zerstört.","Oko Innosa zostało zniszczone.","","","DIA_Xardas_INNOSEYEBROKEN.description","",""
"Scripts/Content/Story/Dialoge/DIA_NONE_100_Xardas.d:808","Das Auge Innos' ist zerstört.","Oko Innosa zostało zniszczone.","","","DIA_Xardas_INNOSEYEBROKEN_15_00","",""
"Scripts/Content/Story/Dialoge/DIA_NONE_100_Xardas.d:809","Was redest du da? Zerstört!","Jak to możliwe? Zniszczone?!","","","DIA_Xardas_INNOSEYEBROKEN_14_01","",""
"Scripts/Content/Story/Dialoge/DIA_NONE_100_Xardas.d:810","Ich habe es oben in den nördlichen Wäldern gefunden und es leider nur noch in Einzelteilen bergen können.","Znalazłem je w północnych lasach. Niestety, udało mi się odzyskać tylko kawałki.","","","DIA_Xardas_INNOSEYEBROKEN_15_02","",""
"Scripts/Content/Story/Dialoge/DIA_NONE_100_Xardas.d:811","Damit ist die einzige Möglichkeit, den Drachen die Stirn zu bieten, dahin. Wir haben versagt.","To była nasza jedyna szansa na pokonanie tych smoków! Wszystko stracone.","","","DIA_Xardas_INNOSEYEBROKEN_14_03","",""
"Scripts/Content/Story/Dialoge/DIA_NONE_100_Xardas.d:817","Was nun?","Co teraz?","","","DIA_Xardas_INNOSEYEBROKEN.DIA_Xardas_INNOSEYEBROKEN_wasnun","Info_AddChoice",""
"Scripts/Content/Story/Dialoge/DIA_NONE_100_Xardas.d:822","Was nun?","Co teraz?","","","DIA_Xardas_INNOSEYEBROKEN_wasnun_15_00","",""
"Scripts/Content/Story/Dialoge/DIA_NONE_100_Xardas.d:823","Das ist ein harter Schlag. Wir müssen uns neu orientieren. Ich werde mich zurückziehen und darüber nachdenken.","To straszliwy cios. Nieprędko się po nim podniesiemy. Muszę przemyśleć całą sprawę w spokoju.","","","DIA_Xardas_INNOSEYEBROKEN_wasnun_14_01","",""
