"location","source","target","id","fuzzy","context","translator_comments","developer_comments"
"Scripts/Content/Story/Dialoge/DIA_Addon_BDT_1097_Fisk.d:470","Was hast du jetzt vor?","Co chcesz zrobić?","","","DIA_Addon_Fisk_Meeting_now_15_00","",""
"Scripts/Content/Story/Dialoge/DIA_Addon_BDT_1097_Fisk.d:474","Wir werden Esteban aus dem Weg räumen. Das heißt, DU wirst ihn umlegen und seine Position übernehmen.","Pozbędziemy się Estebana. Znaczy się, zabijesz go i zajmiesz jego miejsce.","","","DIA_Addon_Fisk_Meeting_now_12_01","",""
"Scripts/Content/Story/Dialoge/DIA_Addon_BDT_1097_Fisk.d:475","Solange seine Leibwächter bei ihm sind, hab ich keine Chance.","Nic z tego, dopóki otaczają go jego ludzie.","","","DIA_Addon_Fisk_Meeting_now_15_02","",""
"Scripts/Content/Story/Dialoge/DIA_Addon_BDT_1097_Fisk.d:476","Dann müssen wir sie dazu kriegen, dass sie abhauen. Und zwar mit der Wahrheit.","A więc będziemy musieli się nimi zająć. Powiemy prawdę.","","","DIA_Addon_Fisk_Meeting_now_12_03","",""
"Scripts/Content/Story/Dialoge/DIA_Addon_BDT_1097_Fisk.d:477","Welche Wahrheit?","Jaką prawdę?","","","DIA_Addon_Fisk_Meeting_now_15_04","",""
"Scripts/Content/Story/Dialoge/DIA_Addon_BDT_1097_Fisk.d:478","Du hast deinen Job erledigt. Du weißt, dass ich hinter dem Attentat stecke.","Wykonałeś swoje zadanie i wiesz, że to ja stałem za próbą zabójstwa.","","","DIA_Addon_Fisk_Meeting_now_12_05","",""
"Scripts/Content/Story/Dialoge/DIA_Addon_BDT_1097_Fisk.d:479","Erzähle das Esteban und er wird seine Jungs schicken, um mich zu töten. Ich werde sie hier erwarten.","Powiedz o tym Estebanowi, a wyśle swoich zbirów, żeby mnie zabili. Będę tu na nich czekać.","","","DIA_Addon_Fisk_Meeting_now_12_06","",""
"Scripts/Content/Story/Dialoge/DIA_Addon_BDT_1097_Fisk.d:480","Wenn sie weg sind, kannst du dir den Mistkerl vornehmen und ich kümmere mich um die Wachen.","Ty będziesz mógł załatwić tego sukinsyna, a ja zajmę się strażnikami.","","","DIA_Addon_Fisk_Meeting_now_12_07","",""
"Scripts/Content/Story/Dialoge/DIA_Addon_BDT_1097_Fisk.d:484","Esteban ist tot. Ich werde mich wieder dem Handel widmen ...","Esteban nie żyje. Znów będę mógł zająć się handlem...","","","DIA_Addon_Fisk_Meeting_now_12_08","",""
"Scripts/Content/Story/Dialoge/DIA_Addon_BDT_1097_Fisk.d:485","Hier, das ist für dich ...","Proszę, to dla ciebie...","","","DIA_Addon_Fisk_Meeting_now_12_09","",""
"Scripts/Content/Story/Dialoge/DIA_Addon_BDT_1097_Fisk.d:505","Esteban ist erledigt.","Esteban nie będzie już sprawiał kłopotów.","","","DIA_Addon_Fisk_Sieg.description","",""
"Scripts/Content/Story/Dialoge/DIA_Addon_BDT_1097_Fisk.d:519","Esteban ist erledigt.","Esteban nie będzie już sprawiał kłopotów.","","","DIA_Addon_Fisk_Sieg_15_00","",""
"Scripts/Content/Story/Dialoge/DIA_Addon_BDT_1097_Fisk.d:520","Darauf habe ich lange gewartet.","Długo na to czekałem.","","","DIA_Addon_Fisk_Sieg_12_01","",""
"Scripts/Content/Story/Dialoge/DIA_Addon_BDT_1097_Fisk.d:521","Ich denke, du hast jetzt einiges zu tun und ich muss mich auch wieder um meine Geschäfte kümmern.","Masz chyba dość dużo roboty, a ja muszę znowu zająć się prowadzeniem mojego interesu.","","","DIA_Addon_Fisk_Sieg_12_02","",""
"Scripts/Content/Story/Dialoge/DIA_Addon_BDT_1097_Fisk.d:522","Also, wenn du noch was brauchst, du weißt, wo du mich findest.","Jeśli będziesz czegoś potrzebować, wiesz, gdzie mnie szukać.","","","DIA_Addon_Fisk_Sieg_12_03","",""
"Scripts/Content/Story/Dialoge/DIA_Addon_BDT_1098_Snaf.d:83","Willst du futtern oder quatschen? Was darf's sein?","Chcesz pić czy gadać? Czego potrzebujesz?","","","DIA_Addon_Snaf_Hi_01_00","",""
"Scripts/Content/Story/Dialoge/DIA_Addon_BDT_1098_Snaf.d:95","Was gibt's denn leckeres?","Masz coś dobrego do jedzenia?","","","DIA_Addon_Snaf_Cook.description","",""
"Scripts/Content/Story/Dialoge/DIA_Addon_BDT_1098_Snaf.d:105","Was gibt's denn Leckeres?","Masz coś dobrego do jedzenia?","","","DIA_Addon_Snaf_Cook_15_00","",""
"Scripts/Content/Story/Dialoge/DIA_Addon_BDT_1098_Snaf.d:106","Ich will ein neues Gericht ausprobieren - 'Feuergeschnetzeltes in Hammersauce'.","Chcę sprawdzić nowy przepis – Ognisty gulasz w mocnym sosie.","","","DIA_Addon_Snaf_Cook_01_01","",""
"Scripts/Content/Story/Dialoge/DIA_Addon_BDT_1098_Snaf.d:109","Feuer- Geschnetzeltes? ","Ognisty gulasz?","","","DIA_Addon_Snaf_Cook.DIA_Addon_Snaf_Cook_FEUER","Info_AddChoice",""
"Scripts/Content/Story/Dialoge/DIA_Addon_BDT_1098_Snaf.d:110","Hammer Sauce? ","Mocny sos?","","","DIA_Addon_Snaf_Cook.DIA_Addon_Snaf_Cook_HAMMER","Info_AddChoice",""
"Scripts/Content/Story/Dialoge/DIA_Addon_BDT_1098_Snaf.d:116","Feuergeschnetzeltes?","Ognisty gulasz?","","","DIA_Addon_Snaf_Cook_FEUER_15_00","",""
"Scripts/Content/Story/Dialoge/DIA_Addon_BDT_1098_Snaf.d:117","Knusprig zart gebratenes Fleisch, vermengt mit eingelegtem Feuerkraut.","Chrupiące, delikatne, pieczone mięso w otoczce z ognistej kapusty.","","","DIA_Addon_Snaf_Cook_FEUER_01_01","",""
"Scripts/Content/Story/Dialoge/DIA_Addon_BDT_1098_Snaf.d:118","Aber keine Sorge - die Zutaten dafür habe ich bereits.","Spokojnie – mam już przygotowane składniki.","","","DIA_Addon_Snaf_Cook_FEUER_01_02","",""
"Scripts/Content/Story/Dialoge/DIA_Addon_BDT_1098_Snaf.d:123","Hammersauce?","Mocny sos?","","","DIA_Addon_Snaf_Cook_HAMMER_15_00","",""
"Scripts/Content/Story/Dialoge/DIA_Addon_BDT_1098_Snaf.d:124","Eine Sauce aus hammerhartem Schnaps. Ich habe ein Rezept von einem Typen namens Lou.","Sos z bardzo mocnego bimbru. Dostałem ten przepis od niejakiego Lou.","","","DIA_Addon_Snaf_Cook_HAMMER_01_01","",""
"Scripts/Content/Story/Dialoge/DIA_Addon_BDT_1098_Snaf.d:125","Besorg du die Zutaten und brenn den Schnaps oben am Labor- Tisch, dann mache ich daraus eine Sauce. Was meinst du?","Zdobądź składniki i przygotuj bimber w laboratorium, a ja zrobię sos. Co ty na to?","","","DIA_Addon_Snaf_Cook_HAMMER_01_02","",""
"Scripts/Content/Story/Dialoge/DIA_Addon_BDT_1098_Snaf.d:127","Dafür habe ich keine Zeit.","Nie mam na to czasu.","","","DIA_Addon_Snaf_Cook.DIA_Addon_Snaf_Cook_NO","Info_AddChoice",""
"Scripts/Content/Story/Dialoge/DIA_Addon_BDT_1098_Snaf.d:128","Okay, ich mach's. ","Dobrze, zrobię to.","","","DIA_Addon_Snaf_Cook.DIA_Addon_Snaf_Cook_YES","Info_AddChoice",""
"Scripts/Content/Story/Dialoge/DIA_Addon_BDT_1098_Snaf.d:133","Dafür habe ich keine Zeit.","Nie mam na to czasu.","","","DIA_Addon_Snaf_Cook_HAMMER_NO_15_00","",""
"Scripts/Content/Story/Dialoge/DIA_Addon_BDT_1098_Snaf.d:134","Dann vergiss es.","Dobra, nieważne.","","","DIA_Addon_Snaf_Cook_HAMMER_NO_01_01","",""
"Scripts/Content/Story/Dialoge/DIA_Addon_BDT_1098_Snaf.d:142","Okay, ich mach's.","Dobrze, zrobię to.","","","DIA_Addon_Snaf_Cook_HAMMER_YES_15_00","",""
"Scripts/Content/Story/Dialoge/DIA_Addon_BDT_1098_Snaf.d:143","Alles klar. Hier ist das Rezept.","Super. Oto przepis.","","","DIA_Addon_Snaf_Cook_HAMMER_YES_01_01","",""
"Scripts/Content/Story/Dialoge/DIA_Addon_BDT_1098_Snaf.d:165","Ich habe den Schnaps gebrannt.","Przygotowałem bimber.","","","DIA_Addon_Snaf_Booze.description","",""
"Scripts/Content/Story/Dialoge/DIA_Addon_BDT_1098_Snaf.d:179","Ich habe den Schnaps gebrannt.","Przygotowałem bimber.","","","DIA_Addon_Snaf_Booze_15_00","",""
"Scripts/Content/Story/Dialoge/DIA_Addon_BDT_1098_Snaf.d:184","Ausgezeichnet, dann mache ich das mal fertig.","Doskonale, zaraz to dokończę.","","","DIA_Addon_Snaf_Booze_01_01","",""
"Scripts/Content/Story/Dialoge/DIA_Addon_BDT_1098_Snaf.d:185","Hier, du kannst direkt eine Portion probieren. Das macht 'nen starken Arm.","Teraz możesz trochę skosztować. To doda ci sił.","","","DIA_Addon_Snaf_Booze_01_02","",""
"Scripts/Content/Story/Dialoge/DIA_Addon_BDT_1098_Snaf.d:186","Ach, und wenn ich dir nochmal helfen kann ... Alle Informationen sind ab jetzt für dich umsonst.","Poczekaj, jeśli będziesz potrzebować pomocy, wszystkie informacje masz u mnie za darmo.","","","DIA_Addon_Snaf_Booze_01_03","",""
"Scripts/Content/Story/Dialoge/DIA_Addon_BDT_1098_Snaf.d:202","Was weißt du über dieses Attentat?","Co wiesz na temat próby zabójstwa?","","","DIA_Addon_Snaf_Attentat.description","",""
"Scripts/Content/Story/Dialoge/DIA_Addon_BDT_1098_Snaf.d:215","Was weißt du über dieses Attentat?","Co wiesz na temat próby zabójstwa?","","","DIA_Addon_Snaf_Attentat_15_00","",""
"Scripts/Content/Story/Dialoge/DIA_Addon_BDT_1098_Snaf.d:216","Die Sache mit Esteban?","Chodzi o ten zamach na Estebana?","","","DIA_Addon_Snaf_Attentat_01_01","",""
"Scripts/Content/Story/Dialoge/DIA_Addon_BDT_1098_Snaf.d:217","Du weißt doch, wie das läuft. Der Wirt kriegt alles mit, aber ergreift nie Partei für eine Seite ...","Wiesz, skąd wieje wiatr. Oberżysta widzi wszystko, ale nie bierze niczyjej strony...","","","DIA_Addon_Snaf_Attentat_01_02","",""
"Scripts/Content/Story/Dialoge/DIA_Addon_BDT_1098_Snaf.d:220","Sag mir wenigstens zu wem ich gehen kann.","Powiedz mi chociaż, gdzie mogę zdobyć informacje.","","","DIA_Addon_Snaf_Attentat.DIA_Addon_Snaf_Attentat_GoWhere","Info_AddChoice",""
"Scripts/Content/Story/Dialoge/DIA_Addon_BDT_1098_Snaf.d:221","Wenn du an meiner Stelle wärst, was würdest du tun?","Co byś zrobił na moim miejscu?","","","DIA_Addon_Snaf_Attentat.DIA_Addon_Snaf_Attentat_YouBeingMe","Info_AddChoice",""
"Scripts/Content/Story/Dialoge/DIA_Addon_BDT_1098_Snaf.d:222","Also weißt du etwas?","A więc coś wiesz?","","","DIA_Addon_Snaf_Attentat.DIA_Addon_Snaf_Attentat_Something","Info_AddChoice",""
"Scripts/Content/Story/Dialoge/DIA_Addon_BDT_1098_Snaf.d:227","Also weißt du etwas?","A więc coś wiesz?","","","DIA_Addon_Snaf_Attentat_Something_15_00","",""
"Scripts/Content/Story/Dialoge/DIA_Addon_BDT_1098_Snaf.d:228","DAS hab ich nicht gesagt.","TEGO nie powiedziałem.","","","DIA_Addon_Snaf_Attentat_Something_01_01","",""
"Scripts/Content/Story/Dialoge/DIA_Addon_BDT_1098_Snaf.d:233","Sag mir wenigstens, zu wem ich gehen kann.","Powiedz mi chociaż, gdzie mogę zdobyć informacje.","","","DIA_Addon_Snaf_Attentat_GoWhere_15_00","",""
"Scripts/Content/Story/Dialoge/DIA_Addon_BDT_1098_Snaf.d:234","Oh Mann! Das kommt doch auf's selbe raus! Vergiss das!","Na boga! To przecież jedno i to samo! Zapomnij o tym.","","","DIA_Addon_Snaf_Attentat_GoWhere_01_01","",""
"Scripts/Content/Story/Dialoge/DIA_Addon_BDT_1098_Snaf.d:239","Wenn du an meiner Stelle wärst, was würdest du tun?","Co byś zrobił na moim miejscu?","","","DIA_Addon_Snaf_Attentat_YouBeingMe_15_00","",""
"Scripts/Content/Story/Dialoge/DIA_Addon_BDT_1098_Snaf.d:240","Ich würde mir überlegen, was ich über den Auftraggeber weiß.","Zastanowiłbym się, co wiem na temat osoby, która zleciła zabójstwo.","","","DIA_Addon_Snaf_Attentat_YouBeingMe_01_01","",""
"Scripts/Content/Story/Dialoge/DIA_Addon_BDT_1098_Snaf.d:241","Erstens: Es war wahrscheinlich einer der Banditen, das heißt er ist hier im Lager.","Po pierwsze – był to najpewniej jeden z bandytów, czyli jest tutaj, w obozie.","","","DIA_Addon_Snaf_Attentat_YouBeingMe_01_02","",""
"Scripts/Content/Story/Dialoge/DIA_Addon_BDT_1098_Snaf.d:242","Zweitens: Dass er hier im Lager ist, heißt, er beobachtet dich.","Po drugie – skoro jest w obozie, to znaczy, że cię obserwuje.","","","DIA_Addon_Snaf_Attentat_YouBeingMe_01_03","",""
"Scripts/Content/Story/Dialoge/DIA_Addon_BDT_1098_Snaf.d:243","Drittens: Wenn er der Meinung ist, dass du auf Estebans Seite stehst, wird er sich dir nie zu erkennen geben.","Po trzecie – jeśli dojdzie do wniosku, że stoisz po stronie Estebana, to nigdy się nie ujawni.","","","DIA_Addon_Snaf_Attentat_YouBeingMe_01_04","",""
"Scripts/Content/Story/Dialoge/DIA_Addon_BDT_1098_Snaf.d:244","Die INTERESSANTE Frage ist also: Wie stehen deine Chancen, den Auftraggeber zu finden.","Pytanie brzmi – jakie masz szanse na znalezienie tego człowieka?","","","DIA_Addon_Snaf_Attentat_YouBeingMe_01_05","",""
"Scripts/Content/Story/Dialoge/DIA_Addon_BDT_1098_Snaf.d:259","Wie stehen meine Chancen, den Auftraggeber zu finden?","No to jakie mam szanse na znalezienie tego człowieka?","","","DIA_Addon_Snaf_Abrechnung.description","",""
"Scripts/Content/Story/Dialoge/DIA_Addon_BDT_1098_Snaf.d:274","Wie stehen meine Chancen, den Auftraggeber zu finden?","No to jakie mam szanse na znalezienie tego człowieka?","","","DIA_Addon_Snaf_Abrechnung_15_00","",""
"Scripts/Content/Story/Dialoge/DIA_Addon_BDT_1098_Snaf.d:275","Hmmm ...","Hmmm...","","","DIA_Addon_Snaf_Abrechnung_01_01","",""
"Scripts/Content/Story/Dialoge/DIA_Addon_BDT_1098_Snaf.d:280","Ziemlich mies. Einige Leute haben mitbekommen, dass du dich mit Senyan eingelassen hast.","Źle to widzę. Niektórzy zauważyli, że kręcisz się koło Senyana.","","","DIA_Addon_Snaf_Abrechnung_01_02","",""
"Scripts/Content/Story/Dialoge/DIA_Addon_BDT_1098_Snaf.d:281","Du wirst deine Beziehung zu ihm abbrechen müssen, sonst hast du keine Chance, den Auftraggeber des Attentats zu finden.","Musisz zrezygnować ze swoich kontaktów. Inaczej nie znajdziesz osoby, która zleciła zabójstwo.","","","DIA_Addon_Snaf_Abrechnung_01_03","",""
"Scripts/Content/Story/Dialoge/DIA_Addon_BDT_1098_Snaf.d:291","Du hast einen von Estebans Leuten abserviert. Der Mann, den du suchst, wird glauben, du stehst auf seiner Seite.","Musisz załatwić jednego z ludzi Estebana. Człowiek, którego szukasz, uwierzy, że jesteś po jego stronie.","","","DIA_Addon_Snaf_Abrechnung_01_04","",""
"Scripts/Content/Story/Dialoge/DIA_Addon_BDT_1098_Snaf.d:292","Aber er wird sich dir nicht einfach so zu erkennen geben. Du musst schon noch mehr rausfinden.","Ale tak łatwo nie ujawni swojej tożsamości. Musisz wymyślić coś więcej.","","","DIA_Addon_Snaf_Abrechnung_01_05","",""
"Scripts/Content/Story/Dialoge/DIA_Addon_BDT_1098_Snaf.d:296","Finn scheint ziemlich aufgeregt zu sein, seit du mit ihm geredet hast.","Od czasu rozmowy z tobą Finn wygląda na bardzo podekscytowanego.","","","DIA_Addon_Snaf_Abrechnung_01_06","",""
"Scripts/Content/Story/Dialoge/DIA_Addon_BDT_1098_Snaf.d:297","Und jeder hier weiß, dass er gut mit Esteban steht.","A każdy wie, że trzyma się blisko Estebana.","","","DIA_Addon_Snaf_Abrechnung_01_07","",""
"Scripts/Content/Story/Dialoge/DIA_Addon_BDT_1098_Snaf.d:298","Das heißt, du hast ihm wahrscheinlich was erzählt, was er nicht hören wollte.","To znaczy, że powiedziałeś mu coś, czego nie chciał usłyszeć.","","","DIA_Addon_Snaf_Abrechnung_01_08","",""
"Scripts/Content/Story/Dialoge/DIA_Addon_BDT_1098_Snaf.d:299","Dem Mann, den du suchst, wird das gefallen ...","Człowiek, którego szukasz, będzie bardzo zadowolony...","","","DIA_Addon_Snaf_Abrechnung_01_09","",""
"Scripts/Content/Story/Dialoge/DIA_Addon_BDT_1098_Snaf.d:300","Allerdings besteht die Gefahr, dass er damit zu Esteban rennt - (ironisch) aber das weißt du ja selbst ...","Ale istnieje ryzyko, że pobiegnie do Estebana – ale sam o tym przecież wiesz.","","","DIA_Addon_Snaf_Abrechnung_01_10","",""
"Scripts/Content/Story/Dialoge/DIA_Addon_BDT_1098_Snaf.d:305","Es heißt, du hättest Finn gesagt, du würdest für Esteban arbeiten.","Podobno powiedziałeś Finnowi, że chętnie pracowałbyś dla Estebana.","","","DIA_Addon_Snaf_Abrechnung_01_11","",""
"Scripts/Content/Story/Dialoge/DIA_Addon_BDT_1098_Snaf.d:306","Ich weiß ja nicht, was du wirklich vorhast, aber der Mann, den du suchst, wird von jetzt an mit Sicherheit vorsichtiger sein.","Nie wiem, co planujesz, ale człowiek, którego szukasz, będzie teraz bardzo ostrożny.","","","DIA_Addon_Snaf_Abrechnung_01_12","",""
"Scripts/Content/Story/Dialoge/DIA_Addon_BDT_1098_Snaf.d:310","Bis jetzt ist noch alles offen.","No wszystko się może zdarzyć.","","","DIA_Addon_Snaf_Abrechnung_01_13","",""
"Scripts/Content/Story/Dialoge/DIA_Addon_BDT_1098_Snaf.d:318","Danke.","Dziękuję.","","","DIA_Addon_Snaf_Abschied_15_14","",""
"Scripts/Content/Story/Dialoge/DIA_Addon_BDT_1098_Snaf.d:319","(schroff) Hey! Ich hab dir nichts erzählt, was du nicht schon längst wusstest, klar?!","Hej, nie powiedziałem ci nic, czego byś wcześniej nie wiedział, jasne?","","","DIA_Addon_Snaf_Abschied_01_15","",""
"Scripts/Content/Story/Dialoge/DIA_Addon_BDT_1098_Snaf.d:325","Wußte ich's doch ...","No pewnie..","","","DIA_Addon_Snaf_Abschied_15_16","",""
"Scripts/Content/Story/Dialoge/DIA_Addon_BDT_1098_Snaf.d:326","Eben.","Dokładnie.","","","DIA_Addon_Snaf_Abschied_01_17","",""
"Scripts/Content/Story/Dialoge/DIA_Addon_BDT_1098_Snaf.d:340","Huno sagt, ich soll hier jemanden treffen...","Huno mówi, że mam kogoś tu spotkać.","","","DIA_Addon_Snaf_HOCH.description","",""
"Scripts/Content/Story/Dialoge/DIA_Addon_BDT_1098_Snaf.d:353","Huno schickt mich","Przysyła mnie Huno.","","","DIA_Addon_Snaf_HOCH_15_00","",""
"Scripts/Content/Story/Dialoge/DIA_Addon_BDT_1098_Snaf.d:354","Sieht aus, als hättest du deinen Mann gefunden.","Wygląda na to, że znalazłeś swojego człowieka.","","","DIA_Addon_Snaf_HOCH_01_01","",""
"Scripts/Content/Story/Dialoge/DIA_Addon_BDT_1098_Snaf.d:355","Geh doch mal eine Etage höher, dort wartet jemand auf dich.","Idź na górę. Ktoś tam na ciebie czeka.","","","DIA_Addon_Snaf_HOCH_01_02","",""
"Scripts/Content/Story/Dialoge/DIA_Addon_BDT_1098_Snaf.d:376","Was halten die Leute hier von Esteban?","Co ludzie sądzą o Estebanie?","","","DIA_Addon_Snaf_People.description","",""
"Scripts/Content/Story/Dialoge/DIA_Addon_BDT_1098_Snaf.d:390","Was halten die Leute hier von Esteban?","Co ludzie sądzą o Estebanie?","","","DIA_Addon_Snaf_People_15_00","",""
"Scripts/Content/Story/Dialoge/DIA_Addon_BDT_1098_Snaf.d:391","Da musst du schon etwas genauer werden ...","O kogo ci dokładnie chodzi?","","","DIA_Addon_Snaf_People_01_01","",""
"Scripts/Content/Story/Dialoge/DIA_Addon_BDT_1098_Snaf.d:395","Jede Information kostet dich 'ne Kleinigkeit.","Każda informacja kosztuje.","","","DIA_Addon_Snaf_People_01_02","",""
"Scripts/Content/Story/Dialoge/DIA_Addon_BDT_1098_Snaf.d:396","Wie viel?","Ile?","","","DIA_Addon_Snaf_People_15_03","",""
"Scripts/Content/Story/Dialoge/DIA_Addon_BDT_1098_Snaf.d:397","10 Goldstücke!","10 sztuk złota.","","","DIA_Addon_Snaf_People_01_04","",""
"Scripts/Content/Story/Dialoge/DIA_Addon_BDT_1098_Snaf.d:405","Paul.","Paul.","","","DIA_Addon_Snaf_People.DIA_Addon_Snaf_People_Paul","Info_AddChoice",""
"Scripts/Content/Story/Dialoge/DIA_Addon_BDT_1098_Snaf.d:406","Huno.","Huno.","","False","DIA_Addon_Snaf_People.DIA_Addon_Snaf_People_Huno","Info_AddChoice",""
"Scripts/Content/Story/Dialoge/DIA_Addon_BDT_1098_Snaf.d:407","Fisk.","Fisk.","","False","DIA_Addon_Snaf_People.DIA_Addon_Snaf_People_Fisk","Info_AddChoice",""
"Scripts/Content/Story/Dialoge/DIA_Addon_BDT_1098_Snaf.d:408","Emilio.","Emilio.","","False","DIA_Addon_Snaf_People.DIA_Addon_Snaf_People_Emilio","Info_AddChoice",""
"Scripts/Content/Story/Dialoge/DIA_Addon_BDT_1098_Snaf.d:411","Senyan.","Senyan.","","False","DIA_Addon_Snaf_People.DIA_Addon_Snaf_People_Senyan","Info_AddChoice",""
"Scripts/Content/Story/Dialoge/DIA_Addon_BDT_1098_Snaf.d:414","Lennar.","Lennar.","","False","DIA_Addon_Snaf_People.DIA_Addon_Snaf_People_Lennar","Info_AddChoice",""
"Scripts/Content/Story/Dialoge/DIA_Addon_BDT_1098_Snaf.d:415","Finn.","Finn.","","False","DIA_Addon_Snaf_People.DIA_Addon_Snaf_People_Finn","Info_AddChoice",""
"Scripts/Content/Story/Dialoge/DIA_Addon_BDT_1098_Snaf.d:421","Du hast nicht genug Gold, Junge!","Nie masz dość pieniędzy, mały!","","","DIA_Addon_Snaf_NotEnough_01_00","",""
"Scripts/Content/Story/Dialoge/DIA_Addon_BDT_1098_Snaf.d:431","Was ist mit Paul?","Co wiesz na temat Paula?","","","DIA_Addon_Snaf_People_Paul_15_00","",""
"Scripts/Content/Story/Dialoge/DIA_Addon_BDT_1098_Snaf.d:434","Ich glaube, er mag Esteban nicht besonders. Seit er für Huno arbeitet, kommt er nicht mehr in die Mine.","Wydaje mi się, że nie przepada za Estebanem. Pracuje dla Huno, więc nie schodzi już do kopalni.","","","DIA_Addon_Snaf_People_Paul_01_01","",""
"Scripts/Content/Story/Dialoge/DIA_Addon_BDT_1098_Snaf.d:444","Was denkt Huno über Esteban?","Huno lubi Estebana?","","","DIA_Addon_Snaf_People_Huno_15_00","",""
"Scripts/Content/Story/Dialoge/DIA_Addon_BDT_1098_Snaf.d:445","Ah! Huno. Über den weiß ich so gut wie nichts.","Ha. Huno. Właściwie nic o nim nie wiem.","","","DIA_Addon_Snaf_People_Huno_01_01","",""
"Scripts/Content/Story/Dialoge/DIA_Addon_BDT_1098_Snaf.d:446","(grinst) Diese Information ist natürlich gratis.","Ta informacja jest za darmo.","","","DIA_Addon_Snaf_People_Huno_01_02","",""
"Scripts/Content/Story/Dialoge/DIA_Addon_BDT_1098_Snaf.d:451","Was ist mit Fisk?","Co możesz mi powiedzieć o Fisku?","","","DIA_Addon_Snaf_People_Fisk_15_00","",""
"Scripts/Content/Story/Dialoge/DIA_Addon_BDT_1098_Snaf.d:454","Fisk ist Fisk. Er bezahlt seinen Teil an Esteban und verteilt die Waren, die er größtenteils von den Piraten bekommt.","Fisk to Fisk. Płaci haracz Estebanowi i oddaje mu część towarów, które dostaje od piratów.","","","DIA_Addon_Snaf_People_Fisk_01_01","",""
"Scripts/Content/Story/Dialoge/DIA_Addon_BDT_1098_Snaf.d:455","Ich denke, Esteban ist ihm ziemlich egal.","Wydaje mi się jednak, że Esteban za bardzo go nie obchodzi.","","","DIA_Addon_Snaf_People_Fisk_01_02","",""
"Scripts/Content/Story/Dialoge/DIA_Addon_BDT_1098_Snaf.d:465","Emilio. Was denkt er über Esteban?","Co Emilio sądzi o Estebanie?","","","DIA_Addon_Snaf_People_Emilio_15_00","",""
"Scripts/Content/Story/Dialoge/DIA_Addon_BDT_1098_Snaf.d:468","Ich denke, er würde nicht gerade Blumen an Estebans Grab bringen, wenn du verstehst, was ich meine.","Wydaje mi się, że nie zapaliłby świeczki na jego grobie. Rozumiesz, o czym mówię?","","","DIA_Addon_Snaf_People_Emilio_01_01","",""
"Scripts/Content/Story/Dialoge/DIA_Addon_BDT_1098_Snaf.d:478","Was ist mit Senyan?","Co powiesz o Senyanie?","","","DIA_Addon_Snaf_People_Senyan_15_00","",""
"Scripts/Content/Story/Dialoge/DIA_Addon_BDT_1098_Snaf.d:481","Senyan ist einer von Estebans Jungs. Er arbeitet schon 'ne ganze Weile für ihn.","Senyan jest jednym z ludzi Estebana. Pracuje dla niego już od pewnego czasu.","","","DIA_Addon_Snaf_People_Senyan_01_01","",""
"Scripts/Content/Story/Dialoge/DIA_Addon_BDT_1098_Snaf.d:491","Was denkt Lennar über Esteban?","Co Lennar myśli o Estebanie?","","","DIA_Addon_Snaf_People_Lennar_15_00","",""
"Scripts/Content/Story/Dialoge/DIA_Addon_BDT_1098_Snaf.d:492","So wie ich das beurteilen kann, denkt Lennar GAR nicht.","O ile dobrze wiem, Lennar NIE myśli.","","","DIA_Addon_Snaf_People_Lennar_01_01","",""
"Scripts/Content/Story/Dialoge/DIA_Addon_BDT_1098_Snaf.d:497","Was ist mit Finn?","Co mi powiesz o Finnie?","","","DIA_Addon_Snaf_People_Finn_15_00","",""
"Scripts/Content/Story/Dialoge/DIA_Addon_BDT_1098_Snaf.d:500","Ein guter Buddler. Er hat 'ne Nase für's Gold.","Dobry kopacz. Ma zmysł do szukania złota.","","","DIA_Addon_Snaf_People_Finn_01_01","",""
"Scripts/Content/Story/Dialoge/DIA_Addon_BDT_1098_Snaf.d:501","Esteban bevorzugt ihn deswegen. Ich denke, er steht ganz gut mit ihm.","Z tego powodu Esteban go szanuje. Wydaje mi się, że się nawzajem dobrze dogadują.","","","DIA_Addon_Snaf_People_Finn_01_02","",""
"Scripts/Content/Story/Dialoge/DIA_Addon_BDT_1098_Snaf.d:518","Was hältst DU von Esteban?","A jakie jest TWOJE zdanie o Estebanie?","","","DIA_Addon_Snaf_Himself.description","",""
"Scripts/Content/Story/Dialoge/DIA_Addon_BDT_1098_Snaf.d:532","Was hältst DU von Esteban?","A jakie jest TWOJE zdanie o Estebanie?","","","DIA_Addon_Snaf_Himself_15_00","",""
"Scripts/Content/Story/Dialoge/DIA_Addon_BDT_1098_Snaf.d:533","Wer über ihn redet, ist schnell tot ...","Kto o nim mówi, szybko kończy martwy...","","","DIA_Addon_Snaf_Himself_01_01","",""
"Scripts/Content/Story/Dialoge/DIA_Addon_BDT_1098_Snaf.d:548","Wie läuft der Laden?","Jak idą interesy?","","","DIA_Addon_Snaf_PERM.description","",""
"Scripts/Content/Story/Dialoge/DIA_Addon_BDT_1098_Snaf.d:561","Wie läuft der Laden?","Jak idą interesy?","","","DIA_Addon_Snaf_PERM_15_00","",""
"Scripts/Content/Story/Dialoge/DIA_Addon_BDT_1098_Snaf.d:562","Gut! Estebans Ableben dürfte wohl für einige hier ein Grund zum Feiern sein ...","Cóż. Śmierć Estebana jest dla paru osób okazją do świętowania...","","","DIA_Addon_Snaf_PERM_01_01","",""
"Scripts/Content/Story/Dialoge/DIA_Addon_BDT_1099_Huno.d:92","Was willst du noch? Verpiss dich!","Czego jeszcze chcesz? Spadaj!","","","DIA_Addon_Huno_Abwimmeln_06_00","",""
"Scripts/Content/Story/Dialoge/DIA_Addon_BDT_1099_Huno.d:96","Worauf wartest du? Geh in die Kneipe!","Na co czekasz? Idź się napić!","","","DIA_Addon_Huno_Abwimmeln_06_01","",""
"Scripts/Content/Story/Dialoge/DIA_Addon_BDT_1099_Huno.d:114","Wie's aussieht, beherrschst du dein Handwerk.","Od razu widać, że znasz się na swoim fachu.","","","DIA_Addon_Huno_Hi.description","",""
"Scripts/Content/Story/Dialoge/DIA_Addon_BDT_1099_Huno.d:124","Wie's aussieht, beherrschst du dein Handwerk.","Od razu widać, że znasz się na swoim fachu.","","","DIA_Addon_Huno_Hi_15_00","",""
"Scripts/Content/Story/Dialoge/DIA_Addon_BDT_1099_Huno.d:125","Das habe ich doch schon mal gehört ... bringst du den Stahl?","Już to kiedyś słyszałem... przynosisz stal?","","","DIA_Addon_Huno_Hi_06_01","",""
"Scripts/Content/Story/Dialoge/DIA_Addon_BDT_1099_Huno.d:126","Stahl? Nein, ich denke, du verwechselst mich ...","Stal? Nie, chyba mnie z kimś pomyliłeś...","","","DIA_Addon_Huno_Hi_15_02","",""
"Scripts/Content/Story/Dialoge/DIA_Addon_BDT_1099_Huno.d:127","Hm ... irgendwie kommst du mir bekannt vor. Kennen wir uns irgendwo her?","Hmm... wyglądasz znajomo. Spotkaliśmy się wcześniej?","","","DIA_Addon_Huno_Hi_06_03","",""
"Scripts/Content/Story/Dialoge/DIA_Addon_BDT_1099_Huno.d:130","Klar, aus dem alten Lager.","Oczywiście, w Starym Obozie.","","","DIA_Addon_Huno_Hi.DIA_Addon_Huno_Hi_JA","Info_AddChoice",""
