"location","source","target","id","fuzzy","context","translator_comments","developer_comments"
"Scripts/Content/Story/Dialoge/DIA_NONE_100_Xardas.d:824","Du solltest inzwischen in die Stadt gehen und dort mit dem Wassermagier Vatras sprechen. Ich könnte mir vorstellen, dass er weiß, was zu tun ist.","W międzyczasie powinieneś udać się do miasta i porozmawiać z Magiem Wody imieniem Vatras. Może on będzie wiedział, co wypada czynić dalej.","","","DIA_Xardas_INNOSEYEBROKEN_wasnun_14_02","",""
"Scripts/Content/Story/Dialoge/DIA_NONE_100_Xardas.d:840","Vatras hat mich zu dir geschickt.","Vatras przysłał mnie do ciebie.","","","DIA_Xardas_RITUALREQUEST.description","",""
"Scripts/Content/Story/Dialoge/DIA_NONE_100_Xardas.d:855","Vatras hat mich zu dir geschickt.","Vatras przysłał mnie do ciebie.","","","DIA_Xardas_RITUALREQUEST_15_00","",""
"Scripts/Content/Story/Dialoge/DIA_NONE_100_Xardas.d:856","Das ist gut. Was hat er gesagt?","To dobrze. Co ci powiedział?","","","DIA_Xardas_RITUALREQUEST_14_01","",""
"Scripts/Content/Story/Dialoge/DIA_NONE_100_Xardas.d:857","Er sagte etwas von einem Umkehrritual am Sonnenkreis.","Wspomniał coś o rytuale odwrócenia, który należy odprawić w Słonecznym Kręgu.","","","DIA_Xardas_RITUALREQUEST_15_02","",""
"Scripts/Content/Story/Dialoge/DIA_NONE_100_Xardas.d:858","(lacht) Der alte Teufel. Ich ahne schon, was er vor hat. Du bist gekommen, um mich zu ihm zu rufen.","Ten stary wyga! Chyba wiem, co planuje. Przybywasz, by przekazać mi jego zaproszenie?","","","DIA_Xardas_RITUALREQUEST_14_03","",""
"Scripts/Content/Story/Dialoge/DIA_NONE_100_Xardas.d:859","So sieht's aus. Wann wirst du aufbrechen?","Na to wygląda. Kiedy wyruszysz?","","","DIA_Xardas_RITUALREQUEST_15_04","",""
"Scripts/Content/Story/Dialoge/DIA_NONE_100_Xardas.d:865","Ich werde Vatras nicht warten lassen und mache mich sofort auf den Weg. Erledige deine Aufgaben und komm dann später nach.","Bezzwłocznie. Ty musisz jeszcze wypełnić swoje zadania. Potem znów się spotkamy.","","","DIA_Xardas_RITUALREQUEST_14_05","",""
"Scripts/Content/Story/Dialoge/DIA_NONE_100_Xardas.d:874","Ich werde erst dem Ritual beiwohnen, wenn ich mir sicher bin, dass du bereit bist, den Drachen die Stirn zu bieten.","Pomogę przy odprawianiu rytuału, dopiero gdy będę miał pewność, że jesteś gotów stawić czoła smokom.","","","DIA_Xardas_RITUALREQUEST_14_06","",""
"Scripts/Content/Story/Dialoge/DIA_NONE_100_Xardas.d:889","Warum gehst du nicht jetzt GLEICH zu Vatras?","Dlaczego nie pójdziesz do Vatrasa od razu?","","","DIA_Xardas_WARUMNICHTJETZT.description","",""
"Scripts/Content/Story/Dialoge/DIA_NONE_100_Xardas.d:905","Warum gehst du nicht jetzt GLEICH zu Vatras? Manchmal verstehe ich dich nicht.","Dlaczego od razu nie pójdziesz do Vatrasa?","","","DIA_Xardas_WARUMNICHTJETZT_15_00","",""
"Scripts/Content/Story/Dialoge/DIA_NONE_100_Xardas.d:906","Erst gab es nichts Wichtigeres als das Auge Innos' und nun, wo du dich selbst bewegen musst, da kneifst du.","Czasem cię po prostu nie rozumiem.","","","DIA_Xardas_WARUMNICHTJETZT_15_01","",""
"Scripts/Content/Story/Dialoge/DIA_NONE_100_Xardas.d:907","(verärgert) Sprich nicht in diesem Ton mit mir. Ohne MICH würde dein armseliger Körper noch im Tempel liegen und vermodern.","Nigdy nie zwracaj się do mnie tym tonem! Gdyby nie JA, twoje szczątki gniłyby teraz w świątyni Śniącego!","","","DIA_Xardas_WARUMNICHTJETZT_14_02","",""
"Scripts/Content/Story/Dialoge/DIA_NONE_100_Xardas.d:909","Schon gut. Sag mir einfach, was ich tun muß.","Mniejsza z tym. Powiedz tylko, co mam zrobić.","","","DIA_Xardas_WARUMNICHTJETZT.DIA_Xardas_WARUMNICHTJETZT_wastun","Info_AddChoice",""
"Scripts/Content/Story/Dialoge/DIA_NONE_100_Xardas.d:910","Dann erkläre mir wenigstens den Grund deines Zögerns.","Więc wyjaśnij mi chociaż, dlaczego się wahasz.","","","DIA_Xardas_WARUMNICHTJETZT.DIA_Xardas_WARUMNICHTJETZT_grund","Info_AddChoice",""
"Scripts/Content/Story/Dialoge/DIA_NONE_100_Xardas.d:915","Dann erkläre mir wenigstens den Grund deines Zögerns.","Więc wyjaśnij mi chociaż, dlaczego się wahasz.","","","DIA_Xardas_WARUMNICHTJETZT_grund_15_00","",""
"Scripts/Content/Story/Dialoge/DIA_NONE_100_Xardas.d:916","Seit ich mich von den Feuermagiern abgewendet habe, bin ich ihnen aus dem Weg gegangen.","Odkąd opuściłem Magów Ognia, starałem się trzymać od nich możliwie daleko.","","","DIA_Xardas_WARUMNICHTJETZT_grund_14_01","",""
"Scripts/Content/Story/Dialoge/DIA_NONE_100_Xardas.d:917","Ich bin auch nicht gewillt, das zu ändern, es sei denn, ich habe keine andere Wahl.","I nie zamierzam tego zmieniać, tak długo, jak to możliwe.","","","DIA_Xardas_WARUMNICHTJETZT_grund_14_02","",""
"Scripts/Content/Story/Dialoge/DIA_NONE_100_Xardas.d:918","Doch bevor ich mich den strafenden Blicken der Magier aussetze, will ich mir erst sicher sein, dass du überhaupt den Hauch einer Chance gegen die Drachen hast.","Więc zanim znów stanę przed mymi dawnymi towarzyszami, chcę mieć absolutną pewność, że nie robię tego na darmo. Musisz być gotów do walki ze smokami!","","","DIA_Xardas_WARUMNICHTJETZT_grund_14_03","",""
"Scripts/Content/Story/Dialoge/DIA_NONE_100_Xardas.d:919","Mit deiner schäbigen Ausrüstung wirst du jedoch nicht weit kommen. Komm erst wieder, wenn du stark genug bist.","Z takim wyposażeniem daleko jednak nie zajdziesz. Wróć do mnie, gdy będziesz wystarczająco silny.","","","DIA_Xardas_WARUMNICHTJETZT_grund_14_04","",""
"Scripts/Content/Story/Dialoge/DIA_NONE_100_Xardas.d:925","Schon gut. Sag mir einfach, was ich tun muss.","Mniejsza z tym. Powiedz tylko, co mam zrobić.","","","DIA_Xardas_WARUMNICHTJETZT_wastun_15_00","",""
"Scripts/Content/Story/Dialoge/DIA_NONE_100_Xardas.d:926","Du bist noch zu schwach für den Kampf gegen die Drachen. Mit der Ausrüstung hast du nicht einmal den Hauch einer Chance.","Jesteś jeszcze zbyt słaby, by zmierzyć się ze smokiem.","","","DIA_Xardas_WARUMNICHTJETZT_wastun_14_01","",""
"Scripts/Content/Story/Dialoge/DIA_NONE_100_Xardas.d:927","Komm erst wieder, wenn du dich besser vorbereitet hast. Dann werde ich mich Vatras anschließen.","Wróć, gdy będziesz odpowiednio przygotowany. Wtedy udam się na spotkanie z Vatrasem.","","","DIA_Xardas_WARUMNICHTJETZT_wastun_14_02","",""
"Scripts/Content/Story/Dialoge/DIA_NONE_100_Xardas.d:940","Ich bin bereit für den Kampf gegen die Drachen.","Jestem gotów, by zmierzyć się ze smokami.","","","DIA_Xardas_BEREIT.description","",""
"Scripts/Content/Story/Dialoge/DIA_NONE_100_Xardas.d:956","Ich bin bereit für den Kampf gegen die Drachen.","Jestem gotów, by zmierzyć się ze smokami.","","","DIA_Xardas_BEREIT_15_00","",""
"Scripts/Content/Story/Dialoge/DIA_NONE_100_Xardas.d:957","Dann lass uns keine Zeit verlieren. Ich werde umgehend zum Sonnenkreis aufbrechen. Erledige deine Aufgaben. Wir treffen uns dann dort.","Zatem nie ma czasu do stracenia. Natychmiast wyruszam w drogę do Słonecznego Kręgu. Wypełnij swoje zadania. Spotkamy się na miejscu.","","","DIA_Xardas_BEREIT_14_01","",""
"Scripts/Content/Story/Dialoge/DIA_NONE_100_Xardas.d:975","Wird das Umkehrritual funktionieren?","Czy ten rytuał odwrócenia ma szansę się powieść?","","","DIA_Xardas_BINGESPANNT.description","",""
"Scripts/Content/Story/Dialoge/DIA_NONE_100_Xardas.d:990","Wird das Umkehrritual funktionieren?","Czy ten rytuał odwrócenia ma szansę się powieść?","","","DIA_Xardas_BINGESPANNT_15_00","",""
"Scripts/Content/Story/Dialoge/DIA_NONE_100_Xardas.d:991","Ich bin mir nicht sicher. Kommt darauf an, was Vatras genau tun wird.","Nie możemy mieć pewności. Wszystko zależy od szczegółów planu Vatrasa.","","","DIA_Xardas_BINGESPANNT_14_01","",""
"Scripts/Content/Story/Dialoge/DIA_NONE_100_Xardas.d:1003","Pyrokar weigert sich, zum Ritual zu erscheinen.","Pyrokar nie chce się stawić na spotkanie.","","","DIA_Xardas_PYROWILLNICHT.description","",""
"Scripts/Content/Story/Dialoge/DIA_NONE_100_Xardas.d:1018","Pyrokar weigert sich, zum Ritual zu erscheinen.","Pyrokar nie chce się stawić na spotkanie.","","","DIA_Xardas_PYROWILLNICHT_15_00","",""
"Scripts/Content/Story/Dialoge/DIA_NONE_100_Xardas.d:1019","Er will erst einen Beweis dafür, dass er dir vertrauen kann.","Domaga się dowodu, że można ci zaufać.","","","DIA_Xardas_PYROWILLNICHT_15_01","",""
"Scripts/Content/Story/Dialoge/DIA_NONE_100_Xardas.d:1020","So so. Pyrokar also. Mmh, interessant.","Czyżby? Pyrokar, tak? To ciekawe.","","","DIA_Xardas_PYROWILLNICHT_14_02","",""
"Scripts/Content/Story/Dialoge/DIA_NONE_100_Xardas.d:1021","Der alte Zausel wird langsam lästig. Aber ich denke, ich habe da etwas für dich, was dir helfen kann.","Ten stary cap zaczyna mnie irytować. Ale chyba mam tu coś, co może go przekonać.","","","DIA_Xardas_PYROWILLNICHT_14_03","",""
"Scripts/Content/Story/Dialoge/DIA_NONE_100_Xardas.d:1022","Damals, als ich den Orden der Feuermagier verließ, habe ich einige Dinge aus dem Kloster mit mir genommen.","Opuszczając Zakon Magów Ognia, zabrałem ze sobą kilka drobiazgów.","","","DIA_Xardas_PYROWILLNICHT_14_04","",""
"Scripts/Content/Story/Dialoge/DIA_NONE_100_Xardas.d:1025","Ich wollte nicht, dass eines Tages eine Truppe von Paladinen oder Feuermagiern meinen Turm auf den Kopf stellt und den Kram bei mir findet.","Nie chcę, by oddział paladynów i magów przetrząsnął moją wieżę i znalazł te rzeczy.","","","DIA_Xardas_PYROWILLNICHT_14_06","",""
"Scripts/Content/Story/Dialoge/DIA_NONE_100_Xardas.d:1026","Also habe ich sie an sichere Orte gebracht, an dem die Magier sicherlich nicht danach suchen würden.","Dlatego ukryłem je w bezpiecznym miejscu, w którym magowie nigdy nie będą ich szukać.","","","DIA_Xardas_PYROWILLNICHT_14_07","",""
"Scripts/Content/Story/Dialoge/DIA_NONE_100_Xardas.d:1027","Und wo?","Gdzie dokładnie?","","","DIA_Xardas_PYROWILLNICHT_15_08","",""
"Scripts/Content/Story/Dialoge/DIA_NONE_100_Xardas.d:1028","Ein Teil davon liegt in einer Truhe verschlossen auf Sekobs Bauernhof.","Część z nich leży zamknięta w skrzyni na farmie Sekoba.","","","DIA_Xardas_PYROWILLNICHT_14_09","",""
"Scripts/Content/Story/Dialoge/DIA_NONE_100_Xardas.d:1030","Du traust diesem Sekob?","Ufasz temu Sekobowi?","","","DIA_Xardas_PYROWILLNICHT_15_10","",""
"Scripts/Content/Story/Dialoge/DIA_NONE_100_Xardas.d:1031","Nein. Aber er ist käuflich und stellt keine unangenehmen Fragen. Außerdem habe ich die Truhe verschlossen. Hier ist der Schlüssel.","Nie, ale można go kupić, a wtedy nie zadaje niewygodnych pytań. Poza tym - skrzynia jest zamknięta. Oto klucz.","","","DIA_Xardas_PYROWILLNICHT_14_11","",""
"Scripts/Content/Story/Dialoge/DIA_NONE_100_Xardas.d:1036","Es ist ein sehr altes Buch dabei. Wenn Pyrokar dieses Buch bekommt, wird er wissen, dass es von mir kommt.","Znajdziesz tam między innymi pewną starą księgę. Gdy Pyrokar ją zobaczy, będzie wiedział, że to prezent ode mnie.","","","DIA_Xardas_PYROWILLNICHT_14_12","",""
"Scripts/Content/Story/Dialoge/DIA_NONE_100_Xardas.d:1037","Ich habe keine Verwendung mehr dafür. Vielleicht erfüllt es ja somit noch einen Zweck.","Ja już nie będę miał z niej pożytku, więc przynajmniej tobie na coś się przyda.","","","DIA_Xardas_PYROWILLNICHT_14_13","",""
"Scripts/Content/Story/Dialoge/DIA_NONE_100_Xardas.d:1064","Nun, da das Auge Innos geheilt ist, mußt du den Drachen entgegentreten!","Teraz, gdy Oko Innosa zostało naprawione, musisz stawić czoła smokom.","","","DIA_Xardas_Add_14_06","",""
"Scripts/Content/Story/Dialoge/DIA_NONE_100_Xardas.d:1065","Sie alle dienen Beliar, dem Gott der Finsternis.","Wszystkie one są sługami Beliara, boga ciemności.","","","DIA_Xardas_Add_14_07","",""
"Scripts/Content/Story/Dialoge/DIA_NONE_100_Xardas.d:1066","Aber es muß eine irdische Macht geben, die sie kontrolliert. Soviel ist mir inzwischen klar.","Ale bezpośrednie rozkazy muszą otrzymywać z tego świata. Tyle udało mi się do tej pory ustalić.","","","DIA_Xardas_Add_14_08","",""
"Scripts/Content/Story/Dialoge/DIA_NONE_100_Xardas.d:1067","Finde heraus, was die Quelle dieser Macht ist.","Dowiedz się, co jest źródłem ich potęgi.","","","DIA_Xardas_Add_14_09","",""
"Scripts/Content/Story/Dialoge/DIA_NONE_100_Xardas.d:1068","Sobald du etwas herausgefunden hast, kommst du zu mir zurück!","Potem wracaj czym prędzej do mnie.","","","DIA_Xardas_Add_14_10","",""
"Scripts/Content/Story/Dialoge/DIA_NONE_100_Xardas.d:1091","Das Auge Innos' ist geheilt, was nun?","Oko Innosa zostało naprawione. Co teraz?","","","DIA_Xardas_WASNUN.description","",""
"Scripts/Content/Story/Dialoge/DIA_NONE_100_Xardas.d:1105","Das Auge Innos' ist geheilt, was nun?","Oko Innosa zostało naprawione. Co teraz?","","","DIA_Xardas_WASNUN_15_00","",""
"Scripts/Content/Story/Dialoge/DIA_NONE_100_Xardas.d:1106","Vergiss nicht, es zu tragen, wenn du gegen die Drachen antrittst.","Pamiętaj, by zakładać je za każdym razem, gdy przyjdzie ci walczyć ze smokiem.","","","DIA_Xardas_WASNUN_14_01","",""
"Scripts/Content/Story/Dialoge/DIA_NONE_100_Xardas.d:1110","Verliere keine Zeit. Geh nun ins Minental und töte die Drachen.","Nie trać czasu. Zejdź teraz do Górniczej Doliny i rozpraw się ze smokami.","","","DIA_Xardas_WASNUN_14_02","",""
"Scripts/Content/Story/Dialoge/DIA_NONE_100_Xardas.d:1114","Geh zu Pyrokar und lass dir von ihm den Umgang mit dem Auge erklären.","Idź do Pyrokara. Niech ci wyjaśni, jak posługiwać się Okiem.","","","DIA_Xardas_WASNUN_14_03","",""
"Scripts/Content/Story/Dialoge/DIA_NONE_100_Xardas.d:1162","Was gibt es neues?","Co nowego?","","","DIA_Xardas_PERM4.description","",""
"Scripts/Content/Story/Dialoge/DIA_NONE_100_Xardas.d:1175","Was gibt es Neues?","Co nowego?","","","DIA_Xardas_PERM4_15_00","",""
"Scripts/Content/Story/Dialoge/DIA_NONE_100_Xardas.d:1176","Die Suchenden sind noch nicht gegangen. Sie werden nicht eher ruhen, bis sie dich zur Strecke gebracht haben.","Poszukiwacze nadal kręcą się w pobliżu. Nie spoczną, póki nie przeciągną cię na swoją stronę.","","","DIA_Xardas_PERM4_14_01","",""
"Scripts/Content/Story/Dialoge/DIA_NONE_100_Xardas.d:1177","Töte die Drachen im Minental und finde heraus, wer hinter diesen Angriffen steckt. Sonst wird ihre Übermacht nur noch größer.","Zabij smoki z Górniczej Doliny i dowiedz się, kto stoi za tymi atakami. W przeciwnym wypadku ich siła jeszcze wzrośnie!","","","DIA_Xardas_PERM4_14_02","",""
"Scripts/Content/Story/Dialoge/DIA_NONE_101_Mario.d:34","Was machst du hier?","Co tu porabiasz?","","","DIA_None_101_Mario_Job.description","",""
"Scripts/Content/Story/Dialoge/DIA_NONE_101_Mario.d:49","Was machst du hier?","Co porabiasz?","","","DIA_None_101_Mario_Job_15_00","",""
"Scripts/Content/Story/Dialoge/DIA_NONE_101_Mario.d:50","Ich hoffe, dass hier in absehbarer Zeit ein Schiff reinkommt, auf dem ich anheuern kann.","Czekam w nadziei, że już niedługo zawinie do portu jakiś statek, na który można będzie się zaciągnąć.","","","DIA_None_101_Mario_Job_07_01","",""
"Scripts/Content/Story/Dialoge/DIA_NONE_101_Mario.d:51","Das Rumgehänge geht mir ganz schön auf die Nerven.","Od tej bezczynności człowiek zaczyna wariować.","","","DIA_None_101_Mario_Job_07_02","",""
"Scripts/Content/Story/Dialoge/DIA_NONE_101_Mario.d:77","Ich hab gehört, du suchst Leute für dein Schiff?","Słyszałem, że szukasz załogi na statek, czy to prawda?","","","DIA_None_101_Mario_YouNeedMe_07_00","",""
"Scripts/Content/Story/Dialoge/DIA_NONE_101_Mario.d:78","Und?","I co z tego?","","","DIA_None_101_Mario_YouNeedMe_15_01","",""
"Scripts/Content/Story/Dialoge/DIA_NONE_101_Mario.d:79","Ich bin dabei!","Wpisz mnie na listę!","","","DIA_None_101_Mario_YouNeedMe_07_02","",""
"Scripts/Content/Story/Dialoge/DIA_NONE_101_Mario.d:95","Warum sollte ich dich mitnehmen?","Dlaczego miałbym cię ze sobą zabrać?","","","DIA_None_101_Mario_WhyNeedYou.description","",""
"Scripts/Content/Story/Dialoge/DIA_NONE_101_Mario.d:109","Warum sollte ich dich mitnehmen?","Dlaczego miałbym cię ze sobą zabrać?","","","DIA_None_101_Mario_WhyNeedYou_15_00","",""
"Scripts/Content/Story/Dialoge/DIA_NONE_101_Mario.d:110","Ganz einfach, weil du mich brauchst.","Po prostu... Potrzebujesz mnie.","","","DIA_None_101_Mario_WhyNeedYou_07_01","",""
"Scripts/Content/Story/Dialoge/DIA_NONE_101_Mario.d:111","Ich bin ... ich war Leutnant bei der Königlichen Kriegsmarine.","Jestem... Byłem porucznikiem marynarki królewskiej.","","","DIA_None_101_Mario_WhyNeedYou_07_02","",""
"Scripts/Content/Story/Dialoge/DIA_NONE_101_Mario.d:112","Ich habe als Seesoldat auf der König Rhobar und auf der Myrtanas Stolz gedient.","Służyłem jako marynarz na 'Królu Rhobarze' i Dumie Myrtany'.","","","DIA_None_101_Mario_WhyNeedYou_07_03","",""
"Scripts/Content/Story/Dialoge/DIA_NONE_101_Mario.d:113","In der Schlacht um das Östliche Archipel habe ich eigenhändig zwei Dutzend Orks zurück in Beliars Reich geschickt.","W bitwie o Wschodni Archipelag własnoręcznie wysłałem z tuzin orków z powrotem do świata Beliara.","","","DIA_None_101_Mario_WhyNeedYou_07_04","",""
"Scripts/Content/Story/Dialoge/DIA_NONE_101_Mario.d:114","Leider waren wir zu wenige, nachdem unser Flaggschiff versenkt worden ist, mussten wir uns zurückziehen.","Niestety, było nas zbyt mało, po zatonięciu okrętu flagowego zostaliśmy zmuszeniu do odwrotu.","","","DIA_None_101_Mario_WhyNeedYou_07_05","",""
"Scripts/Content/Story/Dialoge/DIA_NONE_101_Mario.d:126","Wieso bist du dann hier? ","Co tu właściwie robisz?","","","DIA_None_101_Mario_WhyHere.description","",""
"Scripts/Content/Story/Dialoge/DIA_NONE_101_Mario.d:140","Wieso bist du dann hier?","Co tu właściwie robisz?","","","DIA_None_101_Mario_WhyHere_15_00","",""
"Scripts/Content/Story/Dialoge/DIA_NONE_101_Mario.d:141","Die Flotte ist geschlagen und die Soldkassen sind leer.","Flota została rozgromiona, kufry puste.","","","DIA_None_101_Mario_WhyHere_07_01","",""
"Scripts/Content/Story/Dialoge/DIA_NONE_101_Mario.d:142","Nach meiner Entlassung bin ich dann hier in diesem Nest gestrandet und suche eine neue Heuer.","Po odejściu ze służby wylądowałem w tej dziurze. Staram się gdzieś zaczepić.","","","DIA_None_101_Mario_WhyHere_07_02","",""
"Scripts/Content/Story/Dialoge/DIA_NONE_101_Mario.d:154","Was kannst du?","Co właściwie potrafisz?","","","DIA_None_101_Mario_Abilities.description","",""
"Scripts/Content/Story/Dialoge/DIA_NONE_101_Mario.d:168","Was kannst du?","Co właściwie potrafisz?","","","DIA_None_101_Mario_Abilities_15_00","",""
"Scripts/Content/Story/Dialoge/DIA_NONE_101_Mario.d:169","Ich bin ausgebildet für den Enterkrieg und im Nahkampf, ferner bin ich ein ganz brauchbarer Schütze mit der Schiffskanone.","Jestem mistrzem abordażu i walki w zwarciu. Jeśli trzeba, poradzę sobie także z obsługą działa pokładowego.","","","DIA_None_101_Mario_Abilities_07_01","",""
"Scripts/Content/Story/Dialoge/DIA_NONE_101_Mario.d:170","Ich wette, es gibt die eine oder andere Sache, die ich dir auf der Reise beibringen kann.","Założę się, że w czasie naszej podróży mógłbym cię nauczyć tego i owego.","","","DIA_None_101_Mario_Abilities_07_02","",""
"Scripts/Content/Story/Dialoge/DIA_NONE_101_Mario.d:184","Was verlangst du?","O co więc mnie prosisz?","","","DIA_None_101_Mario_YourPrice.description","",""
"Scripts/Content/Story/Dialoge/DIA_NONE_101_Mario.d:198","Was verlangst du?","O co więc mnie prosisz?","","","DIA_None_101_Mario_YourPrice_15_00","",""
"Scripts/Content/Story/Dialoge/DIA_NONE_101_Mario.d:199","Was kann ich denn verlangen? Ich bin froh, wenn ich von hier wegkomme.","A o cóż mogę prosić? Chcę się stąd po prostu wydostać.","","","DIA_None_101_Mario_YourPrice_07_01","",""
"Scripts/Content/Story/Dialoge/DIA_NONE_101_Mario.d:200","Hand gegen Koje. Ich helfe dir und dafür nimmst du mich mit.","Pomóż mi stąd uciec, jeśli weźmiesz mnie ze sobą, nie pożałujesz.","","","DIA_None_101_Mario_YourPrice_07_02","",""
"Scripts/Content/Story/Dialoge/DIA_NONE_101_Mario.d:212","Die Reise kann gefährlich werden.","Podróż może być niebezpieczna.","","","DIA_None_101_Mario_CouldBeDangerous.description","",""
"Scripts/Content/Story/Dialoge/DIA_NONE_101_Mario.d:226","Die Reise kann gefährlich werden.","Podróż może być niebezpieczna.","","","DIA_None_101_Mario_CouldBeDangerous_15_00","",""
"Scripts/Content/Story/Dialoge/DIA_NONE_101_Mario.d:227","Ich bin Gefahr gewohnt. Wenn du da draußen bist, ist jeder Tag gefährlich.","Przywykłem do niebezpieczeństw. Na morzu każdy dzień to walka o przetrwanie.","","","DIA_None_101_Mario_CouldBeDangerous_07_01","",""
"Scripts/Content/Story/Dialoge/DIA_NONE_101_Mario.d:228","Der nächste Sturm kann dein Tod sein und die Ungeheuer aus den Tiefen können dein ganzes Schiff am Stück verschlingen.","Każda burza, każdy sztorm może przynieść kres twemu życiu. Nie mówiąc już o morskich potworach, zdolnych połknąć statek w całości.","","","DIA_None_101_Mario_CouldBeDangerous_07_02","",""
"Scripts/Content/Story/Dialoge/DIA_NONE_101_Mario.d:229","Die Orkischen Galeeren muss ich wohl nicht extra erwähnen oder? Glaub mir, es gibt nichts, wovor ich Angst habe. Ein Seemann, der Angst hat, ist schon tot","O orkowych galerach nawet nie wspominam. Zaufaj mi, trudno mnie przestraszyć. Tchórzliwy marynarz to martwy marynarz.","","","DIA_None_101_Mario_CouldBeDangerous_07_03","",""
"Scripts/Content/Story/Dialoge/DIA_NONE_101_Mario.d:241","Ich kann dich nicht gebrauchen.","Do niczego mi się nie przydasz.","","","DIA_None_101_Mario_DontNeedYou.description","",""
"Scripts/Content/Story/Dialoge/DIA_NONE_101_Mario.d:255","Ich kann dich nicht gebrauchen.","Do niczego mi się nie przydasz.","","","DIA_None_101_Mario_DontNeedYou_15_00","",""
"Scripts/Content/Story/Dialoge/DIA_NONE_101_Mario.d:256","Ich bin der beste Seeman, den du hier finden wirst.","Nie znajdziesz tu lepszego marynarza ode mnie.","","","DIA_None_101_Mario_DontNeedYou_07_01","",""
"Scripts/Content/Story/Dialoge/DIA_NONE_101_Mario.d:257","Wie du aussiehst, hast du keine Ahnung von der Seefahrt.","Na pierwszy rzut oka wygląda na to, że nie masz zielonego pojęcia o nawigacji.","","","DIA_None_101_Mario_DontNeedYou_07_02","",""
"Scripts/Content/Story/Dialoge/DIA_NONE_101_Mario.d:258","Also überleg dir sehr gut, wem du vertraust.","Zastanów się więc poważnie, nim komuś zaufasz.","","","DIA_None_101_Mario_DontNeedYou_07_03","",""
"Scripts/Content/Story/Dialoge/DIA_NONE_101_Mario.d:270","Gute Leute kann ich immer brauchen.","Przydałbyś mi się.","","","DIA_None_101_Mario_NeedGoodMen.description","",""
"Scripts/Content/Story/Dialoge/DIA_NONE_101_Mario.d:284","Gute Leute kann ich immer brauchen.","Przydałbyś mi się.","","","DIA_None_101_Mario_NeedGoodMen_15_00","",""
"Scripts/Content/Story/Dialoge/DIA_NONE_101_Mario.d:285","Alles klar, wir sehen uns dann am Schiff.","Świetnie, do zobaczenia na statku.","","","DIA_None_101_Mario_NeedGoodMen_07_01","",""
"Scripts/Content/Story/Dialoge/DIA_NONE_101_Mario.d:312","Ich kann dich doch nicht gebrauchen!","Chyba jednak mi się nie przydasz!","","","DIA_Mario_LeaveMyShip.description","",""
"Scripts/Content/Story/Dialoge/DIA_NONE_101_Mario.d:326","Ich kann dich doch nicht gebrauchen!","Jednak nie mogę skorzystać z twojej pomocy!","","","DIA_Mario_LeaveMyShip_15_00","",""
"Scripts/Content/Story/Dialoge/DIA_NONE_101_Mario.d:327","Wie du meinst, du weißt ja, wo du mich findest!","Jak sobie życzysz. Wiesz, gdzie mnie znaleźć.","","","DIA_Mario_LeaveMyShip_07_01","",""
"Scripts/Content/Story/Dialoge/DIA_NONE_101_Mario.d:345","Ich kann dich doch gebrauchen!","Chyba jednak będę cię potrzebował!","","","DIA_Mario_StillNeedYou.description","",""
"Scripts/Content/Story/Dialoge/DIA_NONE_101_Mario.d:360","Ich kann dich doch gebrauchen!","No dobrze, może mi się przydasz.","","","DIA_Mario_StillNeedYou_15_00","",""
"Scripts/Content/Story/Dialoge/DIA_NONE_101_Mario.d:364","Ich hab's doch gewusst. Wir sehen uns am Schiff!","Świetnie! Do zobaczenia na statku!","","","DIA_Mario_StillNeedYou_07_01","",""
"Scripts/Content/Story/Dialoge/DIA_NONE_101_Mario.d:380","So kannst du nicht mit mir umspringen. Ich werde dich aufschlitzen!","Nie możesz mnie tak traktować!","","","DIA_Mario_StillNeedYou_07_02","",""
"Scripts/Content/Story/Dialoge/DIA_NONE_101_Mario_DI.d:34","Jetzt kannst du deine Kampfkraft unter Beweis stellen.","Dam ci szansę wykazania się w walce, no, dalej!","","","DIA_NONE_101_MARIO_DI_Job.description","",""
"Scripts/Content/Story/Dialoge/DIA_NONE_101_Mario_DI.d:48","Jetzt kannst du deine Kampfkraft unter Beweis stellen.","Dam ci szansę wykazania się w walce, no, dalej!","","","DIA_NONE_101_MARIO_DI_Job_15_00","",""
"Scripts/Content/Story/Dialoge/DIA_NONE_101_Mario_DI.d:49","Langsam. Alles zu seiner Zeit.","Powoli, wszystko w swoim czasie.","","","DIA_NONE_101_MARIO_DI_Job_07_01","",""
"Scripts/Content/Story/Dialoge/DIA_NONE_101_Mario_DI.d:50","Mmh. Hab auch nichts anderes von dir erwartet.","Mmm. Tego się właśnie spodziewałem.","","","DIA_NONE_101_MARIO_DI_Job_15_02","",""
"Scripts/Content/Story/Dialoge/DIA_NONE_101_Mario_DI.d:51","Abwarten.","Zaczekaj.","","","DIA_NONE_101_MARIO_DI_Job_07_03","",""
"Scripts/Content/Story/Dialoge/DIA_NONE_101_Mario_DI.d:76","Komm ruhig näher. So, mein Freundchen. Jetzt zeig mal, was du kannst.","Podejdź bliżej przyjacielu, pokaż na co cię stać.","","","DIA_NONE_101_MARIO_DI_ambush_07_00","",""
"Scripts/Content/Story/Dialoge/DIA_NONE_101_Mario_DI.d:77","Was soll das heißen?","O co ci chodzi?","","","DIA_NONE_101_MARIO_DI_ambush_15_01","",""
"Scripts/Content/Story/Dialoge/DIA_NONE_101_Mario_DI.d:78","Ganz einfach. Der Meister hat von dir gehörig die Nase voll.","To proste. Mistrz już dawno chciał się ciebie pozbyć.","","","DIA_NONE_101_MARIO_DI_ambush_07_02","",""
