"location","source","target","id","fuzzy","context","translator_comments","developer_comments"
"Scripts/Content/Story/Dialoge/DIA_Addon_BDT_1070_Paul.d:252","(hektisch) Alles was ich weiß, ist, dass Huno nicht gut auf Esteban zu sprechen ist.","Wiem tylko tyle, że Huno nie lubi Estebana.","","","DIA_Addon_Paul_MaulPaul_03_05","",""
"Scripts/Content/Story/Dialoge/DIA_Addon_BDT_1070_Paul.d:253","(hektisch) Dauernd liegt er mir in den Ohren über diesen Esteban. dass er ihm sein Geschäft versaut und so ...","Działa mi na nerwy, opowiadając, że Esteban cały czas psuje mu interes...","","","DIA_Addon_Paul_MaulPaul_03_06","",""
"Scripts/Content/Story/Dialoge/DIA_Addon_BDT_1070_Paul.d:254","Ich hab nur zugehört und nie was gesagt.","Nigdy nie komentowałem tych spraw.","","","DIA_Addon_Paul_MaulPaul_03_07","",""
"Scripts/Content/Story/Dialoge/DIA_Addon_BDT_1070_Paul.d:255","Ganz bestimmt! Siehst du. War doch gar nicht so schlimm.","Mogłem się domyślić. Widzisz, to nie było takie trudne, prawda?","","","DIA_Addon_Paul_MaulPaul_15_08","",""
"Scripts/Content/Story/Dialoge/DIA_Addon_BDT_1070_Paul.d:289","Endlich! Hier, du sollst mein Erz dafür haben.","W końcu! Oto twoja ruda.","","","DIA_Addon_BDT_1070_Paul_Mine_03_00","",""
"Scripts/Content/Story/Dialoge/DIA_Addon_BDT_1070_Paul.d:308","Sonst alles klar bei dir?","Wszystko w porządku?","","","DIA_Addon_Paul_PERM.description","",""
"Scripts/Content/Story/Dialoge/DIA_Addon_BDT_1070_Paul.d:321","Sonst alles klar bei dir?","Wszystko w porządku?","","","DIA_Addon_Paul_PERM_15_00","",""
"Scripts/Content/Story/Dialoge/DIA_Addon_BDT_1070_Paul.d:325","Ja, ich werde einen Haufen Gold aus diesem Fels holen!","Tak, zamierzam wydobyć z tej skały trochę złota.","","","DIA_Addon_Paul_PERM_03_01","",""
"Scripts/Content/Story/Dialoge/DIA_Addon_BDT_1070_Paul.d:332","Ich hab dir alles gesagt, was ich weiß!","Powiedziałem ci wszystko, co wiem!","","","DIA_Addon_Paul_PERM_03_02","",""
"Scripts/Content/Story/Dialoge/DIA_Addon_BDT_1070_Paul.d:336","Ich will hier nur meine Arbeit machen, Mann!","Człowieku, ja chcę tylko spokojnie pracować.","","","DIA_Addon_Paul_PERM_03_03","",""
"Scripts/Content/Story/Dialoge/DIA_Addon_BDT_1071_Ramon.d:62","Hey, was ist da unten passiert?","Hej, co tu się stało?","","","DIA_Addon_Ramon_FirstWarn_07_00","",""
"Scripts/Content/Story/Dialoge/DIA_Addon_BDT_1071_Ramon.d:63","Ich habe Franco umgehauen.","Pobiłem Franka.","","","DIA_Addon_Ramon_FirstWarn_15_01","",""
"Scripts/Content/Story/Dialoge/DIA_Addon_BDT_1071_Ramon.d:64","So? Dann ist es jetzt DEINE Aufgabe, dafür zu sorgen, dass die faulen Säcke jeden Tag ihre Arbeit machen.","No i co? To teraz TY musisz zadbać, by te lenie odwalały swoją robotę.","","","DIA_Addon_Ramon_FirstWarn_07_02","",""
"Scripts/Content/Story/Dialoge/DIA_Addon_BDT_1071_Ramon.d:65","Hey, ich bin nicht hier, um mich mit Jägern rumzuärgern. Ich will in's Lager.","Hej, nie zamierzam marnować tu czasu. Chcę wejść do obozu.","","","DIA_Addon_Ramon_FirstWarn_15_03","",""
"Scripts/Content/Story/Dialoge/DIA_Addon_BDT_1071_Ramon.d:66","Nichts da. Du hast Franco umgehauen - du bist jetzt der Anführer. Also mach deinen Job.","Nie teraz. Pokonałeś Franka. Czyli jesteś nowym przywódcą. No to rób swoje.","","","DIA_Addon_Ramon_FirstWarn_07_04","",""
"Scripts/Content/Story/Dialoge/DIA_Addon_BDT_1071_Ramon.d:67","Wenn ich der Anführer bin, dann kann ich bestimmen, wer als Nächstes reinkommt.","Skoro jestem przywódcą, to mogę wybrać następną osobę, która wejdzie do obozu.","","","DIA_Addon_Ramon_FirstWarn_15_05","",""
"Scripts/Content/Story/Dialoge/DIA_Addon_BDT_1071_Ramon.d:68","Und ich bestimme, dass ICH als Nächster reinkomme.","No to mówię, że następny mam być JA.","","","DIA_Addon_Ramon_FirstWarn_15_06","",""
"Scripts/Content/Story/Dialoge/DIA_Addon_BDT_1071_Ramon.d:69","(lacht) Ganz so einfach ist es nicht. Wir haben NIEMANDEN angefordert, also kommt auch NIEMAND rein.","To nie takie proste. Nie potrzebujemy nikogo nowego, więc nikt nie wejdzie do środka.","","","DIA_Addon_Ramon_FirstWarn_07_07","",""
"Scripts/Content/Story/Dialoge/DIA_Addon_BDT_1071_Ramon.d:70","Thorus kann doch einen neuen Anführer für die Jäger schicken, dann wird drinnen ein Platz für mich frei.","Thorus może wysłać nowego przywódcę myśliwych, zwalniając tym samym w obozie miejsce dla mnie.","","","DIA_Addon_Ramon_FirstWarn_15_08","",""
"Scripts/Content/Story/Dialoge/DIA_Addon_BDT_1071_Ramon.d:71","(lacht) Du gibst nicht auf, was? Okay, dann schieb deinen Hintern rein.","Nie poddajesz się, co? Dobra, pakuj do obozu swoje cztery litery.","","","DIA_Addon_Ramon_FirstWarn_07_09","",""
"Scripts/Content/Story/Dialoge/DIA_Addon_BDT_1071_Ramon.d:72","Thorus wird sich darum kümmern, dass die Jäger nicht ohne Anführer leben müssen.","Thorus się tym zajmie i przyśle nowego przywódcę.","","","DIA_Addon_Ramon_FirstWarn_07_10","",""
"Scripts/Content/Story/Dialoge/DIA_Addon_BDT_1071_Ramon.d:73","Worauf wartest du noch? Und besorg dir 'ne Spitzhacke!","No to na co czekasz? Nie zapomnij zabrać oskarda.","","False","DIA_Addon_Ramon_FirstWarn_07_11","",""
"Scripts/Content/Story/Dialoge/DIA_Addon_BDT_1071_Ramon.d:87","Hey, was willst du? Kann mir nicht vorstellen, dass du 'ne Erlaubnis für's Lager hast.","Hej, kim jesteś? Nie mogę sobie wyobrazić, żeby ktoś taki jak ty miał pozwolenie na wejście.","","","DIA_Addon_Ramon_FirstWarn_07_12","",""
"Scripts/Content/Story/Dialoge/DIA_Addon_BDT_1071_Ramon.d:91","Franco schickt mich. Er will wissen, ob jemand im Lager gebraucht wird.","Franko mnie przysyłał. Chce wiedzieć, czy nie potrzeba nowych robotników.","","","DIA_Addon_Ramon_FirstWarn_15_13","",""
"Scripts/Content/Story/Dialoge/DIA_Addon_BDT_1071_Ramon.d:94","Ja, wir brauchen jemanden. Gestern hat wieder einer von den Kerlen den Löffel abgegeben.","Tak, w zasadzie potrzeba. Wczoraj jeden gość strzelił w kalendarz.","","","DIA_Addon_Ramon_FirstWarn_07_14","",""
"Scripts/Content/Story/Dialoge/DIA_Addon_BDT_1071_Ramon.d:95","Dieser Idiot hat sich mit Esteban angelegt.","Ten idiota zdenerwował Estebana.","","","DIA_Addon_Ramon_FirstWarn_07_15","",""
"Scripts/Content/Story/Dialoge/DIA_Addon_BDT_1071_Ramon.d:96","Wer ist Esteban?","Kto to jest Esteban?","","","DIA_Addon_Ramon_FirstWarn_15_16","",""
"Scripts/Content/Story/Dialoge/DIA_Addon_BDT_1071_Ramon.d:97","Der Anführer des unteren Lagers. Er entscheidet, wer in die Mine kommt.","To szef obozowiska. On decyduje, komu pozwolić na wejście do kopalni.","","","DIA_Addon_Ramon_FirstWarn_07_17","",""
"Scripts/Content/Story/Dialoge/DIA_Addon_BDT_1071_Ramon.d:98","Also sag Franco, dass Thorus nach einem neuen Mann verlangt. Alles klar?","Powiedz Frankowi, że Thorus prosi o nowego robotnika. Jasne?","","","DIA_Addon_Ramon_FirstWarn_07_18","",""
"Scripts/Content/Story/Dialoge/DIA_Addon_BDT_1071_Ramon.d:105","Thorus? DER Thorus?","Thorus? TEN Thorus?","","","DIA_Addon_Ramon_FirstWarn.DIA_Addon_Ramon_FirstWarn_YES","Info_AddChoice",""
"Scripts/Content/Story/Dialoge/DIA_Addon_BDT_1071_Ramon.d:106","Thorus? Nie gehört...","Thorus? Pierwsze słyszę...","","","DIA_Addon_Ramon_FirstWarn.DIA_Addon_Ramon_FirstWarn_NO","Info_AddChoice",""
"Scripts/Content/Story/Dialoge/DIA_Addon_BDT_1071_Ramon.d:112","Hey, langsam! Du kommst nicht rein - also verschwinde!","Hej, stój! Nie wejdziesz tam, więc zjeżdżaj.","","","DIA_Addon_Ramon_FirstWarn_07_19","",""
"Scripts/Content/Story/Dialoge/DIA_Addon_BDT_1071_Ramon.d:122","Thorus? DER Thorus?","Thorus? TEN Thorus?","","","DIA_Addon_Ramon_FirstWarn_YES_15_00","",""
"Scripts/Content/Story/Dialoge/DIA_Addon_BDT_1071_Ramon.d:123","Ja. DER Thorus. DER Mann, der die neuen Leute anfordert.","Tak. TEN Thorus. Człowiek, który prosi o nowych robotników.","","","DIA_Addon_Ramon_FirstWarn_YES_07_01","",""
"Scripts/Content/Story/Dialoge/DIA_Addon_BDT_1071_Ramon.d:124","Der Mann, der entscheidet, ob und wann ein neuer Typ aus dem Sumpf ins Lager kommt.","Człowiek, który decyduje, czy ktoś nowy może przejść z bagien do obozu.","","","DIA_Addon_Ramon_FirstWarn_YES_07_02","",""
"Scripts/Content/Story/Dialoge/DIA_Addon_BDT_1071_Ramon.d:125","Du willst mir doch nicht erzählen, dass du ihn von früher kennst?","Nie chcesz mi chyba powiedzieć, że znasz go z wcześniejszych czasów?","","","DIA_Addon_Ramon_FirstWarn_YES_07_03","",""
"Scripts/Content/Story/Dialoge/DIA_Addon_BDT_1071_Ramon.d:126","Naja, ... Ja ...","No cóż... Tak.","","","DIA_Addon_Ramon_FirstWarn_YES_15_04","",""
"Scripts/Content/Story/Dialoge/DIA_Addon_BDT_1071_Ramon.d:127","Pass auf - JEDER kennt Thorus.","Rozumiem... KAŻDY zna Thorusa.","","","DIA_Addon_Ramon_FirstWarn_YES_07_05","",""
"Scripts/Content/Story/Dialoge/DIA_Addon_BDT_1071_Ramon.d:128","Trotzdem kommst du nicht rein - und ich werde ihm NICHTS ausrichten!","Niemniej jednak to ci wcale nie pomoże. I nie zamierzam przekazywać ŻADNYCH wiadomości.","","","DIA_Addon_Ramon_FirstWarn_YES_07_06","",""
"Scripts/Content/Story/Dialoge/DIA_Addon_BDT_1071_Ramon.d:135","Thorus? Nie gehört ...","Thorus? Pierwsze słyszę...","","","DIA_Addon_Ramon_FirstWarn_NO_15_00","",""
"Scripts/Content/Story/Dialoge/DIA_Addon_BDT_1071_Ramon.d:136","Oh Mann, du kennst ihn nicht? Er war Chef der Gardisten im alten Lager.","Oj, chłopie, nie znasz go? Był dowódcą strażników w Starym Obozie.","","","DIA_Addon_Ramon_FirstWarn_NO_07_01","",""
"Scripts/Content/Story/Dialoge/DIA_Addon_BDT_1071_Ramon.d:137","Er ist der Mann, der das Vertrauen von allen genießt.","Jest człowiekiem, którego wszyscy szanują i któremu ufają.","","","DIA_Addon_Ramon_FirstWarn_NO_07_02","",""
"Scripts/Content/Story/Dialoge/DIA_Addon_BDT_1071_Ramon.d:138","Er fordert die neuen Leute an und er entscheidet, ob und wann ein neuer Mann in's Lager geholt wird.","On może poprosić o nowych ludzi.","","","DIA_Addon_Ramon_FirstWarn_NO_07_03","",""
"Scripts/Content/Story/Dialoge/DIA_Addon_BDT_1071_Ramon.d:139","Wenn du lange genug lebst, wirst du ihn kennenlernen.","Jeśli pożyjesz dostatecznie długo, to będziesz miał okazję go poznać.","","","DIA_Addon_Ramon_FirstWarn_NO_07_04","",""
"Scripts/Content/Story/Dialoge/DIA_Addon_BDT_1071_Ramon.d:170","Mach noch einen Schritt und es ist dein Letzter!","Zrób jeszcze jeden krok bliżej, a będzie to twój ostatni!","","","DIA_Addon_Ramon_SecondWarn_07_00","",""
"Scripts/Content/Story/Dialoge/DIA_Addon_BDT_1071_Ramon.d:207","Manche lernen es nie ...","Niektórzy nigdy się nie nauczą...","","","DIA_Addon_Ramon_Attack_07_00","",""
"Scripts/Content/Story/Dialoge/DIA_Addon_BDT_1071_Ramon.d:222","Ich bin der neue Mann.","Jestem tym nowym.","","","DIA_Addon_Ramon_News.description","",""
"Scripts/Content/Story/Dialoge/DIA_Addon_BDT_1071_Ramon.d:235","Ich bin der neue Mann.","Jestem tym nowym.","","","DIA_Addon_Ramon_News_15_00","",""
"Scripts/Content/Story/Dialoge/DIA_Addon_BDT_1071_Ramon.d:236","Hey, versuch nicht, mich zu verarschen. Es entscheidet immer noch Franco, wer von euch in's Lager kommt.","Nie próbuj sobie ze mnie żartować. Decyzja o tym, kto może wejść do obozu, wciąż należy do Franko.","","","DIA_Addon_Ramon_News_07_01","",""
"Scripts/Content/Story/Dialoge/DIA_Addon_BDT_1071_Ramon.d:248","Franco hat mich geschickt...","To właśnie Franko mnie przysłał...","","","DIA_Addon_Ramon_Lie.description","",""
"Scripts/Content/Story/Dialoge/DIA_Addon_BDT_1071_Ramon.d:262","Franco hat mich geschickt ...","To właśnie Franko mnie przysłał...","","","DIA_Addon_Ramon_Lie_15_00","",""
"Scripts/Content/Story/Dialoge/DIA_Addon_BDT_1071_Ramon.d:263","Hat er nicht. Also verschwinde, sonst brech ich dir die Knochen ...","Nie zrobił tego. A teraz zjeżdżaj, bo porachuję ci gnaty.","","","DIA_Addon_Ramon_Lie_07_01","",""
"Scripts/Content/Story/Dialoge/DIA_Addon_BDT_1071_Ramon.d:278","Und? Hast du alles im Griff?","I jak? Wszystko w porządku?","","","DIA_Addon_Ramon_Perm.description","",""
"Scripts/Content/Story/Dialoge/DIA_Addon_BDT_1071_Ramon.d:292","Und? Hast du alles im Griff?","I jak? Wszystko w porządku?","","","DIA_Addon_Ramon_Perm_15_00","",""
"Scripts/Content/Story/Dialoge/DIA_Addon_BDT_1071_Ramon.d:293","Hier ist alles in Ordnung - solange niemand rein will, der nicht rein SOLL.","Wszystko dobrze - przynajmniej dopóki ktoś niepowołany nie próbuje się dostać do środka.","","","DIA_Addon_Ramon_Perm_07_01","",""
"Scripts/Content/Story/Dialoge/DIA_Addon_BDT_1072_Logan.d:11","Ich komme später wieder...","Przyjdę później... (KONIEC)","","False","DIA_Addon_Logan_EXIT.description","",""
"Scripts/Content/Story/Dialoge/DIA_Addon_BDT_1072_Logan.d:21","Ich komme später wieder ...","Przyjdę później...","","","DIA_Addon_Logan_EXIT_15_00","",""
"Scripts/Content/Story/Dialoge/DIA_Addon_BDT_1072_Logan.d:27","(knurrt) Jaaa, lauf du nur weg. Ich werde hier stehen und alles aufhalten, was zu dicht rankommt.","Tak, uciekaj. Będę tu stał i zatrzymam każdego, kto spróbuje się zbliżyć.","","","DIA_Addon_Logan_EXIT_10_01","",""
"Scripts/Content/Story/Dialoge/DIA_Addon_BDT_1072_Logan.d:96","Du hast es also geschafft, hm? Okay, gut, dass du mich nicht hängen lässt.","Udało ci się, co? W porządku, dobrze, że mi pomagasz.","","","DIA_Addon_BDT_1072_Logan_Mine_10_00","",""
"Scripts/Content/Story/Dialoge/DIA_Addon_BDT_1072_Logan.d:113","Wie läuft's bei dir?","Co u ciebie słychać?","","","DIA_Addon_Logan_How2.description","",""
"Scripts/Content/Story/Dialoge/DIA_Addon_BDT_1072_Logan.d:127","Wie läuft's bei dir?","Co u ciebie słychać?","","","DIA_Addon_Logan_How2_15_00","",""
"Scripts/Content/Story/Dialoge/DIA_Addon_BDT_1072_Logan.d:128","Na ja, wenigstens bin ich schon mal drin. Lucia brennt einen harten Schnaps.","No cóż, przynajmniej jestem w środku. Lucia pędzi naprawdę mocny bimber.","","","DIA_Addon_Logan_How2_10_01","",""
"Scripts/Content/Story/Dialoge/DIA_Addon_BDT_1072_Logan.d:129","Aber Esteban lässt mich nicht in die Mine. Jedenfalls noch nicht. Er hat mir noch 'ne andere Aufgabe gegeben.","Esteban nie pozwala mi jednak wejść do kopalni. Przynajmniej na razie. Ale dostałem kilka innych zadań.","","","DIA_Addon_Logan_How2_10_02","",""
"Scripts/Content/Story/Dialoge/DIA_Addon_BDT_1072_Logan.d:130","Und? Was will er von dir?","No i? Co ci kazał robić?","","","DIA_Addon_Logan_How2_15_03","",""
"Scripts/Content/Story/Dialoge/DIA_Addon_BDT_1072_Logan.d:131","Es wurde ein Attentat auf Esteban verübt. Er will wissen, wer dahinter steckt.","Ktoś próbował zabić Estebana. Chce wiedzieć, kto za tym stoi.","","","DIA_Addon_Logan_How2_10_04","",""
"Scripts/Content/Story/Dialoge/DIA_Addon_BDT_1072_Logan.d:132","(leise) Esteban glaubt, daß Snaf da mit drin hängt. Ich soll ihn im Auge behalten...","Esteban sądzi, że w sprawę zamieszany jest Snaf. Mam mieć na niego oko...","","","DIA_Addon_Logan_How2_10_05","",""
"Scripts/Content/Story/Dialoge/DIA_Addon_BDT_1072_Logan.d:159","Du suchst nach den Typen, die dahinter stecken, was?","A więc szukasz ludzi, którzy są za to odpowiedzialni?","","","DIA_Addon_Logan_Attentat_10_00","",""
"Scripts/Content/Story/Dialoge/DIA_Addon_BDT_1072_Logan.d:160","Aber ich weiß nichts darüber. Wie sollte ich auch? Zu der Zeit saß ich noch im Sumpf ...","Nic o tym nie wiem. Skąd niby miałem się dowiedzieć? Siedziałem jeszcze w bagnie, gdy cała ta historia miała miejsce.","","","DIA_Addon_Logan_Attentat_10_01","",""
"Scripts/Content/Story/Dialoge/DIA_Addon_BDT_1072_Logan.d:186","Schau an, ein neues Gesicht.","Patrzcie, państwo, nowa twarz.","","","DIA_Addon_Logan_HI_10_00","",""
"Scripts/Content/Story/Dialoge/DIA_Addon_BDT_1072_Logan.d:187","Willst du nur im Weg rumstehen oder bist du gekommen, um mir zu helfen?","Zamierzasz tak stać czy przyszedłeś mi pomóc?","","","DIA_Addon_Logan_HI_10_01","",""
"Scripts/Content/Story/Dialoge/DIA_Addon_BDT_1072_Logan.d:191","Franco schickt mich. Er meint, du kannst Hilfe brauchen. Also was gibt's?","Franko mnie przysłał. Mówił, że przyda ci się pomoc. To o co chodzi?","","","DIA_Addon_Logan_HI_15_02","",""
"Scripts/Content/Story/Dialoge/DIA_Addon_BDT_1072_Logan.d:195","Kommt darauf an - wobei brauchst du denn Hilfe?","To zależy - jakiej pomocy ci trzeba?","","","DIA_Addon_Logan_HI_15_03","",""
"Scripts/Content/Story/Dialoge/DIA_Addon_BDT_1072_Logan.d:198","Die Sumpfhaie kommen mir ein bisschen zu nahe - wird Zeit, ein paar von ihnen zu erledigen.","Błotne węże ostatnimi czasy trochę za bardzo się do nas zbliżają. Pora zabić część z nich.","","","DIA_Addon_Logan_HI_10_04","",""
"Scripts/Content/Story/Dialoge/DIA_Addon_BDT_1072_Logan.d:214","Was kriege ich für meine Hilfe?","A co za to dostanę?","","","DIA_Addon_Logan_Why.description","",""
"Scripts/Content/Story/Dialoge/DIA_Addon_BDT_1072_Logan.d:228","Was kriege ich für meine Hilfe?","A co za to dostanę?","","","DIA_Addon_Logan_Why_15_00","",""
"Scripts/Content/Story/Dialoge/DIA_Addon_BDT_1072_Logan.d:229","(knurrt) Franco lässt dich hier verschimmeln, wenn du nichts tust.","Franko pozwoli ci tu gnić, jeśli nie będzie dla ciebie lepszego zastosowania.","","","DIA_Addon_Logan_Why_10_01","",""
"Scripts/Content/Story/Dialoge/DIA_Addon_BDT_1072_Logan.d:230","Wenn du in's Lager willst, musst du schon mit anpacken. Nur mit Worten kommst du hier nicht weiter.","Chcesz wejść do obozu? No to musisz pomagać. Same słowa nie przybliżą cię do celu.","","","DIA_Addon_Logan_Why_10_02","",""
"Scripts/Content/Story/Dialoge/DIA_Addon_BDT_1072_Logan.d:231","Außerdem kann ich dir zeigen, wie du die Viecher ausweiden kannst.","Poza tym mogę ci pokazać, jak patroszyć te bestie.","","","DIA_Addon_Logan_Why_10_03","",""
"Scripts/Content/Story/Dialoge/DIA_Addon_BDT_1072_Logan.d:232","Aber bild' dir ja nicht ein, dass Franco dich direkt ins Lager schickt, nur weil wir beide hier ein bisschen Spaß mit Sumpfhaien hatten.","Nie sądzę jednak, żeby Franko wpuścił cię do środka tylko dlatego, że zabijesz parę węży.","","","DIA_Addon_Logan_Why_10_04","",""
"Scripts/Content/Story/Dialoge/DIA_Addon_BDT_1072_Logan.d:233","Es gibt Leute hier draußen, die warten schon 'ne ganze Weile darauf, reinzukommen.","Jest tu sporo ludzi, którzy już trochę czekają.","","","DIA_Addon_Logan_Why_10_05","",""
"Scripts/Content/Story/Dialoge/DIA_Addon_BDT_1072_Logan.d:234","Und der Nächste, der reinkommt, bin ich ... (knurrt) ... und wehe nicht ...","I lepiej będzie, jeśli następną osobą, która wejdzie do obozu, będę ja...","","","DIA_Addon_Logan_Why_10_06","",""
"Scripts/Content/Story/Dialoge/DIA_Addon_BDT_1072_Logan.d:249","Was gibt's denn im Lager?","Czym jest obóz?","","","DIA_Addon_Logan_Lager.description","",""
"Scripts/Content/Story/Dialoge/DIA_Addon_BDT_1072_Logan.d:263","Was gibt's denn im Lager?","Czym jest obóz?","","","DIA_Addon_Logan_Lager_15_00","",""
"Scripts/Content/Story/Dialoge/DIA_Addon_BDT_1072_Logan.d:264","(knurrt) Die Frage ist doch was gibt es NICHT im Lager. Es gibt dort keine Sumpfhaie, keine Sumpflöcher ... keinen SUMPF halt.","Pytanie powinno brzmieć: czym NIE jest obóz. Bez węży, bez mokrych dziur... No wiesz, bez BAGNA.","","","DIA_Addon_Logan_Lager_10_01","",""
"Scripts/Content/Story/Dialoge/DIA_Addon_BDT_1072_Logan.d:265","Stattdessen haben sie Schnaps und Gold. Soviel ich weiß, haben sie da auch eine Frau. Alles klar?","Zamiast tego mają gorzałę i złoto. Z tego, co wiem, jest tam nawet jakaś kobieta. Teraz rozumiesz?","","","DIA_Addon_Logan_Lager_10_02","",""
"Scripts/Content/Story/Dialoge/DIA_Addon_BDT_1072_Logan.d:277","Lass uns die Sumpfhaie angreifen.","Chodźmy zabić parę błotnych węży.","","","DIA_Addon_Logan_MIS.description","",""
"Scripts/Content/Story/Dialoge/DIA_Addon_BDT_1072_Logan.d:290","Lass uns die Sumpfhaie angreifen.","Chodźmy zabić parę błotnych węży.","","","DIA_Addon_Logan_MIS_15_00","",""
"Scripts/Content/Story/Dialoge/DIA_Addon_BDT_1072_Logan.d:291","(knurrt) Du hast begriffen, wie du hier weiterkommst. Gefällt mir. Psst ... hörst du das? Jaaa, ich höre sie.","Wygląda na to, że zrozumiałeś, jak się robi postępy. Tak jak i... Cii. Słyszałeś? Słyszę je.","","","DIA_Addon_Logan_MIS_10_01","",""
"Scripts/Content/Story/Dialoge/DIA_Addon_BDT_1072_Logan.d:292","Verstehe - und was machen wir jetzt?","Rozumiem. Co teraz zrobimy?","","","DIA_Addon_Logan_MIS_15_02","",""
"Scripts/Content/Story/Dialoge/DIA_Addon_BDT_1072_Logan.d:293","Sie kommen. Sie haben Appetit auf 'nen Happen Menschenfleisch. Wollen wir doch mal sehen, WER hier wen fressen wird ... Auf geht's","Idą. Na pewno mają ochotę na przekąskę. Zobaczymy, kto kogo będzie jadł. Dalej!","","","DIA_Addon_Logan_MIS_10_03","",""
"Scripts/Content/Story/Dialoge/DIA_Addon_BDT_1072_Logan.d:332","Nur tote Sumpfhaie sind gute Sumpfhaie. Das wird ihren Brüdern eine Warnung sein!","Dobry błotny wąż to martwy błotny wąż. To powinno być przestrogą dla pozostałych.","","","DIA_Addon_Logan_tot_10_00","",""
"Scripts/Content/Story/Dialoge/DIA_Addon_BDT_1072_Logan.d:333","Alles klar, gibt's noch was zu tun? Sonst hau ich mal wieder ab ...","W porządku, masz coś jeszcze do zrobienia? Bo muszę ruszać dalej...","","","DIA_Addon_Logan_tot_15_01","",""
"Scripts/Content/Story/Dialoge/DIA_Addon_BDT_1072_Logan.d:334","Mach das. Wenn du noch was lernen willst - du weißt, wo du mich finden kannst.","W tej chwili nic. Wiesz, kogo musisz poszukać, jeśli będziesz chciał się czegoś nauczyć.","","","DIA_Addon_Logan_tot_10_02","",""
"Scripts/Content/Story/Dialoge/DIA_Addon_BDT_1072_Logan.d:354","Zeig mir, wie ich Tiere ausnehmen kann ...","Pokaż mi, jak patroszyć zwierzęta...","","","DIA_Addon_Logan_Lern.description","",""
"Scripts/Content/Story/Dialoge/DIA_Addon_BDT_1072_Logan.d:367","Zeig mir, wie ich Tiere ausnehmen kann ...","Pokaż mi, jak patroszyć zwierzęta...","","","DIA_Addon_Logan_Lern_15_00","",""
"Scripts/Content/Story/Dialoge/DIA_Addon_BDT_1072_Logan.d:368","Wenn du was über Blutfliegen wissen willst, geh zu Edgor. Der Mann hat Ahnung davon.","Jeśli chcesz się czegoś dowiedzieć o krwiopijcach, zapytaj lepiej Edgora.","","","DIA_Addon_Logan_Lern_10_01","",""
"Scripts/Content/Story/Dialoge/DIA_Addon_BDT_1072_Logan.d:369","Und wenn du Sumpfhaie oder Echsen ausnehmen willst, musst du wissen, wie du Felle und Zähne reißen kannst. Das kann ich dir zeigen.","Jeżeli będziesz patroszył bagienne węże czy jaszczurki, to może chcesz nauczyć się, jak je obdzierać ze skóry i wyrywać im zęby?","","","DIA_Addon_Logan_Lern_10_02","",""
"Scripts/Content/Story/Dialoge/DIA_Addon_BDT_1072_Logan.d:382","Ich will lernen ...","Chcę się nauczyć...","","","DIA_Addon_Logan_Allg.description","",""
"Scripts/Content/Story/Dialoge/DIA_Addon_BDT_1072_Logan.d:452","Wie läuft's?","Co nowego?","","","DIA_Addon_Logan_Hacker.description","",""
"Scripts/Content/Story/Dialoge/DIA_Addon_BDT_1072_Logan.d:465","Wie läuft's?","Co nowego?","","","DIA_Addon_BDT_10004_Logan_Hacker_15_00","",""
"Scripts/Content/Story/Dialoge/DIA_Addon_BDT_1072_Logan.d:466","Hey, dank dir habe ich es geschafft. Ich bin in der Mine!","Hej, udało mi się dzięki twojej pomocy! Dostałem pozwolenie na wejście do kopalni!","","","DIA_Addon_BDT_10004_Logan_Hacker_10_01","",""
"Scripts/Content/Story/Dialoge/DIA_Addon_BDT_1072_Logan.d:467","Ich hab zwar noch nicht viel Ahnung vom Goldhacken, aber das wird schon.","Nie znam się na wydobyciu złota, ale jakoś sobie poradzę.","","","DIA_Addon_BDT_10004_Logan_Hacker_10_02","",""
"Scripts/Content/Story/Dialoge/DIA_Addon_BDT_1072_Logan.d:471","Ich habe schon das Wichtigste gelernt. Beine fest auf den Boden und immer feste drauf kloppen!","Opanowałem już podstawy. Dobrze się ustaw i wal tak mocno, jak możesz!","","","DIA_Addon_BDT_10004_Logan_Hacker_10_03","",""
"Scripts/Content/Story/Dialoge/DIA_Addon_BDT_1073_Sancho.d:79","Scheiße, noch ein Neuer. (lacht) Auch wegen des Goldes hier, was?","Cholera, znowu ktoś nowy. Też chcesz złota, co?","","","DIA_Addon_Sancho_HI_06_00","",""
"Scripts/Content/Story/Dialoge/DIA_Addon_BDT_1073_Sancho.d:80","Gold?","Złota?","","","DIA_Addon_Sancho_HI_15_01","",""
"Scripts/Content/Story/Dialoge/DIA_Addon_BDT_1073_Sancho.d:81","(lachend) Jetzt hör auf mich zu verarschen!","Nie próbuj się ze mną przekomarzać!","","","DIA_Addon_Sancho_HI_06_02","",""
"Scripts/Content/Story/Dialoge/DIA_Addon_BDT_1073_Sancho.d:82","Alle Neuen, die herkommen, wollen in die Mine.","Wszyscy nowi chcą wejść do kopalni.","","","DIA_Addon_Sancho_HI_06_03","",""
"Scripts/Content/Story/Dialoge/DIA_Addon_BDT_1073_Sancho.d:83","Aber stell dir das bloß nicht so einfach vor!","Nie oczekuj jednak, że będzie to łatwe!","","","DIA_Addon_Sancho_HI_06_04","",""
"Scripts/Content/Story/Dialoge/DIA_Addon_BDT_1073_Sancho.d:104","Wie komme ich zum Lager?","Jak mogę się dostać do obozu?","","","DIA_Addon_Sancho_Lager.description","",""
"Scripts/Content/Story/Dialoge/DIA_Addon_BDT_1073_Sancho.d:114","Wie komme ich zum Lager?","Jak mogę się dostać do obozu?","","","DIA_Addon_Sancho_Lager_15_00","",""
"Scripts/Content/Story/Dialoge/DIA_Addon_BDT_1073_Sancho.d:115","Folge einfach dem Steg!","Idź po prostu mostem!","","","DIA_Addon_Sancho_Lager_06_01","",""
"Scripts/Content/Story/Dialoge/DIA_Addon_BDT_1073_Sancho.d:118","Aber wenn du in die Mine willst, musst du an Franco vorbei.","Jeśli jednak chcesz się dostać do kopalni, będziesz musiał przejść koło Franka.","","","DIA_Addon_Sancho_Lager_06_02","",""
"Scripts/Content/Story/Dialoge/DIA_Addon_BDT_1073_Sancho.d:119","Er erwartet von allen Neuen, dass sie sich erstmal 'ne Weile hier draußen abrackern!","On oczekuje od nowych, że przez jakiś czas będą pracować poza obozem.","","","DIA_Addon_Sancho_Lager_06_03","",""
