"location","source","target","id","fuzzy","context","translator_comments","developer_comments"
"Scripts/Content/Story/Dialoge/DIA_Addon_KDW_1403_Myxir_NW.d:139","Was steht denn so auf diesen Steintafeln?","Co zapisano na tych kamiennych tablicach?","","","DIA_Addon_Myxir_Steintafeln.description","",""
"Scripts/Content/Story/Dialoge/DIA_Addon_KDW_1403_Myxir_NW.d:152","Was steht denn so auf diesen Steintafeln?","Co zapisano na tych kamiennych tablicach?","","","DIA_Addon_Myxir_Steintafeln_15_00","",""
"Scripts/Content/Story/Dialoge/DIA_Addon_KDW_1403_Myxir_NW.d:153","Sie enthalten das gesammelte Wissen des alten Volkes.","Zawierają w sobie całą wiedzę starożytnych.","","","DIA_Addon_Myxir_Steintafeln_12_01","",""
"Scripts/Content/Story/Dialoge/DIA_Addon_KDW_1403_Myxir_NW.d:154","Manche von ihnen erhöhen auf magische Weise das Wissen über Kampf und Magie.","Niektórzy z nich za pomocą zaklęć zwiększali swą znajomość magii i walki.","","","DIA_Addon_Myxir_Steintafeln_12_02","",""
"Scripts/Content/Story/Dialoge/DIA_Addon_KDW_1403_Myxir_NW.d:155","Für jemanden, der die Tafeln lesen kann, sind sie ein wahrer Schatz.","Dla kogoś, kto potrafi odczytać tablice, to prawdziwy skarb.","","","DIA_Addon_Myxir_Steintafeln_12_03","",""
"Scripts/Content/Story/Dialoge/DIA_Addon_KDW_1403_Myxir_NW.d:171","Kannst du mir das Lesen der fremden Sprache beibringen?","Możesz mnie nauczyć czytania w tym dawnym języku?","","","DIA_Addon_Myxir_WillYouTeachMe.description","",""
"Scripts/Content/Story/Dialoge/DIA_Addon_KDW_1403_Myxir_NW.d:184","Kannst du mir das Lesen der fremden Sprache beibringen?","Możesz mnie nauczyć czytania w tym dawnym języku?","","","DIA_Addon_Myxir_WillYouTeachMe_15_00","",""
"Scripts/Content/Story/Dialoge/DIA_Addon_KDW_1403_Myxir_NW.d:185","Tja. Warum eigentlich nicht? Ich gebe gerne mein Wissen an dich weiter.","Czemu nie? Przekażę ci moją wiedzę.","","","DIA_Addon_Myxir_WillYouTeachMe_12_01","",""
"Scripts/Content/Story/Dialoge/DIA_Addon_KDW_1403_Myxir_NW.d:206","Lehre mich die fremde Sprache.","Naucz mnie tego dziwnego języka.","","","DIA_Addon_Myxir_Teach.description","",""
"Scripts/Content/Story/Dialoge/DIA_Addon_KDW_14040_Riordian_ADW.d:33","Hast du das hier erwartet?","Spodziewałeś się TEGO?","","","DIA_Addon_Riordian_HelloADW.description","",""
"Scripts/Content/Story/Dialoge/DIA_Addon_KDW_14040_Riordian_ADW.d:43","Hast du DAS hier erwartet?","Spodziewałeś się TEGO?","","","DIA_Addon_Riordian_HelloADW_15_00","",""
"Scripts/Content/Story/Dialoge/DIA_Addon_KDW_14040_Riordian_ADW.d:44","Auf keinen Fall. Ich bin überwältigt, wie groß die Stadt gewesen sein muss.","W żadnym wypadku. Jestem zdumiony wielkością tego miasta.","","","DIA_Addon_Riordian_HelloADW_10_01","",""
"Scripts/Content/Story/Dialoge/DIA_Addon_KDW_14040_Riordian_ADW.d:45","Die meisten Gebäude sind unter Stein und Erde verschüttet, aber die Ruinen, die die Zeit überdauert haben, sind über das ganze Land hier verteilt.","Większość budynków jest przysypana zwałami ziemi i kamieni, ale w całej krainie można znaleźć ruiny, które przetrwały do naszych czasów.","","","DIA_Addon_Riordian_HelloADW_10_02","",""
"Scripts/Content/Story/Dialoge/DIA_Addon_KDW_14040_Riordian_ADW.d:46","Es müssen Tausende gewesen sein, die hier gelebt haben.","Mieszkały tu tysiące ludzi.","","","DIA_Addon_Riordian_HelloADW_10_03","",""
"Scripts/Content/Story/Dialoge/DIA_Addon_KDW_14040_Riordian_ADW.d:58","Was werde ich da draussen finden?","Co mogę tutaj znaleźć?","","","DIA_Addon_Riordian_WhatToFind.description","",""
"Scripts/Content/Story/Dialoge/DIA_Addon_KDW_14040_Riordian_ADW.d:71","Was werde ich da draußen finden?","Co mogę tutaj znaleźć?","","","DIA_Addon_Riordian_WhatToFind_15_00","",""
"Scripts/Content/Story/Dialoge/DIA_Addon_KDW_14040_Riordian_ADW.d:72","Im Osten gibt es eine große Festung in einem riesigen Sumpf.","Na wschodzie, przy wielkim bagnie, znajduje się ogromna forteca.","","","DIA_Addon_Riordian_WhatToFind_10_01","",""
"Scripts/Content/Story/Dialoge/DIA_Addon_KDW_14040_Riordian_ADW.d:73","Soweit wir das von hier aus beurteilen können, haben sich die Banditen dort verschanzt.","Z tego, co wiemy, jest tam teraz siedziba bandytów.","","","DIA_Addon_Riordian_WhatToFind_10_02","",""
"Scripts/Content/Story/Dialoge/DIA_Addon_KDW_14040_Riordian_ADW.d:74","Wenn ich du wäre, würde ich nicht da runter gehen. Sie haben viele Vorposten und Wachen aufgestellt.","Nie szedłbym tam na twoim miejscu. Mają wiele posterunków i strażników.","","","DIA_Addon_Riordian_WhatToFind_10_03","",""
"Scripts/Content/Story/Dialoge/DIA_Addon_KDW_14040_Riordian_ADW.d:75","Du meidest besser den Sumpf, bis du mehr Erfahrung hast oder einen Weg findest, die Banditen zu umgehen.","Lepiej unikaj bagna, aż zdobędziesz więcej doświadczenia, albo znajdziesz sposób na uniknięcie bandytów.","","","DIA_Addon_Riordian_WhatToFind_10_04","",""
"Scripts/Content/Story/Dialoge/DIA_Addon_KDW_14040_Riordian_ADW.d:76","Im Westen haben wir einige Piraten entdeckt.","Na zachodzie znaleźliśmy paru piratów.","","","DIA_Addon_Riordian_WhatToFind_10_05","",""
"Scripts/Content/Story/Dialoge/DIA_Addon_KDW_14040_Riordian_ADW.d:77","Ich bin mir nicht sicher, aber ich glaube, sie haben uns entdeckt.","Nie jestem do końca pewien, ale wydaje mi się, że nas zauważyli.","","","DIA_Addon_Riordian_WhatToFind_10_06","",""
"Scripts/Content/Story/Dialoge/DIA_Addon_KDW_14040_Riordian_ADW.d:78","Scheint sie aber nicht sonderlich zu stören, dass wir hier sind.","Chyba nie przejmują się naszą obecnością.","","","DIA_Addon_Riordian_WhatToFind_10_07","",""
"Scripts/Content/Story/Dialoge/DIA_Addon_KDW_14040_Riordian_ADW.d:91","Erzähl' mir mehr über diese Gegend.","Opowiedz mi więcej o tej okolicy.","","","DIA_Addon_Riordian_Gegend.description","",""
"Scripts/Content/Story/Dialoge/DIA_Addon_KDW_14040_Riordian_ADW.d:106","Erzähl mir mehr über diese Gegend.","Opowiedz mi więcej o tej okolicy.","","","DIA_Addon_Riordian_Gegend_15_00","",""
"Scripts/Content/Story/Dialoge/DIA_Addon_KDW_14040_Riordian_ADW.d:107","Was willst du wissen?","Co chcesz wiedzieć?","","","DIA_Addon_Riordian_Gegend_10_01","",""
"Scripts/Content/Story/Dialoge/DIA_Addon_KDW_14040_Riordian_ADW.d:115","Gibt es eine Karte dieser Gegend?","Czy istnieje mapa tego regionu?","","","DIA_Addon_Riordian_Gegend.DIA_Addon_Riordian_Gegend_map","Info_AddChoice",""
"Scripts/Content/Story/Dialoge/DIA_Addon_KDW_14040_Riordian_ADW.d:119","Wo hast du die Piraten gesehen?","Gdzie widziałeś piratów?","","","DIA_Addon_Riordian_Gegend.DIA_Addon_Riordian_Gegend_Piraten","Info_AddChoice",""
"Scripts/Content/Story/Dialoge/DIA_Addon_KDW_14040_Riordian_ADW.d:120","Wo waren die Banditen nochmal?","Gdzie przebywają bandyci?","","","DIA_Addon_Riordian_Gegend.DIA_Addon_Riordian_Gegend_bandits","Info_AddChoice",""
"Scripts/Content/Story/Dialoge/DIA_Addon_KDW_14040_Riordian_ADW.d:121","Warst du schon mal im Westen?","Byłeś już na zachodzie?","","","DIA_Addon_Riordian_Gegend.DIA_Addon_Riordian_Gegend_west","Info_AddChoice",""
"Scripts/Content/Story/Dialoge/DIA_Addon_KDW_14040_Riordian_ADW.d:122","Was war nochmal im Osten?","Co znajduje się na wschodzie?","","","DIA_Addon_Riordian_Gegend.DIA_Addon_Riordian_Gegend_ost","Info_AddChoice",""
"Scripts/Content/Story/Dialoge/DIA_Addon_KDW_14040_Riordian_ADW.d:123","Wo komme ich hin, wenn ich nach Süden gehe?","Gdzie dojdę, idąc na południe?","","","DIA_Addon_Riordian_Gegend.DIA_Addon_Riordian_Gegend_sued","Info_AddChoice",""
"Scripts/Content/Story/Dialoge/DIA_Addon_KDW_14040_Riordian_ADW.d:124","Was ist im Norden?","Co znajduje się na północy?","","","DIA_Addon_Riordian_Gegend.DIA_Addon_Riordian_Gegend_nord","Info_AddChoice",""
"Scripts/Content/Story/Dialoge/DIA_Addon_KDW_14040_Riordian_ADW.d:134","Gibt es eine Karte dieser Gegend?","Czy istnieje mapa tego regionu?","","","DIA_Addon_Riordian_Gegend_map_15_00","",""
"Scripts/Content/Story/Dialoge/DIA_Addon_KDW_14040_Riordian_ADW.d:135","Cronos hat eine angefertigt. Er überlässt sie dir bestimmt.","Tak, narysował ją Cronos. Z pewnością ci ją przekaże.","","","DIA_Addon_Riordian_Gegend_map_10_01","",""
"Scripts/Content/Story/Dialoge/DIA_Addon_KDW_14040_Riordian_ADW.d:140","Wo waren die Banditen noch mal?","Gdzie przebywają bandyci?","","","DIA_Addon_Riordian_Gegend_bandits_15_00","",""
"Scripts/Content/Story/Dialoge/DIA_Addon_KDW_14040_Riordian_ADW.d:141","Sie haben eine Art Festung mit vielen Vorposten im Osten.","Mają na wschodzie taką niby fortecę i mnóstwo posterunków.","","","DIA_Addon_Riordian_Gegend_bandits_10_01","",""
"Scripts/Content/Story/Dialoge/DIA_Addon_KDW_14040_Riordian_ADW.d:142","Um da hin zu gelangen, musst du durch den großen Sumpf marschieren.","Aby się tam dostać, musisz przejść przez wielkie grzęzawisko.","","","DIA_Addon_Riordian_Gegend_bandits_10_02","",""
"Scripts/Content/Story/Dialoge/DIA_Addon_KDW_14040_Riordian_ADW.d:147","Wo hast du die Piraten gesehen?","Gdzie widziałeś piratów?","","","DIA_Addon_Riordian_Gegend_Piraten_15_00","",""
"Scripts/Content/Story/Dialoge/DIA_Addon_KDW_14040_Riordian_ADW.d:148","Sie liefen nicht weit von hier im Westen umher.","Wałęsają się na zachodzie.","","","DIA_Addon_Riordian_Gegend_Piraten_10_01","",""
"Scripts/Content/Story/Dialoge/DIA_Addon_KDW_14040_Riordian_ADW.d:149","Ich glaube, sie waren auf der Jagd.","Wydaje mi się, że na coś polowali.","","","DIA_Addon_Riordian_Gegend_Piraten_10_02","",""
"Scripts/Content/Story/Dialoge/DIA_Addon_KDW_14040_Riordian_ADW.d:154","Was ist im Norden?","Co znajduje się na północy?","","","DIA_Addon_Riordian_Gegend_nord_15_00","",""
"Scripts/Content/Story/Dialoge/DIA_Addon_KDW_14040_Riordian_ADW.d:155","Wenn ich den Aufzeichnungen der Erbauer Glauben schenken darf, dann wirst du dort ein großes von hohen Felsen umringtes Tal finden.","Jeśli mogę ufać zapiskom budowniczych, znajdziesz tam wielką dolinę otoczoną wysokimi skałami.","","","DIA_Addon_Riordian_Gegend_nord_10_01","",""
"Scripts/Content/Story/Dialoge/DIA_Addon_KDW_14040_Riordian_ADW.d:156","Dürre und Wüstensand bestimmen dort die Landschaft.","Jest to sucha i pustynna okolica.","","","DIA_Addon_Riordian_Gegend_nord_10_02","",""
"Scripts/Content/Story/Dialoge/DIA_Addon_KDW_14040_Riordian_ADW.d:161","Wo komme ich hin, wenn ich nach Süden gehe?","Gdzie dojdę, idąc na południe?","","","DIA_Addon_Riordian_Gegend_sued_15_00","",""
"Scripts/Content/Story/Dialoge/DIA_Addon_KDW_14040_Riordian_ADW.d:162","Das Land im Süden ist sehr zerklüftet.","Tereny na południu są bardzo skaliste.","","","DIA_Addon_Riordian_Gegend_sued_10_01","",""
"Scripts/Content/Story/Dialoge/DIA_Addon_KDW_14040_Riordian_ADW.d:163","Serpentinenartige Wege, Wasserfälle und in Felsen gehauene Ruinen wirst du dort finden.","Znajdziesz tam wijące się drogi, wodospady i kamienne ruiny.","","","DIA_Addon_Riordian_Gegend_sued_10_02","",""
"Scripts/Content/Story/Dialoge/DIA_Addon_KDW_14040_Riordian_ADW.d:168","Was war nochmal im Osten?","Co znajduje się na wschodzie?","","","DIA_Addon_Riordian_Gegend_ost_15_00","",""
"Scripts/Content/Story/Dialoge/DIA_Addon_KDW_14040_Riordian_ADW.d:169","Der große Sumpf. Die Gegend ist sehr gefährlich.","Wielkie bagno. Ten obszar jest bardzo niebezpieczny.","","","DIA_Addon_Riordian_Gegend_ost_10_01","",""
"Scripts/Content/Story/Dialoge/DIA_Addon_KDW_14040_Riordian_ADW.d:170","Nicht nur die Banditen lauern dort, sondern auch äußerst gefährliche Tiere.","Czają się tam nie tylko bandyci, ale też wyjątkowo groźne zwierzęta.","","","DIA_Addon_Riordian_Gegend_ost_10_02","",""
"Scripts/Content/Story/Dialoge/DIA_Addon_KDW_14040_Riordian_ADW.d:171","Du solltest vorsichtig sein.","Zachowaj ostrożność.","","","DIA_Addon_Riordian_Gegend_ost_10_03","",""
"Scripts/Content/Story/Dialoge/DIA_Addon_KDW_14040_Riordian_ADW.d:177","Warst du schon mal im Westen?","Byłeś już na zachodzie?","","","DIA_Addon_Riordian_Gegend_west_15_00","",""
"Scripts/Content/Story/Dialoge/DIA_Addon_KDW_14040_Riordian_ADW.d:178","Nein. Aber irgendwo dort muss die Küste sein.","Nie, ale tam na pewno jest wybrzeże.","","","DIA_Addon_Riordian_Gegend_west_10_01","",""
"Scripts/Content/Story/Dialoge/DIA_Addon_KDW_14040_Riordian_ADW.d:179","Ich vermute, dass die Piraten dort ihr Lager haben.","Podejrzewam, że piraci mają tam swój obóz.","","","DIA_Addon_Riordian_Gegend_west_10_02","",""
"Scripts/Content/Story/Dialoge/DIA_Addon_KDW_14040_Riordian_ADW.d:184","Nicht weit von hier im Osten haben wir die Leiche eines Fischers gefunden.","Na wschodzie, niedaleko stąd, znaleźliśmy zwłoki rybaka.","","","DIA_Addon_Riordian_Gegend_west_10_03","",""
"Scripts/Content/Story/Dialoge/DIA_Addon_KDW_14040_Riordian_ADW.d:185","Das solltest du dir mal ansehen.","Powinieneś się temu przyjrzeć.","","","DIA_Addon_Riordian_Gegend_west_10_04","",""
"Scripts/Content/Story/Dialoge/DIA_Addon_KDW_14040_Riordian_ADW.d:200","Saturas schickt mich.","Przysyła mnie Saturas. ","","","DIA_Addon_Riordian_HousesOfRulers.description","",""
"Scripts/Content/Story/Dialoge/DIA_Addon_KDW_14040_Riordian_ADW.d:213","Saturas schickt mich. Ich soll die fünf Herrenhäuser von Jharkendar durchsuchen.","Przysyła mnie Saturas. Mam poszukać pięciu posiadłości w Jarkendarze.","","","DIA_Addon_Riordian_HousesOfRulers_15_00","",""
"Scripts/Content/Story/Dialoge/DIA_Addon_KDW_14040_Riordian_ADW.d:214","Ich habe lange dafür gebraucht, aus den Niederschriften der Erbauer den Standort der Herrenhäuser zu finden.","Potrzebowałem dużo czasu, aby ustalić położenie posiadłości na podstawie zapisków budowniczych.","","","DIA_Addon_Riordian_HousesOfRulers_10_01","",""
"Scripts/Content/Story/Dialoge/DIA_Addon_KDW_14040_Riordian_ADW.d:215","Aber jetzt kann ich es dir genau sagen.","Ale teraz mogę ci je dokładnie opisać.","","","DIA_Addon_Riordian_HousesOfRulers_10_02","",""
"Scripts/Content/Story/Dialoge/DIA_Addon_KDW_14040_Riordian_ADW.d:228","Wo finde ich die fünf Herrenhäuser?","Gdzie mogę znaleźć te pięć budowli?","","","DIA_Addon_Riordian_WhereAreHouses.description","",""
"Scripts/Content/Story/Dialoge/DIA_Addon_KDW_14040_Riordian_ADW.d:243","Das Haus der Gelehrten ist eine große Bibliothek. Sie muss irgendwo weit im Norden sein.","Dom uczonych to wielka biblioteka. Musi być gdzieś daleko na północy.","","","DIA_Addon_Riordian_WhereAreHouses_10_00","",""
"Scripts/Content/Story/Dialoge/DIA_Addon_KDW_14040_Riordian_ADW.d:244","Das Haus der Krieger war damals eine von Felsen umringte Festung im Osten.","Dom wojowników to forteca otoczona przez skały. Leży na wschodzie.","","","DIA_Addon_Riordian_WhereAreHouses_10_01","",""
"Scripts/Content/Story/Dialoge/DIA_Addon_KDW_14040_Riordian_ADW.d:245","Die Priester und die Totenwächter hatten ihre Behausungen nahe beieinander. Du solltest sie im Südwesten finden.","Domy kapłanów i strażników umarłych znajdowały się blisko siebie. Powinieneś je znaleźć na południowym zachodzie.","","","DIA_Addon_Riordian_WhereAreHouses_10_02","",""
"Scripts/Content/Story/Dialoge/DIA_Addon_KDW_14040_Riordian_ADW.d:246","Und die Heiler hatten ihr Haus der Genesung im Südosten.","Uzdrowiciele mieli swój dom leczniczy na południowym wschodzie.","","","DIA_Addon_Riordian_WhereAreHouses_10_03","",""
"Scripts/Content/Story/Dialoge/DIA_Addon_KDW_14040_Riordian_ADW.d:250","Wenn diese Häuser noch stehen, dann wirst du sie an ihrer Bauweise erkennen.","Jeśli te budowle wciąż stoją, rozpoznasz je po architekturze.","","","DIA_Addon_Riordian_WhereAreHouses_10_04","",""
"Scripts/Content/Story/Dialoge/DIA_Addon_KDW_14040_Riordian_ADW.d:254","Sie sind erhöht. Eine steile Treppe führt in den von hohen Säulen verdeckten Eingang.","Są umieszczone na podwyższeniu. Strome schody prowadzą do wejścia otoczonego wysokimi kolumnami.","","","DIA_Addon_Riordian_WhereAreHouses_10_05","",""
"Scripts/Content/Story/Dialoge/DIA_Addon_KDW_14040_Riordian_ADW.d:258","Ich hoffe, das hilft dir weiter.","Mam nadzieję, że ci to pomoże.","","","DIA_Addon_Riordian_WhereAreHouses_10_06","",""
"Scripts/Content/Story/Dialoge/DIA_Addon_KDW_14040_Riordian_ADW.d:271","Wo finde ich die 5 Herrenhäuser?","Gdzie mogę znaleźć te pięć budowli?","","","DIA_Addon_Riordian_WhereAreHouses_15_00","",""
"Scripts/Content/Story/Dialoge/DIA_Addon_KDW_14040_Riordian_ADW.d:285","Wegen der Herrenhäuser...","Eee, jeśli chodzi o te budynki...","","","DIA_Addon_Riordian_FoundHouse.description","",""
"Scripts/Content/Story/Dialoge/DIA_Addon_KDW_14040_Riordian_ADW.d:310","Äh, wegen der Herrenhäuser ...","Eee, jeśli chodzi o te budynki...","","","DIA_Addon_Riordian_FoundHouse_15_00","",""
"Scripts/Content/Story/Dialoge/DIA_Addon_KDW_14040_Riordian_ADW.d:311","Ja?","Tak?","","","DIA_Addon_Riordian_FoundHouse_10_01","",""
"Scripts/Content/Story/Dialoge/DIA_Addon_KDW_14040_Riordian_ADW.d:316","Die Orks scheinen sich für die Bibliothek der Gelehrten zu interessieren.","Wygląda na to, że orkowie zainteresowali się biblioteką uczonych.","","","DIA_Addon_Riordian_FoundHouse_15_02","",""
"Scripts/Content/Story/Dialoge/DIA_Addon_KDW_14040_Riordian_ADW.d:317","Denkst du, dass sie die alte Sprache lesen können?","Myślisz, że mogą odczytać ten prastary język?","","","DIA_Addon_Riordian_FoundHouse_10_03","",""
"Scripts/Content/Story/Dialoge/DIA_Addon_KDW_14040_Riordian_ADW.d:318","Ich denke nicht, aber wer weiß das schon.","Nie sądzę, ale kto wie...","","","DIA_Addon_Riordian_FoundHouse_15_04","",""
"Scripts/Content/Story/Dialoge/DIA_Addon_KDW_14040_Riordian_ADW.d:319","Vielleicht solltest du trotzdem besser dafür sorgen, dass sie verschwinden.","Może lepiej upewnij się, że nie sprawią kłopotów.","","","DIA_Addon_Riordian_FoundHouse_10_05","",""
"Scripts/Content/Story/Dialoge/DIA_Addon_KDW_14040_Riordian_ADW.d:331","Das Haus der Heiler steht mitten in der Sumpfregion und wurde von einer Menge Steinwächtern verteidigt.","Siedziba uzdrowicieli znajduje się na środku bagna i jest broniona przez wielu kamiennych strażników.","","","DIA_Addon_Riordian_FoundHouse_15_06","",""
"Scripts/Content/Story/Dialoge/DIA_Addon_KDW_14040_Riordian_ADW.d:332","Es steht also immer noch?","Ciągle stoi?","","","DIA_Addon_Riordian_FoundHouse_10_07","",""
"Scripts/Content/Story/Dialoge/DIA_Addon_KDW_14040_Riordian_ADW.d:333","Ja, fragt sich nur, wie lange noch ...","Tak, pytanie tylko – jak długo...","","","DIA_Addon_Riordian_FoundHouse_15_08","",""
"Scripts/Content/Story/Dialoge/DIA_Addon_KDW_14040_Riordian_ADW.d:334","Mich schmerzt es in der Seele, wenn ich die Zeugen der Vergangeheit in diesem zerfallenen Zustand sehe.","Smuci mnie, gdy widzę świadków przeszłości w takim stanie.","","","DIA_Addon_Riordian_FoundHouse_10_09","",""
"Scripts/Content/Story/Dialoge/DIA_Addon_KDW_14040_Riordian_ADW.d:342","Das Herrenhaus der Krieger wurde von Raven als Unterschlupf verwendet.","Kruk wykorzystał posiadłość wojowników jako swoją kryjówkę.","","","DIA_Addon_Riordian_FoundHouse_15_10","",""
"Scripts/Content/Story/Dialoge/DIA_Addon_KDW_14040_Riordian_ADW.d:343","(zynisch) Da hat er eine gute Wahl getroffen.","Mądry wybór.","","","DIA_Addon_Riordian_FoundHouse_10_11","",""
"Scripts/Content/Story/Dialoge/DIA_Addon_KDW_14040_Riordian_ADW.d:344","Vermutlich ist es die sicherste Festung, die in dieser Region noch zu finden ist.","To podobno najbezpieczniejsza forteca, jaką można znaleźć na tym terenie.","","","DIA_Addon_Riordian_FoundHouse_10_12","",""
"Scripts/Content/Story/Dialoge/DIA_Addon_KDW_14040_Riordian_ADW.d:352","Im Haus der Priester waren jede Menge Minecrawler ...","W domu kapłanów jest mnóstwo pełzaczy...","","","DIA_Addon_Riordian_FoundHouse_15_13","",""
"Scripts/Content/Story/Dialoge/DIA_Addon_KDW_14040_Riordian_ADW.d:353","Ist so eine Gegend nicht sehr ungewöhnlich für diese Tiere?","Czy to nie dziwne, że te stworzenia pojawiły się w tym regionie?","","","DIA_Addon_Riordian_FoundHouse_10_14","",""
"Scripts/Content/Story/Dialoge/DIA_Addon_KDW_14040_Riordian_ADW.d:354","Allerdings.","W rzeczy samej.","","","DIA_Addon_Riordian_FoundHouse_15_15","",""
"Scripts/Content/Story/Dialoge/DIA_Addon_KDW_14040_Riordian_ADW.d:355","Bei Adanos. Seltsame Dinge geschehen in dieser Region.","O, Adanosie! Dzieją się tu dziwne rzeczy.","","","DIA_Addon_Riordian_FoundHouse_10_16","",""
"Scripts/Content/Story/Dialoge/DIA_Addon_KDW_14040_Riordian_ADW.d:364","Das Haus der Totenwächter wird beherrscht von der Macht des Bösen.","Siedziba strażników umarłych była opanowana przez moce zła.","","","DIA_Addon_Riordian_FoundHouse_15_17","",""
"Scripts/Content/Story/Dialoge/DIA_Addon_KDW_14040_Riordian_ADW.d:365","Ich glaub, ich habe selten so viele Zombies auf einem Haufen gesehen.","Chyba nigdy jeszcze nie widziałem w jednym miejscu tylu zombie.","","","DIA_Addon_Riordian_FoundHouse_15_18","",""
"Scripts/Content/Story/Dialoge/DIA_Addon_KDW_14040_Riordian_ADW.d:366","Das ist bedauerlich. Die Totenwächter wurden offenbar Opfer ihrer speziellen Fähigkeiten.","To bardzo niedobrze. Strażnicy umarłych stali się ofiarami własnych zdolności.","","","DIA_Addon_Riordian_FoundHouse_10_19","",""
"Scripts/Content/Story/Dialoge/DIA_Addon_KDW_14040_Riordian_ADW.d:367","Ihre Verbundenheit zur Totenwelt hat ihnen schwer geschadet. Ich hoffe, du hast sie von ihrem Leid erlösen können.","Ich powiązanie ze światem umarłych okazało się bardzo szkodliwe. Mam nadzieję, że uwolnisz ich z tej udręki.","","","DIA_Addon_Riordian_FoundHouse_10_20","",""
"Scripts/Content/Story/Dialoge/DIA_Addon_KDW_14040_Riordian_ADW.d:382","Erzähl mir nochmal, wo sich jedes einzelne befindet.","Przypomnij mi znowu, gdzie się znajdują budynki.","","","DIA_Addon_Riordian_FoundHouse_15_21","",""
"Scripts/Content/Story/Dialoge/DIA_Addon_KDW_14040_Riordian_ADW.d:396","Die Orks werden das Interesse an dieser Region bald verlieren.","Orkowie wkrótce przestaną się interesować tym regionem.","","","DIA_Addon_Riordian_OrksWeg.description","",""
"Scripts/Content/Story/Dialoge/DIA_Addon_KDW_14040_Riordian_ADW.d:410","Die Orks werden das Interesse an dieser Region bald verlieren.","Orkowie wkrótce przestaną się interesować tym regionem.","","","DIA_Addon_Riordian_OrksWeg_15_00","",""
"Scripts/Content/Story/Dialoge/DIA_Addon_KDW_14040_Riordian_ADW.d:411","Wie kommst du darauf?","Czemu tak uważasz?","","","DIA_Addon_Riordian_OrksWeg_10_01","",""
"Scripts/Content/Story/Dialoge/DIA_Addon_KDW_14040_Riordian_ADW.d:415","Ich habe ihren Anführer getötet.","Zabiłem ich przywódcę.","","","DIA_Addon_Riordian_OrksWeg_15_02","",""
"Scripts/Content/Story/Dialoge/DIA_Addon_KDW_14040_Riordian_ADW.d:419","Ihr Anführer ist tot.","Ich przywódca nie żyje.","","","DIA_Addon_Riordian_OrksWeg_15_03","",""
"Scripts/Content/Story/Dialoge/DIA_Addon_KDW_14040_Riordian_ADW.d:422","Wollen wir hoffen, dass du Recht hast.","Miejmy nadzieję, że to prawda.","","","DIA_Addon_Riordian_OrksWeg_10_04","",""
"Scripts/Content/Story/Dialoge/DIA_Addon_KDW_14040_Riordian_ADW.d:423","Störungen dieser Art können wir jetzt nun wirklich nicht gebrauchen.","Naprawdę nie możemy sobie teraz pozwolić na tego rodzaju kłopoty.","","","DIA_Addon_Riordian_OrksWeg_10_05","",""
"Scripts/Content/Story/Dialoge/DIA_Addon_KDW_14040_Riordian_ADW.d:438","Ich habe alle Herrenhäuser gefunden.","Znalazłem wszystkie posiadłości.","","","DIA_Addon_Riordian_FoundAllHouses.description","",""
"Scripts/Content/Story/Dialoge/DIA_Addon_KDW_14040_Riordian_ADW.d:452","Ich habe alle Herrenhäuser gefunden.","Znalazłem wszystkie posiadłości.","","","DIA_Addon_Riordian_FoundAllHouses_15_00","",""
"Scripts/Content/Story/Dialoge/DIA_Addon_KDW_14040_Riordian_ADW.d:453","Waren sie alle dort, wo ich es gesagt habe?","Wszystkie były tam, gdzie wskazałem?","","","DIA_Addon_Riordian_FoundAllHouses_10_01","",""
"Scripts/Content/Story/Dialoge/DIA_Addon_KDW_14040_Riordian_ADW.d:454","Mehr oder weniger schon.","Tak, mniej więcej.","","","DIA_Addon_Riordian_FoundAllHouses_15_02","",""
"Scripts/Content/Story/Dialoge/DIA_Addon_KDW_14040_Riordian_ADW.d:455","Sehr gut. Dann hat sich meine Arbeit ja DOCH gelohnt.","Bardzo dobrze. Więc moja praca się opłaciła.","","","DIA_Addon_Riordian_FoundAllHouses_10_03","",""
"Scripts/Content/Story/Dialoge/DIA_Addon_KDW_14040_Riordian_ADW.d:456","Ich danke dir.","Dziękuję.","","","DIA_Addon_Riordian_FoundAllHouses_10_04","",""
"Scripts/Content/Story/Dialoge/DIA_Addon_KDW_14040_Riordian_ADW.d:470","Kannst du mir deine Fähigkeiten beibringen?","Możesz mnie nauczyć swych umiejętności?","","","DIA_Addon_Riordian_ADW_PreTeach.description","",""
"Scripts/Content/Story/Dialoge/DIA_Addon_KDW_14040_Riordian_ADW.d:480","Kannst du mir deine Fähigkeiten beibringen?","Możesz mnie nauczyć swych umiejętności?","","","DIA_Addon_Riordian_ADW_PreTeach_15_00","",""
"Scripts/Content/Story/Dialoge/DIA_Addon_KDW_14040_Riordian_ADW.d:481","Ich kann dich in der Kunst der Alchemie unterrichten.","Mogę cię podszkolić w sztuce alchemii.","","","DIA_Addon_Riordian_ADW_PreTeach_10_01","",""
"Scripts/Content/Story/Dialoge/DIA_Addon_KDW_14040_Riordian_ADW.d:486","Und ich kann dir zeigen, wie du deinem Irrlicht beibringst, nach Gegenständen zu suchen.","Mogę ci także pokazać, jak nauczyć twojego ognika szukania przedmiotów.","","","DIA_Addon_Riordian_ADW_PreTeach_10_02","",""
"Scripts/Content/Story/Dialoge/DIA_Addon_KDW_14040_Riordian_ADW.d:505","Zeig mir, wie ich mein Irrlicht unterrichte.","Pokaż mi, jak wyszkolić mojego ognika.","","","DIA_Addon_Riordian_ADW_Teach.description","",""
"Scripts/Content/Story/Dialoge/DIA_Addon_KDW_14040_Riordian_ADW.d:678","Lehre mich die Kunst des Tränkebrauens.","Naucz mnie warzenia mikstur.","","","DIA_Riordian_ADW_TeachAlchemy.description","",""
"Scripts/Content/Story/Dialoge/DIA_Addon_KDW_14040_Riordian_ADW.d:698","Lehre mich die Kunst des Tränkebrauens.","Naucz mnie warzenia mikstur.","","","DIA_Addon_Riordian_ADW_TeachAlchemy_15_00","",""
