"location","source","target","id","fuzzy","context","translator_comments","developer_comments"
"Scripts/Content/Story/Dialoge/DIA_Addon_PIR_1352_AlligatorJack.d:616","Hier, nimm das Sumpfrattenfleisch und bringe es zu Morgan, dem Faulpelz.","Weź szczura i zanieś go temu leniowi Morganowi.","","","DIA_Addon_AlligatorJack_PassHenry_12_07","",""
"Scripts/Content/Story/Dialoge/DIA_Addon_PIR_1352_AlligatorJack.d:617","Du findest ihn bei uns im Lager.","Znajdziesz go w obozie.","","","DIA_Addon_AlligatorJack_PassHenry_12_08","",""
"Scripts/Content/Story/Dialoge/DIA_Addon_PIR_1352_AlligatorJack.d:618","Er liegt sicher wieder irgendwo am Strand. Ich denke, er wartet schon darauf.","Pewnie będzie się wygrzewał na plaży, czekając na ciebie.","","","DIA_Addon_AlligatorJack_PassHenry_12_09","",""
"Scripts/Content/Story/Dialoge/DIA_Addon_PIR_1352_AlligatorJack.d:622","Am Eingang unseres Lagers steht meistens Henry und passt auf, dass uns die Banditen nicht angreifen.","Przy wejściu spotkasz Henry'ego, który pilnuje, żeby nie podkradli się tu bandyci.","","","DIA_Addon_AlligatorJack_PassHenry_12_10","",""
"Scripts/Content/Story/Dialoge/DIA_Addon_PIR_1352_AlligatorJack.d:623","Wenn er dich nicht rein lassen will, sag ihm einfach, dass ich dich geschickt habe.","Powiedz mu, że to ja cię przysłałem.","","","DIA_Addon_AlligatorJack_PassHenry_12_11","",""
"Scripts/Content/Story/Dialoge/DIA_Addon_PIR_1352_AlligatorJack.d:624","Vielleicht ist er dann ein bisschen umgänglicher.","Powinien cię wpuścić.","","","DIA_Addon_AlligatorJack_PassHenry_12_12","",""
"Scripts/Content/Story/Dialoge/DIA_Addon_PIR_1352_AlligatorJack.d:625","Henry ist etwas übereifrig und markiert immer gerne den Boss.","Henry jest przewrażliwiony, a przy tym lubi zgrywać ważniaka.","","","DIA_Addon_AlligatorJack_PassHenry_12_13","",""
"Scripts/Content/Story/Dialoge/DIA_Addon_PIR_1352_AlligatorJack.d:650","Kennst du Angus und seinen Freund Hank?","Znasz może Angusa i jego kumpla, Hanka?","","","DIA_Addon_AlligatorJack_Angus.description","",""
"Scripts/Content/Story/Dialoge/DIA_Addon_PIR_1352_AlligatorJack.d:663","Kennst du Angus und seinen Freund Hank?","Znasz może Angusa i jego kumpla, Hanka?","","","DIA_Addon_AlligatorJack_Angus_15_00","",""
"Scripts/Content/Story/Dialoge/DIA_Addon_PIR_1352_AlligatorJack.d:664","Ich hab sie schon länger nicht mehr gesehen.","Nie widziałem ich od jakiegoś czasu.","","","DIA_Addon_AlligatorJack_Angus_12_03","",""
"Scripts/Content/Story/Dialoge/DIA_Addon_PIR_1352_AlligatorJack.d:665","Außerdem hätte ich nichts dagegen, wenn die beiden auch nicht wieder auftauchen.","W sumie nie miałbym nic przeciwko temu, żeby przepadli na dobre.","","","DIA_Addon_AlligatorJack_Angus_12_04","",""
"Scripts/Content/Story/Dialoge/DIA_Addon_PIR_1352_AlligatorJack.d:666","Warum?","Dlaczego?","","","DIA_Addon_AlligatorJack_Angus_15_05","",""
"Scripts/Content/Story/Dialoge/DIA_Addon_PIR_1352_AlligatorJack.d:667","Ach, die Penner haben ständig am See rumgehangen und das Wild vertrieben.","Ci obwiesie kręcą się zwykle w pobliżu jeziora, skutecznie odstraszając zwierzynę.","","","DIA_Addon_AlligatorJack_Angus_12_06","",""
"Scripts/Content/Story/Dialoge/DIA_Addon_PIR_1352_AlligatorJack.d:679","An welchem See hängen sie ständig rum?","A jak myślisz, nad którym jeziorem przebywają najczęściej?","","","DIA_Addon_AlligatorJack_Lake.description","",""
"Scripts/Content/Story/Dialoge/DIA_Addon_PIR_1352_AlligatorJack.d:693","An WELCHEM See hängen sie ständig rum?","A jak myślisz, nad którym jeziorem przebywają najczęściej?","","","DIA_Addon_AlligatorJack_Lake_15_00","",""
"Scripts/Content/Story/Dialoge/DIA_Addon_PIR_1352_AlligatorJack.d:697","Erinnerst du dich an unsere Jagd?","Pamiętasz nasze polowanie?","","","DIA_Addon_AlligatorJack_Lake_12_01","",""
"Scripts/Content/Story/Dialoge/DIA_Addon_PIR_1352_AlligatorJack.d:698","Ja.","Tak.","","","DIA_Addon_AlligatorJack_Lake_15_02","",""
"Scripts/Content/Story/Dialoge/DIA_Addon_PIR_1352_AlligatorJack.d:699","Der See in dem Talkessel. Dort habe ich sie meistens gesehen.","Chyba w kotlinie... Tam ich widywałem najczęściej.","","","DIA_Addon_AlligatorJack_Lake_12_03","",""
"Scripts/Content/Story/Dialoge/DIA_Addon_PIR_1352_AlligatorJack.d:703","Am See im großen Talkessel.","Nad jeziorem w kotlinie.","","","DIA_Addon_AlligatorJack_Lake_12_04","",""
"Scripts/Content/Story/Dialoge/DIA_Addon_PIR_1352_AlligatorJack.d:704","Du gehst von unserem Lager aus einfach nach Osten. Den Talkessel kannst du gar nicht übersehen.","Na wschód od naszego obozu. Nie sposób nie trafić.","","","DIA_Addon_AlligatorJack_Lake_12_05","",""
"Scripts/Content/Story/Dialoge/DIA_Addon_PIR_1352_AlligatorJack.d:705","Es gibt dort viel kleine Wasserfälle.","Wpada do niego kilka małych wodospadów.","","","DIA_Addon_AlligatorJack_Lake_12_06","",""
"Scripts/Content/Story/Dialoge/DIA_Addon_PIR_1352_AlligatorJack.d:706","Aber pass auf, wenn du nur noch trockenen Sand unter den Füßen hast, bist du falsch abgebogen und in den Canyon gelaufen.","Tylko uważaj. Kiedy zejdziesz na całkowicie piaszczysty teren, to znaczy, że źle skręciłeś i wszedłeś do kanionu.","","","DIA_Addon_AlligatorJack_Lake_12_07","",""
"Scripts/Content/Story/Dialoge/DIA_Addon_PIR_1352_AlligatorJack.d:722","Kannst du mir was beibringen?","Możesz mnie czegoś nauczyć?","","","DIA_Addon_AlligatorJack_CanLearn.description","",""
"Scripts/Content/Story/Dialoge/DIA_Addon_PIR_1352_AlligatorJack.d:739","Kannst du mir was beibringen?","Możesz mnie czegoś nauczyć?","","","DIA_Addon_AlligatorJack_CanLearn_15_00","",""
"Scripts/Content/Story/Dialoge/DIA_Addon_PIR_1352_AlligatorJack.d:743","Klar, ich bin ein guter Jäger, ich kann dir zeigen wie man Tiere enthäutet und ihnen die Zähne zieht.","Pewnie. Jestem dobrym myśliwym i mogę ci powiedzieć, jak najlepiej ścigać zwierzynę i pozyskiwać kły.","","","DIA_Addon_AlligatorJack_CanLearn_12_01","",""
"Scripts/Content/Story/Dialoge/DIA_Addon_PIR_1352_AlligatorJack.d:744","Wenn du willst, bring ich es dir bei.","Wystarczy, że zapytasz.","","","DIA_Addon_AlligatorJack_CanLearn_12_02","",""
"Scripts/Content/Story/Dialoge/DIA_Addon_PIR_1352_AlligatorJack.d:753","Zeig mir erst mal, dass du bereit bist für die Jagd.","Najpierw musisz jednak pokazać, że wiesz cokolwiek o polowaniu.","","","DIA_Addon_AlligatorJack_CanLearn_12_03","",""
"Scripts/Content/Story/Dialoge/DIA_Addon_PIR_1352_AlligatorJack.d:754","Wenn wir zusammen auf der Jagd waren, werde ich es vielleicht tun."," Jeśli pójdziesz ze mną na polowanie, mogę cię tego nauczyć.","","","DIA_Addon_AlligatorJack_CanLearn_12_04","",""
"Scripts/Content/Story/Dialoge/DIA_Addon_PIR_1352_AlligatorJack.d:780","Unterrichte mich!","Naucz mnie.","","","DIA_Addon_AlligatorJack_Teach.description","",""
"Scripts/Content/Story/Dialoge/DIA_Addon_PIR_1352_AlligatorJack.d:793","Unterrichte mich!","Naucz mnie.","","","DIA_Addon_AlligatorJack_Teach_15_00","",""
"Scripts/Content/Story/Dialoge/DIA_Addon_PIR_1352_AlligatorJack.d:794","Was soll ich dir beibringen?","Czego chcesz się dowiedzieć?","","","DIA_Addon_AlligatorJack_Teach_12_01","",""
"Scripts/Content/Story/Dialoge/DIA_Addon_PIR_1352_AlligatorJack.d:825","Und immer nur am Bauch aufschneiden, sonst verminderst du die Qualität.","Zawsze rozcinaj skórę wzdłuż brzucha, inaczej nie będzie się do niczego nadawać.","","","DIA_Addon_AlligatorJack_Teach_Fur_12_00","",""
"Scripts/Content/Story/Dialoge/DIA_Addon_PIR_1352_AlligatorJack.d:860","Alles klar.","Rozumiem.","","","DIA_Addon_AlligatorJack_Anheuern_12_01","",""
"Scripts/Content/Story/Dialoge/DIA_Addon_PIR_1352_AlligatorJack.d:870","Lass uns jagen gehen.","Chodźmy na polowanie.","","","DIA_Addon_AlligatorJack_Anheuern.description","",""
"Scripts/Content/Story/Dialoge/DIA_Addon_PIR_1352_AlligatorJack.d:883","Lass uns jagen gehen.","Chodźmy na polowanie.","","","DIA_Addon_AlligatorJack_Anheuern_15_00","",""
"Scripts/Content/Story/Dialoge/DIA_Addon_PIR_1352_AlligatorJack.d:901","Komm mit.","Chodź ze mną.","","","DIA_Addon_AlligatorJack_ComeOn.description","",""
"Scripts/Content/Story/Dialoge/DIA_Addon_PIR_1352_AlligatorJack.d:916","Komm mit.","Chodź ze mną.","","","DIA_Addon_AlligatorJack_KommMit_15_00","",""
"Scripts/Content/Story/Dialoge/DIA_Addon_PIR_1352_AlligatorJack.d:941","Ich brauch dich nicht mehr.","Nie potrzebuję już twojej pomocy.","","","DIA_Addon_AlligatorJack_GoHome.description","",""
"Scripts/Content/Story/Dialoge/DIA_Addon_PIR_1352_AlligatorJack.d:955","Ich brauch dich nicht mehr.","Nie potrzebuję już twojej pomocy.","","","DIA_Addon_AlligatorJack_DontNeedYou_15_00","",""
"Scripts/Content/Story/Dialoge/DIA_Addon_PIR_1352_Morgan.d:25","Leg dich wieder hin.","Idź spać.","","","DIA_Addon_Morgan_Perm_15_00","",""
"Scripts/Content/Story/Dialoge/DIA_Addon_PIR_1352_Morgan.d:28","(gähnt) Hervorragende Idee.","Doskonały pomysł.","","","DIA_Addon_Morgan_Perm_07_01","",""
"Scripts/Content/Story/Dialoge/DIA_Addon_PIR_1352_Morgan.d:33","(verschlafen)Na dann, gute Nacht.","W takim razie dobranoc.","","","DIA_Addon_Morgan_Perm_07_02","",""
"Scripts/Content/Story/Dialoge/DIA_Addon_PIR_1352_Morgan.d:38","(müde) Nichts lieber, als das.","No i co jeszcze?","","","DIA_Addon_Morgan_Perm_07_03","",""
"Scripts/Content/Story/Dialoge/DIA_Addon_PIR_1352_Morgan.d:43","Weck mich, wenn irgendwas passiert.","Obudź mnie, kiedy będzie się coś działo.","","","DIA_Addon_Morgan_Perm_07_04","",""
"Scripts/Content/Story/Dialoge/DIA_Addon_PIR_1352_Morgan.d:110","Toll, jetzt hat Greg mich zum Brettersägen verdonnert!","Wspaniale! Teraz Greg wysłał mnie do piłowania desek!","","","DIA_Addon_Morgan_Anheuern_07_00","",""
"Scripts/Content/Story/Dialoge/DIA_Addon_PIR_1352_Morgan.d:113","(sarkastisch) Viel Spass beim Monster schlachten!","Miłego szlachtowania potworów!","","","DIA_Addon_Morgan_Anheuern_07_01","",""
"Scripts/Content/Story/Dialoge/DIA_Addon_PIR_1352_Morgan.d:143","Hey du!","Ej, ty!","","","DIA_Addon_Morgan_Hello_15_00","",""
"Scripts/Content/Story/Dialoge/DIA_Addon_PIR_1352_Morgan.d:144","(verschlafen) Häh? Was willst du?","Tak? Czego chcesz?","","","DIA_Addon_Morgan_Hello_07_01","",""
"Scripts/Content/Story/Dialoge/DIA_Addon_PIR_1352_Morgan.d:145","(verschlafen) Ist Alligator Jack schon wieder da?","Jack Aligator już wrócił?","","","DIA_Addon_Morgan_Hello_07_02","",""
"Scripts/Content/Story/Dialoge/DIA_Addon_PIR_1352_Morgan.d:146","(verschlafen) Nein? Dann wird er sicher bald kommen, gute Nacht.","Nie? No to pewnie niedługo wróci. Dobranoc.","","","DIA_Addon_Morgan_Hello_07_03","",""
"Scripts/Content/Story/Dialoge/DIA_Addon_PIR_1352_Morgan.d:159","Ich habe hier eine Lieferung Fleisch.","Przynoszę mięso.","","","DIA_Addon_Morgan_Meat.description","",""
"Scripts/Content/Story/Dialoge/DIA_Addon_PIR_1352_Morgan.d:173","Ich habe hier eine Lieferung Fleisch.","Przynoszę mięso.","","","DIA_Addon_Morgan_Meat_15_00","",""
"Scripts/Content/Story/Dialoge/DIA_Addon_PIR_1352_Morgan.d:177","(wird wach) Puh. Ich brauch erst mal einen Schluck zum Wachwerden.","Zaraz. Najpierw muszę się napić.","","","DIA_Addon_Morgan_Meat_07_01","",""
"Scripts/Content/Story/Dialoge/DIA_Addon_PIR_1352_Morgan.d:182","So, besser. Also nochmal, was willst du?","No, już lepiej. Dobrze, powtórz mi, czego chcesz.","","","DIA_Addon_Morgan_Meat_07_02","",""
"Scripts/Content/Story/Dialoge/DIA_Addon_PIR_1352_Morgan.d:183","Ich bringe eine Lieferung Fleisch. Von Alligator Jack.","Jack Aligator kazał mi przynieść to mięso.","","","DIA_Addon_Morgan_Meat_15_03","",""
"Scripts/Content/Story/Dialoge/DIA_Addon_PIR_1352_Morgan.d:186","Ich erinnere mich. Genau! Das Fleisch, gib her!","No tak, teraz sobie przypominam. Dawaj je tu!","","","DIA_Addon_Morgan_Meat_07_04","",""
"Scripts/Content/Story/Dialoge/DIA_Addon_PIR_1352_Morgan.d:199","Was, das ist alles? Hast den Rest Rest selber gefreesen was? Naja, egal...","Co? To wszystko? Resztę pewnie zeżarłeś? No, nieważne...","","","DIA_Addon_Morgan_Meat_07_05","",""
"Scripts/Content/Story/Dialoge/DIA_Addon_PIR_1352_Morgan.d:217","Was machst du hier?","Co tu robisz?","","","DIA_Addon_Morgan_Job.description","",""
"Scripts/Content/Story/Dialoge/DIA_Addon_PIR_1352_Morgan.d:230","Was machst du hier?","Co tu robisz?","","","DIA_Addon_Morgan_Job_15_01","",""
"Scripts/Content/Story/Dialoge/DIA_Addon_PIR_1352_Morgan.d:231","Greg hat mir das Kommando über einen der beiden Entertrupps gegeben.","Greg powierzył mi dowództwo nad jedną z dwóch grup abordażowych.","","","DIA_Addon_Morgan_Job_07_01","",""
"Scripts/Content/Story/Dialoge/DIA_Addon_PIR_1352_Morgan.d:232","Ich bin für die Versorgung des Lagers zuständig - darum kümmert sich Alligator Jack.","Jestem odpowiedzialny za zaopatrzenie, które dostarcza nam Jack Aligator.","","","DIA_Addon_Morgan_Job_07_02","",""
"Scripts/Content/Story/Dialoge/DIA_Addon_PIR_1352_Morgan.d:233","Außerdem bin ich dafür verantwortlich, dass die Biester hier in der Gegend nicht zu nah ans Lager kommen.","Odpowiadam też za to, aby okoliczne stwory nie zbliżyły się zanadto do obozu.","","","DIA_Addon_Morgan_Job_07_03","",""
"Scripts/Content/Story/Dialoge/DIA_Addon_PIR_1352_Morgan.d:234","Darum kümmern sich die JUNGS.","Pomagają mi w tym moi chłopcy.","","","DIA_Addon_Morgan_Job_07_04","",""
"Scripts/Content/Story/Dialoge/DIA_Addon_PIR_1352_Morgan.d:237","Ich hab ihnen gesagt, ich will hier kein einziges Vieh mehr in der Nähe sehen, (gähnt) wenn Greg zurückkommt.","Powiedziałem im, że ma tu być spokojnie, kiedy kapitan Greg wróci.","","","DIA_Addon_Morgan_Job_07_05","",""
"Scripts/Content/Story/Dialoge/DIA_Addon_PIR_1352_Morgan.d:250","Tust du auch mal was?","Robisz coś konkretnego?","","","DIA_Addon_Morgan_Sleep.description","",""
"Scripts/Content/Story/Dialoge/DIA_Addon_PIR_1352_Morgan.d:263","Tust du auch mal was?","Robisz coś konkretnego?","","","DIA_Addon_Morgan_Sleep_15_00","",""
"Scripts/Content/Story/Dialoge/DIA_Addon_PIR_1352_Morgan.d:264","Hey, nicht frech werden!","Ej, wolnego!","","","DIA_Addon_Morgan_Sleep_07_01","",""
"Scripts/Content/Story/Dialoge/DIA_Addon_PIR_1352_Morgan.d:265","Ich habe die wichtigste Aufgabe von allen.","Moja praca jest bardzo ważna.","","","DIA_Addon_Morgan_Sleep_07_02","",""
"Scripts/Content/Story/Dialoge/DIA_Addon_PIR_1352_Morgan.d:266","Ich kümmere mich um die Ausbildung meiner Leute.","Nadzoruję szkolenie moich ludzi.","","","DIA_Addon_Morgan_Sleep_07_03","",""
"Scripts/Content/Story/Dialoge/DIA_Addon_PIR_1352_Morgan.d:267","Ich mache sie zu den besten und furchtlosesten Kämpfern, die jemals auf diesen Gewässern gekreuzt sind.","Staram się ich zmienić w nieustraszonych wilków morskich, najlepszych piratów, jacy kiedykolwiek żeglowali po tych wodach.","","","DIA_Addon_Morgan_Sleep_07_04","",""
"Scripts/Content/Story/Dialoge/DIA_Addon_PIR_1352_Morgan.d:268","Außerdem ist es ja nicht so, daß die Jungs nichts davon haben, ihre Arbeit zu machen.","Nie wysługuję się ludźmi.","","","DIA_Addon_Morgan_Sleep_07_05","",""
"Scripts/Content/Story/Dialoge/DIA_Addon_PIR_1352_Morgan.d:269","Sie bekommen 'nen ordentlichen Sack voll Gold dafür.","Każdy z nich dostaje niezły grosz za swoją robotę.","","","DIA_Addon_Morgan_Sleep_07_06","",""
"Scripts/Content/Story/Dialoge/DIA_Addon_PIR_1352_Morgan.d:286","Ich will in deinen Trupp.","Chcę dołączyć do waszej grupy.","","","DIA_Addon_Morgan_JoinMorgan.description","",""
"Scripts/Content/Story/Dialoge/DIA_Addon_PIR_1352_Morgan.d:300","Ich will in deinen Trupp.","Chcę dołączyć do waszej grupy.","","","DIA_Addon_Morgan_JoinMorgan_15_00","",""
"Scripts/Content/Story/Dialoge/DIA_Addon_PIR_1352_Morgan.d:301","(lacht) Mein Trupp? Mein Trupp hängt am Strand rum.","Do nas? Moi chłopcy na razie obijają się na plaży.","","","DIA_Addon_Morgan_JoinMorgan_07_01","",""
"Scripts/Content/Story/Dialoge/DIA_Addon_PIR_1352_Morgan.d:302","Die Jungs machen keinen Finger krumm, bis der Käpt'n wieder da ist, das kann ich dir versprechen.","I nawet palcem nie kiwną, póki kapitan nie wróci. To wiem na pewno.","","","DIA_Addon_Morgan_JoinMorgan_07_03","",""
"Scripts/Content/Story/Dialoge/DIA_Addon_PIR_1352_Morgan.d:303","Aber wenn du allen zeigen willst, was du drauf hast, kannst du dir ja mal den Strand im Norden vornehmen.","Ale jeśli chcesz pokazać, na co cię stać, możesz oczyścić plażę na północy.","","","DIA_Addon_Morgan_JoinMorgan_07_04","",""
"Scripts/Content/Story/Dialoge/DIA_Addon_PIR_1352_Morgan.d:304","Der ist voller Lurker und was weiß ich noch allem.","Pełno tam różnego śmiecia.","","","DIA_Addon_Morgan_JoinMorgan_07_05","",""
"Scripts/Content/Story/Dialoge/DIA_Addon_PIR_1352_Morgan.d:305","Zieh die Sache alleine durch und du verdienst dir den Respekt (gähnt) der Leute...","Jeśli się tego pozbędziesz, chłopaki na pewno cię zaakceptują.","","","DIA_Addon_Morgan_JoinMorgan_07_06","",""
"Scripts/Content/Story/Dialoge/DIA_Addon_PIR_1352_Morgan.d:306","Willommen in meinem Trupp. Ha! Ich hau mich wieder hin...","Witam w mojej ekipie. No, a teraz wracam do obowiązkowego wypoczynku.","","","DIA_Addon_Morgan_JoinMorgan_07_07","",""
"Scripts/Content/Story/Dialoge/DIA_Addon_PIR_1352_Morgan.d:326","Der Strand im Norden ist sauber.","Północna plaża została oczyszczona.","","","DIA_Addon_Morgan_LurkerPlatt.description","",""
"Scripts/Content/Story/Dialoge/DIA_Addon_PIR_1352_Morgan.d:344","Der Strand im Norden ist sauber.","Północna plaża została oczyszczona.","","","DIA_Addon_Morgan_LurkerPlatt_15_00","",""
"Scripts/Content/Story/Dialoge/DIA_Addon_PIR_1352_Morgan.d:345","Was ist mit der Höhle? Warst du da auch schon?","A co z jaskinią? Byłeś tam?","","","DIA_Addon_Morgan_LurkerPlatt_07_01","",""
"Scripts/Content/Story/Dialoge/DIA_Addon_PIR_1352_Morgan.d:349","Klar.","Pewnie.","","","DIA_Addon_Morgan_LurkerPlatt_15_02","",""
"Scripts/Content/Story/Dialoge/DIA_Addon_PIR_1352_Morgan.d:350","Sauber. Bist ein guter Mann.","Świetnie. Jesteś w porządku.","","","DIA_Addon_Morgan_LurkerPlatt_07_03","",""
"Scripts/Content/Story/Dialoge/DIA_Addon_PIR_1352_Morgan.d:351","Hier hast du deinen Lohn.","Oto twoja zapłata.","","","DIA_Addon_Morgan_LurkerPlatt_07_04","",""
"Scripts/Content/Story/Dialoge/DIA_Addon_PIR_1352_Morgan.d:363","Äh ...","Eee...","","","DIA_Addon_Morgan_LurkerPlatt_15_05","",""
"Scripts/Content/Story/Dialoge/DIA_Addon_PIR_1352_Morgan.d:364","Die gehört natürlich auch dazu. Komm wieder, wenn du das erledigt hast.","To też część twojego zadania. Wróć, kiedy już z nią skończysz.","","","DIA_Addon_Morgan_LurkerPlatt_07_06","",""
"Scripts/Content/Story/Dialoge/DIA_Addon_PIR_1352_Morgan.d:382","Gibt's sonst noch was zu tun für mich?","Jest jeszcze coś, co mogę zrobić?","","","DIA_Addon_Morgan_Auftrag2.description","",""
"Scripts/Content/Story/Dialoge/DIA_Addon_PIR_1352_Morgan.d:395","Gibt's sonst noch was zu tun für mich?","Jest jeszcze coś, co mogę zrobić?","","","DIA_Addon_Morgan_Auftrag2_15_00","",""
"Scripts/Content/Story/Dialoge/DIA_Addon_PIR_1352_Morgan.d:399","Im Moment nicht.","Na razie nie.","","","DIA_Addon_Morgan_Auftrag2_07_01","",""
"Scripts/Content/Story/Dialoge/DIA_Addon_PIR_1352_Morgan.d:400","Such dir erst mal 'ne Koje und trink dir 'ne ordentliche Buddel Rum!","Znajdź sobie jakąś koję i zdobądź solidną butelkę rumu.","","","DIA_Addon_Morgan_Auftrag2_07_02","",""
"Scripts/Content/Story/Dialoge/DIA_Addon_PIR_1352_Morgan.d:403","Aaah. Das Zeug ist gut.","Aaach. To jest trunek!","","","DIA_Addon_Morgan_Auftrag2_07_03","",""
"Scripts/Content/Story/Dialoge/DIA_Addon_PIR_1352_Morgan.d:407","Da fragst du am besten den Käpt'n.","Najlepiej spytaj o to kapitana.","","","DIA_Addon_Morgan_Auftrag2_07_04","",""
"Scripts/Content/Story/Dialoge/DIA_Addon_PIR_1352_Morgan.d:425","Wegen Angus und Hank...","Jeśli chodzi o Angusa i Hanka...","","","DIA_Addon_Morgan_FOUNDTHEM.description","",""
"Scripts/Content/Story/Dialoge/DIA_Addon_PIR_1352_Morgan.d:439","Wegen Angus und Hank ...","Jeśli chodzi o Angusa i Hanka...","","","DIA_Addon_Morgan_FOUNDTHEM_15_00","",""
"Scripts/Content/Story/Dialoge/DIA_Addon_PIR_1352_Morgan.d:443","Hör bloß auf mit DER Sache.","Nawet mi o tym nie mów!","","","DIA_Addon_Morgan_FOUNDTHEM_07_01","",""
"Scripts/Content/Story/Dialoge/DIA_Addon_PIR_1352_Morgan.d:444","Die beiden haben sich wahrscheinlich von Banditen umbringen lassen.","Pewnie dorwali ich bandyci.","","","DIA_Addon_Morgan_FOUNDTHEM_07_02","",""
"Scripts/Content/Story/Dialoge/DIA_Addon_PIR_1352_Morgan.d:445","Und Angus hatte meinen Ring dabei.","A ten drań Angus miał przy sobie mój pierścień.","","","DIA_Addon_Morgan_FOUNDTHEM_07_03","",""
"Scripts/Content/Story/Dialoge/DIA_Addon_PIR_1352_Morgan.d:446","Na gut, eigentlich war es SEIN Ring. Er hat ihn beim Würfeln gewonnen.","No dobra, to był już jego pierścień. Uczciwie wygrał go w kości.","","","DIA_Addon_Morgan_FOUNDTHEM_07_04","",""
"Scripts/Content/Story/Dialoge/DIA_Addon_PIR_1352_Morgan.d:447","Aber ich hätte ihn mir wieder zurückgeholt und jetzt ist er WEG!","Ale ja pewnie bym się odegrał, a tak - jak kamień w wodę.","","","DIA_Addon_Morgan_FOUNDTHEM_07_05","",""
"Scripts/Content/Story/Dialoge/DIA_Addon_PIR_1352_Morgan.d:454","Ich habe sie gefunden.","Znalazłem ich.","","","DIA_Addon_Morgan_FOUNDTHEM.DIA_Addon_Morgan_FOUNDTHEM_Now","Info_AddChoice",""
"Scripts/Content/Story/Dialoge/DIA_Addon_PIR_1352_Morgan.d:458","Wenn du meinen Ring findest, dann bring ihn zu mir zurück. Du sollst es auch nicht umsonst gemacht haben!","Jeśli znajdziesz gdzieś mój pierścień, przynieś mi go, a ja ci to wynagrodzę.","","","DIA_Addon_Morgan_FOUNDTHEM_07_06","",""
"Scripts/Content/Story/Dialoge/DIA_Addon_PIR_1352_Morgan.d:464","Ich habe sie gefunden.","Znalazłem ich.","","","DIA_Addon_Morgan_FOUNDTHEM_15_01","",""
"Scripts/Content/Story/Dialoge/DIA_Addon_PIR_1352_Morgan.d:465","Jetzt lass dir doch nicht jedes Wort aus der Nase ziehen. Wo sind sie?","I co? Mam ci płacić za każdą nowinę? Gdzie są?","","","DIA_Addon_Morgan_FOUNDTHEM_07_07","",""
"Scripts/Content/Story/Dialoge/DIA_Addon_PIR_1352_Morgan.d:466","Sie sind tot.","Nie żyją.","","","DIA_Addon_Morgan_FOUNDTHEM_15_03","",""
"Scripts/Content/Story/Dialoge/DIA_Addon_PIR_1352_Morgan.d:467","Der Ring, was ist mit dem Ring?","A pierścień? Co z nim?","","","DIA_Addon_Morgan_FOUNDTHEM_07_08","",""
"Scripts/Content/Story/Dialoge/DIA_Addon_PIR_1352_Morgan.d:469","Hier ist er.","Oto on.","","","DIA_Addon_Morgan_FOUNDTHEM.DIA_Addon_Morgan_FOUNDTHEM_GiveRing","Info_AddChoice",""
"Scripts/Content/Story/Dialoge/DIA_Addon_PIR_1352_Morgan.d:470","Den hatten sie nicht dabei.","Nie było go przy nich.","","","DIA_Addon_Morgan_FOUNDTHEM.DIA_Addon_Morgan_FOUNDTHEM_NoRing","Info_AddChoice",""
"Scripts/Content/Story/Dialoge/DIA_Addon_PIR_1352_Morgan.d:475","Den hatten sie nicht dabei.","Nie było go przy nich.","","","DIA_Addon_Morgan_FOUNDTHEM_NoRing_15_00","",""
"Scripts/Content/Story/Dialoge/DIA_Addon_PIR_1352_Morgan.d:476","entsetzt) Was? Geh zurück und suche noch mal. Sie müssen ihn dabei gehabt haben.","Co? Idź i sprawdź jeszcze raz! Musieli go mieć.","","","DIA_Addon_Morgan_FOUNDTHEM_NoRing_07_01","",""
"Scripts/Content/Story/Dialoge/DIA_Addon_PIR_1352_Morgan.d:477","Es ist ein kleiner Ring mit vielen kleinen Verzierungen.","To mały pierścień, bardzo ładnie zdobiony.","","","DIA_Addon_Morgan_FOUNDTHEM_NoRing_07_02","",""
"Scripts/Content/Story/Dialoge/DIA_Addon_PIR_1352_Morgan.d:478","Du MUSST ihn finden. Du MUSST!","Musisz go znaleźć! Musisz! Słyszysz?","","","DIA_Addon_Morgan_FOUNDTHEM_NoRing_07_03","",""
"Scripts/Content/Story/Dialoge/DIA_Addon_PIR_1352_Morgan.d:484","Hier ist er.","Oto on.","","","DIA_Addon_Morgan_FOUNDTHEM_GiveRing_15_00","",""
"Scripts/Content/Story/Dialoge/DIA_Addon_PIR_1352_Morgan.d:486","(freut sich wie ein Kind) Ja, das ist er. Guter Mann!","Tak, to on! Jesteś naprawdę dobrym człowiekiem, wiesz?","","","DIA_Addon_Morgan_FOUNDTHEM_GiveRing_07_01","",""
"Scripts/Content/Story/Dialoge/DIA_Addon_PIR_1352_Morgan.d:487","Hier, nimm diese Steintafel. Sie sieht zwar aus wie alter Ramsch, aber Garett wird 'ne Menge Gold dafür springen lassen.","Weź tę kamienną tabliczkę. Może wygląda niepozornie, ale Garett da ci za nią niezłą sumkę.","","","DIA_Addon_Morgan_FOUNDTHEM_GiveRing_07_02","",""
"Scripts/Content/Story/Dialoge/DIA_Addon_PIR_1352_Morgan.d:506","Was hälst du von Francis?","Co myślisz o Francisie?","","","DIA_Addon_Morgan_Francis.description","",""
"Scripts/Content/Story/Dialoge/DIA_Addon_PIR_1352_Morgan.d:523","Was hältst du von Francis?","Co myślisz o Francisie?","","","DIA_Addon_Morgan_Francis_15_00","",""
"Scripts/Content/Story/Dialoge/DIA_Addon_PIR_1352_Morgan.d:524","Der ist mir egal, (gefährlich) solange er mich in Ruhe lässt!","A co mnie on obchodzi? Nic do niego nie mam, jeśli on nie ma nic do mnie.","","","DIA_Addon_Morgan_Francis_07_01","",""
"Scripts/Content/Story/Dialoge/DIA_Addon_PIR_1352_Morgan.d:525","Ist er nicht der Boss hier?","Czy on nie jest tu szefem?","","","DIA_Addon_Morgan_Francis_15_02","",""
"Scripts/Content/Story/Dialoge/DIA_Addon_PIR_1352_Morgan.d:526","(lacht dreckig) Er HÄLT sich für den Boss.","Myśli, że jest tu szefem.","","","DIA_Addon_Morgan_Francis_07_03","",""
"Scripts/Content/Story/Dialoge/DIA_Addon_PIR_1352_Morgan.d:527","(schadenfroh) Aber irgendwann ist Greg wieder da, und dann wird Francis wieder schön - brav - Bretter sägen.","Ale Greg kiedyś wróci i wtedy Francis pójdzie piłować deski.","","","DIA_Addon_Morgan_Francis_07_04","",""
"Scripts/Content/Story/Dialoge/DIA_Addon_PIR_1352_Morgan.d:545","Kannst du mich auch trainieren?","Możesz mnie czegoś nauczyć?","","","DIA_Addon_Morgan_TRAIN.description","",""
