"location","source","target","id","fuzzy","context","translator_comments","developer_comments"
"Scripts/Content/Story/Dialoge/DIA_Addon_KDW_14000_Saturas_ADW.d:906","Wahrlich. Die Schöpfer des Portals taten gut daran, diese Dinge vor dem Rest der Welt zu verbergen.","W rzeczy samej, twórcy portalu dobrze zrobili, ukrywając te rzeczy przed resztą świata.","","","DIA_Addon_Saturas_TalkedToGhost_wasistdas_14_09","",""
"Scripts/Content/Story/Dialoge/DIA_Addon_KDW_14000_Saturas_ADW.d:907","Welch ein tragisches Ende für so eine wunderbare Kultur.","Cóż za tragiczny koniec tak wspaniałej kultury.","","","DIA_Addon_Saturas_TalkedToGhost_wasistdas_14_10","",""
"Scripts/Content/Story/Dialoge/DIA_Addon_KDW_14000_Saturas_ADW.d:908","Erkennst du jetzt die Dringlichkeit unserer Mission?","Teraz rozumiesz doniosłość swojej misji?","","","DIA_Addon_Saturas_TalkedToGhost_wasistdas_14_11","",""
"Scripts/Content/Story/Dialoge/DIA_Addon_KDW_14000_Saturas_ADW.d:909","Raven ist ein starker Kämpfer und verblendet von seiner Gier nach Macht.","Kruk jest silnym wojownikiem zaślepionym rządzą władzy.","","","DIA_Addon_Saturas_TalkedToGhost_wasistdas_14_12","",""
"Scripts/Content/Story/Dialoge/DIA_Addon_KDW_14000_Saturas_ADW.d:910","In seiner Hand wird die 'Klaue' zu einem Instrument der Vernichtung.","W jego ręku Szpon stanie się narzędziem zniszczenia.","","","DIA_Addon_Saturas_TalkedToGhost_wasistdas_14_13","",""
"Scripts/Content/Story/Dialoge/DIA_Addon_KDW_14000_Saturas_ADW.d:911","Er darf die Waffe nicht bekommen, sonst sind wir alle verloren.","Nie wolno mu dostać tej broni. Inaczej czeka nas zagłada.","","","DIA_Addon_Saturas_TalkedToGhost_wasistdas_14_14","",""
"Scripts/Content/Story/Dialoge/DIA_Addon_KDW_14000_Saturas_ADW.d:920","Was sind die Kammern Adanos'?","Czym są komnaty Adanosa?","","","DIA_Addon_Saturas_TalkedToGhost_kammern_15_00","",""
"Scripts/Content/Story/Dialoge/DIA_Addon_KDW_14000_Saturas_ADW.d:921","Wir wissen jetzt, dass das Eingangtor nicht die einzige Hürde ist, um ins Innere des Tempels zu gelangen.","Wiem, że brama ma tylko przeszkadzać w wejściu do świątyni.","","","DIA_Addon_Saturas_TalkedToGhost_kammern_14_01","",""
"Scripts/Content/Story/Dialoge/DIA_Addon_KDW_14000_Saturas_ADW.d:922","Im Tempel selbst gibt es drei Kammern, die alle Eindringlinge aufhalten sollen.","Jednak w środku są trzy komnaty, które powinny zatrzymać każdego intruza.","","","DIA_Addon_Saturas_TalkedToGhost_kammern_14_02","",""
"Scripts/Content/Story/Dialoge/DIA_Addon_KDW_14000_Saturas_ADW.d:923","Die farbigen Reliquien der Erbauer sind der Schlüssel dazu.","Kluczem do nich są kolorowe relikty budowniczych.","","","DIA_Addon_Saturas_TalkedToGhost_kammern_14_03","",""
"Scripts/Content/Story/Dialoge/DIA_Addon_KDW_14000_Saturas_ADW.d:924","Nur wenn wir alle Reliquien beisammen haben und die Rätsel auf ihnen lösen, kommen wir ins Allerheiligste des Tempels.","Jeśli zdobędziemy wszystkie relikty i rozwiążemy ich zagadki, będziemy mogli dostać się do sanktuarium świątyni.","","","DIA_Addon_Saturas_TalkedToGhost_kammern_14_04","",""
"Scripts/Content/Story/Dialoge/DIA_Addon_KDW_14000_Saturas_ADW.d:925","Ich weiß nicht, ob Raven die Rätsel des Tempels entschlüsseln konnte, aber falls dies der Fall ist, haben wir ein großes Problem ...","Nie wiem, czy Kruk rozszyfrował sekrety świątyni. Jeśli tak zrobił, to mamy duży problem.","","","DIA_Addon_Saturas_TalkedToGhost_kammern_14_05","",""
"Scripts/Content/Story/Dialoge/DIA_Addon_KDW_14000_Saturas_ADW.d:947","Was genau soll ich mit den Reliquien im Tempel machen?","Co dokładnie powinienem zrobić z reliktami w świątyni?","","","DIA_Addon_Saturas_RelictsBack.description","",""
"Scripts/Content/Story/Dialoge/DIA_Addon_KDW_14000_Saturas_ADW.d:962","Was genau soll ich mit den Reliquien im Tempel machen?","Co dokładnie powinienem zrobić z reliktami w świątyni?","","","DIA_Addon_Saturas_RelictsBack_15_00","",""
"Scripts/Content/Story/Dialoge/DIA_Addon_KDW_14000_Saturas_ADW.d:963","Wir wissen zu wenig. Doch du wirst ihre Bedeutung hoffentlich erkennen, sobald du im Tempel bist.","Nie wiemy wiele na ten temat. Ale miejmy nadzieję, że rozpoznasz ich znaczenie, kiedy dostaniesz się do świątyni.","","","DIA_Addon_Saturas_RelictsBack_14_03","",""
"Scripts/Content/Story/Dialoge/DIA_Addon_KDW_14000_Saturas_ADW.d:964","Tut mir Leid, dass ich dir nicht mehr dazu sagen kann. Jetzt liegt alles bei dir.","Naprawdę bardzo mi przykro, że nie mogę bardziej ci pomóc. Teraz wszystko zależy od ciebie.","","","DIA_Addon_Saturas_RelictsBack_14_05","",""
"Scripts/Content/Story/Dialoge/DIA_Addon_KDW_14000_Saturas_ADW.d:965","Nimm die Reliquien an dich und begib dich umgehend in den Tempel.","Weź relikty i natychmiast idź do świątyni.","","","DIA_Addon_Saturas_RelictsBack_14_06","",""
"Scripts/Content/Story/Dialoge/DIA_Addon_KDW_14000_Saturas_ADW.d:976","Adanos möge dir gnädig sein und uns alle beschützen.","Niech Adanos zmiłuje się nad nami i ma nas w swej opiece.","","","DIA_Addon_Saturas_RelictsBack_14_07","",""
"Scripts/Content/Story/Dialoge/DIA_Addon_KDW_14000_Saturas_ADW.d:977","Vielleicht ist es ja noch nicht zu spät.","Może nie jest jeszcze za późno.","","","DIA_Addon_Saturas_RelictsBack_14_08","",""
"Scripts/Content/Story/Dialoge/DIA_Addon_KDW_14000_Saturas_ADW.d:1002","Die Erdbeben haben aufgehört und wie ich sehe, weilst du immer noch unter den Lebenden.","Trzęsienia ziemi ustały, a ty wciąż żyjesz.","","","DIA_Addon_Saturas_RavensDead_14_00","",""
"Scripts/Content/Story/Dialoge/DIA_Addon_KDW_14000_Saturas_ADW.d:1003","Heißt das, dass deine Mission erfolgreich war?","Twoja misja powiodła się?","","","DIA_Addon_Saturas_RavensDead_14_01","",""
"Scripts/Content/Story/Dialoge/DIA_Addon_KDW_14000_Saturas_ADW.d:1004","Ja. Raven ist tot.","Tak. Kruk nie żyje.","","","DIA_Addon_Saturas_RavensDead_15_02","",""
"Scripts/Content/Story/Dialoge/DIA_Addon_KDW_14000_Saturas_ADW.d:1005","Dann ist es also vorbei. Adanos sei Dank.","A więc wszystko się skończyło. Dzięki Adanosowi!","","","DIA_Addon_Saturas_RavensDead_14_03","",""
"Scripts/Content/Story/Dialoge/DIA_Addon_KDW_14000_Saturas_ADW.d:1006","Das hast du gut gemacht, mein Sohn. Wir stehen tief in deiner Schuld.","Dobrze zrobiłeś, mój synu. Jesteśmy twoimi dłużnikami.","","","DIA_Addon_Saturas_RavensDead_14_04","",""
"Scripts/Content/Story/Dialoge/DIA_Addon_KDW_14000_Saturas_ADW.d:1007","Du hast dem Bösen eine mächtige Waffe entrissen und das Gleichgewicht in diesem Teil der Welt wieder hergestellt.","Odebrałeś sługom zła potężną broń i przywróciłeś równowagę w tej części świata.","","","DIA_Addon_Saturas_RavensDead_14_05","",""
"Scripts/Content/Story/Dialoge/DIA_Addon_KDW_14000_Saturas_ADW.d:1008","Als die Erdbeben verstummten, haben wir beraten, was nun geschehen soll und wir sind zu einem Ergebnis gekommen.","Kiedy trzęsienia ziemi ustały, ustaliliśmy, co trzeba zrobić w następnej kolejności.","","","DIA_Addon_Saturas_RavensDead_14_06","",""
"Scripts/Content/Story/Dialoge/DIA_Addon_KDW_14000_Saturas_ADW.d:1009","Geh hin und nimm die 'Klaue Beliars'. Sie soll nun dir bestimmt sein.","Zdobądź Szpon Beliara. Ta broń jest tobie przeznaczona.","","","DIA_Addon_Saturas_RavensDead_14_07","",""
"Scripts/Content/Story/Dialoge/DIA_Addon_KDW_14000_Saturas_ADW.d:1010","In deiner Hand kann sie ein mächtiger Verbündeter für uns sein.","W twoich rękach powinna stać się naszym potężnym sprzymierzeńcem.","","","DIA_Addon_Saturas_RavensDead_14_08","",""
"Scripts/Content/Story/Dialoge/DIA_Addon_KDW_14000_Saturas_ADW.d:1011","Nutze sie weise, mein Sohn. Adanos möge dir dabei helfen.","Używaj jej mądrze, synu. Niech Adanos ci pomoże.","","","DIA_Addon_Saturas_RavensDead_14_09","",""
"Scripts/Content/Story/Dialoge/DIA_Addon_KDW_14000_Saturas_ADW.d:1012","Wir werden hierbleiben und dafür sorgen, dass der Tempel wieder zu altem Glanz erblüht.","My zostaniemy tutaj i postaramy się, aby świątynia odzyskała dawny blask.","","","DIA_Addon_Saturas_RavensDead_14_11","",""
"Scripts/Content/Story/Dialoge/DIA_Addon_KDW_14000_Saturas_ADW.d:1013","Nur Myxir ist schon nach Khorinis aufgebrochen, um Vatras zu unterstützen.","Tylko Myxir wyruszył do Khorinis, aby wesprzeć Vatrasa.","","","DIA_Addon_Saturas_RavensDead_14_12","",""
"Scripts/Content/Story/Dialoge/DIA_Addon_KDW_14000_Saturas_ADW.d:1014","Vatras ist schon zu lange alleine in der Stadt gewesen.","Vatras zbyt długo był sam w mieście.","","","DIA_Addon_Saturas_RavensDead_14_13","",""
"Scripts/Content/Story/Dialoge/DIA_Addon_KDW_14000_Saturas_ADW.d:1032","Ich habe die Gefangenen befreit.","Uwolniłem więźniów.","","","DIA_Addon_Saturas_FreedMissingPeople.description","",""
"Scripts/Content/Story/Dialoge/DIA_Addon_KDW_14000_Saturas_ADW.d:1045","Ich habe die Gefangenen befreit.","Uwolniłem więźniów.","","","DIA_Addon_Saturas_FreedMissingPeople_15_00","",""
"Scripts/Content/Story/Dialoge/DIA_Addon_KDW_14000_Saturas_ADW.d:1046","Sehr gut. Mögen sie wohlbehalten in ihrer Heimat ankommen.","Bardzo dobrze. Oby szczęśliwie dotarli do swej ojczyzny.","","","DIA_Addon_Saturas_FreedMissingPeople_14_01","",""
"Scripts/Content/Story/Dialoge/DIA_Addon_KDW_14000_Saturas_ADW.d:1059","Ich habe die 'Klaue Beliars' an mich genommen.","Zabrałem Szpon Beliara.","","","DIA_Addon_Saturas_BeliarsWeapon.description","",""
"Scripts/Content/Story/Dialoge/DIA_Addon_KDW_14000_Saturas_ADW.d:1074","Ich habe die 'Klaue Beliars' an mich genommen.","Zabrałem Szpon Beliara.","","","DIA_Addon_Saturas_BeliarsWeapon_15_00","",""
"Scripts/Content/Story/Dialoge/DIA_Addon_KDW_14000_Saturas_ADW.d:1079","Doch ich kann sie nicht anlegen.","Ale nie mogę go użyć.","","","DIA_Addon_Saturas_BeliarsWeapon_15_01","",""
"Scripts/Content/Story/Dialoge/DIA_Addon_KDW_14000_Saturas_ADW.d:1082","Die Klaue Beliars ist eine ganz BESONDERE Waffe.","Szpon Beliara to wyjątkowa broń.","","","DIA_Addon_Saturas_BeliarsWeapon_14_02","",""
"Scripts/Content/Story/Dialoge/DIA_Addon_KDW_14000_Saturas_ADW.d:1083","Sie hat einen eigenen Willen und Bewusstsein.","Ma swoją duszę i własną wolę.","","","DIA_Addon_Saturas_BeliarsWeapon_14_03","",""
"Scripts/Content/Story/Dialoge/DIA_Addon_KDW_14000_Saturas_ADW.d:1084","Du, der nun diese mächtige Waffe besitzt, bist ihr Herr und Meister.","Ty, właściciel tej potężnej broni, jesteś jej panem.","","","DIA_Addon_Saturas_BeliarsWeapon_14_04","",""
"Scripts/Content/Story/Dialoge/DIA_Addon_KDW_14000_Saturas_ADW.d:1085","Sie ist ein Teil von dir und wird sich deinen Fähigkeiten anpassen.","Broń jest teraz częścią ciebie i dostosuje się do twoich umiejętności.","","","DIA_Addon_Saturas_BeliarsWeapon_14_05","",""
"Scripts/Content/Story/Dialoge/DIA_Addon_KDW_14000_Saturas_ADW.d:1086","Doch tut sie das nicht aus freien Stücken.","Ale nie zrobi tego z własnej woli.","","","DIA_Addon_Saturas_BeliarsWeapon_14_06","",""
"Scripts/Content/Story/Dialoge/DIA_Addon_KDW_14000_Saturas_ADW.d:1087","Nur Beliar SELBST kann sie dazu zwingen, dir zu gehorchen.","Jedynie sam BELIAR może zmusić ją, by ci służyła.","","","DIA_Addon_Saturas_BeliarsWeapon_14_07","",""
"Scripts/Content/Story/Dialoge/DIA_Addon_KDW_14000_Saturas_ADW.d:1090","Und warum sollte Beliar mir helfen?","Dlaczego Beliar miałby mi pomóc?","","","DIA_Addon_Saturas_BeliarsWeapon.DIA_Addon_Saturas_BeliarsWeapon_besser","Info_AddChoice",""
"Scripts/Content/Story/Dialoge/DIA_Addon_KDW_14000_Saturas_ADW.d:1091","Was kann ich mit der Waffe tun?","Co mogę zrobić z tą bronią?","","","DIA_Addon_Saturas_BeliarsWeapon.DIA_Addon_Saturas_BeliarsWeapon_wastun","Info_AddChoice",""
"Scripts/Content/Story/Dialoge/DIA_Addon_KDW_14000_Saturas_ADW.d:1096","Was kann ich mit der Waffe tun?","Co mogę zrobić z tą bronią?","","","DIA_Addon_Saturas_BeliarsWeapon_wastun_15_00","",""
"Scripts/Content/Story/Dialoge/DIA_Addon_KDW_14000_Saturas_ADW.d:1097","Das liegt in deiner Hand. Du hast die Waffe erobert und bist nun ihr Herr.","To zależy od ciebie. Zdobyłeś ją i jesteś teraz jej panem.","","","DIA_Addon_Saturas_BeliarsWeapon_wastun_14_01","",""
"Scripts/Content/Story/Dialoge/DIA_Addon_KDW_14000_Saturas_ADW.d:1098","Ich kann dir nur empfehlen, was du damit machen kannst.","Mogę ci jednak służyć radą.","","","DIA_Addon_Saturas_BeliarsWeapon_wastun_14_02","",""
"Scripts/Content/Story/Dialoge/DIA_Addon_KDW_14000_Saturas_ADW.d:1099","Entweder du übergibst sie MIR, und ich werde dafür sorgen, dass sie keinen Schaden mehr anrichtet ...","Albo przekażesz ją MNIE, a ja upewnię się, że nie spowoduje więcej szkód...","","","DIA_Addon_Saturas_BeliarsWeapon_wastun_14_03","",""
"Scripts/Content/Story/Dialoge/DIA_Addon_KDW_14000_Saturas_ADW.d:1100","… oder du machst dir ihre Macht zu Nutzen und verwendest sie im Kampf.","...albo przyswoisz sobie jej moc i będziesz używać miecza do walki.","","","DIA_Addon_Saturas_BeliarsWeapon_wastun_14_04","",""
"Scripts/Content/Story/Dialoge/DIA_Addon_KDW_14000_Saturas_ADW.d:1101","Könntest du die Waffe nicht verwahren?","Nie mógłbyś przechować broni?","","","DIA_Addon_Saturas_BeliarsWeapon.DIA_Addon_Saturas_BeliarsWeapon_geben","Info_AddChoice",""
"Scripts/Content/Story/Dialoge/DIA_Addon_KDW_14000_Saturas_ADW.d:1106","Könntest du die Waffe nicht verwahren?","Nie mógłbyś przechować broni?","","","DIA_Addon_Saturas_BeliarsWeapon_geben_15_00","",""
"Scripts/Content/Story/Dialoge/DIA_Addon_KDW_14000_Saturas_ADW.d:1109","Wenn du sie mir gibst, dann werde ich sie unschädlich machen, damit niemand mehr sie missbrauchen kann.","Jeśli mi ją oddasz, sprawię, że nie będzie można jej użyć. Nigdy więcej nie zostanie wykorzystana do złych celów.","","","DIA_Addon_Saturas_BeliarsWeapon_geben_14_03","",""
"Scripts/Content/Story/Dialoge/DIA_Addon_KDW_14000_Saturas_ADW.d:1110","Überleg dir also gut, was du tun wirst.","Więc dokładnie przemyśl, co zrobić.","","","DIA_Addon_Saturas_BeliarsWeapon_geben_14_04","",""
"Scripts/Content/Story/Dialoge/DIA_Addon_KDW_14000_Saturas_ADW.d:1119","Und warum sollte Beliar mir helfen?","Dlaczego Beliar miałby mi pomóc?","","","DIA_Addon_Saturas_BeliarsWeapon_besser_15_00","",""
"Scripts/Content/Story/Dialoge/DIA_Addon_KDW_14000_Saturas_ADW.d:1120","Nur ein Gebet zu ihm kann das bewirken.","Tylko modlitwa może go przekonać.","","","DIA_Addon_Saturas_BeliarsWeapon_besser_14_01","",""
"Scripts/Content/Story/Dialoge/DIA_Addon_KDW_14000_Saturas_ADW.d:1121","Aber sei vorsichtig. Beliar ist niederträchtig.","Ale uważaj. Beliar jest nikczemny.","","","DIA_Addon_Saturas_BeliarsWeapon_besser_14_02","",""
"Scripts/Content/Story/Dialoge/DIA_Addon_KDW_14000_Saturas_ADW.d:1122","Wenn du seinen Zorn erregst, dann wird er dich das spüren lassen.","Jeśli go rozwścieczysz, odczujesz na sobie jego furię.","","","DIA_Addon_Saturas_BeliarsWeapon_besser_14_03","",""
"Scripts/Content/Story/Dialoge/DIA_Addon_KDW_14000_Saturas_ADW.d:1141","Was werdet ihr nun tun?","Co teraz zrobisz?","","","DIA_Addon_Saturas_PermENDE_ADDON.description","",""
"Scripts/Content/Story/Dialoge/DIA_Addon_KDW_14000_Saturas_ADW.d:1155","Was werdet ihr nun tun?","Co teraz zrobisz?","","","DIA_Addon_Saturas_PermENDE_ADDON_15_00","",""
"Scripts/Content/Story/Dialoge/DIA_Addon_KDW_14000_Saturas_ADW.d:1156","Wir bleiben hier und verhelfen dem Tempel wieder zu Glanz und Größe.","Zostaniemy tutaj i postaramy się, żeby świątynia odzyskała swą dawną świetność.","","","DIA_Addon_Saturas_PermENDE_ADDON_14_01","",""
"Scripts/Content/Story/Dialoge/DIA_Addon_KDW_14000_Saturas_ADW.d:1157","All zu lange schon verweilen seine Mauern in diesem beklagenswerten Zustand.","Te stare mury zbyt długo stały w ruinie.","","","DIA_Addon_Saturas_PermENDE_ADDON_14_02","",""
"Scripts/Content/Story/Dialoge/DIA_Addon_KDW_14000_Saturas_ADW.d:1160","Was dich angeht, mein Sohn ...","A jeśli chodzi o ciebie, mój synu...","","","DIA_Addon_Saturas_PermENDE_ADDON_14_03","",""
"Scripts/Content/Story/Dialoge/DIA_Addon_KDW_14000_Saturas_ADW.d:1161","Es freut mich zu sehen, dass ich mich in dir getäuscht habe. Du bist der Bewahrer des Gleichgewichts. Daran gibt es keinen Zweifel mehr.","Jestem bardzo szczęśliwy, widząc, że myliłem się co do ciebie. Jesteś Strażnikiem Równowagi. Nie ma co do tego wątpliwości.","","","DIA_Addon_Saturas_PermENDE_ADDON_14_04","",""
"Scripts/Content/Story/Dialoge/DIA_Addon_KDW_14000_Saturas_ADW.d:1162","Ohne deinen Mut und deine Kraft wäre die Insel von Khorinis untergegangen. Wir danken dir und werden deiner in Ehren gedenken.","Bez twojej siły i odwagi wyspę Khorinis czekałaby zagłada. Dziękujemy ci. Chwała twemu męstwu.","","","DIA_Addon_Saturas_PermENDE_ADDON_14_05","",""
"Scripts/Content/Story/Dialoge/DIA_Addon_KDW_14000_Saturas_ADW.d:1163","Widme dich jetzt wieder den anderen Aufgaben, die noch vor dir liegen, und gib dieser Welt wieder Gleichgewicht und Frieden.","Skoncentruj się na pozostałych czekających cię zadaniach i przywróć temu światu równowagę i pokój.","","","DIA_Addon_Saturas_PermENDE_ADDON_14_06","",""
"Scripts/Content/Story/Dialoge/DIA_Addon_KDW_14000_Saturas_ADW.d:1164","Geh nun und erfülle dein Schicksal, Bewahrer. Unsere Gebete begleiten dich.","Idź i wypełnij swoje przeznaczenie, Strażniku. Będą ci towarzyszyć nasze modlitwy.","","","DIA_Addon_Saturas_PermENDE_ADDON_14_07","",""
"Scripts/Content/Story/Dialoge/DIA_Addon_KDW_14000_Saturas_ADW.d:1178","Nimm die 'Klaue Beliars' und vernichte sie.","Weź Szpon Beliara i zniszcz go.","","","DIA_Addon_Saturas_BeliarWeapGeben.description","",""
"Scripts/Content/Story/Dialoge/DIA_Addon_KDW_14000_Saturas_ADW.d:1193","Nimm die Klaue Beliars und vernichte sie.","Weź Szpon Beliara i zniszcz go.","","","DIA_Addon_Saturas_BeliarWeapGeben_15_00","",""
"Scripts/Content/Story/Dialoge/DIA_Addon_KDW_14000_Saturas_ADW.d:1194","Wie du willst, mein Sohn. Gib sie mir.","Jak sobie życzysz, synu. Oddaj mi broń.","","","DIA_Addon_Saturas_BeliarWeapGeben_14_01","",""
"Scripts/Content/Story/Dialoge/DIA_Addon_KDW_14000_Saturas_ADW.d:1197","Auf dass sie nun keinen Schaden mehr anrichte werde ich sie in den Tiefen des Meeres versenken.","Nie wyrządzi już nikomu krzywdy, gdy zatopię ją w morskich odmętach.","","","DIA_Addon_Saturas_BeliarWeapGeben_14_02","",""
"Scripts/Content/Story/Dialoge/DIA_Addon_KDW_14000_Saturas_ADW.d:1198","Adanos' Weisheit wird über sie wachen.","Na jej straży stać będzie mądrość Adanosa.","","","DIA_Addon_Saturas_BeliarWeapGeben_14_03","",""
"Scripts/Content/Story/Dialoge/DIA_Addon_KDW_14000_Saturas_ADW.d:1213","Kannst du mir die Kreise der Magie beibringen?","Możesz mnie nauczyć kręgów magii?","","","DIA_Addon_Saturas_ADW_PreTeachCircle.description","",""
"Scripts/Content/Story/Dialoge/DIA_Addon_KDW_14000_Saturas_ADW.d:1227","Kannst du mir die Kreise der Magie beibringen?","Możesz mnie nauczyć kręgów magii?","","","DIA_Addon_Saturas_ADW_PreTeachCircle_15_00","",""
"Scripts/Content/Story/Dialoge/DIA_Addon_KDW_14000_Saturas_ADW.d:1228","Du bist ein Magier des Feuers. Was wird denn wohl Pyrokar dazu sagen?","Jesteś magiem ognia. Co powie na to Pyrokar?","","","DIA_Addon_Saturas_ADW_PreTeachCircle_14_01","",""
"Scripts/Content/Story/Dialoge/DIA_Addon_KDW_14000_Saturas_ADW.d:1229","Das muss ja niemand wissen.","Nie musi o tym wiedzieć.","","","DIA_Addon_Saturas_ADW_PreTeachCircle_15_02","",""
"Scripts/Content/Story/Dialoge/DIA_Addon_KDW_14000_Saturas_ADW.d:1230","(seufzt) Ich sehe, dass es dir Ernst damit ist, also werde ich deiner Bitte entsprechen.","Widzę, że myślisz o tym poważnie. Spełnię twoją prośbę.","","","DIA_Addon_Saturas_ADW_PreTeachCircle_14_03","",""
"Scripts/Content/Story/Dialoge/DIA_Addon_KDW_14000_Saturas_ADW.d:1234","Sollte ich jedoch den Eindruck bekommen, dass ich unser Wissen in die falschen Hände lege, wirst du nicht mehr mit meiner Hilfe rechnen können.","Jeśli odniosę wrażenie, że wykorzystasz swą wiedzę, aby czynić zło, nie będziesz mógł więcej na mnie liczyć.","","","DIA_Addon_Saturas_ADW_PreTeachCircle_14_04","",""
"Scripts/Content/Story/Dialoge/DIA_Addon_KDW_14000_Saturas_ADW.d:1235","Du enttäuschst mich also besser nicht.","Lepiej mnie nie rozczaruj.","","","DIA_Addon_Saturas_ADW_PreTeachCircle_14_05","",""
"Scripts/Content/Story/Dialoge/DIA_Addon_KDW_14000_Saturas_ADW.d:1254","Ich will einen höheren Kreis der Magie lernen.","Chcę dowiedzieć się więcej o wyższych kręgach magii.","","","DIA_Addon_Saturas_ADW_CIRCLE.description","",""
"Scripts/Content/Story/Dialoge/DIA_Addon_KDW_14000_Saturas_ADW.d:1271","Ich will einen höheren Kreis der Magie lernen.","Chcę dowiedzieć się więcej o wyższych kręgach magii.","","","DIA_Addon_Saturas_ADW_CIRCLE_15_00","",""
"Scripts/Content/Story/Dialoge/DIA_Addon_KDW_14000_Saturas_ADW.d:1278","Ja, du bist bereit, dein Wissen zu mehren.","Tak, jesteś gotów na dalszą naukę.","","","DIA_Addon_Saturas_ADW_CIRCLE_14_01","",""
"Scripts/Content/Story/Dialoge/DIA_Addon_KDW_14000_Saturas_ADW.d:1279","Tritt nun in den zweiten Kreis der Magie. Adanos gebe dir die Kraft, deine hiermit verliehene Macht weise einzusetzen.","Wstąp do drugiego kręgu magii. Niech Adanos obdarzy cię mądrością, byś roztropnie używał swych nowych mocy.","","","DIA_Addon_Saturas_ADW_CIRCLE_14_02","",""
"Scripts/Content/Story/Dialoge/DIA_Addon_KDW_14000_Saturas_ADW.d:1287","Ja, die Zeit ist reif. Tritt nun in den dritten Kreis der Magie.","Tak, nastał ku temu czas. Wstąp do trzeciego kręgu magii.","","","DIA_Addon_Saturas_ADW_CIRCLE_14_03","",""
"Scripts/Content/Story/Dialoge/DIA_Addon_KDW_14000_Saturas_ADW.d:1288","Dein Wissen wird dir erlauben, neue mächtige Zauber zu wirken. Setze sie mit Bedacht ein.","Twoja wiedza pozwoli ci rzucać nowe, potężne zaklęcia. Używaj ich roztropnie.","","","DIA_Addon_Saturas_ADW_CIRCLE_14_04","",""
"Scripts/Content/Story/Dialoge/DIA_Addon_KDW_14000_Saturas_ADW.d:1296","Es ist soweit. Du bist bereit, in den vierten Kreis der Magie zu treten.","Nadszedł już czas. Jesteś gotów wstąpić do czwartego kręgu magii.","","","DIA_Addon_Saturas_ADW_CIRCLE_14_05","",""
"Scripts/Content/Story/Dialoge/DIA_Addon_KDW_14000_Saturas_ADW.d:1297","Mächtig ist nun dein Wort und deine Tat. Wähle deine neuen Zauber immer mit Sorgfalt und Vernunft.","Twoje słowa i gesty mają teraz wielką moc. Zawsze rozsądnie i uważnie dobieraj nowe zaklęcia.","","","DIA_Addon_Saturas_ADW_CIRCLE_14_06","",""
"Scripts/Content/Story/Dialoge/DIA_Addon_KDW_14000_Saturas_ADW.d:1305","Dir soll nun das Privileg zuteil werden, in den fünften Kreis der Magie zu treten.","Masz przywilej wstąpienia do piątego kręgu magii.","","","DIA_Addon_Saturas_ADW_CIRCLE_14_07","",""
"Scripts/Content/Story/Dialoge/DIA_Addon_KDW_14000_Saturas_ADW.d:1306","Die Zauber, die du nun erlernen wirst, können wahrlich vernichtend sein.","Zaklęcia, których się teraz nauczysz, mają niszczycielską siłę.","","","DIA_Addon_Saturas_ADW_CIRCLE_14_08","",""
"Scripts/Content/Story/Dialoge/DIA_Addon_KDW_14000_Saturas_ADW.d:1307","Sei dir also deiner Macht bewusst und erliege nicht dem Größenwahn.","Bądź świadom swej wielkiej mocy i nie popadaj w samouwielbienie.","","","DIA_Addon_Saturas_ADW_CIRCLE_14_09","",""
"Scripts/Content/Story/Dialoge/DIA_Addon_KDW_14000_Saturas_ADW.d:1312","Das ist nun nicht mehr meine Aufgabe.","To zadanie nie należy już do mnie.","","","DIA_Addon_Saturas_ADW_CIRCLE_14_10","",""
"Scripts/Content/Story/Dialoge/DIA_Addon_KDW_14000_Saturas_ADW.d:1313","Um den sechsten und letzten Kreis der Magie zu lernen, solltest du doch besser ins Kloster gehen, Magier des Feuers.","Aby poznać szósty i ostatni krąg zaklęć, musisz odwiedzić klasztor, Magu Ognia.","","","DIA_Addon_Saturas_ADW_CIRCLE_14_11","",""
"Scripts/Content/Story/Dialoge/DIA_Addon_KDW_14000_Saturas_ADW.d:1318","Es ist noch zu früh für dich. Komm später wieder.","Jest zbyt wcześnie. Wróć później.","","","DIA_Addon_Saturas_ADW_CIRCLE_14_12","",""
"Scripts/Content/Story/Dialoge/DIA_Addon_KDW_1400_Saturas_NW.d:23","Da du dir ohnehin nicht nehmen lassen wirst, auch die anderen Magier von ihrer Arbeit abzuhalten, kannst du einem von ihnen auch eine Nachricht von mir überbringen.","Ponieważ nie sądzę, żeby udało ci się odciągnąć innych magów od pracy, możesz zanieść jednemu z nich wiadomość ode mnie.","","","DIA_Addon_Saturas_auftrag_14_01","",""
"Scripts/Content/Story/Dialoge/DIA_Addon_KDW_1400_Saturas_NW.d:24","Sag Riordian, dass ich ihn hier bei mir zu sehen wünsche.","Powiedz Riordianowi, że chcę z nim porozmawiać.","","","DIA_Addon_Saturas_auftrag_14_02","",""
"Scripts/Content/Story/Dialoge/DIA_Addon_KDW_1400_Saturas_NW.d:25","Er hält sich im hinteren Bereich des Gewölbes auf. Du wirst ihn schon finden.","Przebywa w głębi krypty.","","","DIA_Addon_Saturas_auftrag_14_03","",""
"Scripts/Content/Story/Dialoge/DIA_Addon_KDW_1400_Saturas_NW.d:45","Ich soll für Nefarius die verlorenen Teile des Ornamentes finden.","Mam znaleźć zaginione części ornamentu dla Nefariusa.","","","DIA_Addon_Saturas_Nefarius.description","",""
"Scripts/Content/Story/Dialoge/DIA_Addon_KDW_1400_Saturas_NW.d:58","Ich soll für Nefarius die verlorenen Teile des Ornamentes finden.","Mam znaleźć zaginione części ornamentu dla Nefariusa.","","","DIA_ADDON_Saturas_Nefarius_15_00","",""
"Scripts/Content/Story/Dialoge/DIA_Addon_KDW_1400_Saturas_NW.d:59","Was? Das ist ja unglaublich! Du steckst schon wieder mit drin?","Co? Niemożliwe! Też się w to wplątałeś?","","","DIA_ADDON_Saturas_Nefarius_14_01","",""
"Scripts/Content/Story/Dialoge/DIA_Addon_KDW_1400_Saturas_NW.d:60","Keine Angst, ich bringe die Dinger schon her.","Nie obawiaj się. Znajdę je i przyniosę tutaj.","","","DIA_ADDON_Saturas_Nefarius_15_02","",""
