"location","source","target","id","fuzzy","context","translator_comments","developer_comments"
"Scripts/Content/Story/Dialoge/DIA_PAL_216_Cedric.d:46","Ich bin Schwertmeister Cedric, Paladin des Königs.","Sono Cedric il maestro di spada, paladino del re.","","","DIA_Cedric_Hallo_12_00","",""
"Scripts/Content/Story/Dialoge/DIA_PAL_216_Cedric.d:59","Kannst du mich trainieren?","Vorresti addestrarmi?","","","DIA_Cedric_CanTeach.description","",""
"Scripts/Content/Story/Dialoge/DIA_PAL_216_Cedric.d:72","Kannst du mich trainieren?","Puoi addestrarmi?","","","DIA_Cedric_CanTeach_15_00","",""
"Scripts/Content/Story/Dialoge/DIA_PAL_216_Cedric.d:76","Ich kann dich im Kampf mit einhändigen Waffen trainieren.","Posso allenarti nel combattimento con le armi a una mano.","","","DIA_Cedric_CanTeach_12_01","",""
"Scripts/Content/Story/Dialoge/DIA_PAL_216_Cedric.d:82","Ich trainiere nur Paladine.","Alleno solamente i paladini.","","","DIA_Cedric_CanTeach_12_02","",""
"Scripts/Content/Story/Dialoge/DIA_PAL_216_Cedric.d:96","Ich will trainieren.","Voglio essere addestrato.","","","DIA_Cedric_Teach.description","",""
"Scripts/Content/Story/Dialoge/DIA_PAL_216_Cedric.d:113","Ich will trainieren.","Voglio essere addestrato.","","","DIA_Cedric_Teach_15_00","",""
"Scripts/Content/Story/Dialoge/DIA_PAL_216_Cedric.d:117","Du hast alles über den Schwertkampf gelernt. Mehr kann ich dir nicht zeigen.","Hai già imparato tutto sul combattimento con la spada. Non posso insegnarti nient'altro.","","","DIA_DIA_Cedric_Teach_12_01","",""
"Scripts/Content/Story/Dialoge/DIA_PAL_217_Marcos.d:46","HALT - im Namen Innos'! Ich bin Marcos, Paladin des Königs. Sag, was du willst, und sprich wahr!","FERMO, nel nome di Innos! Io sono Marcos, paladino del re. Dimmi cosa vuoi, e non mentire!","","","DIA_Marcos_Hallo_04_00","",""
"Scripts/Content/Story/Dialoge/DIA_PAL_217_Marcos.d:50","Ein Erwählter Innos' spricht immer wahr.","L'Eletto di Innos dice sempre la verità.","","","DIA_Marcos_Hallo_15_01","",""
"Scripts/Content/Story/Dialoge/DIA_PAL_217_Marcos.d:51","Verzeih mir, ehrwürdiger Magier. Ich habe nicht erkannt, mit wem ich spreche.","Perdonami, venerabile mago. Non avevo capito con chi stavo parlando.","","","DIA_Marcos_Hallo_04_02","",""
"Scripts/Content/Story/Dialoge/DIA_PAL_217_Marcos.d:52","Ja ja, schon gut.","D'accordo, tutto a posto, non preoccuparti.","","","DIA_Marcos_Hallo_15_03","",""
"Scripts/Content/Story/Dialoge/DIA_PAL_217_Marcos.d:53","Wenn mir die Frage gestattet ist - was verschlägt dich in diese Gegend?","Se mi è permesso chiederlo, cosa ti porta qui?","","","DIA_Marcos_Hallo_04_04","",""
"Scripts/Content/Story/Dialoge/DIA_PAL_217_Marcos.d:57","Bleib ruhig - ich stehe im Dienst von Lord Hagen.","Rilassati, sono al servizio di Lord Hagen.","","","DIA_Marcos_Hallo_15_05","",""
"Scripts/Content/Story/Dialoge/DIA_PAL_217_Marcos.d:58","Du gehörst zur Truppe. Welcher Befehl verschlägt dich hier her?","Sei una delle truppe. Quali ordini ti portano qui?","","","DIA_Marcos_Hallo_04_06","",""
"Scripts/Content/Story/Dialoge/DIA_PAL_217_Marcos.d:62","Bleib ruhig, wir arbeiten für den gleichen Boss - Lord Hagen.","Rilassati, lavoriamo per lo stesso capo, Lord Hagen.","","","DIA_Marcos_Hallo_15_07","",""
"Scripts/Content/Story/Dialoge/DIA_PAL_217_Marcos.d:63","Seit wann heuert Lord Hagen Söldner an? Sprich - was willst du hier?","Da quando Lord Hagen assolda dei mercenari? Parla, cosa cerchi qui?","","","DIA_Marcos_Hallo_04_08","",""
"Scripts/Content/Story/Dialoge/DIA_PAL_217_Marcos.d:76","Ich muss Lord Hagen Beweise für die Existenz der Drachen bringen.","Devo portare a Lord Hagen la prova che i draghi esistono.","","","DIA_Marcos_Hagen.description","",""
"Scripts/Content/Story/Dialoge/DIA_PAL_217_Marcos.d:90","Ich muss Lord Hagen Beweise für die Existenz der Drachen bringen.","Devo portare a Lord Hagen la prova che i draghi esistono.","","","DIA_Marcos_Hagen_15_00","",""
"Scripts/Content/Story/Dialoge/DIA_PAL_217_Marcos.d:91","Dann solltest du keine Zeit verlieren und dein Leben nicht leichtfertig aufs Spiel setzen.","Allora non dovresti perdere tempo e rischiare la tua vita inutilmente.","","","DIA_Marcos_Hagen_04_01","",""
"Scripts/Content/Story/Dialoge/DIA_PAL_217_Marcos.d:92","Glaubst du etwa, du findest hier eine Drachenschuppe, die du ihm bringen kannst?","Pensi forse di trovare una scaglia di drago da portargli proprio qui?","","","DIA_Marcos_Hagen_04_02","",""
"Scripts/Content/Story/Dialoge/DIA_PAL_217_Marcos.d:93","Versuch, die Burg zu erreichen, und sprich mit Kommandant Garond.","Prova a raggiungere il castello e parlare con il comandante Garond.","","","DIA_Marcos_Hagen_04_03","",""
"Scripts/Content/Story/Dialoge/DIA_PAL_217_Marcos.d:94","Er muss erfahren, dass du im Auftrag von Lord Hagen kommst! Und er wird sich auch um deinen Auftrag kümmern.","Dev'essere informato della tua missione da parte di Lord Hagen! E si occuperà anche del tuo incarico.","","","DIA_Marcos_Hagen_04_04","",""
"Scripts/Content/Story/Dialoge/DIA_PAL_217_Marcos.d:106","Ich komme von Garond...","Sono stato da Garond...","","","DIA_Marcos_Garond.description","",""
"Scripts/Content/Story/Dialoge/DIA_PAL_217_Marcos.d:120","Ich komme von Garond - er muss wissen, wieviel Erz zum Transport bereit steht.","Vengo da parte di Garond, ha bisogno di sapere quanto metallo è pronto per il trasporto.","","","DIA_Marcos_Garond_15_00","",""
"Scripts/Content/Story/Dialoge/DIA_PAL_217_Marcos.d:121","Sag Garond, dass ich die Schürfstelle verlassen musste, weil die Ork-Angriffe zu heftig wurden.","Di' a Garond che abbiamo abbandonato la miniera poiché gli attacchi degli orchi erano diventati troppo violenti.","","","DIA_Marcos_Garond_04_01","",""
"Scripts/Content/Story/Dialoge/DIA_PAL_217_Marcos.d:122","Ich habe versucht, mit ein paar Leuten die Burg zu erreichen, doch ich bin der einzige Überlebende.","Ho provato a raggiungere il castello con qualche uomo, ma sono l'unico sopravvissuto.","","","DIA_Marcos_Garond_04_02","",""
"Scripts/Content/Story/Dialoge/DIA_PAL_217_Marcos.d:123","Das Erz habe ich sicher gestellt. Es sind VIER Kisten. Geh zu Garond und berichte ihm das.","Ho nascosto il metallo in un posto sicuro. Ci sono QUATTRO forzieri. Vai da Garond a riferirglielo.","","","DIA_Marcos_Garond_04_03","",""
"Scripts/Content/Story/Dialoge/DIA_PAL_217_Marcos.d:124","Sag ihm, dass ich das Erz mit meinen Leben schützen werde. Doch weiß ich nicht, wie lange es dauern wird, bis mich die Orks hier aufspüren.","Digli che proteggerò i forzieri a costo della mia vita. Ma non so quanto ci metteranno gli orchi a trovarmi.","","","DIA_Marcos_Garond_04_04","",""
"Scripts/Content/Story/Dialoge/DIA_PAL_217_Marcos.d:125","Er soll mir Unterstützung schicken.","Digli di mandarmi dei rinforzi.","","","DIA_Marcos_Garond_04_05","",""
"Scripts/Content/Story/Dialoge/DIA_PAL_217_Marcos.d:126","Ich werd's ihm ausrichten.","Glielo farò sapere.","","","DIA_Marcos_Garond_15_06","",""
"Scripts/Content/Story/Dialoge/DIA_PAL_217_Marcos.d:149","Wie ist die Lage?","Come vanno le cose?","","","DIA_Marcos_Perm.description","",""
"Scripts/Content/Story/Dialoge/DIA_PAL_217_Marcos.d:164","Wie ist die Lage?","Come vanno le cose?","","","DIA_Marcos_Perm_15_00","",""
"Scripts/Content/Story/Dialoge/DIA_PAL_217_Marcos.d:168","Ich brauche mal einen kräftigen Schluck Heiltrank!","Ho bisogno di un buon sorso di una pozione guaritrice!","","","DIA_Marcos_Perm_04_01","",""
"Scripts/Content/Story/Dialoge/DIA_PAL_217_Marcos.d:173","Ich harre aus - und ich hoffe, Garond schickt mir bald die Unterstützung.","Resisterò e spero che Garond mi manderà presto dei rinforzi.","","","DIA_Marcos_Perm_04_02","",""
"Scripts/Content/Story/Dialoge/DIA_PAL_217_Marcos.d:177","Ich danke dir für die Unterstützung. Innos wird uns die Kraft geben durchzuhalten.","Grazie per l'aiuto. Innos ci darà la forza per resistere.","","","DIA_Marcos_Perm_04_03","",""
"Scripts/Content/Story/Dialoge/DIA_PAL_217_Marcos.d:187","Ich werde hier durchhalten, denn Innos ist mit mir!","Resisterò, poiché Innos è con me!","","","DIA_Marcos_Perm_04_04","",""
"Scripts/Content/Story/Dialoge/DIA_PAL_250_Garond.d:57","Bevor wir irgendwas besprechen, zahlst du erstmal deine Strafe.","Non discuteremo di nulla fino a quando non avrai pagato la tua penale.","","","DIA_Garond_PMSchulden_10_00","",""
"Scripts/Content/Story/Dialoge/DIA_PAL_250_Garond.d:61","Und die ist seit den letzten Anschuldigungen gestiegen.","Ed essa è salita in seguito alle ultime accuse.","","","DIA_Garond_PMSchulden_10_01","",""
"Scripts/Content/Story/Dialoge/DIA_PAL_250_Garond.d:62","Anscheinend hast du dir noch mehr Ärger aufgehalst.","Sembra che tu ti sia cacciato in altri guai.","","","DIA_Garond_PMSchulden_10_02","",""
"Scripts/Content/Story/Dialoge/DIA_PAL_250_Garond.d:66","Aber ich hoffe, dass du jetzt für alles bezahlen wirst! Insgesamt sind das ...","Ma spero che pagherai per tutto quanto ora! In totale, si arriva a...","","","DIA_Garond_PMSchulden_10_03","",""
"Scripts/Content/Story/Dialoge/DIA_PAL_250_Garond.d:70","Ich bin schwer enttäuscht von dir. Deine Strafe beläuft sich auf ...","Sono molto deluso. La tua penale ammonta a...","","","DIA_Garond_PMSchulden_10_04","",""
"Scripts/Content/Story/Dialoge/DIA_PAL_250_Garond.d:85","Es haben sich ein paar neue Dinge ergeben.","Sono spuntate fuori alcune novità.","","","DIA_Garond_PMSchulden_10_05","",""
"Scripts/Content/Story/Dialoge/DIA_PAL_250_Garond.d:89","Plötzlich bezichtigt dich niemand mehr des Mordes.","Improvvisamente non sei più accusato di omicidio.","","","DIA_Garond_PMSchulden_10_06","",""
"Scripts/Content/Story/Dialoge/DIA_PAL_250_Garond.d:95","Niemand erinnert sich dran, dich beim Diebstahl gesehen zu haben.","Nessuno ricorda di averti visto commettere un furto.","","","DIA_Garond_PMSchulden_10_07","",""
"Scripts/Content/Story/Dialoge/DIA_PAL_250_Garond.d:101","Es gibt keine Zeugen mehr dafür, dass du jemals in eine Schlägerei verwickelt warst.","Non c'è più alcun testimone che dichiara di averti visto coinvolto in qualche rissa.","","","DIA_Garond_PMSchulden_10_08","",""
"Scripts/Content/Story/Dialoge/DIA_PAL_250_Garond.d:106","Anscheinend sind alle Anschuldigungen gegen dich fallen gelassen worden.","Sembra che tutte le accuse nei tuoi confronti siano cadute.","","","DIA_Garond_PMSchulden_10_09","",""
"Scripts/Content/Story/Dialoge/DIA_PAL_250_Garond.d:109","Ich weiß nicht, was da gelaufen ist, aber ich warne dich: Treib es nicht zu weit!","Non ho idea di cosa stia succedendo qui, ma ti avverto... non esagerare!","","","DIA_Garond_PMSchulden_10_10","",""
"Scripts/Content/Story/Dialoge/DIA_PAL_250_Garond.d:114","Ich habe mich entschieden, dir deine Schulden zu erlassen.","Ho deciso di dimenticare i tuoi debiti.","","","DIA_Garond_PMSchulden_10_11","",""
"Scripts/Content/Story/Dialoge/DIA_PAL_250_Garond.d:115","Und mach bloß keinen Ärger mehr in der Burg!","E non finire più nei guai all'interno del castello!","","","DIA_Garond_PMSchulden_10_12","",""
"Scripts/Content/Story/Dialoge/DIA_PAL_250_Garond.d:123","Damit eines klar ist: Deine Strafe musst du trotzdem in voller Höhe zahlen.","Voglio che sia chiara una cosa: dovrai comunque pagare tutta la tua penale.","","","DIA_Garond_PMSchulden_10_13","",""
"Scripts/Content/Story/Dialoge/DIA_PAL_250_Garond.d:125","Also, was ist?","Allora, cosa ne pensi?","","","DIA_Garond_PMSchulden_10_14","",""
"Scripts/Content/Story/Dialoge/DIA_PAL_250_Garond.d:134","Ich habe nicht genug Gold!","Non ho abbastanza oro!","","","DIA_Garond_PMSchulden.DIA_Garond_PETZMASTER_PayLater","Info_AddChoice",""
"Scripts/Content/Story/Dialoge/DIA_PAL_250_Garond.d:135","Wieviel war es nochmal?","Qual era il prezzo?","","","DIA_Garond_PMSchulden.DIA_Garond_PMSchulden_HowMuchAgain","Info_AddChoice",""
"Scripts/Content/Story/Dialoge/DIA_PAL_250_Garond.d:138","Ich will die Strafe zahlen.","Voglio pagare la penale!","","","DIA_Garond_PMSchulden.DIA_Garond_PETZMASTER_PayNow","Info_AddChoice",""
"Scripts/Content/Story/Dialoge/DIA_PAL_250_Garond.d:145","Wie viel war es noch mal?","Qual era il prezzo?","","","DIA_Garond_PMSchulden_HowMuchAgain_15_00","",""
"Scripts/Content/Story/Dialoge/DIA_PAL_250_Garond.d:188","Du bist also der Kerl, der hier in der Burg Ärger gemacht hat.","Così tu sei quello che ha combinato tutti questi guai nel castello.","","","DIA_Garond_PETZMASTER_10_00","",""
"Scripts/Content/Story/Dialoge/DIA_PAL_250_Garond.d:193","Ich habe mich schon gefragt, wie lange es dauert, bis du zu mir kommst.","Mi stavo domandando quando saresti venuto da me.","","","DIA_Garond_PETZMASTER_10_01","",""
"Scripts/Content/Story/Dialoge/DIA_PAL_250_Garond.d:194","Mord ist so ziemlich das Letzte, das ich hier gebrauchen kann!","L'omicidio è proprio l'ultima cosa di cui abbiamo bisogno qui.","","","DIA_Garond_PETZMASTER_10_02","",""
"Scripts/Content/Story/Dialoge/DIA_PAL_250_Garond.d:195","Ich bin auf jeden meiner Leute angewiesen - und jetzt habe ich wieder einen weniger!","Ho bisogno di ogni singolo uomo, e ora ne ho un altro in meno!","","","DIA_Garond_PETZMASTER_10_03","",""
"Scripts/Content/Story/Dialoge/DIA_PAL_250_Garond.d:200","Ganz zu schweigen von den anderen Sachen, die du angerichtet hast.","Per non parlare degli altri guai nei quali ti sei cacciato.","","","DIA_Garond_PETZMASTER_10_04","",""
"Scripts/Content/Story/Dialoge/DIA_PAL_250_Garond.d:203","Ich erkläre dir jetzt mal was. Wir sitzen hier alle gemeinsam in der Falle.","Lascia che ti spieghi qualcosa. Siamo tutti nella stessa trappola qui.","","","DIA_Garond_PETZMASTER_10_05","",""
"Scripts/Content/Story/Dialoge/DIA_PAL_250_Garond.d:204","Und ich bin auf jeden einzelnen meiner Männer angewiesen. Auch auf dich.","E ho disperatamente bisogno di ogni singolo uomo, te compreso.","","","DIA_Garond_PETZMASTER_10_06","",""
"Scripts/Content/Story/Dialoge/DIA_PAL_250_Garond.d:205","Wenn du jemanden umbringen willst, dann brauchst du nur die Burg zu verlassen. Da gibt's genug Orks.","Se senti di dover uccidere qualcuno, tutto quello che devi fare è lasciare il castello. Ci sono un sacco di orchi da uccidere là fuori.","","","DIA_Garond_PETZMASTER_10_07","",""
"Scripts/Content/Story/Dialoge/DIA_PAL_250_Garond.d:206","Ich werde dir eine Strafe aufdrücken - obwohl ich mich eigentlich gar nicht mit so einer Scheiße beschäftigen will.","Dovrò importi una punizione, sebbene io detesti veramente dovermi occupare di queste scelleratezze.","","","DIA_Garond_PETZMASTER_10_08","",""
"Scripts/Content/Story/Dialoge/DIA_PAL_250_Garond.d:211","Ich hab gehört, das du hier Sachen mitgehen lässt.","Girano voci che tu stia rubacchiando alcune cose qui.","","","DIA_Garond_PETZMASTER_10_09","",""
"Scripts/Content/Story/Dialoge/DIA_PAL_250_Garond.d:214","Ganz zu schweigen von den anderen Sachen, die mir berichtet wurden.","Per non parlare delle altre cose di cui ho sentito.","","","DIA_Garond_PETZMASTER_10_10","",""
"Scripts/Content/Story/Dialoge/DIA_PAL_250_Garond.d:217","Das werde ich dir nicht durchgehen lassen. Ich glaube du unterschätzt den Ernst der Lage.","Non la passerai liscia. Sembra che tu non capisca la serietà della situazione.","","","DIA_Garond_PETZMASTER_10_11","",""
"Scripts/Content/Story/Dialoge/DIA_PAL_250_Garond.d:218","Du wirst eine Strafe zahlen, um dein Verbrechen wieder gut zu machen!","Dovrai pagare una penale per compensare i tuoi crimini!","","","DIA_Garond_PETZMASTER_10_12","",""
"Scripts/Content/Story/Dialoge/DIA_PAL_250_Garond.d:225","Ich sehe es nicht gerne, wenn es Schlägereien zwischen meinen Männern gibt.","Non mi piace assistere a delle risse tra i miei uomini.","","","DIA_Garond_PETZMASTER_10_13","",""
"Scripts/Content/Story/Dialoge/DIA_PAL_250_Garond.d:229","Und die Sache mit den Schafen musste wohl auch nicht sein.","E quella faccenda della pecora, non era comunque necessaria.","","","DIA_Garond_PETZMASTER_10_14","",""
"Scripts/Content/Story/Dialoge/DIA_PAL_250_Garond.d:232","Also wirst du deine Strafe dafür zahlen!","Quindi dovrai pagare una penale per questo!","","","DIA_Garond_PETZMASTER_10_15","",""
"Scripts/Content/Story/Dialoge/DIA_PAL_250_Garond.d:240","Du gehst rum und tötest unsere Schafe? Die gehören uns allen.","Ti sei messo a uccidere le nostre pecore? Esse appartengono a tutti.","","","DIA_Garond_PETZMASTER_10_16","",""
"Scripts/Content/Story/Dialoge/DIA_PAL_250_Garond.d:241","Du wirst mir das Fleisch bezahlen.","Dovrai pagare per il cibo.","","","DIA_Garond_PETZMASTER_10_17","",""
"Scripts/Content/Story/Dialoge/DIA_PAL_250_Garond.d:246","Wie viel?","Quanto vuoi?","","","DIA_Garond_PETZMASTER_15_18","",""
"Scripts/Content/Story/Dialoge/DIA_PAL_250_Garond.d:253","Ich habe nicht genug Gold!","Non ho abbastanza oro!","","","DIA_Garond_PETZMASTER.DIA_Garond_PETZMASTER_PayLater","Info_AddChoice",""
"Scripts/Content/Story/Dialoge/DIA_PAL_250_Garond.d:256","Ich will die Strafe zahlen.","Voglio pagare la penale!","","","DIA_Garond_PETZMASTER.DIA_Garond_PETZMASTER_PayNow","Info_AddChoice",""
"Scripts/Content/Story/Dialoge/DIA_PAL_250_Garond.d:262","Ich will die Strafe zahlen!","Voglio pagare la penale!","","","DIA_Garond_PETZMASTER_PayNow_15_00","",""
"Scripts/Content/Story/Dialoge/DIA_PAL_250_Garond.d:264","Gut, dann werde ich die Jungs wieder beruhigen. Aber mach so einen Scheiß nie wieder!","D'accordo, dirò ai ragazzi di calmarsi. Ma non farti più beccare a farlo di nuovo!","","","DIA_Garond_PETZMASTER_PayNow_10_01","",""
"Scripts/Content/Story/Dialoge/DIA_PAL_250_Garond.d:278","Ich habe nicht genug Gold!","Non ho abbastanza oro!","","","DIA_Garond_PETZMASTER_PayLater_15_00","",""
"Scripts/Content/Story/Dialoge/DIA_PAL_250_Garond.d:279","Dann solltest du das Gold so schnell wie möglich beschaffen.","Allora dovresti tornare con l'oro il più presto possibile.","","","DIA_Garond_PETZMASTER_PayLater_10_01","",""
"Scripts/Content/Story/Dialoge/DIA_PAL_250_Garond.d:280","Und ich warne dich: Mach noch mehr Ärger und es wird teurer für dich!","E ti avverto, causa altri guai in futuro, e il prezzo salirà!","","","DIA_Garond_PETZMASTER_PayLater_10_02","",""
"Scripts/Content/Story/Dialoge/DIA_PAL_250_Garond.d:311","Woher kommst du? Du gehörst weder zu den Schürftruppen, noch zu meinen Leuten. Also?","Da dove vieni? Non sei uno dei minatori, e non sei uno dei miei uomini. Dunque?","","","DIA_Garond_Hello_10_00","",""
"Scripts/Content/Story/Dialoge/DIA_PAL_250_Garond.d:312","Ich bin über den Pass gekommen.","Sono giunto attraverso il passo.","","","DIA_Garond_Hello_15_01","",""
"Scripts/Content/Story/Dialoge/DIA_PAL_250_Garond.d:313","Über den Pass ...? Du hast es tatsächlich geschafft - bei Innos!","Oltre il passo...? Sei riuscito a passare, per Innos!","","","DIA_Garond_Hello_10_02","",""
"Scripts/Content/Story/Dialoge/DIA_PAL_250_Garond.d:317","Warum hast du diesen Weg auf dich genommen, Magier?","Perché hai scelto questa via, mago?","","","DIA_Garond_Hello_10_03","",""
"Scripts/Content/Story/Dialoge/DIA_PAL_250_Garond.d:321","Wie lautet dein Befehl, Soldat?","Quali sono i tuoi ordini, soldato?","","","DIA_Garond_Hello_10_04","",""
"Scripts/Content/Story/Dialoge/DIA_PAL_250_Garond.d:325","Ich frage mich, warum ein Söldner das alles auf sich nimmt. Was willst du hier?","Mi chiedo perché un mercenario se ne sia preso la briga. Cosa ci fai qui?","","","DIA_Garond_Hello_10_05","",""
"Scripts/Content/Story/Dialoge/DIA_PAL_250_Garond.d:338","Ich komme von Lord Hagen. ","Sono stato da Lord Hagen","","","DIA_Garond_NeedProof.description","",""
"Scripts/Content/Story/Dialoge/DIA_PAL_250_Garond.d:353","Ich komme von Lord Hagen. Er will, dass ich ihm einen Beweis für die Anwesenheit der Drachen bringe.","Vengo per conto di Lord Hagen. Vuole che io gli porti la prova della presenza dei draghi.","","","DIA_Garond_NeedProof_15_00","",""
"Scripts/Content/Story/Dialoge/DIA_PAL_250_Garond.d:354","Und du bist hergekommen, um ihn dir abzuholen und wieder zu verschwinden?","E tu sei venuto qui solamente per trovarla e sparire nuovamente?","","","DIA_Garond_NeedProof_10_01","",""
"Scripts/Content/Story/Dialoge/DIA_PAL_250_Garond.d:355","So hatte ich mir das vorgestellt.","È quello che intendo di fare.","","","DIA_Garond_NeedProof_15_02","",""
"Scripts/Content/Story/Dialoge/DIA_PAL_250_Garond.d:356","Er will also einen Beweis? Den kann er haben. Aber ich kann dich nicht zu Lord Hagen zurückschicken, ohne ihm Auskunft über das Erz zu erteilen.","Dunque vuole delle prove? Le avrà. Ma non posso rimandarti da Lord Hagen senza fornirgli delle informazioni riguardo il metallo.","","","DIA_Garond_NeedProof_10_03","",""
"Scripts/Content/Story/Dialoge/DIA_PAL_250_Garond.d:357","Hör zu - Lord Hagen muss unbedingt erfahren, wie unsere Situation hier ist und wie viel Erz wir bisher gefördert haben.","Ascolta, Lord Hagen deve assolutamente venire a sapere qual è la situazione qui e quanto metallo abbiamo estratto finora.","","","DIA_Garond_NeedProof_10_04","",""
"Scripts/Content/Story/Dialoge/DIA_PAL_250_Garond.d:358","Okay, was soll ich für dich tun?","D'accordo, cosa vuoi che faccia per te?","","","DIA_Garond_NeedProof_15_05","",""
"Scripts/Content/Story/Dialoge/DIA_PAL_250_Garond.d:359","Ich habe drei Schürftrupps da draußen, aber die haben mir nicht einen Erzbrocken geschickt.","Ho tre gruppi di minatori là fuori, ma non mi hanno ancora inviato una singola pepita.","","","DIA_Garond_NeedProof_10_06","",""
"Scripts/Content/Story/Dialoge/DIA_PAL_250_Garond.d:360","Such die Schürfstellen auf und berichte mir, wie viel Erz sie gelagert haben.","Vai a controllare le miniere e riferiscimi quanto metallo hanno estratto.","","","DIA_Garond_NeedProof_10_07","",""
"Scripts/Content/Story/Dialoge/DIA_PAL_250_Garond.d:361","Dann werde ich ein Schreiben für dich aufsetzen, mit dem du zu Lord Hagen zurückkehren wirst.","Dopo di che, ti scriverò una lettera da consegnare a Lord Hagen.","","","DIA_Garond_NeedProof_10_08","",""
"Scripts/Content/Story/Dialoge/DIA_PAL_250_Garond.d:362","Na schön - schätze, mir bleibt keine Wahl.","Oh, beh... sembra che io non abbia scelta.","","","DIA_Garond_NeedProof_15_09","",""
"Scripts/Content/Story/Dialoge/DIA_PAL_250_Garond.d:385","Aber warum ausgerechnet ich? ","Perché, fra tutti, proprio io?","","","DIA_Garond_Why.description","",""
"Scripts/Content/Story/Dialoge/DIA_PAL_250_Garond.d:399","Aber warum ausgerechnet ich?","Perché, fra tutti, proprio io?","","","DIA_Garond_Why_15_00","",""
"Scripts/Content/Story/Dialoge/DIA_PAL_250_Garond.d:400","Weil du einen Weg durch die Orkreihen kennst. Meine Jungs wären da draußen hoffnungslos verloren.","Perché conosci una via attraverso le fila degli orchi. I miei ragazzi sarebbero irrimediabilmente perduti là fuori.","","","DIA_Garond_Why_10_01","",""
"Scripts/Content/Story/Dialoge/DIA_PAL_250_Garond.d:401","Du hast es hingegen schon einmal geschafft durchzukommen - das macht dich zum besten Mann für diesen Job.","Tu, d'altro canto, sei già riuscito a passare una volta, e questo ti rende la persona più adatta per questo lavoro.","","","DIA_Garond_Why_10_02","",""
"Scripts/Content/Story/Dialoge/DIA_PAL_250_Garond.d:413","Ich brauche Ausrüstung. ","Ho bisogno di equipaggiamento.","","","DIA_Garond_Equipment.description","",""
"Scripts/Content/Story/Dialoge/DIA_PAL_250_Garond.d:429","Ich brauche Ausrüstung.","Ho bisogno di equipaggiamento.","","","DIA_Garond_Equipment_15_00","",""
"Scripts/Content/Story/Dialoge/DIA_PAL_250_Garond.d:433","Sprich mit dem Magier Milten hier in der Burg. Er kennt sich mit den Sachen aus, die du benötigen wirst.","Parla con il mago Milten qui al castello. Egli saprà cosa ti occorrerà.","","","DIA_Garond_Equipment_10_01","",""
"Scripts/Content/Story/Dialoge/DIA_PAL_250_Garond.d:438","Kläre das mit Tandor. Er wird dich mit allem versorgen, was du brauchst.","Parlane con Tandor. Potrà fornirti tutto quello di cui avrai bisogno.","","","DIA_Garond_Equipment_10_02","",""
"Scripts/Content/Story/Dialoge/DIA_PAL_250_Garond.d:454","Wieviel zahlst du mir für den Job?","Quanto sei disposto a pagarmi per il lavoro?","","","DIA_Garond_zahlen.description","",""
"Scripts/Content/Story/Dialoge/DIA_PAL_250_Garond.d:469","Wieviel zahlst du mir für den Job?","Quanto sei disposto a pagarmi per il lavoro?","","","DIA_Garond_zahlen_15_00","",""
"Scripts/Content/Story/Dialoge/DIA_PAL_250_Garond.d:470","(verärgert) Ich bin es nicht gewohnt, mit Söldnern zu handeln.","(irritato) Non sono abituato a contrattare con i mercenari.","","","DIA_Garond_zahlen_10_01","",""
"Scripts/Content/Story/Dialoge/DIA_PAL_250_Garond.d:471","Aber gut, mir bleibt wohl nicht keine andere Wahl. Ich zahle dir 500 Goldstücke, wenn du die Mission für mich erledigst.","Oh beh, immagino di non avere scelta. Ti pagherò 500 pezzi d'oro se ti occuperai di questa missione.","","","DIA_Garond_zahlen_10_02","",""
"Scripts/Content/Story/Dialoge/DIA_PAL_250_Garond.d:483","Wo finde ich die Schürfstellen?","Dove si trovano i siti minerari?","","","DIA_Garond_Wo.description","",""
"Scripts/Content/Story/Dialoge/DIA_PAL_250_Garond.d:497","Wo finde ich die Schürfstellen?","Dove si trovano i siti minerari?","","","DIA_Garond_Wo_15_00","",""
"Scripts/Content/Story/Dialoge/DIA_PAL_250_Garond.d:498","Hier, nimm diese Karte. Dort sind die zwei Gebiete eingezeichnet, in denen sich die Schürfstellen befinden.","Tieni, prendi questa mappa. Mostra le due aree dove sono situate le miniere.","","","DIA_Garond_Wo_10_01","",""
"Scripts/Content/Story/Dialoge/DIA_PAL_250_Garond.d:503","Falls du noch weitere Fragen hast, wende dich an Parcival. Er wird dich mit allen Informationen über die Schürfer versorgen.","Se hai altre domande, chiedi a Parcival. Ti potrà dire tutto quello di cui avrai bisogno sui minatori.","","","DIA_Garond_Wo_10_02","",""
