"location","source","target","id","fuzzy","context","translator_comments","developer_comments"
"Scripts/Content/Story/Dialoge/DIA_STRF_1115_Geppert.d:61","Da muss ich dich leider enttäuschen. Ich geh nicht mehr zurück.","In tal caso, dovrò deluderti. Non tornerò indietro.","","","DIA_Geppert_HALLO_10_02","",""
"Scripts/Content/Story/Dialoge/DIA_STRF_1115_Geppert.d:64","Was machtst du denn hier draussen?","Che ci fai qua fuori?","","","DIA_Geppert_HALLO.DIA_Geppert_HALLO_Wasmachtihr","Info_AddChoice",""
"Scripts/Content/Story/Dialoge/DIA_STRF_1115_Geppert.d:65","Du bist ein entlaufender Sträfling, stimmt´s?","Sei un prigioniero alla sbarra, giusto?","","","DIA_Geppert_HALLO.DIA_Geppert_HALLO_Flucht","Info_AddChoice",""
"Scripts/Content/Story/Dialoge/DIA_STRF_1115_Geppert.d:70","Du bist ein entlaufender Sträfling, stimmt's?","Sei un prigioniero alla sbarra, giusto?","","","DIA_Geppert_HALLO_Flucht_15_00","",""
"Scripts/Content/Story/Dialoge/DIA_STRF_1115_Geppert.d:71","Du merkst aber auch alles. Glaubst du denn, ich würde mich sonst in diesem Dreckloch verkriechen?","Molto percettivo. Perché dovrei strisciare in questo buco altrimenti?","","","DIA_Geppert_HALLO_Flucht_10_01","",""
"Scripts/Content/Story/Dialoge/DIA_STRF_1115_Geppert.d:77","Was machst du denn hier draußen?","Che ci fai qua fuori?","","","DIA_Geppert_HALLO_Wasmachtihr_15_00","",""
"Scripts/Content/Story/Dialoge/DIA_STRF_1115_Geppert.d:81","Was soll die blöde Fragerei? Ich versteck mich hier vor euch Soldaten.","Cosa sono tutte queste domande stupide? Mi sto nascondendo da voi soldati.","","","DIA_Geppert_HALLO_Wasmachtihr_10_01","",""
"Scripts/Content/Story/Dialoge/DIA_STRF_1115_Geppert.d:82","Rede nicht lange um den heißen Brei herum. Entweder du bringst mich jetzt um oder du verschwindest wieder.","Smettila di prenderla alla larga. Uccidimi ora o sparisci.","","","DIA_Geppert_HALLO_Wasmachtihr_10_02","",""
"Scripts/Content/Story/Dialoge/DIA_STRF_1115_Geppert.d:86","Blöde Frage. Verstecken natürlich. Die Schweine der Miliz haben ihre Späher überall.","Che domanda stupida. Mi sto nascondendo, che altro? Quei porci dell'esercito hanno spie dappertutto.","","","DIA_Geppert_HALLO_Wasmachtihr_10_03","",""
"Scripts/Content/Story/Dialoge/DIA_STRF_1115_Geppert.d:89","In die Mine geh ich jedenfalls nicht wieder.","Non tornerò alla miniera, è la mia ultima parola.","","","DIA_Geppert_HALLO_Wasmachtihr_10_04","",""
"Scripts/Content/Story/Dialoge/DIA_STRF_1115_Geppert.d:103","Der Braten riecht gut.","L’arrosto ha un buon odore.","","","DIA_Geppert_BRATEN.description","",""
"Scripts/Content/Story/Dialoge/DIA_STRF_1115_Geppert.d:116","Der Braten riecht gut.","L’arrosto ha un buon odore.","","","DIA_Geppert_BRATEN_15_00","",""
"Scripts/Content/Story/Dialoge/DIA_STRF_1115_Geppert.d:117","Finger weg!","Non toccarlo!","","","DIA_Geppert_BRATEN_10_01","",""
"Scripts/Content/Story/Dialoge/DIA_STRF_1116_Kervo.d:33","Was ist los mit dir?","Cosa succede?","","","DIA_Kervo_WASIST.description","",""
"Scripts/Content/Story/Dialoge/DIA_STRF_1116_Kervo.d:43","Was ist los mit dir?","Che ti prende?","","","DIA_Kervo_WASIST_15_00","",""
"Scripts/Content/Story/Dialoge/DIA_STRF_1116_Kervo.d:44","Das fragst du noch? Guck dich doch mal um.","E c'è bisogno di chiederlo? Guardati attorno.","","","DIA_Kervo_WASIST_13_01","",""
"Scripts/Content/Story/Dialoge/DIA_STRF_1116_Kervo.d:45","Diese verdammten Lurker haben den ganzen Fluss in Beschlag genommen, seit ich hier bin.","Questi dannati predatori hanno invaso l'intero fiume da quando sono arrivato.","","","DIA_Kervo_WASIST_13_02","",""
"Scripts/Content/Story/Dialoge/DIA_STRF_1116_Kervo.d:46","Erst waren es nur zwei. Seit gestern habe ich mindestens fünf gezählt.","All'inizio, erano solo in due. Da ieri ne ho contati almeno cinque.","","","DIA_Kervo_WASIST_13_03","",""
"Scripts/Content/Story/Dialoge/DIA_STRF_1116_Kervo.d:47","Keine Ahnung, wie ich hier jemals wieder rauskommen soll.","Non ho idea di come farò a uscire di qui.","","","DIA_Kervo_WASIST_13_04","",""
"Scripts/Content/Story/Dialoge/DIA_STRF_1116_Kervo.d:59","Hast du schon versucht, zum Pass zu gelangen?","Hai provato ad attraversare il passaggio?","","","DIA_Kervo_HILFE.description","",""
"Scripts/Content/Story/Dialoge/DIA_STRF_1116_Kervo.d:72","Hast du schon versucht, zum Pass zu gelangen?","Hai provato ad attraversare il passo?","","","DIA_Kervo_HILFE_15_00","",""
"Scripts/Content/Story/Dialoge/DIA_STRF_1116_Kervo.d:73","Bin ich denn wahnsinnig. Mich kriegen hier keine 20 Soldaten wieder raus, solange die Viecher da draußen sind. Ich hasse die Biester.","Ti sembro forse pazzo? 20 soldati non potrebbero trascinarmi fuori di qui fino a quando quelle bestiacce saranno là fuori. Odio quelle cose.","","","DIA_Kervo_HILFE_13_01","",""
"Scripts/Content/Story/Dialoge/DIA_STRF_1116_Kervo.d:74","(völlig abgedreht) Wenn ich sie schon rieche, dann kriege ich Schweißausbrüche. Und dieses ständige Gegluckse, dass einem das Blut in den Adern stockt.","(nervoso) Appena sento il loro odore impazzisco. I loro continui versi mi raggelano il sangue nelle vene.","","","DIA_Kervo_HILFE_13_02","",""
"Scripts/Content/Story/Dialoge/DIA_STRF_1116_Kervo.d:75","Wenn du dir von denen das Fell abziehen lassen willst, dann tu dir keinen Zwang an.","Se sei così ansioso di farti spellare vivo, vai pure.","","","DIA_Kervo_HILFE_13_03","",""
"Scripts/Content/Story/Dialoge/DIA_STRF_1116_Kervo.d:78","Ich geh dann mal.","Bene, io sono fuori.","","","DIA_Kervo_HILFE.DIA_Kervo_HILFE_tschau","Info_AddChoice",""
"Scripts/Content/Story/Dialoge/DIA_STRF_1116_Kervo.d:79","Du kannst doch nicht ewig hier bleiben.","Ma non puoi rimanere qui per sempre.","","","DIA_Kervo_HILFE.DIA_Kervo_HILFE_ewig","Info_AddChoice",""
"Scripts/Content/Story/Dialoge/DIA_STRF_1116_Kervo.d:83","Was würde von dir bekommen, wenn ich die Biester töte?","Cosa mi dai se riesco a uccidere quelle cose?","","","DIA_Kervo_HILFE.DIA_Kervo_HILFE_Problem","Info_AddChoice",""
"Scripts/Content/Story/Dialoge/DIA_STRF_1116_Kervo.d:91","Du kannst doch nicht ewig hier bleiben.","Ma non puoi rimanere qui per sempre.","","","DIA_Kervo_HILFE_ewig_15_00","",""
"Scripts/Content/Story/Dialoge/DIA_STRF_1116_Kervo.d:92","Keine Ahnung, was du von mir willst, aber weg kriegst du mich hier bestimmt nicht, das kann ich dir sagen.","Non ho idea di cosa tu voglia da me, ma posso dirti questo: non mi convincerai a uscire da qui.","","","DIA_Kervo_HILFE_ewig_13_01","",""
"Scripts/Content/Story/Dialoge/DIA_STRF_1116_Kervo.d:98","Was würde ich von dir bekommen, wenn ich die Biester töte?","Cosa mi dai, se riesco ad uccidere quelle cose?","","","DIA_Kervo_HILFE_Problem_15_00","",""
"Scripts/Content/Story/Dialoge/DIA_STRF_1116_Kervo.d:99","Mmh. Nun ja. Es würde schon reichen, wenn die Lurker vor der Höhle verschwinden würden.","Mmmh. Beh, sarebbe sufficiente che quei predatori di fronte alla caverna scomparissero.","","","DIA_Kervo_HILFE_Problem_13_01","",""
"Scripts/Content/Story/Dialoge/DIA_STRF_1116_Kervo.d:103","Ich habe einen Runenrohling gefunden. Du als Magier kannst ihn doch sicher gebrauchen.","Ho trovato una pietra runica vuota. Visto che sei un mago, sono sicuro che potrebbe servirti.","","","DIA_Kervo_HILFE_Problem_13_02","",""
"Scripts/Content/Story/Dialoge/DIA_STRF_1116_Kervo.d:107","Ich habe einen Brocken Erz gefunden.","Ho trovato un pezzo di metallo.","","","DIA_Kervo_HILFE_Problem_13_03","",""
"Scripts/Content/Story/Dialoge/DIA_STRF_1116_Kervo.d:110","Den würde ich dir dafür geben.","Te lo darò in cambio.","","","DIA_Kervo_HILFE_Problem_13_04","",""
"Scripts/Content/Story/Dialoge/DIA_STRF_1116_Kervo.d:117","Ich geh dann mal.","Bene, io sono fuori.","","","DIA_Kervo_HILFE_tschau_15_00","",""
"Scripts/Content/Story/Dialoge/DIA_STRF_1116_Kervo.d:118","Klar. Ich werde dich nicht aufhalten.","Sicuro, non ti tratterrò.","","","DIA_Kervo_HILFE_tschau_13_01","",""
"Scripts/Content/Story/Dialoge/DIA_STRF_1116_Kervo.d:132","Die Lurker vor der Höhle sind weg.","I predatori di fronte alla caverna se ne sono andati.","","","DIA_Kervo_LurkerPlatt.description","",""
"Scripts/Content/Story/Dialoge/DIA_STRF_1116_Kervo.d:151","Die Lurker vor der Höhle sind weg.","I predatori di fronte alla caverna se ne sono andati.","","","DIA_Kervo_LurkerPlatt_15_00","",""
"Scripts/Content/Story/Dialoge/DIA_STRF_1116_Kervo.d:152","Großartig. Jetzt kann ich wenigstens wieder durchatmen.","Ottimo. Ora posso finalmente tirare il fiato.","","","DIA_Kervo_LurkerPlatt_13_01","",""
"Scripts/Content/Story/Dialoge/DIA_STRF_1116_Kervo.d:156","Hier hast du das versprochene Ding.","Ecco quello che ti avevo promesso.","","","DIA_Kervo_LurkerPlatt_13_02","",""
"Scripts/Content/Story/Dialoge/DIA_STRF_1116_Kervo.d:182","Gehst du jetzt über den Pass?","Attraverserai il passaggio, adesso?","","","DIA_Kervo_VERGISSES.description","",""
"Scripts/Content/Story/Dialoge/DIA_STRF_1116_Kervo.d:195","Gehst du jetzt über den Pass?","Attraverserai il passo, adesso?","","","DIA_Kervo_VERGISSES_15_00","",""
"Scripts/Content/Story/Dialoge/DIA_STRF_1116_Kervo.d:196","Vergiss es, Mann. Wenn sie mich erwischen, muss ich wieder in die Minen. Ich geh hier nicht weg.","Scordatelo, amico. Se mi prendono, mi riporteranno nelle miniere. Resterò qui.","","","DIA_Kervo_VERGISSES_13_01","",""
