"location","source","target","id","fuzzy","context","translator_comments","developer_comments"
"Scripts/Content/Story/Dialoge/DIA_NOV_604_Dyrian.d:79","Danke. Hoffentlich wird das nicht meine letzte Wurst sein, die ich hier bekomme.","Grazie. Spero solo che non sia la mia ultima salsiccia.","","","DIA_Dyrian_Wurst_13_01","",""
"Scripts/Content/Story/Dialoge/DIA_NOV_604_Dyrian.d:103","Was machst Du hier?","Cosa stai facendo, qui?","","","DIA_Dyrian_Job.description","",""
"Scripts/Content/Story/Dialoge/DIA_NOV_604_Dyrian.d:119","Was machst du hier?","Cosa stai facendo qui?","","","DIA_Dyrian_Job_15_00","",""
"Scripts/Content/Story/Dialoge/DIA_NOV_604_Dyrian.d:120","Ich habe gegen die Gebote der Gemeinschaft verstoßen.","Ho trasgredito i precetti della comunità.","","","DIA_Dyrian_Job_13_01","",""
"Scripts/Content/Story/Dialoge/DIA_NOV_604_Dyrian.d:121","Jetzt warte ich auf die Entscheidung des Hohen Rates, ob ich im Kloster bleiben darf.","Ora sto aspettando che l'Alto Concilio decida se posso rimanere nel monastero.","","","DIA_Dyrian_Job_13_02","",""
"Scripts/Content/Story/Dialoge/DIA_NOV_604_Dyrian.d:133","Erzähl mir, was passiert ist.","Dimmi che cosa è successo.","","","DIA_Dyrian_WhatDone.description","",""
"Scripts/Content/Story/Dialoge/DIA_NOV_604_Dyrian.d:149","Erzähl mir, was passiert ist.","Dimmi che cosa è successo.","","","DIA_Dyrian_WhatDone_15_00","",""
"Scripts/Content/Story/Dialoge/DIA_NOV_604_Dyrian.d:150","Ich habe beim Fegen in den Räumen der Magier ein Buch mitgenommen, um es später zu lesen.","Ho preso un libro dalle stanze dei maghi mentre stavo facendo le pulizie, per leggerlo più tardi.","","","DIA_Dyrian_WhatDone_13_01","",""
"Scripts/Content/Story/Dialoge/DIA_NOV_604_Dyrian.d:151","Meister Hyglas hat es natürlich sofort bemerkt und mich nach dem Buch gefragt.","Maestro Hyglas naturalmente lo ha notato subito e mi ha chiesto del libro.","","","DIA_Dyrian_WhatDone_13_02","",""
"Scripts/Content/Story/Dialoge/DIA_NOV_604_Dyrian.d:152","Aus Angst vor Bestrafung habe ich es geleugnet - aber als ich später mit dem Buch in meiner Kammer war, hat er mich erwischt.","Gli ho mentito per paura di essere punito, ma poco dopo ha scoperto il libro in camera mia.","","","DIA_Dyrian_WhatDone_13_03","",""
"Scripts/Content/Story/Dialoge/DIA_NOV_604_Dyrian.d:153","Er war ziemlich aufgebracht und hat den Hohen Rat informiert. Jetzt beraten sie, ob ich bleiben kann.","Si è arrabbiato molto e ha informato l'Alto Concilio. Ora stanno decidendo della mia sorte.","","","DIA_Dyrian_WhatDone_13_04","",""
"Scripts/Content/Story/Dialoge/DIA_NOV_604_Dyrian.d:166","Kann ich dir irgendwie helfen?","Posso aiutarti in qualche modo?","","","DIA_Dyrian_CanHelp.description","",""
"Scripts/Content/Story/Dialoge/DIA_NOV_604_Dyrian.d:182","Kann ich dir irgendwie helfen?","Posso aiutarti in qualche modo?","","","DIA_Dyrian_CanHelp_15_00","",""
"Scripts/Content/Story/Dialoge/DIA_NOV_604_Dyrian.d:183","Nein, ich bin der Gnade Innos' und der der Magier ausgeliefert.","No, mi affido alla grazia di Innos e dei maghi.","","","DIA_Dyrian_CanHelp_13_01","",""
"Scripts/Content/Story/Dialoge/DIA_NOV_604_Dyrian.d:210","Hey, hast du tatsächlich die Prüfung des Feuers gefordert?","Ehi, hai veramente richiesto la Prova del Fuoco?","","","DIA_Dyrian_Scroll_13_00","",""
"Scripts/Content/Story/Dialoge/DIA_NOV_604_Dyrian.d:211","Ja. Und ich habe vor, sie zu bestehen.","Sì, e ho intenzione di superarla.","","","DIA_Dyrian_Scroll_15_01","",""
"Scripts/Content/Story/Dialoge/DIA_NOV_604_Dyrian.d:212","Gut - vielleicht kann ich dir dabei helfen. Ich kann dir eine sehr nützliche Spruchrolle geben. Einen SCHLAF-Zauber. Interessiert?","Bene, forse posso aiutarti. Posso darti una pergamena molto utile. Un incantesimo del SONNO. Ti interessa?","","","DIA_Dyrian_Scroll_13_02","",""
"Scripts/Content/Story/Dialoge/DIA_NOV_604_Dyrian.d:215","Nein, ich brauche deine Hilfe nicht.","No, non mi serve il tuo aiuto.","","","DIA_Dyrian_Scroll.DIA_Dyrian_Scroll_No","Info_AddChoice",""
"Scripts/Content/Story/Dialoge/DIA_NOV_604_Dyrian.d:216","Was willst du dafür?","Cosa vuoi in cambio?","","","DIA_Dyrian_Scroll.DIA_Dyrian_Scroll_How","Info_AddChoice",""
"Scripts/Content/Story/Dialoge/DIA_NOV_604_Dyrian.d:217","Was kann ich damit machen?","Cosa posso fare con questo?","","","DIA_Dyrian_Scroll.DIA_Dyrian_Scroll_What","Info_AddChoice",""
"Scripts/Content/Story/Dialoge/DIA_NOV_604_Dyrian.d:222","Was kann ich damit machen?","Cosa posso fare con questo?","","","DIA_Dyrian_Scroll_What_15_00","",""
"Scripts/Content/Story/Dialoge/DIA_NOV_604_Dyrian.d:223","Mit diesem Zauber kannst du Menschen für kurze Zeit in einen magischen Schlaf versetzen. Allerdings nur, wenn ihr Wille schwächer ist als deiner.","Con questo incantesimo puoi far cadere le persone in un sonno magico per un breve periodo di tempo. Ma solo se la loro volontà è più debole della tua.","","","DIA_Dyrian_Scroll_What_13_01","",""
"Scripts/Content/Story/Dialoge/DIA_NOV_604_Dyrian.d:224","Das kann sehr nützlich sein, wenn dir jemand im Weg steht ...","Potrebbe esserti molto utile se qualcuno cerca di ostacolarti...","","","DIA_Dyrian_Scroll_What_13_02","",""
"Scripts/Content/Story/Dialoge/DIA_NOV_604_Dyrian.d:225","Und woher weiß ich, ob derjenige einen schwächeren Willen hat?","E come faccio a sapere se una persona ha una volontà più debole della mia?","","","DIA_Dyrian_Scroll_What_15_03","",""
"Scripts/Content/Story/Dialoge/DIA_NOV_604_Dyrian.d:226","Bei den Magiern brauchst du es gar nicht erst zu versuchen. Aber die meisten Novizen wirst du schlafen legen können.","Non provarci nemmeno contro i maghi. Ma potresti mettere a dormire la maggior parte dei novizi.","","","DIA_Dyrian_Scroll_What_13_04","",""
"Scripts/Content/Story/Dialoge/DIA_NOV_604_Dyrian.d:231","Nein, ich brauche deine Hilfe nicht.","No, non mi serve il tuo aiuto.","","","DIA_Dyrian_Scroll_No_15_00","",""
"Scripts/Content/Story/Dialoge/DIA_NOV_604_Dyrian.d:232","Du kannst jederzeit zu mir kommen, wenn du es dir anders überlegen solltest.","Puoi tornare da me quando ti pare se cambi idea.","","","DIA_Dyrian_Scroll_No_13_01","",""
"Scripts/Content/Story/Dialoge/DIA_NOV_604_Dyrian.d:238","Was willst du dafür?","Cosa vuoi in cambio?","","","DIA_Dyrian_Scroll_How_15_00","",""
"Scripts/Content/Story/Dialoge/DIA_NOV_604_Dyrian.d:239","Jedem Magier steht bei der Aufnahme ein Wunsch zu.","Quando un mago viene accettato ottiene un desiderio.","","","DIA_Dyrian_Scroll_How_13_01","",""
"Scripts/Content/Story/Dialoge/DIA_NOV_604_Dyrian.d:240","Und wenn du tatsächlich die Prüfung des Feuers bestehst, dann kannst du dich dafür einsetzen, dass ich im Kloster bleiben darf.","Se vuoi veramente passare la Prova del Fuoco potresti chiedere di farmi rimanere nel monastero.","","","DIA_Dyrian_Scroll_How_13_02","",""
"Scripts/Content/Story/Dialoge/DIA_NOV_604_Dyrian.d:244","Okay, gib mir die Spruchrolle. ","Va bene, dammi la pergamena per gli incantesimi.","","","DIA_Dyrian_Scroll.DIA_Dyrian_Scroll_Yes","Info_AddChoice",""
"Scripts/Content/Story/Dialoge/DIA_NOV_604_Dyrian.d:249","Okay, gib mir die Spruchrolle.","Va bene, dammi la pergamena magica.","","","DIA_Dyrian_Scroll_Yes_15_00","",""
"Scripts/Content/Story/Dialoge/DIA_NOV_604_Dyrian.d:250","Viel Glück während deiner Prüfung. Möge Innos dir beistehen.","Buona fortuna per la prova. Possa Innos aiutarti.","","","DIA_Dyrian_Scroll_Yes_13_01","",""
"Scripts/Content/Story/Dialoge/DIA_NOV_604_Dyrian.d:270","Ich hab's mir überlegt. Gib mir den Schlaf-Zauber.","Ho cambiato idea. Dammi l’incantesimo del sonno.","","","DIA_Dyrian_Doch.description","",""
"Scripts/Content/Story/Dialoge/DIA_NOV_604_Dyrian.d:285","Ich hab's mir überlegt. Gib mir den Schlaf-Zauber.","Ho cambiato idea. Dammi l’incantesimo del sonno.","","","DIA_Dyrian_Doch_15_00","",""
"Scripts/Content/Story/Dialoge/DIA_NOV_604_Dyrian.d:286","Gut, wenn du die Prüfung bestehst, setzt du dich dafür ein, dass ich im Kloster bleiben kann.","Ottimo. Se passi la prova, chiederai che io possa rimanere nel monastero.","","","DIA_Dyrian_Doch_13_01","",""
"Scripts/Content/Story/Dialoge/DIA_NOV_604_Dyrian.d:316","(freudestrahlend) Danke, du hast mich gerettet!","(felice) Grazie, mi hai salvato la vita!","","","DIA_Dyrian_HelloAgain_13_00","",""
"Scripts/Content/Story/Dialoge/DIA_NOV_604_Dyrian.d:317","(erschrocken) Oh - verzeih mir Meister- ich wollte nicht aufdringlich erscheinen.","(spaventato) Oh, perdonami Maestro. Non intendevo impormi.","","","DIA_Dyrian_HelloAgain_13_01","",""
"Scripts/Content/Story/Dialoge/DIA_NOV_604_Dyrian.d:318","(ehrerbietend) Ich danke dir dafür, dass ich im Kloster bleiben darf. Mein Leben wird sich von nun an ändern ...","(rispettosamente) Ti ringrazio per avermi permesso di rimanere nel monastero. D'ora in poi la mia vita sarà diversa...","","","DIA_Dyrian_HelloAgain_13_02","",""
"Scripts/Content/Story/Dialoge/DIA_NOV_604_Dyrian.d:329","Wie geht's?","Come va?","","","DIA_Dyrian_HowIsIt_15_00","",""
"Scripts/Content/Story/Dialoge/DIA_NOV_604_Dyrian.d:338","Wie geht's?","Come va?","","","DIA_Dyrian_HowIsIt.description","",""
"Scripts/Content/Story/Dialoge/DIA_NOV_604_Dyrian.d:352","Gut. Die Arbeit macht mir viel Freude, Meister.","Bene. Il lavoro mi piace veramente, Maestro.","","","DIA_Dyrian_HowIsIt_13_01","",""
"Scripts/Content/Story/Dialoge/DIA_NOV_604_Dyrian.d:367","Wie geht's?","Come va?","","","DIA_Dyrian_other.description","",""
"Scripts/Content/Story/Dialoge/DIA_NOV_604_Dyrian.d:383","Ich danke Innos, dass ich hier im Kloster sein darf.","Ringrazio Innos di poter rimanere nel monastero.","","","DIA_Dyrian_HowIsIt_13_02","",""
"Scripts/Content/Story/Dialoge/DIA_NOV_604_Dyrian.d:398","Wie geht's?","Come va?","","","DIA_Dyrian_Kneipe.description","",""
"Scripts/Content/Story/Dialoge/DIA_NOV_604_Dyrian.d:412","Wie geht's?","Come va?","","","DIA_Dyrian_Kneipe_15_00","",""
"Scripts/Content/Story/Dialoge/DIA_NOV_604_Dyrian.d:413","Das fragst du mich noch? Ich habe alle meine Hoffnungen auf dich gesetzt, aber du hast mich sitzen lassen.","E me lo chiedi? Ho riposto tutte le mie speranze in te e tu mi hai tradito.","","","DIA_Dyrian_Kneipe_13_01","",""
"Scripts/Content/Story/Dialoge/DIA_NOV_604_Dyrian.d:414","Jetzt bleibt mir nur noch der Alkohol. Und du bist Schuld daran!","Non mi rimane che rifugiarmi nel bere ormai. È tutta colpa tua!","","","DIA_Dyrian_Kneipe_13_02","",""
"Scripts/Content/Story/Dialoge/DIA_NOV_604_Dyrian.d:417","Hier hast Du 5 Gold.","Ecco, 5 monete d’oro per te.","","","DIA_Dyrian_Kneipe.DIA_Dyrian_Kneipe_Gold","Info_AddChoice",""
"Scripts/Content/Story/Dialoge/DIA_NOV_604_Dyrian.d:418","Ich kann alles erklären.","Posso spiegare tutto.","","","DIA_Dyrian_Kneipe.DIA_Dyrian_Kneipe_CanExplain","Info_AddChoice",""
"Scripts/Content/Story/Dialoge/DIA_NOV_604_Dyrian.d:419","Pass auf was du sagst!","Attento a quello che dici.","","","DIA_Dyrian_Kneipe.DIA_Dyrian_Kneipe_ShutUp","Info_AddChoice",""
"Scripts/Content/Story/Dialoge/DIA_NOV_604_Dyrian.d:424","Hier hast du 5 Goldstücke.","Ecco, 5 pezzi d'oro per te.","","","DIA_Dyrian_Kneipe_Gold_15_00","",""
"Scripts/Content/Story/Dialoge/DIA_NOV_604_Dyrian.d:425","(aufgeregt) 5 Gold? Du gibst mir 5 Gold. Dafür, dass du mein Leben zerstört hast?","(nervoso) 5 pezzi d'oro? Vuoi cavartela con 5 pezzi d'oro dopo avermi rovinato la vita?","","","DIA_Dyrian_Kneipe_Gold_13_01","",""
"Scripts/Content/Story/Dialoge/DIA_NOV_604_Dyrian.d:426","Ich werde mir all dein Gold nehmen!","Prenderò tutto il tuo dannato oro!","","","DIA_Dyrian_Kneipe_Gold_13_02","",""
"Scripts/Content/Story/Dialoge/DIA_NOV_604_Dyrian.d:434","Ich kann alles erklären.","Posso spiegare tutto.","","","DIA_Dyrian_Kneipe_CanExplain_15_00","",""
"Scripts/Content/Story/Dialoge/DIA_NOV_604_Dyrian.d:435","Spar dir deine billigen Ausreden.","Risparmiami le scuse.","","","DIA_Dyrian_Kneipe_CanExplain_13_01","",""
"Scripts/Content/Story/Dialoge/DIA_NOV_604_Dyrian.d:436","Du lügst, wenn du den Mund aufmachst. Jetzt lass mich in Ruhe.","Hai mentito sin dall'inizio. Ora lasciami in pace.","","","DIA_Dyrian_Kneipe_CanExplain_13_02","",""
"Scripts/Content/Story/Dialoge/DIA_NOV_604_Dyrian.d:443","Pass auf, was du sagst.","Attento a quello che dici.","","","DIA_Dyrian_Kneipe_ShutUp_15_00","",""
"Scripts/Content/Story/Dialoge/DIA_NOV_604_Dyrian.d:444","Ja, droh mir nur. Es wird dir nicht nützen.","Bravo, continua a minacciarmi. Non ti servirà a niente.","","","DIA_Dyrian_Kneipe_ShutUp_13_01","",""
"Scripts/Content/Story/Dialoge/DIA_NOV_604_Dyrian.d:445","Ich werde der ganzen Welt erzählen, was du für ein scheinheiliger Kerl bist! Sobald ich diese Flasche ausgetrunken habe ...","Dirò al mondo intero che sei un ipocrita bastardo! Appena avrò finito questa bottiglia...","","","DIA_Dyrian_Kneipe_ShutUp_13_02","",""
"Scripts/Content/Story/Dialoge/DIA_NOV_604_Dyrian.d:446","Jetzt geh mir aus den Augen, du widerst mich an!","Ora sparisci dalla mia vista, mi fai schifo!","","","DIA_Dyrian_Kneipe_ShutUp_13_03","",""
"Scripts/Content/Story/Dialoge/DIA_NOV_604_Dyrian.d:461","Wie sieht's aus?","Cosa succede?","","","DIA_Dyrian_nachher.description","",""
"Scripts/Content/Story/Dialoge/DIA_NOV_604_Dyrian.d:474","Wie sieht's aus?","Cosa succede?","","","DIA_Dyrian_nachher_15_00","",""
"Scripts/Content/Story/Dialoge/DIA_NOV_604_Dyrian.d:475","Ach, lass mich bloß in Ruhe! Mit dir will ich nichts mehr zu tun haben!","Ah, lasciami solo! Non voglio più avere niente a che fare con te!","","","DIA_Dyrian_nachher_13_01","",""
"Scripts/Content/Story/Dialoge/DIA_NOV_605_Opolos.d:50","Hallo, Du bist doch der Neue.","Salve, tu devi essere il nuovo arrivato.","","","DIA_Opolos_Hello_12_00","",""
"Scripts/Content/Story/Dialoge/DIA_NOV_605_Opolos.d:51","Ich bin Opolos. Ich kümmere mich hier um die Schafe.","Mi chiamo Opolos. Mi occupo delle pecore del monastero.","","","DIA_Opolos_Hello_12_01","",""
"Scripts/Content/Story/Dialoge/DIA_NOV_605_Opolos.d:63","Ich hab hier diese Schafswurst...","Ho questa salsiccia di pecora...","","","DIA_Opolos_Wurst.description","",""
"Scripts/Content/Story/Dialoge/DIA_NOV_605_Opolos.d:79","Ich hab hier diese Schafswurst...","Ho questa salsiccia di pecora...","","","DIA_Opolos_Wurst_15_00","",""
"Scripts/Content/Story/Dialoge/DIA_NOV_605_Opolos.d:80","Oh Mann, Wahnsinn! Endlich wieder eine leckere Schafswurst!","Oh, fantastico! Finalmente un'altra deliziosa salsiccia di pecora.","","","DIA_Opolos_Wurst_12_01","",""
"Scripts/Content/Story/Dialoge/DIA_NOV_605_Opolos.d:103","Wie lange bist du schon im Kloster?","Da quanto tempo sei nel monastero?","","","DIA_Opolos_HowLong.description","",""
"Scripts/Content/Story/Dialoge/DIA_NOV_605_Opolos.d:116","Wie lange bist du schon im Kloster?","Da quanto tempo sei nel monastero?","","","DIA_Opolos_HowLong_15_00","",""
"Scripts/Content/Story/Dialoge/DIA_NOV_605_Opolos.d:117","Ich bin seit drei Jahren hier. Aber bisher habe ich noch nicht studiert, obwohl ich das gerne würde.","Sono qui da tre anni. Ma finora non ho studiato molto, anche se mi piacerebbe.","","","DIA_Opolos_HowLong_12_01","",""
"Scripts/Content/Story/Dialoge/DIA_NOV_605_Opolos.d:118","Warum nicht?","Perché?","","","DIA_Opolos_HowLong_15_02","",""
"Scripts/Content/Story/Dialoge/DIA_NOV_605_Opolos.d:119","Meine Aufgabe ist das Hüten der Schafe - nicht das Studieren der Schriften.","Il mio compito consiste nell'occuparmi delle pecore, non studiare le scritture.","","","DIA_Opolos_HowLong_12_03","",""
"Scripts/Content/Story/Dialoge/DIA_NOV_605_Opolos.d:120","Und solange Meister Parlan mich nicht von dieser Pflicht entbindet, ist es mir nicht erlaubt, in der Bibliothek zu lernen.","Fino a quando Maestro Parlan non mi libererà da questo incarico, non mi è permesso studiare nella biblioteca.","","","DIA_Opolos_HowLong_12_04","",""
"Scripts/Content/Story/Dialoge/DIA_NOV_605_Opolos.d:137","Auf was muss ich hier im Kloster achten?","Come devo comportarmi nel monastero?","","","DIA_Opolos_Monastery.description","",""
"Scripts/Content/Story/Dialoge/DIA_NOV_605_Opolos.d:151","Auf was muss ich hier im Kloster achten?","Come devo comportarmi nel monastero?","","","DIA_Opolos_Monastery_15_00","",""
"Scripts/Content/Story/Dialoge/DIA_NOV_605_Opolos.d:152","Belüge niemals einen Magier. Vergehe dich nicht an einem Bruder der Gemeinschaft.","Non mentire mai a un mago. Rispetta gli altri fratelli della comunità.","","","DIA_Opolos_Monastery_12_01","",""
"Scripts/Content/Story/Dialoge/DIA_NOV_605_Opolos.d:153","Respektiere das Eigentum der Gemeinschaft. Wenn du gegen diese Regeln verstößt, musst du eine Strafe bei Meister Parlan zahlen.","Rispetta la proprietà della comunità. Se violi queste regole, dovrai pagare una penale a Maestro Parlan.","","","DIA_Opolos_Monastery_12_02","",""
"Scripts/Content/Story/Dialoge/DIA_NOV_605_Opolos.d:154","Ansonsten kann ich dir nur raten, nimm dich vor Agon in acht. Wenn Du nicht aufpasst, ergeht es dir wie Babo.","A parte questo, posso solo dirti di stare attento ad Agon. Se non fai attenzione finirai come Babo.","","","DIA_Opolos_Monastery_12_03","",""
"Scripts/Content/Story/Dialoge/DIA_NOV_605_Opolos.d:166","Kannst du mir was beibringen?","Puoi insegnarmi qualcosa?","","","DIA_Opolos_beibringen.description","",""
"Scripts/Content/Story/Dialoge/DIA_NOV_605_Opolos.d:181","Kannst du mir was beibringen?","Puoi insegnarmi qualcosa?","","","DIA_Opolos_beibringen_15_00","",""
"Scripts/Content/Story/Dialoge/DIA_NOV_605_Opolos.d:182","Klar, ich hab früher mal Leute verprügelt. Ich kann dir zeigen, wie du deine Arme trainierst.","Certo, una volta ero bravo nelle risse. Posso mostrarti come rafforzare le braccia.","","","DIA_Opolos_beibringen_12_01","",""
"Scripts/Content/Story/Dialoge/DIA_NOV_605_Opolos.d:183","Allerdings will ich gerne etwas über Tränke erfahren. Vor allem über magische Tränke.","Ma vorrei imparare qualcosa sulle pozioni, specialmente su quelle magiche.","","","DIA_Opolos_beibringen_12_02","",""
"Scripts/Content/Story/Dialoge/DIA_NOV_605_Opolos.d:184","Wie kann ich dir dabei helfen?","Come posso aiutarti?","","","DIA_Opolos_beibringen_15_03","",""
"Scripts/Content/Story/Dialoge/DIA_NOV_605_Opolos.d:185","Na ja, wenn du für Neoras arbeitest, bekommst du bestimmt Gelegenheit eins seiner Rezepte kurzfristig 'auszuleihen'.","Beh, se lavori per Neoras avrai sicuramente l'opportunità di 'prendere in prestito' una delle sue ricette per poco tempo.","","","DIA_Opolos_beibringen_12_04","",""
"Scripts/Content/Story/Dialoge/DIA_NOV_605_Opolos.d:186","Wenn du es mir bringst, so dass ich einen Blick drauf werfen kann, werde ich dich trainieren.","Se me la porti, sarò disposto ad allenarti.","","","DIA_Opolos_beibringen_12_05","",""
"Scripts/Content/Story/Dialoge/DIA_NOV_605_Opolos.d:203","Wegen des Rezepts...","Riguardo alla ricetta...","","","DIA_Opolos_rezept.description","",""
"Scripts/Content/Story/Dialoge/DIA_NOV_605_Opolos.d:223","Ich habe das Rezept, das du wolltest.","Ho la ricetta che volevi.","","","DIA_Opolos_rezept_15_00","",""
"Scripts/Content/Story/Dialoge/DIA_NOV_605_Opolos.d:224","Gut, dann lass mich mal lesen.","Ottimo, fammela leggere.","","","DIA_Opolos_rezept_12_01","",""
"Scripts/Content/Story/Dialoge/DIA_NOV_605_Opolos.d:226","Aha ... hm ... ja ... verstehe ... soso ...","Ah-ha... mmh... sì... capisco... bene, bene...","","","DIA_Opolos_rezept_12_02","",""
"Scripts/Content/Story/Dialoge/DIA_NOV_605_Opolos.d:228","Gut, vielen Dank. Wenn du willst, kannst du bei mir trainieren.","Bene, grazie mille. Se vuoi ora puoi allenarti con me.","","","DIA_Opolos_rezept_12_03","",""
"Scripts/Content/Story/Dialoge/DIA_NOV_605_Opolos.d:241","Ich habe Neoras das Rezept schon wiedergebracht.","Ho già riportato la ricetta a Neoras.","","","DIA_Opolos_rezept_15_04","",""
"Scripts/Content/Story/Dialoge/DIA_NOV_605_Opolos.d:242","Ach Scheiße - ich komme hier wohl nie zum Studieren. Was soll's. Ich trainiere dich trotzdem.","Oh, dannazione! Probabilmente non riuscirò mai a studiare nulla. Ma cosa importa? Ti allenerò comunque.","","","DIA_Opolos_rezept_12_05","",""
"Scripts/Content/Story/Dialoge/DIA_NOV_605_Opolos.d:254","Ich komme später drauf zurück.","Ci penserò più tardi.","","","DIA_Opolos_rezept_15_06","",""
"Scripts/Content/Story/Dialoge/DIA_NOV_605_Opolos.d:268","Ich will stärker werden.","Voglio diventare più forte.","","","DIA_Opolos_TEACH_STR.description","",""
"Scripts/Content/Story/Dialoge/DIA_NOV_605_Opolos.d:283","Ich will stärker werden.","Voglio diventare più forte.","","","DIA_Opolos_TEACH_STR_15_00","",""
"Scripts/Content/Story/Dialoge/DIA_NOV_605_Opolos.d:295","Du bist ganz schön kräftig geworden. Mehr kann ich dir nicht beibringen.","Sei già abbastanza forte, non posso insegnarti altro.","","","DIA_Opolos_TEACH_STR_12_00","",""
"Scripts/Content/Story/Dialoge/DIA_NOV_605_Opolos.d:330","Wer sind Agon und Babo?","Chi sono Agon e Babo?","","","DIA_Opolos_Agon.description","",""
"Scripts/Content/Story/Dialoge/DIA_NOV_605_Opolos.d:344","Wer sind Agon und Babo?","Chi sono Agon e Babo?","","","DIA_Opolos_Agon_15_00","",""
"Scripts/Content/Story/Dialoge/DIA_NOV_605_Opolos.d:345","Agon kümmert sich um den Kräutergarten. Er ist zwar auch Novize, führt sich aber auf, als wäre er der Erwählte persönlich.","Agon si occupa del giardino botanico. Nonostante sia un novizio come gli altri, si atteggia come se fosse l'Eletto.","","","DIA_Opolos_Agon_12_01","",""
"Scripts/Content/Story/Dialoge/DIA_NOV_605_Opolos.d:346","Babo ist kurz vor dir ins Kloster gekommen. Zuerst hat er Agon im Kräutergarten geholfen.","Babo è giunto al monastero poco prima di te. Inizialmente ha aiutato Agon nel giardino.","","","DIA_Opolos_Agon_12_02","",""
"Scripts/Content/Story/Dialoge/DIA_NOV_605_Opolos.d:347","Aber sie hatten wohl einen Streit und seitdem fegt Babo den Hof.","Ma poi devono aver litigato e Babo si è sempre occupato di spazzare il cortile da allora.","","","DIA_Opolos_Agon_12_03","",""
"Scripts/Content/Story/Dialoge/DIA_NOV_605_Opolos.d:348","Weißt du, was passiert ist?","Sai cos'è successo?","","","DIA_Opolos_Agon_15_04","",""
"Scripts/Content/Story/Dialoge/DIA_NOV_605_Opolos.d:349","Nicht genau. Da musst du schon die beiden fragen. Aber Agons Wort hat mehr Gewicht als das eines anderen Novizen, weil er der Neffe des Stadthalters ist.","Non esattamente. Devi chiederlo a loro. Ma la parola di Agon ha un peso maggiore rispetto a quella degli altri novizi, poiché egli è il nipote del governatore.","","","DIA_Opolos_Agon_12_05","",""
"Scripts/Content/Story/Dialoge/DIA_NOV_605_Opolos.d:362","Ich habe die Liesel mitgebracht","Guarda, ho portato Betsy.","","","DIA_Opolos_LIESEL.description","",""
"Scripts/Content/Story/Dialoge/DIA_NOV_605_Opolos.d:376","Ich habe die Liesel mitgebracht. Kann ich sie dir überlassen?","Guarda, ho portato Betsy. Posso lasciarla qui con te?","","","DIA_Opolos_LIESEL_15_00","",""
"Scripts/Content/Story/Dialoge/DIA_NOV_605_Opolos.d:389","Ja, natürlich. Kein schönes Tier. Ich werde gut auf sie aufpassen.","Certo. Sembra una buona bestia. Mi prenderò cura di lei.","","","DIA_Opolos_LIESEL_12_01","",""
"Scripts/Content/Story/Dialoge/DIA_NOV_605_Opolos.d:394","Hm...irgendwie scheint sie mir abhanden gekommen zu sein. Ich komme später wieder.","Mmmh... mi sembra di aver sbagliato qualcosa. Tornerò più tardi.","","","DIA_Opolos_Add_15_00","",""
"Scripts/Content/Story/Dialoge/DIA_NOV_605_Opolos.d:408","Wegen der Bibliothek...","Riguardo alla biblioteca...","","","DIA_Opolos_Biblothek.description","",""
"Scripts/Content/Story/Dialoge/DIA_NOV_605_Opolos.d:422","Wegen der Bibliothek...","Riguardo alla biblioteca...","","","DIA_Opolos_Biblothek_15_00","",""
"Scripts/Content/Story/Dialoge/DIA_NOV_605_Opolos.d:426","Das ist der verschlossene Raum links neben der Pforte.","È la porta chiusa sulla sinistra, vicino al cancello.","","","DIA_Opolos_Biblothek_12_01","",""
"Scripts/Content/Story/Dialoge/DIA_NOV_605_Opolos.d:427","Aber du bekommst den Schlüssel erst, wenn Meister Parlan entscheidet, dass du die Lehren studieren darfst.","Ma potrai ricevere la chiave solamente quando Maestro Parlan deciderà che potrai studiare gli insegnamenti.","","","DIA_Opolos_Biblothek_12_02","",""
"Scripts/Content/Story/Dialoge/DIA_NOV_605_Opolos.d:431","Du Glücklicher hast den Schlüssel zur Bibliothek bekommen, und dabei bist du erst kurze Zeit hier.","Che fortuna! Hai ottenuto la chiave per la biblioteca sebbene tu sia arrivato nel monastero da poco.","","","DIA_Opolos_Biblothek_12_03","",""
"Scripts/Content/Story/Dialoge/DIA_NOV_605_Opolos.d:432","Nutze die Chance und lerne aus den alten Schriften!","Approfittane per studiare le vecchie scritture!","","","DIA_Opolos_Biblothek_12_04","",""
"Scripts/Content/Story/Dialoge/DIA_NOV_605_Opolos.d:462","Hallo. Danke, dass du mir geholfen hast. Ich werde diese Chance nutzen und viel lernen.","Salve. Grazie per avermi aiutato. Approfitterò dell'occasione per imparare il più possibile.","","","DIA_Opolos_HelloAgain_12_00","",""
"Scripts/Content/Story/Dialoge/DIA_NOV_605_Opolos.d:463","Aber du hast jetzt sicher keine Zeit, dich mit einem einfachen Novizen zu unterhalten, Meister.","Ma sicuramente non hai il tempo per chiacchierare con un semplice novizio, Maestro.","","","DIA_Opolos_HelloAgain_12_01","",""
"Scripts/Content/Story/Dialoge/DIA_NOV_605_Opolos.d:479","Wie geht's?","Come va?","","","DIA_Opolos_HowIsIt.description","",""
"Scripts/Content/Story/Dialoge/DIA_NOV_605_Opolos.d:492","Wie geht's?","Come va?","","","DIA_Opolos_HowIsIt_15_00","",""
"Scripts/Content/Story/Dialoge/DIA_NOV_605_Opolos.d:496","Ausgezeichnet. Seitdem ich studieren kann, ist alles bestens.","Benissimo. Da quando mi hanno permesso di studiare, tutto mi va meglio.","","","DIA_Opolos_HowIsIt_12_01","",""
