"location","source","target","id","fuzzy","context","translator_comments","developer_comments"
"Scripts/Content/Story/Dialoge/DIA_PAL_260_Tandor.d:50","Ich weiß selbst, wie es draußen ist - ich habe eine Zeit lang einen Spähtrupp begleitet.","Io stesso so com'è la situazione là fuori, ho accompagnato una unità di ricognizione per qualche tempo.","","","DIA_Tandor_Hallo_08_01","",""
"Scripts/Content/Story/Dialoge/DIA_PAL_260_Tandor.d:51","Hast du eine Waffe? Wenn du eine gute Waffe brauchst, bist du bei mir richtig.","Hai un'arma? Se ti serve una buona arma, sono la persona giusta.","","","DIA_Tandor_Hallo_08_02","",""
"Scripts/Content/Story/Dialoge/DIA_PAL_260_Tandor.d:66","Was ist mit dem Trupp passiert?","Cosa ne è stato dell’unità?","","","DIA_Tandor_Trupp.description","",""
"Scripts/Content/Story/Dialoge/DIA_PAL_260_Tandor.d:79","Was ist mit dem Trupp passiert?","Cosa ne è stato dell’unità?","","","DIA_Tandor_Trupp_15_00","",""
"Scripts/Content/Story/Dialoge/DIA_PAL_260_Tandor.d:80","Wir haben die Gegend erkundet und wollten bis zur Küste vordringen. In einer Höhle haben wir unser Lager aufgeschlagen.","Esplorammo la zona e decidemmo di proseguire verso la costa. Stabilimmo il campo base in una caverna.","","","DIA_Tandor_Trupp_08_01","",""
"Scripts/Content/Story/Dialoge/DIA_PAL_260_Tandor.d:81","Es war tief in der Nacht, als die Orks kamen. Mit Fackeln und Trommeln stürmten sie den Hang hinauf - und entdeckten uns.","Era tarda notte quando giunsero gli orchi. Scalarono il pendio con torce e tamburi e ci individuarono.","","","DIA_Tandor_Trupp_08_02","",""
"Scripts/Content/Story/Dialoge/DIA_PAL_260_Tandor.d:82","Wir versuchten zu fliehen, doch nur ich habe es geschafft ...","Cercammo di scappare, ma fui l'unico che riuscì a farcela...","","","DIA_Tandor_Trupp_08_03","",""
"Scripts/Content/Story/Dialoge/DIA_PAL_260_Tandor.d:83","Bald darauf errichteten die Orks die große Palisade und wir zogen uns in die Burg zurück.","Poco dopo, gli orchi eressero la loro gigantesca palizzata e noi ci ritirammo nel castello.","","","DIA_Tandor_Trupp_08_04","",""
"Scripts/Content/Story/Dialoge/DIA_PAL_260_Tandor.d:97","Zeig mir deine Ware.","Mostrami la mercanzia.","","","DIA_Tandor_Trade.description","",""
"Scripts/Content/Story/Dialoge/DIA_PAL_260_Tandor.d:108","Zeig mir deine Ware.","Mostrami la mercanzia.","","","DIA_Tandor_Trade_15_00","",""
"Scripts/Content/Story/Dialoge/DIA_PAL_260_Tandor.d:120","Garond schickt mich - ich brauche Ausrüstung.","Mi manda Garond... mi servono degli attrezzi.","","","DIA_Tandor_Equipment.description","",""
"Scripts/Content/Story/Dialoge/DIA_PAL_260_Tandor.d:135","Garond schickt mich - ich brauche Ausrüstung.","Mi manda Garond... mi servono degli attrezzi.","","","DIA_Tandor_Equipment_15_00","",""
"Scripts/Content/Story/Dialoge/DIA_PAL_260_Tandor.d:136","Nahkampf oder Fernkampf?","Combattimento in mischia o a distanza?","","","DIA_Tandor_Equipment_08_01","",""
"Scripts/Content/Story/Dialoge/DIA_PAL_260_Tandor.d:139","Nahkampf","Termina il combattimento","","","DIA_Tandor_Equipment.DIA_Tandor_Equipment_Nah","Info_AddChoice",""
"Scripts/Content/Story/Dialoge/DIA_PAL_260_Tandor.d:140","Fernkampf","Combattimento a lunga distanza.","","","DIA_Tandor_Equipment.DIA_Tandor_Equipment_Fern","Info_AddChoice",""
"Scripts/Content/Story/Dialoge/DIA_PAL_260_Tandor.d:145","Nahkampf.","Termina il combattimento","","","DIA_Tandor_Equipment_Nah_15_00","",""
"Scripts/Content/Story/Dialoge/DIA_PAL_260_Tandor.d:146","Einhand- oder Zweihandkämpfer?","Armi a una o due mani?","","","DIA_Tandor_Equipment_Nah_08_01","",""
"Scripts/Content/Story/Dialoge/DIA_PAL_260_Tandor.d:149","Einhand","A una mano.","","","DIA_Tandor_Equipment.DIA_Tandor_Equipment_Ein","Info_AddChoice",""
"Scripts/Content/Story/Dialoge/DIA_PAL_260_Tandor.d:150","Zweihand","A due mani","","","DIA_Tandor_Equipment.DIA_Tandor_Equipment_Zwei","Info_AddChoice",""
"Scripts/Content/Story/Dialoge/DIA_PAL_260_Tandor.d:155","Fernkampf.","Combattimento a lunga distanza.","","","DIA_Tandor_Equipment_Fern_15_00","",""
"Scripts/Content/Story/Dialoge/DIA_PAL_260_Tandor.d:156","Bogen oder Armbrust?","Archi o balestre?","","","DIA_Tandor_Equipment_Fern_08_01","",""
"Scripts/Content/Story/Dialoge/DIA_PAL_260_Tandor.d:159","Bogen","Arco","","","DIA_Tandor_Equipment.DIA_Tandor_Equipment_Bow","Info_AddChoice",""
"Scripts/Content/Story/Dialoge/DIA_PAL_260_Tandor.d:160","Armbrust","Balestra","","","DIA_Tandor_Equipment.DIA_Tandor_Equipment_Crossbow","Info_AddChoice",""
"Scripts/Content/Story/Dialoge/DIA_PAL_260_Tandor.d:165","Einhand.","A una mano.","","","DIA_Tandor_Equipment_Ein_15_00","",""
"Scripts/Content/Story/Dialoge/DIA_PAL_260_Tandor.d:166","Dann nimm diesen Steinbrecher. Eine gute Waffe.","Allora prendi questa rompipietra. È una buona arma.","","","DIA_Tandor_Equipment_Ein_08_01","",""
"Scripts/Content/Story/Dialoge/DIA_PAL_260_Tandor.d:173","Zweihand.","A due mani","","","DIA_Tandor_Equipment_Zwei_15_00","",""
"Scripts/Content/Story/Dialoge/DIA_PAL_260_Tandor.d:174","Mit diesem Zweihänder bist du gut ausgerüstet.","Con questa spada a due mani sarai a posto.","","","DIA_Tandor_Equipment_Zwei_08_01","",""
"Scripts/Content/Story/Dialoge/DIA_PAL_260_Tandor.d:181","Bogen.","Arco.","","","DIA_Tandor_Equipment_Bow_15_00","",""
"Scripts/Content/Story/Dialoge/DIA_PAL_260_Tandor.d:182","Dieser Jagdbogen ist genau das Richtige für dich. Und Pfeile gebe ich dir auch noch mit.","Questo arco da caccia è proprio quello che fa per te. E ti darò anche delle frecce.","","","DIA_Tandor_Equipment_Bow_08_01","",""
"Scripts/Content/Story/Dialoge/DIA_PAL_260_Tandor.d:190","Armbrust.","Balestra.","","","DIA_Tandor_Equipment_Crossbow_15_00","",""
"Scripts/Content/Story/Dialoge/DIA_PAL_260_Tandor.d:191","Dann nimm diese leichte Armbrust. Bolzen kriegst du auch noch von mir.","Allora prendi questa balestra leggera. Puoi anche avere dei dardi.","","","DIA_Tandor_Equipment_Crossbow_08_01","",""
"Scripts/Content/Story/Dialoge/DIA_PAL_260_Tandor.d:275","Hast du Neuigkeiten?","Hai qualche novità?","","","DIA_Tandor_News.description","",""
"Scripts/Content/Story/Dialoge/DIA_PAL_260_Tandor.d:289","Hast du Neuigkeiten?","Hai qualche novità?","","","DIA_Tandor_News_15_00","",""
"Scripts/Content/Story/Dialoge/DIA_PAL_260_Tandor.d:293","Dass ihr Drachenjäger hierher gekommen seid, ist das einzige, was in letzter Zeit passiert ist.","L'unica cosa successa di recente è l'arrivo di voi cacciatori di draghi qui.","","","DIA_Tandor_News_08_01","",""
"Scripts/Content/Story/Dialoge/DIA_PAL_260_Tandor.d:297","Die Drachenjäger sind angekommen.","Sono arrivati i cacciatori di draghi.","","","DIA_Tandor_News_08_02","",""
"Scripts/Content/Story/Dialoge/DIA_PAL_260_Tandor.d:298","Sie wirken auf mich wie zähe Hunde - und ich hoffe, dass sind sie, denn sonst werden sie nicht lange überleben.","Mi sembrano gente resistente e spero che lo siano, altrimenti non sopravvivranno a lungo.","","","DIA_Tandor_News_08_03","",""
"Scripts/Content/Story/Dialoge/DIA_PAL_260_Tandor.d:346","Du ziehst nicht gerade ein glückliches Gesicht.","Non hai un’aria molto felice.","","","DIA_Tandor_WASISTLOS.description","",""
"Scripts/Content/Story/Dialoge/DIA_PAL_260_Tandor.d:360","Du ziehst nicht gerade ein glückliches Gesicht.","Non hai un’aria molto felice.","","","DIA_Tandor_WASISTLOS_15_00","",""
"Scripts/Content/Story/Dialoge/DIA_PAL_260_Tandor.d:364","Die Orks werden immer wieder kommen. Solange, bis wir alle tot sind.","Gli orchi continueranno ad arrivare. Fino a quando non saremo tutti morti.","","","DIA_Tandor_WASISTLOS_08_01","",""
"Scripts/Content/Story/Dialoge/DIA_PAL_260_Tandor.d:368","Keine gescheite Nahrung schon seit Wochen. Ich verhungere.","Non un pasto decente da settimane. Sono affamato.","","","DIA_Tandor_WASISTLOS_08_02","",""
"Scripts/Content/Story/Dialoge/DIA_PAL_261_Gerold.d:36","Was bewachst du?","Cosa state sorvegliando?","","","DIA_Gerold_Hallo.description","",""
"Scripts/Content/Story/Dialoge/DIA_PAL_261_Gerold.d:49","Was bewachst du?","Cosa state sorvegliando?","","","DIA_Gerold_Hallo_15_00","",""
"Scripts/Content/Story/Dialoge/DIA_PAL_261_Gerold.d:50","Die Gefangenen.","I prigionieri.","","","DIA_Gerold_Hallo_12_01","",""
"Scripts/Content/Story/Dialoge/DIA_PAL_261_Gerold.d:51","Und wer ist das?","E chi sarebbero?","","","DIA_Gerold_Hallo_15_02","",""
"Scripts/Content/Story/Dialoge/DIA_PAL_261_Gerold.d:52","Ein paar Sträflinge und den Söldner Gorn. Ein harter Bursche - stark wie ein Ochse.","Qualche detenuto e il mercenario Gorn. Un tipo massiccio, forte come un bue.","","","DIA_Gerold_Hallo_12_03","",""
"Scripts/Content/Story/Dialoge/DIA_PAL_261_Gerold.d:53","Es waren vier Mann nötig, um ihn in Gewahrsam zu nehmen.","Ci sono voluti quattro uomini per metterlo in cella.","","","DIA_Gerold_Hallo_12_04","",""
"Scripts/Content/Story/Dialoge/DIA_PAL_261_Gerold.d:65","Kannst du mich in den Kerker lassen? ","Potete lasciarmi accedere alla prigione sotterranea?","","","DIA_Gerold_Jail.description","",""
"Scripts/Content/Story/Dialoge/DIA_PAL_261_Gerold.d:80","Kannst du mich in den Kerker lassen?","Potete lasciarmi accedere alla prigione sotterranea?","","","DIA_Gerold_Jail_15_00","",""
"Scripts/Content/Story/Dialoge/DIA_PAL_261_Gerold.d:81","Nein. Der Kerker ist für NIEMANDEN zugänglich. Das gilt für JEDEN. Für dich, für Milten und jeden anderen.","No. NESSUNO può scendere nei sotterranei. Questo vale per TUTTI. Per te, per Milten e per chiunque altro.","","","DIA_Gerold_Jail_12_01","",""
"Scripts/Content/Story/Dialoge/DIA_PAL_261_Gerold.d:82","Das hier ist keine Taverne, wo man rein und rausspazieren kann, wie man will. Merk dir das.","Questa non è una taverna, dove puoi entrare e uscire come ti pare e piace. Ricordatelo.","","","DIA_Gerold_Jail_12_02","",""
"Scripts/Content/Story/Dialoge/DIA_PAL_261_Gerold.d:96","Kannst du nicht mal eine Ausnahme machen?","Non potete fare un’eccezione per me?","","","DIA_Gerold_Ausnahme.description","",""
"Scripts/Content/Story/Dialoge/DIA_PAL_261_Gerold.d:111","Kannst du nicht mal eine Ausnahme machen?","Non potete fare un’eccezione per me?","","","DIA_Gerold_Ausnahme_15_00","",""
"Scripts/Content/Story/Dialoge/DIA_PAL_261_Gerold.d:112","Nein.","No.","","","DIA_Gerold_Ausnahme_12_01","",""
"Scripts/Content/Story/Dialoge/DIA_PAL_261_Gerold.d:124","Und wenn ich dir Gold zahle?","Nemmeno se vi pago in oro?","","","DIA_Gerold_Gold.description","",""
"Scripts/Content/Story/Dialoge/DIA_PAL_261_Gerold.d:139","Und wenn ich dir Gold zahle?","Nemmeno se vi pago in oro?","","","DIA_Gerold_Gold_15_00","",""
"Scripts/Content/Story/Dialoge/DIA_PAL_261_Gerold.d:140","... hm ...","...mmh...","","","DIA_Gerold_Gold_12_01","",""
"Scripts/Content/Story/Dialoge/DIA_PAL_261_Gerold.d:141","Nein.","No.","","","DIA_Gerold_Gold_12_02","",""
"Scripts/Content/Story/Dialoge/DIA_PAL_261_Gerold.d:153","Ich habe hier eine Notiz für einen Gefangenen...","Ho qui un messaggio per uno dei prigionieri...","","","DIA_Gerold_Deal.description","",""
"Scripts/Content/Story/Dialoge/DIA_PAL_261_Gerold.d:169","Ich habe hier eine Notiz für einen Gefangenen. Kannst du sie weitergeben?","Ho un messaggio per uno dei prigionieri... Potresti farglielo avere?","","","DIA_Gerold_Deal_15_00","",""
"Scripts/Content/Story/Dialoge/DIA_PAL_261_Gerold.d:170","Hm ... prinzipiell spricht nichts dagegen. Für wen ist denn diese Notiz?","Mmmh... normalmente, non vedo perché no. Per chi sarebbe questo messaggio, allora?","","","DIA_Gerold_Deal_12_01","",""
"Scripts/Content/Story/Dialoge/DIA_PAL_261_Gerold.d:171","Für Gorn.","Per Gorn.","","","DIA_Gerold_Deal_15_02","",""
"Scripts/Content/Story/Dialoge/DIA_PAL_261_Gerold.d:172","Ein sehr wichtiger Gefangener. Ich glaube, Garond wäre nicht damit einverstanden. Aber wenn dir das wichtig ist, werden wir uns bestimmt einigen.","Un prigioniero molto importante. Non penso che Garond sarebbe d'accordo. Ma se è veramente importante per te, potremo sicuramente trovare un accordo.","","","DIA_Gerold_Deal_12_03","",""
"Scripts/Content/Story/Dialoge/DIA_PAL_261_Gerold.d:173","Was willst du?","Che vuoi?","","","DIA_Gerold_Deal_15_04","",""
"Scripts/Content/Story/Dialoge/DIA_PAL_261_Gerold.d:174","Unsere Nahrungsrationen werden ständig gekürzt. Ich will mal wieder was Anständiges essen.","Le nostre razioni di cibo continuano a scarseggiare. Vorrei qualcosa di decente da mangiare, una volta tanto.","","","DIA_Gerold_Deal_12_05","",""
"Scripts/Content/Story/Dialoge/DIA_PAL_261_Gerold.d:175","Besorg mir eine leckere Wurst und einen frischen Laib Brot - und süßen Honig.","Portami una gustosa salsiccia e del pane fresco e anche un po' di miele.","","","DIA_Gerold_Deal_12_06","",""
"Scripts/Content/Story/Dialoge/DIA_PAL_261_Gerold.d:176","Dazu eine Flasche Wein ... Ja, das sollte reichen. Das wirst du ja wohl hinkriegen. Also komm wieder, wenn du das Zeug hast.","E una bottiglia di vino per accompagnare il tutto... Sì, dovrebbe bastare. Dovresti riuscire a procurartela. Dunque, torna quando avrai la roba.","","","DIA_Gerold_Deal_12_07","",""
"Scripts/Content/Story/Dialoge/DIA_PAL_261_Gerold.d:191","Ich hab hier was für dich...","Ho qualcosa per te...","","","DIA_Gerold_Stuff.description","",""
"Scripts/Content/Story/Dialoge/DIA_PAL_261_Gerold.d:210","Ich hab hier was für dich. Das Essen, das du haben wolltest.","Ho qualcosa per te. Il cibo che volevi.","","","DIA_Gerold_Stuff_15_00","",""
"Scripts/Content/Story/Dialoge/DIA_PAL_261_Gerold.d:236","Gut, gib her das Zeug. Hast du die Nachricht?","Bene, dammi il cibo. Hai il messaggio?","","","DIA_Gerold_Stuff_12_01","",""
"Scripts/Content/Story/Dialoge/DIA_PAL_261_Gerold.d:237","Ja, hier. Denk daran, sie ist für Gorn.","Sì, ecco. Ricorda, è per Gorn.","","","DIA_Gerold_Stuff_15_02","",""
"Scripts/Content/Story/Dialoge/DIA_PAL_261_Gerold.d:238","Komm morgen wieder, dann hat er die Nachricht bekommen.","Torna domani, avrà ricevuto il messaggio per allora.","","","DIA_Gerold_Stuff_12_03","",""
"Scripts/Content/Story/Dialoge/DIA_PAL_261_Gerold.d:248","Komm wieder, wenn du das Zeug dabei hast, was ich wollte.","Torna quando avrai il cibo che ti ho chiesto.","","","DIA_Gerold_Stuff_12_04","",""
"Scripts/Content/Story/Dialoge/DIA_PAL_261_Gerold.d:262","Hat Gorn die Nachricht bekommen?","Gorn ha ricevuto il messaggio?","","","DIA_Gerold_Antwort.description","",""
"Scripts/Content/Story/Dialoge/DIA_PAL_261_Gerold.d:280","Hat Gorn die Nachricht bekommen?","Gorn ha ricevuto il messaggio?","","","DIA_Gerold_Antwort_15_00","",""
"Scripts/Content/Story/Dialoge/DIA_PAL_261_Gerold.d:284","Ja, ich soll dir was von ihm ausrichten:","Sì, mi ha detto di dirti:","","","DIA_Gerold_Antwort_12_01","",""
"Scripts/Content/Story/Dialoge/DIA_PAL_261_Gerold.d:285","Und?","E allora?","","","DIA_Gerold_Antwort_15_02","",""
"Scripts/Content/Story/Dialoge/DIA_PAL_261_Gerold.d:286","Es liegt am Südtor.","È al cancello sud.","","","DIA_Gerold_Antwort_12_03","",""
"Scripts/Content/Story/Dialoge/DIA_PAL_261_Gerold.d:287","Hat er noch was gesagt?","Ha detto qualcos'altro?","","","DIA_Gerold_Antwort_15_04","",""
"Scripts/Content/Story/Dialoge/DIA_PAL_261_Gerold.d:288","Nein. Keine Ahnung, was das bedeuten soll. Weißt du, was es bedeutet?","No. Non ho idea di cosa voglia dire. Sai cosa intendeva?","","","DIA_Gerold_Antwort_12_05","",""
"Scripts/Content/Story/Dialoge/DIA_PAL_261_Gerold.d:289","Vielleicht. Aber du solltest nicht weiter darüber nachdenken.","Forse. Ma faresti meglio a non pensarci troppo.","","","DIA_Gerold_Antwort_15_06","",""
"Scripts/Content/Story/Dialoge/DIA_PAL_261_Gerold.d:290","Ist wahrscheinlich besser.","Sì, forse è meglio.","","","DIA_Gerold_Antwort_12_07","",""
"Scripts/Content/Story/Dialoge/DIA_PAL_261_Gerold.d:298","Nein, noch nicht. Komm später wieder.","No, non ancora. Torna più tardi.","","","DIA_Gerold_GornsAnswer_12_08","",""
"Scripts/Content/Story/Dialoge/DIA_PAL_261_Gerold.d:313","Lass Gorn frei.","Libera Gorn.","","","DIA_Gerold_SetGornFree.description","",""
"Scripts/Content/Story/Dialoge/DIA_PAL_261_Gerold.d:327","Lass Gorn frei. Ich komme auf Befehl vom Kommandanten Garond.","Libera Gorn. È un ordine del comandante Garond.","","","DIA_Gerold_SetGornFree_15_00","",""
"Scripts/Content/Story/Dialoge/DIA_PAL_261_Gerold.d:328","Ich bin schon informiert worden. Hier ist der Schlüssel, du kannst reingehen.","Sono già stato informato. Ecco la chiave, puoi entrare.","","","DIA_Gerold_SetGornFree_12_01","",""
"Scripts/Content/Story/Dialoge/DIA_PAL_261_Gerold.d:345","Schläfst du eigentlich nie?","Non dormi mai?","","","DIA_Gerold_Perm.description","",""
"Scripts/Content/Story/Dialoge/DIA_PAL_261_Gerold.d:359","Schläfst du eigentlich nie?","Non dormi mai?","","","DIA_Gerold_Perm_15_00","",""
"Scripts/Content/Story/Dialoge/DIA_PAL_261_Gerold.d:360","Nein. Innos selbst verleiht mir die Kraft, niemals schlafen zu müssen.","No. Innos stesso mi ha concesso la forza per non aver mai bisogno del sonno.","","","DIA_Gerold_Perm_12_01","",""
"Scripts/Content/Story/Dialoge/DIA_PAL_261_Gerold.d:406","Alles ruhig?","Tutto tranquillo?","","","DIA_Gerold_KAP4_ALLESRUHIG.description","",""
"Scripts/Content/Story/Dialoge/DIA_PAL_261_Gerold.d:419","Alles ruhig?","Tutto tranquillo?","","","DIA_Gerold_KAP4_ALLESRUHIG_15_00","",""
"Scripts/Content/Story/Dialoge/DIA_PAL_261_Gerold.d:420","Ruhig schon.","Tranquillo, sì.","","","DIA_Gerold_KAP4_ALLESRUHIG_12_01","",""
"Scripts/Content/Story/Dialoge/DIA_PAL_261_Gerold.d:421","Aber?","Ma?","","","DIA_Gerold_KAP4_ALLESRUHIG_15_02","",""
"Scripts/Content/Story/Dialoge/DIA_PAL_261_Gerold.d:422","Mir hängt der Magen in den Kniekehlen, Mann. Garond hat schon wieder die Nahrungsrationen gekürzt.","Ho un terribile buco nello stomaco. Garond ha ridotto nuovamente le razioni.","","","DIA_Gerold_KAP4_ALLESRUHIG_12_03","",""
"Scripts/Content/Story/Dialoge/DIA_PAL_261_Gerold.d:423","Wenn ich nicht bald was Anständiges zwischen die Zähne bekomme, dann beiße ich Garond in seinen fetten Arsch.","Se non riuscirò a mandare giù un pasto decente, finirò per addentare il grasso sedere di Garond.","","","DIA_Gerold_KAP4_ALLESRUHIG_12_04","",""
"Scripts/Content/Story/Dialoge/DIA_PAL_261_Gerold.d:426","Nicht mein Problem.","Non è un mio problema.","","","DIA_Gerold_KAP4_ALLESRUHIG.DIA_Gerold_KAP4_ALLESRUHIG_Nein","Info_AddChoice",""
"Scripts/Content/Story/Dialoge/DIA_PAL_261_Gerold.d:427","Vielleicht kann ich dir etwas geben.","Forse potrei darti qualcosa.","","","DIA_Gerold_KAP4_ALLESRUHIG.DIA_Gerold_KAP4_ALLESRUHIG_geben","Info_AddChoice",""
"Scripts/Content/Story/Dialoge/DIA_PAL_261_Gerold.d:432","Vielleicht kann ich dir etwas geben.","Forse potrei darti qualcosa.","","","DIA_Gerold_KAP4_ALLESRUHIG_geben_15_00","",""
"Scripts/Content/Story/Dialoge/DIA_PAL_261_Gerold.d:433","Bist du verrückt. Doch nicht hier. Wenn das einer der anderen sieht, hab ich gleich 'ne Menge neuer Freunde, wenn du verstehst, was ich meine.","Sei impazzito? Certamente non qui. Se qualcun altro dovesse vederci, avrei subito un sacco di nuovi amici, se capisci quello che intendo.","","","DIA_Gerold_KAP4_ALLESRUHIG_geben_12_01","",""
"Scripts/Content/Story/Dialoge/DIA_PAL_261_Gerold.d:436","Du findest mich im Magiertempel, wenn sich alle zurück gezogen haben.","Puoi trovarmi nel tempio dei maghi quando tutti gli altri saranno andati a dormire.","","","DIA_Gerold_KAP4_ALLESRUHIG_geben_12_02","",""
"Scripts/Content/Story/Dialoge/DIA_PAL_261_Gerold.d:440","Schnell, folge mir in den Magiertempel, bevor die anderen wieder aus ihren Löchern kommen. Ich hab keine Lust, bis morgen zu warten.","Svelto, seguimi nel tempio dei maghi prima che gli altri escano dalle loro tane. Non voglio aspettare fino a domani.","","","DIA_Gerold_KAP4_ALLESRUHIG_geben_12_03","",""
"Scripts/Content/Story/Dialoge/DIA_PAL_261_Gerold.d:443","Im Tempel ist sowieso zurzeit kaum jemand. Ich werde dort auf dich warten.","Non c'è mai nessuno al tempio a quest'ora, comunque. Ti aspetterò lì.","","","DIA_Gerold_KAP4_ALLESRUHIG_geben_12_04","",""
"Scripts/Content/Story/Dialoge/DIA_PAL_261_Gerold.d:444","Komm mir aber bloß nicht mit einem trockenem Brot oder irgendeinem rohen Fleischdreck, klar?","Ma non venire con una fetta di pane secco e un pezzo di carne cruda, hai capito?","","","DIA_Gerold_KAP4_ALLESRUHIG_geben_12_05","",""
"Scripts/Content/Story/Dialoge/DIA_PAL_261_Gerold.d:458","Nicht mein Problem.","Non è un mio problema.","","","DIA_Gerold_KAP4_ALLESRUHIG_Nein_15_00","",""
"Scripts/Content/Story/Dialoge/DIA_PAL_261_Gerold.d:459","Du hast gut reden. Dir kürzt Garond sicher nicht die Rationen.","Puoi parlare. Garond non taglierà certo le tue razioni.","","","DIA_Gerold_KAP4_ALLESRUHIG_Nein_12_01","",""
"Scripts/Content/Story/Dialoge/DIA_PAL_261_Gerold.d:460","Auch wenn er es nicht zugibt, aber sein Arsch geht ihm ganz schön auf Grundeis und er sieht in dir seine einzige Rettung.","Anche se non vuole ammetterlo, è spaventato a morte e vede in te l'unica possibilità di salvezza.","","","DIA_Gerold_KAP4_ALLESRUHIG_Nein_12_02","",""
"Scripts/Content/Story/Dialoge/DIA_PAL_261_Gerold.d:493","Das reicht. Das reicht. Damit komme ich erstmal über die Runden.","È abbastanza, è abbastanza. Con questo sarò a posto per un bel po'.","","","DIA_Gerold_MoreFood_12_00","",""
"Scripts/Content/Story/Dialoge/DIA_PAL_261_Gerold.d:494","Hier hast du mein Gold. Hier draußen kann ich eh nichts dafür kaufen, also kannst du es auch genauso gut haben.","Ecco il mio oro. Non potrei comunque comprarci nulla qui, quindi tanto vale che lo abbia tu.","","","DIA_Gerold_MoreFood_12_01","",""
"Scripts/Content/Story/Dialoge/DIA_PAL_261_Gerold.d:495","Ich geh dann besser, bevor man uns sieht.","Farò meglio ad andare, prima che qualcuno ci veda.","","","DIA_Gerold_MoreFood_12_02","",""
"Scripts/Content/Story/Dialoge/DIA_PAL_261_Gerold.d:507","Ich hab gerade nichts dabei.","In questo momento non ho nulla.","","","DIA_Gerold_FOOD.DIA_Gerold_FOOD_nichts","Info_AddChoice",""
"Scripts/Content/Story/Dialoge/DIA_PAL_261_Gerold.d:511","Mehr hab´ ich nicht.","È tutto ciò che ho.","","","DIA_Gerold_FOOD.DIA_Gerold_FOOD_kaese_nichtmehr","Info_AddChoice",""
"Scripts/Content/Story/Dialoge/DIA_PAL_261_Gerold.d:514","Klar. Her damit. Hast du noch mehr?","Certo. Da' qui. Ne hai ancora?","","","DIA_Gerold_MoreFood_12_03","",""
"Scripts/Content/Story/Dialoge/DIA_PAL_261_Gerold.d:518","Ja. Mehr, mehr!","Sì. Ancora, ancora!","","","DIA_Gerold_MoreFood_12_04","",""
"Scripts/Content/Story/Dialoge/DIA_PAL_261_Gerold.d:525","(Suppe Geben)","(Dai la zuppa)","","","DIA_Gerold_FOOD.DIA_Gerold_FOOD_Suppe","Info_AddChoice",""
"Scripts/Content/Story/Dialoge/DIA_PAL_261_Gerold.d:530","(Fleisch geben)","(Dai la carne)","","","DIA_Gerold_FOOD.DIA_Gerold_FOOD_fleisch","Info_AddChoice",""
"Scripts/Content/Story/Dialoge/DIA_PAL_261_Gerold.d:535","(Schinken geben)","(Dai il prosciutto)","","","DIA_Gerold_FOOD.DIA_Gerold_FOOD_schinken","Info_AddChoice",""
"Scripts/Content/Story/Dialoge/DIA_PAL_261_Gerold.d:540","(Käse geben)","(Dai il formaggio)","","","DIA_Gerold_FOOD.DIA_Gerold_FOOD_kaese","Info_AddChoice",""
"Scripts/Content/Story/Dialoge/DIA_PAL_261_Gerold.d:545","(Wurst geben)","(Dai la salsiccia)","","","DIA_Gerold_FOOD.DIA_Gerold_FOOD_Wurst","Info_AddChoice",""
"Scripts/Content/Story/Dialoge/DIA_PAL_261_Gerold.d:554","Da bist du ja. Also, was ist jetzt? Hast du was zu essen für mich?","Eccoti. Allora, come va? Hai qualcosa da mangiare per me?","","","DIA_Gerold_FOOD_12_00","",""
"Scripts/Content/Story/Dialoge/DIA_PAL_261_Gerold.d:561","Ich hab gerade nichts dabei.","In questo momento non ho nulla.","","","DIA_Gerold_FOOD_nichts_15_00","",""
"Scripts/Content/Story/Dialoge/DIA_PAL_261_Gerold.d:562","Erst machst du einen solchen Aufstand und jetzt willst du mich verarschen?","Prima fai tutte quelle promesse e ora cerchi di fregarmi?","","","DIA_Gerold_FOOD_nichts_12_01","",""
"Scripts/Content/Story/Dialoge/DIA_PAL_261_Gerold.d:573","Mehr hab ich nicht.","È tutto ciò che ho.","","","DIA_Gerold_FOOD_kaese_nichtmehr_15_00","",""
"Scripts/Content/Story/Dialoge/DIA_PAL_261_Gerold.d:574","Und das soll ich dir glauben? Na gut, besser als nichts. Hier hast du ein bisschen Gold dafür.","Dovrei crederti? D'accordo, meglio di niente. Eccoti un po' d'oro in cambio.","","","DIA_Gerold_FOOD_kaese_nichtmehr_12_01","",""
"Scripts/Content/Story/Dialoge/DIA_PAL_261_Gerold.d:577","So. Ich muss zurück auf meinen Posten.","Bene. Devo tornare al mio posto.","","","DIA_Gerold_FOOD_kaese_nichtmehr_12_02","",""
"Scripts/Content/Story/Dialoge/DIA_PAL_261_Gerold.d:601","Wie wär's mir einem saftigen Stück Käse?","Cosa ne dici di un gustoso pezzo di formaggio?","","","DIA_Gerold_FOOD_kaese_15_00","",""
"Scripts/Content/Story/Dialoge/DIA_PAL_261_Gerold.d:608","Ein Stück Wurst?","Un pezzo di salsiccia?","","","DIA_Gerold_FOOD_Wurst_15_00","",""
"Scripts/Content/Story/Dialoge/DIA_PAL_261_Gerold.d:615","Ich kann dir diesen Schinken geben.","Potrei darti questo prosciutto.","","","DIA_Gerold_FOOD_schinken_15_00","",""
"Scripts/Content/Story/Dialoge/DIA_PAL_261_Gerold.d:622","Ein Stück Fleisch?","Un pezzo di carne?","","","DIA_Gerold_FOOD_fleisch_15_00","",""
"Scripts/Content/Story/Dialoge/DIA_PAL_261_Gerold.d:629","Ich denke, eine gute Suppe könnte dir schmecken.","Una buona zuppa sarebbe l'ideale, non credi?","","","DIA_Gerold_FOOD_Suppe_15_00","",""
"Scripts/Content/Story/Dialoge/DIA_PAL_261_Gerold.d:652","Immer noch Hunger?","Ancora affamato?","","","DIA_Gerold_PERM4.description","",""
"Scripts/Content/Story/Dialoge/DIA_PAL_261_Gerold.d:665","Immer noch Hunger?","Ancora affamato?","","","DIA_Gerold_PERM4_15_00","",""
"Scripts/Content/Story/Dialoge/DIA_PAL_261_Gerold.d:669","Wenn die Orks noch mal angreifen, hilft mir auch kein voller Magen.","Se gli orchi attaccheranno ancora, neanche una pancia piena mi aiuterà.","","","DIA_Gerold_PERM4_12_01","",""
